user_input,retrieved_contexts,response,reference,faithfulness,answer_relevancy,context_precision,context_recall,answer_correctness,semantic_similarity
How many 3-pointers did Kemba Walker make in the 2018-2019 NBA season?,"[""Augustin, he became their starting point guard for the lockout-shortened season. Walker participated in the 2012 Rising Stars Challenge during All-Star Weekend. However, the Charlotte Bobcats only managed to go 7–59 in the lockout season. 2012–13 season: Sophomore season On November 14, 2012, Walker hit the first game-winner of his NBA career against the Minnesota Timberwolves. He finished the game with 22 points on 9-of-19 shooting, as well as 5 rebounds, 4 assists and 4 steals. On January 21, 2013, he scored a then career-high 35 points against the Houston Rockets. During the 2012–13 season, Walker was selected with teammate Michael Kidd-Gilchrist to the 2013 Rising Stars Challenge in which they both scored 8 points. Kemba finished the 2012–13 season with averages of 17.7 points, 5.8 assists, 3.5 rebounds, and 1 steal per contest. He took significant strides over his rookie year. 2013–14 season: First playoff appearance On December 18, 2013, Walker hit a buzzer-beating jump shot over Jonas Valančiūnas in overtime to beat the Toronto Raptors. He finished the night with 26 points and 5 rebounds on 10/18 shooting from the field. On February 19, 2014, Walker recorded 23 points, 5 rebounds and a career-high 16 assists in a 116–98 win over the Detroit Pistons. Five days later, he was awarded the Eastern Conference Player of the Week, having averaged 22.5 points, 8.8 assists, and 5.5 rebounds in the span of seven days. In a home victory over the Orlando Magic on April 4, 2014, Walker recorded his second career triple-double with 13 points, 10 assists, and 10 rebounds. Playing against the Miami Heat in the first round of the Eastern Conference Playoffs and with teammate Al Jefferson unable to play due to a Plantar fasciitis injury, Walker had an exceptional game four: he finished the game with a playoff franchise-high 29 points, along with 5 assists, 5 rebounds, 3 blocks, and 2 steals. The effort came in a loss as the Heat completed a four-game sweep of the Bobcats. 2014–15 season: Knee surgery In the newly renamed Charlotte Hornets' opening game against the Milwaukee Bucks on October 29, Walker led an impressive comeback in an overtime 108–106 victory. The Hornets had been 24 points down by the fourth quarter when they staged a comeback; Walker scored a three-pointer with 1.6 seconds left to force overtime and later hit the shot that clinched the game as well. He finished with 26 points, 5 assists, and 6 rebounds. The following day, he signed a four-year, $48 million contract extension with the Hornets. On December 5, 2014, Walker hit his second game-winner of the season in a 103–102 win over the New York Knicks. On December 27, in a 94–102 loss to the Orlando Magic, he scored a then career-high 42 points and set a Charlotte Hornets franchise record for most points scored in a half with his 35 points that he posted in the second. On January 3, against the Orlando Magic, Walker scored 30 points to pass Kendall Gill for 10th place on the Charlotte Hornets all-time scoring list with 4,160 points. In three back-to-back games played between the January 3 and 7, Walker scored 30, 33, and 31 points in victories over the Orlando Magic, the Boston Celtics, and the New Orleans Pelicans respectively; he thereby joined Larry Johnson, Glen Rice, and Kelly Tripucka as one of four players in Charlotte Hornets' franchise history to have three or more consecutive games of scoring 30-plus points. Walker also hit his fifth game-winner of his career and his third of the season on January 7 in the 98–94 victory over the Pelicans. On January 12, he was named the Eastern Conference Player of the Week for games played Monday, January 5, through Sunday, January 11. Over the week, he led the Hornets to a 4–0 record and averaged 30.3 points, 5.8 rebounds, and 4.5 assists in 36.2 minutes, while shooting .500 from the field (44–88), .364 from beyond the three-point line (8–22) and .893 from the free-throw line (25–28). On January 28, 2015, Walker was ruled out for six weeks after he underwent successful surgery to repair a torn lateral meniscus in his left knee. He returned to action on March 11, after missing 18 games, to score six points in 16 minutes off the bench as the Hornets lost to the Sacramento Kings 106–113. 2015–16 season: Breakthrough On November 23, 2015, Walker scored a then season-high 39 points in a 127–122 overtime win over the Sacramento Kings. On January 18, 2016, Walker set a career-high and a franchise-record with 52 points in a 124–119 double overtime win over the Utah Jazz. He made 16-of-34 from the field, including 6-of-11 three-pointers, and was 14-of-15 from the free throw line, breaking the team mark of 48 points set by Glen Rice in March 1997. On March 9, in a win over the New Orleans Pelicans, Walker became just the third Hornets player to make 500 career three-pointers, joining Dell Curry (929) and Glen Rice (508). Five days later, he earned his fourth career Player of the Week award, and second of the 2015–16 season (first coming on January 25), becoming just the sixth Charlotte player to win the award multiple times in the same season. The Hornets finished the regular season as the sixth seed in the Eastern Conference with a 48–34 record. In the first round of the playoffs, the Hornets faced the third-seeded Miami Heat, and in a Game 4 win on April 25, Walker scored a playoff career-high 34 points, helping the Hornets tie the series at 2–2. He topped that mark in Game 6 of the series, scoring 37 points in a 97–90 loss, as the Heat tied the series at 3–3. The Hornets went on to lose Game 7, bowing out of the playoffs with a 4–3 defeat. In May 2016, Walker again underwent surgery on a torn meniscus in his left knee. 2016–17 season: First All-Star selection On November 4, 2016, Walker scored a season-high 30 points in a 99–95 win over the Brooklyn Nets, helping Charlotte improve to 4–1 for the first time since 2000. He topped that mark on November 11, recording 40 points, 10 rebounds and six assists in a 113–111 loss to the Toronto Raptors. On December 29, with 22 points against the Miami Heat, Walker recorded his 7,000th point with the Charlotte franchise when he hit a three-pointer with 4:16 left in the first quarter. He became the fourth player in franchise history to reach that mark, and became the second-quickest by doing so in his 396th game—Larry Johnson passed the mark in his 355th career game with the Hornets. On January 2, 2017, Walker recorded 34 points and a season-high 11 rebounds in a 118–111 loss to the Chicago Bulls. On January 26, he was named an Eastern Conference All-Star reserve for the 2017 NBA All-Star Game. Two days later, in a loss to the Sacramento Kings, Walker moved into third place in franchise history in field goals made (2,586), passing Gerald Wallace. On January 31, he scored 22 points against the Portland Trail Blazers and moved into third place on the team's career scoring list. On March 6, he was named Eastern Conference Player of the Week for games played Monday, February 27 through Sunday, March 5. On March 31, 2017, he scored a game-high 31 points in a 122–114 win over the Denver Nuggets. During the game, Walker became the second player in team history to reach 8,000 career points—the only other player to reach that mark is Dell Curry (9,839). In May 2017, Walker underwent an arthroscopic procedure on his left knee. 2017–18 season: 2nd Sportsmanship Award On December 4, Walker scored 29 points and made all 14 free throw attempts (tying a career-high) in a 104–94 win over the Orlando Magic, becoming the first player in franchise history with 200 career 20-point games. On January 10, 2018, he had 41 points on 16-of-28 shooting in a 115–111 loss to the Dallas Mavericks. On January 15, he scored 20 points in a 118–107 win over the Detroit Pistons, thus reaching 9,000 career points. On January 24, in a 101–96 loss to the New Orleans Pelicans, Walker became only the second Hornets' player with 900 career 3-pointers, joining Dell Curry (929). On January 31, he set franchise and career-highs with nine 3-pointers and scored 38 points in a 123–110 win over the Atlanta Hawks. On February 4, in a 115–110 win over the Phoenix Suns, Walker scored 18 points and broke the franchise career record for 3-pointers with 930, surpassing the record of 929 held by Dell Curry. On February 8, Walker was named as the replacement for the injured Kristaps Porziņģis in the 2018 NBA All-Star Game, marking his second consecutive All-Star selection. On March 22, Walker scored 46 points with 10 3-pointers in a 140–79 win over the Memphis Grizzlies. It was his ninth 40-point game of his career and third-highest scoring game of his career, as he helped the Hornets record the sixth-largest win in NBA history. On March 28, he scored 21 points in a 118–105 loss to the Cleveland Cavaliers, surpassing Dell Curry (9,839 points) to become the franchise's career scoring leader. Walker also established a new team record with his 44th consecutive made free throw. That free throw also brought his career total to 1,999, which broke Gerald Wallace's franchise record of 1,998. 2018–19 season: All-NBA selection and final season with the Hornets On October 17, 2018, Walker scored 41 points in a 113–112 loss to the Milwaukee Bucks, setting a franchise record for points scored in a season opener. It was his 10th 40-point game of his career, tying Glen Rice for the franchise record for 40-point games. Three days later, he scored 39 points, including the game-winning free throw with a half-second left, to lift the Hornets to a 113–112 win over the Miami Heat. During the game, he eclipsed the career 10,000-point mark. Walker set the NBA record for most three-point field goals through the first three games of a season with 19 (previously held by Danilo Gallinari with 18 in 2009–10) and became the first player in NBA history to make five or more three-point field goals in each of the first three games of a season. He was subsequently named Eastern Conference Player of the Week for the first week of the season."", 'He subsequently signed with Jordan Brand, a subsidiary of Nike. List of National Basketball Association franchise career scoring leaders List of National Basketball Association single-game scoring leaders Career statistics from NBA.com · Basketball Reference UConn Huskies bio\n\nIn the 2011–12 season, Kemba Walker played for Charlotte in 66* games. He averaged 12.1 points, 3.5 rebounds, 4.4 assists, 0.9 steals, and 0.3 blocks per game. He shot 0.366 from the field, 0.305 from 3-point range, and .789 from the free throw line, playing an average of 27.2 minutes per game. In the 2012–13 season, Kemba Walker played for Charlotte in 82* games. He averaged 17.7 points, 3.5 rebounds, 5.7 assists, 2.0 steals, and 0.4 blocks per game. He shot 0.423 from the field, 0.322 from 3-point range, and .798 from the free throw line, playing an average of 34.9 minutes per game. In the 2013–14 season, Kemba Walker played for Charlotte in 73 games. He averaged 17.7 points, 4.2 rebounds, 6.1 assists, 1.2 steals, and 0.4 blocks per game. He shot 0.393 from the field, 0.333 from 3-point range, and .837 from the free throw line, playing an average of 35.8 minutes per game. In the 2014–15 season, Kemba Walker played for Charlotte in 62 games. He averaged 17.3 points, 3.5 rebounds, 5.1 assists, 1.4 steals, and 0.5 blocks per game. He shot 0.385 from the field, 0.304 from 3-point range, and .827 from the free throw line, playing an average of 34.2 minutes per game. In the 2015–16 season, Kemba Walker played for Charlotte in 81 games. He averaged 20.9 points, 4.4 rebounds, 5.2 assists, 1.6 steals, and 0.5 blocks per game. He shot 0.427 from the field, 0.371 from 3-point range, and .847 from the free throw line, playing an average of 35.6 minutes per game. In the 2016–17 season, Kemba Walker played for Charlotte in 79 games. He averaged 23.2 points, 3.9 rebounds, 5.5 assists, 1.1 steals, and 0.3 blocks per game. He shot 0.443 from the field, 0.399 from 3-point range, and .847 from the free throw line, playing an average of 34.7 minutes per game. In the 2017–18 season, Kemba Walker played for Charlotte in 80 games. He averaged 22.1 points, 3.1 rebounds, 5.6 assists, 1.1 steals, and 0.3 blocks per game. He shot 0.431 from the field, 0.384 from 3-point range, and .864 from the free throw line, playing an average of 34.2 minutes per game. In the 2018–19 season, Kemba Walker played for Charlotte in 82* games. He averaged 25.6 points, 4.4 rebounds, 5.9 assists, 1.2 steals, and 0.4 blocks per game. He shot 0.434 from the field, 0.356 from 3-point range, and .844 from the free throw line, playing an average of 34.9 minutes per game. In the 2019–20 season, Kemba Walker played for Boston in 56 games. He averaged 20.4 points, 3.9 rebounds, 4.8 assists, 0.9 steals, and 0.5 blocks per game. He shot 0.425 from the field, 0.381 from 3-point range, and .864 from the free throw line, playing an average of 31.1 minutes per game. In the 2020–21 season, Kemba Walker played for Boston in 43 games. He averaged 19.3 points, 4.0 rebounds, 4.9 assists, 1.1 steals, and 0.3 blocks per game. He shot 0.42 from the field, 0.36 from 3-point range, and .899 from the free throw line, playing an average of 31.8 minutes per game. In the 2021–22 season, Kemba Walker played for New York in 37 games. He averaged 11.6 points, 3.0 rebounds, 3.5 assists, 0.7 steals, and 0.2 blocks per game. He shot 0.403 from the field, 0.367 from 3-point range, and .845 from the free throw line, playing an average of 25.6 minutes per game. In the 2022–23 season, Kemba Walker played for Dallas in 9 games. He averaged 8.0 points, 1.8 rebounds, 2.1 assists, 0.2 steals, and 0.2 blocks per game. He shot 0.421 from the field, 0.25 from 3-point range, and .810 from the free throw line, playing an average of 16.0 minutes per game. In the All-Star season, Kemba Walker played for All-Star in 4 games. He averaged 11.3 points, 2.3 rebounds, 4.5 assists, 0.8 steals, and 0.0 blocks per game. He shot 0.452 from the field, 0.28 from 3-point range, and — from the free throw line, playing an average of 21.0 minutes per game. In the 2014 season, Kemba Walker played for Charlotte in 4 games. He averaged 19.5 points, 3.8 rebounds, 6.0 assists, 2.0 steals, and 0.8 blocks per game. He shot 0.473 from the field, 0.5 from 3-point range, and 0.778 from the free throw line, playing an average of 38.3 minutes per game. In the 2016 season, Kemba Walker played for Charlotte in 7 games. He averaged 22.7 points, 3.0 rebounds, 4.0 assists, 1.3 steals, and 0.6 blocks per game. He shot 0.366 from the field, 0.326 from 3-point range, and 0.943 from the free throw line, playing an average of 37.1 minutes per game. In the 2020 season, Kemba Walker played for Boston in 17 games. He averaged 19.6 points, 4.1 rebounds, 5.1 assists, 0.9 steals, and 0.4 blocks per game. He shot 0.441 from the field, 0.31 from 3-point range, and 0.852 from the free throw line, playing an average of 36.9 minutes per game. In the 2021 season, Kemba Walker played for Boston in 3 games. He averaged 12.7 points, 4.0 rebounds, 4.0 assists, 0.3 steals, and 0.0 blocks per game. He shot 0.317 from the field, 0.176 from 3-point range, and 0.9 from the free throw line, playing an average of 30.3 minutes per game. In the 2023–24 season, Kemba Walker played for Monaco in 26 games. He averaged 4.4 points, 1.4 rebounds, 1.1 assists, 0.4 steals, and 0.0 blocks per game. He shot 0.389 from the field, 0.364 from 3-point range, and 0.778 from the free throw line, playing an average of 11.0 minutes per game. In the 2008–09 season, Kemba Walker played for Connecticut in 36 games. He averaged 8.9 points, 3.5 rebounds, 2.9 assists, 1.1 steals, and 0.2 blocks per game. He shot 0.47 from the field, 0.271 from 3-point range, and 0.715 from the free throw line, playing an average of 25.2 minutes per game. In the 2009–10 season, Kemba Walker played for Connecticut in 34 games. He averaged 14.6 points, 4.3 rebounds, 5.0 assists, 2.0 steals, and 0.4 blocks per game. He shot 0.405 from the field, 0.339 from 3-point range, and 0.767 from the free throw line, playing an average of 35.2 minutes per game. In the 2010–11 season, Kemba Walker played for Connecticut in 41 games. He averaged 23.5 points, 5.4 rebounds, 4.5 assists, 1.9 steals, and 0.2 blocks per game.', 'On November 17, he scored a career-high and franchise-best 60 points in a 122–119 overtime loss to the Philadelphia 76ers. On December 5 against the Minnesota Timberwolves, Walker made his 502nd career start for Charlotte, the most of any player in team history, passing Muggsy Bogues (501). On January 24, Walker was named a starter for the Eastern Conference in the 2019 NBA All-Star Game, joining Glen Rice as the only players to represent Charlotte in three All-Star Games. Walker also became the third Hornets player to start an All-Star Game, along with Larry Johnson (1993) and Eddie Jones (2000). On February 6, he had 30 points and a season-high 11 rebounds in a 99–93 loss to the Dallas Mavericks. On February 9, he hit a season-high nine 3-pointers and scored 37 points in a 129–120 win over the Atlanta Hawks. With 32 points, seven assists and three rebounds against the New Orleans Pelicans on April 3, Walker recorded his 26th 30-point game of the season, passing Glen Rice for the franchise record for 30-point games in a season. He also set the franchise record for 3-pointers made in a season when he made his 244th 3-pointer against New Orleans. On April 5, he scored 29 points in a 113–111 win over the Toronto Raptors, thus joining Glen Rice as the only players in franchise history to score 2,000 points in a season—Rice scored 2,115 points in the 1996–97 season. With his 250th made 3-pointer on April 7 against the Detroit Pistons, Walker became only the ninth different player in NBA history to connect on 250+ 3-pointers in a season. He was subsequently named Eastern Conference Player of the Week for games played April 1–7, marking his seventh career player of the week award.', 'He led the league in three-pointers made, and ranked among NBA leaders in attempts (third) and percentage (18th, .405).', 'Kemba Hudley Walker (born May 8, 1990) is an American professional basketball coach and former player who is a player enhancement coach for the Charlotte Hornets of the National Basketball Association (NBA). He was picked ninth overall by the Charlotte Bobcats in the 2011 NBA draft and also played for the Boston Celtics, New York Knicks, and the Dallas Mavericks, before finishing his career with AS Monaco.', ""Following the season, he was named to the All-NBA Third Team, his first all-league selection. = Coming off a frustrating 2018–19 season, the Boston Celtics would go on to lose franchise centerpieces Kyrie Irving and Al Horford to free agency, opening the door to start a new chapter with a new max-salary player. After Walker and the Celtics showed mutual interest at the start of free agency, he officially joined the franchise on July 6, 2019, through a sign and trade deal with Charlotte worth $141 million over four years. Walker chose to wear Kobe Bryant’s number 8 with the Celtics as his usual number 15 had been retired by the Celtics in honor of Tom Heinsohn. Walker made his Celtics debut on October 23, 2019, against the Philadelphia 76ers; he put up 12 points on 18 shot attempts from the field in 34 minutes of play during the 107–93 loss. On November 22, during a game against the Nuggets, Walker went down with a neck injury after colliding with teammate Semi Ojeleye. He was taken off the court on a stretcher. He was first diagnosed with concussion-like symptoms, and then later diagnosed with a sprained neck. On November 27, Walker scored a then season-high 39 points in a 121–110 win over the Brooklyn Nets. That season-high would be eclipsed on December 11, when Walker scored 44 points in 122–117 loss to the Indiana Pacers. On January 16, 2020, Walker would post a 40-point, 11 assist double-double in a 128–123 loss to the Milwaukee Bucks. On January 20, Walker recorded his first head-to-head win against LeBron James, after having begun his career 0–28 against him. Posting 20 points, seven assists, four rebounds, and a steal, he helped the Celtics come away with a 139–107 blowout victory over longtime rivals the Lakers. Three days later, Walker was named to his fourth consecutive All-Star Game, being selected as an Eastern Conference starter. The 2019–2020 season was suspended due to the COVID-19 pandemic. After the season resumed, Walker helped the Celtics reach the Eastern Conference Finals, where the team was defeated by the Miami Heat. Walker missed several games during the season due to knee soreness. In December 2020, the Celtics confirmed that Walker had received a stem cell injection in his left knee in October and had been placed on 12 week strengthening program, sidelining him for the start of the 2020–21 NBA season. Walker made his season debut on January 17, 2021. In the 2021 playoffs, Walker missed games four and five of Boston's first-round playoff series against the Brooklyn Nets due to a bone bruise in his left knee. The Celtics lost the series in five games. = On June 18, 2021, Walker was traded to the Oklahoma City Thunder, along with a 2021 first-round draft pick (16th selection), and a 2025 second round draft pick from the Boston Celtics in exchange for Al Horford, Moses Brown, and a 2023 second-round draft pick. Walker reached a contract buyout agreement with the Thunder on August 6, 2021. On August 11, he signed a two-year, $17.9 million contract with the New York Knicks, his hometown team. On October 20, Walker made his Knicks debut, recording 10 points and eight assists in a 138–134 double overtime victory over the Boston Celtics. On November 29, 2021, Walker was removed from the Knicks' rotation in favor of Alec Burks. He sat for 10 games before re-entering the rotation on December 18 after guard Derrick Rose was injured. On December 23, Walker scored a season-high 44 points, alongside nine rebounds and eight assists, in a 124–117 loss to the Washington Wizards. On December 25, in the Knicks' 101–87 win against the Atlanta Hawks, Walker recorded a triple-double with 10 points, 10 rebounds and 12 assists and became the seventh player in NBA history to record a triple-double in an NBA Christmas Day game. Walker missed games in January 2022 due to knee problems."", 'to own and grow brands in the sports industry. The initial investment was a 10% stake in the Bodyarmor SuperDrink company for $6 million in March 2014. The headquarters are in Newport Beach, California. With The Coca-Cola Company purchasing a minority stake in the company in August 2018, the valuation of Bryant\'s stake rose to approximately $200 million. In 2013, Bryant launched a production company called Granity Studios, which developed different media, ranging from films to television shows and novels. On August 22, 2016, Bryant and his business partner Jeff Stibel launched Bryant-Stibel, a venture capital firm focused on different businesses including media, data, gaming, and technology, with $100 million in funding. In 2018, Bryant and Sports Academy launched Mamba Sports Academy, a joint athletic-training business venture. The academy established locations in Thousand Oaks and Redondo Beach, California. = On October 23, 2018, Bryant\'s book The Mamba Mentality: How I Play, with photographs and afterword by Andrew D. Bernstein, an introduction by Phil Jackson, and a foreword by Pau Gasol, was published by MCD / Farrar, Straus and Giroux. The book looks back on his career with photos and his reflections. At the time of his death, Bryant was working with Brazilian author Paulo Coelho on a children\'s book aimed at inspiring underprivileged children. After Bryant\'s death, Coelho deleted the draft, saying in an interview that ""it didn\'t make any sense to publish without him."" He did not say how many pages had been written or whether the book had a title. Bryant also co-wrote/produced several young adult novels through Granity Studios: The Wizenard Series: Training Camp, Legacy and the Queen, and Epoca: The Tree of Ecrof. A fourth novel, The Wizenard Series: Season One, was released posthumously in March 2020.', ""Wiggins, Stephen Curry and Klay Thompson combined for 23 made three-pointers, the most three-pointers made in a game by a trio in NBA history. On December 3, Wiggins scored a season-best 36 points and matched his career high with 8-of-10 shooting from three-point range in a 120–103 win over the Houston Rockets. In the 2023 NBA playoffs, the Warriors were eliminated in the Conference Semifinals by the Los Angeles Lakers. On March 24, 2024, Wiggins became the first NBA player born in Canada to reach 1,000 career threes made. = On February 6, 2025, Wiggins was traded to the Miami Heat in a five-team trade, including Jimmy Butler to the Warriors. On March 23, Wiggins had the second-highest scoring game of his career with 42 points in a 122–105 win over the Charlotte Hornets. Wiggins participated in the 2010 FIBA Under-17 World Championship and 2012 FIBA Americas Under-18 Championship, helping the Canadian junior national team win a bronze medal in each tournament. During the 2010 tournament, Wiggins was a teammate of Anthony Bennett, the number one overall pick in the 2013 NBA draft and his former teammate on the Timberwolves. In the 2012 tournament, he led the team in scoring with 15.2 ppg, along with 7.6 rpg. On August 20, 2015, Wiggins was named to the Canadian national team roster for the 2015 FIBA Americas Championship, a qualifying tournament for the 2016 Summer Olympics. Wiggins helped Canada win the bronze medal; he led the team in scoring, with 15.1 points per game, and he was named to the All-Tournament Team. Wiggins rejoined the team for the 2020 FIBA Men's Olympic Qualifying Tournament, averaging 21.7 points, 6.0 rebounds and 2.3 assists per game in three contests. = Regular season Playoffs = Wiggins has two children named Amyah and Alayah. Wiggins has five siblings: sisters Stephanie, Angelica and Taya; and brothers Nick and Mitchell Jr. His middle brother, Nick, played college basketball at Vincennes University, Wabash Valley College and Wichita State University, and his oldest brother, Mitchell Jr., played at Hillsborough Community College and Southeastern University. List of Canadians in the NBA List of second-generation NBA players Career statistics from NBA.com · Basketball Reference Kansas Jayhawks bio\n\nIn the 2014–15 season, Andrew Wiggins played for Minnesota in 82 games. He averaged 16.9 points, 4.6 rebounds, 2.1 assists, 1.0 steals, and 0.6 blocks per game. He shot 0.437 from the field, 0.31 from 3-point range, and .760 from the free throw line, playing an average of 36.2 minutes per game. In the 2015–16 season, Andrew Wiggins played for Minnesota in 81 games. He averaged 20.7 points, 3.6 rebounds, 2.0 assists, 1.0 steals, and 0.6 blocks per game. He shot 0.459 from the field, 0.3 from 3-point range, and .761 from the free throw line, playing an average of 35.1 minutes per game. In the 2016–17 season, Andrew Wiggins played for Minnesota in 82* games. He averaged 23.6 points, 4.0 rebounds, 2.3 assists, 1.0 steals, and 0.4 blocks per game. He shot 0.452 from the field, 0.356 from 3-point range, and .760 from the free throw line, playing an average of 37.2 minutes per game. In the 2017–18 season, Andrew Wiggins played for Minnesota in 82* games. He averaged 17.7 points, 4.4 rebounds, 2.0 assists, 1.1 steals, and 0.6 blocks per game. He shot 0.438 from the field, 0.331 from 3-point range, and .643 from the free throw line, playing an average of 36.3 minutes per game. In the 2018–19 season, Andrew Wiggins played for Minnesota in 73 games. He averaged 18.1 points, 4.8 rebounds, 2.5 assists, 1.0 steals, and 0.7 blocks per game. He shot 0.412 from the field, 0.339 from 3-point range, and .699 from the free throw line, playing an average of 34.8 minutes per game. In the 2019–20 season, Andrew Wiggins played for Minnesota in 42 games. He averaged 22.4 points, 5.2 rebounds, 3.7 assists, 0.7 steals, and 0.9 blocks per game. He shot 0.444 from the field, 0.331 from 3-point range, and .720 from the free throw line, playing an average of 34.7 minutes per game. In the 2019–20 season, Andrew Wiggins played for Golden State in 12 games. He averaged 19.4 points, 4.6 rebounds, 3.6 assists, 1.3 steals, and 1.4 blocks per game. He shot 0.457 from the field, 0.339 from 3-point range, and .672 from the free throw line, playing an average of 33.6 minutes per game. In the 2020–21 season, Andrew Wiggins played for Golden State in 71 games. He averaged 18.6 points, 4.9 rebounds, 2.4 assists, 0.9 steals, and 1.0 blocks per game. He shot 0.477 from the field, 0.38 from 3-point range, and .714 from the free throw line, playing an average of 33.3 minutes per game. In the 2021–22† season, Andrew Wiggins played for Golden State in 73 games. He averaged 17.2 points, 4.5 rebounds, 2.2 assists, 1.0 steals, and 0.7 blocks per game. He shot 0.466 from the field, 0.393 from 3-point range, and .634 from the free throw line, playing an average of 31.9 minutes per game. In the 2022–23 season, Andrew Wiggins played for Golden State in 37 games. He averaged 17.1 points, 5.0 rebounds, 2.3 assists, 1.2 steals, and 0.8 blocks per game. He shot 0.473 from the field, 0.396 from 3-point range, and .611 from the free throw line, playing an average of 32.2 minutes per game. In the 2023–24 season, Andrew Wiggins played for Golden State in 71 games. He averaged 13.2 points, 4.5 rebounds, 1.7 assists, 0.6 steals, and 0.6 blocks per game. He shot 0.453 from the field, 0.358 from 3-point range, and .751 from the free throw line, playing an average of 27.0 minutes per game. In the 2024–25 season, Andrew Wiggins played for Golden State in 43 games. He averaged 17.6 points, 4.6 rebounds, 2.4 assists, 0.9 steals, and 0.8 blocks per game. He shot 0.444 from the field, 0.379 from 3-point range, and .777 from the free throw line, playing an average of 30.1 minutes per game. In the 2024–25 season, Andrew Wiggins played for Miami in 17 games. He averaged 19.0 points, 4.2 rebounds, 3.3 assists, 1.2 steals, and 1.0 blocks per game. He shot 0.458 from the field, 0.36 from 3-point range, and .731 from the free throw line, playing an average of 32.1 minutes per game. In the All-Star season, Andrew Wiggins played for All-Star in 1 games. He averaged 10.0 points, 0.0 rebounds, 1.0 assists, 0.0 steals, and 0.0 blocks per game. He shot 0.571 from the field, 0.5 from 3-point range, and — from the free throw line, playing an average of 15.3 minutes per game. In the 2018 season, Andrew Wiggins played for Minnesota in 5 games. He averaged 15.8 points, 5.2 rebounds, 2.0 assists, 0.4 steals, and 0.4 blocks per game. He shot 0.441 from the field, 0.333 from 3-point range, and 0.6 from the free throw line, playing an average of 32.8 minutes per game. In the 2022† season, Andrew Wiggins played for Golden State in 22 games. He averaged 16.5 points, 7.5 rebounds, 1.8 assists, 1.0 steals, and 1.0 blocks per game. He shot 0.469 from the field, 0.333 from 3-point range, and 0.646 from the free throw line, playing an average of 34.9 minutes per game. In the 2023 season, Andrew Wiggins played for Golden State in 13 games. He averaged 16.7 points, 5.6 rebounds, 1.9 assists, 0.8 steals, and 1.2 blocks per game. He shot 0.459 from the field, 0.297 from 3-point range, and 0.681 from the free throw line, playing an average of 34.0 minutes per game. In the 2025 season, Andrew Wiggins played for Miami in 4 games. He averaged 11.5 points, 3.3 rebounds, 2.3 assists, 0.3 steals, and 1.3 blocks per game. He shot 0.372 from the field, 0.35 from 3-point range, and 0.7 from the free throw line, playing an average of 30.5 minutes per game. In the 2013–14 season, Andrew Wiggins played for Kansas in 35 games. He averaged 17.1 points, 5.9 rebounds, 1.5 assists, 1.2 steals, and 1.0 blocks per game."", ""1 in the nation. Considered a five-star recruit by Rivals.com, Walker was listed as the No. 5 point guard and the No. 14 player in the nation in 2008. = During his freshman year at the University of Connecticut, Walker played in every contest and was named to the Big East All-Rookie Team. He helped the Huskies achieve a number one seed in the 2009 NCAA tournament. Despite starting in only two games, he averaged 25.5 minutes per contest, easily far more than any regular non-starter. He also helped the Huskies advance to the 2009 Final Four with a 23-point effort in the Elite Eight versus Missouri. = During the Huskies' 2009–2010 season, Walker started in all 34 of their games and contributed an average of 14.6 points. He also led the team in scoring for the eighth time in the last nine games of the season, with 18 points at Virginia Tech. Walker was named by the U.S. Basketball Writers Association (USBWA) to the First Team All-District. Connecticut clinched a 4-seed in the NCAA's 2010 National Invitation Tournament only to fall short to Virginia Tech and finish the relatively disappointing season going 18–16 (7–11) in conference play. = Walker rose to national prominence in his third year at Connecticut. This was because, twelve games into his junior campaign, he distinguished himself as the leading scorer in the nation, posting 26.7 points per contest; in addition, Walker averaged 5 rebounds and 3.8 assists. It was then that he appeared on one of the six regional covers of Sports Illustrated magazine. In the 2011 Big East tournament, Walker hit the game-clinching shot at the buzzer to beat the Pittsburgh Panthers, ranked No. 3 overall, thereby advancing the Huskies to the semifinals. Walker led UConn to victory in the ensuing Big East Championship against the Louisville Cardinals and earned tournament MVP honors in the process. Over five games in as many days, Walker tallied an unprecedented 130 points, a record of points scored for not only the Big East but for any conference tournament in the past 15 seasons. UConn thus became the first school to win five games in five days and earn a conference championship. On March 14, 2011, the U.S. Basketball Writers Association named Walker First Team All-American with only Fox Sports picking him to the Second Team. His heroic performance in the 2010–11 season also made him a finalist for the Association's college player of the year honors, the Oscar Robertson Trophy. Despite finishing second to Jimmer Fredette for this award, at least several journalists held that it was rather Walker who deserved the distinction of best player that year. Among other accolades bestowed on him, Walker claimed the Bob Cousy Award for college basketball's top point guard in the nation. On April 4, 2011, Walker, with 16 points himself, rallied and led the University of Connecticut to win the Division I Championship, while he won the honor of NCAA basketball tournament Most Outstanding Player. Upon the team's return from Houston, at a pep rally to celebrate the National Title, Walker was added to the Huskies of Honor. He became the first men's basketball player to receive the distinction since the inaugural class was announced in December 2006. = 2011–12 season: Rookie season Walker graduated from UConn in three years. Accordingly, he entered the 2011 NBA draft and was selected ninth overall by the Charlotte Bobcats. Walker signed a multi-year shoe deal with Under Armour, the first rookie from the 2011 draft class to do so. On December 11, 2011, he signed the rookie scale contract with the Bobcats, and with the injury of point guard D."", ""On February 7, Matthews was waived by the Knicks after appearing in just two games for the team. = On February 10, 2019, Matthews signed with the Indiana Pacers. On February 22, Matthews made 6 three-pointers and finished with 24 points, to lead the Pacers in a comeback win over the New Orleans Pelicans. = On July 12, 2019, Matthews signed with the Milwaukee Bucks. On November 25, 2019, Matthews scored 19 points and grabbed 4 rebounds while starting in place of injured All-Star Khris Middleton in a game against the Utah Jazz. On December 22, he again scored 19 points, this time in a win against his previous team, the Pacers. = On November 22, 2020, Matthews signed with the Los Angeles Lakers. He appeared in 58 games for the Lakers, averaging only 4.8 points and a career-worst 33% 3-point shot percentage. = On December 3, 2021, Matthews was signed by the Milwaukee Bucks. During Milwaukee's Christmas Day game, Matthews scored just 9 points, but gave the Bucks the lead by making a 3-point shot with 30 seconds left to help complete a 19-point come back, in a 117–113 win over the Boston Celtics. Matthews was inserted into the starting lineup by Mike Budenholzer towards the end of the regular season to provide a defensive presence alongside All-Defensive guard Jrue Holiday. On July 6, 2022, Matthews re-signed with the Bucks. = On July 22, 2023, Matthews signed with the Atlanta Hawks. = Regular season Playoffs = List of National Basketball Association career 3-point scoring leaders Career statistics from NBA.com · Basketball Reference Marquette Golden Eagles bio\n\nIn the 2009–10 season, Wesley Matthews played for Utah in 82* games. He averaged 9.4 points, 2.3 rebounds, 1.5 assists, 0.8 steals, and 0.2 blocks per game. He shot 0.483 from the field, 0.382 from 3-point range, and 0.829 from the free throw line, playing an average of 24.7 minutes per game. In the 2010–11 season, Wesley Matthews played for Portland in 82 games. He averaged 15.9 points, 3.1 rebounds, 2.0 assists, 1.2 steals, and 0.1 blocks per game. He shot 0.449 from the field, 0.407 from 3-point range, and 0.844 from the free throw line, playing an average of 33.6 minutes per game. In the 2011–12 season, Wesley Matthews played for Portland in 66* games. He averaged 13.7 points, 3.4 rebounds, 1.7 assists, 1.5 steals, and 0.2 blocks per game. He shot 0.412 from the field, 0.383 from 3-point range, and 0.86 from the free throw line, playing an average of 33.8 minutes per game. In the 2012–13 season, Wesley Matthews played for Portland in 69 games. He averaged 14.8 points, 2.8 rebounds, 2.5 assists, 1.3 steals, and 0.3 blocks per game. He shot 0.436 from the field, 0.398 from 3-point range, and 0.797 from the free throw line, playing an average of 34.8 minutes per game. In the 2013–14 season, Wesley Matthews played for Portland in 82 games. He averaged 16.4 points, 3.5 rebounds, 2.4 assists, 1.3 steals, and 0.3 blocks per game. He shot 0.441 from the field, 0.393 from 3-point range, and 0.837 from the free throw line, playing an average of 34.0 minutes per game. In the 2014–15 season, Wesley Matthews played for Portland in 60 games. He averaged 15.9 points, 3.7 rebounds, 2.3 assists, 1.3 steals, and 0.2 blocks per game. He shot 0.448 from the field, 0.389 from 3-point range, and 0.752 from the free throw line, playing an average of 33.7 minutes per game. In the 2015–16 season, Wesley Matthews played for Dallas in 78 games. He averaged 12.5 points, 3.1 rebounds, 1.9 assists, 1.0 steals, and 0.2 blocks per game. He shot 0.388 from the field, 0.36 from 3-point range, and 0.863 from the free throw line, playing an average of 33.9 minutes per game. In the 2016–17 season, Wesley Matthews played for Dallas in 73 games. He averaged 13.5 points, 3.5 rebounds, 2.9 assists, 1.1 steals, and 0.2 blocks per game. He shot 0.393 from the field, 0.363 from 3-point range, and 0.816 from the free throw line, playing an average of 34.2 minutes per game. In the 2017–18 season, Wesley Matthews played for Dallas in 63 games. He averaged 12.7 points, 3.1 rebounds, 2.7 assists, 1.2 steals, and 0.3 blocks per game. He shot 0.406 from the field, 0.381 from 3-point range, and 0.822 from the free throw line, playing an average of 33.8 minutes per game. In the 2018–19 season, Wesley Matthews played for Dallas in 44 games. He averaged 13.1 points, 2.3 rebounds, 2.3 assists, 0.8 steals, and 0.3 blocks per game. He shot 0.414 from the field, 0.38 from 3-point range, and 0.791 from the free throw line, playing an average of 29.8 minutes per game. In the 2018–19 season, Wesley Matthews played for New York in 2 games. He averaged 7.0 points, 1.5 rebounds, 2.5 assists, 0.5 steals, and 0.5 blocks per game. He shot 0.211 from the field, 0.2 from 3-point range, and 0.8 from the free throw line, playing an average of 26.9 minutes per game. In the 2018–19 season, Wesley Matthews played for Indiana in 23 games. He averaged 10.9 points, 2.8 rebounds, 2.4 assists, 0.9 steals, and 0.2 blocks per game. He shot 0.386 from the field, 0.369 from 3-point range, and 0.854 from the free throw line, playing an average of 31.5 minutes per game. In the 2019–20 season, Wesley Matthews played for Milwaukee in 67 games. He averaged 7.4 points, 2.5 rebounds, 1.4 assists, 0.6 steals, and 0.1 blocks per game. He shot 0.396 from the field, 0.364 from 3-point range, and 0.765 from the free throw line, playing an average of 24.4 minutes per game. In the 2020–21 season, Wesley Matthews played for L.A. Lakers in 58 games."", ""As a freshman at Kentucky he was named SEC Tournament MVP. In his sophomore year, Walker was named All-SEC First, All-SEC Tournament and to the All-NCAA Regional Teams. = After Walker's sophomore season, he declared for the 1996 NBA draft and was picked sixth overall by the Boston Celtics. In the 1996–1997 season, Walker made the All-Rookie First Team and led the team in scoring (17.5 ppg) and rebounding (9.0), as the team had its worst season in franchise history, 15–67. The following season, Pitino was reunited with Walker as the new coach of the Celtics and he made the All-Star team as a reserve while averaging 22.4 ppg and 10.2 rpg. He also scored a career-high 49 points in a loss against the Washington Wizards. Walker's success led to his appearance on the cover of NBA Live 99. In the '98 draft, the Celtics had the 10th pick and chose swing man Paul Pierce. The next few years, Pierce and Walker were a talented duo for the Celtics. In the 2001–2002 season, Walker had his best overall season by helping lead the Celtics to a 49–33 record and their first playoff berth in seven years. He was second on his team in scoring (22.0), first in rebounds (9), and first in assists, (5.0). Pierce and Walker took the team to the Eastern Conference finals, where they fell to the New Jersey Nets in six games. The next season, Walker made his third All-Star team. On February 20, 2002, former Kentucky teammate Tony Delk was traded to the Celtics, reuniting Walker with him. = Just 10 days before the start of the 2003–04 season, Walker was traded with Delk to the Dallas Mavericks for Raef LaFrentz, Chris Mills, Jiří Welsch, and a 2004 first-round draft pick. Despite appearing and starting in every game for Dallas that season, Walker was used in a relatively limited capacity on his new team due to the number of high-caliber players populating the Mavericks' roster. Included on that team was Antawn Jamison, who was newly acquired from the Golden State Warriors. = On August 8, 2004, Walker and Delk were traded again, this time to the Atlanta Hawks for Jason Terry, longtime Hawk Alan Henderson and a conditional 2007 first-round draft pick. As the pick did not convey, Dallas received cash considerations from Atlanta instead. = On February 24, 2005, Walker was traded back to the Celtics in a deal that sent Gary Payton, Tom Gugliotta, Michael Stewart, and a first-round draft pick to the Hawks. (Payton was released by the Hawks and re-signed with Boston for the remainder of the season). Walker started all 24 remaining games for the Celtics, averaging 16.3 points and 8.3 rebounds a game as the Celtics advanced to the playoffs before losing to the Indiana Pacers in a 7-game first round series. For his second stint with the Celtics, Walker briefly chose to wear the uniform number 88, as his trademark 8 jersey was being worn by rookie Al Jefferson. Jefferson would switch to number 7 after 2 games. = On August 2, 2005, Walker was involved in a five-team, 13-player deal (the largest trade in NBA history) that sent him from the Celtics to the Miami Heat. The Celtics received Curtis Borchardt, Qyntel Woods, the draft rights of Albert Miralles, and draft picks in the deal. The move reunited Walker with Celtics teammate Gary Payton."", ""Early in the season, he was widely regarded to have been in a shooting slump. He broke the UNC record for the most career three-pointers made (299). However, he recovered late in the season and helped the Tar Heels win the 2016 ACC tournament and lead them to the 2016 NCAA championship game, where they faced Villanova. In the game, Paige scored 21 points and hit a game-tying circus three-pointer with 4.7 seconds left in the second half of regulation. However, Villanova's Kris Jenkins went on to score a buzzer beater to win the game 77–74. = On June 23, 2016, Paige was selected by the Brooklyn Nets with the 55th overall pick in the 2016 NBA draft."", '35). On October 25, 2023, Smart made his Grizzlies debut, putting up 17 points, three assists, and two steals in a 111–104 loss to the New Orleans Pelicans. At the 2024 NBA All-Star break, Smart averaged a career best 14.4 points alongside 2.0 steals while playing 30.2 minutes per game. However, he only appeared in 20 games during the 2023–24 season due to injuries. Smart played in just one game following the All-Star break, a 121–118 overtime loss to the Sacramento Kings on March 18, where he played just five minutes without recording a single stat in any category. = On February 6, 2025, Smart was traded to the Washington Wizards along with Colby Jones and Alex Len for Johnny Davis, Marvin Bagley III, and a 2025 second round pick. Smart plays both the point guard and shooting guard positions, but was named the Celtics\' starting point guard in 2021. Standing at 6 feet 3 inches (1.91 m) with a 6-foot-9-inch (2.06 m) wingspan, Smart is capable of guarding all five positions, enabling him to play a switching defense with historic efficiency. Smart has earned a reputation as a hustle player. He is known for diving for loose balls and taking charges, and has been nicknamed ""the Cobra"" as a result. Due to his physicality, quick hands, and elite basketball IQ, many consider Smart to be one of the most versatile and consistent defenders in the NBA. Although not a high percentage shooter, Smart is aggressive on offense and defense. He often guards opposing players taller than he is, using his physicality to make them uncomfortable and often causing turnovers or missed shots. Over his years in the league, Smart\'s three-point shooting has improved. His former teammate, Kemba Walker, describes the energy Smart brings to the game: ""It\'s exciting. It\'s energizing.', 'On March 3, 2019, he scored a then season-high 28 points with a career-high five 3-pointers in a 123–118 win over the Chicago Bulls. On April 7, he scored a career-high 33 points, including a career-best six 3-pointers, in a 115–107 loss to the Milwaukee Bucks. = On February 6, 2020, Len and Jabari Parker were traded to the Sacramento Kings in exchange for Dewayne Dedmon and two second round picks. = On November 29, 2020, Len signed with the Toronto Raptors.', 'Sometimes I think about it now and I\'m like, Damn. How did I get here?"" Also in the Katz interview, Ezeli remarked on his struggles to learn the game:""I didn\'t know what I was doing. Imagine someone who is 14 or 15 years old, and you\'re teaching them as if they\'re a 6-year-old.', 'The Celtics went on to lose in seven games as they failed to defend their title. 2009–2012: finals upset and 3-point record On December 10, 2009, Allen scored 18 points to reach the 20,000 point total for his career. On June 6, 2010, in Game 2 of the 2010 NBA Finals in a 103–94 victory against the Los Angeles Lakers, Allen set a then record for most three-pointers made in an NBA Finals game on 8–11 shooting to tie the series 1–1. He broke Michael Jordan\'s record of six three-pointers in one half by hitting seven in the first half and had tied Scottie Pippen and Kenny Smith\'s record for most three-pointers in one game in the NBA Finals by half time. Allen also became the first player in NBA history to have two separate games of scoring at least seven three-pointers in the NBA Finals. The Celtics would win two of three games in Boston, before losing the last two games and the series in Los Angeles. After becoming a free agent on July 1, 2010, Allen re-signed a two-year deal with the Boston Celtics on July 7 worth $20 million. During a game against the Los Angeles Lakers on February 10, 2011, Allen became the all-time NBA leader in total three-pointers made (2,562), surpassing Reggie Miller\'s record of 2,560. The 35-year-old shooting guard finished the game with 20 points but the Celtics eventually lost 92–86. In the 2010–11 NBA season Allen was named to his tenth All-Star game alongside teammates Rajon Rondo, Paul Pierce and Kevin Garnett. Also during All-Star Weekend, Allen competed in the Three-Point Shootout, but lost to James Jones of the Miami Heat. During the 2011–12 NBA season, Allen was privately frustrated with trade rumors in February, issues with teammate Rajon Rondo, and an ankle injury that ultimately required surgery in June 2012 to remove bone spurs. The Celtics lost in seven games to the Miami Heat in the 2012 Eastern Conference finals. = 2012–2013: second championship Allen\'s initial plan in the summer of 2012 was to stay with the Boston Celtics. He was reportedly seeking a three-year, $24 million contract whereas the Celtics were offering a two-year, $12 million deal. Further internal discord with a bench role and a Rondo-focused approach led to Allen rejecting the Celtics and instead choosing to sign a two-year, $6 million deal with the Miami Heat. The Heat were limited to their mid-level exception amount of slightly more than $3 million per season. During Allen\'s first season with the Miami Heat, he averaged 10.9 points per game and made 88.6% of his free throws while playing an average of 25.8 minutes per game. On April 25, 2013, while playing Milwaukee in Game 3 of the first round of the playoffs, Allen made his 322nd career three-pointer in the playoffs, which broke Reggie Miller\'s record for most three-pointers made in NBA playoff history. Allen returned to his favorite #34 jersey upon joining the Heat. In Game 6 of the NBA Finals against the San Antonio Spurs, as the Heat trailed by three points, Allen made a game-tying 3-pointer with 5.2 seconds left in the fourth quarter to force overtime. Having rallied from a 10-point deficit at the end of the third quarter, the Heat won in overtime 103–100 over the San Antonio Spurs and forced a seventh game in the series. With the Heat leading 101–100, Allen stole the ball from Manu Ginóbili under the Spurs\' basket and drew a foul with 1.9 seconds remaining in the overtime period. Allen made both ensuing free throws to put Miami up 103–100. Allen played 41 minutes in Game 6 off the bench and scored 9 points on 3-for-8 field goal shooting; his game-tying three-pointer was the only three-pointer he made in three attempts. Allen also had one defensive rebound and two assists. In Game 7, which the Heat won 95–88 to win its second consecutive championship, Allen played 20 minutes off the bench. Although he made none of 4 field goal attempts and had 3 turnovers, Allen recorded 4 defensive rebounds and 4 assists. 2013–2014: final playing year On June 29, 2013, Allen picked up his $3.23 million player option to stay with the Heat through the 2013–14 NBA season. During the regular season, Allen played in 73 games, starting 9 of them, averaging 9.6 points and shooting 37 percent from three-point range. In the playoffs, Allen scored 19 points on 4–7 three-point shooting in game 4 of the conference semifinals against the Brooklyn Nets. Then in Game 3 against the Indiana Pacers in an Eastern Conference finals rematch, Allen hit four 3-point shots in the fourth quarter and put them up 2–1 in the series. The Heat won the series in six games to advance to the NBA Finals for the fourth straight year and Allen\'s second. The Heat faced the Spurs again in the 2014 NBA Finals, but they lost the series in five games. = Allen became a free agent in the 2014 off-season, and after much anticipation of a return at some point during the 2014–15 season, he announced his decision to sit out the season and focus on 2015–16. However, he did not end up joining a team. In July 2016, Allen began mulling a comeback, and admitted he was ""intrigued"" by the possibility of competing for another championship. The following month, Allen had talks with the Boston Celtics and the Milwaukee Bucks regarding a possible return, but ultimately decided to officially retire on November 1, 2016. In September 2018, Allen was inducted into the Naismith Memorial Basketball Hall of Fame. In February 2019, Allen played in the NBA All-Star Celebrity Game. In October 2021, Allen was honored as one of the league\'s greatest players of all time by being named to the NBA\'s 75th Anniversary Team. He was also named in the top 75 players by The Athletic. In 1998, Allen co-starred alongside Denzel Washington in the Spike Lee film He Got Game as high school basketball phenomenon Jesus Shuttlesworth. Roger Ebert praised his performance and said Allen ""is that rarity: an athlete who can act,"" while New York magazine described him as ""graceful and fast in the basketball scenes"" while giving ""a somberly effective minimalist performance."" His role as Jesus Shuttlesworth earned him that name as a nickname from teammates and fans. Allen also appeared as Marcus Blake in the 2001 film Harvard Man.', ""He has also played for the Brooklyn Nets. Walker was born December 14, 1998, in Reading, Pennsylvania. He attended Reading Senior High School in Reading. Walker made his varsity basketball debut as a freshman and played 27 games averaging eight points per game, and later as a sophomore he averaged 16.9 points per game in a short season due to injury. In 29 games, as a junior, he averaged 17.1 points per game. During his senior year, Walker was named a McDonald's All-American and voted Mr. Pennsylvania Basketball. He averaged a career best 18.4 points per game and surpassed Reading High grad and former NBA player Donyell Marshall's school record in points by finishing with 1,828 total points scored. On March 25, 2017, Walker led Reading Senior High School to their first state championship in the program's 117-year history in a 64–60 win over the Pine-Richland Rams. Walker finished the game with 22 points, eight rebounds, four steals, and three assists. During the season, Walker signed with the Miami Hurricanes, passing on other scholarship offers from Villanova, Kentucky, Syracuse, and Arizona. Walker made his collegiate debut with the Miami Hurricanes on November 10, 2017, recording 10 points and a season-high five assists coming off the bench in a 77–45 blowout win over Gardner-Webb University. He created new highs of 12 points and 5 rebounds on December 2 in an 80–52 blowout win against Princeton University before recording season-highs of 26 points and 7 rebounds during his first collegiate start three days later in a 69–54 win over Boston University. Against Louisville, he scored a game-high 25 points including an acrobatic layup in traffic to force overtime. In a game against Boston College, he hit a 3-pointer with two seconds remaining to win 79–78. Walker finished the season averaging 11.5 points per game and was named to the ACC all-freshman team. After his sole season with Miami concluded, Walker declared for the 2018 NBA draft. = On June 21, 2018, Walker was selected with the 18th overall pick by the San Antonio Spurs in the 2018 NBA draft. Walker was later included in the 2018 NBA Summer League roster of the Spurs. On July 11, 2018, the Spurs announced that they signed Walker. On October 6, 2018, Walker was revealed to have a right medial meniscus tear. On November 25, 2018, the San Antonio Spurs assigned Walker the first time of the season to the Austin Spurs. Walker made his NBA debut on January 3, 2019, in a 125–107 win against the Toronto Raptors, scoring three points and grabbing one rebound in five minutes of play. On December 3, 2019, Walker scored a career-high 28 points, including 19 in the 4th quarter, in a 135–133 double overtime win over the Houston Rockets with four rebounds, three steals and a block. = On July 6, 2022, Walker signed with the Los Angeles Lakers on a one-year, $6.5M contract. He began the 2022–23 season playing in 32 games, all starts, before being sidelined beginning in late December with knee tendinitis.""]",I don't know.,"Walker made 250 3-pointers in the 2018-2019 NBA season, becoming the ninth different player in NBA history to connect on 250+ 3-pointers in a season.",0.0,0.0,0.7936720142503286,1.0,0.18097288858236993,0.7239394765213607
Who did Ray Allen co-star alongside in 2015?,"['In 2015, Allen co-starred alongside Kyrie Irving, Baron Davis and J.', ""He appeared in the 2012 film That's My Boy as a gym teacher, and in 2015, he appeared in Yahoo! Screen's Sin City Saints, playing the role of Billy Crane. He also played himself in the 2015 film The Night Before, and portrayed a doctor in Joe Dirt 2. On November 12, 2015, Davis co-starred alongside Kyrie Irving, Ray Allen and J."", 'Walter Ray Allen Jr. (born July 20, 1975) is an American former professional basketball player. Allen played 18 seasons in the National Basketball Association (NBA) and was inducted into the Naismith Memorial Basketball Hall of Fame as a player in 2018. He is widely considered one of the greatest three-point shooters of all time. Allen was a ten-time NBA All-Star, and won an Olympic gold medal as a member of the 2000 United States men\'s basketball team. At the time of his retirement, he was the leading three-point scorer in NBA history until he was surpassed by Stephen Curry in 2021. As of 2025, he ranks third on the NBA\'s all-time three-pointers list. In 2021, he was selected to the NBA 75th Anniversary Team. Allen played college basketball for the Connecticut Huskies for three seasons, before he was selected with the fifth overall pick in the 1996 NBA draft, and developed into a prolific scorer for the Milwaukee Bucks, featuring alongside Glenn Robinson and Sam Cassell as the team achieved playoff success. In 2003, he was traded to the Seattle SuperSonics, where he solidified his reputation as a scorer, breaking several league records for three-point and free throw shooting. Allen was later traded to the Boston Celtics, where he formed a ""Big Three"" with Kevin Garnett and Paul Pierce; the team won an NBA championship in 2008. After five seasons with the Celtics, he played with the Miami Heat for two seasons, reaching the NBA Finals both times and winning the title in 2013; his clutch three-pointer in the 2013 Finals to force overtime is regarded as one of the most iconic and memorable plays in NBA history. Allen retired on November 1, 2016, after playing for four different teams. During his NBA career, Allen acted in some films, such as his role as basketball prodigy Jesus Shuttlesworth in Spike Lee\'s basketball drama He Got Game (1998). Allen\'s performance as Shuttlesworth was praised by critics, and the name was borrowed as Allen\'s basketball nickname. The third of five children, Allen was born at Castle Air Force Base near Merced, California, the son of Walter Sr.', ""ISBN 978-0062675477. Career statistics from NBA.com · Basketball Reference Allen's official website Ray Allen Archived April 1, 2016, at the Wayback Machine at nba.com Ray Allen at jockbio.com Ray Allen at IMDb\n\nIn the 1993–94 season, Ray Allen played for Connecticut in 34 games. He averaged 12.6 points, 4.6 rebounds, 1.4 assists, 1.1 steals, and 0.2 blocks per game. He shot 0.51 from the field, 0.402 from 3-point range, and 0.792 from the free throw line, playing an average of 21.6 minutes per game. In the 1994–95 season, Ray Allen played for Connecticut in 32 games. He averaged 21.1 points, 6.8 rebounds, 2.3 assists, 1.9 steals, and 0.5 blocks per game. He shot 0.489 from the field, 0.445 from 3-point range, and 0.727 from the free throw line, playing an average of 32.8 minutes per game. In the 1995–96 season, Ray Allen played for Connecticut in 35 games. He averaged 23.4 points, 6.5 rebounds, 3.3 assists, 1.7 steals, and 0.5 blocks per game. He shot 0.472 from the field, 0.466 from 3-point range, and 0.81 from the free throw line, playing an average of 34.7 minutes per game. In the 1996–97 season, Ray Allen played for Milwaukee in 82 games. He averaged 13.4 points, 4.0 rebounds, 2.6 assists, 0.9 steals, and 0.1 blocks per game. He shot 0.43 from the field, 0.393 from 3-point range, and 0.823 from the free throw line, playing an average of 30.9 minutes per game. In the 1997–98 season, Ray Allen played for Milwaukee in 82* games. He averaged 19.5 points, 4.9 rebounds, 4.3 assists, 1.4 steals, and 0.1 blocks per game. He shot 0.428 from the field, 0.364 from 3-point range, and 0.875 from the free throw line, playing an average of 40.1 minutes per game. In the 1998–99 season, Ray Allen played for Milwaukee in 50* games. He averaged 17.1 points, 4.2 rebounds, 3.6 assists, 1.1 steals, and 0.1 blocks per game. He shot 0.45 from the field, 0.356 from 3-point range, and 0.903 from the free throw line, playing an average of 34.4 minutes per game. In the 1999–00 season, Ray Allen played for Milwaukee in 82 games. He averaged 22.1 points, 4.4 rebounds, 3.8 assists, 1.3 steals, and 0.2 blocks per game. He shot 0.455 from the field, 0.423 from 3-point range, and 0.887 from the free throw line, playing an average of 37.4 minutes per game. In the 2000–01 season, Ray Allen played for Milwaukee in 82 games. He averaged 22.0 points, 5.2 rebounds, 4.6 assists, 1.5 steals, and 0.2 blocks per game. He shot 0.48 from the field, 0.433 from 3-point range, and 0.888 from the free throw line, playing an average of 38.2 minutes per game. In the 2001–02 season, Ray Allen played for Milwaukee in 69 games. He averaged 21.8 points, 4.5 rebounds, 3.9 assists, 1.3 steals, and 0.3 blocks per game. He shot 0.462 from the field, 0.434 from 3-point range, and 0.873 from the free throw line, playing an average of 36.6 minutes per game. In the 2002–03 season, Ray Allen played for Milwaukee in 47 games. He averaged 21.3 points, 4.6 rebounds, 3.5 assists, 1.2 steals, and 0.2 blocks per game. He shot 0.437 from the field, 0.395 from 3-point range, and 0.913 from the free throw line, playing an average of 35.8 minutes per game. In the 2002–03 season, Ray Allen played for Seattle in 29 games. He averaged 24.5 points, 5.6 rebounds, 5.9 assists, 1.6 steals, and 0.1 blocks per game. He shot 0.441 from the field, 0.351 from 3-point range, and 0.92 from the free throw line, playing an average of 41.3 minutes per game. In the 2003–04 season, Ray Allen played for Seattle in 56 games. He averaged 23.0 points, 5.1 rebounds, 4.8 assists, 1.3 steals, and 0.2 blocks per game. He shot 0.44 from the field, 0.392 from 3-point range, and 0.904 from the free throw line, playing an average of 38.4 minutes per game. In the 2004–05 season, Ray Allen played for Seattle in 78 games. He averaged 23.9 points, 4.4 rebounds, 3.7 assists, 1.1 steals, and 0.1 blocks per game. He shot 0.428 from the field, 0.376 from 3-point range, and 0.883 from the free throw line, playing an average of 39.3 minutes per game. In the 2005–06 season, Ray Allen played for Seattle in 78 games. He averaged 25.1 points, 4.3 rebounds, 3.7 assists, 1.3 steals, and 0.2 blocks per game. He shot 0.454 from the field, 0.412 from 3-point range, and 0.903 from the free throw line, playing an average of 38.7 minutes per game. In the 2006–07 season, Ray Allen played for Seattle in 55 games. He averaged 26.4 points, 4.5 rebounds, 4.1 assists, 1.5 steals, and 0.2 blocks per game. He shot 0.438 from the field, 0.372 from 3-point range, and 0.903 from the free throw line, playing an average of 40.3 minutes per game. In the 2007–08† season, Ray Allen played for Boston in 73 games. He averaged 17.4 points, 3.7 rebounds, 3.1 assists, 0.9 steals, and 0.2 blocks per game. He shot 0.445 from the field, 0.398 from 3-point range, and 0.907 from the free throw line, playing an average of 35.9 minutes per game. In the 2008–09 season, Ray Allen played for Boston in 79 games. He averaged 18.2 points, 3.5 rebounds, 2.8 assists, 0.9 steals, and 0.2 blocks per game. He shot 0.48 from the field, 0.409 from 3-point range, and 0.952 from the free throw line, playing an average of 36.4 minutes per game. In the 2009–10 season, Ray Allen played for Boston in 80 games. He averaged 16.3 points, 3.2 rebounds, 2.6 assists, 0.8 steals, and 0.3 blocks per game. He shot 0.477 from the field, 0.363 from 3-point range, and 0.913 from the free throw line, playing an average of 35.2 minutes per game. In the 2010–11 season, Ray Allen played for Boston in 80 games. He averaged 16.5 points, 3.4 rebounds, 2.7 assists, 1.0 steals, and 0.2 blocks per game. He shot 0.491 from the field, 0.444 from 3-point range, and 0.881 from the free throw line, playing an average of 36.1 minutes per game. In the 2011–12 season, Ray Allen played for Boston in 46 games. He averaged 14.2 points, 3.1 rebounds, 2.4 assists, 1.1 steals, and 0.2 blocks per game. He shot 0.458 from the field, 0.453 from 3-point range, and 0.915 from the free throw line, playing an average of 34.0 minutes per game. In the 2012–13† season, Ray Allen played for Miami in 79 games. He averaged 10.9 points, 2.7 rebounds, 1.7 assists, 0.8 steals, and 0.2 blocks per game. He shot 0.449 from the field, 0.419 from 3-point range, and 0.886 from the free throw line, playing an average of 25.8 minutes per game. In the 2013–14 season, Ray Allen played for Miami in 73 games. He averaged 9.6 points, 2.8 rebounds, 2.0 assists, 0.7 steals, and 0.1 blocks per game. He shot 0.442 from the field, 0.375 from 3-point range, and 0.905 from the free throw line, playing an average of 26.5 minutes per game. In the All-Star season, Ray Allen played for All-Star in 10 games. He averaged 14.5 points, 2.6 rebounds, 2.2 assists, 1.1 steals, and 0.2 blocks per game. He shot 0.423 from the field, 0.31 from 3-point range, and 0.765 from the free throw line, playing an average of 20.1 minutes per game. In the 1999 season, Ray Allen played for Milwaukee in 3 games. He averaged 22.3 points, 7.3 rebounds, 4.3 assists, 1.0 steals, and 0.3 blocks per game. He shot 0.532 from the field, 0.474 from 3-point range, and 0.615 from the free throw line, playing an average of 40.0 minutes per game. In the 2000 season, Ray Allen played for Milwaukee in 5 games. He averaged 22.0 points, 6.6 rebounds, 2.6 assists, 1.6 steals, and 0.0 blocks per game. He shot 0.444 from the field, 0.385 from 3-point range, and 0.909 from the free throw line, playing an average of 37.2 minutes per game. In the 2001 season, Ray Allen played for Milwaukee in 18 games. He averaged 25.1 points, 4.1 rebounds, 6.0 assists, 1.3 steals, and 0.6 blocks per game. He shot 0.477 from the field, 0.479 from 3-point range, and 0.919 from the free throw line, playing an average of 42.7 minutes per game. In the 2005 season, Ray Allen played for Seattle in 11 games. He averaged 26.5 points, 4.3 rebounds, 3.9 assists, 1.3 steals, and 0.4 blocks per game. He shot 0.474 from the field, 0.378 from 3-point range, and 0.889 from the free throw line, playing an average of 39.6 minutes per game. In the 2008† season, Ray Allen played for Boston in 26‡ games. He averaged 15.6 points, 3.8 rebounds, 2.7 assists, 0.9 steals, and 0.3 blocks per game. He shot 0.428 from the field, 0.396 from 3-point range, and 0.913 from the free throw line, playing an average of 38.0 minutes per game. In the 2009 season, Ray Allen played for Boston in 14 games. He averaged 18.3 points, 3.9 rebounds, 2.6 assists, 1.1 steals, and 0.4 blocks per game. He shot 0.403 from the field, 0.35 from 3-point range, and 0.948 from the free throw line, playing an average of 40.4 minutes per game. In the 2010 season, Ray Allen played for Boston in 24 games. He averaged 16.1 points, 3.3 rebounds, 2.6 assists, 0.9 steals, and 0.1 blocks per game. He shot 0.431 from the field, 0.386 from 3-point range, and 0.863 from the free throw line, playing an average of 38.5 minutes per game. In the 2011 season, Ray Allen played for Boston in 9 games. He averaged 18.9 points, 3.8 rebounds, 2.4 assists, 1.2 steals, and 0.1 blocks per game. He shot 0.523 from the field, 0.571 from 3-point range, and 0.96 from the free throw line, playing an average of 40.1 minutes per game. In the 2012 season, Ray Allen played for Boston in 18 games. He averaged 10.7 points, 4.1 rebounds, 1.0 assists, 0.9 steals, and 0.1 blocks per game. He shot 0.395 from the field, 0.304 from 3-point range, and 0.711 from the free throw line, playing an average of 34.2 minutes per game. In the 2013† season, Ray Allen played for Miami in 23 games. He averaged 10.2 points, 2.8 rebounds, 1.3 assists, 0.5 steals, and 0.1 blocks per game. He shot 0.43 from the field, 0.406 from 3-point range, and 0.87 from the free throw line, playing an average of 24.9 minutes per game. In the 2014 season, Ray Allen played for Miami in 20 games. He averaged 9.3 points, 3.4 rebounds, 1.6 assists, 0.7 steals, and 0.2 blocks per game. He shot 0.413 from the field, 0.388 from 3-point range, and 0.919 from the free throw line, playing an average of 26.4 minutes per game."", 'NBA / Jr. WNBA program and was selected as NBA Spokesman for the Thurgood Marshall College Fund. He also started the ""Ray of Hope"" Foundation to assist charities in several communities. Former President Obama appointed Allen to the United States Holocaust Memorial Council. Allen is a longtime supporter of the Holocaust Memorial Museum and has brought teammates and friends to the museum on frequent visits. In August 2017, he penned a first-person article for ""The Players\' Tribune"", entitled Why I Went to Auschwitz. On November 21, 2017, Allen said in a court filing that he was the victim of ""catfishing"" by a man who posed online as several different women. In an emergency motion, Allen was responding to a claim made by the man, Bryant Coleman, that he was being stalked by Allen. Allen\'s autobiography, From the Outside, was released on March 27, 2018. On July 18, 2021, Allen suffered injuries in a serious bicycle crash, and he credited his bicycle helmet with effectively saving his life. On August 20, 2021, Allen accepted a position as director of boys\' and girls\' basketball and boys\' varsity basketball head coach at Gulliver Preparatory School. In the spring of 2023, Allen received a bachelor\'s degree in General Studies from the University of Connecticut. = = Regular season Playoffs 2× NBA champion: 2008, 2013 3× Gold medalist as member of the USA men\'s basketball team: 1995 Summer Universiade, 2000 Summer Olympics & 2003 FIBA Americas Championship 10× NBA All-Star: 2000–2002, 2004–2009, 2011 All-NBA Second Team: 2005 All-NBA Third Team: 2001 NBA All-Rookie Second Team: 1997 NBA Joe Dumars NBA Sportsmanship Award: 2003 The Sporting News ""Good Guy"": 2000, 2001, 2005 NBA All-Star Weekend Three-point Shootout champion: 2001 USA Basketball Male Athlete of the Year (1995) = 3-point field goal attempts, career: 7,429 = 3-point field goals attempted, game: 18, Boston Celtics at Chicago Bulls, April 30, 2009 (3 OT) Tied with Stephen Curry (April 23, 2015), Damian Lillard (May 9, 2016), Klay Thompson (May 28, 2016), and Russell Westbrook (April 25, 2017) = 3-point field goals made, half: 7, first half, Boston Celtics at Los Angeles Lakers, June 6, 2010 3-point field goals made, quarter: 5, second quarter, Boston Celtics at Los Angeles Lakers, June 6, 2010 Tied with Stephen Curry (June 3, 2018) = Consecutive games played: 400, from 11/1/96 to 12/20/01 3-point field goals made, career: 1,051 3-point field goals made, season: 229 (2001–02) 3-point field goals made, game: 10, vs. Charlotte Hornets, April 14, 2002 3-point field goals made, half: 8, second half, vs.', ""On February 19, 2014, Terry was traded, along with Reggie Evans, to the Sacramento Kings in exchange for Marcus Thornton. It was later announced that due to a lingering knee injury, Terry wouldn't join the team in 2013–14; instead he rehabilitated the injury in Dallas to prepare for 2014–15. He did not appear in a game for the Kings during his time with the organization. = On September 17, 2014, Terry was traded, along with two future second-round picks, to the Houston Rockets in exchange for Alonzo Gee and Scotty Hopson. On December 22, 2014, in a 110–95 win over the Portland Trail Blazers, Terry hit a 3-pointer in the third quarter to become the third player in NBA history to make 2,000 three-pointers, joining Ray Allen and Reggie Miller. On August 24, 2015, Terry re-signed with the Rockets."", 'The Celtics went on to lose in seven games as they failed to defend their title. 2009–2012: finals upset and 3-point record On December 10, 2009, Allen scored 18 points to reach the 20,000 point total for his career. On June 6, 2010, in Game 2 of the 2010 NBA Finals in a 103–94 victory against the Los Angeles Lakers, Allen set a then record for most three-pointers made in an NBA Finals game on 8–11 shooting to tie the series 1–1. He broke Michael Jordan\'s record of six three-pointers in one half by hitting seven in the first half and had tied Scottie Pippen and Kenny Smith\'s record for most three-pointers in one game in the NBA Finals by half time. Allen also became the first player in NBA history to have two separate games of scoring at least seven three-pointers in the NBA Finals. The Celtics would win two of three games in Boston, before losing the last two games and the series in Los Angeles. After becoming a free agent on July 1, 2010, Allen re-signed a two-year deal with the Boston Celtics on July 7 worth $20 million. During a game against the Los Angeles Lakers on February 10, 2011, Allen became the all-time NBA leader in total three-pointers made (2,562), surpassing Reggie Miller\'s record of 2,560. The 35-year-old shooting guard finished the game with 20 points but the Celtics eventually lost 92–86. In the 2010–11 NBA season Allen was named to his tenth All-Star game alongside teammates Rajon Rondo, Paul Pierce and Kevin Garnett. Also during All-Star Weekend, Allen competed in the Three-Point Shootout, but lost to James Jones of the Miami Heat. During the 2011–12 NBA season, Allen was privately frustrated with trade rumors in February, issues with teammate Rajon Rondo, and an ankle injury that ultimately required surgery in June 2012 to remove bone spurs. The Celtics lost in seven games to the Miami Heat in the 2012 Eastern Conference finals. = 2012–2013: second championship Allen\'s initial plan in the summer of 2012 was to stay with the Boston Celtics. He was reportedly seeking a three-year, $24 million contract whereas the Celtics were offering a two-year, $12 million deal. Further internal discord with a bench role and a Rondo-focused approach led to Allen rejecting the Celtics and instead choosing to sign a two-year, $6 million deal with the Miami Heat. The Heat were limited to their mid-level exception amount of slightly more than $3 million per season. During Allen\'s first season with the Miami Heat, he averaged 10.9 points per game and made 88.6% of his free throws while playing an average of 25.8 minutes per game. On April 25, 2013, while playing Milwaukee in Game 3 of the first round of the playoffs, Allen made his 322nd career three-pointer in the playoffs, which broke Reggie Miller\'s record for most three-pointers made in NBA playoff history. Allen returned to his favorite #34 jersey upon joining the Heat. In Game 6 of the NBA Finals against the San Antonio Spurs, as the Heat trailed by three points, Allen made a game-tying 3-pointer with 5.2 seconds left in the fourth quarter to force overtime. Having rallied from a 10-point deficit at the end of the third quarter, the Heat won in overtime 103–100 over the San Antonio Spurs and forced a seventh game in the series. With the Heat leading 101–100, Allen stole the ball from Manu Ginóbili under the Spurs\' basket and drew a foul with 1.9 seconds remaining in the overtime period. Allen made both ensuing free throws to put Miami up 103–100. Allen played 41 minutes in Game 6 off the bench and scored 9 points on 3-for-8 field goal shooting; his game-tying three-pointer was the only three-pointer he made in three attempts. Allen also had one defensive rebound and two assists. In Game 7, which the Heat won 95–88 to win its second consecutive championship, Allen played 20 minutes off the bench. Although he made none of 4 field goal attempts and had 3 turnovers, Allen recorded 4 defensive rebounds and 4 assists. 2013–2014: final playing year On June 29, 2013, Allen picked up his $3.23 million player option to stay with the Heat through the 2013–14 NBA season. During the regular season, Allen played in 73 games, starting 9 of them, averaging 9.6 points and shooting 37 percent from three-point range. In the playoffs, Allen scored 19 points on 4–7 three-point shooting in game 4 of the conference semifinals against the Brooklyn Nets. Then in Game 3 against the Indiana Pacers in an Eastern Conference finals rematch, Allen hit four 3-point shots in the fourth quarter and put them up 2–1 in the series. The Heat won the series in six games to advance to the NBA Finals for the fourth straight year and Allen\'s second. The Heat faced the Spurs again in the 2014 NBA Finals, but they lost the series in five games. = Allen became a free agent in the 2014 off-season, and after much anticipation of a return at some point during the 2014–15 season, he announced his decision to sit out the season and focus on 2015–16. However, he did not end up joining a team. In July 2016, Allen began mulling a comeback, and admitted he was ""intrigued"" by the possibility of competing for another championship. The following month, Allen had talks with the Boston Celtics and the Milwaukee Bucks regarding a possible return, but ultimately decided to officially retire on November 1, 2016. In September 2018, Allen was inducted into the Naismith Memorial Basketball Hall of Fame. In February 2019, Allen played in the NBA All-Star Celebrity Game. In October 2021, Allen was honored as one of the league\'s greatest players of all time by being named to the NBA\'s 75th Anniversary Team. He was also named in the top 75 players by The Athletic. In 1998, Allen co-starred alongside Denzel Washington in the Spike Lee film He Got Game as high school basketball phenomenon Jesus Shuttlesworth. Roger Ebert praised his performance and said Allen ""is that rarity: an athlete who can act,"" while New York magazine described him as ""graceful and fast in the basketball scenes"" while giving ""a somberly effective minimalist performance."" His role as Jesus Shuttlesworth earned him that name as a nickname from teammates and fans. Allen also appeared as Marcus Blake in the 2001 film Harvard Man.', 'Allan Nathaniel Ray (born June 17, 1984) is an American sports agent and former professional basketball player. He played college basketball for four years at Villanova University.', 'For that year, he averaged 16.5 points and finished third in the voting for Rookie of the Year honors. In his second season, he raised his scoring average to 19.5 points per game. In the 2000–01 season, Pierce appeared in 82 games (all starts), averaging 25.3 points, 6.4 rebounds, 3.1 assists and 1.68 steals in 38.0 minutes. He led the Celtics and finished eighth in the league in points per game and fourth in total points (2,071). He was named NBA Player of the Month for March 2001 after averaging 30.3 points, 7.2 rebounds, 3.4 assists, and 1.60 steals for the month. First All-Star and playoff appearances (2001–2007) In the 2001–02 season, Pierce was named Eastern Conference Co-Player of the Month twice, for December and April. That season, Pierce led the Celtics to the playoffs for the first time in seven years and on to the Eastern Conference Finals. In Game 3 of the conference finals, the Celtics pulled off the largest fourth-quarter comeback in NBA playoff history, with Pierce scoring 19 of his 28 points in the final 12 minutes as Boston overcame a 21-point deficit to beat the New Jersey Nets 94–90. The win gave the Celtics a 2–1 advantage in the series; however, the Nets went on to win the series in six games. From 2002 to 2006, Pierce made the All-Star team every season. He led the league in total points (2,144) in 2002 and was an All-NBA Third Team selection in 2002 and 2003. In the 2007 offseason, Pierce requested a trade to the Dallas Mavericks, and stated that he would publicly demand a trade unless the Celtics acquired a co-star for him. A three-team trade between the Celtics, Mavericks, and the Atlanta Hawks was nearly completed, but Atlanta canceled the trade upon learning that Boston would receive a first-round pick. Instead, the Celtics decided to fulfill Pierce\'s request for a co-star. NBA champion and Finals MVP (2007–2008) Prior to the 2007–08 season, the Celtics acquired the services of fellow NBA All-Stars Ray Allen and Kevin Garnett. The pair combined with Pierce to form a ""Big Three"". The Celtics completed the largest single-season turnaround in NBA history, with the ""Big Three"" leading Boston to 66 wins in the regular season, a 42-game improvement. However, the team struggled initially in the playoffs.', ""Upon joining the Celtics, Allen changed his jersey to number 20 because Paul Pierce already had number 34 in Boston. On November 4, 2007, Allen passed 17,000 points for his career with his first of two 3-pointers in overtime in a 98–95 victory against the Toronto Raptors, in which he sank the game winning 3-pointer with three seconds remaining in overtime. On February 13, 2008, Allen was named as the replacement for injured East All-Star Caron Butler of the Washington Wizards, who was out with a left hip flexor strain, for the 2008 NBA All-Star Game in New Orleans. While LeBron James was given the All-Star MVP Award, many analysts, including the TNT commentators of the game, felt it should have gone to Allen, who scored 14 points in a stretch of 2 minutes and 30 seconds in the fourth quarter to seal the win for the East team. On March 28, 2008, Allen was honored as the 3rd best of the 20 greatest players in franchise history during Milwaukee's 40th Anniversary Team Celebration, but could not attend the festivities because of the Celtics' game against the New Orleans Hornets. The Boston Celtics finished 66–16, and were the #1 seed in the 2008 NBA Playoffs."", 'He was raised by his mother and maternal grandmother. By age three, he was a participant in the Hammond, Indiana YMCA children\'s basketball league. At age 5 he played in a Boys & Girls Clubs of America basketball league. Growing up, Robinson had special NBA experiences. On January 2, 1998, when his father and Michael Jordan each scored 44 points against each other at the United Center, he and his brother Gelen were in the front row. When his father played for the Milwaukee Bucks, Robinson remembers being kicked off the court by head coach George Karl. During a meeting in the Philadelphia 76ers locker room with Allen Iverson, Iverson referred to him as ""Shorty"", and the younger Robinson noted that he was as tall as Iverson, saying ""Man, I’m your height right now! Who are you calling shorty?"" Robinson attended Grimmer Middle School in Schererville, Indiana prior to attending Lake Central High School in St. John, Indiana.', 'Some of his family members sold crack cocaine, and his father left his family at age 10. He attended public school in his youth but attended Episcopal Academy for high school. He became one of the top high school basketball players in the country at Episcopal, receiving scholarship offers at 16 schools. He chose to attend Penn to study accounting at the Wharton School; he had planned on being an accountant in his youth. Allen was a four-year starter at Penn alongside future NBA players Matt Maloney and Ira Bowman. Allen and the Quakers were undefeated from his freshman season to his junior season in the Ivy League. The team\'s 48-game conference winning streak is the best in Ivy League history. He averaged 13.7 points per game in his career for Penn. = Allen was selected 49th overall (2nd round, pick 20) by the Minnesota Timberwolves in the 1995 NBA draft. Until Miye Oni was selected in 2019, Allen was the most recent Ivy League player to be drafted to the NBA. He played 41 games for the Timberwolves, averaging 2.6 points per game in 8.8 minutes per game. = Allen signed with the Indiana Pacers for the 1996 NBA season. He played 51 games, averaging about 3 points in 14 minutes per game. He did not finish the season with the Pacers. = Allen signed with the Denver Nuggets and played 25 games to finish the 1996 NBA season. = Allen also spent time in France, Italy (with Lottomatica Roma, Carpisa Napoli and Snaidero Udine), Greece, Spain and Turkey. = In 2009, he became an assistant coach for the University of Pennsylvania\'s men\'s basketball team. On December 14, 2009, Allen was named interim head coach of the Penn men\'s basketball team after the firing of Glen Miller. On March 31, 2010, he was announced as the new permanent head coach of the Penn Men\'s Basketball team. He resigned his position as head coach effective on March 10, 2015. = Allen joined the Boston Celtics in 2015 under head coach Brad Stevens. Allen was one of Boston\'s longer-tenured assistants and was with the team for all but two seasons of the Brad Stevens era. = In summer 2021, Allen announced he was leaving the Celtics\' coaching staff to join Dwane Casey in Detroit. In October 2018, Allen pleaded guilty to accepting an $18,000 bribe in 2014 while the head coach at Penn to help a student get on the recruiting list in order to get accepted to the university. He was ordered to pay back $18,000 in addition to a $200,000 fine. He would testify on behalf of the federal government against the man he said had bribed him – Phillip Esformes. During Esformes\'s trial, Allen testified that he had received about $300,000 in bribes from Esformes, and that the student in question was Esformes\'s son. On February 26, 2020, the NCAA announced penalties against Allen and the Penn men\'s basketball program stemming from the bribes. The program was placed on two years\' probation but did not receive a postseason ban. Allen received a 15-year show-cause penalty from the NCAA, effective until February 20, 2035. It is the longest ever handed down to a (former) head coach. During this period, any school that hires Allen must ""show cause"" for why it should not be sanctioned for doing so. In an unusual move, if Allen gets a head coaching job after the show-cause expires, he must sit out the first half of the first season of his return. It is very difficult for a head coach to return to the collegiate ranks even after a show-cause expires, since many presidents and athletic directors are extremely reluctant to hire someone with a show-cause on his record. Only four coaches have ever worked in college basketball again after receiving a show-cause. Career statistics from NBA.com · Basketball Reference coach|Boston Celtics\n\n', 'Overall, their record was 28–5. In 2006, Ray was named to the Big East first team, along with teammate Randy Foye, who was given the honor of Big East Player of the Year. Ray led Villanova to the Elite Eight of the 2006 NCAA tournament, playing in a four-guard offense with Foye, Kyle Lowry and Mike Nardi. = During the 2006 Big East tournament, Ray was poked in the eye by Carl Krauser during the semifinal game against Pittsburgh. His vision apparently left him for a period of time and his eyeball had seemed to come loose from the socket, leading most to believe it was an extremely serious injury. However, his vision returned and it turned out to be only soft tissue damage. He was able to play less than a week later in the NCAA tournament, without goggles. In his first game back, he led Villanova in scoring. While on the video it appeared as though his eye came loose from the socket, his eyelid actually went behind his eye, giving off the impression of his eye coming loose. Ray was not selected in the 2006 NBA draft, surprising many Big East fans and some NBA experts. On July 6, 2006, he was signed as a free agent by the Boston Celtics. Ray was sent to the D-League Austin Toros, but was recalled after just two games there. He led the Toros in scoring in both games he played for them. During the last two months of the season, Ray began receiving extended playing time with the Celtics, and had two 22-point games and three others where he scored 20, 18 and 17 points. Ray was also fourth among rookies in three-point percentage. Despite a seemingly bright future in Boston, Ray agreed to terms on a $2 million contract to play in Italy, instead of having the Celtics pick up his $687,456 option. Ray signed with the Euroleague club Lottomatica Virtus Roma on July 27, 2007. Midway through the following season, after the club signed Brandon Jennings (whom Ray served as a mentor to), Ray left to sign a contract with Carife Ferrara for the remaining part of the season. After sitting out the 2009–10 season to recover from knee surgery, Ray signed with Sutor Montegranaro for the 2010–11 season. In November 2011 he signed a temporary contract with BC Krka in Slovenia, but in December 2011 he signed a new contract with Élan Béarnais Pau-Orthez in France. In August 2012, he moved to Germany and signed with ratiopharm Ulm for the 2012–13 season. In November 2013, he signed with the Croatian team Cedevita Zagreb for the rest of the 2013–14 season. On July 30, 2014, he signed with Virtus Bologna for the 2014–15 season. On March 11, 2015, he signed a two-year contract extension with Virtus. On March 31, 2016, he parted ways with Virtus. In 2015–16 season, he played only six games due to an injury. On October 30, 2016, he signed with Amici Pallacanestro Udinese of the Italian Serie A2 Basket. On March 30, 2017, he parted ways with Udinese. On April 3, 2017, he signed with Turkish club TED Ankara Kolejliler for the rest of the 2016–17 BSL season. On December 4, 2017, Ray signed with Byblos Club of the Lebanese Basketball League. = Career statistics from NBA.com · Basketball Reference Profile at euroleague.com Profile Archived January 27, 2019, at the Wayback Machine at legabasket.it (in Italian)\n\nIn the 2006–07 season, Allan Ray played for Boston in 47 games. He averaged 6.2 points, 1.5 rebounds, 0.9 assists, 0.4 steals, and 0.1 blocks per game.', 'Redd lives in New Albany, Ohio. Rapper Nelly name-dropped Redd along with fellow NBA players Magic Johnson, Kareem Abdul-Jabbar, Shaquille O\'Neal, and Allen Iverson—as well as NFL players Julius Peppers, Ray Lewis, and Peyton Manning—in the song ""Heart of a Champion,"" the first track on 2004 album Sweat. Early in the song\'s second verse, Nelly says: ""...', 'Jarrett Allen (born April 21, 1998) is an American professional basketball player for the Cleveland Cavaliers of the National Basketball Association (NBA). He played college basketball for the Texas Longhorns and was selected 22nd overall by the Brooklyn Nets in the 2017 NBA draft. In January 2021, he was traded to the Cleveland Cavaliers as part of the four-team blockbuster James Harden trade. In February 2022, Allen was named to his first NBA All-Star Game. Allen attended Walsh Middle School in Round Rock Texas, which feeds into Round Rock High School in Round Rock, Texas for his freshman year of high school.', 'and Flora Allen. A military child, he spent time growing up in Saxmundham, Suffolk, England, in Altus, Oklahoma, at Edwards Air Force Base in California, and in Germany. After years of traveling and frequent moves, his family settled in Dalzell, South Carolina, for four years, where he would attend high school. When he first arrived, the young Allen was often the odd-man-out, picked on by other kids for the accent acquired during his formative years in Britain. Allen\'s athletic gifts and work ethic allowed him to excel in sports. When a growth spurt left him with a natural advantage in basketball, he decided to dedicate his free time to becoming the best basketball player he possibly could. Fueled by his desire to become the top player on his military base, Allen practiced at length daily, so long as it did not interfere with his studies. By the age of fifteen, he was playing for Hillcrest High School\'s varsity team, and would eventually lead them to their first state championship. Allen scored 25 points and notched 12 rebounds in a blowout victory for Hillcrest Wildcats. At Hillcrest, he was teammates with future Major League Baseball player Terrell Wade. He drew much attention from college recruiters, especially from the University of Kentucky, but ultimately accepted an offer from the University of Connecticut. Allen attended the University of Connecticut from 1993 to 1996. As a freshman with the Huskies in 1993–94, Allen came off the bench in 34 games he played, averaging 12.6 points, 4.6 rebounds, 1.4 assists and 1.1 steals in 21.6 minutes per game. He was subsequently named to the Big East All-Freshman Team. As a sophomore in 1994–95, Allen played 32 games with 31 starts, averaging 21.1 points, 6.8 rebounds, 2.3 assists and 1.9 steals in 32.8 minutes per game. He was named first-team All-Big East. As a junior in 1995–96, Allen started all 35 games and averaged 23.4 points, 6.5 rebounds, 3.3 assists and 1.7 steals in 34.7 minutes per game. He was named the Big East Player of the Year and earned first-team All-Big East. The Huskies won their third consecutive Big East Conference regular season title and played in their third consecutive NCAA Tournament. Allen declared for the 1996 NBA draft. As of 2018, his 1,922 point total ranked fifth all-time, his 19.0 career average was fourth, his 44.8 three-point field goal percentage was first, and the 818 points he scored as a junior was the third-highest season total in UConn history. In January 2001, Allen was named honorary captain of the 25-member UConn All-Century Basketball Team. In February 2007, he was an inaugural inductee in the UConn men\'s basketball ""Huskies of Honor"" recognition program. In March 2019, his number 34 jersey was retired by UConn. In May 2023, Allen graduated from UConn with a Bachelor\'s Degree in General Studies. = 1996–1999: early years in Milwaukee Allen was drafted by the Minnesota Timberwolves with the fifth pick of the 1996 NBA draft. Immediately after his selection, Allen and Andrew Lang were traded to the Milwaukee Bucks for the rights to fourth pick Stephon Marbury. On July 24, 1996, Allen signed a 3-year, $6.2 million contract with the Bucks. Allen made his NBA debut on November 1, 1996, where he started and played 28 minutes and scored 13 points in a win against fellow rookie Allen Iverson and the Philadelphia 76ers. On January 12, 1997, Allen put in one of his strongest efforts of the season in a win against the Golden State Warriors, contributing 22 points, 6 assists, 3 steals and a new career high of 9 rebounds. In February 1997, Allen competed in the Slam Dunk Contest during All-Star Weekend, where he finished fourth. Continuing his strong rookie season, on March 25, 1997, Allen scored a new career high of 32 points in a loss to the Phoenix Suns. Allen was named to the NBA All-Rookie Second Team. In the 1997–98 season, Allen played and started all 82 games for the Bucks. In the season opener, he put up 29 points, including 6 three-pointers in a win against the 76ers. On December 20, 1997, Allen set a new career high of 35 points against the New York Knicks. On the brink of missing the playoffs for the second straight year, on April 18, 1998, the last game of the regular season, Allen tallied a 40-point double-double with 10 rebounds. 1999–2003: building his legacy On February 10, 1999, following the 1998–99 NBA lockout, Allen signed a six-year, $70.9 million extension with the Bucks, making him the highest paid player in franchise history at that point. The 1998–99 season saw Allen make his first playoff appearance, with the Bucks earning the seventh seed. There they were swept by the Indiana Pacers in the first round despite Allen averaging 22.3 points per game. The following season, on January 20, 2000, Allen recorded a career-high 13 assists in a loss to the Seattle SuperSonics. On February 3, 2000, Allen scored 36 points and grabbed 8 rebounds in a 102–99 win against the Utah Jazz. A month later, Allen played in his first All-Star Game, where he had 14 points in 17 minutes. During the 1999–2000 season, Allen led the Bucks in scoring during the regular and post-season. On February 7, 2001, Allen recorded his first career triple-double with 20 points, 10 rebounds and 11 assists against the Boston Celtics. A few days later, he participated and won his first 3-point shootout during All-Star Weekend. Allen, alongside Sam Cassell and Glenn Robinson, helped lead the Bucks to the Eastern Conference finals. Allen recorded a new playoff career high with 41 points in a Game 6 victory over the 76ers, but the Bucks ultimately lost in seven games. Allen earned All-NBA Third Team honors in 2001. = Allen remained with the Bucks midway through the 2002–03 season, when he was dealt to the Seattle SuperSonics, along with Ronald Murray, former UConn teammate Kevin Ollie, and a conditional first round draft pick, in exchange for Gary Payton and Desmond Mason. It was speculated that Allen\'s contentious relationship with coach George Karl played a role in the Bucks\' willingness to part with Allen. After an injury-riddled 2003–04 season, Allen was named to the All-NBA Second Team in the 2004–05 season and, alongside teammate Rashard Lewis, led the Sonics to the 2005 Conference semifinals. In July 2005, Allen signed a five-year, $85 million contract with the SuperSonics. On March 12, 2006, Allen became the 97th player in NBA history to score 15,000 points. On April 7, 2006, Allen moved into second place on the NBA\'s list of all-time 3-point field goals made, trailing only Reggie Miller. On April 19, 2006, Allen broke Dennis Scott\'s ten-year-old NBA record for 3-point field goals made in a season in a game against the Denver Nuggets. The record was broken by Stephen Curry. In the 2006–07 regular season, Allen averaged a career-high 26.4 points per game while adding 4.5 rebounds and 4.1 assists per game. On January 12, 2007, he scored a career-high 54 points against the Utah Jazz in a 122–114 overtime win, the second most in Sonics history. Shortly after, he had ankle surgery on both ankles and missed the remainder of the 2006–07 season. = 2007–2009: first championship On June 28, 2007, the Sonics traded Allen and Glen Davis, the 35th overall pick in the 2007 NBA draft, to the Celtics in exchange for Delonte West, Wally Szczerbiak, and the fifth overall pick, Jeff Green. Shortly after acquiring Allen, the Celtics acquired Minnesota Timberwolves forward Kevin Garnett to play alongside Allen and Paul Pierce.', 'Tony Allen may refer to: Tony Allen (musician) (1940–2020), Nigerian drummer with Fela Kuti and one of the founders of Afrobeat Tony Allen, member of American doo-wop group The Furys Tony Allen, Irish singer, member of Irish duo Foster and Allen with Mick Foster Tony Allen, recording alias of J.W. Hodkinson (1942–2013), English rock singer Tony Allen (footballer) (1939–2022), English footballer Tony Allen (basketball) (born 1982), American former basketball player Tony Allen (comedian) (1945–2023), English comedian and writer Tony Allen (academic administrator), president of the Delaware State University Tony Allan (disambiguation) Anthony Allen (disambiguation)\n\nIn the 2004–05 season, Tony Allen played for Boston in 77 games.']","In 2015, Ray Allen co-starred alongside Kyrie Irving, Baron Davis, and J.","Kyrie Irving, Baron Davis, and J.",0.5,0.9999989015855623,0.5833333333041666,1.0,0.7275420214671867,0.9101680858687468
What college did Miye Oni play basketball for?,"['On a volunteer basis, Oni and Brandon Sherrod (his fellow Connecticut CASA ambassador) participated in an awareness-raising forum recorded on YouTube and documented in an October 2020 news story. Yale Bulldogs bio NBA Draft profile Criollos de Caguas statistics\n\nIn the 2019–20 season, Miye Oni played for Utah in 10 games. He averaged 3.5 points, 1.7 rebounds, 0.4 assists, 0.4 steals, and 0.2 blocks per game. He shot 0.375 from the field, 0.368 from 3-point range, and 0.8 from the free throw line, playing an average of 10.9 minutes per game. In the 2020–21 season, Miye Oni played for Utah in 54 games. He averaged 1.9 points, 1.6 rebounds, 0.5 assists, 0.2 steals, and 0.1 blocks per game. He shot 0.354 from the field, 0.341 from 3-point range, and 0.833 from the free throw line, playing an average of 9.6 minutes per game. In the 2021–22 season, Miye Oni played for Utah in 16 games. He averaged 0.3 points, 0.4 rebounds, 0.3 assists, 0.0 steals, and 0.0 blocks per game. He shot 0.222 from the field, 0.125 from 3-point range, and 0.0 from the free throw line, playing an average of 2.8 minutes per game. In the 2020 season, Miye Oni played for Utah in 2 games. He averaged 3.5 points, 2.0 rebounds, 0.0 assists, 0.5 steals, and 0.5 blocks per game. He shot 0.5 from the field, 0.25 from 3-point range, and — from the free throw line, playing an average of 7.0 minutes per game. In the 2021 season, Miye Oni played for Utah in 8 games. He averaged 0.0 points, 0.4 rebounds, 0.0 assists, 0.1 steals, and 0.0 blocks per game. He shot 0.0 from the field, 0.0 from 3-point range, and — from the free throw line, playing an average of 5.1 minutes per game. In the 2016–17 season, Miye Oni played for Yale in 29 games. He averaged 12.9 points, 6.3 rebounds, 2.7 assists, 0.7 steals, and 1.1 blocks per game. He shot 0.441 from the field, 0.396 from 3-point range, and 0.784 from the free throw line, playing an average of 31.2 minutes per game. In the 2017–18 season, Miye Oni played for Yale in 29 games. He averaged 15.1 points, 6.0 rebounds, 3.6 assists, 0.9 steals, and 0.8 blocks per game. He shot 0.405 from the field, 0.31 from 3-point range, and 0.75 from the free throw line, playing an average of 32.8 minutes per game. In the 2018–19 season, Miye Oni played for Yale in 29 games. He averaged 17.1 points, 6.3 rebounds, 3.6 assists, 0.9 steals, and 1.3 blocks per game.', 'Olumiye Dimolu ""Miye"" Oni (born August 4, 1997) is an American-Nigerian professional basketball player for Criollos de Caguas of the BSN in Puerto Rico. He played college basketball for the Yale Bulldogs.', 'On November 2, he joined the Osceola Magic. On September 6, 2024, Oni signed with the Memphis Grizzlies, but was waived on October 19. = On December 16, 2024, Oni signed with Joventut Badalona of the Liga ACB. On March 6, 2025, Oni reached an agreement with the club to conclude the contract for personal reasons. = On March 17, 2025, Oni made his debut with Criollos de Caguas in the BSN professional league in Puerto Rico. On April 21, 2025, Oni had 33 points with 6 3PT, 7 rebounds, 7 assists in a win. Oni was eligible to play for the Nigeria men\'s national basketball team at the 2020 Summer Olympics in Tokyo due to his mother being born there. He saw significant minutes and made the go-ahead three point field goal when Nigeria upset the United States men\'s national basketball team in an exhibition game prior to the start of the Games. Oni then appeared in all three games in Tokyo, starting two of the three and averaging 21.8 minutes which was second on the team. Against Germany, he was 5-of-6 from three-point range and finished with 15 points. = Regular season Playoffs = At Yale University, Oni was a major in political science. He has been praised for his academic performance, with Yale assistant basketball coach Justin Simon saying, ""To maintain his grades at the level he has—the guys respect his work ethic."" After being drafted, Yale allowed him to complete his degree. = Miye Oni is one of two inaugural ambassadors for Connecticut CASA, part of the national CASA network for children who have experienced abuse or neglect. He was also involved with Utah CASA.', ""He plays the shooting guard position. Oni was named Ivy League Player of the Year in 2019 and was a three-time All-Ivy League selection. Oni, who is of Nigerian descent, grew up in Northridge, Los Angeles and began playing high school basketball at Viewpoint School, where he was named the divisional player of the year. He was lightly recruited at Viewpoint and committed to Williams College of the NCAA Division III. After drawing more interest as a senior at Viewpoint, he committed to Yale, but admissions rules forced him to play an additional season of prep basketball at Suffield Academy before college. Oni was born to Nigerian parents Opeyemi and Oludotun Oni. His father is a professor at the University of Phoenix and an engineer. Oni began playing basketball at age two with a toy hoop and joined a YMCA league with his older sister at age five. From a young age, he had aspirations to play in the National Basketball Association (NBA) and admired Kobe Bryant of the Los Angeles Lakers. In addition to basketball, he played football, mainly as a safety and wide receiver, and baseball. Oni began his freshman year at Sierra Canyon School in Chatsworth, California, but transferred to enroll and play basketball at Viewpoint School in Calabasas, California before the season started. He played for the junior varsity team in his freshman season, when he stood 5 feet 9 inches (1.75 m) and weighed 140 pounds (64 kg). He did not play on the school's basketball team as a sophomore to focus on his education. As a junior, Oni suffered a knee injury that sidelined him for most of the season. The injury hindered his college recruiting because he did not have film to show college coaches before his senior year. Oni stood 6 feet 4 inches (1.93 m) and weighed 180 pounds (82 kg) by the time he was a senior. He had a breakout final season for Viewpoint, averaging 18 points, 9 rebounds, and 4 assists and being named California Interscholastic Federation (CIF) Division 5AA player of the year. At Viewpoint, Oni did not draw interest from NCAA Division I basketball programs and was only recruited by Division III school Williams College, where he committed in the fall of his senior year of high school. However, Williams did not offer enough financial aid for his family to meet the cost of attendance. During his senior season at Viewpoint, Oni attracted attention from Yale assistant coach Matt Kingsley. After watching his highlight video in the spring of 2015, Yale head coach James Jones offered him, and Oni committed to play for the team on July 1, 2015. However, since Yale admissions were closed, he spent his next season playing for Suffield Academy, a prep school in Suffield, Connecticut, located near Yale University. With Suffield, Oni averaged 17 points, 6 rebounds and 5 assists and earned New England Preparatory School Athletic Council (NEPSAC) Class A player of the year distinction. On February 5, 2016, he scored 52 points with 11 three-pointers versus Wilbraham & Monson Academy at the National Prep School Invitational, breaking his school record and Shabazz Napier's tournament record. Oni was named most outstanding player of the event."", 'He was a nominee for the 2016 McDonald\'s All-American Boys Game. = Oni made his debut for Yale on November 13, 2016, recording a team-high 24 points, 6 rebounds, and 3 assists in a 98–90 upset win over Washington. In his next game, he posted 13 points, 10 rebounds, and a season-best 5 blocks in an 89–81 victory over Lehigh. Oni claimed Ivy League Rookie of the Week honors in each of his first three weeks with Yale. On February 25, 2017, he scored a season-high 27 points while chipping in 7 rebounds and 4 assists, in a 99–86 win over Dartmouth. By the end of the season, Oni was averaging 12.9 points, 6.3 rebounds, and 2.7 assists per game. He earned second-team All-Ivy League recognition and was named conference Rookie of the Week on five occasions during the season. = Entering the 2017–18 season, the Hartford Courant speculated that the Yale duo of Oni and Makai Mason could be ""one of the top backcourts in the country."" On November 14, 2017, his third appearance in his sophomore season, he led all scorers with 20 points in an 86–54 victory over South Carolina State. Oni erupted for 26 points, his best mark in the season, and recorded team-highs of 7 rebounds and 4 assists on November 25, in a 79–73 loss to Vermont. On February 24, 2018, he flirted with a triple-double in an 83–73 win over Columbia, matching his season-high of 26 points while leading his team with 9 rebounds and 8 assists. Through 29 games, Oni averaged 15.1 points, 6.0 rebounds, and 3.6 assists per game, leading Yale in all three categories. He tied the school record for three-pointers attempted in a single season, with 184. Oni was a three-time Ivy League Player of the Week, unanimous first-team All-Ivy League pick, and National Association of Basketball Coaches (NABC) District 13 second-team selection. = Oni made his junior season debut on November 9, 2018, scoring 16 points in a 76–59 win over California at the Pac-12 China Game held in Shanghai. On November 21, he posted his first double-double of the season, leading his team with 18 points and 10 rebounds in a 79–70 loss to Vermont. On December 1, Oni scored 29 points and was named game MVP in a 77–73 victory over Miami (Florida) at the Hoophall Miami Invitational. He erupted for 31 points, 9 rebounds, and 4 assists, leading his team in each category, on February 2, 2019, in an 89–68 win over Dartmouth. Oni was the first Yale player to record a 30-point game since Anthony Dallier in 2017. In his next game, a 74–60 victory over Princeton, he posted a career-high 35 points, 12 rebounds, and 3 blocks. Oni scored the most single-game points in school history since Greg Mangano in 2012. He delivered another strong performance on March 1, when he scored 30 points—shooting 9-of-11 from the field—to help Yale defeat Cornell, 88–65, and clinch a spot in the 2019 Ivy league tournament. By the end of the regular season, Oni was averaging a team-best 17.4 points, 6.3 rebounds, and 3.6 assists per game. He was named Ivy League Player of the Year, becoming the third Yale player to win the award. In his junior season, Oni frequently attracted attention from NBA scouts, who visited all of his games to see him play. He was considered a top-50 prospect for the 2019 NBA draft and became the first Ivy League player to be drafted since 1995. In December 2018, Duke head coach Mike Krzyzewski predicted that he would be a first-round pick. = On June 20, 2019, Oni was selected as the 58th pick of the 2019 NBA draft by the Golden State Warriors. His draft rights were traded to the Utah Jazz. With the selection, Oni became the first Ivy League men\'s basketball player picked in the NBA draft since Jerome Allen in 1995 and the first Yale Bulldogs men\'s basketball player picked since Chris Dudley in 1987. On July 15, 2019, the Utah Jazz signed Oni. He was assigned to the Salt Lake City Stars for the start of the NBA G League season.', 'He scored a season-high 28 points for the Stars in a win over the Memphis Hustle on January 10, 2020. The 2019-2020 Salt Lake City Stars ended up breaking the NBA G League record for most consecutive wins with 14 and finished the season with the best record. Oni averaged 12.7 points, 6.1 rebounds, and 4 assists in all contests. Later in his rookie season, Oni began to get looked on to play for the Jazz, as injuries to Bojan Bogdanovic left a hole in the team heading into the NBA Bubble. On August 7, 2020, Oni recorded his first start and scored his NBA career high 14 points and 7 rebounds for the Jazz in a loss to the San Antonio Spurs. In his second year with the Jazz, Oni became a rotation regular, often filling in for injuries at the guard position. Oni appeared in 54 of the 72 regular season games, and the Jazz finished the season with a league best 52–20 record and the top seed in the Western Conference. Oni was called upon to play key minutes for the Jazz in the 2022 NBA Playoffs, notably matching up with Paul George of the Los Angeles Clippers. In his third season with the Jazz, new additions to the roster led to Oni falling out of the rotation. On January 4, 2022, Oni was traded to the Oklahoma City Thunder along with a 2028 second-round pick in exchange for cash considerations. Three days later, he was waived. On February 4, 2022, Oni signed a 10-day hardship contract with the New Orleans Pelicans. Oni joined the Dallas Mavericks for the 2022 NBA Summer League, = On November 16, 2022, Oni signed with London Lions of the British Basketball League. He became the 4th former NBA draft pick to sign with the Lions in 2022, joining Sam Dekker, Kosta Koufos, and Tomislav Zubčić. In their first season in the EuroCup, the Lions became the first British club in history to clinch a berth in the EuroCup Playoffs. = On October 13, 2023, Oni signed with the Orlando Magic, but was waived five days later.', 'He played college basketball for the Michigan State Spartans.', 'He played college basketball at the University of Massachusetts.', 'Some of his family members sold crack cocaine, and his father left his family at age 10. He attended public school in his youth but attended Episcopal Academy for high school. He became one of the top high school basketball players in the country at Episcopal, receiving scholarship offers at 16 schools. He chose to attend Penn to study accounting at the Wharton School; he had planned on being an accountant in his youth. Allen was a four-year starter at Penn alongside future NBA players Matt Maloney and Ira Bowman. Allen and the Quakers were undefeated from his freshman season to his junior season in the Ivy League. The team\'s 48-game conference winning streak is the best in Ivy League history. He averaged 13.7 points per game in his career for Penn. = Allen was selected 49th overall (2nd round, pick 20) by the Minnesota Timberwolves in the 1995 NBA draft. Until Miye Oni was selected in 2019, Allen was the most recent Ivy League player to be drafted to the NBA. He played 41 games for the Timberwolves, averaging 2.6 points per game in 8.8 minutes per game. = Allen signed with the Indiana Pacers for the 1996 NBA season. He played 51 games, averaging about 3 points in 14 minutes per game. He did not finish the season with the Pacers. = Allen signed with the Denver Nuggets and played 25 games to finish the 1996 NBA season. = Allen also spent time in France, Italy (with Lottomatica Roma, Carpisa Napoli and Snaidero Udine), Greece, Spain and Turkey. = In 2009, he became an assistant coach for the University of Pennsylvania\'s men\'s basketball team. On December 14, 2009, Allen was named interim head coach of the Penn men\'s basketball team after the firing of Glen Miller. On March 31, 2010, he was announced as the new permanent head coach of the Penn Men\'s Basketball team. He resigned his position as head coach effective on March 10, 2015. = Allen joined the Boston Celtics in 2015 under head coach Brad Stevens. Allen was one of Boston\'s longer-tenured assistants and was with the team for all but two seasons of the Brad Stevens era. = In summer 2021, Allen announced he was leaving the Celtics\' coaching staff to join Dwane Casey in Detroit. In October 2018, Allen pleaded guilty to accepting an $18,000 bribe in 2014 while the head coach at Penn to help a student get on the recruiting list in order to get accepted to the university. He was ordered to pay back $18,000 in addition to a $200,000 fine. He would testify on behalf of the federal government against the man he said had bribed him – Phillip Esformes. During Esformes\'s trial, Allen testified that he had received about $300,000 in bribes from Esformes, and that the student in question was Esformes\'s son. On February 26, 2020, the NCAA announced penalties against Allen and the Penn men\'s basketball program stemming from the bribes. The program was placed on two years\' probation but did not receive a postseason ban. Allen received a 15-year show-cause penalty from the NCAA, effective until February 20, 2035. It is the longest ever handed down to a (former) head coach. During this period, any school that hires Allen must ""show cause"" for why it should not be sanctioned for doing so. In an unusual move, if Allen gets a head coaching job after the show-cause expires, he must sit out the first half of the first season of his return. It is very difficult for a head coach to return to the collegiate ranks even after a show-cause expires, since many presidents and athletic directors are extremely reluctant to hire someone with a show-cause on his record. Only four coaches have ever worked in college basketball again after receiving a show-cause. Career statistics from NBA.com · Basketball Reference coach|Boston Celtics\n\n', 'He played college basketball for the California Golden Bears.', '9, also one of his only two UK hits, peaking at No. 8), ""Dynamite"" (No. 15), ""Do What You Do"" (No. 13), and ""I Think It\'s Love"" (No.', 'He played college basketball for Kentucky.', ""In 2007, he founded a title insurance agency. List of NCAA Division I men's basketball players with 20 or more assists in a game List of NCAA Division I men's basketball career assists leaders List of NCAA Division I men's basketball season assists leaders College & NBA stats @ basketball-reference.com What the Hell Happened to...Chris Corchiani? @ celticslife.com Euroleague.net Profile Italian League Profile (in Italian) Spanish League Profile (in Spanish)\n\n"", 'He played college basketball for the University of Kentucky.', 'Shaedon Sharpe ( SHAY-dən; born May 30, 2003) is a Canadian professional basketball player for the Portland Trail Blazers of the National Basketball Association (NBA). A consensus five-star recruit out of high school, Sharpe signed to play college basketball with the Kentucky Wildcats, but did not play a game before leaving for the NBA. Nicknamed ""The Abnormality,"" he was selected seventh overall in the 2022 NBA draft. Sharpe played basketball for H.']",Miye Oni played college basketball for the Yale Bulldogs.,Yale Bulldogs,1.0,0.9821259286691743,0.9999999999833333,0.2,0.714120407381014,0.8564224051723216
"In what year did AJ Green record his fourth consecutive 1,000 yard season despite missing three games and nearly all of two more due to a concussion?","[""In Week 5, against the New England Patriots, he re-aggravated his lingering toe injury and missed the following three games. In Week 14, he recorded 224 yards on 11 receptions (a 20.4 average) and one touchdown in a 42–21 loss to the Pittsburgh Steelers. Green's 224 receiving yards marked the third most the Steelers had ever given up in a game to one player. Despite missing three games and nearly all of two more, Green still recorded his fourth consecutive 1,000 yard season, finishing the year with 69 receptions for 1,041 yards and six touchdowns. However, a concussion ultimately forced him to miss the postseason for the first time in his career. He was ranked 37th by his peers on the NFL Top 100 Players of 2015. 2015 season Green was an instrumental part of the Bengals recording a franchise-record tying 12 victories in 2015. In Week 3 of the 2015 season, Green caught 10 passes for a career-high 227 yards and two fourth quarter touchdowns in a 28–24 win over the Ravens. His 227 yards were the second highest single game total in franchise history, trailing only Chad Johnson's 260 receiving yards in a 2006 game against the Chargers. In Week 8, against the Steelers, he had 11 receptions for 118 receiving yards and a touchdown in the 16–10 victory. In Week 12, against the St. Louis Rams, he recorded his second multi-touchdown game of the season. In Week 13 against the Browns and Week 14 against the Steelers, he recorded consecutive 100 yard games while catching another touchdown. He finished the 2015 season with 86 receptions, 1,297 yards, and 10 touchdowns while recording his fifth straight 1,000-yard season to start a career. He joined Randy Moss as the only players in NFL history to accomplish the feat at the time. During the Wild Card Round against the Steelers, he caught five passes for 71 yards and his first postseason touchdown, which put the Bengals up 16–15 with less than two minutes remaining. However, a late turnover and penalty by the Bengals loomed large as the Bengals lost 16–18. He earned his fifth straight Pro Bowl and was ranked 16th by his fellow players on the NFL Top 100 Players of 2016. 2016 season In the Bengals' season opener against the New York Jets, Green had 12 receptions for 180 receiving yards, including a 54-yard touchdown as the Bengals won by a score of 23–22. Green had three key receptions on the Bengals' drive to set up the late go-ahead field goal. In Week 4, he caught 10 passes for 173 receiving yards and a touchdown during a 22–7 victory over the Miami Dolphins on Thursday Night Football. In Week 7, the Bengals defeated the Browns while Green finished the win with eight receptions for 169 receiving yards and a 48-yard touchdown. The following game, Green recorded nine catches for 121 receiving yards in a 27–27 tie with the Redskins. Green returned in Week 10 and caught seven passes for 68 yards and a touchdown during the Bengals' 21–20 loss at the Giants. On November 20, Green sustained a tear to his hamstring in the first quarter of a 16–12 loss to the Buffalo Bills. He was inactive for the next five games before being placed on injured reserve prior to the regular-season finale. Green finished the 2016 season with 66 receptions, 964 receiving yards, and four touchdown receptions in 10 games. This marked the first time in Green's career that he failed to reach 1,000 receiving yards. Despite the injury, Green was named to his sixth straight Pro Bowl on December 20. He was ranked 17th by his peers on the NFL Top 100 Players of 2017. 2017 season In Week 3, against the Green Bay Packers, Green recorded ten receptions for 111 yards and one touchdown in the 27–24 overtime loss. In Week 5 against the Bills, Green had two passes deflected off his hands that were intercepted and he lost a fumble, but still had an impressive outing with seven receptions for 189 receiving yards as the Bengals won 20–16. In Week 9 against the Jacksonville Jaguars, Green got into a fight with Jalen Ramsey, resulting in both players being ejected and his first ever foul. He was later fined $42,541."", 'He followed that up with eight receptions for 153 receiving yards and a receiving touchdown in a 20–17 victory over Arizona State in the next game. On November 14, against Auburn, he suffered a left shoulder injury, which kept him out of the remaining regular season games. He returned for the 2009 Independence Bowl, December 28, in Shreveport, Louisiana, where he made six catches totaling 57 yards in the 44–20 victory over the Texas A&M Aggies. Green ended the 2009 regular season with 53 catches for 808 yards and six touchdowns, leading the team in all those categories despite missing time due to injury. Among other awards, Green was elected All-SEC First-team by Associated Press, SEC Coaches, ESPN, Phil Steele, and Sporting News. = Green\'s junior season started off tumultuous due to a compliance issue. He was suspended for the first four games of the 2010 regular season after he admitted to selling his 2009 Independence Bowl Jersey for $1,000 to former North Carolina defensive back Chris Hawkins, who the NCAA described as an agent or someone who markets amateur athletes. As part of his punishment, he was required to repay $1,000 to a charity. Green returned from the suspension on October 2 and had seven receptions for 119 receiving yards and two receiving touchdowns in a 29–27 road loss to Colorado. On November 6, against Idaho State, he had six receptions for 103 receiving yards and two receiving touchdowns in the 55–7 victory. In the following game against rival Auburn, he had nine receptions for 164 receiving yards and two receiving touchdowns in the 49–31 road loss. Green finished Georgia\'s 6–7 season with a team-high 57 catches for 848 yards and nine touchdowns. On January 9, 2011, Green officially declared for the 2011 NFL draft. He finished his three seasons at the University of Georgia with 166 receptions for 2,619 yards and 23 touchdowns. = = 2011 season Green was selected in the first round with the fourth overall pick in the 2011 NFL Draft by the Cincinnati Bengals. He became the highest drafted wide receiver in Georgia school history, breaking the mark set by Lindsay Scott, who went 13th overall in 1984. On July 28, 2011, Green agreed to a four-year contract with the Cincinnati Bengals worth $19.6 million. After signing with the Cincinnati Bengals, Green became a member of School of the Legends (SOTL) in 2011. Green was featured in the 2011 NFLPA Rookie Debut ""One Team"" Celebration which streamed live on YouTube from New York City\'s Cipriani Wall Street. The event was produced by SOTL, a licensed partner of the NFLPA, and employed YouTube\'s live streaming platform. Green\'s first NFL reception was a 41-yard touchdown reception from quarterback Bruce Gradkowski against the Cleveland Browns in the Bengals\' 2011 regular season opener, a 27–17 victory. In the following game, Green recorded his first 100-yard game with ten receptions for 124 receiving yards and one receiving touchdown in a 24–22 loss to the Denver Broncos. By the end of his rookie season, Green recorded four 100-yard games and led all NFL rookies in receptions and receiving yards, catching 65 passes for 1,057 yards in 15 games. His seven touchdown receptions were second among rookies – one behind Julio Jones of the Atlanta Falcons. On December 18, 2011, Green and fellow rookie quarterback Andy Dalton surpassed the all-time NFL record for yards and receptions by a rookie quarterback/receiver tandem. One week later on December 24, 2011, Green\'s 1,031 yards surpassed Cris Collinsworth\'s franchise record of 1,009 yards set in 1981 for most receiving yards by a rookie. Green made his playoff debut in the Wild Card Round against the Houston Texans. In the 31–10 loss, he had five receptions for 47 receiving yards. Green earned a Pro Bowl nomination for his rookie season in addition to being named to the NFL All-Rookie Team. He was ranked 77th by his fellow players on the NFL Top 100 Players of 2012. 2012 season In Week 3 of the 2012 regular season, Green caught nine passes for a career-high 183 yards in a 38–31 win over the Washington Redskins. He earned AFC Offensive Player of the Month for September.', '13 power forward. = As a freshman for Michigan State in 2008–09, Green appeared in 37 games off the Spartan bench as he averaged 3.3 points and 3.3 rebounds per game on the season. During Michigan State\'s 2009 NCAA tournament run to the championship game, Green improved to average 8.5 points and 5.3 rebounds, ranking fourth on the squad in scoring and second in rebounding while shooting a team-best .679 from the field in the tournament. = As a sophomore in 2009–10, Green appeared in 37 games with three starting assignments as he averaged 9.9 points, 7.7 rebounds, 3.0 assists and 1.2 steals per game. He became the first player in Michigan State history to be named Big Ten Sixth Man of the Year, winning the award by unanimous vote. He also earned third-team All-Big Ten honors and was the recipient of MSU\'s Most Improved Player, Chairman of the Boards and Antonio Smith Glue and Guts awards. Twice, Green scored a season-high 19 points, on December 10 against Oakland and December 30 against Texas–Arlington. He also had seven games with double-doubles, including 17 points and 16 rebounds on February 6 against Illinois. = As a junior in 2010–11, Green averaged 12.6 points and 8.6 rebounds per game. On February 10, 2011, Green followed Charlie Bell and Magic Johnson to be the third Michigan State men\'s basketball player to record a triple-double. In the 2011 NCAA Men\'s Division I Basketball Tournament, he recorded his second triple-double of the season and the seventh in NCAA tournament history in the loss against UCLA. He went on to earn third-team All-Big Ten honors for the second straight year. = As a senior in 2011–12, Green captained the Spartans to a regular season Big Ten championship and Big Ten tournament championship, being named Most Outstanding Player. The 2011–12 squad compiled a regular season 24–7 record and a 13–5 mark in Big Ten play, good for the team\'s 13th conference title and the third in the previous four years. Green was named Big Ten Men\'s Basketball Player of the week four times during the season; no other Spartan in history has won the award more than three times in a single season. On March 5, 2012, Green was named Big Ten Player of the Year by the coaches and media and was a unanimous first-team All-Big Ten selection. On March 10, 2012, Draymond passed Johnny Green as the second all-time rebounding leader at MSU, finishing the game with 1,046 career rebounds. On March 16, 2012, Green recorded his third career triple-double against LIU-Brooklyn in the second round of the 2012 NCAA tournament and joined Oscar Robertson and Magic Johnson as just the third player in NCAA history to have two career triple-doubles in the NCAA tournament. On March 22, 2012, in a loss to Louisville, Green collected 16 rebounds, bringing him to 1,096 career rebounds, the most in Michigan State history ahead of Greg Kelser. He ended his career as one of three players in Michigan State history with over 1,000 points and 1,000 rebounds. Concluding his time in college, he graduated with a degree in communication studies at the end of his senior year. = Early years (2012–2014) Green was selected with the 35th overall pick in the 2012 NBA draft by the Golden State Warriors. On July 30, 2012, he signed a three-year, $2.6 million contract with the Warriors. In his NBA debut in the Warriors\' season opener on October 31 against the Phoenix Suns, Green played one minute, made one defensive rebound, and committed one foul. Green gradually received more playing time in subsequent games, especially in the wake of injuries to Brandon Rush and Richard Jefferson. After getting only marginal floor time at the beginning of the season, by November 22, Green was playing 15–20 minutes per game, and by December 9, as Green gained a bigger role on the team, the Warriors had won 8 of 10 games. On December 12, Green made the winning layup with 0.9 seconds left in the Warriors\' 97–95 win over the defending champion Miami Heat. In Game 1 of the first round of the 2013 playoffs against the Denver Nuggets on April 20, Nuggets\' guard Andre Miller drove around Green and made the game-winning layup in the Nuggets\' 97–95 win over the Warriors. Improving on his three-point percentage and offensive performance over the course of the series, Green helped the Warriors win the first round in six games. On May 8, Green started Game 2 of the Warriors\' second-round series against the San Antonio Spurs. In the Warriors\' 100–91 victory, the Warriors\' first victory in San Antonio since the 1996–97 season, Green started in place of Festus Ezeli. Green played 32 minutes and recorded 5 points on 2-of-8 shooting, 7 rebounds and 5 assists. The Spurs went on to win the series 4 games to 2, subsequently ending the Warriors\' season and playoff run. Green lost 20 pounds in the 2013 off-season and showed improvement in three-point shooting and defense as a sophomore. On December 1, 2013, in the Warriors\' 115–113 win over the Sacramento Kings, Green tipped in a missed shot by Stephen Curry to give the Warriors a 113–111 lead with 28.7 seconds left. On December 25, Green was ejected from the Warriors\' game against the Los Angeles Clippers for committing a flagrant 2 foul on the Clippers\' forward Blake Griffin. The following day, the NBA fined Green $15,000 for ""failing to leave the court in a timely manner"" after being ejected. Late in the season, he filled in at power forward for injured starter David Lee, who was out indefinitely. On April 14, 2014, in the Warriors\' second to last game of the regular season, Green recorded a career-high 20 points and a career-high-tying 12 rebounds off the bench to help his team defeat the Minnesota Timberwolves, 130–120. Green finished the 2013–14 season having played in all 82 games with 12 starts while averaging 6.2 points and 5.0 rebounds per game. He went on to play in all seven of the Warriors\' first-round playoff games against the Los Angeles Clippers, as the Warriors lost the series 4 games to 3. He earned praise for his tough defense during the series after averaging 1.7 steals and 1.7 blocks per game. First championship (2014–2015) With the Warriors\' resurgence in 2014–15, along with it came the breakthrough the Warriors were hoping for from Green. With David Lee out of the Warriors\' lineup with a hamstring injury to begin the season, Green was promoted to the starting lineup as his replacement at power forward. Over the first seven games of the season, Green averaged 13.6 points per game as the Warriors fell to a 5–2 record after losing two games in a row on November 9 and 11. In response to the two-game losing streak, the Warriors went on a 16-game winning streak with the help of Green as he averaged 13.3 points per game over the streak, including a career-high 31 points on December 6 in a 112–102 win over the Chicago Bulls. On January 2, 2015, Green recorded his first career triple-double with 16 points, 11 rebounds and 13 assists in a 126–105 win over the Toronto Raptors. He went on to finish runner-up in both the Defensive Player of the Year Award and the Most Improved Player Award. Green capped off a great season with an NBA championship and a triple-double in Game 6 of the NBA Finals, playing a center position role in place of Andrew Bogut. He became just the sixth player in NBA history to record a triple-double in an NBA Finals clinching game, joining Magic Johnson, Larry Bird, James Worthy, Tim Duncan and LeBron James. First All-Star and All-NBA appearances (2015–2016) On July 9, 2015, Green re-signed with the Warriors to a five-year, $82 million contract. Green helped the Warriors record their first ever 10–0 start to a season behind averages of 11.9 points, 7.7 rebounds, a team-high 6.6 assists, 1.2 steals and 1.2 blocks per game. On November 24, he recorded 18 points and 7 rebounds in a win over the Los Angeles Lakers as the Warriors set the record for best start in NBA history at 16–0. Three days later, he recorded his third career triple-double with 14 points, 10 rebounds and 10 assists in a 135–116 win over the Phoenix Suns. His fourth career triple-double came the very next game on November 28 against the Sacramento Kings. Green had 13 points, 11 rebounds and 12 assists against the Kings, becoming the first Warriors player with back-to-back triple-doubles since Wilt Chamberlain in 1964. On December 11, Green became the first player since Nicolas Batum in 2012 to record five or more in all five major statistical categories. In just under 50 minutes of action, he recorded 24 points, 11 rebounds, 8 assists, 5 steals and 5 blocks in a 124–119 double overtime win over the Boston Celtics, increasing their unbeaten winning streak to start the season to 24–0. The following day, the Warriors\' unbeaten run was broken by the Milwaukee Bucks, losing their first game of the season 108–95 despite Green\'s 24-point, 11-rebound effort. On January 4, 2016, Green became the second Warriors player ever to post three straight triple-doubles (the other being Tom Gola in 1959–60) as he helped Golden State record its 35th straight regular season home win with a 111–101 victory over the Charlotte Hornets. The same day, Green was named the NBA Western Conference Player of the Week for Week 10 (December 28 – January 3), his first career NBA Player of the Week award. He led the Warriors to a 3–1 week with averages of 18.8 points, 11.3 rebounds, 9.5 assists and 2.5 steals in 36 minutes. On January 28, he was named a Western Conference All-Star reserve for the 2016 NBA All-Star Game, earning his first All-Star selection. On March 27, he posted his franchise-best 12th triple-double of the season in a win over the Philadelphia 76ers. Three days later, in a win over the Utah Jazz, Green became the first player in NBA history to record 1,000 points, 500 rebounds, 500 assists, 100 steals and 100 blocks in a season. At the conclusion of the regular season, Green was selected to the All-NBA Second Team, finished runner-up for the Defensive Player of the Year award, and was named to the All-Defensive Team with the second-most votes. His 13 triple-doubles were second in the league to Russell Westbrook\'s 18, and he broke Gola\'s team record of nine set in 1959–60. His 13 were the most by a non-guard in the NBA since Grant Hill\'s 13 in 1996–97.', 'He had six seasons with 1,000 or more receiving yards. Green signed with the Cardinals in 2021, having finished his Bengals career ranked second in franchise history, behind only Chad Johnson, in receiving yards, receiving touchdowns, and receptions. On September 16, 2023, Green signed a one-day contract with the Bengals to retire with the team. When Green was age 4, his older brother and only sibling died in a car wreck on the way to a school carnival. Green was on his elementary school\'s juggling team, telling The Atlanta Journal-Constitution that he learned to juggle as early as second grade. Green said he could juggle as many as four items at once, and that the ability helped the development of his hand-eye coordination. Green attended Summerville High School in Summerville, South Carolina, where he was a three-sport athlete in football, basketball, and track. He played as a wide receiver for the Summerville Green Wave football team, under coach John McKissick. He was widely considered to be one of the top national football prospects of the Class of 2008 and was listed #1 by Sports Illustrated. Green earned All-State honors four times and was the only junior nominated to the 2006 USA Today All-American first-team following 75 receptions for 1,422 yards and 16 touchdowns during his junior season. Green was also selected as a member of the Rivals.com Junior All-America team based on those stats. As a freshman, he had 57 receptions for 1,217 yards and eight touchdowns. As a sophomore, he had 60 catches for 1,203 yards and 14 touchdowns. Green\'s 5,373 career receiving yards rank second in the all-time career receiving records of the National Federation of High Schools. His 279 career receptions rank fourth. In June 2006, Green was profiled by Sports Illustrated as part of its ""Where Will They Be?"" stories documenting athletes with the potential of becoming a future great, alongside Peter Uihlein, John Tavares, Tyreke Evans, Elena Delle Donne, and others. Sports Illustrated compared him to the then-Oakland Raiders wideout Randy Moss and predicted Green will be in the NFL by 2011. Green was also on the school\'s track & field team, where he competed as a long jumper (top-jump of 19 ft 6 in) and triple jumper (40 ft 0 in). Rivals.com ranked Green as their No. 9 prospect for the high school class of 2008, while Scout.com named Green their No. 10 prospect nationally. He participated in the Under Armour All-America Game. Green was also on the Summerville High high school basketball team that claimed the 2007–2008 South Carolina state championship in a championship game against Spartanburg (S.C.) High. The game was played in memory of their fallen assistant coach, Captain Louis Mulkey of the Charleston Fire Department in South Carolina, who died responding to a fire with eight other firefighters on June 18, 2007. Green verbally committed to attend the University of Georgia in October 2006, and made his commitment official by signing a letter of intent to play at Georgia on February 6, 2008. He played for coach Mark Richt\'s Georgia Bulldogs football team from 2008 to 2010. = Green had a solid freshman season for the 10–3 Georgia Bulldogs in 2008. He joined a wide receivers unit that contained Mohamed Massaquoi, Michael Moore, Kris Durham, and Demiko Goodman. In the fourth game of his college career, against Arizona State, Green had eight catches for 159 yards and a touchdown in the 27–10 victory. For this, he was named SEC Player of the Week. On October 18, against SEC East rival Vanderbilt, he had seven receptions for 132 receiving yards in the 24–14 victory. He finished the 2008 season with 56 catches for 963 yards and eight touchdowns, all Georgia freshman school records. He also led the SEC in receiving yards, with the third-highest total in UGA school history. He was named second-team All-SEC and Freshman of the Year by the SEC coaches, and was named to the Associated Press All-SEC first-team. = As a sophomore, Green became the top option for the Georgia wide receivers group that added newcomers Tavarres King and Rantavious Wooten. Green saw similar opportunities production-wise as a sophomore in Georgia\'s 8–5 season. On September 19, he had seven receptions for 137 receiving yards and two receiving touchdowns in a 52–41 victory on the road against Arkansas.', 'In 2019, Green donated money to elementary school teachers in his hometown of Summerville. List of Cincinnati Bengals first-round draft picks List of National Football League career receiving yards leaders Career statistics from NFL.com · ESPN · Yahoo Sports · Pro Football Reference Georgia Bulldogs bio\n\nIn the 2022–23 season, AJ Green played for Milwaukee in 35 games. He averaged 4.4 points, 1.3 rebounds, 0.6 assists, 0.2 steals, and 0.0 blocks per game. He shot 0.424 from the field, 0.419 from 3-point range, and 1.0 from the free throw line, playing an average of 9.9 minutes per game. In the 2023–24 season, AJ Green played for Milwaukee in 56 games. He averaged 4.5 points, 1.1 rebounds, 0.5 assists, 0.2 steals, and 0.1 blocks per game. He shot 0.423 from the field, 0.408 from 3-point range, and 0.895 from the free throw line, playing an average of 11.0 minutes per game. In the 2024–25 season, AJ Green played for Milwaukee in 73 games. He averaged 7.4 points, 2.4 rebounds, 1.5 assists, 0.5 steals, and 0.1 blocks per game. He shot 0.429 from the field, 0.427 from 3-point range, and 0.815 from the free throw line, playing an average of 22.7 minutes per game. In the 2024 season, AJ Green played for Milwaukee in 6 games. He averaged 2.8 points, 1.5 rebounds, 0.3 assists, 0.0 steals, and 0.0 blocks per game. He shot 0.375 from the field, 0.182 from 3-point range, and 1.0 from the free throw line, playing an average of 11.2 minutes per game. In the 2025 season, AJ Green played for Milwaukee in 5 games. He averaged 11.0 points, 2.8 rebounds, 2.0 assists, 0.0 steals, and 0.2 blocks per game. He shot 0.462 from the field, 0.514 from 3-point range, and 0.5 from the free throw line, playing an average of 27.0 minutes per game. In the 2018–19 season, AJ Green played for Northern Iowa in 34 games. He averaged 15.0 points, 3.0 rebounds, 2.3 assists, 0.6 steals, and 0.1 blocks per game. He shot 0.41 from the field, 0.348 from 3-point range, and 0.864 from the free throw line, playing an average of 29.9 minutes per game. In the 2019–20 season, AJ Green played for Northern Iowa in 31 games. He averaged 19.7 points, 3.0 rebounds, 3.0 assists, 0.7 steals, and 0.0 blocks per game. He shot 0.416 from the field, 0.391 from 3-point range, and 0.917 from the free throw line, playing an average of 34.8 minutes per game. In the 2020–21 season, AJ Green played for Northern Iowa in 3 games. He averaged 22.3 points, 5.7 rebounds, 2.7 assists, 1.3 steals, and 0.7 blocks per game. He shot 0.464 from the field, 0.407 from 3-point range, and 0.667 from the free throw line, playing an average of 36.3 minutes per game. In the 2021–22 season, AJ Green played for Northern Iowa in 31 games. He averaged 18.8 points, 3.7 rebounds, 2.5 assists, 0.8 steals, and 0.0 blocks per game.', ""He made the All-Summer League Second Team after missing the last three of five games due to soreness on his right hamstring. He made his preseason debut on October 5 in a 125–119 win against the Washington Wizards with 12 points, six rebounds, and two assists. On October 20, Green made his NBA debut, putting up nine points, four rebounds, and four assists in a 124–106 loss to the Minnesota Timberwolves. On October 24, Green put up 30 points, with eight three-pointers made, in a 107–97 loss to the Boston Celtics, becoming the first rookie to put up at least 30 points and eight threes in a game in Rockets history. On October 28, Green and Jordan Clarkson became the first two players of Filipino descent to play in the same NBA game in time for the Rockets' Filipino Heritage Night celebration. Unfortunately for Green, he started out his rookie season suffering with a hamstring injury on his lower left leg after a home game win against the Chicago Bulls and been sidelined out of the rotation for a while. After missing 14-games in a month from his hamstring injury, Green returned to the starting line up on December 24, scoring 20 points by going on a 6-for-9 from the three point line in a loss road trip game to the Indiana Pacers. On February 19, 2022, Green participated in the Slam Dunk Contest, finishing in third place. On March 9, Green scored 32 points along with three rebounds, three assists, and one blocked shot in 38 minutes which marked his second 30-point game in a 130–139 overtime win against the Los Angeles Lakers. On March 28, Green scored his third 30-points game along with four rebounds and assists in a 123–120 loss against the San Antonio Spurs. He joined with Allen Iverson as the only NBA rookie to score a 30-plus point in five straight games in a row since 1997. In his final game as a rookie, Green scored a then-career high with 41 points in a 130–114 loss to the Atlanta Hawks, which was the first 40-point game by a Rockets rookie since Hakeem Olajuwon. At the end of the regular season, he was named Rookie of the Month for March and April. He was selected to the NBA All-Rookie First Team with averages of 17.3 points, 3.4 rebounds, and 2.6 assists. 2022–23 season: Career-high in scoring Prior to the 2022–23 season, Green changed his jersey number from 0 to 4. Green was unable to wear number 4 during his rookie season since Danuel House, who was still a teammate with Green, refused to exchange number jerseys with him since the number was of significance to him before being waived by the Rockets on December 17, 2021. In his second game of the season, Green played 35 minutes with a record of 33 points with four threes, five rebounds, two assists, and a steal in a 129–122 loss to the Grizzlies. On November 7, 2022, scored 34 points in a win against the Orlando Magic, making him the sixth guard in NBA history to score at least 30 points ten or more times before turning 21, joining other elite guards in Luka Dončić, Devin Booker, Anthony Edwards, LaMelo Ball, and Kyrie Irving. On November 26, he secured a career-high nine assists along with 28 points and three rebounds in a 118–105 win against the Oklahoma City Thunder. In December 2, Green logged 20 points in the third quarter leading with 30 points in a 122–121 comeback game win against the Phoenix Suns. On January 15, 2023, the NBA suspended Green along with teammate Jae'Sean Tate for one game without pay for leaving the bench area during an altercation between the Rockets and the Sacramento Kings two days earlier. On January 18, Green tied a then-career high of 41 points with seven assists and five rebounds in a 121–117 loss against the Charlotte Hornets. On January 23, he surpassed his career high with 42 points along with four rebounds and four assists in a 119–114 win against the Minnesota Timberwolves. He became the only sixth player at 20 or younger to have recorded at least three 40-point games. On February 8, Green scored 41 points along with two assists and rebounds, securing his fourth game of 40 or more points before turning 21, tied for the third most in NBA history. He achieved this a day before his 21st birthday. 2023–24 season Green was nearly traded to the Brooklyn Nets for Mikal Bridges. The deal would have sent Green and Brooklyn's picks back from the James Harden trade to the Nets. On January 24, 2024, Green and his teammate Alperen Şengün became the first duo in NBA history to score 30-plus points and 10-plus rebounds at 21 years or younger in a 135–119 win against the Los Angeles Lakers. On March 19, 2024, Green put up a career-high 42 points, along with 10 rebounds and three assists, in a 137–114 win over the Washington Wizards. 2024–25 season: Playoff debut On October 21, 2024, Green and the Rockets agreed to a three–year, $106 million contract extension. On November 27, 2024, Green put up 41 points in a 122–115 overtime win over the Philadelphia 76ers. On January 13, 2025, Green matched his career high with 42 points on 72.2% shooting from the field in a home game win against the Memphis Grizzlies. He joined Hakeem Olajuwon as the only two players in Rockets history to score 40+ points with at least 70% from the field. In Game 2 of the Rockets' first-round series against the Golden State Warriors, Green put up 38 points in a 109–94 win. He also made a Rockets franchise playoff record-tying eight three-point shots—joining Chris Paul (v. Utah, May 2018), (Matt Maloney) (at Seattle, May 1997). Green represents the United States internationally but has also shown interest in playing for the Philippines in the future due to his partial Filipino background. He made his national team debut for the United States at the 2017 FIBA Under-16 Americas Championship in Formosa, Argentina."", ""In Week 10 against the Titans, he recorded five receptions for 115 receiving yards and a touchdown as the Bengals lost 24–20. In Week 13 against the Steelers, he caught two touchdowns in the 23–20 loss. On December 19, 2017, Green was named to his seventh straight Pro Bowl. Overall, he finished the 2017 season with 75 receptions for 1,078 receiving yards and eight touchdowns in the Bengals' 7–9 season. 2017 marked the seventh consecutive season that Green led the Bengals in receiving yards, breaking the mark of six set by Chad Ochocinco and Cris Collinsworth. He was ranked 22nd by his fellow players on the NFL Top 100 Players of 2018. 2018 season On September 13, 2018, Green had the first three-touchdown game of his career against the Ravens, completing the hat-trick in the first half, with each of his first three catches resulting in touchdowns in the 34–23 victory. In Week 4, against the Falcons, with the Bengals trailing by five with only 12 seconds remaining, Dalton connected with Green on a 13-yard pass to give the Bengals the game-winning points. On October 7, in a 27–17 win over the Dolphins in, Green caught six passes for 112 yards, setting a franchise record with his 32nd 100-yard receiving game, breaking the previous mark by Chad Johnson. He suffered a toe injury in Week 8 against the Tampa Bay Buccaneers and missed the next three games. Green returned in Week 13 against the Broncos but re-injured his toe and was placed on injured reserve on December 5. He finished the 2018 season with 46 receptions for 694 receiving yards and six touchdowns, ending his Pro Bowl streak at seven seasons, as the Bengals finished with a 6–10 record. He was ranked 58th by his fellow players on the NFL Top 100 Players of 2019. 2019 season During training camp, Green suffered torn ligaments in his ankle while practicing with the team at Welcome Stadium in Dayton, Ohio. Despite being expected to only miss a handful of games early in the season, he ended up missing the entire year, being inactive for every game before being placed on injured reserve on December 23, 2019. 2020 season On March 16, 2020, the Bengals placed the franchise tag on Green. He signed the one-year tender on July 17, 2020. He made his official return from injury in the Bengals' 2020 regular season opener against the Los Angeles Chargers. He scored his first touchdown since Week 8 of the 2018 season in Week 11 against the Washington Football Team. Overall, in the 2020 season, he finished with 47 receptions for 523 receiving yards and two receiving touchdowns as the Bengals finished with a 4–11–1 record. He finished his Bengals career second to Chad Johnson in receptions, receiving yards, and receiving touchdowns. = 2021 season Green signed a one-year deal worth $8.5 million, with $6 million guaranteed, with the Arizona Cardinals on March 17, 2021. He entered the 2021 season as a starter alongside DeAndre Hopkins and Christian Kirk. In Week 3, against the Jaguars, he had five receptions for 112 yards in the 31–19 victory. For Green, it was his first game reaching at least 100 yards since Week 7 of the 2018 season. In Week 8, against the Packers, Green was targeted on a potential game-winning play by Kyler Murray. A miscommunication on the play led to Green not looking at the thrown pass and it led to an interception by Rasul Douglas. In Week 14, against the Los Angeles Rams, Green eclipsed 10,000 career receiving yards. He finished the season with 54 catches for 848 yards and three touchdowns. 2022 season On April 14, 2022, Green re-signed with the Cardinals on a one-year contract. In his final career game against the San Francisco 49ers, Green recorded three catches for 91 yards, including a 77-yard touchdown reception off a flea-flicker from David Blough. In the 2022 season, Green played in 15 games, starting ten. He finished with 24 receptions for 236 receiving yards and two receiving touchdowns. = On February 6, 2023, Green posted on Instagram that he would be retiring after two seasons with the Cardinals. He finished his NFL career with 10,514 career yards. On September 16, 2023, Green signed a one-day contract with the Bengals to retire with the team. Career best in bold = = On March 21, 2015, he married actress and singer Miranda Brooke, his college sweetheart. They have two sons together."", '(born October 4, 1963) is an American former professional basketball player. Nicknamed ""Iron Man"", he holds a National Basketball Association (NBA) record for most consecutive regular-season games played with 1,192. Green played for the Los Angeles Lakers, Phoenix Suns, Dallas Mavericks and Miami Heat. He found most success with the Lakers, with whom he won three championships in 1987, 1988 and 2000, and was named an NBA All-Star in 1990. Green was born and raised in Portland, Oregon, attending Benson Polytechnic High School and Oregon State University. He was inducted into the Oregon Sports Hall of Fame in 2003. A.C. Green Jr. was born on October 4, 1963, in Portland, Oregon. Green was given the initials ""A.C."" like his father A.C. Green Sr. The initials stand for his father\'s mother Amanda and his father\'s father Chester. Green, who had regularly attended church with his family until allowed the decision whether to do so during his high school freshman year, became a born again Christian during a Fellowship of Christian Athletes weekend retreat during his senior year of high school. He never missed a class in his educational career. Green attended Oregon State University, where he finished second in school history in rebounding and fourth in scoring. He was an All-Pac-10 selection as a sophomore, and as a junior he ranked fourth in the nation in field goal percentage at .657. As a senior, he averaged 19.1 points and 9.2 rebounds and was named to the All-America Third Team. He was inducted into the Pac-12 Basketball Hall of Honor during the 2012 Pac-12 Conference men\'s basketball tournament, March 10, 2012. = The Los Angeles Lakers, fresh from winning an NBA championship, selected Green in the first round as the 23rd overall pick in the 1985 NBA draft. Green led the Lakers in rebounding for six of his eight years on the team. Led by Magic Johnson, James Worthy and Kareem Abdul-Jabbar, Los Angeles captured back-to-back titles in 1987 and 1988, Green\'s second and third years with the squad. In the two campaigns combined, he averaged 11.1 points and 8.2 rebounds while shooting better than .500 from the field. Green also reached the NBA Finals with Los Angeles in 1989 and 1991. Green was named to the NBA All-Defensive Second Team in 1988–89, was voted a starter on the 1990 Western Conference All-Star Team and finished fourth in the league in field goal percentage in 1992–93 at .537. = Green left the Lakers in 1993 to sign with the Phoenix Suns as a free agent. The Suns had just reached the NBA Finals, losing in six games to the Chicago Bulls, and they viewed Green as the missing piece to their championship puzzle. Green posted a career-high average of 14.7 points per game in 1993–94, but the Suns were eliminated in the conference semifinals. In 1994–95 he again contributed double-figure scoring and solid rebounding for the Suns, but his playing time and contributions dipped in 1995–96; though he remained the team\'s second-leading rebounder. His streak of consecutive games played almost ended during a game with the New York Knicks when J.', 'Adriel Jeremiah ""AJ"" Green (born July 31, 1988) is an American former professional football wide receiver who played in the National Football League (NFL) for twelve seasons, primarily with the Cincinnati Bengals. He played college football for the Georgia Bulldogs, earning first-team All-American honors before being selected by the Bengals with the fourth overall pick in the 2011 NFL draft.', 'Olympic team coached by Bob Knight. Stockton made the initial cut in April to the final 20, but was one of four released in May (with Charles Barkley, Terry Porter, and Maurice Martin) in the penultimate cut to 16 players. Though not selected, the experience led him to meet his future teammate and friend, Karl Malone. = In June 1984, Stockton was selected by the Utah Jazz in the first round of the 1984 NBA draft as the 16th overall pick. Though he was relatively unknown during his college career, his stock rose significantly in the months before the NBA draft. Nevertheless, the announcement of his selection to the thousands of Jazz fans gathered at the Salt Palace on draft day was met with a stunned silence. On November 10, 1984, Stockton had his highest scoring game as a rookie, with 19 points in only 19 minutes of playing time, during a loss against the Denver Nuggets. Stockton became the starting point guard for the Jazz in the 1987–88 season. That season, despite eventually finishing tenth in MVP voting and being named to the All-NBA Second Team after averaging 14.7 points, 13.8 assists (best in the league), and 3 steals a game, Stockton was not selected to play in the 1988 NBA All-Star Game. In 1988–89, he played in his first All-Star Game; that season he also led the league in steals per game (while once again leading the NBA in assists per game, which he would do for nine consecutive seasons). Stockton also led the league in steals per game in 1991-92. On January 15, 1991, Stockton scored 20 points and dished out a career-high and franchise-record 28 assists in a 124–102 home win against the San Antonio Spurs. On February 12, Stockton nearly recorded a triple-double after putting up 19 points, 11 assists, and 9 steals in a 113–92 win over the Houston Rockets. In 1992, Stockton and the Jazz reached the Western Conference Finals for the first time; however, they were defeated by the Portland Trail Blazers in six games. Along with Malone, Stockton was named co-MVP of the All-Star Game in 1993 and the game was held in Salt Lake City. During the 1994–95 season, Stockton achieved many milestones. On February 1, 1995, he passed Magic Johnson (who had 9,921 assists) as the NBA\'s all-time leader in assists as he dished out 16 assists in a 129–98 victory over the visiting Denver Nuggets. His 16 assists gave him 9,937 assists for his career at that time. Magic Johnson, in an interview, said to Stockton, ""John, from one assist man to another, you are the greatest team leader I have ever played against."" Seventeen days later, Stockton dished out 15 assists in a 108–98 victory over the Boston Celtics. His 15 assists gave him a career total of 10,008 assists, the first-ever player to have dished out 10,000 assists in his career. On March 25, Stockton became just the second player in NBA history to have recorded 2,000 steals after recording 6 steals in a 117–110 loss to the Dallas Mavericks. Stockton and the Jazz reached the Conference Finals again in 1994 and 1996, but lost to the Houston Rockets and the Seattle SuperSonics, respectively. Utah set a franchise record and led the Western Conference with 64 wins in the 1996–97 season. The team again reached the Western Conference Finals. In Game Six of the Conference Finals, Stockton scored 25 points, dished out 13 assists, and made a buzzer-beating, game-winning three-point shot over the Rockets\' Charles Barkley to send the Jazz to the first of two consecutive NBA Finals appearances. Stockton\'s game-winner became known as ""The Shot"". In Game 3 of the 1997 NBA Finals, Stockton recorded 17 points, 7 rebounds, and 12 assists in their first Finals\' win in franchise history. The Jazz were defeated by the Michael Jordan-led Chicago Bulls in six games in the Finals. Stockton missed the first 18 games of the 1997–98 season with a knee injury, but the Jazz returned to the NBA Finals and again faced the Bulls. In Game 6 of the 1998 NBA Finals, Stockton made a three-pointer with 41.9 seconds left to give the Jazz a lead, but Bulls guard Michael Jordan made two field goals to put his team ahead 87–86. Stockton missed a three-point attempt with 5.2 seconds left and said in a post-game interview that he felt confident the shot would go in. The Bulls again defeated the Jazz in six games. The Jazz made the NBA playoffs every season during Stockton\'s 19-year NBA career. = On May 2, 2003, Stockton announced his retirement with a released statement instead of the customary news conference. The Jazz later held a retirement ceremony for him, in which Salt Lake City renamed the street in front of the venue known as Delta Center, where the Jazz play, John Stockton Drive. Stockton would later declare that despite being still content with the game and how well he was playing, his growing family made him feel that ""sitting in the hotel room waiting for games wasn\'t making up for what I was missing at home."" Stockton\'s number 12 jersey was retired by the Jazz during a game on November 22, 2004. A statue of Stockton can be seen in front of the Delta Center; an accompanying statue of Karl Malone was placed nearby on March 23, 2006. The Malone and Stockton statues stand on a bronze plaque commemorating their achievements together. Stockton was inducted into the Naismith Memorial Basketball Hall of Fame in 2009. Stockton was also inducted into the Hall of Fame along with the rest of the 1992 United States men\'s Olympic basketball team in 2010. Stockton was notable for his durability, missing only 22 games in his 19-season career and playing every game of 17 seasons. In his first 13 seasons, he missed only four games (all in the 1989–90 season) until he missed the first 18 games of the 1997–98 season due to an injured MCL in his left knee sustained in the preseason. That was the only major injury in his career, and he never missed another game after returning from that injury. Stockton earned the ""old school"" tag for his physical play; surveys of athletes and fans alike often judged him among the toughest players in the NBA, usually just behind teammate Karl Malone. Stockton\'s tenacity also earned him a reputation among some in the league as being a dirty player, as suggested by a poll Sports Illustrated conducted in 1997 where he was voted as the second dirtiest player in the league behind Dennis Rodman. His patented ""short shorts"" became known as ""Stocktons""—since he continued to wear the style long after the rest of the league had adopted a baggier look. Stockton\'s career is also notable for its consistency and longevity. He remained a starting NBA player until his retirement at age 41. Stockton avoided most endorsements and stayed loyal to Utah despite being offered more money by other teams. In 1996, he agreed to a deal that made salary-cap space available so the team could improve, but in exchange, he insisted on guaranteed Delta Center ice time for his son\'s hockey team. For many years, Karl Malone and Stockton were the Jazz\'s one-two punch. The two played a record 1,412 regular season games together as teammates. Many of Stockton\'s assists resulted from passes to Malone. Stockton and Malone have been described as the greatest pick-and-roll combination of all time. Stockton and Malone are also considered the two best players to never have won an NBA championship. Stockton holds a commanding lead for the NBA record for career assists with 15,806. He was the first player to reach the 10,000 through 15,000 career assist milestones. Stockton also holds the record for assists-per-game average over one season (14.5 in 1990) and is one of three players who have logged more than 1,000 assists in one season, joining Kevin Porter (1,099 in 1979) and Isiah Thomas (1,123 in 1985) in the exclusive list. Stockton did this seven times, with season totals of 1,164, 1,134, 1,128, 1,126, 1,118, 1,031 and 1,011 assists. On defense, Stockton holds the NBA record for career steals with 3,265. Stockton was also a capable scorer (13.1 points per game career average and a 51.5 career shooting percentage) with a reliable three-point shot (38.4% lifetime average). As of February 2023, he is 55th on the all-time NBA scoring list with 19,711 career points. Stockton was selected to the All-NBA First Team twice, the All-NBA Second Team six times, the All-NBA Third Team three times, and the NBA All-Defensive Second Team five times. He was selected to 10 All-Star Games. He was named one of the 50 Greatest Players in NBA history in 1996. On May 11, 2006, ESPN.com named Stockton the fourth best point guard of all time. In October 2021, Stockton was again honored as one of the league\'s greatest players of all time by being named to the NBA 75th Anniversary Team In 1999, Sports Illustrated named Stockton as the best athlete to come out of the state of Washington in the 20th century. In 2022, to commemorate the NBA\'s 75th Anniversary The Athletic ranked their top 75 players of all time, and named Stockton as the 25th greatest player in NBA history. = Only player in NBA history to record multiple games with at least 25 assists made.', ""In Week 6, against the Browns, he had seven receptions for 135 receiving yards and two touchdowns in the 34–24 loss. In Week 9, he caught a 56-yard touchdown against the New York Giants extending his touchdown streak to eight consecutive games, the longest in the NFL by a receiver and second-longest overall. He extended the streak to nine following a four-yard touchdown in a 28–6 victory over the Kansas City Chiefs in Week 11. On December 23, Green recorded his first career lost fumble against the Pittsburgh Steelers, but he finished the game with 10 receptions for 116 yards, including a 21-yard reception that set up the game-winning field goal. Green gained over 100 receiving yards in five different games and was selected to his second Pro Bowl. He finished the season with 97 receptions for 1,350 yards and 11 touchdowns. In the Bengals' Wild Card Round loss to the Texans, he was the team's leading receiver with five receptions for 80 yards. He was ranked 16th by his fellow players on the NFL Top 100 Players of 2013. 2013 season Green started off the 2013 season with nine receptions for 162 receiving yards and two receiving touchdowns in a 24–21 loss to the Chicago Bears. In Week 7, against the Detroit Lions, he scored on a career-long 82-yard touchdown reception on the Bengals' first drive of the game in the 27–24 victory. In Week 10, against the Baltimore Ravens, he recorded a 51-yard touchdown reception on the game's last play in regulation to tie the game. However, the Bengals eventually lost in overtime. He had a franchise-record five consecutive games with at least 100 receiving yards from Week 6 to Week 10. In Week 16, against the Minnesota Vikings, he had seven receptions for 97 receiving yards and two receiving touchdowns in the 42–14 victory. Green set new career highs in 2013 for receptions (98) and receiving yards (1,426, which was the third-highest total in Bengals history), while scoring 11 touchdowns. He was targeted a franchise-record 178 times, breaking the 174 targets for Carl Pickens in 1996. Green was named to his third Pro Bowl and was ranked ninth by his fellow players on the NFL Top 100 Players of 2014. His 260 career receptions set an NFL record for most receptions in a player's first three seasons, which was later broken by Odell Beckham Jr. and Jarvis Landry in 2016 after both tallied 288."", ""They would be without two of their best players, Jamal Murray and Will Barton, who were both out with injuries. Regardless, Jokić continued his elite level of play throughout the series, averaging 33 points (on 50/40/90 shooting splits), 10.5 rebounds, and 4.5 assists. In Game 6, Jokić scored 27 of his 36 points in the second half to lead the Nuggets to a 126–115 series-clinching victory. Denver would match up against the Phoenix Suns in the Western Conference Semifinals. In a Game 3 loss, Jokić tallied 32 points, 20 rebounds and 10 assists, joining Abdul-Jabbar and Chamberlain as the only players in NBA playoff history to post a 30/20/10 game. The Nuggets were eliminated from the playoffs in Game 4, with Jokić being ejected late in the third quarter after being assessed a flagrant foul two for making a hard swipe at the ball and catching the Suns' Cameron Payne in the face. For the playoffs, Jokić averaged 29.8 points, 11.6 rebounds, and 5.0 assists per game. For his regular season performance, Jokić won the NBA Most Valuable Player Award; in doing so, he became the first center to win the award since Shaquille O'Neal in 2000 as well as the first player in Denver Nuggets franchise history. Jokić also became the first Serbian player, third European player overall, and sixth international player to ever win the award. Having been selected 41st overall in the 2014 NBA draft, Jokić became the lowest-drafted player in NBA history to be named MVP, as well as the first-ever player to be drafted in the second round of the common draft era (since 1966) to win the award. Jokić and Vasilije Micić also became the first-ever pair of players from the same country to be awarded both NBA MVP and EuroLeague MVP honors in the same season. 2021–22 season: Second MVP award On November 8, 2021, in a 113–96 victory over the Miami Heat, Jokić and opposing forward Markieff Morris were both ejected after Morris shoved Jokić, leading Jokić to shoulder Morris in the back. The next day, the NBA announced that they had suspended Jokić for one game without pay. On December 6, Jokić recorded his 60th triple-double, in a 109–97 loss to the Chicago Bulls, overtaking Larry Bird for eighth on the all-time career triple-double list. On December 27, Jokić tied his career best with 22 rebounds and added 26 points, eight assists, two steals, and two blocks in a 103–100 victory against the Los Angeles Clippers, and became the first player to record 25-plus points, 20-plus rebounds, and five-plus assists in consecutive games since Charles Barkley in 1988. On January 25, 2022, Jokić recorded 28 points, 21 rebounds, and nine assists in a 110–105 victory over the Detroit Pistons; he also became the only player in NBA history to record 5,000 rebounds and 3,000 assists within his first 500 career games. Two days later, Jokić was selected for his fourth consecutive NBA All-Star appearance, second in a row as a starter, joining Alex English as the only Nuggets players to be selected to four straight NBA All-Star games. For his play in January, Jokić was named Western Conference Player of the Month for the third time in his career, tying Carmelo Anthony and English for most Player of the Month honors in Nuggets franchise history. Jokić recorded seven triple-doubles and became one of just five players in NBA history to have seven-or-more in a single month, joining Chamberlain, Robertson, Westbrook, and Michael Jordan as the only players to achieve this feat. On February 6, in his 500th NBA game, Jokić logged his 71st career triple-double with 27 points, 12 rebounds, 10 assists, and two steals on 12-of-15 shooting from the field in a 124–104 victory over the Brooklyn Nets; in league history, only Robertson (151) and Johnson (73) recorded more triple-doubles through their first 500 games. Five days later, he became the fifth player in NBA history to have multiple seasons recording 15 or more triple-doubles. On March 6, in a 138–130 overtime victory over the Pelicans, Jokić recorded a triple-double with 46 points, 12 rebounds, 11 assists, three steals, and four blocks. He scored 30 of his 46 points in the fourth quarter and overtime, and joined Chamberlain as the only players to record a 45-point triple-double whilst shooting 70 percent from the field in the same game. Ten days later in a 127–109 victory over the Washington Wizards, Jokić became the second-fastest player to record 10,000 points, 5,000 rebounds, and 3,000 assists. He achieved this feat in his 516th NBA appearance, one game short of Larry Bird's record (515). On March 26, Jokić recorded 35 points, 12 rebounds, eight assists, two steals, and two blocks on 13-of-15 shooting from the field in a 113–107 victory over the Oklahoma City Thunder. He became the second player in NBA history after Chamberlain with three or more career 35-point, 10-rebound, and five-assist games on 85 percent shooting. On April 7, Jokić recorded 35 points, 16 rebounds, six assists, and four steals in a 122–109 victory over the Memphis Grizzlies to clinch a playoff spot outside of the NBA play-in tournament. He became the first player in NBA history to tally at least 2,000 points, 1,000 rebounds, and 500 assists in a season. Jokić's late-season surge also saw him become the first player since Chamberlain to register at least 35 points and 12 rebounds in five straight games. For games played in March and April, Jokić was named Western Conference Player of the Month, for the second time in the season, and fourth time in his career, surpassing Carmelo Anthony and Alex English for most such honors in Nuggets franchise history. Jokić finished the regular season averaging 27.1 points, 13.8 rebounds, and 7.9 assists on 58.3%/33.7%/81.0% shooting splits, and led the Nuggets to a 48–34 winning record for the last direct playoff spot (No. 6) despite Denver's second and third best players missing nearly the entire season. He became the first player in NBA history to average over 25 points, 13 rebounds, and seven assists in a season and the first to lead his team in points, rebounds, assists, steals, blocks and field goal percentage. Jokić was the only player in the NBA this season to finish in the top 10 in points per game, rebounds per game and assists per game. His advanced metrics were historically great, garnering the highest single-season player efficiency rating in NBA history at 32.85. Jokić also led the NBA in win shares, offensive win shares, box plus-minus, value over replacement player, total rebounds, double-doubles (66), and triple-doubles (19). On April 21, in Game 3 of the first round of the playoffs, Jokić logged 37 points, 18 rebounds, five assists, and three steals in a 118–113 loss to the Warriors. Three days later in Game 4, he recorded 37 points, eight rebounds, and six assists in a 126–121 victory. Denver would go on to lose to Golden State in five games despite Jokić's 30-point, 19-rebound, eight-assist, and two-block outing in the 102–98 close-out loss. He scored 12 of his 30 points in the final four minutes of the game."", ""The Bengals finished with an 11–5 record and won the AFC North. In the Wild Card Round against the San Diego Chargers, Green had three receptions for 34 yards in the 27–10 loss. 2014 season Green caught six passes for 131 yards, including a 77-yard fourth quarter touchdown reception, in the Bengals 23–16 win over the Ravens in Week 1. In Week 2, he suffered a game-ending ligament injury on the Bengals opening drive against the Falcons, resulting in Green's first career NFL game without a reception. He returned the following week against the Tennessee Titans and recorded six receptions for 102 yards in the 33–7 victory."", '23 upon his return to Cleveland. 2014–2016: Ending Cleveland\'s championship drought In January of the 2014–2015 season, James missed two weeks due to left knee and lower back strains, which at the time represented the longest stretch of missed games in his career. In total, James played a then career-low 69 games and his final averages were 25.3 points, 6.0 rebounds, and 7.4 assists per game. In the second round of the playoffs, he hit a baseline jumper at the buzzer to give Cleveland a 2–2 series tie with the Chicago Bulls. In the Eastern Conference Finals, the Cavaliers defeated the Atlanta Hawks to advance to the NBA Finals, making James the first player since the 1960s to play in five consecutive Finals. For most of the Finals against the Golden State Warriors, Irving and Love were sidelined due to injury, giving James more offensive responsibilities. Behind his leadership, the Cavaliers opened the series with a 2–1 lead before losing in six games. Despite the loss, he received serious consideration for the Finals MVP Award, averaging 35.8 points, 13.3 rebounds, and 8.8 assists per game. In the 2015 offseason, James declined his $21.5 million player option and re-signed on a two-year, $46.9 million contract that again carried a second year player option. During the 2015–16 season, James was criticized for his role in several off-court controversies, including the midseason firing of Cavaliers\' coach David Blatt. Despite these distractions, Cleveland finished the year with 57 wins and the best record in the East. James\'s final averages were 25.3 points, 7.4 rebounds, and 6.8 assists per game on 52 percent shooting. In the playoffs, the Cavaliers advanced comfortably to the NBA Finals, losing only two games en route to a rematch with the Golden State Warriors, who were coming off a record-setting 73-win season. To begin the series, Cleveland fell behind 3–1, including two blowout losses. James responded by registering back-to-back 41-point games in Games 5 and 6, leading the Cavaliers to two consecutive wins to stave off elimination. In Game 7, he posted a triple-double and made a number of key plays, including a chasedown block on Andre Iguodala\'s go-ahead layup attempt, as Cleveland emerged victorious, winning the city\'s first professional sports title in 52 years and becoming the first team in NBA history to come back from a 3–1 series deficit in the Finals. James became just the third player to record a triple-double in an NBA Finals Game 7, and behind series averages of 29.7 points, 11.3 rebounds, 8.9 assists, 2.3 blocks, and 2.6 steals per game, he also became the first player in league history to lead both teams in all five statistical categories for a playoff round, culminating in a unanimous Finals MVP selection. 2016–2018: End of second stint in Cleveland Following the championship, James again opted out of his contract and re-signed with the Cavaliers, this time on a three-year, $100 million contract, in which the final year was a player option. The 2016–17 season was marred by injuries and unexpected losses for the Cavaliers; James later described it as one of the ""strangest"" years of his career. Following a January defeat to the New Orleans Pelicans, James publicly criticized Cleveland\'s front office for constructing a team that he felt was too ""top heavy"", for which he received countercriticism. The Cavaliers finished the season as the East\'s second seed, with James averaging 26.4 points and career highs in rebounds (8.6), assists (8.7), and turnovers (4.1) per game. In Game 3 of the first round of the playoffs, he registered 41 points, 13 rebounds, and 12 assists against the Indiana Pacers, leading Cleveland to a comeback victory after trailing by 25 points at halftime, representing the largest halftime deficit overcome in NBA playoff history. In Game 5 of the Eastern Conference Finals against the Boston Celtics, James scored 35 points and surpassed Jordan as the league\'s all-time postseason scoring leader. The Cavaliers won the game and the series, advancing to the NBA Finals for the third consecutive time against the Golden State Warriors, who had signed James\'s rival Kevin Durant during the off-season. Behind averages of 33.6 points, 12.0 rebounds, and 10.0 assists per game, James became the first player to average a triple-double in the Finals, but Cleveland was defeated in five games. Prior to the start of the 2017–18 season, the Cavaliers overhauled their roster by trading Kyrie Irving to the Boston Celtics, who requested a trade in part because he no longer wanted to play with James. After a slow start to the year, Cleveland rebounded by winning 18 of 19 games in December. Their turnaround began with a victory over the Wizards on November 3 where James scored 57 points, which represented the second-highest point total of his career and tied a franchise record. In January, the Cavaliers had a losing record, and James was criticized for his lackluster effort. The next month, James won his third All-Star Game MVP Award, after posting 29 points, 10 rebounds, eight assists, and several key plays to help Team LeBron win over Team Curry. Following another round of trades in February, Cleveland returned to form and James reached a number of historical milestones; on March 30, he set an NBA record with 867 straight games scoring in double digits. James eventually finished the season with averages of 27.5 points, 8.6 rebounds, 9.2 assists, and 4.2 turnovers per game. In the playoffs, James guided the Cavaliers to another Finals rematch with the Golden State Warriors. Along the way, he had some of the most memorable moments of his career, including a game-winning shot against the Pacers and another against the Raptors, after which a new nickname, ""LeBronto"" was popularized. In Game 1 of the NBA Finals, James scored a playoff career-high 51 points, but Cleveland lost 124–114 in overtime. Following the loss, James injured his hand after punching a wall in the locker room, which hindered his effectiveness for the remainder of the series. The Cavaliers lost the series in four games, with James averaging 34 points, 8.5 rebounds, and 10.0 assists per game for the Finals. = 2018–2019: Injury and playoff miss On June 29, 2018, James opted out of his contract with the Cavaliers and became an unrestricted free agent. Two days later, his management company, Klutch Sports, announced that he would sign with the Los Angeles Lakers on a four-year, $153.5 million contract; the deal was officially completed on July 9. In an interview with Sports Illustrated, James\'s agent Rich Paul explained: ""In 2010, when he went to Miami, it was about championships. In 2014, when he went back to Cleveland, it was about delivering on a promise. In 2018, it was just about doing what he wants to do."" Reaction to the move was more positive than his original departure from the Cavaliers, albeit still mixed, as some onlookers felt that Los Angeles was not his optimal destination. The Lakers expected James to immediately transform them into a championship contender after having missed the playoffs since 2014 and not appearing in the Finals since 2010. Following his signing, the team rounded out their roster with a controversial collection of playmakers and veterans. To begin the 2018–19 season, the Lakers struggled to find effective lineups and recorded only two wins through their first seven games. In November, they began a turnaround, which included two of James\'s strongest performances of the season. On November 14, he registered 44 points, 10 rebounds, and nine assists in a victory against the Portland Trail Blazers. Four days later, James scored a season-high 51 points in a victory over the Heat. After blowing out the Golden State Warriors on Christmas Day, Los Angeles improved their record to 20–14, but James suffered a groin injury, the first major injury of his career. James missed a then career-high 17 consecutive games, and the Lakers fell out of playoff contention without him, marking the first time that James missed the playoffs since 2005. In March, the Lakers announced that James would begin a minutes restriction, and he was later officially ruled out for the rest of the season. James\'s final averages were 27.4 points, 8.5 rebounds, and 8.3 assists per game. Despite his inconsistent campaign, James was named to the All-NBA Third Team, marking the first time in twelve years that he did not make the All-NBA First Team. 2019–2020: Fourth NBA championship During the offseason, the Lakers hired Frank Vogel as their new head coach, and traded the majority of their young core to the Pelicans for superstar big man Anthony Davis. James immediately embraced the team\'s much-improved roster by transforming his playing style, moving to full-time point guard, and competing with a more consistent defensive effort. Behind James\'s leadership, the Lakers opened the 2019–20 season with a 17–2 record, matching the best start in franchise history. On January 25, James scored his 33,644th career point, passing Kobe Bryant for third on the all-time regular season scoring list. The following day, Bryant died in a helicopter crash in Calabasas, California. James delivered an improvised eulogy in honor of Bryant at Staples Center, before a January 31 game against the Portland Trail Blazers. In early March, before the season was suspended due to the COVID-19 pandemic, James led the Lakers to a victory over the Milwaukee Bucks in a matchup of conference leaders, followed by a streak-breaking victory over the Los Angeles Clippers. Regular season play resumed in July and concluded in August within the confined NBA Bubble, where James ended the regular season as the league leader in assists for the first time in his career, averaging 10.2 assists per game. He earned a record 16th All-NBA Team selection as part of the First Team, extending his record First Team selections to 13. The Lakers entered the playoffs as the top seed in the West and advanced to the NBA Finals convincingly, with only three total losses along the way. In Game 5 of the Western Conference Finals against the Denver Nuggets, James helped clinch the conference championship by scoring a game-high 38 points, including 16 in the fourth quarter. In the Finals, James and his teammates found themselves matched up with his former team, the Miami Heat, and quickly took control of the series with a 2–0 lead. In Game 5, James had his best statistical performance of the Finals with 40 points, 13 rebounds, and seven assists in a memorable duel with Miami\'s Jimmy Butler, but Los Angeles was ultimately defeated in a three-point game. The Lakers eliminated the Heat in Game 6, which earned James, who averaged 29.8 points, 11.8 rebounds, and 8.5 assists per game during the series, his fourth NBA championship and fourth Finals MVP award. At 35 years and 287 days old, James became the second-oldest player in league history to win the award, and the only player in NBA history to win the award with three different franchises. James and teammate Danny Green also became the third and fourth players in NBA history to win at least one championship with three different teams each. 2020–2021: Back-to-back chase Following the championship, James would sign a two-year, $85.7 million extension that would keep him with the Lakers through the 2022–23 season. The 2020–2021 season, reduced to 72 games for each team and starting on December 22, 2020, due to the COVID-19 pandemic, began after the shortest offseason in NBA history with a 116–109 loss to the Los Angeles Clippers. On December 31, James became the first player in NBA history to score 10 points or more in 1,000 consecutive games in a 121–107 victory over the San Antonio Spurs. On February 18, 2021, James became the third player in NBA history with 35,000 career points, joining Hall of Famers Abdul-Jabbar and Karl Malone; aged 36 years and 50 days, he was the youngest player to reach the milestone. On March 20, James sprained his ankle against the Atlanta Hawks, but was able to hit a three-point shot afterwards to keep his 10-points streak alive before exiting the game.', 'A.C. Green Jr.', 'It was his fourth career All-Star selection and first since 2018. Green missed 31 consecutive games from January to March with a back injury. Up to that point, he was mentioned as one of the favorites to win the NBA Defensive Player of the Year Award. Despite playing in just 46 games, Green was selected to his seventh NBA All-Defensive Team, earning second-team honors. The Warriors advanced to the 2022 NBA Finals, and he won his fourth NBA championship after they defeated the Celtics in six games. In Game 6 of the Finals, Green posted a near triple-double with 12 points, 12 rebounds, 8 assists, 2 steals and 2 blocks in a 103–90 closeout win. During a team practice with the Warriors on October 5, 2022, Green and teammate Jordan Poole got into an altercation, resulting in Green striking Poole in the face. TMZ published a leaked video on October 7, showing the punch but not what led to the incident. On October 9, Green publicly apologized for the incident and announced that he would spend a few days away from the team.', 'He shot 0.462 from the field, .083 from 3-point range, and 0.873 from the free throw line, playing an average of 36.8 minutes per game. In the 1996 season, A.C. Green played for Phoenix in 4 games. He averaged 4.8 points, 4.5 rebounds, 0.5 assists, 0.3 steals, and 0.0 blocks per game.', ""He missed time during the 2017 playoffs due to recurring back issues. Associate head coach Mike Brown acted as acting head coach during periods of Kerr's absence, and Brown continued head coaching into the playoffs leading the Warriors to a 13–0 record in the postseason. Kerr returned in Game 2 of the 2017 NBA Finals, where the Warriors defeated the Cleveland Cavaliers in five games. The Warriors finished the playoffs with a 16–1 record, the best postseason winning percentage in NBA history. Kerr is the fourth coach in NBA history to win two championships in his first three seasons of coaching. He won his third championship as a head coach when the Warriors swept the Cleveland Cavaliers in four games during the 2018 NBA Finals to give Kerr his eighth championship of his career. The Warriors reached their fifth straight Finals under Kerr in 2019, but were defeated by the Toronto Raptors in six games. During Game 5, starting power forward Kevin Durant tore his Achilles, and in Game 6, starting shooting guard Klay Thompson tore his ACL. 2019–present: Injury-plagued season before a return to the promised land During the 2019–20 season, with Thompson out for the year and franchise point guard Stephen Curry only playing five games due to a hand injury, the Warriors finished with the worst record (15–50) in the league. It marked the first time in Kerr's coaching career that he had missed the playoffs. In 2020–21, with Thompson still out due to an Achilles tear but Curry healthy, the Warriors qualified for the newly implemented play-in tournament, but ultimately did not qualify for the playoffs for the second straight season. The Warriors returned to the playoffs in 2021–22 and reached the 2022 NBA Finals. They defeated the Boston Celtics in six games, giving Kerr his fourth championship as a head coach and his ninth championship overall. In the 2022–23 season, Kerr and the Warriors reached the Western Conference Semifinals, where they were defeated in six games by the Los Angeles Lakers. On April 20, 2025, he recorded his 100th playoff win as a head coach, tying Larry Brown for sixth place in the list. = Kerr was an assistant coach on the gold medal-winning United States men's Olympic basketball team at the 2020 Summer Olympics. In December 2021, he was named head coach of the U.S. men's basketball team. In 2023, Kerr led the United States team to a disappointing fourth place finish at the FIBA World Cup as the U.S. failed to win a medal for the second consecutive tournament after an overtime loss to Canada in the bronze medal game, 127–118. 2024 Summer Olympics At the 2024 Summer Olympic Men's Basketball Tournament, Kerr coached the United States team to its fifth consecutive gold medal at Paris' Bercy Arena in a win over host country France, 98–87. This was a reprise of the win over the French Team at the Tokyo Olympics. = Kerr is the first head coach in NBA history to lead his team to 67 or more wins in three consecutive seasons. Kerr was named one of the Top 15 Coaches in NBA History in 2022, when the league commemorated its 75th anniversary. In March 2025, he overtook Al Attles as the Warriors coach with the most wins in franchise history. Kerr married Margot Brennan, his college sweetheart, in 1990. They have three children.""]","AJ Green recorded his fourth consecutive 1,000 yard season in the year 2015.",2015,,0.9170102993251469,0.7794011543881644,,0.7984417455152588,0.7937669820610351
What was Ronald Dupree's shooting percentage from the field in the specified season?,"[""Ronald Edmund Dupree Jr. (born January 26, 1981) is an American former professional basketball player who played six seasons in the National Basketball Association (NBA). He also played numerous seasons in the NBA Development League, and spent time in Europe and Argentina. After his playing retirement, Dupree was a college basketball assistant coach and works as a scout for the Milwaukee Bucks. Dupree played at Louisiana State University (LSU) under Coach John Brady. He averaged 4.9 points and 3.3 rebounds in 12.7 minutes per game in the Tigers' 2000 Sweet Sixteen season."", ""On December 14, 2007, he was waived so the Pistons could make room for other players obtained in a trade with the Charlotte Bobcats. He was signed to a ten-day contract by the Seattle SuperSonics on April 3, 2008, becoming the last player to sign with the Sonics. Dupree started the 2008–2009 season with the Tulsa 66ers of the NBA Developmental League. Halfway through the season he was traded to the Utah Flash, and helped take that team to the D-League finals. Dupree was invited to training camp with the Utah Jazz for preparation to the 2009–2010 season. However, he did not make their final roster. He signed a non-guaranteed contract with the Toronto Raptors on September 16, 2010. Dupree was released from the Toronto Raptors roster on October 19, 2010. He was re-signed by Toronto on December 26, 2010, but waived again on January 5, 2011. He signed with the Argentine team Regatas Corrientes in January 2012. He then signed with the Italian team Andrea Costa Imola Basket in February 2012. In September 2012, he joined the Memphis Grizzlies, but he did not make the team's regular season roster. On January 4, 2013, Dupree was acquired by the Los Angeles D-Fenders. On February 25, 2013, Dupree was traded to the Reno Bighorns. On August 8, 2013, he signed a two-year deal with Hapoel Jerusalem. On September 10, 2014, he announced his retirement and became a student assistant on the LSU men's basketball staff. Dupree returned to LSU as a student assistant coach in 2014. He was elevated to the position of director of student development for the 2015–16 season. Dupree was hired by the Nevada Wolf Pack men's basketball team as an assistant coach for the 2016–17 season. He departed the position in 2017 to join the Milwaukee Bucks as a scout. = = Career statistics from NBA.com · Basketball Reference LSU Tigers bio\n\nIn the 2003–04 season, Ronald Dupree played for Chicago in 47 games. He averaged 6.2 points, 3.6 rebounds, 1.2 assists, 0.7 steals, and 0.4 blocks per game. He shot 0.394 from the field, 0.444 from 3-point range, and 0.629 from the free throw line, playing an average of 19.0 minutes per game. In the 2004–05 season, Ronald Dupree played for Detroit in 47 games. He averaged 3.2 points, 2.0 rebounds, 0.5 assists, 0.1 steals, and 0.2 blocks per game. He shot 0.48 from the field, 0.5 from 3-point range, and 0.617 from the free throw line, playing an average of 10.0 minutes per game. In the 2005–06 season, Ronald Dupree played for Minnesota in 36 games. He averaged 2.2 points, 1.4 rebounds, 0.4 assists, 0.3 steals, and 0.0 blocks per game. He shot 0.524 from the field, 0.0 from 3-point range, and 0.341 from the free throw line, playing an average of 7.4 minutes per game. In the 2006–07 season, Ronald Dupree played for Detroit in 19 games. He averaged 1.3 points, 0.9 rebounds, 0.3 assists, 0.3 steals, and 0.1 blocks per game. He shot 0.355 from the field, 0.0 from 3-point range, and 0.333 from the free throw line, playing an average of 4.9 minutes per game. In the 2007–08 season, Ronald Dupree played for Detroit in 1 games. He averaged 0.0 points, 0.0 rebounds, 0.0 assists, 0.0 steals, and 0.0 blocks per game. He shot 0.0 from the field, 0.0 from 3-point range, and 0.0 from the free throw line, playing an average of 3.0 minutes per game. In the 2007–08 season, Ronald Dupree played for Seattle in 4 games. He averaged 1.0 points, 2.0 rebounds, 0.3 assists, 0.3 steals, and 0.0 blocks per game. He shot 0.333 from the field, 0.0 from 3-point range, and 1.0 from the free throw line, playing an average of 4.5 minutes per game. In the 2010–11 season, Ronald Dupree played for Toronto in 3 games. He averaged 0.7 points, 1.0 rebounds, 0.3 assists, 0.0 steals, and 0.0 blocks per game. He shot 0.25 from the field, 0.0 from 3-point range, and 0.0 from the free throw line, playing an average of 4.3 minutes per game. In the 2005 season, Ronald Dupree played for Detroit in 14 games. He averaged 0.3 points, 0.4 rebounds, 0.0 assists, 0.0 steals, and 0.0 blocks per game."", 'What I am? I am a Japanese-American, I take great pride in that."" Walters is known as a hard working, selfless person with a great passion to motivate and lead others. Walters daughter, Addison Walters is currently with the Minnesota Timberwolves staff serving as a Video Associate. = Northwestern (1988–1990) Walters played at Northwestern University (1988–1990) and was All Big 10 honorable mention leading the team in scoring. Kansas (1990–1993) In 1990, he transferred to Kansas, playing two seasons. In 68 starts under Roy Williams, he averaged 15.6 points per game, leading the Jayhawks in scoring during both his junior and senior campaigns. KU combined to go 56–12 overall in 1991–92 and 1992–93, winning back-to-back Big Eight titles and reaching the 1993 Final Four. Walters was named to the All-Big Eight team both seasons and was Big Eight Male Athlete of the Year as a senior in 1993. As a junior, Walters averaged 16.0 points per game as the Jayhawks went 27–5. In his senior season, KU had a record of 29–7, with Walters scoring at a clip of 15.3 points per game. Walters was an outstanding scorer from all areas of the court at Kansas, shooting nearly 51% from the field, 42% from three-point range and 85% at the free throw line. The 6\'4"" shooting guard was selected by the New Jersey Nets with the 16th pick in the 1993 NBA draft. = Walters’ professional playing career spanned 10 seasons, including seven seasons in the NBA with the New Jersey Nets (1993–95), Philadelphia 76ers (1995–98) and Miami Heat (1998–2000). He also had stints with Baloncesto Leon (2000), the Kansas City Knights (2000–01; 2002–03) and CB Gran Canaria (2001–02). The New Jersey Nets selected Walters with the 16th overall pick in the 1993 NBA draft. As a rookie, Walters led the team in field goal percentage (.522) and hit 14 of 28 three-point attempts. His role expanded in 1994–95 and his statistics improved in nearly every category. In 1995–96, Walters was dealt to the Philadelphia 76ers and started the last eight games of the season. He played in 59 games for Philadelphia in 1996–97, making 16 starts behind Allen Iverson and Jerry Stackhouse. He led the team in three-point shooting with a .385 mark while averaging 6.8 points a game. He played in 38 games in 1997–98, splitting the season between Philadelphia and Miami, which signed him after he was waived by the Sixers in January of ’98. He appeared in 33 games (13 starts) for the Heat in 1998–99 and averaged 3.1 points a game. After leaving the NBA, Walters played for León and Gran Canaria in Spain. In addition to his playing career, Walters had a minor role in the 1994 film Blue Chips starring Nick Nolte and Shaquille O\'Neal. = (2002–2003) Blue Valley NW High School, Assistant Coach, qualifying for the Kansas Class 6A State Tournament.', 'He shot .607 from the field, — from 3-point range, and 0.738 from the free throw line, playing an average of 22.9 minutes per game.', 'He was one of the best recruits in the country. He ranked among the top-100 players in the nation by the following: Rivals.com (#83)(#21 power forward) ESPNU100 (#87) (#17 power forward) Scout.com (#95) (#23 center) He averaged 19.8 points, 13.0 rebounds and 3.8 blocks as a junior, shooting 53.4 percent from the field and 72 percent from the foul line. Costello posted a school-record 19 double-doubles. He helped his team improve from 10 to 11 in 2010 to 24–3 in 2011, leading Bay City Western to Class A state semifinals for the first time in school history. His stats earned him MVP of Saginaw Valley Association. Costello averaged 16.7 points 11.8 rebounds, 3 blocks and 3 assists as a sophomore and set a school record with 14 blocks in a single game. In 2010 Bay City Times named him to the Dream Team and first-team All-Saginaw Valley League selection. He was a National Honor Society member. = As a freshman, Costello appeared in 30 games, averaging 6.1 minutes,1.5 points and 1.3 rebounds, shooting .469 from the field. His .824 free-throw percentage (14–17) was tops on the team.', 'He shot 0.623 from the field, .500 from 3-point range, and 0.711 from the free throw line, playing an average of 32.0 minutes per game.', ""In 1999, he moved to Canberra to attend the Australian Institute of Sport in conjunction with Lake Ginninderra College. Between 1999 and 2001, he played for the Australian Institute of Sport's SEABL team. In 2001, he led the team in scoring (15.2 points per game) and rebounding (9.2 per game), while also averaging 1.65 blocks per game and shooting 54 percent from the floor. He was subsequently named AIS Junior Athlete of the Year. Also in 2001, he became the first high school student to play for the Boomers when he took part in the East Asian Games. Additionally, he was a member of the Australian national under-21 team which finished eighth at the FIBA Under-21 World Championship. From 2001 to 2005, Schenscher played college basketball for Georgia Tech. As a freshman, he started five of first six games before being sidelined for 12 games with a broken foot. He led Tech in field goal percentage (.587) and averaged 4.8 points and 3.2 rebounds for the season. As a sophomore, he started 16 games and ranked third on the team in field goal percentage (.472) and second in blocked shots (25). As a junior in 2003–04, Schenscher finished fourth in the ACC in blocks (1.4 bpg) and eighth in rebounds (6.6 rpg). He shot .565 from the floor."", 'He shot 0.561 from the field, .250 from 3-point range, and 0.752 from the free throw line, playing an average of 22.9 minutes per game.', ""In the first year, Eastern was upset by lightly regarded Metcalfe County in the first round, 60–58. A year later as a senior, Eastern was eliminated in the quarter-finals by Hazard High School. Spencer attended the University of Louisville, where he played college basketball for the Louisville Cardinals. He became the all-time field goal percentage leader at 62.8%. He took over the center position as a senior in 1989–90 after Pervis Ellison left to join the NBA. That season Spencer paced the Cardinals in scoring (14.9 ppg), rebounding (8.5 rpg), blocked shots (69), and field goal percentage (68.1%). The Minnesota Timberwolves selected Spencer in the first round, with the sixth overall pick, in the 1990 NBA draft. As a rookie, Spencer split time at center with 7-foot-3-inch (2.21 m) veteran Randy Breuer, but still managed respectable numbers, averaging 7.1 points and 7.9 rebounds per game, and shooting 51.2% from the floor. He finished the season with 272 offensive rebounds, the seventh-most in the NBA that year. Additionally, he blocked 121 shots, establishing a single-season record for the young franchise that would stand until Kevin Garnett's rookie season in 1995–96. For his efforts, Spencer was named to the NBA All-Rookie Second Team that year."", 'He shot 0.483 from the field, 0.322 from 3-point range, and 0.752 from the free throw line, playing an average of 32.9 minutes per game.', 'In addition, according to different analysts, he resembles NBA players LeBron James and Julius Randle. Lee Sartor, Williamson\'s high school coach, reported that basketball coach Roy Williams told Williamson ""that he was probably one of the best high school players he\'s seen since Michael Jordan."" Williamson, who is left-handed, is almost ambidextrous. While in high school, Williamson drew national attention for his slam dunks. The Charlotte Observer remarked that he ""could be the best high-school dunker in history."" NBA point guard John Wall has likened Williamson\'s in-game dunking ability to that of Vince Carter. Williamson\'s outside shooting has been considered a point of concern, and he has unorthodox shot mechanics. Recruiting service 247Sports has praised his ball handling and passing skills for his size, commenting that they are ""overshadowed by [his] athletic plays."" Williamson has the ability to defend multiple positions well due to his speed and length, although his defensive effort has been questioned. He is a skilled shot-blocker and rebounder. At various points during his NBA career, Williamson has received criticism in the media from basketball observers who perceive him to be overweight. Prior to the start of the 2021–2022 season, Williamson\'s weight increased to over 300 lbs. Williamson lost weight in 2022. In 2023, however, retired basketball players Charles Barkley and Shaquille O\'Neal each expressed concerns about Williamson\'s weight. Williamson\'s 2022 contract extension with the New Orleans Pelicans provides for salary reductions in the event that Williamson fails to maintain his weight and body fat percentage at specified levels. Since the inaugural In-Season Tournament during the 2023 season, Williamson has seen significant improvements to his physique, losing 25 lbs. On July 23, 2019, Williamson signed a five-year, $75 million shoe deal with Jordan brand. Williamson\'s deal is the second-largest rookie shoe deal in history, trailing only LeBron James\'s $90 million rookie deal signed in 2003. On March 13, 2020, Williamson pledged to pay the salaries of all the employees of the Smoothie King Center for 30 days during the suspension of the 2019–20 NBA season, which was caused by the COVID-19 pandemic. He was one of several basketball players to help the arena workers.', 'He shot 0.608 from the field, 0.5 from 3-point range, and 0.692 from the free throw line, playing an average of 27.7 minutes per game.', ""Allen signed a multi-year contract with Cleveland on August 6. On October 20, 2021, in a 132–121 loss to the Memphis Grizzlies, Allen became the first player since the shot clock was introduced in the 1954–55 NBA season to make 10 or more field goals without a miss in a season opener. Allen was named a replacement for Harden, for whom he was traded a year prior, on Team LeBron in the 2022 NBA All-Star Game. Starting all the 56 games he played, Allen finished the 2021–22 season averaging a number of career best with 16.1 points, 10.8 rebounds, 1.6 assists, 1.3 blocks, and .8 steals per game, while shooting .677, .100, and .708 from the field, the three-point line, and on free throws, respectively, on 32.3 minutes per game. Alongside rookie and fellow Cavalier Evan Mobley, Allen led Cleveland from a .306 winning percentage and the league's sixth-worst defense to a .537 winning percentage and the league's fifth best defense for efficiency; it was .578 before Allen suffered a fractured finger injury in early March. On December 28, 2023, he scored 24 points, grabbed 23 rebounds, recorded 6 assists and 2 steals in a 113–110 victory over the Dallas Mavericks. The next day, Allen posted 30 points, 12 rebounds, six assists and two blocks on 15-of-17 shooting from the field in a 119–111 loss against the Milwaukee Bucks. On January 22, 2024, he set the franchise record for consecutive double-doubles during a win against the Orlando Magic by passing the 11-game streak held by both Andre Drummond and Elmore Smith. In Game 2 of the Cavaliers' first round playoffs series against the Orlando Magic, Allen recorded a playoff career-high 20 rebounds, along with 16 points, three assists, two steals and three blocks in a 96–86 win. On July 31, 2024, Allen and the Cavaliers agreed to a three–year, $91 million max contract extension. = Regular season Playoffs = Allen's father Leonard was drafted by the Dallas Mavericks in the 1985 NBA draft and played at San Diego State and in Spain. His older brother Leonard Jr."", 'He shot 0.616 from the field, 0.25 from 3-point range, and 0.72 from the free throw line, playing an average of 30.6 minutes per game.', 'Robert J. Hite II (born January 12, 1984) is an American former professional basketball player. He played briefly for the Miami Heat in the National Basketball Association (NBA), as well as in the NBA G League and in the top leagues of Turkey, Spain, Belgium, France and Israel. Hite, at 6\'2"" and 184 lbs., played four seasons at the University of Miami appearing in 121 games (109 starts) and averaged 14.2 points, 4.6 rebounds, 1.55 steals and 1.5 assists. He finished fifth on Miami\'s career scoring list with 1,717 points, fourth on UM\'s career steals list with 187 and third in three-point field goals made with 228. His 84.9 career shooting percentage from the free throw line ranks second in school history while his 38.4 shooting percentage from three-point range ranks third all-time. His 109 career starts also rank second on Miami\'s all-time list. As a senior, he led Miami in steals (50) while ranking second on the team in scoring (558) and rebounding (198). Hite was a third-team All-ACC selection and named to the All-District 6 first-team by the National Association of Basketball Coaches (NABC) after starting all 34 games, averaging 16.4 points, 5.8 rebounds, 1.47 steals and 1.4 assists while connecting on 85 three-point field goals, setting a new UM single-season record. As a junior, he appeared in all 29 games (28 starts) and averaged 17.3 points, 5.0 rebounds, 1.55 steals and 1.1 assists. Hite was an Honorable-mention All-ACC selection and earned Player of the Week honors on December 13. As a sophomore, he appeared in all 30 games (29 starts) and averaged 15.2 points, 3.6 rebounds, 2.03 steals and 2.0 assists. He was named Big East Player of the Week on Dec 29th and was also named to the All-Tournament team at the 2003 Las Vegas Tourney. As a freshman, he appeared in all 28 games (18 starts) and averaged 7.3 points, 3.6 rebounds, 1.4 assists and 1.11 steals. He ranked third on the team in scoring and became the first University of Miami freshman since 1992 to open the season with four consecutive double-figure scoring games. After going undrafted in the 2006 NBA draft, he joined the Miami Heat for the 2007 NBA Summer League. In August 2006, he signed a multi-year deal with the Heat. Hite played his first NBA game in the Heat\'s season opener against the Chicago Bulls on October 31, 2006. He went 0–3 from the field to go scoreless in 5 minutes with 1 rebound and 1 steal. Hite\'s best game came against the San Antonio Spurs on November 22, 2006. He scored 9 points on 4–6 shooting and went 1–1 from the three-point line.', 'He shot 0.612 from the field, 0.343 from 3-point range, and 0.733 from the free throw line, playing an average of 33.5 minutes per game.', ""That year he played alongside teammate Tom Jamerson, his younger brother. After his college career at Ohio, Jamerson was underestimated despite finishing third nationally in scoring because the school had not produced an NBA player since Howie Jolliff in the early 1960s. He participated in the Portsmouth Invitational Tournament, earning tournament MVP honors and a late invitation to the Orlando All-Star Classic. Jamerson turned heads both on hot shooting nights and his off games when he had to demonstrate his all around game during the summer all-star circuit. = Jamerson's 60-point/14-three point shot performance established several records. The previous school single-game record had been 45 by Fred Moore in 1957. The previous conference record had been 53 by Tommie Johnson. Scott Tedder of Ohio Wesleyan set the arena record with 50 points on November 28, 1987, which still stood as the visiting player record as of 2023. His NCAA record total of 14 three-point shots was not matched until Askia Jones went 14–18 on March 24, 1994, for Kansas State of the Big Eight Conference against Fresno State of NCAA Division I Western Athletic Conference. It was not surpassed until Keith Veney posted 15 on December 14, 1996, for Marshall of the Southern Conference against Morehead State of the Ohio Valley Conference. Also as of 2018, his single-season three-point shot total of 131 and average of 4.68 per game were still standing conference records. His single-season point total of 874 stood as a conference record from 1990 until 2017 when Marcus Keene posted 959. His conference record 14 single-game three point shots was tied by Ronald Blackshear on March 1, 2002, but had not been surpassed as of the beginning of the 2018–19 season. When his college basketball eligibility expired, his career total of 2,336 points was second in MAC history to Ron Harper (2,377). Since no MAC player had scored 52 points since he tied the conference single-game scoring record, he still shared that record as of 2018. Jamerson is listed five times in the NCAA's 2022-23 Division I Men's Basketball Record book: 1.) 3rd in scoring in 1990 31.2 points per game, 2.) 1990 national leader with 4.68 three-point shots per game, 3.) the 60-point game is listed as tied for 13th in the annual top 25 update for single-game scoring highs (vs. Non-DI), 4.) 14 single-game three point shots made is listed as tied for 4th in annual top 25 update, and 5.) 4.68 single-season three point shots per game is listed 6th in the annual top 25 update. According to the Ohio Men's Basketball 2023–24 Record Book Jamerson currently holds the following school records: career points (2,336), career field goals made (864), single-season points (874), single-season scoring average (31.4), single-season three-point shots made (131), single-game points (first and second with 60 and 52), single-game field goals made (21 and 20), single-game three point field goals made (14 and 11), single-game three-point field goal percentage (5–5=100%), Per the same source, he formerly held the following school records: career three-point field goals made (239, surpassed by Tommy Freeman 2011), career three-point field goal percentage (41.9%, surpassed by Freeman 2011 44.3%), single-season field-goals made (297, surpassed by Gary Trent in 1994). Many of Jamerson's records are for three-point shots. When he established his three-point shot records, the three-point line was at 19 feet 9 inches (6.02 metres), but for the 2008–09 NCAA Division I men's basketball season, the line was extended to 20 feet 9 inches (6.32 metres). For the 2019–20 NCAA Division I men's basketball season, the line was further extended to 22 feet 1.75 inches (6.75 metres). Jamerson's #33 jersey was retired during halftime in a banner-raising ceremony during a January 24, 2007, game at Ohio University' Convocation Center. He was inducted into the Ohio Athletics Hall of Fame in 1995."", 'He shot 0.636 from the field, .214 from 3-point range, and 0.701 from the free throw line, playing an average of 28.8 minutes per game.', ""While playing in 70 games and not missing much playing time, he averaged career lows in points (8.3) and field goal attempts (6.0). It has been said that much of this decline can be attributed to the main offensive emphasis on Carlos Boozer, Deron Williams, and Mehmet Okur, and that Kirilenko was uncomfortable losing his position as the main go-to guy on the team. His frustration eventually culminated in a widely publicized breakdown near the end of the Jazz's first-round playoffs series against the Houston Rockets. Kirilenko bounced back to lead Russia to the championship in EuroBasket 2007, and was named MVP of the tournament. Following his performance in the 2007 EuroBasket, he asked to be released from his contract to return to Russia to play basketball. Despite the trade rumors and controversy created by these statements, he rebounded in the 2007–08 NBA season and backed off on trade demands. His statistics for the 2007–08 NBA season were 11.0 ppg, 4.7 rpg, 4.0 apg, 1.2 spg, and 1.5 bpg, all of which were improvements over his previous season's stats (with the exception of blocks and rebounds). He worked out personally with former Jazz shooting guard Jeff Hornacek on his shooting in the 2007 off-season, and his field goal percentage improved from 47% to 51%.""]",Ronald Dupree's shooting percentage from the field in the 2003–04 season was 0.394 (or 39.4%).,0.286,0.5,0.9705435879210391,0.622961249270117,1.0,0.19188069971432886,0.7675227988573154
In which year did Kirk Haston play basketball?,"['The expulsion was widely characterized as unprecedented. = Source = Source Regular season Playoffs = Source Regular season = = = Career statistics from NBA.com · Basketball Reference\n\nIn the 1998–99 season, Kirk Haston played for Indiana in 34 games. He averaged 9.9 points, 6.5 rebounds, 0.9 assists, 0.6 steals, and 0.8 blocks per game. He shot 0.514 from the field, – from 3-point range, and 0.753 from the free throw line, playing an average of 22.4 minutes per game. In the 1999–00 season, Kirk Haston played for Indiana in 29 games. He averaged 15.3 points, 8.3 rebounds, 1.4 assists, 0.8 steals, and 1.2 blocks per game. He shot 0.496 from the field, .000 from 3-point range, and 0.73 from the free throw line, playing an average of 27.4 minutes per game. In the 2000–01 season, Kirk Haston played for Indiana in 33 games. He averaged 19.0 points, 8.7 rebounds, 1.2 assists, 1.1 steals, and 1.2 blocks per game. He shot 0.44 from the field, .377 from 3-point range, and 0.687 from the free throw line, playing an average of 30.8 minutes per game. In the 2001–02 season, Kirk Haston played for Charlotte in 15 games. He averaged 1.7 points, 1.3 rebounds, 0.3 assists, 0.0 steals, and 0.1 blocks per game. He shot 0.282 from the field, 0.0 from 3-point range, and 0.5 from the free throw line, playing an average of 5.1 minutes per game. In the 2002–03 season, Kirk Haston played for New Orleans in 12 games. He averaged 0.5 points, 0.6 rebounds, 0.3 assists, 0.0 steals, and 0.4 blocks per game. He shot 0.118 from the field, 0.0 from 3-point range, and 0.5 from the free throw line, playing an average of 4.8 minutes per game. In the 2002 season, Kirk Haston played for Charlotte in 2 games. He averaged 1.0 points, 0.5 rebounds, 0.0 assists, 0.5 steals, and 0.0 blocks per game. He shot 1.0 from the field, – from 3-point range, and – from the free throw line, playing an average of 2.0 minutes per game. In the 2004–05 season, Kirk Haston played for Florida in 46 games. He averaged 16.4 points, 7.9 rebounds, 1.6 assists, 1.1 steals, and 1.6 blocks per game. He shot 0.456 from the field, 0.444 from 3-point range, and 0.705 from the free throw line, playing an average of 36.4 minutes per game.', 'Kirk Haston (born March 10, 1979) is an American former professional basketball player and politician. He played for Indiana University under coach Bobby Knight between 1998–99 and 2000–01. He was subsequently drafted 16th overall in 2001 by the Charlotte Hornets, with whom he played a reserve role for two years during the team\'s transition to New Orleans. Since 2019, Haston has been a member of the Tennessee House of Representatives, representing Tennessee\'s 72nd state congressional district as a Republican. Born in Lobelville, Tennessee, he attended Perry County High School in Linden, Tennessee, where, as a senior, he was a part of the 37–0 Class A state championship team, being named Class A ""Mr.', ""His college career took place under head coach Bob Knight and Mike Davis at Indiana University where, in the 2000–01 season he led the Big Ten Conference in scoring and was a third-team All-American selection. In the 2000–01 season, Haston's buzzer-beating three-pointer helped IU beat the defending champion and top-ranked Michigan State 59–58 at Assembly Hall. During his sophomore year, he lost his mother, Patti Kirk Haston, 48, in a tornado that hit the county seat, Linden, Tennessee on May 5, 1999. Haston was selected 16th overall by the Charlotte Hornets in the 2001 NBA draft; many analysts, who had pegged Haston in the late first round-early second round area, thought that the Hornets took Haston to be a 'zone breaker', working against the change in rules that allowed some forms of the zone defense in games. Haston was known for his sky hook shot and shooting range for a forward/center. Haston averaged 1.2 points and 1 rebound per game, playing in 27 games. Haston would only play in the NBA for 2 years as his final NBA game was played on March 7, 2003, in a 102–76 win over the Cleveland Cavaliers. In his final game, Haston recorded 2 points and 1 rebound in 8 minutes of play. He played the 2004–05 season with the Florida Flame for head coach Dennis Johnson in the NBA D-League. There he averaged 16 points, 7.9 rebounds, 1.2 blocks per game and was selected to the All NBDL First-Team. His season came to an end when he suffered a right knee injury that required season-ending knee surgery with three games remaining. In 2005, he signed with Upea Capo D'Orlando of the Serie A. He and his wife Kasey soon returned from Sicily to Middle Tennessee when he was waived due to a right knee injury prior to the start of the season. In 2010, he came back to Perry County High School to coach the boys basketball team. He then led his alma mater to two state appearances in his first seasons. In 2012, the Perry County Vikings finished their season as state runner-up. In 2016 he published Days of Knight: How the General Changed My Life in which he details his mostly positive experiences playing for then Indiana Coach Bob Knight. Knight provided assistance and an endorsement during Haston's 2018 campaign to the Tennessee House of Representatives. In 2018, Haston was elected to the Tennessee House of Representatives, representing District 72. He won with 81% of the vote. Haston was inaugurated on January 8, 2019. That same month, Haston was appointed as the Vice Chairman of Tennessee's House Education Committee. In 2023, Haston supported a resolution to expel three Democratic lawmakers from the legislature for violating decorum rules."", 'You pay your debt to society and you humble yourself and you learn from your mistakes. So everybody deserves a second chance, maybe a third chance."" = = Media related to Kirk Snyder at Wikimedia Commons Career statistics from NBA.com · Basketball Reference\n\nIn the 2004–05 season, Kirk Snyder played for Utah in 68 games. He averaged 5.0 points, 1.8 rebounds, 0.5 assists, 0.4 steals, and 0.3 blocks per game. He shot 0.372 from the field, 0.353 from 3-point range, and 0.667 from the free throw line, playing an average of 13.3 minutes per game. In the 2005–06 season, Kirk Snyder played for NO/Oklahoma City in 68 games. He averaged 8.0 points, 2.4 rebounds, 1.5 assists, 0.4 steals, and 0.3 blocks per game. He shot 0.453 from the field, 0.357 from 3-point range, and 0.735 from the free throw line, playing an average of 19.3 minutes per game. In the 2006–07 season, Kirk Snyder played for Houston in 39 games. He averaged 4.9 points, 2.1 rebounds, 1.0 assists, 0.3 steals, and 0.3 blocks per game. He shot 0.452 from the field, 0.25 from 3-point range, and 0.653 from the free throw line, playing an average of 14.4 minutes per game. In the 2007–08 season, Kirk Snyder played for Houston in 9 games. He averaged 3.8 points, 1.3 rebounds, 0.9 assists, 0.1 steals, and 0.1 blocks per game. He shot 0.464 from the field, 0.222 from 3-point range, and 0.545 from the free throw line, playing an average of 9.0 minutes per game. In the 2007–08 season, Kirk Snyder played for Minnesota in 27 games. He averaged 8.4 points, 4.2 rebounds, 2.1 assists, 0.7 steals, and 0.5 blocks per game. He shot 0.516 from the field, 0.214 from 3-point range, and 0.753 from the free throw line, playing an average of 25.2 minutes per game. In the 2007 season, Kirk Snyder played for Houston in 3 games. He averaged 0.7 points, 0.3 rebounds, 0.0 assists, 0.0 steals, and 0.0 blocks per game. He shot 0.333 from the field, 0.0 from 3-point range, and 0.0 from the free throw line, playing an average of 3.0 minutes per game.', 'Kirk James Hinrich ( HYNE-rik born January 2, 1981) is an American former professional basketball player. He has also been a member of the USA National Team. Growing up in Sioux City, Iowa, Hinrich was exposed to basketball at an early age. His father, Jim, coached him from the third grade through high school. As a high school senior, Hinrich was named the 1999 Co-Iowa Mr. Basketball, along with future college teammate and roommate Nick Collison. Hinrich originally committed to play basketball at Iowa State but when the coach at the time, Tim Floyd, took the head coaching position for the NBA\'s Chicago Bulls, Hinrich changed his mind and decided to attend the University of Kansas. Hinrich helped Kansas to consecutive Final Fours in 2002 and 2003, his junior and senior seasons. He was drafted by the Chicago Bulls with the seventh pick in the 2003 NBA Draft, where he earned the nickname ""Captain Kirk"". Hinrich was the Bulls\' all-time leader in three-point field goals until November 29, 2024 when this was surpassed by Zach LaVine. After seven seasons with the Bulls, he had short stints with the Washington Wizards and Atlanta Hawks before returning to the Bulls in 2012. In 2016, he was traded back to the Atlanta Hawks. Hinrich was born to Jim and Nancy Hinrich of Sioux City, Iowa. His father played basketball at Briar Cliff College and later became a coach for Sioux City West High School. When Hinrich was about seven years old, Jim Hinrich visited Ray Nacke, his old college coach, and asked if Kirk could enroll in Nacke\'s summer camp for fourth, fifth, and sixth graders. Despite Nacke\'s hesitations, Hinrich was allowed to attend the camp, and played well against the older children. After just two years, Hinrich advanced to Nacke\'s camp for young teenagers, and excelled there, as well. Hinrich also played football at the quarterback position, and baseball as a pitcher. However, basketball was Hinrich\'s passion. His role model was Seattle SuperSonics star Gary Payton, a player known for his strong defense. With his father as coach, Hinrich\'s basketball team at Sioux City West High School achieved an 82–9 record over four years, and won the Iowa state championship when Hinrich was a senior. When he graduated, Hinrich was West High\'s all-time leader in points, steals, and assists. As a freshman with the University of Kansas Jayhawks, Hinrich tallied 123 assists and received the Clyde Lovellette Most Improved Player Award. The next year, he ranked eighth in the nation in assists per game (6.9), led his team in steals, and set a Kansas Jayhawks record with a .505 three-point shooting mark. Hinrich was also voted onto the Associated Press All-Big 12 Second Team and earned All Third Team status from the NCAA coaches. In his fourth and final season at Kansas, Hinrich, along with power forward Nick Collison, led the Jayhawks to the Final Four, and was voted onto the All-Big 12 Second Team by coaches and the media. He led his team in free throw shooting and three-point shooting, contributed 5.0 assists per game and received Kansas\' Ted Owens Defensive Player Award. Kansas lost to Syracuse in the championship Game but Hinrich was named the Midwest Region\'s Most Outstanding Player. He ranked second on his team in scoring and led it in three-pointers, while also contributing 3.5 assists per game, 3.9 rebounds per game and 1.9 steals a game. Following the season, he was named a third-team All-American by the Associated Press. On March 1, 2009, Kansas retired Hinrich\'s number 10 jersey and raised it to the rafters of Allen Fieldhouse. Hinrich\'s was the 25th jersey to be retired by Kansas and is an honor reserved for the highest caliber of player, which includes names like Wilt Chamberlain and Paul Pierce. Hinrich was quoted as saying: ""I don\'t know if there\'s a greater honor in basketball than to have your jersey hanging in the most historic basketball building in the world. It\'s an unbelievable honor."" = 2003 draft Hinrich was selected by the Chicago Bulls in the 2003 NBA draft with the seventh overall pick, resulting in mild surprise because he had been expected to be a mid to late first-round draft pick. Some doubted that his college game would translate successfully to the professional league, in part because he played shooting guard for his final two years in college and was considered too small to play that position professionally. Hinrich\'s high selection in the draft is credited to a good workout in front of NBA team scouts. The Bulls needed a point guard, as Jay Williams was severely injured in a motorcycle accident. After being picked by the Bulls, Hinrich said he knew they had a need at point guard: ""I know Jay... [W]e came out of high school the same year. He\'s a great guy. I feel for him, but the rumors were Chicago was going to take a point guard, so I had a good chance to be drafted. The situation is tough.', 'I don\'t think Kirk did anything. He was just playing aggressive defense. Kirk didn\'t do anything dirty. I don\'t appreciate him taking shots at our guys."" Sports Illustrated columnist Chris Mannix called Riley\'s comments ""on the border of hypocrisy"" while maintaining that Hinrich\'s grab of Wade\'s wrist, while illegal, was not a dirty play. ""For starters, the play itself hardly qualifies as dirty.', ""He was selected by the Milwaukee Bucks in the second round (44th pick overall) of the 1990 NBA draft. He was an assistant basketball coach at the University of Oklahoma under his former college coach Lon Kruger. Henson played collegiately at Kansas State University, where he was named to the All-Big Eight Conference first team in 1989. He is Kansas State's all-time leader in assists, and remains in the top ten on the all-time NCAA career free throw percentage list, with a .900 mark. He was also a track and field decathlete at Kansas State. In six seasons in the NBA, Henson played for the Bucks, Atlanta Hawks, Charlotte Hornets, Portland Trail Blazers, and Detroit Pistons. During his NBA career, Henson appeared in 238 games and averaged 3.1 points per game. = = Since retiring from playing basketball, Henson has turned to coaching."", 'Kirk, a 7\'0"" center, played at Los Alamos High School in Los Alamos, New Mexico. He came to the University of New Mexico in 2010, averaging 4.7 points and 3.7 rebounds per game in the 2010–11 season. In the offseason, Kirk underwent back surgery for a herniated disc and subsequently redshirted the 2011–12 season. Kirk bounced back as a redshirt sophomore, averaging 12.1 points, 8.1 rebounds and 1.8 blocked shots per game. At the conclusion of the season, Kirk was named second team All-Mountain West Conference and a member of the league\'s All-Defensive team. In the summer of 2013, Kirk was named to the United States\' team for the 2013 Summer Universiade. He averaged 3.7 points and 4.6 rebounds as the team finished in ninth place. In 2013–14, Kirk increased his numbers to 13.2 points, 8.7 rebounds and 2.7 blocks per game. He was named third team All-MWC and repeated as a member of the All-Defensive team. In April 2014, Kirk declared for the NBA draft, foregoing his final year of college eligibility. = After going undrafted in the 2014 NBA draft, Kirk joined the Cleveland Cavaliers for the 2014 NBA Summer League. On August 11, 2014, he signed with the Cavaliers. During his rookie season with the Cavaliers, he had multiple assignments with the Canton Charge of the NBA Development League. On January 5, 2015, Kirk was traded to the New York Knicks in a three-team trade that also involved the Oklahoma City Thunder. Two days later, he was waived by the Knicks. = On January 10, 2015, Kirk was acquired by the Canton Charge. In 46 games for the Charge in 2014–15, he averaged 12.5 points, 6.5 rebounds, 1.1 assists and 1.1 blocks per game. = On August 15, 2015, Kirk signed with Pistoia Basket 2000 of the Italian Serie A for the 2015–16 season. Kirk averaged 16.3 points and 7.6 rebounds per game for Pistoia, which reached the Serie A playoffs before being eliminated in the first round by Scandone Avellino. = In July 2016, Kirk played for the San Antonio Spurs in the Utah session of the 2016 NBA Summer League. He then played for the Toronto Raptors in the Las Vegas session. On July 29, 2016, Kirk signed to play for the Guangzhou Long-Lions of the Chinese Basketball Association for the 2016–17 season. On November 15, he was released by Guangzhou. = On January 16, 2017, Kirk signed with Turkish club Anadolu Efes for the rest of the season. = On July 26, 2017, Kirk signed with Alvark Tokyo of the Japan B League. Alvark Tokyo won the 2017–18 B League championship, and Kirk led the team, averaging 16.2 points and 8.8 rebounds per game for the season. In the summer of 2017, Kirk played in The Basketball Tournament on ESPN for The Stickmen. He competed for the $2 million prize, and for The Stickmen, he averaged 6.5 points per game. Kirk helped take The Stickmen to the second round of the tournament, where they then lost to Team Challenge ALS 87–73. In TBT 2018, he played for Eberlein Drive. Eberlein Drive made it to the championship game, where they lost to Overseas Elite. = Career statistics from NBA.com · Basketball Reference New Mexico Lobos bio Alex Kirk on Twitter\n\nIn the 2014–15 season, Alex Kirk played for Cleveland in 5 games. He averaged 0.8 points, 0.2 rebounds, 0.2 assists, 0.0 steals, and 0.0 blocks per game. He shot 0.25 from the field, 0.0 from 3-point range, and 1.0 from the free throw line, playing an average of 2.8 minutes per game. In the 2017–18 season, Alex Kirk played for A Tokyo in 60 games. He averaged 16.2 points, 8.9 rebounds, 0.9 assists, 0.5 steals, and 1.2 blocks per game.', 'He reminds me of Jerry Sloan, he reminds me of Michael Cooper. And just like the Chicago Bulls whined about Dwyane, who was getting too many free throws, a great defender like Kirk Hinrich gets away with more."" ""He\'s into you, he\'s relentless. He has a reputation as a tough defender and he gets away with more."" During the Bulls\' first game of the 2007 playoffs against the Miami Heat, Hinrich threw his mouthpiece into the stands after being assessed a charging foul. Hinrich received a technical foul for his actions as well as a $25,000 fine. Technically Hinrich should have been ejected from the game but he was allowed to stay in. Bulls coach Scott Skiles was quoted as saying ""What Kirk did the other (day), that\'s supposed to be an automatic ejection. They didn\'t see it.', 'Scott Russell Haskin (born September 19, 1970) is an American former professional basketball player who was selected by the Indiana Pacers in the first round (14th pick overall) of the 1993 NBA draft. Haskin played one season in the National Basketball Association (NBA) for the Pacers, appearing in 27 games and averaging 2.0 ppg. He played collegiately at Oregon State University.', 'I was focused on what we were doing. After the season was over, I was thinking that I someday might regret it. To get another chance to reconsider, I feel lucky."" The roster first fielded more than 20 players, but it was soon cut down to 15 players, among which was Hinrich. When the final roster was announced, Hinrich was chosen as one of the 12 players set to compete in the FIBA World Championship in Japan. After Hinrich learned of his grandfather\'s death, he briefly left the US training camp in Las Vegas early in the morning of July 25 and returned to his hometown of Sioux City, Iowa. Hinrich started an exhibition game against Lithuania on August 13, 2006, and scored 10 points and 2 steals in a US win. After the game, Hinrich was asked about starting the game. He responded, ""We\'re playing in groups right now. I know when I get my time, I just try to make the best of it, make sure our team is successful. It\'s one of those deals when you play in groups in spurts like that, it\'s a little bit tougher. But, you don\'t hold back and give it everything you got because you know you\'ll be rested a lot."" In the FIBA world Championship semi-final, Team USA played against the Greece national team. With 2:41 to play in the game, Hinrich connected on a three-point shot to bring the US within 5 points, but was then called for an unsportsmanlike foul on Greece center Sofoklis Schortsanitis. With 45 seconds left, he knocked down another three-pointer to pull the US within four. Hinrich was then fouled out when he intentionally hit a Greek player to stop the shot clock. Despite the US effort, the Greek sealed the deal with free throws and won 101–95. The US team then played against the Argentinian team for the bronze medal. In the game, Hinrich played against his former Bulls\' teammate Andrés Nocioni. The US went on to win 96–81, and took home the bronze medal. Hinrich dropped out of the U.S. training camp for the FIBA Americas Championship in 2007, citing personal reasons. The Chicago Tribune reported that Hinrich dropped out of his commitment to the US national team so that he could focus on his wedding, and to ""hitting the weights"" hard. In April 2008, Hinrich revealed that he would not play for Team USA in the Beijing Olympics since his wife was expecting a baby. He said of the Olympics, ""It wasn\'t like I was upset about anything. It just wasn\'t working out for me."" Hinrich was engaged to Jill Fisher in 2006. He married her on July 7, 2007. His wife gave birth to their first child, a daughter named Kenzie, in 2008. Hinrich\'s wife gave birth to their second daughter, Kyla, in September 2011. On September 12, 2014, Hinrich\'s wife gave birth to twins, a boy, Kolton, and a girl, Kinley. During his NBA career, Hinrich lived in Bannockburn, Illinois. Upon retiring from the NBA in 2017, Hinrich and his family moved to Sioux Falls, South Dakota, where Hinrich was hired at Sanford Power as a lead basketball specialist. = = Sports portal Career statistics from NBA.com · Basketball Reference Prospect Profile\n\nIn the 2003–04 season, Kirk Hinrich played for Chicago in 76 games. He averaged 12.0 points, 3.4 rebounds, 6.8 assists, 1.3 steals, and 0.3 blocks per game. He shot 0.386 from the field, 0.39 from 3-point range, and 0.804 from the free throw line, playing an average of 35.6 minutes per game. In the 2004–05 season, Kirk Hinrich played for Chicago in 77 games. He averaged 15.7 points, 3.9 rebounds, 6.4 assists, 1.6 steals, and 0.3 blocks per game. He shot 0.397 from the field, 0.355 from 3-point range, and 0.792 from the free throw line, playing an average of 36.4 minutes per game. In the 2005–06 season, Kirk Hinrich played for Chicago in 81 games. He averaged 15.9 points, 3.6 rebounds, 6.3 assists, 1.2 steals, and 0.3 blocks per game. He shot 0.418 from the field, 0.37 from 3-point range, and 0.815 from the free throw line, playing an average of 36.5 minutes per game. In the 2006–07 season, Kirk Hinrich played for Chicago in 80 games. He averaged 16.6 points, 3.4 rebounds, 6.3 assists, 1.3 steals, and 0.3 blocks per game. He shot 0.448 from the field, 0.415 from 3-point range, and 0.835 from the free throw line, playing an average of 35.5 minutes per game. In the 2007–08 season, Kirk Hinrich played for Chicago in 75 games. He averaged 11.5 points, 3.3 rebounds, 6.0 assists, 1.2 steals, and 0.3 blocks per game. He shot 0.414 from the field, 0.35 from 3-point range, and 0.831 from the free throw line, playing an average of 31.7 minutes per game. In the 2008–09 season, Kirk Hinrich played for Chicago in 51 games. He averaged 9.9 points, 2.4 rebounds, 3.9 assists, 1.3 steals, and 0.4 blocks per game. He shot 0.437 from the field, 0.408 from 3-point range, and 0.791 from the free throw line, playing an average of 26.3 minutes per game. In the 2009–10 season, Kirk Hinrich played for Chicago in 74 games. He averaged 10.9 points, 3.5 rebounds, 4.5 assists, 1.1 steals, and 0.3 blocks per game. He shot 0.409 from the field, 0.371 from 3-point range, and 0.752 from the free throw line, playing an average of 33.5 minutes per game. In the 2010–11 season, Kirk Hinrich played for Washington in 48 games. He averaged 11.1 points, 2.7 rebounds, 4.4 assists, 1.2 steals, and 0.2 blocks per game. He shot 0.452 from the field, 0.384 from 3-point range, and 0.876 from the free throw line, playing an average of 30.6 minutes per game. In the 2010–11 season, Kirk Hinrich played for Atlanta in 24 games. He averaged 8.6 points, 2.2 rebounds, 3.3 assists, 0.8 steals, and 0.3 blocks per game. He shot 0.432 from the field, 0.421 from 3-point range, and 0.667 from the free throw line, playing an average of 28.6 minutes per game. In the 2011–12 season, Kirk Hinrich played for Atlanta in 48 games. He averaged 6.6 points, 2.1 rebounds, 2.8 assists, 0.8 steals, and 0.2 blocks per game. He shot 0.414 from the field, 0.346 from 3-point range, and 0.781 from the free throw line, playing an average of 25.8 minutes per game. In the 2012–13 season, Kirk Hinrich played for Chicago in 60 games. He averaged 7.7 points, 2.6 rebounds, 5.2 assists, 1.1 steals, and 0.4 blocks per game. He shot 0.377 from the field, 0.39 from 3-point range, and 0.714 from the free throw line, playing an average of 29.4 minutes per game. In the 2013–14 season, Kirk Hinrich played for Chicago in 73 games. He averaged 9.1 points, 2.6 rebounds, 3.9 assists, 1.1 steals, and 0.4 blocks per game. He shot 0.393 from the field, 0.351 from 3-point range, and 0.76 from the free throw line, playing an average of 29.0 minutes per game. In the 2014–15 season, Kirk Hinrich played for Chicago in 66 games. He averaged 5.7 points, 1.8 rebounds, 2.2 assists, 0.7 steals, and 0.2 blocks per game. He shot 0.373 from the field, 0.345 from 3-point range, and 0.7 from the free throw line, playing an average of 24.4 minutes per game. In the 2015–16 season, Kirk Hinrich played for Chicago in 35 games. He averaged 3.8 points, 1.7 rebounds, 1.7 assists, 0.4 steals, and 0.0 blocks per game. He shot 0.398 from the field, 0.411 from 3-point range, and 0.938 from the free throw line, playing an average of 15.9 minutes per game. In the 2015–16 season, Kirk Hinrich played for Atlanta in 11 games. He averaged 0.5 points, 1.1 rebounds, 1.3 assists, 0.2 steals, and 0.1 blocks per game. He shot 0.182 from the field, 0.167 from 3-point range, and 0.0 from the free throw line, playing an average of 6.9 minutes per game. In the 2005 season, Kirk Hinrich played for Chicago in 6 games. He averaged 21.2 points, 3.7 rebounds, 5.8 assists, 2.0 steals, and 0.7 blocks per game. He shot 0.45 from the field, 0.515 from 3-point range, and 0.69 from the free throw line, playing an average of 35.5 minutes per game. In the 2006 season, Kirk Hinrich played for Chicago in 6 games. He averaged 20.5 points, 3.3 rebounds, 7.7 assists, 1.3 steals, and 0.3 blocks per game. He shot 0.415 from the field, 0.346 from 3-point range, and 0.857 from the free throw line, playing an average of 39.0 minutes per game. In the 2007 season, Kirk Hinrich played for Chicago in 10 games. He averaged 12.1 points, 4.2 rebounds, 7.5 assists, 0.9 steals, and 0.3 blocks per game. He shot 0.376 from the field, 0.302 from 3-point range, and 0.769 from the free throw line, playing an average of 36.2 minutes per game. In the 2009 season, Kirk Hinrich played for Chicago in 7 games. He averaged 12.6 points, 2.7 rebounds, 2.9 assists, 1.7 steals, and 0.4 blocks per game. He shot 0.468 from the field, 0.433 from 3-point range, and 0.68 from the free throw line, playing an average of 30.0 minutes per game. In the 2010 season, Kirk Hinrich played for Chicago in 5 games. He averaged 12.4 points, 4.4 rebounds, 4.0 assists, 1.4 steals, and 0.0 blocks per game. He shot 0.423 from the field, 0.5 from 3-point range, and 0.714 from the free throw line, playing an average of 39.2 minutes per game. In the 2011 season, Kirk Hinrich played for Atlanta in 6 games. He averaged 10.2 points, 2.3 rebounds, 2.7 assists, 1.2 steals, and 0.3 blocks per game. He shot 0.5 from the field, 0.421 from 3-point range, and 1.0 from the free throw line, playing an average of 28.8 minutes per game. In the 2012 season, Kirk Hinrich played for Atlanta in 6 games. He averaged 5.7 points, 2.0 rebounds, 1.0 assists, 0.7 steals, and 0.0 blocks per game. He shot 0.433 from the field, 0.375 from 3-point range, and 1.0 from the free throw line, playing an average of 23.5 minutes per game. In the 2013 season, Kirk Hinrich played for Chicago in 4 games. He averaged 11.3 points, 2.8 rebounds, 5.8 assists, 2.0 steals, and 0.3 blocks per game. He shot 0.432 from the field, 0.364 from 3-point range, and 0.643 from the free throw line, playing an average of 40.5 minutes per game. In the 2014 season, Kirk Hinrich played for Chicago in 5 games. He averaged 11.0 points, 3.0 rebounds, 4.4 assists, 0.8 steals, and 0.2 blocks per game. He shot 0.411 from the field, 0.368 from 3-point range, and 0.5 from the free throw line, playing an average of 33.4 minutes per game. In the 2015 season, Kirk Hinrich played for Chicago in 10 games. He averaged 2.6 points, 0.5 rebounds, 1.1 assists, 0.3 steals, and 0.1 blocks per game. He shot 0.474 from the field, 0.6 from 3-point range, and 0.667 from the free throw line, playing an average of 12.6 minutes per game. In the 2016 season, Kirk Hinrich played for Atlanta in 6 games. He averaged 0.8 points, 0.7 rebounds, 0.5 assists, 0.0 steals, and 0.0 blocks per game.', 'In a game against the Boston Celtics, he had 9 steals. He also scored a career-high 43 points in a game against the Orlando Magic. = In 1993, Hawkins was traded to the Charlotte Hornets for Dana Barros, Sidney Green and draft picks. In 1994, he grabbed a career-high 14 rebounds against the Houston Rockets. Hawkins wore #32 with the Hornets during the 1993–94 season since Alonzo Mourning wore #33. Next season, he would change his jersey number to #3. = After two productive seasons in Charlotte, Hawkins and David Wingate were traded to the Seattle SuperSonics for Kendall Gill. In 1996, he played a key role, complementing Gary Payton, Detlef Schrempf and Shawn Kemp on a Sonics team that made it to the NBA Finals but lost 2–4 to his hometown team, the Chicago Bulls. He won the NBA Sportsmanship Award in his final season in Seattle. = On August 12, 1999, Hawkins was traded along with James Cotton to the Bulls for Brent Barry, but his one-year tenure in Chicago was marred by injury, and he only averaged 7.9 points per game in 61 games. = He returned to Charlotte as a free agent in 2000 for his final season, and he retired in 2001 with 14,470 career points. = Regular season Playoffs = Hawkins was named as an assistant by head coach Ty Amundsen for the 2006–2007 season at Estrella Foothills High School varsity basketball in Goodyear, Arizona. He also came to the Hoopfest in 2009.', ""5 player in the nation in 2008. He played three seasons of college basketball for the University of Tennessee under head coach Bruce Pearl from 2008 to 2011. = Hopson went undrafted in the 2011 NBA draft. In August 2011, he signed with Kolossos Rodou of the Greek Basket League for the 2011–12 season. = In July 2012, Hopson signed with Hapoel Eilat of the Israeli Basketball Super League for the 2012–13 season. In 33 games, he averaged 17.7 points and 5.2 rebounds per game. = In July 2013, Hopson signed with Anadolu Efes of the Turkish Basketball League for the 2013–14 season. His final game for Anadolu Efes came on January 13, 2014. = On March 31, 2014, Hopson signed with the Cleveland Cavaliers. He had two assignments with the Canton Charge of the NBA Development League during April 2014. On July 12, 2014, Hopson was traded, along with cash considerations, to the Charlotte Hornets in exchange for Brendan Haywood and the draft rights to Dwight Powell. The next day, the Hornets traded him to the New Orleans Pelicans in exchange for cash considerations. Two days later, he was traded again, this time to the Houston Rockets. On September 17, 2014, he was traded, along with Alonzo Gee, to the Sacramento Kings in exchange for Jason Terry and two future second-round draft picks. On September 24, 2014, he was waived by the Kings. = On December 7, 2014, Hopson was acquired by the Sioux Falls Skyforce of the NBA Development League. On February 24, 2015, Hopson set two Skyforce single-game records, scoring 52 points and making 21 field goals in a win over the Reno Bighorns. = On April 21, 2015, Hopson signed with Laboral Kutxa of Spain for the rest of the 2014–15 ACB season. = In September 2015, Hopson signed with the Foshan Long Lions of China for the 2015–16 CBA season. He played seven games for Foshan in November 2015, before leaving the team. = On July 24, 2016, Hopson signed with Croatian club Cedevita Zagreb. = On February 11, 2017, Hopson signed with Israeli club Ironi Nahariya for the rest of the 2016–17 season. = On July 20, 2017, Hopson signed with Turkish club Galatasaray for the 2017–18 season. He left Galatasaray in January 2018. = On February 26, 2018, Hopson signed a 10-day contract with the Dallas Mavericks. After appearing in one game, he was not offered a second 10-day contract. = On October 10, 2018, Hopson signed with the Oklahoma City Thunder. He was waived two days later and subsequently joined the Thunder's NBA G League affiliate, the Oklahoma City Blue. On February 14, 2019, he signed a 10-day contract with the Thunder. He did not appear in a game for the Thunder during his stint and returned to the Blue after the contract expired. = On April 18, 2019, Hopson returned to Israel for a third stint, signing with Hapoel Holon. He suffered a foot injury in his first game with Holon and was later ruled out for the rest of the season. = On July 31, 2019, Hopson signed with the New Zealand Breakers for the 2019–20 NBL season. Early in the season, he split a ligament in his knee."", 'But after that year I missed my wife and kids so much. I realized that if I didn\'t prioritize, I\'d miss everything that they were doing."" When Jordan joined the Washington Wizards, he asked Paxson to consider the head coaching job, but Paxson declined for the same reasons. = In April 2003, Paxson left his broadcasting position to become General Manager for the Bulls after the resignation of longtime Bulls general manager Jerry Krause. After a promising conclusion to the 2002–03 NBA season, Paxson pledged that the team would make the playoffs. He made headlines by signing former icon Scottie Pippen after years of bad relations between the franchise and one of the stars of their championship years. However, the Bulls opened the 2003–04 NBA season in sloppy and uninspired form, and Paxson opted to begin reshaping the character of the team by trading leading scorer Jalen Rose for Antonio Davis and firing friend and former teammate coach Bill Cartwright, replacing him with Scott Skiles. These moves had virtually no impact at all, and the Bulls finished Paxson\'s first season as general manager with a 23–59 record, second-worst in the NBA. In his second season, however, Paxson was able to reshape the franchise with remarkable speed through the draft. Kirk Hinrich made the NBA All-Rookie Team in 2003–04, and the 2004–05 rookie class yielded four major contributors, Ben Gordon, Luol Deng, Chris Duhon and Andrés Nocioni. After a long drought dating back to Jordan\'s departure, the Bulls returned to the playoffs and posted the third-best record in the Eastern Conference, a 24-game improvement from the previous year. The Bulls were knocked out of the playoffs in the first round, by the Washington Wizards despite having home-court advantage, a better regular-season record and a 2–0 lead in the best of seven playoff series. The absence of starting center and leading scorer Eddy Curry and promising small forward Luol Deng in this series played a major role, although Tyson Chandler and Kirk Hinrich both performed well. When center Eddy Curry showed possible symptoms of a heart problem shortly before the playoffs, Paxson took a cautious approach and would not clear Curry to play without extensive DNA testing. Ultimately, Curry was traded along with Antonio Davis to the New York Knicks for Michael Sweetney, Tim Thomas, and several draft picks. This trade would give them the Knicks\' first-round pick in 2006, which they eventually used to acquire Tyrus Thomas, and the right to swap first-round picks with the Knicks in 2007. The Bulls floundered in the season that followed, but the team made a late-season run to finish at 41-41 and earn a second consecutive trip to the playoffs – as well as a second consecutive first-round exit.', ""He played collegiately with the Kentucky Wildcats men's basketball team. Hanson was born in Charlotte, North Carolina and graduated from high school in Pulaski County, Kentucky. "", ""He was substituted from the game and did not return to add to his two-goal first half tally. With Richmond's bye the following week he was able to recover and avoid missing a match as a result of the injury. He did however miss matches in Rounds 20, 21 and 23 before returning fully fit to play in his first final, a losing effort against Carlton at the MCG. At years end he had played 20 matches, kicked 11 goals and set a then career-best tackles per-game mark. He placed 14th in the club's best and fairest that season. = 2014 would prove an exceptional year for Edwards, but one which included a form reversal after a relatively slow start. After playing in Richmond's first six matches of the season Edwards would be played as Richmond's substitute in its Round 7 match against Geelong. Despite the setback he ultimately kicked two goals in just 39 per cent time on ground.""]","Kirk Haston played basketball in the years 1998–99 to 2001–02, during which he played in college and then in the NBA from 2001 to 2003.",Kirk Haston played basketball in the year mentioned in the document.,0.6666666666666666,0.9931465149396752,0.9999999999666667,1.0,0.2354302174982293,0.9416756515451326
In what year was Adonal Foyle inducted into the World Sports Humanitarian Hall of Fame?,"['He also became a member of the National Basketball Players Association executive committee. He was elected to the Common Cause National Governing Board in 2008. On September 24, 2009, Foyle was inducted into the World Sports Humanitarian Hall of Fame. Only eight other NBA players have been inducted into the World Sports Humanitarian Hall of Fame (Nate ""Tiny"" Archibald, Vlade Divac, Julius Erving, A. C.', 'Green, Kevin Johnson, Dikembe Mutombo, David Robinson and Steve Smith). In 2013, Foyle released his first children\'s book, called Too Tall Foyle Finds His Game. In January 2014, Foyle traveled to Spain and Morocco as a Sports Diplomacy Sports Envoy for the U.S. Department of State. In this function, he worked with Ruth Riley to conduct basketball clinics for more than 600 youth from under-served areas. In so doing, Foyle helped contribute to Sports Diplomacy\'s mission to promote conflict resolution, leadership, greater understanding and inclusion through sport. The Golden State Warriors appointed Foyle as the team\'s community ambassador in 2014. = = List of NCAA Division I men\'s basketball career blocks leaders List of NCAA Division I men\'s basketball season blocks leaders Adonal Foyle\'s homepage Career statistics from NBA.com · Basketball Reference ""Adonal Foyle biography"". NBA.com.', ""Adonal David Foyle (born March 9, 1975) is a Vincentian-American former professional basketball center. He was selected by the Golden State Warriors with the eighth overall selection of the 1997 NBA draft. Foyle played ten seasons with the Warriors until the team bought out his contract on August 13, 2007. At the time, he had been Golden State's longest-tenured player. He then played two seasons with the Orlando Magic and part of the 2008–09 season with the Memphis Grizzlies, sat out the next season due to knee surgery, and retired. As of 2018, Foyle does Warriors post-game commentary for ABC 7 in San Francisco. Foyle was born in Canouan, St."", 'Archived from the original on January 20, 2010. Retrieved August 19, 2005.{{cite web}}: CS1 maint: bot: original URL status unknown (link) at NBA.com Kerosene Lamp Foundation Democracy Matters C-SPAN Q&A interview with Foyle, March 5, 2006\n\nIn the 1997–98 season, Adonal Foyle played for Golden State in 55 games. He averaged 3.0 points, 3.3 rebounds, 0.3 assists, 0.2 steals, and 0.9 blocks per game. He shot 0.406 from the field, 0.0 from 3-point range, and 0.435 from the free throw line, playing an average of 11.9 minutes per game. In the 1998–99 season, Adonal Foyle played for Golden State in 44 games. He averaged 2.9 points, 4.4 rebounds, 0.4 assists, 0.3 steals, and 1.0 blocks per game. He shot 0.43 from the field, 0.0 from 3-point range, and 0.49 from the free throw line, playing an average of 14.0 minutes per game. In the 1999–00 season, Adonal Foyle played for Golden State in 76 games. He averaged 5.5 points, 5.6 rebounds, 0.6 assists, 0.3 steals, and 1.8 blocks per game. He shot 0.508 from the field, 0.0 from 3-point range, and 0.378 from the free throw line, playing an average of 21.8 minutes per game. In the 2000–01 season, Adonal Foyle played for Golden State in 58 games. He averaged 5.9 points, 7.0 rebounds, 0.8 assists, 0.5 steals, and 2.7 blocks per game. He shot 0.416 from the field, 0.0 from 3-point range, and 0.441 from the free throw line, playing an average of 25.1 minutes per game. In the 2001–02 season, Adonal Foyle played for Golden State in 79 games. He averaged 4.8 points, 4.9 rebounds, 0.5 assists, 0.5 steals, and 2.1 blocks per game. He shot 0.444 from the field, 0.0 from 3-point range, and 0.398 from the free throw line, playing an average of 18.8 minutes per game. In the 2002–03 season, Adonal Foyle played for Golden State in 82 games. He averaged 5.4 points, 6.0 rebounds, 0.5 assists, 0.5 steals, and 2.5 blocks per game. He shot 0.536 from the field, 0.0 from 3-point range, and 0.673 from the free throw line, playing an average of 21.8 minutes per game. In the 2003–04 season, Adonal Foyle played for Golden State in 44 games. He averaged 3.1 points, 3.8 rebounds, 0.4 assists, 0.1 steals, and 1.0 blocks per game. He shot 0.454 from the field, 0.0 from 3-point range, and 0.543 from the free throw line, playing an average of 13.0 minutes per game. In the 2004–05 season, Adonal Foyle played for Golden State in 78 games. He averaged 4.5 points, 5.5 rebounds, 0.7 assists, 0.3 steals, and 2.0 blocks per game. He shot 0.502 from the field, 0.0 from 3-point range, and 0.556 from the free throw line, playing an average of 21.8 minutes per game. In the 2005–06 season, Adonal Foyle played for Golden State in 77 games. He averaged 4.5 points, 5.5 rebounds, 0.4 assists, 0.6 steals, and 1.6 blocks per game. He shot 0.507 from the field, 0.0 from 3-point range, and 0.612 from the free throw line, playing an average of 23.7 minutes per game. In the 2006–07 season, Adonal Foyle played for Golden State in 48 games. He averaged 2.2 points, 2.6 rebounds, 0.4 assists, 0.2 steals, and 1.0 blocks per game. He shot 0.565 from the field, 0.0 from 3-point range, and 0.44 from the free throw line, playing an average of 9.9 minutes per game. In the 2007–08 season, Adonal Foyle played for Orlando in 82* games. He averaged 1.9 points, 2.5 rebounds, 0.2 assists, 0.2 steals, and 0.5 blocks per game. He shot 0.458 from the field, 0.0 from 3-point range, and 0.471 from the free throw line, playing an average of 9.4 minutes per game. In the 2008–09 season, Adonal Foyle played for Orlando in 9 games. He averaged 1.9 points, 2.9 rebounds, 0.1 assists, 0.0 steals, and 0.9 blocks per game. He shot 0.636 from the field, 0.0 from 3-point range, and 0.5 from the free throw line, playing an average of 6.6 minutes per game. In the 2008–09 season, Adonal Foyle played for Memphis in 1 games. He averaged 0.0 points, 0.0 rebounds, 0.0 assists, 0.0 steals, and 0.0 blocks per game. He shot 0.0 from the field, 0.0 from 3-point range, and 0.0 from the free throw line, playing an average of 3.0 minutes per game. In the 2007 season, Adonal Foyle played for Golden State in 3 games. He averaged 0.7 points, 0.7 rebounds, 0.0 assists, 0.0 steals, and 0.0 blocks per game. He shot 1.0 from the field, 0.0 from 3-point range, and 0.0 from the free throw line, playing an average of 2.0 minutes per game. In the 2008 season, Adonal Foyle played for Orlando in 3 games. He averaged 0.7 points, 1.0 rebounds, 0.0 assists, 0.0 steals, and 0.0 blocks per game. He shot 0.333 from the field, 0.0 from 3-point range, and 0.0 from the free throw line, playing an average of 3.7 minutes per game. In the 2009 season, Adonal Foyle played for Orlando in 2 games. He averaged 0.0 points, 0.5 rebounds, 0.0 assists, 0.0 steals, and 0.0 blocks per game. He shot 0.0 from the field, 0.0 from 3-point range, and 0.0 from the free throw line, playing an average of 2.0 minutes per game.', 'Walter Kennedy Citizenship Award in 2001 and 2009. For his feats, Sporting News named him as one of the ""Good Guys in Sports"" in 1999 and 2000.', 'He transferred after sophomore year and attended high school at Hamilton Central School (Hamilton, New York), where he helped the HCS Emerald Knights gain their first two state championships. As of 2016, his 47 points and 25 rebounds in the NYSPHSAA Class D semifinals in 1994 are tied for the most in either statistical category in a state tournament game. In his official biography, Foyle explained that he enrolled at Colgate University because ""he wanted the opportunity to learn the principles of the game in a slower-paced setting, where the coach would be able to give him the attention he desired."" With the Colgate Raiders, he was the school\'s all-time-leading rebounder and 2nd-all-time-leading scorer. He led the Raiders to their first two NCAA tournament appearances in school history. He left as the NCAA\'s all-time leader in blocked shots with 492, despite playing only three college seasons (his record was broken by Wojciech Myrda in 2002). He now ranks third all-time, behind Myrda and Jarvis Varnado. In 1999, Foyle graduated from Colgate magna cum laude with a history degree. Politically motivated, he founded the organization Democracy Matters, which tries to curb the effects of money on politics. In his NBA career, Foyle averaged 4.1 points and 1.6 blocks per game. He was among the top 10 in blocks per game three times during his career. In July 2004, during the offseason, the Golden State Warriors re-signed Foyle to a six-year, $42 million contract. Foyle played sparingly during the 2006–07 season under head coach Don Nelson, and was waived by the Warriors on August 13, 2007, with three years and $29.2 million remaining on his contract. On August 23, 2007, Foyle signed with the Orlando Magic for the veteran\'s minimum of $1.3 million. On August 2, 2008, he re-signed with the Magic for another year, also at the veteran\'s minimum. He was traded to the Memphis Grizzlies on February 19, 2009. On March 1, 2009, the Grizzlies waived Foyle. He signed with the Orlando Magic on March 23, 2009, for the rest of the season. Later that year, in August, Foyle re-signed with the Magic. However, he underwent arthroscopic knee surgery before the season began, and did not play that season. On August 17, 2010, Foyle announced his retirement. On September 7, 2010, the Magic named Foyle the team\'s director of player development, which he held until 2012. In his spare time, Foyle writes poems and is a political activist. He has reviewed books for Hoop magazine. In 2001, he founded Democracy Matters, a non-partisan student organization, as an effort to counteract political apathy on college campuses. The organization\'s signature issue is campaign finance reform, particularly Clean Elections. Active on over 50 college campuses, Democracy Matters involves hundreds of students and faculty nationwide through teach-ins, letter writing and petition campaigns, educational seminars, and voter registration drives. In 2005, Foyle founded the Kerosene Lamp Foundation, which serves children in St.', 'Bush. In 1992, he was honored as a ""Point of Light Ambassador"" by Bush for inviting disadvantaged children to his Neverland Ranch. Jackson won hundreds of awards, making him one of the most-awarded artists in popular music. His awards include 39 Guinness World Records, including the Most Successful Entertainer of All Time, 13 Grammy Awards, as well as the Grammy Legend Award and the Grammy Lifetime Achievement Award, and 26 American Music Awards, including the Artist of the Century and Artist of the 1980s. He also received the World Music Awards\' Best-Selling Male Artist of the Millennium and the Bambi Pop Artist of the Millennium Award. Jackson was inducted onto the Hollywood Walk of Fame in 1980 as a member of the Jacksons, and in 1984 as a solo artist. He was inducted to the Rock and Roll Hall of Fame and Vocal Group Hall of Fame as a member of the Jackson 5 in 1997 and 1999, respectively, and again as a solo artist in 2001. In 2002, he was added to the Songwriters Hall of Fame. In 2010, he was the first recording artist to be inducted into the Dance Hall of Fame, and in 2014, he was posthumously inducted into the Rhythm and Blues Music Hall of Fame. In 2021, he was among the inaugural inductees into the Black Music & Entertainment Walk of Fame. In 1988, Fisk University honored him with an Honorary Doctorate of Humane Letters. In 1992, he was invested as a titular king of Sanwi, a traditional kingdom located in the south-east of Ivory Coast. In July 2009, the Lunar Republic Society named a crater on the Moon after Jackson. In August, for what would have been Jackson\'s 51st birthday, Google dedicated their Google Doodle to him. In 2012, the extinct hermit crab Mesoparapylocheles michaeljacksoni was named in his honor. In 2014, the British Council of Cultural Relations deemed Jackson\'s life one of the 80 most important cultural moments of the 20th century. World Vitiligo Day has been celebrated on June 25, the anniversary of Jackson\'s death, to raise awareness of the auto-immune disorder that Jackson suffered from. In 1989, Jackson\'s annual earnings from album sales, endorsements, and concerts were estimated at $125 million.', ""Nimphius is married to Krista, and lives in Arizona. Nimphius is a black belt in karate. Nimphius was inducted into the Wisconsin Basketball Hall of Fame in 2007. Nimphius was inducted into the Pac-12 Basketball Hall of Honor during the 2012 Pac-12 Conference men's basketball tournament on March 10, 2012. In 2011, Nimphius was inducted into the Arizona State University Sports Hall of Fame. Career Stats\n\n"", 'He was inducted as a player into the Naismith Memorial Basketball Hall of Fame on September 10, 2004, in his first year of eligibility.', 'Jim Zoet (born December 20, 1953) is a Canadian former basketball player, NBA player and member of the Canada\'s Olympic basketball team. He and Brian Heaney are the only Canadian University basketball players to play in an NBA game. Zoet played for the Detroit Pistons in 1982. Zoet played in seven games for the Pistons. Zoet also played professionally in the Netherlands, England, Argentina, Mexico, and the Philippines. Zoet was a member of the Canadian national team from 1977 - 1980, including being a member of the 1980 Olympic team. Zoet unfortunately was unable to compete in these 1980 games (held in Moscow) given that Canada boycotted said Olympics as a result of the Soviet Union\'s invasion of Afghanistan. This 1980 Canadian men\'s team was positioned to perform well in these Olympics given that Canada competed for the bronze medal in the Olympic games preceding and following these 1980 Olympics (1976, 1984) and this time in Canadian basketball has been described as ""arguably the Canadian national team\'s greatest era"" and ""Canada\'s golden age of basketball"". Zoet competed for Canada in the 1978 FIBA World Championship and was Canada\'s third-leading scorer in this tournament. Canada finished 6th overall in this World Championship. Zoet played on scholarship for three seasons (1973–76) for Kent State University in the NCAA. Zoet then transferred to Lakehead University in the CIAU where he played for the next two seasons (1976–1978). He was named an CIAU All-Canadian both of these seasons, where he averaged 19 points per game. He was also named as a Great Plains First Team All-Star these two seasons. In the 1977 season, he led Lakehead to the CIAU national championship game, the first of two times Lakehead has reached the national championship game. This year he was named as a CIAU Tournament All-Star. Zoet was inducted into the Canada Basketball Hall of Fame (2015) and the Lakehead University Sports Wall of Fame (2009). In 2015, the 1976-77 Lakehead men\'s basketball team was inducted into the Lakehead Sports Wall of Fame, of which Zoet was a crucial member. Zoet was born on December 20, 1953, in Uxbridge, Ontario.', 'Vincent & the Grenadines. He played a cameo role of ""detective"" in the 2006 movie The Darwin Awards. Foyle became an American citizen on March 13, 2007, after being in the U.S. for almost 18 years.', 'Alonzo Harding Mourning Jr. (born February 8, 1970) is an American former professional basketball player who has served as vice president of player programs and development for the Miami Heat since June 2009. Mourning played most of his 15-year National Basketball Association (NBA) career for the Heat. Nicknamed ""Zo"", Mourning played the center position. Following his college basketball career at Georgetown University, his tenacity on defense twice earned him the NBA Defensive Player of the Year Award and twice placed him on the NBA All-Defensive Team. Mourning made a comeback after undergoing a kidney transplant and later won the 2006 NBA championship with the Heat. Mourning also played for the Charlotte Hornets and New Jersey Nets. On March 30, 2009, Mourning became the first Miami Heat player to have his number retired. In 2010, Mourning was inducted into the Virginia Sports Hall of Fame. In August 2014, Mourning was inducted into the Naismith Memorial Basketball Hall of Fame, and in August 2019 he was inducted into the FIBA Hall of Fame. Alonzo Harding Mourning Jr. was born on February 8, 1970, in Chesapeake, Virginia.', ""Vincent and the Grenadines. At the age of 15, Foyle was adopted by Joan and Jay Mandle, professors at Colgate University. He first attended high school at Cardinal O'Hara Catholic High in Springfield, Pennsylvania."", 'At the funeral, U.S. Senator Sam Brownback said, ""I can\'t think of a person that I know of in the world [who] used [his] celebrity status for a greater good than what Manute Bol did. He did it for his people. He gave his life for his people."" NBA Development Vice President Rory Sparrow added, ""\'He had a heart that was very large and full of compassion for his fellow man\'"". After his death, tributes to Bol\'s career and charitable works came from around the United States and the world. His former teams, and the NBA, issued statements in recognition of his impact on the sport of basketball and on Sudan. Brownback paid tribute to Bol on the floor of the United States Senate. Bol was inducted into the University of Bridgeport Athletics Hall of Fame, Class of 2010. On January 27, 2015, the Golden State Warriors honored Bol with a Manute Bol bobblehead giveaway. The team sponsored a giveaway of 10,000 of the tallest bobbleheads in franchise history, at 10 inches (25 cm). The ""Manute Bol Court"" was built and constructed in South Sudan by the Luol Deng Foundation in 2015. The Manute Bol Peace Builders Basketball Tournament is held annually throughout Sudan. In 2016, Bol was inducted into the Fairfield County Sports Hall of Fame. = Regular season Playoffs = Source List of NBA annual blocks leaders List of NBA single-game blocks leaders List of NBA single-season blocks per game leaders List of tallest players in NBA history List of tallest people Career statistics from NBA.com · Basketball Reference ""Manute Bol at NBA.com"". NBA.com.', 'In 2018, he was named to the Maryland State Athletic Hall of Fame.', 'Vlade Divac (Serbian Cyrillic: Владе Дивац, pronounced [ʋlǎːde dǐːʋats]; born February 3, 1968) is a Serbian professional basketball executive and former player who was most recently the vice president of basketball operations and general manager of the Sacramento Kings of the National Basketball Association (NBA). At 7 ft 1 in (2.16 m), Divac played center and, unlike many centers, was known for his passing skills. He was among the first group of European basketball players to transfer to the NBA in the late 1980s and was named one of the 50 Greatest EuroLeague Contributors. He is one of seven players in NBA history to record 13,000 points, 9,000 rebounds, 3,000 assists, and 1,500 blocked shots, along with Kareem Abdul-Jabbar, Hakeem Olajuwon, Shaquille O\'Neal, Tim Duncan, Kevin Garnett, and Pau Gasol. Divac was also the first player born and trained outside the United States to play in over 1,000 games in the NBA. Divac was named to the FIBA All-Time EuroStars Team in 2007. On August 20, 2010, he was inducted into the FIBA Hall of Fame in recognition of his play in international competition. He was elected to the Naismith Memorial Basketball Hall of Fame in 2019. Divac is a humanitarian, helping children in his native country of Serbia and in Africa. In October 2008, he was appointed as government adviser in Serbia for humanitarian issues. In February 2009, he was elected President of the Serbian Olympic Committee for a four-year term and re-elected in November 2012. In 2013, Divac received an honor from the World Sports Humanitarian Hall of Fame. = Divac began playing basketball in his home town Prijepolje for the team KK Elan. He began his professional career in Yugoslavia playing for Sloga from Kraljevo, and was immediately noted for scoring 27 points against Crvena zvezda. = In the summer of 1986, Divac was the top star of the basketball transfer season, and he ended up signing with KK Partizan for DM14,000. In the 1986-87 Yugoslav First League season, with players like Divac, Aleksandar Đorđević, Žarko Paspalj, Željko Obradović, and with coach Duško Vujošević at the helm, Partizan had a ""dream team"", which won the Yugoslavian League title. In the subsequent 1987-88 FIBA European Champions Cup season (now called EuroLeague), the club failed to reach the top of the EuroLeague, after having lost to Maccabi Tel Aviv in the semifinal in Ghent. Jugoplastika, with Dino Rađa and Toni Kukoč, was a stronger team in the subsequent three years, reigning both in Yugoslavia and in Europe. Divac had an unusual style compared to most other centers of his generation: despite his height, he possessed good mobility, had good control of the ball, and was a decent shooter.']","Adonal Foyle was inducted into the World Sports Humanitarian Hall of Fame on September 24, 2009.",2009,1.0,0.9927901807157858,0.8333333332916666,1.0,0.9456609296718361,0.7826341602731486
In which year did Cozell McQueen lead the Italian Serie A league in blocks per game?,"[""Though he briefly played in the NBA for the Detroit Pistons, the majority of his professional career took place in the minor leagues and in Europe. He played as a center. As a sophomore, McQueen took part in North Carolina State's 1983 NCAA title. He sunk an off-balance shot to tie the overtime game against Pepperdine in the first round of the Tournament. In the semifinal against Georgia, McQueen - who had more playing than usual as the Wolfpack dropped their three-guard lineup - posted a career-high 13 rebounds and added 8 points. In the final against favourites Houston, he had 12 rebounds and 4 points whilst also defending Hakeem Olajuwon as NC State earned an upset win to win the tournament. He finished his collegiate career in 1985 with 5.3 points and 6 rebounds per game on average. He was drafted by the Milwaukee Bucks in the 4th round of the 1985 NBA draft, he was waived by the Bucks a week later. McQueen signed with Spanish side Cacaolat Granollers the same year but was again released, having only played in the Catalan league. McQueen then moved to the Continental Basketball Association, playing with the Wisconsin Flyers. He was signed as a free-agent by the New York Knicks in August 1986 but was released without playing a competitive game less than two months later. He then returned to play in the CBA. He averaged 11.9 points and 10.2 rebounds for the La Crosse Catbirds in the CBA for the first half of the 1986–1987 season. McQueen was signed by the Detroit Pistons in January 1987 on a 10-day contract as an injury replacement for Rick Mahorn. Though he posted 6 points (on 3 for 3 shooting) and 8 rebounds in 7 minutes, he could not find space in a roster containing Adrian Dantley, John Salley and Dennis Rodman and left after 3 games, finishing the season with the Catbirds. McQueen then moved abroad, returning to his birth country, France, to play for Tours in the Pro A. He had 12 points, 10.6 rebounds and 1.5 blocks in 37.3 minutes per game for 1987–88. For the next season, he moved to the Italian Serie A, signing with Paini Napoli. He led the league in blocks with 2.1 per game in 1988–89, adding 16.3 points and 11.5 rebounds in 35.4 minutes. Joining Philips Milano in 1990, he had 10.2 points, 12.1 rebounds and 1.3 blocks in 32.7 minutes per game. The American then signed with Spanish side CAI Zaragoza in 1991. He averaged 9 points, 11 rebounds and 1.3 blocks in 35 minutes on average in the Liga ACB during 1991–1992. A return to Italy followed, signing a $800,000 contract with Scaini Venezia. He was replaced by Shelton Jones in February 1993 after posting 9.1 points, 10.2 rebounds and 1.2 blocks in nearly 33 minutes per game. He finished his career in the American minor leagues, retiring in 1996."", ""He signed in 2007 with another Serie B1 team, Gira Ozzano, staying there for two years, before ending his playing career in 2009, at 40 years old. Esposito finished his 25-year playing career with 762 games played, across all teams and divisions, with 13,286 points scored, for an average of 17.43 points per game. Esposito played several years for the youth national teams of Italy, playing in the 1985 FIBA Europe Under-16 Championship, where he won a bronze medal, and the 1988 FIBA Europe Under-18 Championship, where he was the Team Best Scorer, as they lost in the final. He later joined the senior men's Italian national basketball team for EuroBasket 1995, where Italy made it to the quarterfinals and he was the Team Best Scorer. Later on he played in the qualifiers for EuroBasket 1997, but he did not participate to the tournament. Following the year 2002 Esposito never played again for the Italian national basketball team. After his retirement from playing professional basketball, Esposito started a basketball coaching career with Aquila Basket Trento of the Serie A Dilettanti (the renamed third division) for the 2009–10 season, with the team finishing ninth. The next year, he coached Fortitudo Agrigento in the same division, leaving after one year. In July 2013, he returned to Imola, to coach the team that was still in the second division (now DNA Gold), after his team only won 1 game in 13, he decided - at 44 - to return to the team as player, leaving coaching duties to his assistant. He rejoined another former club, Juvecaserta, in 2014, to serve as assistant coach to Emanuele Molin first and then Zare Markovski in the Serie A. When Markovski was dismissed in December, with Caserta at zero games won in 11 games, Esposito took over as head coach. He helped them to 8 wins in the next 19 games, which gave them hope of escaping relegation, however the team lost their final game and were unable to achieve safety. Esposito would stay in the Serie A, signing a two-year deal with Giorgio Tesi Group Pistoia in June 2015. In two years as the head coach of the Giorgio Tesi Group Pistoia he took twice the team to the playoffs, one time to the Italian Basketball Cup, and at the end of the season 2017 he was named Italian League Coach of the Year (Lega Basket Serie A awards) On May 22, 2018, Esposito signed a deal with Banco di Sardegna Sassari in LBA. On May 26, 2019, Esposito signed a deal with Germani Basket Brescia. Source. Lega Basket Serie A Coach Profile Retrieved 29 June 2015.(in Italian) Lega Basket Serie A player statistics Retrieved 2 June 2015.(in Italian) FIBA Player Profile FIBA Europe Player Profile Liga ACB Player Profile Retrieved 2 June 2015.(in Spanish) Real GM Player Profile Retrieved 6 June 2015. In the 1995–96 season, Vincenzo Esposito played for Toronto in 30 games. He averaged 3.9 points, 0.5 rebounds, 0.8 assists, 0.2 steals, and 0.0 blocks per game."", 'Primarily a center, he was widely regarded as an excellent shot-blocker and led the league three times in blocks per game.', 'Cozell McQueen (born January 18, 1962) is an American former professional basketball player. He was part of the NC State side that surprisingly won the 1983 NCAA Tournament.', 'He appeared in 11 games and had four starts in the Italian League, averaging 9.0 points and 5.0 rebounds in 22.4 minutes per game.', 'He continued to improve in 2005–06, before getting injured in January, averaging 14.5 points and 7 rebounds, and ranking in the top 10 in the NBA in field goal percentage (54.142), blocks (2.19), and steals per game (2.44). Since the NBA began counting blocks as a statistic in 1973, only two other players (David Robinson and Hakeem Olajuwon) in league history have averaged over 2.0 blocks and 2.0 steals per game in a single season. Wallace was known for his somewhat reckless style of play that led to frequent injuries and earned him the nickname ""Crash"".', 'Thabo Patrick Sefolosha (; born 2 May 1984) is a Swiss former professional basketball player. He played in the NBA, the Turkish Basketball League, LNB Pro A, and Lega Basket Serie A. In 2006, he became the first player from Switzerland to play in the NBA, and in 2013, he was labelled the best Swiss basketball player of all time by Swiss newspaper Freiburger Nachrichten. Sefolosha was born in Vevey, Switzerland to Patrick Sefolosha, a Black South African musician, and Christine Sefolosha (née Beck), a Swiss artist. He speaks French, Italian and English. = Sefolosha was invited to join the junior Swiss national basketball team, and at 17 he began a professional career with Vevey Riviera Basket, in Switzerland\'s top domestic league. On a team trip to France, Sefolosha was approached by a French talent scout to play with Élan Chalon in the premier pro league in France. Sefolosha spent his first year in Chalon-sur-Saône playing with the junior under-21 squad, which traveled alongside the senior club. The following year (2002–03), he earned a rotation spot on the senior club, where he played 30 games and averaged 4 points, 3.5 rebounds and 1 assist per game. The following season, Sefolosha earned a starting spot on the senior team, which he helped lead to a third-place finish in the French league, where his team advanced to the playoffs semifinals. During the season, he averaged 9.4 points, 7 rebounds, and 1 steal in 30.7 minutes per game. Before the start of his fourth season with Élan Chalon, a contract dispute between Sefolosha and the team arose. Sefolosha\'s agent and the team president could not reach an agreement on a new contract, so Sefolosha signed with Italian team Angelico Biella. ""Last summer, I had the chance to re-negotiate my contract with the club.', 'La Salle on February 28 (17 pts, 10 reb, 10 blocks). Also in 2006–07 Lasme set new UMass records for career blocked shots (399), single season blocked shots (168), and blocks per game (11), passing Marcus Camby on all three lists. In June 2007, Lasme was selected in the second round, 46th overall, in the 2007 NBA draft by the Golden State Warriors, using the pick they got from the New Jersey Nets in exchange for Clifford Robinson. He made his NBA debut on November 8, playing only 3.8 seconds of game time in the Warriors 120–115 loss to the Dallas Mavericks. On November 17, Lasme was waived by the Warriors. Later that month, he was signed by the NBA Development League\'s Los Angeles D-Fenders. On March 21, 2008, Lasme was signed to a ten-day contract with the Miami Heat, whose roster had been depleted by injuries. He later signed for the rest of the season. In 15 games (four starts), he averaged 5.5 points, 3.5 rebounds, 1.5 blocks and 20.2 minutes. In September 2008, Lasme signed with the Adriatic League champions Partizan Belgrade, for the 2008–09 season. After the opening three games in EuroLeague, he was ranked second in both blocks and rebounds per game. Lasme finished the season well, averaging 10.6 points, 6.6 rebounds, and 1.5 blocks per game, 25.5 minutes a contest, after Partizan\'s strong showing that ended in the quarterfinals with a loss to CSKA Moscow. He was instrumental in helping the team to another regional ABA championship, with 11.3 points per game. He also won Serbian national championship and the Serbian Radivoj Korać Cup titles with Partizan. In July 2009, Lasme signed with the Israeli League club Maccabi Tel Aviv, along with Alan Anderson. On June 8, 2010, Maccabi announced that they had released Lasme, after a foot injury had limited his playing time towards the end of the season. In 20 games of EuroLeague play, he averaged 6.5 points, 4.4 rebounds, and 1.4 blocks per game in 18.5 minutes per game. Lasme then signed a two-year contract with the Russian League club Spartak Saint Petersburg in July 2010. However, he was released in September, due to some administrative problems that he had in the United States. Lasme was invited to join the Boston Celtics for their 2010 training camp. However, he was waived on October 20. Subsequently, Lasme joined the Maine Red Claws of the NBA D-League, an affiliate of the Celtics. However, Lasme fractured his foot just 2 minutes into the team\'s preseason opener against the Springfield Armor, and immediately underwent surgery. After recovering, he returned to action in March 2011. In August 2011, Lasme returned to Europe and signed with the Spanish League newcomers Obradoiro CAB. On July 5, 2012, the Boston Celtics announced that Lasme was added to their roster for the 2012 Orlando Pro Summer League and the 2012 NBA Summer League. On September 29, 2012, Lasme signed a one-year contract with the Greek League club Panathinaikos Athens. He was named the EuroLeague Best Defender for the 2012–13 Euroleague season. He averaged 1.86 blocks and 6.14 rebounds per game, while his team allowed 69.8 points per game, thus displaying the second best team defense in the league. Also, Lasme earned the Greek Basket League MVP award, as well as the Greek League Best Defender award for the 2012–13 season. On July 1, 2013, Lasme renewed his contract with Panathinaikos for two more years. In May 2014, he was named to the All-EuroLeague Second Team of the EuroLeague. He also earned the Greek League Best Defender award and was named to the Greek League Best Five for the 2013–14 season. Panathinaikos decided to exercise an ""opt out"" clause in his contract for the upcoming 2014–15 season, on 12 June 2014. On June 22, 2014, he signed a two-year contract with Anadolu Efes Istanbul.', 'Devontae Calvin Cacok ( KAY-kok; born October 8, 1996) is an American professional basketball player who last played for Virtus Bologna of the Italian Lega Basket Serie A (LBA) and the EuroLeague. He played college basketball for the UNC Wilmington Seahawks, where in the 2017–18 season he led the nation in rebounding. Cacok was born in Chicago, Illinois to a Haitian-American father Harry Cacok and Rose Lewis, and grew up in Riverdale, Georgia, playing football as a youth, mainly on the offensive line. He first began playing basketball in eight grade after he fractured his wrist, ending his football season. Cacok admits being terrible at first, but joined his high school varsity team after a seven-inch growth spurt as a sophomore. As a senior at Alpharetta High School, he averaged 22 points and 12 rebounds per game and led the team to a regional title. As a freshman at UNC Wilmington, Cacok came off the bench to average 3.3 points per game. Cacok averaged 12.2 points and 9.8 rebounds per game as a sophomore and led the nation in field goal percentage (80.0%). He accomplished this extremely high percentage, the highest ever, by mainly shooting within a range of about two feet from the basket and only taking one jump shot all year on the 29–6 Seahawks team. He had 40 blocks and tied for the league lead with 11 double-doubles. He was named CAA Defensive Player of the Year and was selected to the Third Team All-CAA. After the season, UNC Wilmington lost four starters and coach Kevin Keatts; new coach C. B.', ""He also won the Italian Cup in 1988, and the Italian league championship with Juvecaserta, in 1991. = The Caserta native started his career with hometown club Juvecaserta Basket during the 1984–85 Serie A season, at age 15. With the Campanian club he won the 1988 Italian Basketball Cup and the 1990–91 Serie A championship, the club's first (and as of 2021 only) national championship, during that time the team also played in the 1991–92 FIBA European League and the 1992–93 FIBA Korać Cup. Esposito moved to Fortitudo Bologna in 1993, playing there for two years. = Esposito had been noticed by NBA teams: the Cleveland Cavaliers through scout Rudy D'Amico and the Toronto Raptors through Bob Zuffelato. Though he had agreed terms with the Cavaliers, complications related to the NBA lockout meant he could only sign with the Raptors. When he signed a multi-year deal on 25 May 1995, he was the first player ever signed by the Canadian expansion team (predating the expansion draft and 1995 NBA draft by a month). Though Esposito wasn't the first Italian to play in an NBA game – preceded by Stefano Rusconi by three days – he was the first to score, on a free throw in a 15 November game against the Houston Rockets. With the Raptors' 21–61 season, he played 30 games, averaging 3.9 points and 0.8 assists, in 9.4 minutes. His best performance was 18 points, 2 assists, 2 offensive rebounds, and 2 turnovers, in 30 minutes, during a 6 April 1996 loss to the New York Knicks in Madison Square Garden. = Despite having two years left on his contract, and having a chance of a trade to the Philadelphia 76ers, Esposito returned to Italy to sign with Scavolini Pesaro in summer 1996. Penning a contract reportedly worth at least 1 billion lire net annually (more than 500,000 in euros today), Esposito was acclaimed as a star on his return. However, Pesaro struggled in the league and the club and the player agreed to a buyout in November 1997, with the player moving to Mabo Pistoia. He joined Andrea Costa Imola after the 1997–98 season, and there he regained his top form, by top-scoring the league for three consecutive years, and being twice designated as league MVP, in 1999 and 2000, and also All Star Game MVP in 1998. He moved to Snaidero Udine in 2001, but he only stayed until January 2002, before having another experience abroad, in the Spanish Liga ACB with Telecom Gran Canaria, where he finished the season. He impressed in Spain averaging more than 20 points per game, including 45 in an April game against Valladolid. = He returned to Imola, then in the second division Legadue, in 2002, staying there one year, and in 2003 to another Legadue team Scafati Basket . Esposito stayed there until February 2004, when the nearly 35-year-old returned to the Serie A with Lottomatica Roma, to provide more depth to an injury-struck squad. He played less than usual, and finished averaging 3.5 points in the league, also scoring 14 in his first (and last) career Euroleague game, against Pau-Orthez. He returned to Imola, Legadue, for the 2004–05 season, with then a brief stay at the end of the Regular Season to play in the LEB playoffs with Polaris World Murcia. Another return to Legadue followed in 2005, with Casale Monferrato, where he stayed until February 2006, as he signed with Capo d'Orlando for his last Serie A season. In November 2006, he joined the third division Serie B1 club Gragnano."", ""They therefore became considerably less competitive in the league. Ford's contract with Olympiacos was subsequently not renewed, and he signed a new contract with the Italian league's EuroLeague contender, Mens Sana Siena. Ford had a quick adaptation period to his new team, and although his scoring average in the EuroLeague dropped to 17.9 points per game, he was selected to the All-EuroLeague 2002–03 First Team, after Siena qualified to the 2003 EuroLeague Final Four. Unfortunately, Ford had one of his worst shooting nights ever, in the semifinal against Benetton Treviso: he scored 15 points, making only 5 of his 19 shots. His 7 rebounds and 2 steals did not allow his team to overcome Benetton's obstacle, as they lost 62–65 in a highly intense game. In the Italian League 2002–03 season, Ford averaged 19.1 points per game, and Siena finished in fourth place in the league. Despite his leukemia being in an advanced stage, Ford played the Italian League 2003–04 season with Scavolini Pesaro. Averaging 22.2 points per game in the Italian League, Ford, in his final season, helped Scavolini finish in fourth place in the Italian League, which meant the team qualified to the next season's EuroLeague, and to the Italian Cup's runner-up position, despite being near death. Less than two weeks after announcing his retirement from the EuroLeague, Ford died from leukemia, at age 32. He is survived by his wife Paula, their daughter Quekenshia, and their sons Karlderek, Alphonso Jr. In Ford's honor, the EuroLeague named its trophy for the leading scorer of the year, the Alphonso Ford EuroLeague Top Scorer Trophy. The player who replaced Ford on Scavolini Pesaro, following his death, Charles Smith, would win the award the very next season. In 2021, a documentary dedicated to the life of Alphonso Ford, titled Alphonso Ford: Score Until The Last Day, premiered at the Thessaloniki International Documentary Festival, receiving critical acclaim. = List of NCAA Division I men's basketball career scoring leaders Alphonso Ford at nba.com Alphonso Ford at basketballreference.com Alphonso Ford at euroleague.net Alphonso Ford at fibaeurope.com Alphonso Ford at acb.com (in Spanish) Alphonso Ford at legabasket.it (in Italian) Alphonso Ford at esake.gr (in Greek) Alphonso Ford at baskethotel.com\n\nIn the 1989–90 season, Alphonso Ford played for MVSU in 27 games. He averaged 29.9 points, 4.9 rebounds, 1.9 assists, 1.5 steals, and 0.2 blocks per game. He shot 0.441 from the field, 0.361 from 3-point range, and 0.737 from the free throw line, playing an average of 31.8 minutes per game. In the 1990–91 season, Alphonso Ford played for MVSU in 28 games. He averaged 32.7 points, 6.0 rebounds, 1.4 assists, 2.2 steals, and 0.1 blocks per game. He shot 0.487 from the field, 0.331 from 3-point range, and 0.765 from the free throw line, playing an average of 33.4 minutes per game. In the 1991–92 season, Alphonso Ford played for MVSU in 26 games. He averaged 27.5 points, 5.6 rebounds, 3.7 assists, 2.5 steals, and 0.4 blocks per game. He shot 0.45 from the field, 0.303 from 3-point range, and 0.757 from the free throw line, playing an average of 33.2 minutes per game. In the 1992–93 season, Alphonso Ford played for MVSU in 28 games. He averaged 26.0 points, 5.3 rebounds, 3.9 assists, 1.9 steals, and 0.4 blocks per game."", 'Then, he was traded to the New Jersey Nets, played one game there, then was traded to the Indiana Pacers. Larry Brown, then of the Pacers, described his trade for Askew as ""I don\'t know of too many guys in the league who are better defenders than him, and not everybody is as unselfish. He doesn\'t worry about minutes, doesn\'t worry about shots, he just worries about winning."" He also had stints with the Denver Nuggets and the Portland Trail Blazers, where he was waived for a final time in the 1997–1998 season. Askew was described as a 6-foot-6 do-everything team player who played in the post and the perimeter and was a steady defensive stopper who built a reliable jumper late in his career. The most he has ever scored in an NBA game is 21 points. In his NBA career, Askew played in 467 games and scored a total of 3,313 points. He averaged 7.1 points, 2.5 rebounds, 2.2 assists in 20 minutes per game. Askew is the only player to be named Most Valuable Player in two straight years (1990 and 1991) in the Continental Basketball Association (CBA). He was selected to the All-CBA First Team in 1990 and 1991 and All-Defensive Team in 1991. He also had a stint in the World Basketball League. Askew also played in Italy for Serie A team Arimo Bologna (1989) and Serie A2 teams Emmezeta Udine (1990–1991) and Sidis Reggio Emilia (1992). After the NBA, Askew had some difficulties establishing himself. European basketball records indicate that at least three times he signed with various teams but refused to play with them, ending in August 2001 when he signed a contract with Roseto, but did not come to Italy. Askew, according to an undated Euroleague scouting report, ""is an NBA veteran that has finally, according to many, reached maturity. Vincent still has a lot of basketball left in him and wants to show the basketball people in Europe that he is indeed a reliable person. He is also in debt $10,000 to Vernon Maxwell. "" Upon his release from Portland in 1998, Askew returned to his hometown of Memphis, completed a degree in marketing and did some scouting for Memphis coach John Calipari, which piqued his interest in coaching. He confided in George Karl, his long-time mentor from his Sonics days, and was told to go overseas. Askew went to Europe, where he coached in an Italian league for three years. Askew took the head coaching job at Elliston Baptist Academy in Memphis, but was embattled to leave the job. Allegations that he had used ineligible players had landed the school in hot water with the Tennessee Secondary School Athletic Association, potentially costing them a chance to play in the postseason, and Askew\'s players were not pleased with his abrasive coaching methods. In 2004, Askew accepted the head coaching position at Rossville Christian Academy. Askew again stirred some controversy by recruiting players, which is a clear Mississippi Private School Association (MPSA) violation, but Askew did lead the RCA Rebels to the Class A State Championship. In 2005, he contacted the ABA expansion team Tacoma Navigators\' owner Michael Tuckman. Askew got a chance to hone his raw coaching skills, while the Navigators, which plays its home games at Mount Tahoma High School, marketed its coach as a former Sonic. Askew served as head coach of the Albany Patroons in the CBA during the 2007–08 season and accumulated a 21–27 record. In 2014, Askew hosted ""Holiday Hoop It Up"" in Memphis, Tennessee Askew also tells his story about ""Going Public"" with God and getting baptized Askew was listed by CBS Los Angeles as ""10 Biggest NBA Trade Deadline Deals"" Career Statistics\n\n', ""He averaged 5.2 points and 5.2 rebounds per game as a sophomore. As a junior at St. John's, Owens averaged 8.4 points, 5.9 rebounds and a Big East Conference-best 2.8 blocks per game. Following the season, Owens opted to transfer as a graduate student, selecting Texas Tech over an offer from Maryland. Owens scored 18 points in a 78–63 win over USC on November 20, 2018. As a senior at Texas Tech, Owens averaged 8.7 points, 5.8 rebounds and 2.4 blocks per game. He helped lead the Red Raiders to the 2019 NCAA Men's Basketball Championship game. Owens was named to the Big 12 Conference All-Defensive Team and honorable mention All-Big 12. = After going undrafted in the 2019 NBA draft, Owens did not play in the NBA Summer League but suited up for the Phoenix Suns. On July 18, 2019, Owens signed an Exhibit 10 contract with the Suns. but was waived on October 15. He was named to the roster of the Suns’ NBA G League affiliate, the Northern Arizona Suns. Owens had a double-double with 14 points and 15 rebounds in a 117–113 loss to the Texas Legends on November 12. On January 5, 2020, Owens led the team in scoring with 18 points to go with nine rebounds, one assist, one steal and one block across in a 101–93 victory over the Rio Grande Valley Vipers, helping snap a 13-game losing streak for Northern Arizona. = On January 15, 2020, the Phoenix Suns announced that they had signed Owens to a two-way contract. In his NBA debut on February 2, Owens scored two points and grabbed two rebounds in a 129–108 loss to the Milwaukee Bucks. = On January 27, 2021, Owens was included in the roster of the Long Island Nets, who mentioned that the returning right to Owens had been acquired from the Northern Arizona Suns along with returning right to Matt Farrell in exchange to returning rights to Joe Cremo and Drew Gordon earlier during off-season trades. = On July 19, 2022, he has signed with Pallacanestro Varese of the Lega Basket Serie A (LBA). = On July 27, 2023, he signed with Napoli Basket of the Italian Lega Basket Serie A (LBA). = On August 3, 2024, he signed with Vanoli Cremona of the Italian Lega Basket Serie A (LBA). = = Career statistics from NBA.com · Basketball Reference Texas Tech Red Raiders bio St. John's Red Storm bio Tennessee Volunteers bio Media related to Tariq Owens at Wikimedia Commons\n\nIn the 2014–15 season, Tariq Owens played for Tennessee in 28 games. He averaged 1.2 points, 1.1 rebounds, .1 assists, .2 steals, and .5 blocks per game. He shot .353 from the field, .000 from 3-point range, and .526 from the free throw line, playing an average of 7.6 minutes per game. In the 2015–16 season, Tariq Owens played for St. John's in Redshirt games. He averaged Redshirt points, Redshirt rebounds, Redshirt assists, Redshirt steals, and Redshirt blocks per game. He shot Redshirt from the field, Redshirt from 3-point range, and Redshirt from the free throw line, playing an average of Redshirt minutes per game. In the 2016–17 season, Tariq Owens played for St. John's in 32 games. He averaged 5.2 points, 5.2 rebounds, .5 assists, .6 steals, and 2.2 blocks per game. He shot .504 from the field, .000 from 3-point range, and .750 from the free throw line, playing an average of 18.8 minutes per game. In the 2017–18 season, Tariq Owens played for St. John's in 33 games. He averaged 8.4 points, 5.9 rebounds, .5 assists, .6 steals, and 2.8 blocks per game. He shot .504 from the field, .324 from 3-point range, and .690 from the free throw line, playing an average of 30.3 minutes per game. In the 2018–19 season, Tariq Owens played for Texas Tech in 38 games. He averaged 8.7 points, 5.8 rebounds, .7 assists, .5 steals, and 2.4 blocks per game. He shot .611 from the field, .250 from 3-point range, and .780 from the free throw line, playing an average of 25.4 minutes per game. In the 2019–20 season, Tariq Owens played for Phoenix in 3 games. He averaged 1.3 points, 1.0 rebounds, 0.0 assists, 0.3 steals, and 0.0 blocks per game."", ""= After playing at St. Catherine's High School in Racine (averaging 22.9 points, 11.1 rebounds and 8.1 blocked shots as a senior) and blocking a school-record 399 shots at Marquette University, McIlvaine was named NABC Defensive Player of the Year and was drafted with the fifth pick in the second round of the 1994 draft by the Washington Bullets (now Washington Wizards). He spent two years with the team, primarily in a backup role to Gheorghe Mureșan."", ""In 2014, he won the NBA championship with the San Antonio Spurs, becoming the first Italian player to do so. He won the Three-Point Contest during the 2014 NBA All-Star Weekend. He played in the 2007, 2011, 2013, 2015, and 2017 editions of the FIBA EuroBasket and the 2006 and 2019 editions of the FIBA World Championship with the Italian national basketball team. = Belinelli played in the Italian Serie A and the EuroLeague for Virtus Bologna and Fortitudo Bologna. In 2004, he lost the EuroLeague Finals against Maccabi Tel Aviv, and in 2005, he won the Serie A title with Fortitudo. = Golden State Warriors (2007–2009) After being selected #18 in the first round of the 2007 NBA draft by the Golden State Warriors, Belinelli scored 37 points in his first NBA Summer League game against the New Orleans Hornets, going 14-on-2 from the field, including 5-on-7 from behind the arc, adding 5 boards, 2 assists and 1 steal to help the Warriors earn a 110–102 win. His performance is tied for second for the highest scoring game ever in Vegas summer league history, behind Keith Bogans' 38 scored as a member of the Orlando Magic in 2004. Belinelli finished his Summer League scoring an average of 22.8 points per game in 4 games with the Warriors, before returning to Italy to be part of the Italian national team for EuroBasket 2007. On 19 December 2008, he scored 27 points, in a game the Warriors lost to Atlanta Hawks. Toronto Raptors (2009–2010) On 30 July 2009, he was traded to the Toronto Raptors for Devean George, joining Italian national squad teammate Andrea Bargnani. He played his first NBA game as a starter for Toronto on 2 February 2010 against the Indiana Pacers. New Orleans Hornets (2010–2012) On 11 August 2010, he was traded to the New Orleans Hornets for Julian Wright. After the 2010–11 season, he became a restricted free agent."", 'Before the 1989–90 NBA season, he signed with the Milwaukee Bucks but his season was cut short due to injury in February and he was waived. The following season he began a three-year stint in Spain, signing with Baloncesto León in Spain. He moved to FC Barcelona and CB Peñas Huesca. For the 1993–94 NBA season, Coleman returned to the U.S. with the Rapid City Thrillers of the Continental Basketball Association. He signed a ten-day contract with the Detroit Pistons. After Detroit did not retain him, he played on a rest-of-season contract with Roma and the following season with Montecatiniterme Basketball in Italy. He ended his playing career with the Sioux Falls Skyforce and Omaha Racers of the CBA. After he retired, Coleman coached in the greater Minneapolis area with the private coaching service, CoachUp. Coleman died on January 6, 2019, at age 57. = = College & NBA statistics @ basketballreference.com Italian League profile\n\nIn the 1986–87 season, Ben Coleman played for New Jersey in 68 games. He averaged 6.6 points, 4.2 rebounds, 0.5 assists, 0.5 steals, and 0.5 blocks per game. He shot 0.581 from the field, 0.0 from 3-point range, and 0.727 from the free throw line, playing an average of 15.1 minutes per game. In the 1987–88 season, Ben Coleman played for New Jersey in 27 games. He averaged 11.0 points, 6.4 rebounds, 1.4 assists, 1.0 steals, and 0.6 blocks per game. He shot 0.483 from the field, 0.0 from 3-point range, and 0.774 from the free throw line, playing an average of 24.3 minutes per game. In the 1987–88 season, Ben Coleman played for Philadelphia in 43 games. He averaged 6.9 points, 4.1 rebounds, 0.5 assists, 0.3 steals, and 0.6 blocks per game. He shot 0.516 from the field, 0.0 from 3-point range, and 0.752 from the free throw line, playing an average of 19.6 minutes per game. In the 1988–89 season, Ben Coleman played for Philadelphia in 58 games. He averaged 5.1 points, 3.1 rebounds, 0.3 assists, 0.2 steals, and 0.3 blocks per game. He shot 0.485 from the field, 0.0 from 3-point range, and 0.792 from the free throw line, playing an average of 12.1 minutes per game. In the 1989–90 season, Ben Coleman played for Milwaukee in 22 games. He averaged 5.7 points, 4.0 rebounds, 0.5 assists, 0.3 steals, and 0.3 blocks per game. He shot 0.474 from the field, 0.0 from 3-point range, and 0.829 from the free throw line, playing an average of 13.9 minutes per game. In the 1993–94 season, Ben Coleman played for Detroit in 9 games. He averaged 3.1 points, 2.9 rebounds, 0.0 assists, 0.2 steals, and 0.2 blocks per game. He shot 0.48 from the field, 0.0 from 3-point range, and 0.5 from the free throw line, playing an average of 8.6 minutes per game. In the 1988–89 season, Ben Coleman played for Philadelphia in 3 games. He averaged 4.7 points, 1.7 rebounds, 0.0 assists, 0.3 steals, and 0.0 blocks per game.', ""His D-League rights are still retained by Westchester for the next two seasons. In July 2015, Lamb joined the Golden State Warriors for the 2015 Summer League. On November 25, 2015, Lamb signed a contract with Budućnost Podgorica of Montenegro. He left Budućnost after appearing in only one game, and on December 23, 2015, he signed with Torku Konyaspor of the Turkish Basketball Super League. However, only two days later he was released after failing to pass physicals. On February 8, 2016, Lamb signed a tryout contract with Manital Torino of Italy. However, he did not stay with Torino and on February 24, he signed a one-month contract with JSF Nanterre of the French LNB Pro A. On November 16, 2016, Lamb was reacquired by the Westchester Knicks. On June 6, 2017, Lamb signed with Greek club Lavrio for the 2017–18 season. Lamb left the Greek team temporarily before the end of the season to address family matters, but then re-signed with them for another season on August 14, 2018. On July 8, 2019, Lamb signed with Turkish club Darüşşafaka that competes in the EuroCup. He averaged 9.9 points and 2.3 assists per game. On March 22, 2020, Lamb and the Turkish club mutually agreed to part ways, amidst the Coronavirus pandemic. On August 5, 2021, he has signed with Start Lublin of the PLK. Lamb did not conclude the season with Star Lublin signing in the Italian Serie A with Victoria Libertas Pesaro on November 24, 2021. On August 7, 2022, he has signed with Scafati Basket of the Lega Basket Serie A. On January 18, 2023, he signed with New Basket Brindisi of the Lega Basket Serie A. In October 2023, Lamb joined the Tunisian champions US Monastir. In January 2024, Lamb joined Italian club UEB Gesteco Cividale of the Serie A2, the country's second-tier division. = Career statistics from NBA.com · Basketball Reference FIBA.com profile Kentucky Wildcats bio NBADraft.net profile Scout.com profile Rivals.com profile\n\nIn the 2010–11 season, Doron Lamb played for Kentucky Wildcats in 38 games. He averaged 12.3 points, 2.7 rebounds, 1.6 assists, 0.6 steals, and 0.2 blocks per game. He shot 0.497 from the field, 0.486 from 3-point range, and 0.79 from the free throw line, playing an average of 28.4 minutes per game. In the 2011–12 season, Doron Lamb played for Kentucky Wildcats in 40 games. He averaged 13.7 points, 2.7 rebounds, 1.5 assists, 0.5 steals, and 0.1 blocks per game. He shot 0.474 from the field, 0.466 from 3-point range, and 0.826 from the free throw line, playing an average of 31.2 minutes per game. In the 2012–13 season, Doron Lamb played for Milwaukee in 23 games. He averaged 3.4 points, 0.7 rebounds, 0.9 assists, 0.3 steals, and 0.0 blocks per game. He shot 0.347 from the field, 0.25 from 3-point range, and 0.533 from the free throw line, playing an average of 12.2 minutes per game. In the 2012–13 season, Doron Lamb played for Orlando in 24 games. He averaged 3.2 points, 1.2 rebounds, 0.5 assists, 0.3 steals, and 0.0 blocks per game. He shot 0.397 from the field, 0.476 from 3-point range, and 0.632 from the free throw line, playing an average of 12.4 minutes per game. In the 2013–14 season, Doron Lamb played for Orlando in 53 games. He averaged 3.6 points, 0.9 rebounds, 0.8 assists, 0.2 steals, and 0.0 blocks per game.""]",Cozell McQueen led the Italian Serie A league in blocks per game in the year 1988–89.,1988–89,,0.9251900227076358,0.574999999985625,,0.9537426993240732,0.8148483214100912
In which year did Brandon Ingram represent the Olympic basketball team?,"['He was also a member of the United States national team that competed in the 2023 FIBA Basketball World Cup, finishing fourth overall. Standing 6 feet 8 inches (2.03 m) tall and weighing 196 pounds (89 kg), Ingram plays mostly at the small forward position. His long arms, stretching to a 7-foot-3-inch (2.21 m) wingspan and 9-foot-1-inch (2.77 m) standing reach, allows him get his shot off over defenders and block shots on the defensive end. Ingram has drawn frequent comparisons to Kevin Durant, after whom he patterned his playing style revealing, ""I try to take bits and pieces out of [Durant\'s] game and put it in my game [but] at the end of the day, he\'s Kevin Durant, and I\'m Brandon Ingram"". Like Durant, Ingram has been criticized for his slim frame; however, one Western Conference coach stated that Ingram is ""just weak right now. He\'s not soft, by any stretch of the imagination."" After a Team USA practice, Durant told reporters that Ingram is ""the first person that I could... look at him and feel like I\'m looking in the mirror"". In his rookie year, Ingram was utilized as a point forward by coach Luke Walton, who stated that ""it helps engage [Ingram] in the game."" Growing up, one of Ingram\'s favorite things to do as a kid was fishing with his grandmother at Atlantic Beach. Ingram signed with Excel Sports Management and is represented by Excel founder and president Jeff Schwartz. In 2016, he chose to sign an endorsement deal with Adidas Basketball and made an appearance in a commercial for Speed Stick along with then Minnesota Timberwolves point guard Kris Dunn. In early 2017, he teamed up with L.A. street artist Jonas Never for Delta\'s ""Beyond the Court"" campaign, which saw Ingram and then-Laker teammate Jordan Clarkson explore their passions outside of basketball. While Clarkson is an aspiring fashion designer, Ingram\'s passion for art began with him drawing basketball players and cartoon characters, which was bolstered by taking a portrait drawing class at Duke. = Regular season Playoffs = NBA NBA All-Star (2020) NBA Most Improved Player (2020) 2× Rising Stars Challenge (2017, 2018) NBA All-Rookie Second Team (2017) College Associated Press Honorable Mention (2016) ACC Rookie of the Year (2016) High school 4× NCHSAA champion (2012, 2013, 2014, 2015) North Carolina Mr. Basketball (2015) McDonald\'s All-American (2015) First-team Parade All-American (2015) Nike Hoop Summit (2015) Career statistics from NBA.com · Basketball Reference Duke Blue Devils bio Lakers rookie Brandon Ingram has skill and moxie, scouts say of his Las Vegas summer league stint\n\nIn the 2016–17 season, Brandon Ingram played for L.A. Lakers in 79 games.', ""Brandon Xavier Ingram (born September 2, 1997) is an American professional basketball player for the Toronto Raptors of the National Basketball Association (NBA). He was selected by the Los Angeles Lakers with the second overall pick in the 2016 NBA draft, and was named to the NBA All-Rookie Second Team. He was traded to the New Orleans Pelicans and became a first-time NBA All-Star and was named the NBA Most Improved Player in 2020 during his first season with the Pelicans. Ingram had a successful high school career in North Carolina, where he won state titles each of his four years of high school and was named North Carolina's Mr. Basketball. He played one season of college basketball for the Duke Blue Devils, where he was named Atlantic Coast Conference Rookie of the Year. After the season, Ingram decided to forgo his remaining college eligibility and declared for the NBA draft. He played three seasons with the Lakers before being traded to New Orleans in 2019 in a package for All-Star Anthony Davis. Ingram was born on September 2, 1997, in Kinston, North Carolina. He is the son of Donald and Joann Ingram. He has two half-siblings, an older brother, Donovan, and an older sister, Brittany. He shares a father with Donovan and a mother with Brittany. Ingram's father started his career as a police officer and a manager of a local gym, but he is now full-time at a welding plant, where he makes forklifts. Before that, Donald was a would-be hoops star, pushing his way through the semi-pro leagues. When he moved back home to Kinston, his father started playing pickup games with a young Jerry Stackhouse, who was looking to play locally against older and more experienced players to help him elevate his game. Stackhouse, an ex-NBA star and Kinston native, forged a friendship with Ingram's father on the court. While Ingram grew up in a one-story house on Highland Avenue in Kinston, his brother Donovan grew up in a different house but would spend weekends with Brandon, teaching him basketball. Kinston had an extremely high crime rate, but Ingram kept his focus on basketball. Before Ingram was a teenager, his brother allowed him to play with him and his older friends."", 'He averaged 9.4 points, 4.0 rebounds, 2.1 assists, 0.6 steals, and 0.4 blocks per game. He shot 0.402 from the field, 0.294 from 3-point range, and .621 from the free throw line, playing an average of 28.9 minutes per game. In the 2017–18 season, Brandon Ingram played for L.A. Lakers in 59 games. He averaged 16.1 points, 5.3 rebounds, 3.9 assists, 0.8 steals, and 0.7 blocks per game. He shot 0.47 from the field, 0.39 from 3-point range, and .681 from the free throw line, playing an average of 33.5 minutes per game. In the 2018–19 season, Brandon Ingram played for L.A. Lakers in 52 games. He averaged 18.3 points, 5.1 rebounds, 3.0 assists, 0.5 steals, and 0.6 blocks per game. He shot 0.497 from the field, 0.33 from 3-point range, and .675 from the free throw line, playing an average of 33.9 minutes per game. In the 2019–20 season, Brandon Ingram played for New Orleans in 62 games. He averaged 23.8 points, 6.1 rebounds, 4.2 assists, 1.0 steals, and 0.6 blocks per game. He shot 0.463 from the field, 0.391 from 3-point range, and .851 from the free throw line, playing an average of 33.9 minutes per game. In the 2020–21 season, Brandon Ingram played for New Orleans in 61 games. He averaged 23.8 points, 4.9 rebounds, 4.9 assists, 0.7 steals, and 0.6 blocks per game. He shot 0.466 from the field, 0.381 from 3-point range, and .878 from the free throw line, playing an average of 34.3 minutes per game. In the 2021–22 season, Brandon Ingram played for New Orleans in 55 games. He averaged 22.7 points, 5.8 rebounds, 5.6 assists, 0.6 steals, and 0.5 blocks per game. He shot 0.461 from the field, 0.327 from 3-point range, and .826 from the free throw line, playing an average of 34.0 minutes per game. In the 2022–23 season, Brandon Ingram played for New Orleans in 45 games. He averaged 24.7 points, 5.5 rebounds, 5.8 assists, 0.7 steals, and 0.4 blocks per game. He shot 0.484 from the field, 0.39 from 3-point range, and .882 from the free throw line, playing an average of 34.2 minutes per game. In the 2023–24 season, Brandon Ingram played for New Orleans in 64 games. He averaged 20.8 points, 5.1 rebounds, 5.7 assists, 0.8 steals, and 0.6 blocks per game. He shot 0.492 from the field, 0.355 from 3-point range, and .801 from the free throw line, playing an average of 32.9 minutes per game. In the 2024–25 season, Brandon Ingram played for New Orleans in 18 games. He averaged 22.2 points, 5.6 rebounds, 5.2 assists, 0.9 steals, and 0.6 blocks per game. He shot 0.465 from the field, 0.374 from 3-point range, and .855 from the free throw line, playing an average of 33.1 minutes per game. In the All-Star season, Brandon Ingram played for All-Star in 1 games. He averaged 2.0 points, 1.0 rebounds, 1.0 assists, 1.0 steals, and 0.0 blocks per game. He shot 0.25 from the field, 0.0 from 3-point range, and — from the free throw line, playing an average of 8.6 minutes per game. In the 2022 season, Brandon Ingram played for New Orleans in 6 games. He averaged 27.0 points, 6.2 rebounds, 6.2 assists, 0.7 steals, and 0.3 blocks per game. He shot 0.475 from the field, 0.407 from 3-point range, and 0.83 from the free throw line, playing an average of 39.3 minutes per game. In the 2024 season, Brandon Ingram played for New Orleans in 4 games. He averaged 14.3 points, 4.5 rebounds, 3.3 assists, 1.0 steals, and 1.3 blocks per game. He shot 0.345 from the field, 0.25 from 3-point range, and 0.895 from the free throw line, playing an average of 36.4 minutes per game. In the 2015–16 season, Brandon Ingram played for Duke in 36 games. He averaged 17.3 points, 6.8 rebounds, 2.0 assists, 1.1 steals, and 1.4 blocks per game.', ""Andre Ingram (born November 19, 1985) is an American former professional basketball player who played two seasons for the Los Angeles Lakers. He played college basketball for American University, where he finished his four-year career as the school's fifth all-time leading scorer with 1,655 points. He made his NBA debut with the Los Angeles Lakers in 2018. Ingram is the NBA G League's career leader in three-point field goals and games played. He has also scored the third-most points in league history and won the D-League 3-Point Contest in 2010 and 2016. As a pro, Ingram spent four seasons with the Utah Flash between 2007 and 2011, and four seasons with the Los Angeles D-Fenders between 2012 and 2016. After a short stint in Australia with the Perth Wildcats, Ingram returned to the D-Fenders in March 2017. He continued on with the renamed South Bay Lakers for the 2017–18 season, before joining the Los Angeles Lakers in April 2018, and finally making his NBA debut. Ingram was born and raised in Richmond, Virginia, and grew up in a tight-knit family of four. He loved basketball from an early age, and by the time he turned 12, he was beating his older brother by seven years, Lucius, in one-on-one. Ingram attended Highland Springs High School in Highland Springs, Virginia, where he led the basketball team to the Group AAA championship as a senior in 2002–03, the first title in school history. That year, he averaged 22.8 points and 9.5 rebounds per game, while shooting 49 percent from three-point range. He was subsequently named the Associated Press Group AAA Player of the Year for his division. He left Highland Springs as a two-time Capital District Player of the Year and First-Team All-Metro, and as a senior was a First-Team All-State and First-Team All-Central Region pick. = As a freshman at American University in 2003–04, Ingram started in all 31 games and led the team with 13.6 points per game, which ranked fifth best in the league. He was subsequently named Patriot League Freshman of the Year, becoming the first American player to win the award. He had 16 points, five rebounds, two assists and two steals against Maryland on November 22, 2003, in his first collegiate game. On January 14, 2004, he made eight shots from behind the arc in a 27-point effort against Navy, which ties the second best single-game three-point total in AU history. In addition, his 15 three-point attempts against Navy is tied for the highest single-game attempt total for an Eagle."", 'Olympic basketball team.', 'He described this experience as ""the best thing that ever happened to my game"". His brother, known as Bo, went on to play college basketball for South Plains College (2008–2010) and UT Arlington (2010–2012). By the time Brandon reached eighth grade, Stackhouse became Ingram\'s Amateur Athletic Union (AAU) coach and mentored the young basketball player. Those influences ""took me to the next level"", said Ingram, whose foundation as a player came from his father. His father was a high school and collegiate referee who stated Brandon ""was trained correctly, both mentally and physically. He grew up knowing the rules of the game"". Ingram played all four years of his high school basketball career at Kinston High School and helped lead Kinston to four straight state championships during his time there. During his freshman year at Kinston, he came off the bench on the varsity basketball team but along the way his role grew. In his first year with the Kinston Vikings, the team defeated Cuthbertson High School by three points to win the 2012 NCHSAA 2-A boys\' basketball state championship in Reynolds Coliseum. As a sophomore, Kinston defeated Cuthbertson for the second year in a row to win the state title and Ingram averaged 12.4 points per game (ppg), 3.9 rebounds per game (rpg) and 1.5 assists per game (apg). Prior to the start of Ingram\'s junior year, he began to show improvement during the 2013 summer while playing AAU basketball. After shining for the Stackhouse Elite team, the 6-foot-7-inch (2.01 m) junior entered the year with high expectations and received a large amount of attention from college coaches who were lined up to recruit Ingram to a Division I school. In his junior year, Ingram led the Kinston Vikings to its third consecutive state title where he scored 28 points to go along with his 16 rebounds against North Rowan. During the season, the Vikings went undefeated in their conference with a 26–4 overall record while Ingram was averaging 19.5 points, 9.1 rebounds, 2.5 blocks and 1.5 assists per game and was named Eastern Regional Most Valuable Player (MVP). During the spring 2014, Ingram represented the Stackhouse Elite for the Norman Parker Showcase at the Suwanee Sports Academy where he earned MVP honors after leading the team to the championship. He averaged 17.9 points per game and 5.3 rebounds each contest and shot better than 81 percent from the free throw line during the Adidas Uprising circuit. After his junior year came to an end, Ingram participated in the NBPA Top 100 Camp on June 19, 2014, at John Paul Jones Arena in Charlottesville, Virginia. Later that summer, instead of playing for an AAU tournament in the Atlanta area, he decided to compete with his high school team at the annual East Coast Invitational (ECI), an off-season event in his home state. As a senior, he averaged 24.3 points and 10.4 rebounds per game and led the Vikings to a 26–4 record. At the Spalding Hoophall Classic, Kinston pulled off a fourth-quarter comeback defeating Trenton Catholic Academy (56–54) behind Ingram\'s 22 points. In his final high school basketball game, he was named MVP of the state championship game after scoring 28 points to go with 10 rebounds and 5 blocks in a win over East Lincoln High School at the Dean E. Smith Center. This made Ingram the first men\'s basketball player to win 4 consecutive North Carolina High School Athletic Association (NCHSAA) championships. The Vikings also became the first Class 2A school in North Carolina history to win four consecutive state titles. Following his senior season, Ingram was a participant in the 2015 McDonald\'s All-American Game, where he scored 15 points and had five rebounds. Ingram was rated as a five-star recruit and was considered among the best high school prospects of the 2015 class. He was ranked as the No.', ""He scored in double digits in 19 of 29 games, starting the season with a 24-point effort against Washington on November 19. He notched his 1,000th career point, while amassing a season-high 10 rebounds, against the Saint Francis Red Flash on January 2. At the season's end, he earned second-team All-Patriot League honors. = As a senior in 2006–07, Ingram ranked fifth in the Patriot League in scoring (15.2 ppg), second in three-point field goal percentage (.424) and second in three-point field goals made per game (2.6). He scored 20 or more points eight times, including a season-high 25 points against Lafayette. He subsequently earned first-team All-Patriot League honors for the second time in three years. Ingram finished his collegiate career as American's fifth all-time leading scorer with 1,655 points, as he led the team in scoring all four years. He graduated from American University with a bachelor’s degree in physics. = On November 1, 2007, Ingram was selected by the Utah Flash in the seventh round of the 2007 NBA Development League Draft. He spent four years with the Flash, and in that time, became the franchise's all-time leading scorer with 2,098 points. He also ranks second in rebounds (608), fourth in assists (336), and third in steals (184). Ingram had a career-best year in 2009–10, as he won the Jason Collier Sportsmanship Award and participated in 2010 NBA D-League All-Star festivities in Dallas, where he took home the Three-Point Shooting Competition Championship. Ingram made noteworthy contributions in game as well, starting 49 of the team's 50 games, and averaging 12.9 points, 3.9 rebounds, 2.1 assists and 1.5 steals in 34.0 minutes. He scored in double figures 36 times, including a season-high 24 points in a 104–99 road victory over the Bakersfield Jam on December 5, 2009. Following the 2010–11 season, the Flash suspended operations and left Ingram without a team for the 2011–12 season. = On March 22, 2012, Ingram was acquired by the Los Angeles D-Fenders. He spent the rest of the 2011–12 season with the D-Fenders, playing in six regular season games and seven playoff games. After sitting out the entire 2012–13 season, Ingram returned to the D-Fenders for the 2013–14 season. In 45 games (11 starts) with the D-Fenders in 2013–14, Ingram posted averages of 9.1 points, 3.2 rebounds and 1.7 assists, while shooting .447 from three-point range and helping the D-Fenders to a West Division Championship. Ingram did not return to the D-Fenders for the start of 2014–15 season. He missed the first two months of the season before joining the team on January 12, 2015. Ingram spent only his second full season with the D-Fenders in 2015–16. In February 2016, he became the D-League's all-time leader in three-pointers made and won his second three-point contest title. He took the crown by making 39-of-50 shots over two rounds – an all-time record across the NBA and D-League. = On October 18, 2016, Ingram signed with the Perth Wildcats for the rest of the 2016–17 NBL season, marking his first stint overseas. However, he managed just two games for the Wildcats before requesting his release from the club a week after landing in Perth, citing mental health reasons for the sudden decision. = On March 6, 2017, Ingram returned to the Los Angeles D-Fenders to play out the 2016–17 season. He returned to the team, now called the South Bay Lakers, for the 2017–18 season. Ingram averaged 9.1 points, 2.5 rebounds and 1.1 assists in 47 games (seven starts) for the South Bay Lakers in 2017–18, shooting a league-best 47.5 percent from three-point range. = On April 9, 2018, Ingram signed with the Los Angeles Lakers for the final two games of the 2017–18 NBA season. He made his NBA debut the following day, scoring 19 points with four 3-pointers in a 105–99 loss to the Houston Rockets. At 32 years old, Ingram became the second oldest American rookie in the NBA since at least Pablo Prigioni’s 2012 rookie season at 35 years of age. His 19 points were the most by a Laker in his first career game since Nick Van Exel had 23 in 1993. For players making their NBA debut after the All-Star break, Ingram's 19 points were the most in a debut in 50 years, and the most scored by a Laker since Danny Finn's 28 points in 1953. In the Lakers' season finale on April 11, Ingram scored five points on 2-of-9 shooting, including 1 of 4 from 3-point range, and had six assists and three rebounds in 35 minutes in a 115–100 win over the Los Angeles Clippers. Ingram reportedly earned $13,824 for his three days with the Lakers, after making just $19,000 for the entirety of his G League season. = Returning to the South Bay Lakers for the 2018–19 season, Ingram appeared in his 402nd career game in the NBA G League in January 2019, becoming the league's all-time leader for games played. = On March 11, 2019, Ingram signed a 10-day contract with the Los Angeles Lakers, returning to the franchise for a second stint. With Lonzo Ball and Brandon Ingram out for the remainder of the season due to injuries, the Lakers roster required bolstering. = After his 10-day contract expired, Ingram returned to South Bay for their final two games of the season. Ingram once again returned to South Bay for the 2019–20 season. On February 7, 2020, he was removed from the active roster due to a season-ending injury. He suffered a right pectoralis tendon tear on January 22 and never fully recovered. In October 2020, Ingram was named as the inaugural president of the G League Players Union, known as the Basketball Players Union (BPU). On October 23, 2021, Ingram was named to the training camp roster for the South Bay Lakers, returning to the franchise for a fifth stint. On December 19, 2021, Ingram was re-elected as President of the NBA G-League's union, following his stint as interim inaugural president. On April 10, 2022, he received his second Jason Collier Sportsmanship Award. = On March 8, 2023, Ingram was reacquired by the South Bay Lakers. Ingram is considered to be retired but, he has expressed interest in returning to professional basketball. = = Regular season Playoffs = Ingram has a wife and two daughters. Prior to his promotion to the NBA, he tutored children in math to supplement his G-League salary. Ingram is a Christian."", 'On January 16, 2020, he bested that career high, scoring 49 points in a 138–132 overtime win over the Utah Jazz. Ingram gave New Orleans a one-point lead with a fadeaway jumper with 0.2 seconds remaining in regulation, before Rudy Gobert was fouled and sent the game to overtime with a free throw. He became an NBA All-Star in his first year as a Pelican.', 'He was selected with the 31st overall pick in the 2014 NBA draft by the Bucks and represents France in international competition. Born in Cayenne, French Guiana, Inglis was a big soccer fan, but as his cousins played streetball, he first began playing basketball at age nine before moving to Paris as a teenager. Several years later, he recalled his move to Paris saying, ""I was by myself. I left French Guiana when I was 14 years old. My family was far and I had to play basketball. It was cold, it was tough.', 'He debuted for his country at the 2012 Centrobasket, when he was age 16.', ""He was named the NBA Most Improved Player after averaging 23.8 points. 6.1 rebounds and 4.2 assists per game. After becoming a restricted free agent in the 2020 offseason, Ingram re-signed to the Pelicans on a five-year, $158 million contract. His contract has no player or team option, setting Ingram up to become a free agent again in the 2025 offseason. On December 3, 2021, Ingram recorded a career-high 12 assists, along with 24 points and eight rebounds, in a 107–91 win over the Dallas Mavericks. Two days later, he scored a season-high 40 points in a 118–108 loss to the Houston Rockets. On January 11, 2022, Ingram recorded 33 points and nine assists, and hit a game-winning three-pointer to lift the Pelicans to a 128–125 victory over the Minnesota Timberwolves. On April 19, during Game 2 of the first round of the playoffs, Ingram recorded 37 points, 11 rebounds and 9 assists in a 125–114 win over the Phoenix Suns. In Game 4, on April 24, Ingram scored 30 points in a 118–103 win to tie the series at 2–2. New Orleans would go on to lose to Phoenix in six games despite Ingram averaging 27.0 points, 6.2 rebounds and 6.2 assists. On June 7, Ingram underwent surgery on his right pinky finger and was ruled out for 6 to 8 weeks. On March 24, 2023, Ingram achieved the first triple-double of his NBA career with 30 points, 11 rebounds, and 10 assists in the Pelicans' 115–96 victory over the Charlotte Hornets. On March 30, Ingram put up a triple-double with 31 points, 11 rebounds, and 10 assists in a 107–88 win over the Denver Nuggets. He joined Chris Paul as the only players with multiple games of at least 30 points, 10 rebounds, and 10 assists in Pelicans history. On April 9, in the final game of the 2022–23 season, Ingram posted season highs of 42 points and 12 rebounds along with 7 assists in a 113–108 loss against the Minnesota Timberwolves. On February 6, 2024, Ingram put up 41 points, nine rebounds, and six assists in a 138–100 win over the Toronto Raptors. He became the first player in NBA history to put up at least 40 points, eight or more three-pointers made, and shoot at least 75+% from the field, while not committing a turnover. On December 8, 2024, Ingram sustained a left ankle sprain in a 119–109 loss to the Oklahoma City Thunder, which would go on to be his last game played for the Pelicans. = On February 6, 2025, Ingram was traded to the Toronto Raptors in exchange for guard-forward Bruce Brown, center Kelly Olynyk, a 2026 first-round draft pick (via Indiana) and a 2031 second-round draft pick. On February 12, he signed a 3-year, $120 million contract extension with the team. On April 9, before ever being able to suit up for the franchise, he was officially shut down for the season following a PRP injection in his ankle to aid in his recovery. Ingram was selected to the 2016 U.S."", ""He attended St. Mark's School of Texas in Dallas, Texas and was a consensus five-star recruit coming out of high school. Ingram attended St. Mark's School of Texas in Dallas. As a junior, he averaged 19.5 points, 10.9 rebounds and seven assists per game, leading his team to a Southwest Preparatory Conference title. As a senior, Ingram only played seven games, with his team facing multiple COVID-19 pauses, and averaged 22 points, 13 rebounds and 8.4 assists per game. He was named a McDonald's All-American. = Ingram held scholarship offers from several NCAA Division I programs, including Baylor and Kansas, by the time he was a sophomore. A consensus five-star recruit, he committed to playing college basketball for Stanford over offers from Purdue, North Carolina, Michigan, Harvard and Howard. = In his college debut, Ingram scored 16 points and grabbed seven rebounds in a 62–50 win against Tarleton State. On January 11, 2022, he scored 21 points in a 75–69 upset of USC. As a freshman, Ingram averaged 10.5 points, 6.7 rebounds and three assists per game. He was named Pac-12 Freshman of the Year. On March 30, 2022, Ingram declared for the 2022 NBA draft while maintaining his college eligibility. He returned for his sophomore season and started all but one game, averaging 10.5 points and 5.8 rebounds on the campaign. Following the season, Ingram decided to leave Stanford and put his name into the transfer portal. = Ingram's transfer recruitment came down to North Carolina and Kansas. After an official visit to Chapel Hill, Ingram decided to transfer to the Tar Heels, committing in late April 2023. Before the start of the season, Ingram was named to the Julius Erving Award preseason watchlist. On November 29, 2023, Ingram scored 20 points and 6 rebounds in a 100–92 win over Tennessee in the ACC-SEC Challenge. On January 27, 2024, Ingram scored a double-double of 13 points and 17 rebounds in a 75–68 victory against Florida State. On February 3, 2024, Ingram scored another double-double with 21 points and 13 rebounds in a 93–84 win over rival Duke. On February 5, 2024, Ingram earned Atlantic Coast Conference (ACC) Co-Player of the week honors. At the close of the season, Ingram was named third-team All-ACC. His last collegiate game was in the Sweet 16 versus The University of Alabama. He would lose 89-87 scoring twelve points on 5-12 shooting from the field with 9 rebounds, 5 assists, 2 steals, and a block. After the conclusion of the season, Ingram declared for the 2024 NBA draft, forgoing his remaining college eligibility. = On June 27, 2024, Ingram was selected with the 48th overall pick by the San Antonio Spurs in the 2024 NBA draft and on July 29, he signed a two-way contract with them. Ingram made his NBA debut on November 6, 2024. In his debut, Ingram was substituted in for Sandro Mamukelashvili right under seven minutes left in the 4th quarter and went on to grab one rebound and no other stats as the Spurs fell to the Houston Rockets 100–127. Ingram represented the United States at the 2021 FIBA Under-19 World Cup in Latvia. He averaged 4.6 points and 4.1 rebounds per game, helping his team win the gold medal. = Ingram is the son of Vera and Tyrous Ingram. His older brother, Will, played basketball for Middlebury at the NCAA Division III level."", ""He was also selected to play in the 2020 Jordan Brand Classic. = A five-star recruit, Boston committed to play college basketball at the University of Kentucky. In his college debut on November 25, 2020, Boston posted 15 points and seven rebounds in an 81–45 win over Morehead State. He scored 21 points in the season finale win against South Carolina. As a freshman, he averaged 11.5 points and 4.5 rebounds per game. On March 20, 2021, Boston declared for the 2021 NBA draft, forgoing his remaining college eligibility. = Boston was selected in the second round of the 2021 NBA draft with the 51st pick by the Memphis Grizzlies, then traded to the Los Angeles Clippers via the New Orleans Pelicans. Boston was assigned to the Clippers' NBA G League affiliate, the Agua Caliente Clippers, for their G League season-opener. Boston helped the since-relocated Ontario Clippers win the G League Winter Showcase championship in 2022, earning Showcase Cup MVP honors after scoring 21 points in the final. On August 8, 2024, Boston signed with the San Antonio Spurs, but was waived on October 19. = On October 21, 2024, Boston was claimed off waivers by the New Orleans Pelicans, who later converted his deal into a two-way contract. On February 26, 2025, the Pelicans signed Boston to a standard, two-year contract. He made 42 appearances (10 starts) for New Orleans during the 2024–25 NBA season, averaging 10.7 points, 3.2 rebounds, and 2.2 assists. On April 28, it was announced that Boston had undergone arthroscopic surgery on his left ankle. = Regular season Playoffs = After a workout with Kentucky teammate Terrence Clarke on April 22, 2021, Clarke was involved in a car crash in Los Angeles, California. Clarke, driving by himself, was killed while Boston, in the car behind of Clarke, witnessed the crash. He also keeps a dollar bill in his shoe during games. Kentucky Wildcats bio Sierra Canyon Trailblazers bio USA Basketball bio\n\nIn the 2021–22 season, Brandon Boston played for L.A. Clippers in 51 games."", 'On April 27, 2015, he announced that he would attend Duke University and play for the Blue Devils in the 2015–16 season. Ingram said he ""probably"" would have committed to North Carolina in November if the Tar Heels were not involved in a ""far-reaching academic scandal"". Ingram began his freshman year of college basketball playing two exhibition games against Florida Southern and Livingstone. In his debut for Duke, Ingram scored 15 points on 5-of-16 shooting against Siena. In the second game, he scored 21 points to help Duke defeat Bryant in the 2K Sports Classic. The Blue Devils started out the season ranked fifth in the nation entering the Champions Classic, an event that matches four of the nation\'s best programs against each other, before receiving their first loss of the season against Kentucky on November 17, 2015. The same day, Ingram became one of seven freshmen named to the 50-man Wooden Award preseason watchlist. Duke quickly bounced back by defeating Georgetown the following week at the 2K Sports Classic Championship in Madison Square Garden on November 22. The same week, Ingram came off the bench for the second time after being removed from Duke\'s starting line-up for their game against Yale, scoring 15 points. The following game, he was inserted back into the starting line-up and helped Duke start the season 9–1, which included a seven-game win streak, before falling to Utah in overtime. During a five-game stretch in December, Ingram averaged 21.2 points and 8.8 rebounds while filling in at power forward for injured Amile Jefferson. After recording 24 points and 6 rebounds in a win over Indiana in the ACC-Big Ten Challenge on December 2, Ingram scored 23 points to lead Duke over Buffalo. For his efforts, he received his first ACC Rookie of the Week honor. On December 12, 2015, Ingram scored a career-high 26 points and grabbed 14 rebounds in a home win over Georgia Southern, and blocked a career-high 6 shots in a home win over Virginia Tech in January 2016. That same month, he scored 25 points and had 9 rebounds in a win at Boston College in his ACC debut. After being voted National Freshman of the Week and ACC Rookie of the Week twice in the month of January, Ingram helped Duke break a three-game losing streak by scoring 25 points to go with 7 rebounds against NC State. In February 2016, he was voted ACC Rookie of the Week for the fourth time after averaging a team-high 21.5 points and added 8.5 rebounds and 2.5 assists on the week as Duke defeated number thirteen Louisville and number seven Virginia to extend its winning streak to four games. That same month, Ingram was named to the 35-man midseason watchlist for the Naismith College Player of the Year award. In a road game against the number fifth seed and rival North Carolina, Ingram scored 20 points and grabbed 10 rebounds to give Duke a one-point win over the Tar Heels on February 17. As the fifth seed in the ACC tournament, Duke beat NC State in the second round but lost to Notre Dame in the quarterfinals. In the 2016 NCAA tournament, Duke was awarded a fourth seed and won their first-round match-up against UNC Wilmington. After beating Yale in the second round, Duke was defeated in the Sweet 16 by Oregon despite 24 points from Ingram. In 36 games for Duke in 2015–16, Ingram averaged 17.3 points, 6.8 rebounds, and 2.0 assists in 34.6 minutes per game, while shooting 44.2% from the field, 41.0% from three-point range and 68.2% from the free throw line. He finished the tournament averaging 23.0 points to go along with 6.3 rebounds and 2.7 assists in the three games. He subsequently earned ACC Rookie of the Year honors and AP All-American honorable mention. Ingram had one of the best seasons ever for a young player at Duke, ranking in the top 3 among the school\'s all-time freshman leaders in scoring (third), three-pointers (second) and 20-point games (tied for second). On April 4, 2016, Ingram declared for the 2016 NBA draft, forgoing his final three years of college eligibility. = On June 23, 2016, Ingram was selected with the second overall pick in the 2016 NBA draft by the Los Angeles Lakers. Being only 18 years old at the time, he was the second-youngest player drafted in 2016. On August 23, 2016, he signed his rookie-scale contract with the Lakers. He made his debut for the Lakers in their season opener on October 26, 2016, scoring nine points off the bench in a 120–114 win over the Houston Rockets. On November 23, in his first career start, Ingram scored a then career-high 16 points in a 149–106 loss to the Golden State Warriors. He topped that mark on December 2, scoring 17 points in a 113–80 loss to the Toronto Raptors. On December 17, he had nine points, 10 rebounds and nine assists, finishing just an assist and a point shy of becoming the youngest player in NBA history to record a triple-double in Los Angeles\' 119–108 loss to the Cleveland Cavaliers. On January 6, 2017, he had his second 17-point game of the season in a 127–100 win over the Miami Heat. Two days later, he had another 17-point effort in a 111–95 win over the Orlando Magic. During the NBA All-Star Weekend, he participated in the Rising Stars Challenge along with teammate D\'Angelo Russell. He hit the 20-point mark for the first time in his career on February 26, scoring 22 points in a 119–98 loss to the San Antonio Spurs. At the season\'s end, he was named to the NBA All-Rookie Second Team. During his only game in Summer League, Ingram scored 26 points in the first game and according to the Los Angeles Times, ""had a fabulous debut this summer [...] and outclassed all the other players on the court."" On October 20, 2017, he scored a then career-high 25 points in a 132–130 win over the Phoenix Suns. On November 15, 2017, he scored 26 points to go with a career-best 11 rebounds in a 115–109 loss to the Philadelphia 76ers. On November 29, he scored a career-high 32 points in a 127–123 overtime loss to the Golden State Warriors. On December 7, he scored 21 points, including the game-winning 3-pointer with 0.8 seconds remaining, leading the Lakers to a 107–104 victory over the 76ers to end a five-game losing streak. On January 5, 2018, he had 22 points and a career-high 14 rebounds in a 108–94 loss to the Charlotte Hornets. For the second year, he participated in the Rising Stars Challenge during NBA All-Star Weekend for Team USA. On March 1, Ingram suffered a groin strain that would cause him to miss 12 straight games. He returned on March 30 against the Milwaukee Bucks but suffered a neck muscle contusion during the game and was placed in the NBA\'s concussion protocol, causing him to miss the rest of the season. Ingram received a four-game suspension early in the 2018–19 season for his involvement in an on-court fight against the Houston Rockets on October 20. He missed seven games in December with a sprained left ankle. On January 17, 2019, he had a career-high 11 assists in a 138–128 overtime win over the Oklahoma City Thunder. On January 29, he scored a career-high 36 points in a 121–105 loss to the Philadelphia 76ers. On March 9, Ingram was ruled out for the remainder of the season due to a deep vein thrombosis in his arm. = On July 6, 2019, the Lakers traded Ingram, Lonzo Ball, Josh Hart, the draft rights to De\'Andre Hunter, two first-round picks, a first-round pick swap and cash to the New Orleans Pelicans for All-Star Anthony Davis. On November 4, 2019, Ingram recorded a then career high by scoring 40 points in a loss against the Brooklyn Nets.', ""Kyle Brandon O'Quinn (born March 26, 1990) is an American former professional basketball player. He played for the Norfolk State Spartans, and led them to a victory over the #2 seed Missouri Tigers in the second round of the 2012 NCAA Men's Division I Basketball Tournament. He was drafted in the second round of the 2012 NBA draft with the 49th overall pick, by the Orlando Magic. O'Quinn was born in Queens, New York, and grew up in South Jamaica, Queens."", ""= In September 1997, Cleveland traded Brandon to the Milwaukee Bucks. In the trade, Cleveland also sent Tyrone Hill and a top 10 protected draft pick to the Bucks; Milwaukee sent Sherman Douglas to Cleveland and Vin Baker to the Seattle SuperSonics, who dealt Shawn Kemp to Cleveland. Though Cleveland was not looking to trade Brandon, the team felt they could not pass over the opportunity to trade for a superstar of Kemp's caliber. On December 7, 1997, Brandon scored 20 points, recorded 13 assists, and grabbed seven rebounds in a 97–91 win over the SuperSonics. On January 5, 1998, Brandon again helped lead the Bucks to a victory, scoring 16 points and recording 15 assists in a 98–92 win against the Portland Trail Blazers. Despite success on the court, injuries limited him to just 50 games in his first season with the Bucks, and Milwaukee struggled without him playing. Brandon was among the league leaders in steals and led the team in assists during his two-year stint with the Bucks. Though he expressed interest in playing in Milwaukee long-term with Ray Allen, the Bucks feared they would be unable to re-sign Brandon or continue to lose his playing time to injuries and did not want to risk losing him without return. = On March 12, 1999, after just 15 games in his second Milwaukee season, Brandon was traded to Minnesota in a three-team, nine player trade that sent Sam Cassell to Milwaukee and Stephon Marbury to the New Jersey Nets. Paired with Kevin Garnett, Brandon helped lead Minnesota to their first 50-win season in 1999–2000 with averages of 17 points, 9 assists and 2 steals per game. However, he was often plagued by injuries and on February 13, 2002, he was placed on the injury list by the Timberwolves, from which he did not return. It was during his stint with the Timberwolves that Brandon would get to team up with and mentor Chauncey Billups. On July 23, 2003, Brandon was traded to the Atlanta Hawks for salary cap purposes. He was waived by the Hawks on February 19, 2004, two years and 13 days after his last game, and he subsequently announced his retirement. Brandon finished his career averaging 13.8 points, three rebounds, 6.1 assists and 1.6 steals per game, and came within six points of scoring 10,000 in his career. His career-high for assists registered in a game was 16, which he accomplished five times.""]",I don't know.,...,,0.0,0.0,,0.19754451043759488,0.7901780417503795
"What were Greg Brown III's shooting percentages from the field, 3-point range, and free throw line in the mentioned season?","['He shot - from the field, - from 3-point range, and - from the free throw line, playing an average of 3.0 minutes per game.', ""Brown drew the attention of major college basketball programs before high school. In his freshman year, he emerged as one of the best players in the 2020 class and held basketball offers from several schools, including Kansas and Texas. By the end of his high school career, Brown was a consensus five-star recruit and a top-10 player in the 2020 class, according to major recruiting services. He trimmed his offers to Auburn, Kentucky, Memphis, Michigan or Texas, or opt to instead play professionally. On April 24, 2020, he announced his commitment to Texas over Auburn, Memphis, Michigan, Kentucky and a $300,000 offer from the G League. In his college debut on November 25, 2020, Brown recorded 11 points and 10 rebounds in a 91–55 win against Texas–Rio Grande Valley. On December 20, he posted a career-high 24 points, 14 rebounds and three blocks in a 77–74 win over Oklahoma State. As a freshman, Brown averaged 9.3 points and 6.2 rebounds per game. He earned All-Big 12 honorable mention and was an All-Freshman Team and All-Newcomer Team selection. On May 13, 2021, Brown declared for the 2021 NBA draft, forgoing his remaining college eligibility. = Brown was selected in the second round of the 2021 NBA draft with the 43rd pick by the New Orleans Pelicans. He was then traded to the Portland Trail Blazers for a future second-round draft pick and cash considerations. Brown joined the Trail Blazers for the 2021 NBA Summer League. On August 12, 2021, he signed a 3-year, $4.3 million rookie scale contract with the Trail Blazers. On October 23, Brown made his NBA debut, logging four points and three rebounds in a 134–105 blowout win over the Phoenix Suns. On February 8, 2022, he scored a season-high 15 points, along with eight rebounds, in a 95–113 loss to the Orlando Magic. On March 23, in a 96–133 blowout loss to the San Antonio Spurs, Brown grabbed a season-high 14 rebounds, along with seven points and two blocks. On February 9, 2023, Brown was waived by the Blazers. = On March 2, 2023, Brown was acquired by the Ontario Clippers. = On August 14, 2023, Brown signed with the Dallas Mavericks and on October 21, his deal was converted into a two-way contract. Brown reached the NBA Finals where the Mavericks lost to the Boston Celtics in five games. = On October 28, 2024, Brown joined the Mexico City Capitanes. = On April 2, 2025, Brown signed with the Calgary Surge of the Canadian Elite Basketball League. = = Brown's father, Greg Brown II, played college football as a safety for Texas before playing in the NFL Europe and the practice squad of the Denver Broncos of the National Football League. Brown's uncle, Roderick Anderson, played college basketball as a point guard for Texas before playing professionally overseas. Texas Longhorns bio USA Basketball bio\n\nIn the 2021–22 season, Greg Brown III played for Portland in 48 games. He averaged 4.7 points, 2.8 rebounds, 0.7 assists, 0.5 steals, and 0.5 blocks per game. He shot 0.426 from the field, 0.311 from 3-point range, and 0.677 from the free throw line, playing an average of 13.3 minutes per game. In the 2022–23 season, Greg Brown III played for Portland in 16 games. He averaged 1.8 points, 1.2 rebounds, 0.2 assists, 0.3 steals, and 0.3 blocks per game. He shot 0.393 from the field, 0.143 from 3-point range, and 0.417 from the free throw line, playing an average of 5.8 minutes per game. In the 2023–24 season, Greg Brown III played for Dallas in 6 games. He averaged 2.5 points, 1.5 rebounds, 0.7 assists, 0.0 steals, and 0.7 blocks per game. He shot 0.455 from the field, 0.333 from 3-point range, and 0.444 from the free throw line, playing an average of 6.6 minutes per game. In the 2020–21 season, Greg Brown III played for Texas in 26 games. He averaged 9.3 points, 6.2 rebounds, 0.4 assists, 0.6 steals, and 1.0 blocks per game."", 'He shot — from the field, — from 3-point range, and — from the free throw line, playing an average of 3.0 minutes per game.', 'He serves as an advance scout for the Dallas Mavericks. = Source Regular season Playoffs = Career stats Media related to Greg Dreiling at Wikimedia Commons\n\nIn the 1986–87 season, Greg Dreiling played for Indiana in 24 games. He averaged 1.8 points, 1.8 rebounds, 0.3 assists, 0.1 steals, and 0.1 blocks per game. He shot 0.432 from the field, – from 3-point range, and 0.833 from the free throw line, playing an average of 5.3 minutes per game. In the 1987–88 season, Greg Dreiling played for Indiana in 20 games. He averaged 1.7 points, 0.9 rebounds, 0.3 assists, 0.1 steals, and 0.2 blocks per game. He shot 0.471 from the field, – from 3-point range, and 0.692 from the free throw line, playing an average of 3.7 minutes per game. In the 1988–89 season, Greg Dreiling played for Indiana in 53 games. He averaged 2.4 points, 1.7 rebounds, 0.3 assists, 0.1 steals, and 0.2 blocks per game. He shot 0.558 from the field, – from 3-point range, and 0.672 from the free throw line, playing an average of 7.5 minutes per game. In the 1989–90 season, Greg Dreiling played for Indiana in 49 games. He averaged 1.3 points, 1.8 rebounds, 0.2 assists, 0.1 steals, and 0.3 blocks per game. He shot 0.377 from the field, – from 3-point range, and 0.735 from the free throw line, playing an average of 6.3 minutes per game. In the 1990–91 season, Greg Dreiling played for Indiana in 73 games. He averaged 3.5 points, 3.5 rebounds, 0.7 assists, 0.3 steals, and 0.4 blocks per game. He shot 0.505 from the field, .000 from 3-point range, and 0.6 from the free throw line, playing an average of 14.1 minutes per game. In the 1991–92 season, Greg Dreiling played for Indiana in 60 games. He averaged 2.0 points, 1.6 rebounds, 0.4 assists, 0.2 steals, and 0.3 blocks per game. He shot 0.494 from the field, 1.000 from 3-point range, and 0.75 from the free throw line, playing an average of 8.5 minutes per game. In the 1992–93 season, Greg Dreiling played for Indiana in 43 games. He averaged 1.1 points, 1.5 rebounds, 0.2 assists, 0.1 steals, and 0.2 blocks per game. He shot 0.328 from the field, .000 from 3-point range, and 0.533 from the free throw line, playing an average of 5.6 minutes per game. In the 1993–94 season, Greg Dreiling played for Dallas in 54 games. He averaged 2.4 points, 3.1 rebounds, 0.6 assists, 0.3 steals, and 0.4 blocks per game. He shot 0.5 from the field, 1.000 from 3-point range, and 0.711 from the free throw line, playing an average of 12.7 minutes per game. In the 1994–95 season, Greg Dreiling played for Cleveland in 58 games. He averaged 1.9 points, 2.0 rebounds, 0.4 assists, 0.1 steals, and 0.4 blocks per game. He shot 0.412 from the field, – from 3-point range, and 0.634 from the free throw line, playing an average of 8.3 minutes per game. In the 1996–97 season, Greg Dreiling played for Dallas in 40 games. He averaged 2.0 points, 1.9 rebounds, 0.3 assists, 0.2 steals, and 0.2 blocks per game. He shot 0.459 from the field, 1.000 from 3-point range, and 0.407 from the free throw line, playing an average of 9.7 minutes per game. In the 1991 season, Greg Dreiling played for Indiana in 5 games. He averaged 2.8 points, 3.6 rebounds, 0.0 assists, 0.0 steals, and 0.0 blocks per game. He shot .333 from the field, – from 3-point range, and .667 from the free throw line, playing an average of 15.0 minutes per game. In the 1992 season, Greg Dreiling played for Indiana in 1 games. He averaged 0.0 points, 0.0 rebounds, 0.0 assists, 0.0 steals, and 0.0 blocks per game. He shot – from the field, – from 3-point range, and – from the free throw line, playing an average of 3.0 minutes per game. In the 1993 season, Greg Dreiling played for Indiana in 2 games. He averaged 1.5 points, 0.5 rebounds, 0.0 assists, 0.0 steals, and 0.0 blocks per game. He shot 1.000 from the field, 1.000 from 3-point range, and – from the free throw line, playing an average of 2.0 minutes per game. In the 1995 season, Greg Dreiling played for Cleveland in 1 games. He averaged 0.0 points, 1.0 rebounds, 0.0 assists, 0.0 steals, and 0.0 blocks per game. He shot .000 from the field, – from 3-point range, and – from the free throw line, playing an average of 7.0 minutes per game. In the 1981–82 season, Greg Dreiling played for Wichita State in 29 games. He averaged 8.1 points, 4.2 rebounds, 0.6 assists, 0.3 steals, and 1.2 blocks per game. He shot 0.543 from the field, nan from 3-point range, and 0.753 from the free throw line, playing an average of 18.4 minutes per game. In the 1983–84 season, Greg Dreiling played for Kansas in 32 games. He averaged 9.7 points, 4.8 rebounds, 0.9 assists, 0.4 steals, and 1.2 blocks per game. He shot 0.531 from the field, nan from 3-point range, and 0.742 from the free throw line, playing an average of 23.2 minutes per game. In the 1984–85 season, Greg Dreiling played for Kansas in 34 games. He averaged 13.1 points, 6.9 rebounds, 1.2 assists, 0.4 steals, and 1.6 blocks per game. He shot 0.577 from the field, nan from 3-point range, and 0.727 from the free throw line, playing an average of 29.0 minutes per game. In the 1985–86 season, Greg Dreiling played for Kansas in 39 games. He averaged 11.6 points, 6.7 rebounds, 1.5 assists, 0.3 steals, and 1.2 blocks per game. He shot 0.6 from the field, nan from 3-point range, and 0.711 from the free throw line, playing an average of 26.4 minutes per game. In the Career[4] season, Greg Dreiling played for Career[4] in 134 games. He averaged 10.8 points, 5.8 rebounds, 1.1 assists, 0.4 steals, and 1.3 blocks per game. He shot 0.568 from the field, nan from 3-point range, and 0.731 from the free throw line, playing an average of 24.6 minutes per game.', 'He shot 0.493 from the field, — from 3-point range, and 0.739 from the free throw line, playing an average of 22.8 minutes per game. In the 2008† season, P.J. Brown played for Boston in 25 games. He averaged 2.9 points, 2.4 rebounds, 0.5 assists, 0.2 steals, and 0.4 blocks per game. He shot 0.464 from the field, .000 from 3-point range, and 0.84 from the free throw line, playing an average of 13.6 minutes per game.', 'He shot 0.501 from the field, .200 from 3-point range, and .604 from the free throw line, playing an average of 24.2 minutes per game. In the 1988–89 season, Greg Anderson played for San Antonio in 82 games. He averaged 13.7 points, 8.2 rebounds, 0.7 assists, 1.2 steals, and 1.3 blocks per game. He shot 0.503 from the field, .000 from 3-point range, and .514 from the free throw line, playing an average of 29.3 minutes per game. In the 1989–90 season, Greg Anderson played for Milwaukee in 60 games. He averaged 8.8 points, 6.2 rebounds, 0.4 assists, 0.5 steals, and 0.9 blocks per game. He shot 0.507 from the field, – from 3-point range, and .535 from the free throw line, playing an average of 21.5 minutes per game. In the 1990–91 season, Greg Anderson played for Milwaukee in 26 games. He averaged 2.7 points, 2.9 rebounds, 0.1 assists, 0.3 steals, and 0.3 blocks per game. He shot 0.37 from the field, .000 from 3-point range, and .571 from the free throw line, playing an average of 9.5 minutes per game. In the 1990–91 season, Greg Anderson played for New Jersey in 1 games. He averaged 8.0 points, 6.0 rebounds, 1.0 assists, 2.0 steals, and 0.0 blocks per game. He shot 1.0 from the field, – from 3-point range, and – from the free throw line, playing an average of 18.0 minutes per game. In the 1990–91 season, Greg Anderson played for Denver in 41 games. He averaged 5.2 points, 5.8 rebounds, 0.3 assists, 0.6 steals, and 0.9 blocks per game. He shot 0.44 from the field, – from 3-point range, and .506 from the free throw line, playing an average of 16.1 minutes per game. In the 1991–92 season, Greg Anderson played for Denver in 82 games. He averaged 11.5 points, 11.5 rebounds, 1.0 assists, 1.1 steals, and 0.8 blocks per game. He shot 0.456 from the field, .000 from 3-point range, and .623 from the free throw line, playing an average of 34.1 minutes per game. In the 1993–94 season, Greg Anderson played for Detroit in 77 games. He averaged 6.4 points, 7.4 rebounds, 0.7 assists, 0.7 steals, and 0.9 blocks per game. He shot 0.543 from the field, .333 from 3-point range, and .571 from the free throw line, playing an average of 21.1 minutes per game. In the 1994–95 season, Greg Anderson played for Atlanta in 51 games. He averaged 2.9 points, 3.7 rebounds, 0.3 assists, 0.5 steals, and 0.6 blocks per game. He shot 0.548 from the field, – from 3-point range, and .479 from the free throw line, playing an average of 12.2 minutes per game. In the 1995–96 season, Greg Anderson played for San Antonio in 46 games. He averaged 1.2 points, 2.2 rebounds, 0.2 assists, 0.2 steals, and 0.5 blocks per game. He shot 0.511 from the field, .000 from 3-point range, and .240 from the free throw line, playing an average of 7.5 minutes per game. In the 1996–97 season, Greg Anderson played for San Antonio in 82 games. He averaged 3.9 points, 5.5 rebounds, 0.4 assists, 0.8 steals, and 0.8 blocks per game. He shot 0.496 from the field, .000 from 3-point range, and .667 from the free throw line, playing an average of 20.2 minutes per game. In the 1997–98 season, Greg Anderson played for Atlanta in 50 games. He averaged 1.8 points, 2.4 rebounds, 0.3 assists, 0.4 steals, and 0.2 blocks per game. He shot 0.444 from the field, .000 from 3-point range, and .390 from the free throw line, playing an average of 8.0 minutes per game. In the 1988 season, Greg Anderson played for San Antonio in 3 games. He averaged 12.7 points, 7.0 rebounds, 1.0 assists, 0.7 steals, and 1.3 blocks per game. He shot .472 from the field, – from 3-point range, and 0.444 from the free throw line, playing an average of 31.7 minutes per game. In the 1990 season, Greg Anderson played for Milwaukee in 4 games. He averaged 8.3 points, 6.0 rebounds, 0.0 assists, 0.3 steals, and 1.0 blocks per game. He shot .684 from the field, – from 3-point range, and 0.5 from the free throw line, playing an average of 25.3 minutes per game. In the 1995 season, Greg Anderson played for Atlanta in 3 games. He averaged 1.7 points, 4.3 rebounds, 0.7 assists, 0.7 steals, and 0.7 blocks per game. He shot .200 from the field, – from 3-point range, and 0.75 from the free throw line, playing an average of 13.0 minutes per game. In the 1996 season, Greg Anderson played for San Antonio in 6 games. He averaged 0.2 points, 1.5 rebounds, 0.0 assists, 0.3 steals, and 0.2 blocks per game. He shot .000 from the field, – from 3-point range, and 0.5 from the free throw line, playing an average of 5.7 minutes per game. In the 1998 season, Greg Anderson played for Atlanta in 1 games. He averaged 0.0 points, 2.0 rebounds, 0.0 assists, 0.0 steals, and 1.0 blocks per game.', 'He shot 0.513 from the field, 0.368 from 3-point range, and 0.686 from the free throw line, playing an average of 35.0 minutes per game.', 'He shot 0.46 from the field, .000 from 3-point range, and 0.689 from the free throw line, playing an average of 11.2 minutes per game. In the 1991–92 season, Greg Foster played for Washington in 49 games. He averaged 4.3 points, 3.0 rebounds, 0.7 assists, 0.1 steals, and 0.2 blocks per game. He shot 0.461 from the field, .000 from 3-point range, and 0.714 from the free throw line, playing an average of 11.2 minutes per game. In the 1992–93 season, Greg Foster played for Washington in 10 games. He averaged 2.4 points, 2.7 rebounds, 1.1 assists, 0.0 steals, and 0.5 blocks per game. He shot 0.44 from the field, – from 3-point range, and 0.667 from the free throw line, playing an average of 9.3 minutes per game. In the 1992–93 season, Greg Foster played for Atlanta in 33 games. He averaged 3.1 points, 1.7 rebounds, 0.3 assists, 0.1 steals, and 0.3 blocks per game. He shot 0.463 from the field, .000 from 3-point range, and 0.722 from the free throw line, playing an average of 6.2 minutes per game. In the 1993–94 season, Greg Foster played for Milwaukee in 3 games. He averaged 3.3 points, 1.0 rebounds, 0.0 assists, 0.0 steals, and 0.3 blocks per game. He shot 0.571 from the field, – from 3-point range, and 1.0 from the free throw line, playing an average of 6.3 minutes per game. In the 1994–95 season, Greg Foster played for Chicago in 17 games. He averaged 6.1 points, 3.2 rebounds, 0.9 assists, 0.1 steals, and 0.5 blocks per game. He shot 0.477 from the field, .– from 3-point range, and 0.71 from the free throw line, playing an average of 17.6 minutes per game. In the 1994–95 season, Greg Foster played for Minnesota in 61 games. He averaged 4.6 points, 3.4 rebounds, 0.4 assists, 0.2 steals, and 0.3 blocks per game. He shot 0.47 from the field, .304 from 3-point range, and 0.7 from the free throw line, playing an average of 13.9 minutes per game. In the 1995–96 season, Greg Foster played for Utah in 73 games. He averaged 3.8 points, 2.4 rebounds, 0.3 assists, 0.1 steals, and 0.3 blocks per game. He shot 0.439 from the field, .125 from 3-point range, and 0.847 from the free throw line, playing an average of 11.0 minutes per game. In the 1996–97 season, Greg Foster played for Utah in 79 games. He averaged 3.5 points, 2.4 rebounds, 0.4 assists, 0.1 steals, and 0.3 blocks per game. He shot 0.453 from the field, .667 from 3-point range, and 0.831 from the free throw line, playing an average of 11.6 minutes per game. In the 1997–98 season, Greg Foster played for Utah in 78 games. He averaged 5.7 points, 3.5 rebounds, 0.7 assists, 0.2 steals, and 0.4 blocks per game. He shot 0.445 from the field, .222 from 3-point range, and 0.77 from the free throw line, playing an average of 18.5 minutes per game. In the 1998–99 season, Greg Foster played for Utah in 42 games. He averaged 2.8 points, 2.0 rebounds, 0.6 assists, 0.1 steals, and 0.2 blocks per game. He shot 0.377 from the field, .250 from 3-point range, and 0.619 from the free throw line, playing an average of 10.9 minutes per game. In the 1999–00 season, Greg Foster played for Seattle in 60 games. He averaged 3.4 points, 1.8 rebounds, 0.7 assists, 0.2 steals, and 0.3 blocks per game. He shot 0.406 from the field, .200 from 3-point range, and 0.643 from the free throw line, playing an average of 12.0 minutes per game. In the 2000–01† season, Greg Foster played for L.A. Lakers in 62 games.', 'He shot 0.513 from the field, 0.396 from 3-point range, and 0.809 from the free throw line, playing an average of 34.8 minutes per game.', ""Ostertag is also a licensed Realtor with Century 21 Harvey Properties. = Source Regular season Playoffs List of National Basketball Association career playoff blocks leaders List of National Basketball Association players with 10 or more blocks in a game Career statistics from NBA.com · Basketball Reference Ostertag's NBA Draft History Page Official website\n\nIn the 1995–96 season, Greg Ostertag played for Utah in 57 games. He averaged 3.6 points, 3.1 rebounds, 0.1 assists, 0.1 steals, and 1.1 blocks per game. He shot 0.473 from the field, – from 3-point range, and 0.667 from the free throw line, playing an average of 11.6 minutes per game. In the 1996–97 season, Greg Ostertag played for Utah in 77 games. He averaged 7.3 points, 7.3 rebounds, 0.4 assists, 0.3 steals, and 2.0 blocks per game. He shot 0.515 from the field, .000 from 3-point range, and 0.678 from the free throw line, playing an average of 23.6 minutes per game. In the 1997–98 season, Greg Ostertag played for Utah in 63 games. He averaged 4.7 points, 5.9 rebounds, 0.4 assists, 0.4 steals, and 2.1 blocks per game. He shot 0.481 from the field, – from 3-point range, and 0.479 from the free throw line, playing an average of 20.4 minutes per game. In the 1998–99 season, Greg Ostertag played for Utah in 48 games. He averaged 5.7 points, 7.3 rebounds, 0.5 assists, 0.2 steals, and 2.7 blocks per game. He shot 0.476 from the field, – from 3-point range, and 0.62 from the free throw line, playing an average of 27.9 minutes per game. In the 1999–2000 season, Greg Ostertag played for Utah in 81 games. He averaged 4.5 points, 6.0 rebounds, 0.2 assists, 0.2 steals, and 2.1 blocks per game. He shot 0.464 from the field, .000 from 3-point range, and 0.636 from the free throw line, playing an average of 19.8 minutes per game. In the 2000–01 season, Greg Ostertag played for Utah in 81 games. He averaged 4.5 points, 5.1 rebounds, 0.3 assists, 0.3 steals, and 1.8 blocks per game. He shot 0.495 from the field, .500 from 3-point range, and 0.556 from the free throw line, playing an average of 18.4 minutes per game. In the 2001–02 season, Greg Ostertag played for Utah in 74 games. He averaged 3.3 points, 4.2 rebounds, 0.7 assists, 0.2 steals, and 1.5 blocks per game. He shot 0.453 from the field, – from 3-point range, and 0.485 from the free throw line, playing an average of 15.0 minutes per game. In the 2002–03 season, Greg Ostertag played for Utah in 81 games. He averaged 5.4 points, 6.2 rebounds, 0.7 assists, 0.2 steals, and 1.8 blocks per game. He shot 0.518 from the field, – from 3-point range, and 0.51 from the free throw line, playing an average of 23.8 minutes per game. In the 2003–04 season, Greg Ostertag played for Utah in 78 games. He averaged 6.8 points, 7.4 rebounds, 1.6 assists, 0.4 steals, and 1.8 blocks per game. He shot 0.476 from the field, .000 from 3-point range, and 0.579 from the free throw line, playing an average of 27.6 minutes per game. In the 2004–05 season, Greg Ostertag played for Sacramento in 56 games. He averaged 1.6 points, 3.0 rebounds, 0.7 assists, 0.1 steals, and 0.7 blocks per game. He shot 0.44 from the field, .000 from 3-point range, and 0.342 from the free throw line, playing an average of 9.9 minutes per game. In the 2005–06 season, Greg Ostertag played for Utah in 60 games. He averaged 2.4 points, 3.8 rebounds, 1.0 assists, 0.1 steals, and 1.1 blocks per game. He shot 0.492 from the field, – from 3-point range, and 0.5 from the free throw line, playing an average of 13.5 minutes per game. In the 1996 season, Greg Ostertag played for Utah in 15 games. He averaged 3.5 points, 3.3 rebounds, 0.1 assists, 0.1 steals, and 1.4 blocks per game. He shot 0.444 from the field, – from 3-point range, and .619 from the free throw line, playing an average of 14.1 minutes per game. In the 1997 season, Greg Ostertag played for Utah in 20* games. He averaged 4.7 points, 6.9 rebounds, 0.3 assists, 0.5 steals, and 2.4 blocks per game. He shot 0.41 from the field, – from 3-point range, and .743 from the free throw line, playing an average of 20.3 minutes per game. In the 1998 season, Greg Ostertag played for Utah in 19 games. He averaged 3.4 points, 4.3 rebounds, 0.3 assists, 0.4 steals, and 1.9 blocks per game. He shot 0.565 from the field, – from 3-point range, and .480 from the free throw line, playing an average of 17.7 minutes per game. In the 1999 season, Greg Ostertag played for Utah in 11 games. He averaged 4.0 points, 5.9 rebounds, 0.5 assists, 0.2 steals, and 2.2 blocks per game. He shot 0.371 from the field, – from 3-point range, and .643 from the free throw line, playing an average of 23.7 minutes per game. In the 2000 season, Greg Ostertag played for Utah in 8 games. He averaged 3.8 points, 5.6 rebounds, 0.3 assists, 0.3 steals, and 2.1 blocks per game. He shot 0.526 from the field, – from 3-point range, and .455 from the free throw line, playing an average of 21.5 minutes per game. In the 2001 season, Greg Ostertag played for Utah in 5 games. He averaged 1.6 points, 3.6 rebounds, 0.2 assists, 0.0 steals, and 0.4 blocks per game. He shot 0.364 from the field, – from 3-point range, and .000 from the free throw line, playing an average of 12.8 minutes per game. In the 2002 season, Greg Ostertag played for Utah in 4 games. He averaged 6.8 points, 8.5 rebounds, 0.5 assists, 0.5 steals, and 1.8 blocks per game. He shot 0.619 from the field, – from 3-point range, and .100 from the free throw line, playing an average of 21.8 minutes per game. In the 2003 season, Greg Ostertag played for Utah in 5 games. He averaged 9.2 points, 8.6 rebounds, 1.6 assists, 0.6 steals, and 1.8 blocks per game. He shot 0.444 from the field, – from 3-point range, and .737 from the free throw line, playing an average of 30.2 minutes per game. In the 2004 season, Greg Ostertag played for Sacramento in 2 games. He averaged 3.0 points, 4.5 rebounds, 0.0 assists, 0.5 steals, and 1.0 blocks per game."", 'He shot 0.603 from the field, 0.28 from 3-point range, and 0.678 from the free throw line, playing an average of 30.2 minutes per game.', 'Clippers in 58 games. He averaged 1.9 points, 3.3 rebounds, 0.5 assists, 0.4 steals, and 0.8 blocks per game. He shot 0.405 from the field, – from 3-point range, and .452 from the free throw line, playing an average of 12.6 minutes per game. In the 1988–89 season, Greg Kite played for Charlotte in 12 games. He averaged 3.2 points, 4.4 rebounds, 0.6 assists, 0.3 steals, and 0.7 blocks per game. He shot 0.533 from the field, – from 3-point range, and .600 from the free throw line, playing an average of 17.8 minutes per game. In the 1989–90 season, Greg Kite played for Sacramento in 71 games. He averaged 3.2 points, 5.3 rebounds, 1.1 assists, 0.4 steals, and 0.7 blocks per game. He shot 0.432 from the field, 1.000 from 3-point range, and .500 from the free throw line, playing an average of 21.3 minutes per game. In the 1990–91 season, Greg Kite played for Orlando in 82* games. He averaged 4.8 points, 7.2 rebounds, 0.7 assists, 0.3 steals, and 1.0 blocks per game. He shot 0.491 from the field, – from 3-point range, and .512 from the free throw line, playing an average of 27.1 minutes per game. In the 1991–92 season, Greg Kite played for Orlando in 72 games. He averaged 3.2 points, 5.6 rebounds, 0.6 assists, 0.4 steals, and 0.8 blocks per game. He shot 0.437 from the field, .000 from 3-point range, and .588 from the free throw line, playing an average of 20.5 minutes per game. In the 1992–93 season, Greg Kite played for Orlando in 64 games. He averaged 1.4 points, 3.0 rebounds, 0.2 assists, 0.2 steals, and 0.2 blocks per game. He shot 0.452 from the field, .000 from 3-point range, and .542 from the free throw line, playing an average of 10.0 minutes per game. In the 1993–94 season, Greg Kite played for Orlando in 29 games. He averaged 1.2 points, 2.4 rebounds, 0.1 assists, 0.1 steals, and 0.4 blocks per game. He shot 0.371 from the field, – from 3-point range, and .364 from the free throw line, playing an average of 10.7 minutes per game. In the 1994–95 season, Greg Kite played for New York in 2 games. He averaged 0.0 points, 2.0 rebounds, 0.0 assists, 0.0 steals, and 0.0 blocks per game. He shot 0.0 from the field, – from 3-point range, and – from the free throw line, playing an average of 8.0 minutes per game. In the 1994–95 season, Greg Kite played for Indiana in 9 games. He averaged 0.9 points, 2.0 rebounds, 0.1 assists, 0.0 steals, and 0.0 blocks per game. He shot 0.214 from the field, – from 3-point range, and .200 from the free throw line, playing an average of 6.8 minutes per game. In the 1984† season, Greg Kite played for Boston in 11 games. He averaged 0.6 points, 0.8 rebounds, 0.3 assists, 0.0 steals, and 0.1 blocks per game. He shot 0.125 from the field, – from 3-point range, and 0.833 from the free throw line, playing an average of 3.5 minutes per game. In the 1985 season, Greg Kite played for Boston in 9 games. He averaged 1.2 points, 1.8 rebounds, 0.3 assists, 0.1 steals, and 0.0 blocks per game. He shot 0.417 from the field, – from 3-point range, and 0.5 from the free throw line, playing an average of 7.0 minutes per game. In the 1986† season, Greg Kite played for Boston in 13 games. He averaged 1.4 points, 1.5 rebounds, 0.2 assists, 0.2 steals, and 0.3 blocks per game. He shot 0.7 from the field, – from 3-point range, and 0.571 from the free throw line, playing an average of 6.0 minutes per game. In the 1987 season, Greg Kite played for Boston in 20 games. He averaged 0.9 points, 2.3 rebounds, 0.4 assists, 0.1 steals, and 0.4 blocks per game. He shot 0.35 from the field, – from 3-point range, and 0.429 from the free throw line, playing an average of 8.6 minutes per game. In the 1995 season, Greg Kite played for Indiana in 8 games. He averaged 0.5 points, 0.9 rebounds, 0.0 assists, 0.1 steals, and 0.0 blocks per game.', 'He shot 0.513 from the field, 0.306 from 3-point range, and 0.673 from the free throw line, playing an average of 34.9 minutes per game.', 'He shot 0.421 from the field, .333 from 3-point range, and 0.714 from the free throw line, playing an average of 7.3 minutes per game. In the 2001–02 season, Greg Foster played for Milwaukee in 6 games. He averaged 1.2 points, 1.3 rebounds, 0.2 assists, 0.0 steals, and 0.0 blocks per game. He shot 0.222 from the field, .000 from 3-point range, and 0.75 from the free throw line, playing an average of 4.0 minutes per game. In the 2002–03 season, Greg Foster played for Toronto in 29 games. He averaged 4.2 points, 3.5 rebounds, 0.4 assists, 0.0 steals, and 0.3 blocks per game. He shot 0.385 from the field, .250 from 3-point range, and 0.813 from the free throw line, playing an average of 18.6 minutes per game. In the 1993 season, Greg Foster played for Atlanta in 1 games. He averaged 5.0 points, 1.0 rebounds, 0.0 assists, 0.0 steals, and 0.0 blocks per game. He shot .333 from the field, – from 3-point range, and .750 from the free throw line, playing an average of 5.0 minutes per game. In the 1995 season, Greg Foster played for Utah in 12 games. He averaged 2.3 points, 1.0 rebounds, 0.2 assists, 0.1 steals, and 0.2 blocks per game. He shot .500 from the field, – from 3-point range, and .600 from the free throw line, playing an average of 6.3 minutes per game. In the 1996 season, Greg Foster played for Utah in 20* games. He averaged 4.2 points, 2.8 rebounds, 0.6 assists, 0.2 steals, and 0.4 blocks per game. He shot .389 from the field, .250 from 3-point range, and .867 from the free throw line, playing an average of 15.5 minutes per game. In the 1997 season, Greg Foster played for Utah in 20 games. He averaged 4.1 points, 3.4 rebounds, 0.3 assists, 0.1 steals, and 0.3 blocks per game. He shot .453 from the field, .500 from 3-point range, and .600 from the free throw line, playing an average of 16.8 minutes per game. In the 1998 season, Greg Foster played for Utah in 8 games. He averaged 2.0 points, 1.0 rebounds, 0.1 assists, 0.1 steals, and 0.0 blocks per game. He shot .421 from the field, – from 3-point range, and – from the free throw line, playing an average of 8.8 minutes per game. In the 1999 season, Greg Foster played for Seattle in 5 games. He averaged 3.6 points, 2.2 rebounds, 0.2 assists, 0.0 steals, and 0.2 blocks per game. He shot .368 from the field, .400 from 3-point range, and 1.000 from the free throw line, playing an average of 13.6 minutes per game. In the 2000–01† season, Greg Foster played for L.A. Lakers in 1 games.', 'He shot .585 from the field, .387 from 3-point range, and .837 from the free throw line, playing an average of 27.0 minutes per game.', ""In 2012, Anthony publicly endorsed Republican presidential candidate Mitt Romney, appearing in a Romney ad in Nevada. = On January 16, 2015, Anthony was arrested in Washington, D.C., and charged with soliciting a prostitute. Following his arrest, Anthony was indefinitely suspended by CBS and Turner Sports. On February 11, Anthony reached a deferred prosecution agreement in which the charge would be dropped provided he completed 32 hours of community service and stayed out of trouble for four months. In March 2016, Anthony was dropped by CBS, but returned to Turner as a studio analyst for NBA TV, and as a fill-in analyst for the NBA on TNT during the regular season and the playoffs. A list of Anthony's career statistics: = = List of NCAA Division I men's basketball career assists leaders List of NCAA Division I men's basketball career steals leaders Black conservatism in the United States Career statistics from NBA.com · Basketball Reference ESPN.com: Greg Anthony archive PRO BASKETBALL; Suns' Biggest Beef Is Over Anthony's 'Sucker Punch'\n\nIn the 1991–92 season, Greg Anthony played for New York in 82 games. He averaged 5.5 points, 1.7 rebounds, 3.8 assists, 0.7 steals, and 0.1 blocks per game. He shot 0.37 from the field, 0.145 from 3-point range, and 0.741 from the free throw line, playing an average of 18.4 minutes per game. In the 1992–93 season, Greg Anthony played for New York in 70 games. He averaged 6.6 points, 2.4 rebounds, 5.7 assists, 1.6 steals, and 0.2 blocks per game. He shot 0.415 from the field, 0.133 from 3-point range, and 0.673 from the free throw line, playing an average of 24.3 minutes per game. In the 1993–94 season, Greg Anthony played for New York in 80 games. He averaged 7.9 points, 2.4 rebounds, 4.6 assists, 1.4 steals, and 0.2 blocks per game. He shot 0.394 from the field, 0.3 from 3-point range, and 0.774 from the free throw line, playing an average of 24.9 minutes per game. In the 1994–95 season, Greg Anthony played for New York in 61 games. He averaged 6.1 points, 1.0 rebounds, 2.6 assists, 0.8 steals, and 0.1 blocks per game. He shot 0.437 from the field, 0.361 from 3-point range, and 0.789 from the free throw line, playing an average of 15.5 minutes per game. In the 1995–96 season, Greg Anthony played for Vancouver in 69 games. He averaged 14.0 points, 2.5 rebounds, 6.9 assists, 1.7 steals, and 0.2 blocks per game. He shot 0.415 from the field, 0.332 from 3-point range, and 0.771 from the free throw line, playing an average of 30.4 minutes per game. In the 1996–97 season, Greg Anthony played for Vancouver in 65 games. He averaged 9.5 points, 2.8 rebounds, 6.3 assists, 2.0 steals, and 0.1 blocks per game. He shot 0.393 from the field, 0.37 from 3-point range, and 0.73 from the free throw line, playing an average of 28.7 minutes per game. In the 1997–98 season, Greg Anthony played for Seattle in 80 games. He averaged 5.2 points, 1.4 rebounds, 2.6 assists, 0.8 steals, and 0.0 blocks per game. He shot 0.43 from the field, 0.415 from 3-point range, and 0.663 from the free throw line, playing an average of 12.8 minutes per game. In the 1998–99 season, Greg Anthony played for Portland in 50* games. He averaged 6.4 points, 1.3 rebounds, 2.0 assists, 1.3 steals, and 0.1 blocks per game. He shot 0.414 from the field, 0.392 from 3-point range, and 0.697 from the free throw line, playing an average of 16.1 minutes per game. In the 1999–00 season, Greg Anthony played for Portland in 82 games. He averaged 6.3 points, 1.6 rebounds, 2.5 assists, 0.7 steals, and 0.1 blocks per game. He shot 0.406 from the field, 0.378 from 3-point range, and 0.772 from the free throw line, playing an average of 18.9 minutes per game. In the 2000–01 season, Greg Anthony played for Portland in 58 games. He averaged 4.9 points, 1.1 rebounds, 1.4 assists, 0.7 steals, and 0.1 blocks per game. He shot 0.383 from the field, 0.409 from 3-point range, and 0.657 from the free throw line, playing an average of 14.8 minutes per game. In the 2001–02 season, Greg Anthony played for Chicago in 36 games. He averaged 8.4 points, 2.4 rebounds, 5.6 assists, 1.4 steals, and 0.1 blocks per game. He shot 0.394 from the field, 0.322 from 3-point range, and 0.671 from the free throw line, playing an average of 26.7 minutes per game. In the 2001–02 season, Greg Anthony played for Milwaukee in 24 games. He averaged 7.2 points, 1.8 rebounds, 3.3 assists, 1.2 steals, and 0.0 blocks per game. He shot 0.372 from the field, 0.26 from 3-point range, and 0.619 from the free throw line, playing an average of 23.0 minutes per game. In the 1992 season, Greg Anthony played for New York in 12 games. He averaged 5.3 points, 1.4 rebounds, 3.4 assists, 1.3 steals, and 0.1 blocks per game. He shot 0.413 from the field, 0.417 from 3-point range, and 0.606 from the free throw line, playing an average of 17.8 minutes per game. In the 1993 season, Greg Anthony played for New York in 15 games. He averaged 3.9 points, 2.0 rebounds, 3.5 assists, 0.9 steals, and 0.1 blocks per game. He shot 0.4 from the field, 0.214 from 3-point range, and 0.571 from the free throw line, playing an average of 16.0 minutes per game. In the 1994 season, Greg Anthony played for New York in 25 games. He averaged 4.9 points, 1.1 rebounds, 2.4 assists, 0.8 steals, and 0.3 blocks per game. He shot 0.352 from the field, 0.295 from 3-point range, and 0.583 from the free throw line, playing an average of 17.4 minutes per game. In the 1995 season, Greg Anthony played for New York in 11 games. He averaged 4.3 points, 0.9 rebounds, 1.4 assists, 0.2 steals, and 0.2 blocks per game. He shot 0.395 from the field, 0.304 from 3-point range, and 0.909 from the free throw line, playing an average of 12.3 minutes per game. In the 1998 season, Greg Anthony played for Seattle in 9 games. He averaged 3.6 points, 1.1 rebounds, 1.1 assists, 0.6 steals, and 0.1 blocks per game. He shot 0.3 from the field, 0.263 from 3-point range, and 0.375 from the free throw line, playing an average of 13.1 minutes per game. In the 1999 season, Greg Anthony played for Portland in 13 games. He averaged 5.2 points, 1.1 rebounds, 2.5 assists, 1.0 steals, and 0.1 blocks per game. He shot 0.327 from the field, 0.258 from 3-point range, and 0.676 from the free throw line, playing an average of 17.3 minutes per game. In the 2000 season, Greg Anthony played for Portland in 15 games. He averaged 4.0 points, 1.1 rebounds, 1.7 assists, 0.9 steals, and 0.3 blocks per game. He shot 0.365 from the field, 0.323 from 3-point range, and 0.75 from the free throw line, playing an average of 14.2 minutes per game. In the 2001 season, Greg Anthony played for Portland in 2 games. He averaged 2.5 points, 0.0 rebounds, 0.0 assists, 0.5 steals, and 0.0 blocks per game."", 'He shot 0.381 from the field, 0.269 from 3-point range, and 0.779 from the free throw line, playing an average of 29.5 minutes per game.', 'He has admitted to suffering from depression. Career statistics from NBA.com · Basketball Reference Wisconsin bio\n\nIn the 2004–05 season, Greg Stiemsma played for Wisconsin in 10 games. He averaged 1.1 points, 0.6 rebounds, 0.0 assists, 0.1 steals, and 0.2 blocks per game. He shot 0.833 from the field, 0.0 from 3-point range, and 0.5 from the free throw line, playing an average of 2.7 minutes per game. In the 2005–06 season, Greg Stiemsma played for Wisconsin in 16 games. He averaged 2.8 points, 2.8 rebounds, 0.9 assists, 0.4 steals, and 1.5 blocks per game. He shot 0.553 from the field, 0.0 from 3-point range, and 0.429 from the free throw line, playing an average of 11.7 minutes per game. In the 2006–07 season, Greg Stiemsma played for Wisconsin in 34 games. He averaged 2.2 points, 1.6 rebounds, 1.1 assists, 0.1 steals, and 0.9 blocks per game. He shot 0.5 from the field, 0.0 from 3-point range, and 0.808 from the free throw line, playing an average of 9.9 minutes per game. In the 2007–08 season, Greg Stiemsma played for Wisconsin in 35 games. He averaged 3.5 points, 3.1 rebounds, 0.7 assists, 0.4 steals, and 1.1 blocks per game. He shot 0.548 from the field, 0.0 from 3-point range, and 0.826 from the free throw line, playing an average of 11.5 minutes per game. In the 2011–12 season, Greg Stiemsma played for Boston in 55 games. He averaged 2.9 points, 3.2 rebounds, 0.5 assists, 0.7 steals, and 1.5 blocks per game. He shot 0.545 from the field, 0.0 from 3-point range, and 0.707 from the free throw line, playing an average of 13.9 minutes per game. In the 2012–13 season, Greg Stiemsma played for Minnesota in 76 games. He averaged 4.0 points, 3.4 rebounds, 0.4 assists, 0.6 steals, and 1.2 blocks per game. He shot 0.457 from the field, 0.0 from 3-point range, and 0.768 from the free throw line, playing an average of 15.9 minutes per game. In the 2013–14 season, Greg Stiemsma played for New Orleans in 55 games. He averaged 2.9 points, 4.1 rebounds, 0.7 assists, 0.6 steals, and 1.0 blocks per game. He shot 0.574 from the field, 0.0 from 3-point range, and 0.594 from the free throw line, playing an average of 18.3 minutes per game. In the 2014–15 season, Greg Stiemsma played for Toronto in 17 games. He averaged 0.8 points, 0.9 rebounds, 0.2 assists, 0.1 steals, and 0.0 blocks per game. He shot 0.75 from the field, 0.0 from 3-point range, and 0.5 from the free throw line, playing an average of 3.9 minutes per game. In the 2012 season, Greg Stiemsma played for Boston in 19 games. He averaged 1.5 points, 2.2 rebounds, 0.3 assists, 0.2 steals, and 0.6 blocks per game. He shot 0.667 from the field, 0.0 from 3-point range, and 0.667 from the free throw line, playing an average of 7.5 minutes per game.', 'He shot 0.387 from the field, 0.331 from 3-point range, and 0.86 from the free throw line, playing an average of 31.9 minutes per game.', 'Mayo, Marko Jarić, and Antoine Walker for Kevin Love, Mike Miller, Brian Cardinal, and Jason Collins. On July 9, 2009, Buckner was traded to the Dallas Mavericks as a part of the four-team deal among Grizzlies, Mavericks, Orlando Magic and Toronto Raptors. On July 29, 2011, he joined the Houston Rockets as a player development coach, serving for five seasons. Buckner reached the playoffs three times with the team as part of the coaching staff. He would later become an assistant coach with the Memphis Grizzlies, and in November 2020, became an assistant coach with the Cleveland Cavaliers. On April 21, 2021, Buckner got his first NBA head coaching victory when he temporarily replaced head coach J. B. Bickerstaff as the Cavaliers won 121–105 against the Chicago Bulls. On June 13, 2022, the Cavaliers promoted Buckner to associate head coach position. = = Career statistics from NBA.com · Basketball Reference\n\nIn the 1999–00 season, Greg Buckner played for Dallas in 48 games. He averaged 5.7 points, 3.6 rebounds, 1.1 assists, 0.8 steals, and 0.4 blocks per game. He shot 0.476 from the field, 0.385 from 3-point range, and 0.683 from the free throw line, playing an average of 19.2 minutes per game. In the 2000–01 season, Greg Buckner played for Dallas in 37 games. He averaged 6.2 points, 4.2 rebounds, 1.3 assists, 0.9 steals, and 0.2 blocks per game. He shot 0.438 from the field, 0.286 from 3-point range, and 0.728 from the free throw line, playing an average of 22.2 minutes per game. In the 2001–02 season, Greg Buckner played for Dallas in 44 games. He averaged 5.8 points, 3.9 rebounds, 1.1 assists, 0.7 steals, and 0.4 blocks per game. He shot 0.525 from the field, 0.313 from 3-point range, and 0.69 from the free throw line, playing an average of 20.1 minutes per game. In the 2002–03 season, Greg Buckner played for Philadelphia in 75 games. He averaged 6.0 points, 2.9 rebounds, 1.3 assists, 1.0 steals, and 0.2 blocks per game. He shot 0.465 from the field, 0.273 from 3-point range, and 0.802 from the free throw line, playing an average of 20.2 minutes per game. In the 2003–04 season, Greg Buckner played for Philadelphia in 53 games. He averaged 3.1 points, 1.9 rebounds, 0.8 assists, 0.4 steals, and 0.1 blocks per game. He shot 0.377 from the field, 0.273 from 3-point range, and 0.741 from the free throw line, playing an average of 13.3 minutes per game. In the 2004–05 season, Greg Buckner played for Denver in 70 games. He averaged 6.2 points, 3.0 rebounds, 1.9 assists, 1.1 steals, and 0.1 blocks per game. He shot 0.528 from the field, 0.405 from 3-point range, and 0.778 from the free throw line, playing an average of 21.7 minutes per game. In the 2005–06 season, Greg Buckner played for Denver in 73 games. He averaged 6.7 points, 2.9 rebounds, 1.7 assists, 1.2 steals, and 0.3 blocks per game. He shot 0.434 from the field, 0.354 from 3-point range, and 0.782 from the free throw line, playing an average of 24.1 minutes per game. In the 2006–07 season, Greg Buckner played for Dallas in 76 games. He averaged 4.0 points, 2.1 rebounds, 0.9 assists, 0.6 steals, and 0.1 blocks per game. He shot 0.411 from the field, 0.311 from 3-point range, and 0.794 from the free throw line, playing an average of 18.1 minutes per game. In the 2007–08 season, Greg Buckner played for Minnesota in 31 games. He averaged 4.0 points, 2.1 rebounds, 1.3 assists, 0.7 steals, and 0.1 blocks per game. He shot 0.385 from the field, 0.3 from 3-point range, and 0.864 from the free throw line, playing an average of 16.8 minutes per game. In the 2008–09 season, Greg Buckner played for Memphis in 63 games. He averaged 2.5 points, 2.1 rebounds, 0.9 assists, 0.5 steals, and 0.1 blocks per game. He shot 0.384 from the field, 0.255 from 3-point range, and 0.8 from the free throw line, playing an average of 13.9 minutes per game. In the 2001 season, Greg Buckner played for Dallas in 5 games. He averaged 6.0 points, 4.2 rebounds, 0.6 assists, 1.0 steals, and 0.0 blocks per game. He shot 0.478 from the field, 0.333 from 3-point range, and .700 from the free throw line, playing an average of 15.0 minutes per game. In the 2002 season, Greg Buckner played for Dallas in 7 games. He averaged 3.9 points, 3.7 rebounds, 0.6 assists, 0.4 steals, and 0.1 blocks per game. He shot 0.48 from the field, 0.0 from 3-point range, and .750 from the free throw line, playing an average of 15.0 minutes per game. In the 2003 season, Greg Buckner played for Philadelphia in 10 games. He averaged 2.6 points, 1.7 rebounds, 0.3 assists, 0.1 steals, and 0.2 blocks per game. He shot 0.323 from the field, 0.222 from 3-point range, and 1.000 from the free throw line, playing an average of 11.2 minutes per game. In the 2005 season, Greg Buckner played for Denver in 5 games. He averaged 2.0 points, 3.2 rebounds, 1.0 assists, 0.4 steals, and 0.2 blocks per game. He shot 0.222 from the field, 0.222 from 3-point range, and — from the free throw line, playing an average of 20.0 minutes per game. In the 2006 season, Greg Buckner played for Denver in 5 games. He averaged 12.6 points, 2.8 rebounds, 1.2 assists, 0.6 steals, and 0.2 blocks per game. He shot 0.418 from the field, 0.313 from 3-point range, and .875 from the free throw line, playing an average of 27.4 minutes per game. In the 2007 season, Greg Buckner played for Dallas in 6 games. He averaged 0.2 points, 1.0 rebounds, 0.3 assists, 0.3 steals, and 0.2 blocks per game.']","In the 2022–23 season, Greg Brown III shot 0.393 from the field, 0.143 from 3-point range, and 0.417 from the free throw line.","Greg Brown III shot 0.42 from the field, 0.33 from 3-point range, and 0.708 from the free throw line.",,0.9551312083001734,0.4342402480506095,,0.24024628846126542,0.9609851538450617
What did Michael Jackson install at his Neverland Ranch?,"['The Recording Industry Association of America (RIAA) certified it as eight times Platinum in the US. In March 1988, Jackson purchased 2,700 acres (11 km2) of land near Santa Ynez, California, to build a new home, Neverland Ranch, at a cost of $17 million (equivalent to $45 million in 2024). He installed a Ferris wheel, a carousel, a movie theater and a zoo.', 'The People v. Jackson trial began on January 31, 2005, in Santa Maria, California, and lasted until the end of May. Jackson found the experience stressful and it affected his health. If convicted, he would have faced up to twenty years in prison. On June 13, 2005, Jackson was acquitted on all counts. FBI files on Jackson, released in 2009, revealed the FBI\'s role in the 2005 trial and the 1993 allegations, and showed that the FBI found no evidence of criminal conduct on Jackson\'s behalf. = After the trial, Jackson became reclusive. In June 2005, he moved to Bahrain as a guest of Sheikh Abdullah. In early 2006, it was announced that Jackson had signed a contract with a Bahrain startup, Two Seas Records. Nothing came of the deal, and the Two Seas CEO, Guy Holmes, later said it was never finalized. Holmes also found that Jackson was on the verge of bankruptcy and was involved in 47 ongoing lawsuits. By September 2006, Jackson was no longer affiliated with Two Seas. In April 2006, Jackson agreed to use a piece of his ATV catalog stake, then worth about $1 billion, as collateral against his $270 million worth of loans from Bank of America. Bank of America had sold the loans to Fortress Investments, an investment company that buys distressed loans, the year before. As part of the agreement, Fortress Investments provided Jackson a new loan of $300 million with reduced interest payments (equivalent to $470 million in 2024). Sony Music would have the option to buy half of his stake, or about 25% of the catalog, at a set price. Jackson\'s financial managers had urged him to shed part of his stake to avoid bankruptcy. The main house at Neverland Ranch was closed as a cost-cutting measure, while Jackson lived in Bahrain at the hospitality of Abdullah. At least thirty of Jackson\'s employees had not been paid on time and were owed $306,000 in back wages. Jackson was ordered to pay $100,000 in penalties. Jackson never returned to Neverland after his acquittal. In mid-2006, Jackson moved to Grouse Lodge, a residential recording studio near Rosemount, County Westmeath, Ireland. There, he began work on a new album with the American producers will.i.am and Rodney Jenkins. That November, Jackson invited an Access Hollywood camera crew into the studio in Westmeath. On November 15, Jackson briefly joined in on a performance of ""We Are the World"" at the World Music Awards in London, his last public performance, and accepted the Diamond Award for sales of 100 million records. He returned to the US in December, settling in Las Vegas. That month, he attended James Brown\'s funeral in Augusta, Georgia, where he gave a eulogy calling Brown his greatest inspiration. In 2007, Jackson and Sony bought another music publishing company, Famous Music LLC, formerly owned by Viacom. The deal gave Jackson the rights to songs by Eminem and Beck, among others. In a brief interview, Jackson said he had no regrets about his career despite his problems and ""deliberate attempts to hurt [him]"". That March, Jackson visited a US Army post in Japan, Camp Zama, to greet more than 3,000 troops and their families. As of September, Jackson was still working on his next album, which he never completed. In 2008, for the 25th anniversary of Thriller, Jackson and Sony released Thriller 25, with two remixes released as singles: ""The Girl Is Mine 2008"" and ""Wanna Be Startin\' Somethin\' 2008"". Thriller 25 was the last recorded work released during his life which he was extensively involved with, with Jackson co-producing the album\'s remix tracks. For his 50th birthday, Sony BMG released a series of greatest hits albums, King of Pop, with different tracklists for different regions. That July, Fortress Investments threatened to foreclose on Neverland Ranch, which he had used as collateral for his loans. Fortress sold Jackson\'s debts to Colony Capital LLC. In November, Jackson transferred Neverland Ranch\'s title to Sycamore Valley Ranch Company LLC, a joint venture between Jackson and Colony Capital LLC. The deal earned him $35 million.', 'T.J. Jackson, the son of Tito Jackson, was given co-guardianship of Michael Jackson\'s children after false reports of Katherine Jackson going missing. Xscape, an album of unreleased material, was released on May 13, 2014. The lead single, a duet between Jackson and Justin Timberlake, ""Love Never Felt So Good"", reached number 9 on the US Billboard Hot 100, making Jackson the first artist to have a top-10 single on the chart in five different decades. Later in 2014, Queen released a duet recorded with Jackson in the 1980s. A compilation album, Scream, was released on September 29, 2017. A jukebox musical, MJ the Musical, premiered on Broadway in 2022. Myles Frost won the 2022 Tony Award for Best Actor in a Musical for his portrayal of Jackson. On November 18, 2022, Epic released a 40th-anniversary edition reissue of Thriller. A biographical film based on Jackson\'s life, Michael, directed by Antoine Fuqua, is scheduled for October 2025. Jackson is played by his nephew Jaafar Jackson. Deadline Hollywood reported that the film ""will not shy away from the controversies of Jackson\'s life"". Since Jackson\'s death, his estate has grossed $2 billion in ticket revenue from MJ the Musical, Michael Jackson\'s This Is It and two Cirque du Soleil productions. = In 2013, choreographer Wade Robson filed a lawsuit alleging that Jackson had sexually abused him for seven years, beginning when he was seven years old (1989–1996). In 2014, a case was filed by James Safechuck, alleging similar sexual abuse over a four-year period starting when Safechuck was ten (1988–1992). Both had previously testified in Jackson\'s defense during the 1993 allegations; Robson did so again in 2005. In 2015, Robson\'s case against Jackson\'s estate was dismissed as it had been filed too late. Safechuck\'s claim was also time-barred. In 2017, it was ruled that Jackson\'s corporations could not be held accountable for his alleged past actions. The rulings were appealed. On October 20, 2020, Safechuck\'s lawsuit against Jackson\'s corporations was again dismissed. The judge ruled that there was no evidence that Safechuck had had a relationship with Jackson\'s corporation, nor was it proven that there was a special relationship between the two. On April 26, 2021, Robson\'s case was dismissed because of a lack of supporting evidence that the defendants exercised control over Jackson. Robson and Safechuck\'s allegations were the subject of the documentary film Leaving Neverland, released in March 2019. Radio stations in New Zealand, Canada, the UK and the Netherlands removed Jackson\'s music from their playlists. Jackson\'s family condemned the film as a ""public lynching"", and the Jackson estate released a statement calling the film a ""tabloid character assassination [Jackson] endured in life, and now in death"". Close associates of Jackson, such as Corey Feldman, Aaron Carter, Brett Barnes, and Macaulay Culkin, defended Jackson in the wake of the documentary\'s release, saying that Jackson had never molested them. Documentaries such as Square One: Michael Jackson, Neverland Firsthand: Investigating the Michael Jackson Documentary and Michael Jackson: Chase the Truth, presented information countering the claims suggested by Leaving Neverland. Jackson\'s album sales increased following the documentary screenings. Billboard senior editor Gail Mitchell said she and a colleague interviewed about thirty music executives who believed Jackson\'s legacy could withstand the controversy. In late 2019, some New Zealand and Canadian radio stations re-added Jackson\'s music to their playlists, citing ""positive listener survey results"". On February 21, 2019, the Jackson estate sued HBO for breaching a non-disparagement clause from a 1992 contract. The suit sought to compel HBO to participate in a non-confidential arbitration that could result in $100 million or more in damages awarded to the estate. HBO said they did not breach a contract and filed an anti-SLAPP motion against the estate. In September 2019, Judge George H. Wu denied HBO\'s motion to dismiss the case, allowing the Jackson estate to arbitrate. HBO appealed, but in December 2020 the appeals court affirmed Wu\'s ruling. In 2020, a state law passed in California which granted plaintiffs in child sex abuse cases an additional period to file lawsuits. In October 2020 and again in April 2021, the Los Angeles County Superior Court ruled that MJJ Productions Inc. and MJJ Ventures Inc. employees were not legally obligated to protect the two men from Jackson. In August 2023, California\'s Second District Court of Appeal overturned the ruling, and the case was approved to move forward to trial court. Jackson has been referred to as the ""King of Pop"" for having transformed the art of music videos and paving the way for modern pop music. For much of Jackson\'s career, he had an unparalleled worldwide influence over the younger generation. His influence extended beyond the music industry; he impacted dance, led fashion trends, and raised awareness for global affairs. Jackson\'s music and videos fostered racial diversity in MTV\'s roster and steered its focus from rock to pop music and R&B, leading to the discontinuation of the album-oriented rock format previously dominant on the channel. In songs such as ""Black or White"", ""Heal the World"", ""Earth Song"" and ""They Don\'t Care About Us"", Jackson\'s music emphasized racial integration and environmentalism and protested injustice. He is considered one of the most significant figures of the 20th century, and his contributions to music, dance, and fashion, along with his publicized personal life, made him a global figure in popular culture for over four decades. Jackson\'s meteoric rise in the 1980s catapulted him to global stardom, and his influence transcended borders. In Africa, his influence was compared to Nelson Mandela for his ability to inspire and unite diverse audiences through his music. Similarly, in India, Jackson was likened to Mahatma Gandhi, with his art championing themes of social justice and humanitarianism, and his influence extending to Bollywood where it was said that anyone who danced well was compared to Jackson. In Europe, Jackson\'s impact was compared to that of the Pope, drawing huge crowds of people who gathered to see the singer in public and even more to his concerts, which spread messages of love and healing during rough economic and political times. His presence in the Middle East was considered as widespread as Coca-Cola, symbolizing a shared global culture through his music. Additionally, Jackson is considered the backbone of the K-pop industry in South Korea, influencing countless artists and shaping the genre\'s development.Trying to trace Michael Jackson\'s influence on the pop stars that followed him is like trying to trace the influence of oxygen and gravity. So vast, far-reaching and was his impact—particularly in the wake of Thriller\'s colossal and heretofore unmatched commercial success—that there weren\'t a whole lot of artists who weren\'t trying to mimic some of the Jackson formula.Danyel Smith, chief content officer of Vibe Media Group and the editor-in-chief of Vibe, described Jackson as ""the greatest star"". Steve Huey of AllMusic called him ""an unstoppable juggernaut, possessed of all the skills to dominate the charts seemingly at will: an instantly identifiable voice, eye-popping dance moves, stunning musical versatility and loads of sheer star power"". BET said Jackson was ""quite simply the greatest entertainer of all time"" whose ""sound, style, movement and legacy continues to inspire artists of all genres"". In 1984, Time pop critic Jay Cocks wrote that ""Jackson is the biggest thing since the Beatles. He is the hottest single phenomenon since Elvis Presley. He just may be the most popular black singer ever."" He described Jackson as a ""star of records, radio, rock video. A one-man rescue team for the music business. A songwriter who sets the beat for a decade.', 'The documentary, broadcast in February 2003 as Living with Michael Jackson, showed Jackson holding hands and discussing sleeping arrangements with a twelve-year-old boy. He said that he saw nothing wrong with having sleepovers with minors and sharing his bed and bedroom with various people, which aroused controversy. He insisted that the sleepovers were not sexual and that his words had been misunderstood. In October 2003, Jackson received the Key to the City of Las Vegas from Mayor Oscar Goodman. On November 18, 2003, Sony released Number Ones, a greatest hits album. It was certified five times platinum by the RIAA, and ten times platinum in the UK, for shipments of at least 3 million units. On December 18, 2003, Santa Barbara authorities charged Jackson with seven counts of child molestation and two counts of intoxicating a minor with alcoholic drinks. Jackson denied the allegations and pleaded not guilty.', 'A dancer with the fanciest feet on the street. A singer who cuts across all boundaries of taste and style and color too."" The New York Times wrote ""in the world of pop music, there is Michael Jackson and there is everybody else"".In November 1983, Jackson and his brothers partnered with PepsiCo in a $5 million promotional deal that broke records for a celebrity endorsement (equivalent to $15.8 million in 2024). The first Pepsi campaign, which ran in the US from 1983 to 1984 and launched its ""New Generation"" theme, included tour sponsorship, public relations events, and in-store displays. Jackson helped to create the advertisement, and suggested using his song ""Billie Jean"", with revised lyrics, as its jingle. On January 27, 1984, Michael and other members of the Jacksons filmed a Pepsi commercial overseen by Phil Dusenberry, a BBDO ad agency executive, and Alan Pottasch, Pepsi\'s Worldwide Creative Director, at the Shrine Auditorium in Los Angeles. During a simulated concert before a full house of fans, pyrotechnics accidentally set Jackson\'s hair on fire, causing second-degree burns to his scalp. Jackson underwent treatment to hide the scars and had his third rhinoplasty shortly thereafter. Pepsi settled out of court, and Jackson donated the $1.5 million (equivalent to $4.5 million in 2024) settlement to the Brotman Medical Center in Culver City, California; its now-closed Michael Jackson Burn Center was named in his honor. Jackson signed a second agreement with Pepsi in the late 1980s for $10 million (equivalent to $27.7 million in 2024). The second campaign covered 20 countries and provided financial support for Jackson\'s Bad album and 1987–1988 world tour. Jackson had endorsements and advertising deals with other companies, such as LA Gear, Suzuki, and Sony, but none were as significant as his deals with Pepsi. The Victory Tour of 1984 headlined the Jacksons and showcased Jackson\'s new solo material to more than two million Americans. It was the last tour he did with his brothers. Following controversy over the concert\'s ticket sales, Jackson donated his share of the proceeds, an estimated $3 to 5 million, to charity. During the last concert of the Victory Tour at the Dodger Stadium in Los Angeles, Jackson announced his split from the Jacksons during ""Shake Your Body"". = With Lionel Richie, Jackson co-wrote the charity single ""We Are the World"" (1985), which raised money for the poor in the US and Africa. It earned $63 million (equivalent to $184 million in 2024), and became one of the best-selling singles of all time, with 20 million copies sold. It won four Grammy Awards in 1985, including Song of the Year for Jackson and Richie. Jackson, Jones, and the promoter Ken Kragen received special awards for their roles in the song\'s creation. Jackson collaborated with Paul McCartney in the early 1980s, and learned that McCartney was making $40 million a year from owning the rights to other artists\' songs. By 1983, Jackson had begun buying publishing rights to others\' songs, but he was careful with his acquisitions, only bidding on a few of the dozens that were offered to him. Jackson\'s early acquisitions of music catalogs and song copyrights such as the Sly Stone collection included ""Everyday People"" (1968), Len Barry\'s ""1-2-3"" (1965), and Dion DiMucci\'s ""The Wanderer"" (1961) and ""Runaround Sue"" (1961). In 1984, Robert Holmes à Court announced he was selling the ATV Music Publishing catalog comprising the publishing rights to nearly 4,000 songs, including most of the Beatles\' material. In 1981, McCartney had been offered the catalog for £20 million ($40 million) (equivalent to $138 million in 2024). Jackson submitted a bid of $46 million (equivalent to $139 million in 2024) on November 20, 1984. When Jackson and McCartney were unable to make a joint purchase, McCartney did not want to be the sole owner of the Beatles\' songs, and did not pursue an offer on his own. Jackson\'s agents were unable to come to a deal, and in May 1985 left talks after having spent more than $1 million and four months of due diligence work on the negotiations. In June 1985, Jackson and Branca learned that Charles Koppelman\'s and Marty Bandier\'s The Entertainment Company had made a tentative offer to buy ATV Music for $50 million; in early August, Holmes à Court contacted Jackson and talks resumed. Jackson\'s increased bid of $47.5 million (equivalent to $139 million in 2024) was accepted because he could close the deal more quickly, having already completed due diligence. Jackson agreed to visit Holmes à Court in Australia, where he would appear on the Channel Seven Perth Telethon. His purchase of ATV Music was finalized on August 10, 1985. = Jackson\'s skin had been medium-brown during his youth, but from the mid-1980s gradually grew paler. The change drew widespread media coverage, including speculation that he had been bleaching his skin. His dermatologist, Arnold Klein, said he observed in 1983 that Jackson had vitiligo, a condition characterized by patches of the skin losing their pigment. He also identified discoid lupus erythematosus in Jackson. He diagnosed Jackson with lupus that year, and with vitiligo in 1986. Vitiligo\'s drastic effects on the body can cause psychological distress. Jackson used fair-colored makeup, and possibly skin-bleaching prescription creams, to cover up the uneven blotches of color caused by the illness. The creams would depigment the blotches, and, with the application of makeup, he could appear very pale. Jackson said he had not purposely bleached his skin and could not control his vitiligo, adding, ""When people make up stories that I don\'t want to be who I am, it hurts me."" He became friends with Klein and Klein\'s assistant, Debbie Rowe. Rowe later became Jackson\'s second wife and the mother of his first two children. In his 1988 autobiography and a 1993 interview, Jackson said he had had two rhinoplasty surgeries and a cleft chin surgery but no more than that. He said he lost weight in the early 1980s because of a change in diet to achieve a dancer\'s body. Witnesses reported that he was often dizzy, and speculated he was suffering from anorexia nervosa. Periods of weight loss became a recurring problem later in his life. After his death, Jackson\'s mother said that he first turned to cosmetic procedures to remedy his vitiligo, because he did not want to look like a ""spotted cow"". She said he had received more than the two cosmetic surgeries he claimed and speculated that he had become addicted to them. In 1986, it was reported that Jackson slept in a hyperbaric oxygen chamber to slow aging. He denied the story, although it was alleged that Jackson leaked an image of him sleeping in a glass chamber (according to Jackson, this was a promotional shot from an upcoming space opera featuring himself) to The National Enquirer. It was also reported that Jackson took female hormone shots to keep his voice high and facial hair wispy, proposed to Elizabeth Taylor and possibly had a shrine of her, and had cosmetic surgery on his eyes. Jackson\'s manager Frank DiLeo denied all of them, except for Jackson having a chamber. DiLeo added ""I don\'t know if he sleeps in it.', ""He spent time in the Skywalker Ranch for the movie's post-production."", ""3 (7). How Michael Jackson Changed Dance History – biography.com Official website Michael Jackson at Amazon Music Michael Jackson at the FBI's website Michael Jackson at IMDb\n\n"", 'Bush. In 1992, he was honored as a ""Point of Light Ambassador"" by Bush for inviting disadvantaged children to his Neverland Ranch. Jackson won hundreds of awards, making him one of the most-awarded artists in popular music. His awards include 39 Guinness World Records, including the Most Successful Entertainer of All Time, 13 Grammy Awards, as well as the Grammy Legend Award and the Grammy Lifetime Achievement Award, and 26 American Music Awards, including the Artist of the Century and Artist of the 1980s. He also received the World Music Awards\' Best-Selling Male Artist of the Millennium and the Bambi Pop Artist of the Millennium Award. Jackson was inducted onto the Hollywood Walk of Fame in 1980 as a member of the Jacksons, and in 1984 as a solo artist. He was inducted to the Rock and Roll Hall of Fame and Vocal Group Hall of Fame as a member of the Jackson 5 in 1997 and 1999, respectively, and again as a solo artist in 2001. In 2002, he was added to the Songwriters Hall of Fame. In 2010, he was the first recording artist to be inducted into the Dance Hall of Fame, and in 2014, he was posthumously inducted into the Rhythm and Blues Music Hall of Fame. In 2021, he was among the inaugural inductees into the Black Music & Entertainment Walk of Fame. In 1988, Fisk University honored him with an Honorary Doctorate of Humane Letters. In 1992, he was invested as a titular king of Sanwi, a traditional kingdom located in the south-east of Ivory Coast. In July 2009, the Lunar Republic Society named a crater on the Moon after Jackson. In August, for what would have been Jackson\'s 51st birthday, Google dedicated their Google Doodle to him. In 2012, the extinct hermit crab Mesoparapylocheles michaeljacksoni was named in his honor. In 2014, the British Council of Cultural Relations deemed Jackson\'s life one of the 80 most important cultural moments of the 20th century. World Vitiligo Day has been celebrated on June 25, the anniversary of Jackson\'s death, to raise awareness of the auto-immune disorder that Jackson suffered from. In 1989, Jackson\'s annual earnings from album sales, endorsements, and concerts were estimated at $125 million.', 'In late 1995, Jackson was admitted to a hospital after collapsing during rehearsals for a televised performance, caused by a stress-related panic attack. In November, Jackson merged his ATV Music catalog with Sony\'s music publishing division, creating Sony/ATV Music Publishing. He retained ownership of half the company, earning $95 million up front (equivalent to $196 million in 2024) as well as the rights to more songs. ""Earth Song"" was the third single released from HIStory, and topped the UK Singles Chart for six weeks over Christmas 1995. It became the 87th-bestselling single in the UK. At the 1996 Brit Awards, Jackson\'s performance of ""Earth Song"" was disrupted by Pulp singer Jarvis Cocker, who was protesting what Cocker saw as Jackson\'s ""Christ-like"" persona. Jackson said the stage invasion was ""disgusting and cowardly"". In 1996, Jackson won a Grammy for Best Music Video, Short Form, for ""Scream"" and an American Music Award for Favorite Pop/Rock Male Artist. In July 1996, Jackson performed for Sultan Hassanal Bolkiah\'s fiftieth birthday at Jerudong Park Amphitheater, which was specifically built for that birthday concert. Jackson was reportedly paid $17 million (equivalent to $34 million in 2024). Jackson promoted HIStory with the HIStory World Tour, from September 7, 1996, to October 15, 1997. He performed 82 concerts in five continents, 35 countries and 58 cities to over 4.5 million fans, his most attended tour. It grossed $165 million (equivalent to $323 million in 2024). During the tour, in Sydney, Australia, Jackson married Debbie Rowe, a dermatology assistant, who was six months pregnant with his first child. Michael Joseph Jackson Jr. (commonly known as Prince) was born on February 13, 1997. His sister Paris-Michael Katherine Jackson was born on April 3, 1998. Jackson and Rowe divorced in 2000, Rowe conceded custody of the children, with an $8 million settlement (equivalent to $15.1 million in 2024). In 2004, after the second child abuse allegations against Jackson, she returned to court to reclaim custody.', 'R. Rahman, Prabhu Deva Sundaram, Shobana, Andrea Bocelli and Luciano Pavarotti. The proceeds went to the Nelson Mandela Children\'s Fund, the Red Cross and UNESCO. In 1999, Jackson was presented with the ""Outstanding Humanitarian Award"" at Bollywood Movie Awards in New York City where he noted Mahatma Gandhi to have been an inspiration for him. From August 1999 to 2000, he lived in New York City at 4 East 74th Street. At the turn of the century, Jackson was awarded with the Artist of the 1980s Decade Award at the 27th American Music Awards, and the Best-Selling Pop Male Artist of the Millennium Award at the 12nd World Music Awards. In 2000, Guinness World Records recognized him for supporting 39 charities, more than any other entertainer. In September 2001, two concerts were held at Madison Square Garden to mark Jackson\'s 30th year as a solo artist. Jackson performed with his brothers for the first time since 1984. The show also featured Mýa, Usher, Whitney Houston, Destiny\'s Child, Monica, Liza Minnelli and Slash. The first show was marred by technical lapses, and the crowd booed a speech by Marlon Brando. 45 million people watched the television broadcast of the shows in November according to Nielsen Media Research. After the September 11 attacks (in which Jackson narrowly avoided death by oversleeping and missing a scheduled meeting at the World Trade Center), Jackson helped organize the United We Stand: What More Can I Give benefit concert at Robert F. Kennedy Memorial Stadium in Washington, D.C., on October 21, 2001. Jackson performed ""What More Can I Give"" as the finale. The release of Invincible was preceded by a dispute between Jackson and his record label, Sony Music Entertainment. Jackson had expected the licenses to the masters of his albums to revert to him in the early 2000s, after which he would be able to promote the material however he pleased and keep the profits, but clauses in the contract set the revert date years into the future. Jackson sought an early exit from his contract. Invincible was released on October 30, 2001. It was Jackson\'s first full-length album in six years, and the last album of original material he released in his lifetime. It debuted at number one in 13 countries, and went on to sell eight million copies worldwide, receiving double-platinum certification in the US. On January 9, 2002, Jackson won his 22nd American Music Award for Artist of the Century. Later that year, an anonymous surrogate mother gave birth to his third child, Prince Michael Jackson II (nicknamed ""Blanket""), who had been conceived by artificial insemination. On November 20, Jackson briefly held Blanket over the railing of his Berlin hotel room, four stories above ground level, prompting widespread criticism in the media. Jackson apologized for the incident, calling it ""a terrible mistake"". On January 22, promoter Marcel Avram filed a breach of contract complaint against Jackson for failing to perform two planned 1999 concerts. In March, a Santa Maria jury ordered Jackson to pay Avram $5.3 million (equivalent to $9.3 million in 2024). On December 18, 2003, Jackson\'s attorneys dropped all appeals on the verdict and settled the lawsuit for an undisclosed amount. On April 24, 2002, Jackson performed at Apollo Theater. The concert was a fundraiser for the Democratic National Committee and former President Bill Clinton. The money collected would be used to encourage citizens to vote. It raised $2.5 million (equivalent to $3.8 million in 2024). The concert was called Michael Jackson: Live at the Apollo and was one of Jackson\'s final on-stage performances. In July 2002, at Al Sharpton\'s National Action Network in Harlem, Jackson called the Sony Music chairman Tommy Mottola ""a racist, and very, very, very devilish"", and accused him of exploiting black artists for his own gain. The accusation prompted Sharpton to form a coalition investigating whether Mottola exploited black artists. Jackson charged that Mottola had called his colleague Irv Gotti a ""fat nigger"". Sony issued a statement calling the accusations ""ludicrous, spiteful, and hurtful"" and said Mottola had championed Jackson\'s career for years. Sony refused to renew Jackson\'s contract and said that a $25 million (equivalent to $43.7 million in 2024) promotional campaign had failed because Jackson refused to tour in the US for Invincible. = Beginning in May 2002, a documentary film crew led by Martin Bashir followed Jackson for several months.', 'Its score was arranged by Quincy Jones, who later produced three of Jackson\'s solo albums. During his time in New York, Jackson frequented the Studio 54 nightclub, where he heard early hip hop; this influenced his beatboxing on future tracks such as ""Working Day and Night"". In 1978, Jackson felt unsatisfied with his nose, and decided to have a rhinoplasty. He was referred to Steven Hoefflin, who performed his operations. Jackson\'s fifth solo album and first album as an adult, Off the Wall (1979), established him as a solo performer and helped him move from the bubblegum pop of his youth to more complex sounds. It produced four top 10 entries in the US: ""Off the Wall"", ""She\'s Out of My Life"", and the chart-topping singles ""Don\'t Stop \'Til You Get Enough"" and ""Rock with You"". The album reached number three on the US Billboard 200 and sold over 20 million copies worldwide. In 1980, Jackson won three American Music Awards for his solo work: Favorite Soul/R&B Album, Favorite Soul/R&B Male Artist, and Favorite Soul/R&B Single for ""Don\'t Stop \'Til You Get Enough"". He also won a Grammy Award for Best Male R&B Vocal Performance for 1979 with ""Don\'t Stop \'Til You Get Enough"". In 1981, Jackson was the American Music Awards winner for Favorite Soul/R&B Album and Favorite Soul/R&B Male Artist. Jackson felt Off the Wall should have made a bigger impact, and was determined to exceed expectations with his next release. In 1980, he secured the highest royalty rate in the music industry: 37 percent of wholesale album profit. = Jackson recorded with Queen\'s lead singer Freddie Mercury from 1981 to 1983, recording demos of ""State of Shock"", ""Victory"" and ""There Must Be More to Life Than This"". The recordings were intended for an album of duets but, according to Queen\'s manager Jim Beach, the relationship soured when Jackson brought a llama into the recording studio, and Jackson was upset by Mercury\'s drug use. ""There Must Be More to Life Than This"" was released in 2014. Jackson went on to record ""State of Shock"" with Mick Jagger for the Jacksons\' album Victory (1984). In 1982, Jackson contributed ""Someone in the Dark"" to the audiobook for the film E.T. the Extra-Terrestrial. Jackson\'s sixth album, Thriller, was released in late 1982. It was the bestselling album worldwide in 1983, and became the bestselling album of all time in the US and the best-selling album of all time worldwide, selling an estimated 70 million copies. It topped the Billboard 200 chart for 37 weeks and was in the top 10 of the 200 for 80 consecutive weeks. It was the first album to produce seven Billboard Hot 100 top-10 singles, including ""Billie Jean"", ""Beat It"", and ""Wanna Be Startin\' Somethin\'"".On March 25, 1983, Jackson reunited with his brothers for Motown 25: Yesterday, Today, Forever, an NBC television special. The show aired on May 16 to an estimated audience of 47 million, and featured the Jacksons and other Motown stars. Jackson\'s solo performance of ""Billie Jean"" earned him his first Emmy Award nomination. Wearing a glove decorated with rhinestones, he debuted his moonwalk dance, which Jeffrey Daniel had taught him three years earlier, and it became his signature dance in his repertoire. Jackson had originally turned down the invitation to the show, believing he had been doing too much television.', 'On July 8, 1993, Evan Chandler, Jordan\'s father and a Los Angeles dentist, was recorded threatening to ""destroy"" Jackson\'s career with a ""carefully planned plot, with people in place ready to set it in motion"" if Jackson did not meet his demands, revealing clear financial motives: ""If I go through with this, I win big-time. There’s no way I lose"". On July 9, Jackson\'s investigator, Anthony Pellicano, met Jordan, who denied any abuse or inappropriate touching by Jackson. Evan Chandler\'s lawyer would later call Beverly Hills psychiatrist Dr. Mathis Abrams and present him with a hypothetical situation. In reply and without having met either Jordan Chandler or his parents, Abrams sent Rothman a two-page letter in which he states that ""reasonable suspicion would exist that sexual abuse may have occurred"" after receiving the letter from Dr Abrams Evan Chandler allegedly received a confession from his son Jordan. Evan demands $20 million from Jackson on August 4, 1993, without going to law enforcement regarding the reports of the abuse that was claimed to have taken place, but Jackson refused and sued Chandler for extortion. Later a meeting at the Westwood Marquis Hotel, Evan and his son Jordan met Michael Jackson and Anthony Pellicano without their lawyer Barry Rothman, Evan greeted Jackson with a hug before pulling out a letter from Dr. Mathis Abrams and reading its allegations of child molestation aloud, As Evan cited the molestation references, Jordan lowered his head and then looked at Jackson with evident surprise, casting doubt on the claims as he had reportedly already reported his confession weeks prior. The encounter concluded with Evan pointing at Jackson and declaring, ""I\'m going to ruin you,"" revealing a clear intent to threaten rather than seek justice—a stark contrast to the embrace that opened the meeting. From August 9–13, 1993 Evan Chandler and his legal team made various counteroffers to secure a settlement from Jackson, escalating their financial demands after his refusal to pay the initial $20 million, with Evan later filing a civil suit in September demanding $30 million for alleged damages which were all denied by Jackson, prompting Chandler to go public with the claims of child molestation. Jackson\'s older sister La Toya accused him of being a pedophile; she later retracted this, saying she had been forced into it by her abusive husband. Prosecutors raided Neverland Ranch and other places of residency while Jackson was on tour in August, but no leads were found as the investigators ruled that there was no medical evidence or physical evidence. Additionally hundreds of children were investigated but all of them stated no abuse or improper behavior had taken place. Attention was later brought to two legal art books depicting featuring young boys playing, running, and swimming in various states of undress, however Jackson denied knowing of the books\' content and claimed if they were there, someone had to have sent them to him and he did not open them. No child pornography or other incriminating evidence was found. In December 1993, Prosecutor Tom Sneddon filed a strip search on Jackson based on the drawing obtained by Jordan Chandler which had been sent to the authorities, however the drawing did not match and prosecutors sought out Jackson\'s doctors and family inquiring about the possibility the singer had altered his genitals as to explain the mismatch. In November 1993, Jackson requested that the civil trial be postponed until after the criminal hearing was completed due to a violation of his civil rights, under the circumstances of having to defend himself under double jeopardy. This motion was denied and in January 1994 the civil lawsuit was settled for $15,331,250 with separate payments of 1.5 million for Evan and June Chandler coming out to a total of 18.3 million allocated to the Chandler family, lower than the initial demand of 20-30 million requested by Evan Chandler. The document shows that the Chandlers dropped the child molestation allegations from their complaint with Jackson\'s settlement being filed over claims of negligence. It was later revealed that this settlement did not prevent the Chandlers from testifying in the criminal case The police never pressed criminal charges. The prosecution continued to investigate Jackson from January to June 1994 with Jordan Chandler continuing to co-operate with investigators, by July 1994 multiple grand juries had been called however jurors remarked that no damaging evidence was heard against Jackson. ""The [Santa Barbara] grand jury in Michael Jackson\'s case was dismissed and one juror said he heard no evidence against [Jackson]... Another juror told CNN that he heard no evidence against him [Jackson] during the hearing."" On September 21, 1994, after 400 witnesses had been investigated with another 30 called in front of the grand juries, the investigation was closed. A few potential leads had been found but all of them turned out to be false. Jackson had been taking painkillers for his reconstructive scalp surgeries, administered due to the Pepsi commercial accident in 1984, and became dependent on them to cope with the stress of the sexual abuse allegations. On November 12, 1993, Jackson canceled the remainder of the Dangerous World Tour due to health problems, stress from the allegations and painkiller addiction. He thanked his close friend Elizabeth Taylor for support, encouragement and counsel. The end of the tour concluded his sponsorship deal with Pepsi. In late 1993, Jackson proposed to Lisa Marie Presley, the daughter of Elvis Presley, over the phone. They were married in La Vega, Dominican Republic, in May 1994 by civil judge Hugo Francisco Álvarez Pérez. The tabloid media speculated that the wedding was a publicity stunt to deflect away from Jackson\'s sexual abuse allegations and jump-start Presley\'s career as a singer. Their marriage ended little more than a year later, and they separated in December 1995. Presley cited ""irreconcilable differences"" when filing for divorce the next month and only sought to reclaim her maiden name as her settlement. After the divorce, Judge Pérez said, ""They lasted longer than I thought they would. I gave them a year. They lasted a year and a half."" Presley later said she and Jackson had attempted to reconcile intermittently for four years following their divorce, and that she had traveled the world to be with him. Jackson composed music for the Sega Genesis video game Sonic the Hedgehog 3 (1994), but left the project around the time the sexual abuse allegations surfaced and went uncredited. Jackson\'s involvement was the subject of fan speculation for decades until Sonic co-creator Yuji Naka confirmed it in 2022. Sega Technical Institute director Roger Hector and Sonic co-creator Naoto Ohshima said that Jackson was terminated and his music reworked following the allegations. However, Jackson\'s musical director Brad Buxer and other members of Jackson\'s team said he went uncredited because he was unhappy with how the Genesis replicated his music. The game\'s credits theme served as the basis for Jackson\'s 1996 song ""Stranger in Moscow"". = In June 1995, Jackson released the double album HIStory: Past, Present and Future, Book I. The first disc, HIStory Begins, is a greatest hits album (reissued in 2001 as Greatest Hits: HIStory, Volume I). The second disc, HIStory Continues, contains 13 original songs and two cover versions. The album debuted at number one on the charts and has been certified for eight million shipments in the US. It is the bestselling multi-disc album of all time, with 20 million copies (40 million units) sold worldwide. HIStory received a Grammy nomination for Album of the Year. The New York Times reviewed it as ""the testimony of a musician whose self-pity now equals his talent"". The first single from HIStory was ""Scream/Childhood"". ""Scream"", a duet with Jackson\'s youngest sister Janet, protests the media\'s treatment of Jackson during the 1993 child abuse allegations against him. The single reached number five on the Billboard Hot 100, and received a Grammy nomination for ""Best Pop Collaboration with Vocals"".', 'Michael Joseph Jackson (August 29, 1958 – June 25, 2009) was an American singer, songwriter, dancer, and philanthropist. Dubbed the ""King of Pop"", he is regarded as one of the most culturally significant figures of the 20th century. Over a four-decade career, his music achievements broke racial barriers in America and made him a dominant figure across the world. Through songs, stages, and fashion, he proliferated visual performance for artists in popular music; popularizing street dance moves including the moonwalk, the robot, and the anti-gravity lean. Jackson is often deemed the greatest entertainer of all time based on his acclaim and records. The eighth child of the Jackson family, Michael made his public debut in 1964 at age six, as a member of the Jackson 5 (later known as the Jacksons). After signing with Motown in 1968, the band achieved worldwide success with him as its lead singer. Jackson achieved solo stardom with the release of his fifth album Off the Wall (1979). He followed it up with Thriller (1982), the best-selling album of all time, which catapulted him to a rare level of fame, whilst aiding in the popularization of MTV and revolutionizing the music video medium with the videos for its title track along with ""Beat It"" and ""Billie Jean"". Jackson furthered his position as a global superstar with Bad (1987), the world\'s best-selling album of both 1987 and 1988, as well as the first album to produce five US Billboard Hot 100 number-one singles: ""I Just Can\'t Stop Loving You"", ""Bad"", ""The Way You Make Me Feel"", ""Man in the Mirror"", and ""Dirty Diana"". Dangerous (1991) marked a new era for Jackson, lauded as his most artistic and socially conscious album. HIStory (1995) produced ""You Are Not Alone"", the first song to debut at number one on the US Billboard Hot 100. His final album, Invincible, was released in 2001. From the late 1980s, Jackson became a figure of controversy and speculation due to his changing appearance, relationships, behavior, and lifestyle. He was accused of sexually abusing the child of a family friend in 1993. In 2005, Jackson was tried and acquitted of further child sexual abuse allegations and all other charges. While preparing for This Is It (a series of comeback concerts), Jackson died in 2009 from an overdose of propofol administered by his personal physician Conrad Murray, who was convicted in 2011 of involuntary manslaughter. Jackson\'s death triggered reactions around the world, creating unprecedented surges of internet traffic and a spike in sales of his music. His televised memorial service, held at the Staples Center in Los Angeles, was estimated to have been viewed by more than 2.5 billion people. Jackson is one of the best-selling music artists of all time, with estimated sales of over 500 million records worldwide. He had 13 Billboard Hot 100 number-one singles (the fifth-highest in Hot 100 history) and is the first artist to have a top-ten single on the chart in five different decades. Jackson was inducted into the Rock and Roll Hall of Fame (twice), the National Rhythm & Blues Hall of Fame, the Vocal Group Hall of Fame, the Songwriters Hall of Fame and the Dance Hall of Fame (the only recording artist to be inducted). One of the most-awarded artists in popular music, his accolades include 13 Grammy Awards, the Grammy Legend Award, and the Grammy Lifetime Achievement Award; 26 American Music Awards, including Artist of the Century; 12 World Music Awards; six Brit Awards; the Bambi Pop Artist of the Millennium Award; and three presidential honors. In 1992, Jackson founded Heal the World Foundation, donating an estimated $500 million to charity throughout his lifetime. In 2024, half of his music catalogue sold to Sony for $600 million, the largest music acquisition for a single artist in history. = Michael Joseph Jackson was born in Gary, Indiana, on August 29, 1958. He was the eighth of ten children in the Jackson family, a working-class African-American family living in a two-bedroom house on Jackson Street. His mother, Katherine Esther Jackson (née Scruse), played clarinet, cello, and piano, had aspired to be a country-and-western performer, and worked part-time at Sears. She was a Jehovah\'s Witness. His father, Joseph Walter ""Joe"" Jackson, was a former boxer, crane operator at US Steel, and guitarist for local rhythm and blues band the Falcons. Joe\'s great-grandfather, July ""Jack"" Gale, was a US Army scout; family lore held that he was also a Native American medicine man. Michael grew up with three sisters (Rebbie, La Toya, and Janet) and five brothers (Jackie, Tito, Jermaine, Marlon, and Randy). A sixth brother, Marlon\'s twin Brandon, died shortly after his birth. In 1964, Michael and Marlon joined the Jackson Brothers—a band formed by their father which included Jackie, Tito and Jermaine—as backup musicians playing congas and tambourine. Michael said his father told him he had a ""fat nose"", and physically and emotionally abused him during rehearsals. He recalled that Joe often sat in a chair with a belt in his hand as he and his siblings rehearsed, ready to punish any mistakes. Joe acknowledged that he regularly whipped Michael. Katherine said that although whipping came to be considered abuse, it was a common way to discipline children when Michael was growing up. Jackie, Tito, Jermaine and Marlon denied that their father was abusive and said that the whippings, which had a deeper impact on Michael because he was younger, kept them disciplined and out of trouble. Michael said that during his youth he was lonely and isolated. Later in 1965, Michael began sharing lead vocals with Jermaine, and the group\'s name was changed to the Jackson 5. In 1965, the group won a talent show; Michael performed the dance to Robert Parker\'s 1965 song ""Barefootin\'"" and sang the Temptations\' ""My Girl"". From 1966 to 1968, the Jacksons 5 toured the Midwest; they frequently played at a string of black clubs known as the Chitlin\' Circuit as the opening act for artists such as Sam & Dave, the O\'Jays, Gladys Knight and Etta James. The Jackson 5 also performed at clubs and cocktail lounges, where striptease shows were featured, and at local auditoriums and high school dances. In August 1967, while touring the East Coast, they won a weekly amateur night concert at the Apollo Theater in Harlem. The Jackson 5 recorded several songs for a Gary record label, Steeltown Records; their first single, ""Big Boy"", was released in 1968. Bobby Taylor of Bobby Taylor & the Vancouvers brought the Jackson 5 to Motown after they opened for Taylor at Chicago\'s Regal Theater in 1968. Taylor produced some of their early Motown recordings, including a version of ""Who\'s Lovin\' You"". After signing with Motown, the Jackson family relocated to Los Angeles. In 1969, Motown executives decided Diana Ross should introduce the Jackson 5 to the public — partly to bolster her career in television — sending off what was considered Motown\'s last product of its ""production line"". The Jackson 5 made their first television appearance in 1969 in the Miss Black America pageant, performing a cover of ""It\'s Your Thing"". Rolling Stone later described the young Michael as ""a prodigy"" with ""overwhelming musical gifts"" who ""quickly emerged as the main draw and lead singer"". In January 1970, ""I Want You Back"" became the first Jackson 5 song to reach number one on the US Billboard Hot 100; it stayed there for four weeks. Three more singles with Motown topped the chart: ""ABC"", ""The Love You Save"", and ""I\'ll Be There"". In May 1971, the Jackson family moved into a large house at Hayvenhurst, a 2-acre (0.81 ha) estate in Encino, California. During this period, Michael developed from a child performer into a teen idol. Between 1972 and 1975, he released four solo studio albums with Motown: Got to Be There (1972), Ben (1972), Music & Me (1973) and Forever, Michael (1975). ""Got to Be There"" and ""Ben"", the title tracks from his first two solo albums, sold well as singles, as did a cover of Bobby Day\'s ""Rockin\' Robin"". Michael maintained ties to the Jackson 5.', '2 on the charts in 1992. Jackson founded the Heal the World Foundation in 1992. The charity brought underprivileged children to Jackson\'s ranch to use the theme park rides, and sent millions of dollars around the globe to help children threatened by war, poverty, and disease. That July, Jackson published his second book, Dancing the Dream, a collection of poetry. The Dangerous World Tour ran between June 1992 and November 1993 and grossed $100 million (equivalent to $220 million in 2024); Jackson performed for over 3.5 million people in 70 concerts, all of which were outside the US. Part of the proceeds went to Heal the World Foundation. Jackson sold the broadcast rights of the tour to HBO for $20 million (equivalent to $45 million in 2024), a record-breaking deal that still stands. Following the death of HIV/AIDS spokesperson and friend Ryan White, Jackson pleaded with the Clinton administration at Bill Clinton\'s inaugural gala to give more money to HIV/AIDS charities and research and performed ""Gone Too Soon"", a song dedicated to White, and ""Heal the World"" at the gala. Jackson visited Africa in early 1992; on his first stop in Gabon he was greeted by more than 100,000 people, some of them carrying signs that read ""Welcome Home Michael"", and was awarded an Officer of the National Order of Merit from President Omar Bongo. During his trip to Ivory Coast, Jackson drew larger crowds than Pope John Paul II on his previous visits. He was crowned ""King Sani"" by a tribal chief in the Ivorian village of Krindjabo, where he thanked the dignitaries in French and English, signed documents formalizing his kingship, and sat on a golden throne while presiding over ceremonial dances. In January 1993, Jackson performed at the Super Bowl XXVII halftime show in Pasadena, California. The NFL sought a big-name artist to keep ratings high during halftime following dwindling audience figures. With 133.4 million viewers, it was the first Super Bowl whose halftime show drew greater audience figures than the game. Jackson played ""Jam"", ""Billie Jean"", ""Black or White"", and ""Heal the World"". Dangerous rose 90 places in the US albums chart after the performance. Jackson gave a 90-minute interview with Oprah Winfrey on February 10, 1993.', 'On the same trip, he appeared in Glasgow with British Prime Minister Gordon Brown, speaking in support of Searchlight magazine\'s anti racism campaign, the Daily Mirror ""Hope Not Hate Bus"". On November 23, 2007, Jackson appeared on Katie & Peter: Unleashed and again talked of a reunion with his brothers on a tour the following year. In 2008, Jackson flew to Australia to be a guest judge and mentor for the top-five Michael Jackson night on Australian Idol. In March 2008, Jackson was the guest of honor at the Muslim Writers Awards in Birmingham. In 2009, following his brother Michael\'s passing, Jermaine appeared on the A&E television series The Jacksons: A Family Dynasty, documenting what was supposed to be a 40th-anniversary reunion between Jermaine and his brothers. The series lasted one season and Jermaine, along with his three brothers, was listed as an executive producer. In October 2010, Jermaine played a concert at the Planet Hollywood hotel and casino in Las Vegas, naming it ""40 Years of Jackson Music"" and dedicating the concert to Michael. He wrote the memoir You Are Not Alone: Michael Through a Brother\'s Eyes (2011). In a 2012 interview with Luka Neskovic, for The Huffington Post, Jackson said that his brother planned a reunion with him: ""... the plan was to do some shows with the brothers, as well, after he finished his commitment with the This Is It [concert], and we probably gonna do some songs with him on the This Is It tour"". In October 2012, Jackson released I Wish You Love, his first solo album in 21 years, consisting mostly of jazz covers. The album was arranged and produced by French opera singer David Serero, who recorded a duet on ""Autumn Leaves"" with Jermaine, and was released by David Serero Productions. They both performed You Are Not Alone: The Musical, written, directed and produced by Serero, in France in January 2013. The following year, You Are Not Alone: The Musical Live was released on video and audio. = Jackson has been married and divorced three times, and has seven children. His first marriage was to Hazel Gordy, the daughter of Motown founder Berry Gordy. The couple were married from 1973 to 1988. They had three children; Jermaine La Jaune ""Jay"" Jackson Jr. (born 1977), Autumn Joi Jackson (born 1978) and Jaimy Jermaine Jackson (born 1987). Jackson was in a relationship with Margaret Maldonado from 1986 until 1993. They had two sons, Jeremy Maldonado Jackson (born 1986) and Jourdynn Michael Jackson (born 1989). He began a relationship with Alejandra Loaiza, former girlfriend of his brother, Randy, they were married from 1995 to 2003. They had two sons, Jaafar Jeremiah Jackson (born 1996) and Jermajesty Jermaine Jackson (born 2000). In 2004, Jackson married Halima Rashid in a mosque in Los Angeles. Rashid was arrested in 2015 in Los Angeles for alleged domestic violence. She filed a petition for divorce in 2016, citing irreconcilable differences. Jermaine supported his brother, Michael, during his 2005 trial. He came to Michael\'s defense on CNN\'s Larry King Live and appeared with him in court on many occasions. Jermaine announced his brothers\'s death on 25 June 2009 at a press conference at Ronald Reagan UCLA Medical Center. Jermaine is a supporter of the English football team Sheffield Wednesday. = Jermaine thanked the people that attended Michael Jackson\'s memorial at the Staples Center, on July 7, 2009. ""As you know,"" he said, ""I am lost for words.']","Michael Jackson installed a Ferris wheel, a carousel, a movie theater, and a zoo at his Neverland Ranch.","He installed a Ferris wheel, a carousel, a movie theater, and a zoo.",,1.0000000000000002,0.5319230769124385,,0.9823213622817913,0.9292854491271654
"In the 2016-17 season, how many games did Ron Baker play for New York?","['He shot 0.378 from the field, 0.267 from 3-point range, and .651 from the free throw line, playing an average of 16.5 minutes per game. In the 2017–18 season, Ron Baker played for New York in 29 games. He averaged 2.4 points, 1.0 rebounds, 1.6 assists, 0.9 steals, and 0.2 blocks per game. He shot 0.339 from the field, 0.333 from 3-point range, and .769 from the free throw line, playing an average of 13.3 minutes per game. In the 2018–19 season, Ron Baker played for New York in 11 games. He averaged 1.3 points, 0.6 rebounds, 1.2 assists, 0.5 steals, and 0.0 blocks per game. He shot 0.25 from the field, 0.111 from 3-point range, and .833 from the free throw line, playing an average of 9.7 minutes per game. In the 2018–19 season, Ron Baker played for Washington in 4 games. He averaged 0.0 points, 1.0 rebounds, 0.5 assists, 0.3 steals, and 0.3 blocks per game. He shot 0.0 from the field, 0.0 from 3-point range, and – from the free throw line, playing an average of 11.3 minutes per game. In the 2012–13 season, Ron Baker played for Wichita State in 18 games. He averaged 12.7 points, 3.2 rebounds, 1.8 assists, 0.8 steals, and 0.3 blocks per game. He shot 0.398 from the field, 0.357 from 3-point range, and 0.822 from the free throw line, playing an average of 26.1 minutes per game. In the 2013–14 season, Ron Baker played for Wichita State in 36 games. He averaged 13.1 points, 3.8 rebounds, 3.1 assists, 1.4 steals, and 0.6 blocks per game. He shot 0.456 from the field, 0.38 from 3-point range, and 0.842 from the free throw line, playing an average of 29.9 minutes per game. In the 2014–15 season, Ron Baker played for Wichita State in 35 games. He averaged 13.7 points, 4.5 rebounds, 2.5 assists, 1.3 steals, and 0.8 blocks per game. He shot 0.433 from the field, 0.383 from 3-point range, and 0.758 from the free throw line, playing an average of 32.7 minutes per game. In the 2015–16 season, Ron Baker played for Wichita State in 35 games. He averaged 14.0 points, 4.8 rebounds, 3.2 assists, 1.5 steals, and 0.6 blocks per game.', 'Ron Baker may refer to: Ron Baker (American football) (born 1954), former NFL offensive lineman Ron Baker (basketball) (born 1993), NBA basketball guard Ronnie Baker (athlete) (born 1993), American track and field sprinter Ronnie Baker (musician) (1947–1990), record producer, bassist, arranger and songwriter Ron Bakir (born 1977), Lebanese-Australian entrepreneur\n\nIn the 2016–17 season, Ron Baker played for New York in 52 games. He averaged 4.1 points, 1.9 rebounds, 2.1 assists, 0.7 steals, and 0.2 blocks per game.', 'He played college basketball for Dixie State College and Oklahoma State University, and has spent time in the NBA with the Los Angeles Clippers and the Portland Trail Blazers. He has also played professionally in Russia, Syria, Mexico, Lithuania, France, Puerto Rico, Philippines, Venezuela, and the Dominican Republic. Baker played his longest tenure with the Santa Cruz Warriors, starting with the 2004 season when the team was known as the Dakota Wizards in the Continental Basketball Association before the team moved to the NBA Development League in 2006. Baker has appeared in the second-most D-League games (356) in league history, and is the Warriors\' franchise all-time leader in points, minutes played, rebounds, assists, steals, and field goals made. Over his first two professional seasons, between 2002 and 2004, Baker played in Russia, Syria and Mexico. His first stint in the United States came during the 2004–05 season, when he joined the Dakota Wizards of the Continental Basketball Association. After averaging 16.9 points, 6.7 assists and 5.4 rebounds in 30 games for Dakota, he was called up to the NBA by the Los Angeles Clippers in February 2005. The following month, he garnered another NBA stint, this time with the Portland Trail Blazers. Over two 10-day contract periods with the Clippers and Trail Blazers, Baker appeared in five games with limited court time. Baker\'s 10-day contract with the Trail Blazers ended up being his final playing time in the NBA, as the rest of his professional basketball career was played in the D-League and overseas. His final game was played on March 19, 2005, in a 92 - 97 loss to the Orlando Magic where he only played for 5 seconds and recorded no stats. Baker returned to the Dakota Wizards for the 2005–06 season, playing with them until January 2006 when he moved to Lithuania to play for Lietuvos Rytas. In 12 league games for Rytas, he averaged 6.5 points, 3.2 rebounds, 2.1 assists and 1.7 steals per game. In the summer of 2006, Baker underwent ankle surgery, and was deemed ""about 80 percent of the player he was before"" the surgery. For the 2006–07 season, Baker returned to the Dakota Wizards, with the team now playing in the NBA Development League. In their first D-League season, Baker helped the Wizards win the championship, leading the team in rebounds with ten while scoring nineteen points in the Championship game against the Colorado 14ers. He again played for Dakota in 2007–08, departing the team in January 2008 to join Paris-Levallois of the LNB Pro A. In 2008–09, Baker again played in the NBA Development League for the Dakota Wizards, earning All-Star honors for the first time. Following the season with Dakota, Baker moved to Puerto Rico for the 2009 BSN season, joining Atléticos de San Germán. He returned to Dakota for the 2009–10 season, before again playing in Puerto Rico in the off-season, this time joining Indios de Mayagüez. For the 2010–11 season, Baker moved to Mexico where he played for Ola Verde de Poza Rica. In January 2011, he returned to the Dakota Wizards for the rest of the season. He later had stints in the Philippines for the Talk \'N Text Tropang Texters, and in Venezuela for Guaiqueríes de Margarita. Baker again played for the Dakota Wizards in 2011–12. He then played in the Dominican Republic during the 2012 off-season for Cañeros del Este. In 2012, the Wizards were moved from North Dakota to California by their NBA affiliate team, the Golden State Warriors. The team was subsequently renamed the Santa Cruz Warriors, and Baker continued on with Santa Cruz. Between 2012 and 2016, Baker was a consistent presence on the Santa Cruz roster, earning his second D-League championship in the 2014–15 season. Prior to the start of the 2022–23 NBA season, Baker was hired as an assistant coach for the Indiana Pacers under head coach Rick Carlisle. = Career statistics from NBA.com · Basketball Reference Maurice Baker at nbadleague.com Maurice Baker Oklahoma State profile Maurice Baker at lnb.fr Maurice Baker is the legend you never heard of\n\nIn the 2004–05 season, Maurice Baker played for L.A. Clippers in 1 games.', 'In 2013, the New York Daily News reported that he had stopped drinking alcohol on April 17, 2011. List of National Basketball Association annual minutes leaders Career statistics from NBA.com · Basketball Reference The Curious Case of Vin Baker\n\nIn the 1989–90 season, Vin Baker played for Hartford in 28 games. He averaged 4.7 points, 2.9 rebounds, 0.3 assists, 0.3 steals, and 1.7 blocks per game. He shot 0.617 from the field, – from 3-point range, and 0.39 from the free throw line, playing an average of 13.4 minutes per game. In the 1990–91 season, Vin Baker played for Hartford in 29 games. He averaged 19.6 points, 10.4 rebounds, 0.6 assists, 1.1 steals, and 2.0 blocks per game. He shot 0.491 from the field, – from 3-point range, and 0.678 from the free throw line, playing an average of 31.0 minutes per game. In the 1991–92 season, Vin Baker played for Hartford in 27 games. He averaged 27.6 points, 9.9 rebounds, 1.3 assists, 1.3 steals, and 3.7 blocks per game. He shot 0.44 from the field, .331 from 3-point range, and 0.657 from the free throw line, playing an average of 36.9 minutes per game. In the 1992–93 season, Vin Baker played for Hartford in 28 games. He averaged 28.3 points, 10.7 rebounds, 1.9 assists, 1.4 steals, and 2.6 blocks per game. He shot 0.477 from the field, .269 from 3-point range, and 0.625 from the free throw line, playing an average of 36.4 minutes per game. In the 1993–94 season, Vin Baker played for Milwaukee in 82* games. He averaged 13.5 points, 7.6 rebounds, 2.0 assists, 0.7 steals, and 1.4 blocks per game. He shot 0.501 from the field, .200 from 3-point range, and 0.569 from the free throw line, playing an average of 31.2 minutes per game. In the 1994–95 season, Vin Baker played for Milwaukee in 82* games. He averaged 17.7 points, 10.3 rebounds, 3.6 assists, 1.0 steals, and 1.4 blocks per game. He shot 0.483 from the field, .292 from 3-point range, and 0.593 from the free throw line, playing an average of 41.0* minutes per game. In the 1995–96 season, Vin Baker played for Milwaukee in 82 games. He averaged 21.1 points, 9.9 rebounds, 2.6 assists, 0.8 steals, and 1.1 blocks per game. He shot 0.489 from the field, .208 from 3-point range, and 0.67 from the free throw line, playing an average of 40.5 minutes per game. In the 1996–97 season, Vin Baker played for Milwaukee in 78 games. He averaged 21.0 points, 10.3 rebounds, 2.7 assists, 1.0 steals, and 1.4 blocks per game. He shot 0.505 from the field, .278 from 3-point range, and 0.687 from the free throw line, playing an average of 40.5 minutes per game. In the 1997–98 season, Vin Baker played for Seattle in 82* games. He averaged 19.2 points, 8.0 rebounds, 1.9 assists, 1.1 steals, and 1.0 blocks per game. He shot 0.542 from the field, .143 from 3-point range, and 0.591 from the free throw line, playing an average of 35.9 minutes per game. In the 1998–99 season, Vin Baker played for Seattle in 34 games. He averaged 13.8 points, 6.2 rebounds, 1.6 assists, 0.9 steals, and 1.0 blocks per game. He shot 0.453 from the field, .000 from 3-point range, and 0.45 from the free throw line, playing an average of 34.2 minutes per game. In the 1999–2000 season, Vin Baker played for Seattle in 79 games. He averaged 16.6 points, 7.7 rebounds, 1.9 assists, 0.6 steals, and 0.8 blocks per game. He shot 0.455 from the field, .250 from 3-point range, and 0.682 from the free throw line, playing an average of 36.1 minutes per game. In the 2000–01 season, Vin Baker played for Seattle in 76 games. He averaged 12.2 points, 5.7 rebounds, 1.2 assists, 0.5 steals, and 1.0 blocks per game. He shot 0.422 from the field, .063 from 3-point range, and 0.723 from the free throw line, playing an average of 28.0 minutes per game. In the 2001–02 season, Vin Baker played for Seattle in 55 games. He averaged 14.1 points, 6.4 rebounds, 1.3 assists, 0.4 steals, and 0.7 blocks per game. He shot 0.485 from the field, .125 from 3-point range, and 0.633 from the free throw line, playing an average of 31.1 minutes per game. In the 2002–03 season, Vin Baker played for Boston in 52 games. He averaged 5.2 points, 3.8 rebounds, 0.6 assists, 0.4 steals, and 0.6 blocks per game. He shot 0.478 from the field, .000 from 3-point range, and 0.673 from the free throw line, playing an average of 18.1 minutes per game. In the 2003–04 season, Vin Baker played for Boston in 37 games. He averaged 11.3 points, 5.7 rebounds, 1.5 assists, 0.6 steals, and 0.6 blocks per game. He shot 0.505 from the field, .000 from 3-point range, and 0.732 from the free throw line, playing an average of 27.0 minutes per game. In the 2003–04 season, Vin Baker played for New York in 17 games. He averaged 6.6 points, 4.1 rebounds, 0.7 assists, 0.4 steals, and 0.5 blocks per game. He shot 0.404 from the field, .500 from 3-point range, and 0.711 from the free throw line, playing an average of 18.4 minutes per game. In the 2004–05 season, Vin Baker played for New York in 24 games. He averaged 1.4 points, 1.5 rebounds, 0.4 assists, 0.1 steals, and 0.2 blocks per game. He shot 0.342 from the field, .000 from 3-point range, and 0.467 from the free throw line, playing an average of 8.0 minutes per game. In the 2004–05 season, Vin Baker played for Houston in 3 games. He averaged 0.7 points, 0.7 rebounds, 0.3 assists, 0.0 steals, and 0.0 blocks per game. He shot 0.0 from the field, — from 3-point range, and 1.0 from the free throw line, playing an average of 4.3 minutes per game. In the 2005–06 season, Vin Baker played for L.A. Clippers in 8 games.', 'He currently serves as an assistant coach for the Milwaukee Bucks. Baker played for Old Saybrook High School in Old Saybrook, Connecticut. He first started on Old Saybrook\'s varsity in his junior year. Baker was passed over by the bigger Division I schools and signed a scholarship offer from the Hartford Hawks. During Baker\'s inaugural season in 1989, he averaged 4.7 points and 2.9 rebounds per game, which earned him a place on the North Atlantic Conference (now America East Conference) All-Rookie Team. Named a starter for his sophomore season, Baker averaged 19.7 PPG and 10.4 RPG and a first team All-NAC spot. As a Junior, Baker averaged 27.6 PPG (2nd in the country), 9.9 RPG, and 3.7 blocks per game (5th in the country), though the team finished with an abysmal 6–21 record. Entering his final season, Baker was called ""America\'s Best-Kept Secret"" by Sports Illustrated and the conference\'s most dominant player since Reggie Lewis by Street & Smith\'s College/Prep Basketball Preview in 1992. Baker averaged 28.3 PPG (4th in the country) and finished with 792 points in only 28 games, a conference record that still remains in the NAC. He finished with 2,238 points, a school record that still stands. However, Baker was not able to translate his immense scoring abilities into team success, as none of his teams ever made the NCAA tournament, and the best his Hartford teams ever finished in a season was .500 (14–14). Baker\'s jersey (#42) hangs on the east wall of Chase Arena in the Reich Family Pavilion. = After a college career at the University of Hartford, Baker was selected by the Milwaukee Bucks with the 8th pick of the 1993 NBA draft. He played four seasons in Milwaukee, during which he was the leading star (alongside Glenn Robinson) and received three all-star selections. On March 14, 1995, Baker recorded a triple double, with 12 points, 12 rebounds, and 12 assists, in a win against the Charlotte Hornets. On April 11, 1995, Baker scored 31 points, grabbed 12 rebounds, and recorded 9 assists in a 114–100 victory over the Detroit Pistons. During the 1995–96 and 1996–97 seasons, Baker averaged at least 21.0 points. On March 1, 1997, Baker recorded a career-high 6 blocks, alongside 20 points and 15 rebounds, in a 103–92 loss against the Sacramento Kings. Despite his personal success as a player while in Milwaukee, the Bucks were not able to make the postseason during his tenure with the team. = After four seasons with the Bucks, he was traded to the Seattle SuperSonics following the 1996–97 NBA season in a three-team deal that sent Tyrone Hill and Terrell Brandon to the Bucks, and Shawn Kemp and Sherman Douglas to the Cleveland Cavaliers. Baker helped the SuperSonics to a strong 1997-98 NBA season and a first round win over the Minnesota Timberwolves, while proving to be a valuable replacement for Kemp. On May 12, 1998, in a decisive Game 5 of a hard-fought Western Conference Semifinals against the Los Angeles Lakers (both teams finished the season with a 61–21 record, though Seattle had home-court advantage due to a tiebreaker), Baker led Seattle with 29 points and 9 rebounds in a losing effort. On February 1, 2000, Baker scored 33 points, recorded 5 assists, and 5 rebounds, in a 104–96 victory against Karl Malone and the Jazz. = After four years in Seattle, Baker was traded to the Boston Celtics with Shammond Williams for Kenny Anderson, Vitaly Potapenko and Joseph Forte. While his career averages include 15.1 points per game, his numbers had dropped considerably in the twenty-first century. After the 1998–99 NBA lockout season in Seattle, Baker\'s weight ballooned to near 300 pounds and his game suffered tremendously. While Baker was able to get his weight down to around 250, Baker revealed that he was a recovering alcoholic who used to binge in hotel rooms and at home after playing poorly. In an interview with the Boston Globe, Baker said Celtics coach Jim O\'Brien smelled alcohol on him in practice and confronted him about it. The team suspended him and he was eventually released. = Baker would sign with the New York Knicks. The team reached the playoffs in the 2003–04 NBA season. = Baker was traded to the Rockets with Moochie Norris for Maurice Taylor on February 24, 2005. = The Rockets would ultimately release Baker on October 7, 2005. He would spend the 2005–06 NBA season in a reserve role with the Los Angeles Clippers. Baker signed with the Minnesota Timberwolves on October 1, 2006, reuniting him with head coach Dwane Casey, who served as an assistant coach when Baker was in Seattle. His tenure in Minnesota would be short-lived, though. Baker was released from the Timberwolves on November 13, 2006. He never played in a regular season game after being on the inactive list for the first six games. = = Regular season Playoffs Baker has a non-profit foundation called the Stand Tall Foundation. The Stand Tall Foundation is an organization that helps give kids a better future by financially assisting with different charitable and volunteer organizations. The goal of the Stand Tall Foundation is to help young people with their education, personal development and general well-being. On June 3, 2011, Baker was hired as an assistant high school boys basketball coach at St.', 'He shot 0.467 from the field, — from 3-point range, and 0.722 from the free throw line, playing an average of 10.6 minutes per game. In the All-Star season, Vin Baker played for All-Star in 4 games. He averaged 8.7 points, 6.0 rebounds, 0.7 assists, 0.5 steals, and 0.2 blocks per game. He shot 0.419 from the field, .000 from 3-point range, and 0.75 from the free throw line, playing an average of 17.5 minutes per game. In the 1998 season, Vin Baker played for Seattle in 10 games. He averaged 15.8 points, 9.4 rebounds, 1.8 assists, 1.8 steals, and 1.5 blocks per game. He shot 0.53 from the field, — from 3-point range, and 0.421 from the free throw line, playing an average of 37.1 minutes per game. In the 2000 season, Vin Baker played for Seattle in 5 games. He averaged 14.0 points, 7.6 rebounds, 2.0 assists, 1.0 steals, and 0.4 blocks per game. He shot 0.4 from the field, .000 from 3-point range, and 0.588 from the free throw line, playing an average of 35.4 minutes per game. In the 2002 season, Vin Baker played for Seattle in 5 games. He averaged 13.2 points, 5.0 rebounds, 0.8 assists, 0.6 steals, and 1.2 blocks per game. He shot 0.5 from the field, 1.000 from 3-point range, and 0.778 from the free throw line, playing an average of 28.8 minutes per game. In the 2004 season, Vin Baker played for New York in 4 games. He averaged 5.5 points, 3.0 rebounds, 0.3 assists, 0.8 steals, and 0.5 blocks per game. He shot 0.571 from the field, — from 3-point range, and 0.667 from the free throw line, playing an average of 14.3 minutes per game.', 'Bernard School in Uncasville, Connecticut. In 2014, Baker was named to a team assembled by Dennis Rodman as part of his ""basketball diplomacy"" effort in North Korea; the team was assembled to play an exhibition game against the North Korean Senior National Team to celebrate the birthday of Kim Jong-un. As of December 2015, Baker was managing a Starbucks location in Old Saybrook, Connecticut. Baker later became Fox Sports Milwaukee\'s home team broadcaster. In 2017, Baker became the head of the basketball department at Camp Greylock. On July 18, 2020, The Vin Baker Foundation hosted a 5k run called ""Addiction Ends Here"". Since 2018, Baker has been serving as an assistant coach for the Milwaukee Bucks, helping them win a championship in 2021.', ""VanVleet was included in the Wooden Award Late season Top 20 Watch List on February 12. In the 2016 NCAA Division I men's basketball tournament, VanVleet led the team to victories over Vanderbilt and Arizona. Against Vanderbilt in the First Four round, he and fellow senior Ron Baker led an 11–0 run to break a 30–30 tie on March 15. The pair scored all 11 points in the run and tied with a game-high 14 points. On March 17, VanVleet and Baker led 11-seed Wichita State to a victory over #6 seed and AP poll 17th-ranked Arizona. VanVleet posted a game-high 16 points, five steals and four rebounds. With four steals in his final career game on March 19 against Miami, VanVleet brought his career total to 225, setting a school career record. For the season, he repeated as the MVC in assists per game (5.55) leader for a third time and led the conference in free throw percentage (81.7%). Following the regular season, VanVleet was named to the Missouri Valley Conference all-league first team (for the third consecutive season) and the MVC Larry Bird Trophy Player of the Year for the second time in three years. He was also an AP All-America honorable mention. = Early years (2016–2018) VanVleet was not selected in the 2016 NBA draft after declining two offers to agree to play in the NBA Development League at annual salaries of $20,000 for two years by teams interested in drafting him in the second round. VanVleet signed to play in the 2016 NBA Summer League with the Toronto Raptors with the expectation that he would be in the Raptors' training camp. His summer league contract had a guarantee of three game appearances. On July 18, VanVleet signed a multi-year deal with the Raptors. At the time of his signing, the Raptors had 14 players entering training camp on guaranteed contracts, including point guards Kyle Lowry, Cory Joseph and Delon Wright. VanVleet was competing with Brady Heslip, Drew Crawford, Yanick Moreira, E."", ""Ronnie Goodall Cavenall (born April 30, 1959) is an American retired basketball player. Cavenall played college basketball for Texas Southern University, and went undrafted in the 1981 NBA draft as a senior. After playing for the Sydney Supersonics in the Australian National Basketball League, Cavenall returned to America to play in the Continental Basketball Association with the Washington Generals, while also playing for the basketball show team Harlem Wizards. While playing for the Wizards, he caught the attention of Rick Pitino, who was then an assistant for the New York Knicks, who invited Cavenall to join the Knicks in the 1984 NBA Summer League. He made the team's final roster, playing in 53 games with 2 starts and averaging 1.8 points and 3.1 rebounds during 12.3 minutes of playing time in the 1984-85 NBA season. Cavenall was not resigned by the Knicks at the end of the season. He spent the following few years playing for three teams in the CBA, before receiving another call-up to the NBA to play for the New Jersey Nets in 1988. Cavenall only played five games for the team in limited minutes, and was waived in December of that year. He spent the rest of his career playing for various teams in the CBA, with his final season being in 1992–1993 with Columbus Horizon. Cavenall currently lives in Houston, Texas. = Career statistics from NBA.com · Basketball Reference\n\nIn the 1984–85 season, Ron Cavenall played for New York in 53 games. He averaged 1.5 points, 3.1 rebounds, 0.4 assists, 0.2 steals, and 0.8 blocks per game. He shot 0.326 from the field, 0.0 from 3-point range, and 0.564 from the free throw line, playing an average of 12.3 minutes per game. In the 1988–89 season, Ron Cavenall played for New Jersey in 5 games. He averaged 1.2 points, 0.4 rebounds, 0.0 assists, 0.0 steals, and 0.4 blocks per game."", ""He returned to the line-up on 6 February 2013, but after managing another 14 games, he was ruled out for the rest of the season on 13 March because of the same injury. = 2013–14 season On 10 July 2013, Bargnani was traded to the New York Knicks in exchange for Steve Novak, Marcus Camby and Quentin Richardson, along with a future first-round draft pick (2016) and two future second-round draft picks (2014 and 2017). On 18 December 2013, in a game at the Milwaukee Bucks, with 20 seconds remaining in overtime in which the Knicks held a two-point lead, Bargnani received an offensive rebound and, instead of dribbling out the clock or getting fouled to go to the free throw line, for reasons only known to him, shot a three-pointer that missed. The game went into double-overtime as a result, where the Knicks outscored the Bucks 13–7 to hold on for a 107–101 win. On 22 January 2014, in a loss to the Philadelphia 76ers, Bargnani suffered a torn ligament in his left elbow after a failed dunk attempt, and was ruled out indefinitely, eventually missing the rest of the regular season. The Knicks finished the season at 37–45 and missed the playoffs. 2014–15 season After missing most of the preseason with a hamstring injury, Bargnani was set to make his season debut on 22 November when he was ruled out indefinitely again with a strained calf muscle. He went on to make his season debut on 31 December against the Los Angeles Clippers after having not played for nearly a year. In just under 20 minutes of action off the bench, he recorded 9 points, 4 rebounds and 2 assists in the 78–99 loss. However, the following game on 2 January, Bargnani re-injured his right calf during the first quarter of the Knicks' 81–97 loss to the Detroit Pistons. He missed a further 16 games before making his second return of the season against Miami on 9 February. = On 17 July 2015, Bargnani signed with the Brooklyn Nets. He made his debut for the Nets in the team's season opener against the Chicago Bulls on 28 October, recording 17 points and 7 rebounds off the bench in a 115–100 loss. On 10 December, he scored a season-high 23 points in a 110–91 win over the Philadelphia 76ers."", '= VanVleet broke out as a sophomore, as expected. On January 23, 2014, he was selected to the 23-man Oscar Robertson Award midseason watchlist by the United States Basketball Writers Association. On February 17, Vanvleet was selected as one of 23 finalists for the Bob Cousy Award. When the Rockford native returned to the Chicago metropolitan area on February 19 to lead Wichita State against Loyola, he went 6-for-6 from the field and 10-for-10 on his free throw attempts for a game-high 22 points and added eight rebounds and 6 assists to help Wichita State raise its record to 28–0. The 28–0 Shockers (Cleanthony Early, Tekele Cotton, VanVleet, Ron Baker and Chadrack Lufile) appeared on the cover of the February 24, 2014 Sports Illustrated.', ""22 for the season's summer leagues, in Las Vegas, Nevada. On December 1, 2008, it was announced that Brewer had sustained an ACL tear and would miss the rest of the 2008–09 NBA season. = On February 22, 2011, Brewer was traded to the New York Knicks in a three-way blockbuster trade that also brought Carmelo Anthony from the Nuggets to New York. On March 1, 2011, he was waived by the Knicks without playing a game for them. On March 3, 2011, Brewer signed a three-year, $8 million contract with the Dallas Mavericks. He went on to win his first NBA Championship with the Mavericks when they defeated the Miami Heat in six games in the 2011 NBA Finals. = On December 13, 2011, Brewer and Rudy Fernández were traded to the Denver Nuggets for a future second-round pick and a traded player exception. = On July 12, 2013, Brewer signed a reported three-year, $15 million contract with the Minnesota Timberwolves, returning to the franchise for a second stint. On April 11, 2014, Brewer scored a career-high 51 points in a 112–110 win over the Houston Rockets. In doing so he joined Michael Jordan, Allen Iverson and Rick Barry as the only players to record 50-plus points and 6-plus steals in one game. He also tied Kevin Love's then-franchise record for most points in a game. = On December 19, 2014, Brewer was acquired by the Houston Rockets in a three-team trade that also involved the Timberwolves and the Philadelphia 76ers. Three days later, he made his debut for the Rockets against the Portland Trail Blazers. In just under 23 minutes of action off the bench, he recorded 12 points, 4 rebounds, 4 assists, 5 steals and 1 block in a 110–95 win. On February 21, 2015, he recorded season-highs of 26 points and 10 rebounds in a 98–76 win over the Toronto Raptors. During 2015 NBA Playoffs of the Semiconference finals, Brewer score 19 points, grab 10 rebounds and 2 assist off the bench leading the Rockets to decisive victory over Clippers in game 6 that ultimately came back with a 3–1 deflict and head to the Western Conference Finals. On July 14, 2015, Brewer re-signed with the Rockets to a three-year, $23.4 million contract. On January 22, 2016, he picked up the team's starting small forward role. On February 4, in his ninth start of the season, Brewer scored a season-high 24 points in a 111–105 win over the Phoenix Suns. = On February 23, 2017, Brewer was traded, along with a 2017 first round draft pick, to the Los Angeles Lakers in exchange for Lou Williams. On February 28, 2018, he was waived by the Lakers after reaching a buyout agreement. = On March 3, 2018, Brewer signed with the Oklahoma City Thunder. The signing reunited Brewer with his former college coach Billy Donovan. On March 16, 2018, he scored 22 points and matched a career high with six steals in a 121–113 win over the Los Angeles Clippers. = On January 15, 2019, Brewer signed a 10-day contract with the Philadelphia 76ers. On January 25, he signed a second 10-day contract with the 76ers. Following the expiration of his second 10-day contract, the 76ers parted ways with Brewer, deciding not to sign him for the rest of the season. = On February 8, 2019, Brewer signed a 10-day contract with the Sacramento Kings. He went on to sign a second 10-day contract on February 18, and a rest-of-season contract on February 28. After spending the whole of the 2019–20 NBA season (before it was suspended) as a free agent, Brewer re-signed with the Kings on June 23, 2020, prior to the planned resumption of the season. On November 16, 2020, the New Orleans Pelicans announced that they had hired Brewer as a player development coach, at the same time announcing his retirement from the NBA. On September 27, 2024, Brewer was promoted to assistant coach by the Pelicans. = = List of Florida Gators in the NBA Career statistics from NBA.com · Basketball Reference Brewer's official website Florida Gators bio\n\nIn the 2007–08 season, Corey Brewer played for Minnesota in 79 games. He averaged 5.8 points, 3.7 rebounds, 1.4 assists, 1.0 steals, and .3 blocks per game. He shot 0.374 from the field, 0.194 from 3-point range, and 0.8 from the free throw line, playing an average of 22.8 minutes per game. In the 2008–09 season, Corey Brewer played for Minnesota in 15 games. He averaged 6.2 points, 3.3 rebounds, 1.7 assists, 1.0 steals, and .2 blocks per game. He shot 0.411 from the field, 0.417 from 3-point range, and 0.737 from the free throw line, playing an average of 20.5 minutes per game. In the 2009–10 season, Corey Brewer played for Minnesota in 82* games. He averaged 13.0 points, 3.4 rebounds, 2.4 assists, 1.4 steals, and .4 blocks per game. He shot 0.431 from the field, 0.346 from 3-point range, and 0.648 from the free throw line, playing an average of 30.3 minutes per game. In the 2010–11 season, Corey Brewer played for Minnesota in 56 games. He averaged 8.6 points, 2.7 rebounds, 1.4 assists, 1.6 steals, and .2 blocks per game. He shot 0.384 from the field, 0.263 from 3-point range, and 0.708 from the free throw line, playing an average of 24.3 minutes per game. In the 2010–11† season, Corey Brewer played for Dallas in 13 games. He averaged 5.3 points, 1.8 rebounds, 0.9 assists, 0.8 steals, and .2 blocks per game. He shot 0.49 from the field, 0.308 from 3-point range, and 0.714 from the free throw line, playing an average of 11.4 minutes per game. In the 2011–12 season, Corey Brewer played for Denver in 59 games. He averaged 8.9 points, 2.5 rebounds, 1.5 assists, 1.2 steals, and .3 blocks per game. He shot 0.434 from the field, 0.26 from 3-point range, and 0.692 from the free throw line, playing an average of 21.8 minutes per game. In the 2012–13 season, Corey Brewer played for Denver in 82* games. He averaged 12.1 points, 2.9 rebounds, 1.5 assists, 1.4 steals, and .3 blocks per game. He shot 0.425 from the field, 0.296 from 3-point range, and 0.69 from the free throw line, playing an average of 24.4 minutes per game. In the 2013–14 season, Corey Brewer played for Minnesota in 81 games. He averaged 12.3 points, 2.6 rebounds, 1.7 assists, 1.9 steals, and .4 blocks per game. He shot 0.481 from the field, 0.28 from 3-point range, and 0.718 from the free throw line, playing an average of 32.2 minutes per game. In the 2014–15 season, Corey Brewer played for Minnesota in 24 games. He averaged 10.5 points, 3.9 rebounds, 3.3 assists, 2.3 steals, and .2 blocks per game. He shot 0.418 from the field, 0.195 from 3-point range, and 0.705 from the free throw line, playing an average of 28.3 minutes per game. In the 2014–15 season, Corey Brewer played for Houston in 56 games. He averaged 11.9 points, 3.6 rebounds, 1.7 assists, 1.1 steals, and .3 blocks per game. He shot 0.429 from the field, 0.284 from 3-point range, and 0.764 from the free throw line, playing an average of 25.1 minutes per game. In the 2015–16 season, Corey Brewer played for Houston in 82* games. He averaged 7.2 points, 2.4 rebounds, 1.3 assists, 1.0 steals, and .2 blocks per game. He shot 0.384 from the field, 0.272 from 3-point range, and 0.75 from the free throw line, playing an average of 20.4 minutes per game. In the 2016–17 season, Corey Brewer played for Houston in 58* games. He averaged 4.2 points, 2.0 rebounds, 1.1 assists, 0.6 steals, and .2 blocks per game. He shot 0.414 from the field, 0.234 from 3-point range, and 0.727 from the free throw line, playing an average of 15.9 minutes per game. In the 2016–17 season, Corey Brewer played for L.A. Lakers in 24* games."", 'New York Basketball.']","In the 2016–17 season, Ron Baker played for New York in 52 games.",Ron Baker played in 52 games for New York in the 2016-17 season.,,0.9853557071079382,0.8761904761729523,1.0,0.6175600001091766,0.9702400004367064
