user_input,retrieved_contexts,response,reference,faithfulness,answer_relevancy,context_precision,context_recall,answer_correctness,semantic_similarity
How many 3-pointers did Kemba Walker make in the 2018-2019 NBA season?,"[""Augustin, he became their starting point guard for the lockout-shortened season. Walker participated in the 2012 Rising Stars Challenge during All-Star Weekend. However, the Charlotte Bobcats only managed to go 7–59 in the lockout season. 2012–13 season: Sophomore season On November 14, 2012, Walker hit the first game-winner of his NBA career against the Minnesota Timberwolves. He finished the game with 22 points on 9-of-19 shooting, as well as 5 rebounds, 4 assists and 4 steals. On January 21, 2013, he scored a then career-high 35 points against the Houston Rockets. During the 2012–13 season, Walker was selected with teammate Michael Kidd-Gilchrist to the 2013 Rising Stars Challenge in which they both scored 8 points. Kemba finished the 2012–13 season with averages of 17.7 points, 5.8 assists, 3.5 rebounds, and 1 steal per contest. He took significant strides over his rookie year. 2013–14 season: First playoff appearance On December 18, 2013, Walker hit a buzzer-beating jump shot over Jonas Valančiūnas in overtime to beat the Toronto Raptors. He finished the night with 26 points and 5 rebounds on 10/18 shooting from the field. On February 19, 2014, Walker recorded 23 points, 5 rebounds and a career-high 16 assists in a 116–98 win over the Detroit Pistons. Five days later, he was awarded the Eastern Conference Player of the Week, having averaged 22.5 points, 8.8 assists, and 5.5 rebounds in the span of seven days. In a home victory over the Orlando Magic on April 4, 2014, Walker recorded his second career triple-double with 13 points, 10 assists, and 10 rebounds. Playing against the Miami Heat in the first round of the Eastern Conference Playoffs and with teammate Al Jefferson unable to play due to a Plantar fasciitis injury, Walker had an exceptional game four: he finished the game with a playoff franchise-high 29 points, along with 5 assists, 5 rebounds, 3 blocks, and 2 steals. The effort came in a loss as the Heat completed a four-game sweep of the Bobcats. 2014–15 season: Knee surgery In the newly renamed Charlotte Hornets' opening game against the Milwaukee Bucks on October 29, Walker led an impressive comeback in an overtime 108–106 victory. The Hornets had been 24 points down by the fourth quarter when they staged a comeback; Walker scored a three-pointer with 1.6 seconds left to force overtime and later hit the shot that clinched the game as well. He finished with 26 points, 5 assists, and 6 rebounds. The following day, he signed a four-year, $48 million contract extension with the Hornets. On December 5, 2014, Walker hit his second game-winner of the season in a 103–102 win over the New York Knicks. On December 27, in a 94–102 loss to the Orlando Magic, he scored a then career-high 42 points and set a Charlotte Hornets franchise record for most points scored in a half with his 35 points that he posted in the second. On January 3, against the Orlando Magic, Walker scored 30 points to pass Kendall Gill for 10th place on the Charlotte Hornets all-time scoring list with 4,160 points. In three back-to-back games played between the January 3 and 7, Walker scored 30, 33, and 31 points in victories over the Orlando Magic, the Boston Celtics, and the New Orleans Pelicans respectively; he thereby joined Larry Johnson, Glen Rice, and Kelly Tripucka as one of four players in Charlotte Hornets' franchise history to have three or more consecutive games of scoring 30-plus points. Walker also hit his fifth game-winner of his career and his third of the season on January 7 in the 98–94 victory over the Pelicans. On January 12, he was named the Eastern Conference Player of the Week for games played Monday, January 5, through Sunday, January 11. Over the week, he led the Hornets to a 4–0 record and averaged 30.3 points, 5.8 rebounds, and 4.5 assists in 36.2 minutes, while shooting .500 from the field (44–88), .364 from beyond the three-point line (8–22) and .893 from the free-throw line (25–28). On January 28, 2015, Walker was ruled out for six weeks after he underwent successful surgery to repair a torn lateral meniscus in his left knee. He returned to action on March 11, after missing 18 games, to score six points in 16 minutes off the bench as the Hornets lost to the Sacramento Kings 106–113. 2015–16 season: Breakthrough On November 23, 2015, Walker scored a then season-high 39 points in a 127–122 overtime win over the Sacramento Kings. On January 18, 2016, Walker set a career-high and a franchise-record with 52 points in a 124–119 double overtime win over the Utah Jazz. He made 16-of-34 from the field, including 6-of-11 three-pointers, and was 14-of-15 from the free throw line, breaking the team mark of 48 points set by Glen Rice in March 1997. On March 9, in a win over the New Orleans Pelicans, Walker became just the third Hornets player to make 500 career three-pointers, joining Dell Curry (929) and Glen Rice (508). Five days later, he earned his fourth career Player of the Week award, and second of the 2015–16 season (first coming on January 25), becoming just the sixth Charlotte player to win the award multiple times in the same season. The Hornets finished the regular season as the sixth seed in the Eastern Conference with a 48–34 record. In the first round of the playoffs, the Hornets faced the third-seeded Miami Heat, and in a Game 4 win on April 25, Walker scored a playoff career-high 34 points, helping the Hornets tie the series at 2–2. He topped that mark in Game 6 of the series, scoring 37 points in a 97–90 loss, as the Heat tied the series at 3–3. The Hornets went on to lose Game 7, bowing out of the playoffs with a 4–3 defeat. In May 2016, Walker again underwent surgery on a torn meniscus in his left knee. 2016–17 season: First All-Star selection On November 4, 2016, Walker scored a season-high 30 points in a 99–95 win over the Brooklyn Nets, helping Charlotte improve to 4–1 for the first time since 2000. He topped that mark on November 11, recording 40 points, 10 rebounds and six assists in a 113–111 loss to the Toronto Raptors. On December 29, with 22 points against the Miami Heat, Walker recorded his 7,000th point with the Charlotte franchise when he hit a three-pointer with 4:16 left in the first quarter. He became the fourth player in franchise history to reach that mark, and became the second-quickest by doing so in his 396th game—Larry Johnson passed the mark in his 355th career game with the Hornets. On January 2, 2017, Walker recorded 34 points and a season-high 11 rebounds in a 118–111 loss to the Chicago Bulls. On January 26, he was named an Eastern Conference All-Star reserve for the 2017 NBA All-Star Game. Two days later, in a loss to the Sacramento Kings, Walker moved into third place in franchise history in field goals made (2,586), passing Gerald Wallace. On January 31, he scored 22 points against the Portland Trail Blazers and moved into third place on the team's career scoring list. On March 6, he was named Eastern Conference Player of the Week for games played Monday, February 27 through Sunday, March 5. On March 31, 2017, he scored a game-high 31 points in a 122–114 win over the Denver Nuggets. During the game, Walker became the second player in team history to reach 8,000 career points—the only other player to reach that mark is Dell Curry (9,839). In May 2017, Walker underwent an arthroscopic procedure on his left knee. 2017–18 season: 2nd Sportsmanship Award On December 4, Walker scored 29 points and made all 14 free throw attempts (tying a career-high) in a 104–94 win over the Orlando Magic, becoming the first player in franchise history with 200 career 20-point games. On January 10, 2018, he had 41 points on 16-of-28 shooting in a 115–111 loss to the Dallas Mavericks. On January 15, he scored 20 points in a 118–107 win over the Detroit Pistons, thus reaching 9,000 career points. On January 24, in a 101–96 loss to the New Orleans Pelicans, Walker became only the second Hornets' player with 900 career 3-pointers, joining Dell Curry (929). On January 31, he set franchise and career-highs with nine 3-pointers and scored 38 points in a 123–110 win over the Atlanta Hawks. On February 4, in a 115–110 win over the Phoenix Suns, Walker scored 18 points and broke the franchise career record for 3-pointers with 930, surpassing the record of 929 held by Dell Curry. On February 8, Walker was named as the replacement for the injured Kristaps Porziņģis in the 2018 NBA All-Star Game, marking his second consecutive All-Star selection. On March 22, Walker scored 46 points with 10 3-pointers in a 140–79 win over the Memphis Grizzlies. It was his ninth 40-point game of his career and third-highest scoring game of his career, as he helped the Hornets record the sixth-largest win in NBA history. On March 28, he scored 21 points in a 118–105 loss to the Cleveland Cavaliers, surpassing Dell Curry (9,839 points) to become the franchise's career scoring leader. Walker also established a new team record with his 44th consecutive made free throw. That free throw also brought his career total to 1,999, which broke Gerald Wallace's franchise record of 1,998. 2018–19 season: All-NBA selection and final season with the Hornets On October 17, 2018, Walker scored 41 points in a 113–112 loss to the Milwaukee Bucks, setting a franchise record for points scored in a season opener. It was his 10th 40-point game of his career, tying Glen Rice for the franchise record for 40-point games. Three days later, he scored 39 points, including the game-winning free throw with a half-second left, to lift the Hornets to a 113–112 win over the Miami Heat. During the game, he eclipsed the career 10,000-point mark. Walker set the NBA record for most three-point field goals through the first three games of a season with 19 (previously held by Danilo Gallinari with 18 in 2009–10) and became the first player in NBA history to make five or more three-point field goals in each of the first three games of a season. He was subsequently named Eastern Conference Player of the Week for the first week of the season."", 'He subsequently signed with Jordan Brand, a subsidiary of Nike. List of National Basketball Association franchise career scoring leaders List of National Basketball Association single-game scoring leaders Career statistics from NBA.com · Basketball Reference UConn Huskies bio\n\nIn the 2011–12 season, Kemba Walker played for Charlotte in 66* games. He averaged 12.1 points, 3.5 rebounds, 4.4 assists, 0.9 steals, and 0.3 blocks per game. He shot 0.366 from the field, 0.305 from 3-point range, and .789 from the free throw line, playing an average of 27.2 minutes per game. In the 2012–13 season, Kemba Walker played for Charlotte in 82* games. He averaged 17.7 points, 3.5 rebounds, 5.7 assists, 2.0 steals, and 0.4 blocks per game. He shot 0.423 from the field, 0.322 from 3-point range, and .798 from the free throw line, playing an average of 34.9 minutes per game. In the 2013–14 season, Kemba Walker played for Charlotte in 73 games. He averaged 17.7 points, 4.2 rebounds, 6.1 assists, 1.2 steals, and 0.4 blocks per game. He shot 0.393 from the field, 0.333 from 3-point range, and .837 from the free throw line, playing an average of 35.8 minutes per game. In the 2014–15 season, Kemba Walker played for Charlotte in 62 games. He averaged 17.3 points, 3.5 rebounds, 5.1 assists, 1.4 steals, and 0.5 blocks per game. He shot 0.385 from the field, 0.304 from 3-point range, and .827 from the free throw line, playing an average of 34.2 minutes per game. In the 2015–16 season, Kemba Walker played for Charlotte in 81 games. He averaged 20.9 points, 4.4 rebounds, 5.2 assists, 1.6 steals, and 0.5 blocks per game. He shot 0.427 from the field, 0.371 from 3-point range, and .847 from the free throw line, playing an average of 35.6 minutes per game. In the 2016–17 season, Kemba Walker played for Charlotte in 79 games. He averaged 23.2 points, 3.9 rebounds, 5.5 assists, 1.1 steals, and 0.3 blocks per game. He shot 0.443 from the field, 0.399 from 3-point range, and .847 from the free throw line, playing an average of 34.7 minutes per game. In the 2017–18 season, Kemba Walker played for Charlotte in 80 games. He averaged 22.1 points, 3.1 rebounds, 5.6 assists, 1.1 steals, and 0.3 blocks per game. He shot 0.431 from the field, 0.384 from 3-point range, and .864 from the free throw line, playing an average of 34.2 minutes per game. In the 2018–19 season, Kemba Walker played for Charlotte in 82* games. He averaged 25.6 points, 4.4 rebounds, 5.9 assists, 1.2 steals, and 0.4 blocks per game. He shot 0.434 from the field, 0.356 from 3-point range, and .844 from the free throw line, playing an average of 34.9 minutes per game. In the 2019–20 season, Kemba Walker played for Boston in 56 games. He averaged 20.4 points, 3.9 rebounds, 4.8 assists, 0.9 steals, and 0.5 blocks per game. He shot 0.425 from the field, 0.381 from 3-point range, and .864 from the free throw line, playing an average of 31.1 minutes per game. In the 2020–21 season, Kemba Walker played for Boston in 43 games. He averaged 19.3 points, 4.0 rebounds, 4.9 assists, 1.1 steals, and 0.3 blocks per game. He shot 0.42 from the field, 0.36 from 3-point range, and .899 from the free throw line, playing an average of 31.8 minutes per game. In the 2021–22 season, Kemba Walker played for New York in 37 games. He averaged 11.6 points, 3.0 rebounds, 3.5 assists, 0.7 steals, and 0.2 blocks per game. He shot 0.403 from the field, 0.367 from 3-point range, and .845 from the free throw line, playing an average of 25.6 minutes per game. In the 2022–23 season, Kemba Walker played for Dallas in 9 games. He averaged 8.0 points, 1.8 rebounds, 2.1 assists, 0.2 steals, and 0.2 blocks per game. He shot 0.421 from the field, 0.25 from 3-point range, and .810 from the free throw line, playing an average of 16.0 minutes per game. In the All-Star season, Kemba Walker played for All-Star in 4 games. He averaged 11.3 points, 2.3 rebounds, 4.5 assists, 0.8 steals, and 0.0 blocks per game. He shot 0.452 from the field, 0.28 from 3-point range, and — from the free throw line, playing an average of 21.0 minutes per game. In the 2014 season, Kemba Walker played for Charlotte in 4 games. He averaged 19.5 points, 3.8 rebounds, 6.0 assists, 2.0 steals, and 0.8 blocks per game. He shot 0.473 from the field, 0.5 from 3-point range, and 0.778 from the free throw line, playing an average of 38.3 minutes per game. In the 2016 season, Kemba Walker played for Charlotte in 7 games. He averaged 22.7 points, 3.0 rebounds, 4.0 assists, 1.3 steals, and 0.6 blocks per game. He shot 0.366 from the field, 0.326 from 3-point range, and 0.943 from the free throw line, playing an average of 37.1 minutes per game. In the 2020 season, Kemba Walker played for Boston in 17 games. He averaged 19.6 points, 4.1 rebounds, 5.1 assists, 0.9 steals, and 0.4 blocks per game. He shot 0.441 from the field, 0.31 from 3-point range, and 0.852 from the free throw line, playing an average of 36.9 minutes per game. In the 2021 season, Kemba Walker played for Boston in 3 games. He averaged 12.7 points, 4.0 rebounds, 4.0 assists, 0.3 steals, and 0.0 blocks per game. He shot 0.317 from the field, 0.176 from 3-point range, and 0.9 from the free throw line, playing an average of 30.3 minutes per game. In the 2023–24 season, Kemba Walker played for Monaco in 26 games. He averaged 4.4 points, 1.4 rebounds, 1.1 assists, 0.4 steals, and 0.0 blocks per game. He shot 0.389 from the field, 0.364 from 3-point range, and 0.778 from the free throw line, playing an average of 11.0 minutes per game. In the 2008–09 season, Kemba Walker played for Connecticut in 36 games. He averaged 8.9 points, 3.5 rebounds, 2.9 assists, 1.1 steals, and 0.2 blocks per game. He shot 0.47 from the field, 0.271 from 3-point range, and 0.715 from the free throw line, playing an average of 25.2 minutes per game. In the 2009–10 season, Kemba Walker played for Connecticut in 34 games. He averaged 14.6 points, 4.3 rebounds, 5.0 assists, 2.0 steals, and 0.4 blocks per game. He shot 0.405 from the field, 0.339 from 3-point range, and 0.767 from the free throw line, playing an average of 35.2 minutes per game. In the 2010–11 season, Kemba Walker played for Connecticut in 41 games. He averaged 23.5 points, 5.4 rebounds, 4.5 assists, 1.9 steals, and 0.2 blocks per game.', 'He led the league in three-pointers made, and ranked among NBA leaders in attempts (third) and percentage (18th, .405).', 'On November 17, he scored a career-high and franchise-best 60 points in a 122–119 overtime loss to the Philadelphia 76ers. On December 5 against the Minnesota Timberwolves, Walker made his 502nd career start for Charlotte, the most of any player in team history, passing Muggsy Bogues (501). On January 24, Walker was named a starter for the Eastern Conference in the 2019 NBA All-Star Game, joining Glen Rice as the only players to represent Charlotte in three All-Star Games. Walker also became the third Hornets player to start an All-Star Game, along with Larry Johnson (1993) and Eddie Jones (2000). On February 6, he had 30 points and a season-high 11 rebounds in a 99–93 loss to the Dallas Mavericks. On February 9, he hit a season-high nine 3-pointers and scored 37 points in a 129–120 win over the Atlanta Hawks. With 32 points, seven assists and three rebounds against the New Orleans Pelicans on April 3, Walker recorded his 26th 30-point game of the season, passing Glen Rice for the franchise record for 30-point games in a season. He also set the franchise record for 3-pointers made in a season when he made his 244th 3-pointer against New Orleans. On April 5, he scored 29 points in a 113–111 win over the Toronto Raptors, thus joining Glen Rice as the only players in franchise history to score 2,000 points in a season—Rice scored 2,115 points in the 1996–97 season. With his 250th made 3-pointer on April 7 against the Detroit Pistons, Walker became only the ninth different player in NBA history to connect on 250+ 3-pointers in a season. He was subsequently named Eastern Conference Player of the Week for games played April 1–7, marking his seventh career player of the week award.', ""Following the season, he was named to the All-NBA Third Team, his first all-league selection. = Coming off a frustrating 2018–19 season, the Boston Celtics would go on to lose franchise centerpieces Kyrie Irving and Al Horford to free agency, opening the door to start a new chapter with a new max-salary player. After Walker and the Celtics showed mutual interest at the start of free agency, he officially joined the franchise on July 6, 2019, through a sign and trade deal with Charlotte worth $141 million over four years. Walker chose to wear Kobe Bryant’s number 8 with the Celtics as his usual number 15 had been retired by the Celtics in honor of Tom Heinsohn. Walker made his Celtics debut on October 23, 2019, against the Philadelphia 76ers; he put up 12 points on 18 shot attempts from the field in 34 minutes of play during the 107–93 loss. On November 22, during a game against the Nuggets, Walker went down with a neck injury after colliding with teammate Semi Ojeleye. He was taken off the court on a stretcher. He was first diagnosed with concussion-like symptoms, and then later diagnosed with a sprained neck. On November 27, Walker scored a then season-high 39 points in a 121–110 win over the Brooklyn Nets. That season-high would be eclipsed on December 11, when Walker scored 44 points in 122–117 loss to the Indiana Pacers. On January 16, 2020, Walker would post a 40-point, 11 assist double-double in a 128–123 loss to the Milwaukee Bucks. On January 20, Walker recorded his first head-to-head win against LeBron James, after having begun his career 0–28 against him. Posting 20 points, seven assists, four rebounds, and a steal, he helped the Celtics come away with a 139–107 blowout victory over longtime rivals the Lakers. Three days later, Walker was named to his fourth consecutive All-Star Game, being selected as an Eastern Conference starter. The 2019–2020 season was suspended due to the COVID-19 pandemic. After the season resumed, Walker helped the Celtics reach the Eastern Conference Finals, where the team was defeated by the Miami Heat. Walker missed several games during the season due to knee soreness. In December 2020, the Celtics confirmed that Walker had received a stem cell injection in his left knee in October and had been placed on 12 week strengthening program, sidelining him for the start of the 2020–21 NBA season. Walker made his season debut on January 17, 2021. In the 2021 playoffs, Walker missed games four and five of Boston's first-round playoff series against the Brooklyn Nets due to a bone bruise in his left knee. The Celtics lost the series in five games. = On June 18, 2021, Walker was traded to the Oklahoma City Thunder, along with a 2021 first-round draft pick (16th selection), and a 2025 second round draft pick from the Boston Celtics in exchange for Al Horford, Moses Brown, and a 2023 second-round draft pick. Walker reached a contract buyout agreement with the Thunder on August 6, 2021. On August 11, he signed a two-year, $17.9 million contract with the New York Knicks, his hometown team. On October 20, Walker made his Knicks debut, recording 10 points and eight assists in a 138–134 double overtime victory over the Boston Celtics. On November 29, 2021, Walker was removed from the Knicks' rotation in favor of Alec Burks. He sat for 10 games before re-entering the rotation on December 18 after guard Derrick Rose was injured. On December 23, Walker scored a season-high 44 points, alongside nine rebounds and eight assists, in a 124–117 loss to the Washington Wizards. On December 25, in the Knicks' 101–87 win against the Atlanta Hawks, Walker recorded a triple-double with 10 points, 10 rebounds and 12 assists and became the seventh player in NBA history to record a triple-double in an NBA Christmas Day game. Walker missed games in January 2022 due to knee problems."", ""Wiggins, Stephen Curry and Klay Thompson combined for 23 made three-pointers, the most three-pointers made in a game by a trio in NBA history. On December 3, Wiggins scored a season-best 36 points and matched his career high with 8-of-10 shooting from three-point range in a 120–103 win over the Houston Rockets. In the 2023 NBA playoffs, the Warriors were eliminated in the Conference Semifinals by the Los Angeles Lakers. On March 24, 2024, Wiggins became the first NBA player born in Canada to reach 1,000 career threes made. = On February 6, 2025, Wiggins was traded to the Miami Heat in a five-team trade, including Jimmy Butler to the Warriors. On March 23, Wiggins had the second-highest scoring game of his career with 42 points in a 122–105 win over the Charlotte Hornets. Wiggins participated in the 2010 FIBA Under-17 World Championship and 2012 FIBA Americas Under-18 Championship, helping the Canadian junior national team win a bronze medal in each tournament. During the 2010 tournament, Wiggins was a teammate of Anthony Bennett, the number one overall pick in the 2013 NBA draft and his former teammate on the Timberwolves. In the 2012 tournament, he led the team in scoring with 15.2 ppg, along with 7.6 rpg. On August 20, 2015, Wiggins was named to the Canadian national team roster for the 2015 FIBA Americas Championship, a qualifying tournament for the 2016 Summer Olympics. Wiggins helped Canada win the bronze medal; he led the team in scoring, with 15.1 points per game, and he was named to the All-Tournament Team. Wiggins rejoined the team for the 2020 FIBA Men's Olympic Qualifying Tournament, averaging 21.7 points, 6.0 rebounds and 2.3 assists per game in three contests. = Regular season Playoffs = Wiggins has two children named Amyah and Alayah. Wiggins has five siblings: sisters Stephanie, Angelica and Taya; and brothers Nick and Mitchell Jr. His middle brother, Nick, played college basketball at Vincennes University, Wabash Valley College and Wichita State University, and his oldest brother, Mitchell Jr., played at Hillsborough Community College and Southeastern University. List of Canadians in the NBA List of second-generation NBA players Career statistics from NBA.com · Basketball Reference Kansas Jayhawks bio\n\nIn the 2014–15 season, Andrew Wiggins played for Minnesota in 82 games. He averaged 16.9 points, 4.6 rebounds, 2.1 assists, 1.0 steals, and 0.6 blocks per game. He shot 0.437 from the field, 0.31 from 3-point range, and .760 from the free throw line, playing an average of 36.2 minutes per game. In the 2015–16 season, Andrew Wiggins played for Minnesota in 81 games. He averaged 20.7 points, 3.6 rebounds, 2.0 assists, 1.0 steals, and 0.6 blocks per game. He shot 0.459 from the field, 0.3 from 3-point range, and .761 from the free throw line, playing an average of 35.1 minutes per game. In the 2016–17 season, Andrew Wiggins played for Minnesota in 82* games. He averaged 23.6 points, 4.0 rebounds, 2.3 assists, 1.0 steals, and 0.4 blocks per game. He shot 0.452 from the field, 0.356 from 3-point range, and .760 from the free throw line, playing an average of 37.2 minutes per game. In the 2017–18 season, Andrew Wiggins played for Minnesota in 82* games. He averaged 17.7 points, 4.4 rebounds, 2.0 assists, 1.1 steals, and 0.6 blocks per game. He shot 0.438 from the field, 0.331 from 3-point range, and .643 from the free throw line, playing an average of 36.3 minutes per game. In the 2018–19 season, Andrew Wiggins played for Minnesota in 73 games. He averaged 18.1 points, 4.8 rebounds, 2.5 assists, 1.0 steals, and 0.7 blocks per game. He shot 0.412 from the field, 0.339 from 3-point range, and .699 from the free throw line, playing an average of 34.8 minutes per game. In the 2019–20 season, Andrew Wiggins played for Minnesota in 42 games. He averaged 22.4 points, 5.2 rebounds, 3.7 assists, 0.7 steals, and 0.9 blocks per game. He shot 0.444 from the field, 0.331 from 3-point range, and .720 from the free throw line, playing an average of 34.7 minutes per game. In the 2019–20 season, Andrew Wiggins played for Golden State in 12 games. He averaged 19.4 points, 4.6 rebounds, 3.6 assists, 1.3 steals, and 1.4 blocks per game. He shot 0.457 from the field, 0.339 from 3-point range, and .672 from the free throw line, playing an average of 33.6 minutes per game. In the 2020–21 season, Andrew Wiggins played for Golden State in 71 games. He averaged 18.6 points, 4.9 rebounds, 2.4 assists, 0.9 steals, and 1.0 blocks per game. He shot 0.477 from the field, 0.38 from 3-point range, and .714 from the free throw line, playing an average of 33.3 minutes per game. In the 2021–22† season, Andrew Wiggins played for Golden State in 73 games. He averaged 17.2 points, 4.5 rebounds, 2.2 assists, 1.0 steals, and 0.7 blocks per game. He shot 0.466 from the field, 0.393 from 3-point range, and .634 from the free throw line, playing an average of 31.9 minutes per game. In the 2022–23 season, Andrew Wiggins played for Golden State in 37 games. He averaged 17.1 points, 5.0 rebounds, 2.3 assists, 1.2 steals, and 0.8 blocks per game. He shot 0.473 from the field, 0.396 from 3-point range, and .611 from the free throw line, playing an average of 32.2 minutes per game. In the 2023–24 season, Andrew Wiggins played for Golden State in 71 games. He averaged 13.2 points, 4.5 rebounds, 1.7 assists, 0.6 steals, and 0.6 blocks per game. He shot 0.453 from the field, 0.358 from 3-point range, and .751 from the free throw line, playing an average of 27.0 minutes per game. In the 2024–25 season, Andrew Wiggins played for Golden State in 43 games. He averaged 17.6 points, 4.6 rebounds, 2.4 assists, 0.9 steals, and 0.8 blocks per game. He shot 0.444 from the field, 0.379 from 3-point range, and .777 from the free throw line, playing an average of 30.1 minutes per game. In the 2024–25 season, Andrew Wiggins played for Miami in 17 games. He averaged 19.0 points, 4.2 rebounds, 3.3 assists, 1.2 steals, and 1.0 blocks per game. He shot 0.458 from the field, 0.36 from 3-point range, and .731 from the free throw line, playing an average of 32.1 minutes per game. In the All-Star season, Andrew Wiggins played for All-Star in 1 games. He averaged 10.0 points, 0.0 rebounds, 1.0 assists, 0.0 steals, and 0.0 blocks per game. He shot 0.571 from the field, 0.5 from 3-point range, and — from the free throw line, playing an average of 15.3 minutes per game. In the 2018 season, Andrew Wiggins played for Minnesota in 5 games. He averaged 15.8 points, 5.2 rebounds, 2.0 assists, 0.4 steals, and 0.4 blocks per game. He shot 0.441 from the field, 0.333 from 3-point range, and 0.6 from the free throw line, playing an average of 32.8 minutes per game. In the 2022† season, Andrew Wiggins played for Golden State in 22 games. He averaged 16.5 points, 7.5 rebounds, 1.8 assists, 1.0 steals, and 1.0 blocks per game. He shot 0.469 from the field, 0.333 from 3-point range, and 0.646 from the free throw line, playing an average of 34.9 minutes per game. In the 2023 season, Andrew Wiggins played for Golden State in 13 games. He averaged 16.7 points, 5.6 rebounds, 1.9 assists, 0.8 steals, and 1.2 blocks per game. He shot 0.459 from the field, 0.297 from 3-point range, and 0.681 from the free throw line, playing an average of 34.0 minutes per game. In the 2025 season, Andrew Wiggins played for Miami in 4 games. He averaged 11.5 points, 3.3 rebounds, 2.3 assists, 0.3 steals, and 1.3 blocks per game. He shot 0.372 from the field, 0.35 from 3-point range, and 0.7 from the free throw line, playing an average of 30.5 minutes per game. In the 2013–14 season, Andrew Wiggins played for Kansas in 35 games. He averaged 17.1 points, 5.9 rebounds, 1.5 assists, 1.2 steals, and 1.0 blocks per game."", ""On February 7, Matthews was waived by the Knicks after appearing in just two games for the team. = On February 10, 2019, Matthews signed with the Indiana Pacers. On February 22, Matthews made 6 three-pointers and finished with 24 points, to lead the Pacers in a comeback win over the New Orleans Pelicans. = On July 12, 2019, Matthews signed with the Milwaukee Bucks. On November 25, 2019, Matthews scored 19 points and grabbed 4 rebounds while starting in place of injured All-Star Khris Middleton in a game against the Utah Jazz. On December 22, he again scored 19 points, this time in a win against his previous team, the Pacers. = On November 22, 2020, Matthews signed with the Los Angeles Lakers. He appeared in 58 games for the Lakers, averaging only 4.8 points and a career-worst 33% 3-point shot percentage. = On December 3, 2021, Matthews was signed by the Milwaukee Bucks. During Milwaukee's Christmas Day game, Matthews scored just 9 points, but gave the Bucks the lead by making a 3-point shot with 30 seconds left to help complete a 19-point come back, in a 117–113 win over the Boston Celtics. Matthews was inserted into the starting lineup by Mike Budenholzer towards the end of the regular season to provide a defensive presence alongside All-Defensive guard Jrue Holiday. On July 6, 2022, Matthews re-signed with the Bucks. = On July 22, 2023, Matthews signed with the Atlanta Hawks. = Regular season Playoffs = List of National Basketball Association career 3-point scoring leaders Career statistics from NBA.com · Basketball Reference Marquette Golden Eagles bio\n\nIn the 2009–10 season, Wesley Matthews played for Utah in 82* games. He averaged 9.4 points, 2.3 rebounds, 1.5 assists, 0.8 steals, and 0.2 blocks per game. He shot 0.483 from the field, 0.382 from 3-point range, and 0.829 from the free throw line, playing an average of 24.7 minutes per game. In the 2010–11 season, Wesley Matthews played for Portland in 82 games. He averaged 15.9 points, 3.1 rebounds, 2.0 assists, 1.2 steals, and 0.1 blocks per game. He shot 0.449 from the field, 0.407 from 3-point range, and 0.844 from the free throw line, playing an average of 33.6 minutes per game. In the 2011–12 season, Wesley Matthews played for Portland in 66* games. He averaged 13.7 points, 3.4 rebounds, 1.7 assists, 1.5 steals, and 0.2 blocks per game. He shot 0.412 from the field, 0.383 from 3-point range, and 0.86 from the free throw line, playing an average of 33.8 minutes per game. In the 2012–13 season, Wesley Matthews played for Portland in 69 games. He averaged 14.8 points, 2.8 rebounds, 2.5 assists, 1.3 steals, and 0.3 blocks per game. He shot 0.436 from the field, 0.398 from 3-point range, and 0.797 from the free throw line, playing an average of 34.8 minutes per game. In the 2013–14 season, Wesley Matthews played for Portland in 82 games. He averaged 16.4 points, 3.5 rebounds, 2.4 assists, 1.3 steals, and 0.3 blocks per game. He shot 0.441 from the field, 0.393 from 3-point range, and 0.837 from the free throw line, playing an average of 34.0 minutes per game. In the 2014–15 season, Wesley Matthews played for Portland in 60 games. He averaged 15.9 points, 3.7 rebounds, 2.3 assists, 1.3 steals, and 0.2 blocks per game. He shot 0.448 from the field, 0.389 from 3-point range, and 0.752 from the free throw line, playing an average of 33.7 minutes per game. In the 2015–16 season, Wesley Matthews played for Dallas in 78 games. He averaged 12.5 points, 3.1 rebounds, 1.9 assists, 1.0 steals, and 0.2 blocks per game. He shot 0.388 from the field, 0.36 from 3-point range, and 0.863 from the free throw line, playing an average of 33.9 minutes per game. In the 2016–17 season, Wesley Matthews played for Dallas in 73 games. He averaged 13.5 points, 3.5 rebounds, 2.9 assists, 1.1 steals, and 0.2 blocks per game. He shot 0.393 from the field, 0.363 from 3-point range, and 0.816 from the free throw line, playing an average of 34.2 minutes per game. In the 2017–18 season, Wesley Matthews played for Dallas in 63 games. He averaged 12.7 points, 3.1 rebounds, 2.7 assists, 1.2 steals, and 0.3 blocks per game. He shot 0.406 from the field, 0.381 from 3-point range, and 0.822 from the free throw line, playing an average of 33.8 minutes per game. In the 2018–19 season, Wesley Matthews played for Dallas in 44 games. He averaged 13.1 points, 2.3 rebounds, 2.3 assists, 0.8 steals, and 0.3 blocks per game. He shot 0.414 from the field, 0.38 from 3-point range, and 0.791 from the free throw line, playing an average of 29.8 minutes per game. In the 2018–19 season, Wesley Matthews played for New York in 2 games. He averaged 7.0 points, 1.5 rebounds, 2.5 assists, 0.5 steals, and 0.5 blocks per game. He shot 0.211 from the field, 0.2 from 3-point range, and 0.8 from the free throw line, playing an average of 26.9 minutes per game. In the 2018–19 season, Wesley Matthews played for Indiana in 23 games. He averaged 10.9 points, 2.8 rebounds, 2.4 assists, 0.9 steals, and 0.2 blocks per game. He shot 0.386 from the field, 0.369 from 3-point range, and 0.854 from the free throw line, playing an average of 31.5 minutes per game. In the 2019–20 season, Wesley Matthews played for Milwaukee in 67 games. He averaged 7.4 points, 2.5 rebounds, 1.4 assists, 0.6 steals, and 0.1 blocks per game. He shot 0.396 from the field, 0.364 from 3-point range, and 0.765 from the free throw line, playing an average of 24.4 minutes per game. In the 2020–21 season, Wesley Matthews played for L.A. Lakers in 58 games."", ""Early in the season, he was widely regarded to have been in a shooting slump. He broke the UNC record for the most career three-pointers made (299). However, he recovered late in the season and helped the Tar Heels win the 2016 ACC tournament and lead them to the 2016 NCAA championship game, where they faced Villanova. In the game, Paige scored 21 points and hit a game-tying circus three-pointer with 4.7 seconds left in the second half of regulation. However, Villanova's Kris Jenkins went on to score a buzzer beater to win the game 77–74. = On June 23, 2016, Paige was selected by the Brooklyn Nets with the 55th overall pick in the 2016 NBA draft."", 'On March 3, 2019, he scored a then season-high 28 points with a career-high five 3-pointers in a 123–118 win over the Chicago Bulls. On April 7, he scored a career-high 33 points, including a career-best six 3-pointers, in a 115–107 loss to the Milwaukee Bucks. = On February 6, 2020, Len and Jabari Parker were traded to the Sacramento Kings in exchange for Dewayne Dedmon and two second round picks. = On November 29, 2020, Len signed with the Toronto Raptors.', 'The Celtics went on to lose in seven games as they failed to defend their title. 2009–2012: finals upset and 3-point record On December 10, 2009, Allen scored 18 points to reach the 20,000 point total for his career. On June 6, 2010, in Game 2 of the 2010 NBA Finals in a 103–94 victory against the Los Angeles Lakers, Allen set a then record for most three-pointers made in an NBA Finals game on 8–11 shooting to tie the series 1–1. He broke Michael Jordan\'s record of six three-pointers in one half by hitting seven in the first half and had tied Scottie Pippen and Kenny Smith\'s record for most three-pointers in one game in the NBA Finals by half time. Allen also became the first player in NBA history to have two separate games of scoring at least seven three-pointers in the NBA Finals. The Celtics would win two of three games in Boston, before losing the last two games and the series in Los Angeles. After becoming a free agent on July 1, 2010, Allen re-signed a two-year deal with the Boston Celtics on July 7 worth $20 million. During a game against the Los Angeles Lakers on February 10, 2011, Allen became the all-time NBA leader in total three-pointers made (2,562), surpassing Reggie Miller\'s record of 2,560. The 35-year-old shooting guard finished the game with 20 points but the Celtics eventually lost 92–86. In the 2010–11 NBA season Allen was named to his tenth All-Star game alongside teammates Rajon Rondo, Paul Pierce and Kevin Garnett. Also during All-Star Weekend, Allen competed in the Three-Point Shootout, but lost to James Jones of the Miami Heat. During the 2011–12 NBA season, Allen was privately frustrated with trade rumors in February, issues with teammate Rajon Rondo, and an ankle injury that ultimately required surgery in June 2012 to remove bone spurs. The Celtics lost in seven games to the Miami Heat in the 2012 Eastern Conference finals. = 2012–2013: second championship Allen\'s initial plan in the summer of 2012 was to stay with the Boston Celtics. He was reportedly seeking a three-year, $24 million contract whereas the Celtics were offering a two-year, $12 million deal. Further internal discord with a bench role and a Rondo-focused approach led to Allen rejecting the Celtics and instead choosing to sign a two-year, $6 million deal with the Miami Heat. The Heat were limited to their mid-level exception amount of slightly more than $3 million per season. During Allen\'s first season with the Miami Heat, he averaged 10.9 points per game and made 88.6% of his free throws while playing an average of 25.8 minutes per game. On April 25, 2013, while playing Milwaukee in Game 3 of the first round of the playoffs, Allen made his 322nd career three-pointer in the playoffs, which broke Reggie Miller\'s record for most three-pointers made in NBA playoff history. Allen returned to his favorite #34 jersey upon joining the Heat. In Game 6 of the NBA Finals against the San Antonio Spurs, as the Heat trailed by three points, Allen made a game-tying 3-pointer with 5.2 seconds left in the fourth quarter to force overtime. Having rallied from a 10-point deficit at the end of the third quarter, the Heat won in overtime 103–100 over the San Antonio Spurs and forced a seventh game in the series. With the Heat leading 101–100, Allen stole the ball from Manu Ginóbili under the Spurs\' basket and drew a foul with 1.9 seconds remaining in the overtime period. Allen made both ensuing free throws to put Miami up 103–100. Allen played 41 minutes in Game 6 off the bench and scored 9 points on 3-for-8 field goal shooting; his game-tying three-pointer was the only three-pointer he made in three attempts. Allen also had one defensive rebound and two assists. In Game 7, which the Heat won 95–88 to win its second consecutive championship, Allen played 20 minutes off the bench. Although he made none of 4 field goal attempts and had 3 turnovers, Allen recorded 4 defensive rebounds and 4 assists. 2013–2014: final playing year On June 29, 2013, Allen picked up his $3.23 million player option to stay with the Heat through the 2013–14 NBA season. During the regular season, Allen played in 73 games, starting 9 of them, averaging 9.6 points and shooting 37 percent from three-point range. In the playoffs, Allen scored 19 points on 4–7 three-point shooting in game 4 of the conference semifinals against the Brooklyn Nets. Then in Game 3 against the Indiana Pacers in an Eastern Conference finals rematch, Allen hit four 3-point shots in the fourth quarter and put them up 2–1 in the series. The Heat won the series in six games to advance to the NBA Finals for the fourth straight year and Allen\'s second. The Heat faced the Spurs again in the 2014 NBA Finals, but they lost the series in five games. = Allen became a free agent in the 2014 off-season, and after much anticipation of a return at some point during the 2014–15 season, he announced his decision to sit out the season and focus on 2015–16. However, he did not end up joining a team. In July 2016, Allen began mulling a comeback, and admitted he was ""intrigued"" by the possibility of competing for another championship. The following month, Allen had talks with the Boston Celtics and the Milwaukee Bucks regarding a possible return, but ultimately decided to officially retire on November 1, 2016. In September 2018, Allen was inducted into the Naismith Memorial Basketball Hall of Fame. In February 2019, Allen played in the NBA All-Star Celebrity Game. In October 2021, Allen was honored as one of the league\'s greatest players of all time by being named to the NBA\'s 75th Anniversary Team. He was also named in the top 75 players by The Athletic. In 1998, Allen co-starred alongside Denzel Washington in the Spike Lee film He Got Game as high school basketball phenomenon Jesus Shuttlesworth. Roger Ebert praised his performance and said Allen ""is that rarity: an athlete who can act,"" while New York magazine described him as ""graceful and fast in the basketball scenes"" while giving ""a somberly effective minimalist performance."" His role as Jesus Shuttlesworth earned him that name as a nickname from teammates and fans. Allen also appeared as Marcus Blake in the 2001 film Harvard Man.']",Kemba Walker made 250 three-pointers in the 2018-2019 NBA season.,"Walker made 250 3-pointers in the 2018-2019 NBA season, becoming the ninth different player in NBA history to connect on 250+ 3-pointers in a season.",0.0,0.9969488037404849,0.9444444444287038,1.0,0.7295752123864157,0.9183008495456624
Who did Ray Allen co-star alongside in 2015?,"['In 2015, Allen co-starred alongside Kyrie Irving, Baron Davis and J.', 'Walter Ray Allen Jr. (born July 20, 1975) is an American former professional basketball player. Allen played 18 seasons in the National Basketball Association (NBA) and was inducted into the Naismith Memorial Basketball Hall of Fame as a player in 2018. He is widely considered one of the greatest three-point shooters of all time. Allen was a ten-time NBA All-Star, and won an Olympic gold medal as a member of the 2000 United States men\'s basketball team. At the time of his retirement, he was the leading three-point scorer in NBA history until he was surpassed by Stephen Curry in 2021. As of 2025, he ranks third on the NBA\'s all-time three-pointers list. In 2021, he was selected to the NBA 75th Anniversary Team. Allen played college basketball for the Connecticut Huskies for three seasons, before he was selected with the fifth overall pick in the 1996 NBA draft, and developed into a prolific scorer for the Milwaukee Bucks, featuring alongside Glenn Robinson and Sam Cassell as the team achieved playoff success. In 2003, he was traded to the Seattle SuperSonics, where he solidified his reputation as a scorer, breaking several league records for three-point and free throw shooting. Allen was later traded to the Boston Celtics, where he formed a ""Big Three"" with Kevin Garnett and Paul Pierce; the team won an NBA championship in 2008. After five seasons with the Celtics, he played with the Miami Heat for two seasons, reaching the NBA Finals both times and winning the title in 2013; his clutch three-pointer in the 2013 Finals to force overtime is regarded as one of the most iconic and memorable plays in NBA history. Allen retired on November 1, 2016, after playing for four different teams. During his NBA career, Allen acted in some films, such as his role as basketball prodigy Jesus Shuttlesworth in Spike Lee\'s basketball drama He Got Game (1998). Allen\'s performance as Shuttlesworth was praised by critics, and the name was borrowed as Allen\'s basketball nickname. The third of five children, Allen was born at Castle Air Force Base near Merced, California, the son of Walter Sr.', 'NBA / Jr. WNBA program and was selected as NBA Spokesman for the Thurgood Marshall College Fund. He also started the ""Ray of Hope"" Foundation to assist charities in several communities. Former President Obama appointed Allen to the United States Holocaust Memorial Council. Allen is a longtime supporter of the Holocaust Memorial Museum and has brought teammates and friends to the museum on frequent visits. In August 2017, he penned a first-person article for ""The Players\' Tribune"", entitled Why I Went to Auschwitz. On November 21, 2017, Allen said in a court filing that he was the victim of ""catfishing"" by a man who posed online as several different women. In an emergency motion, Allen was responding to a claim made by the man, Bryant Coleman, that he was being stalked by Allen. Allen\'s autobiography, From the Outside, was released on March 27, 2018. On July 18, 2021, Allen suffered injuries in a serious bicycle crash, and he credited his bicycle helmet with effectively saving his life. On August 20, 2021, Allen accepted a position as director of boys\' and girls\' basketball and boys\' varsity basketball head coach at Gulliver Preparatory School. In the spring of 2023, Allen received a bachelor\'s degree in General Studies from the University of Connecticut. = = Regular season Playoffs 2× NBA champion: 2008, 2013 3× Gold medalist as member of the USA men\'s basketball team: 1995 Summer Universiade, 2000 Summer Olympics & 2003 FIBA Americas Championship 10× NBA All-Star: 2000–2002, 2004–2009, 2011 All-NBA Second Team: 2005 All-NBA Third Team: 2001 NBA All-Rookie Second Team: 1997 NBA Joe Dumars NBA Sportsmanship Award: 2003 The Sporting News ""Good Guy"": 2000, 2001, 2005 NBA All-Star Weekend Three-point Shootout champion: 2001 USA Basketball Male Athlete of the Year (1995) = 3-point field goal attempts, career: 7,429 = 3-point field goals attempted, game: 18, Boston Celtics at Chicago Bulls, April 30, 2009 (3 OT) Tied with Stephen Curry (April 23, 2015), Damian Lillard (May 9, 2016), Klay Thompson (May 28, 2016), and Russell Westbrook (April 25, 2017) = 3-point field goals made, half: 7, first half, Boston Celtics at Los Angeles Lakers, June 6, 2010 3-point field goals made, quarter: 5, second quarter, Boston Celtics at Los Angeles Lakers, June 6, 2010 Tied with Stephen Curry (June 3, 2018) = Consecutive games played: 400, from 11/1/96 to 12/20/01 3-point field goals made, career: 1,051 3-point field goals made, season: 229 (2001–02) 3-point field goals made, game: 10, vs. Charlotte Hornets, April 14, 2002 3-point field goals made, half: 8, second half, vs.', ""ISBN 978-0062675477. Career statistics from NBA.com · Basketball Reference Allen's official website Ray Allen Archived April 1, 2016, at the Wayback Machine at nba.com Ray Allen at jockbio.com Ray Allen at IMDb\n\nIn the 1993–94 season, Ray Allen played for Connecticut in 34 games. He averaged 12.6 points, 4.6 rebounds, 1.4 assists, 1.1 steals, and 0.2 blocks per game. He shot 0.51 from the field, 0.402 from 3-point range, and 0.792 from the free throw line, playing an average of 21.6 minutes per game. In the 1994–95 season, Ray Allen played for Connecticut in 32 games. He averaged 21.1 points, 6.8 rebounds, 2.3 assists, 1.9 steals, and 0.5 blocks per game. He shot 0.489 from the field, 0.445 from 3-point range, and 0.727 from the free throw line, playing an average of 32.8 minutes per game. In the 1995–96 season, Ray Allen played for Connecticut in 35 games. He averaged 23.4 points, 6.5 rebounds, 3.3 assists, 1.7 steals, and 0.5 blocks per game. He shot 0.472 from the field, 0.466 from 3-point range, and 0.81 from the free throw line, playing an average of 34.7 minutes per game. In the 1996–97 season, Ray Allen played for Milwaukee in 82 games. He averaged 13.4 points, 4.0 rebounds, 2.6 assists, 0.9 steals, and 0.1 blocks per game. He shot 0.43 from the field, 0.393 from 3-point range, and 0.823 from the free throw line, playing an average of 30.9 minutes per game. In the 1997–98 season, Ray Allen played for Milwaukee in 82* games. He averaged 19.5 points, 4.9 rebounds, 4.3 assists, 1.4 steals, and 0.1 blocks per game. He shot 0.428 from the field, 0.364 from 3-point range, and 0.875 from the free throw line, playing an average of 40.1 minutes per game. In the 1998–99 season, Ray Allen played for Milwaukee in 50* games. He averaged 17.1 points, 4.2 rebounds, 3.6 assists, 1.1 steals, and 0.1 blocks per game. He shot 0.45 from the field, 0.356 from 3-point range, and 0.903 from the free throw line, playing an average of 34.4 minutes per game. In the 1999–00 season, Ray Allen played for Milwaukee in 82 games. He averaged 22.1 points, 4.4 rebounds, 3.8 assists, 1.3 steals, and 0.2 blocks per game. He shot 0.455 from the field, 0.423 from 3-point range, and 0.887 from the free throw line, playing an average of 37.4 minutes per game. In the 2000–01 season, Ray Allen played for Milwaukee in 82 games. He averaged 22.0 points, 5.2 rebounds, 4.6 assists, 1.5 steals, and 0.2 blocks per game. He shot 0.48 from the field, 0.433 from 3-point range, and 0.888 from the free throw line, playing an average of 38.2 minutes per game. In the 2001–02 season, Ray Allen played for Milwaukee in 69 games. He averaged 21.8 points, 4.5 rebounds, 3.9 assists, 1.3 steals, and 0.3 blocks per game. He shot 0.462 from the field, 0.434 from 3-point range, and 0.873 from the free throw line, playing an average of 36.6 minutes per game. In the 2002–03 season, Ray Allen played for Milwaukee in 47 games. He averaged 21.3 points, 4.6 rebounds, 3.5 assists, 1.2 steals, and 0.2 blocks per game. He shot 0.437 from the field, 0.395 from 3-point range, and 0.913 from the free throw line, playing an average of 35.8 minutes per game. In the 2002–03 season, Ray Allen played for Seattle in 29 games. He averaged 24.5 points, 5.6 rebounds, 5.9 assists, 1.6 steals, and 0.1 blocks per game. He shot 0.441 from the field, 0.351 from 3-point range, and 0.92 from the free throw line, playing an average of 41.3 minutes per game. In the 2003–04 season, Ray Allen played for Seattle in 56 games. He averaged 23.0 points, 5.1 rebounds, 4.8 assists, 1.3 steals, and 0.2 blocks per game. He shot 0.44 from the field, 0.392 from 3-point range, and 0.904 from the free throw line, playing an average of 38.4 minutes per game. In the 2004–05 season, Ray Allen played for Seattle in 78 games. He averaged 23.9 points, 4.4 rebounds, 3.7 assists, 1.1 steals, and 0.1 blocks per game. He shot 0.428 from the field, 0.376 from 3-point range, and 0.883 from the free throw line, playing an average of 39.3 minutes per game. In the 2005–06 season, Ray Allen played for Seattle in 78 games. He averaged 25.1 points, 4.3 rebounds, 3.7 assists, 1.3 steals, and 0.2 blocks per game. He shot 0.454 from the field, 0.412 from 3-point range, and 0.903 from the free throw line, playing an average of 38.7 minutes per game. In the 2006–07 season, Ray Allen played for Seattle in 55 games. He averaged 26.4 points, 4.5 rebounds, 4.1 assists, 1.5 steals, and 0.2 blocks per game. He shot 0.438 from the field, 0.372 from 3-point range, and 0.903 from the free throw line, playing an average of 40.3 minutes per game. In the 2007–08† season, Ray Allen played for Boston in 73 games. He averaged 17.4 points, 3.7 rebounds, 3.1 assists, 0.9 steals, and 0.2 blocks per game. He shot 0.445 from the field, 0.398 from 3-point range, and 0.907 from the free throw line, playing an average of 35.9 minutes per game. In the 2008–09 season, Ray Allen played for Boston in 79 games. He averaged 18.2 points, 3.5 rebounds, 2.8 assists, 0.9 steals, and 0.2 blocks per game. He shot 0.48 from the field, 0.409 from 3-point range, and 0.952 from the free throw line, playing an average of 36.4 minutes per game. In the 2009–10 season, Ray Allen played for Boston in 80 games. He averaged 16.3 points, 3.2 rebounds, 2.6 assists, 0.8 steals, and 0.3 blocks per game. He shot 0.477 from the field, 0.363 from 3-point range, and 0.913 from the free throw line, playing an average of 35.2 minutes per game. In the 2010–11 season, Ray Allen played for Boston in 80 games. He averaged 16.5 points, 3.4 rebounds, 2.7 assists, 1.0 steals, and 0.2 blocks per game. He shot 0.491 from the field, 0.444 from 3-point range, and 0.881 from the free throw line, playing an average of 36.1 minutes per game. In the 2011–12 season, Ray Allen played for Boston in 46 games. He averaged 14.2 points, 3.1 rebounds, 2.4 assists, 1.1 steals, and 0.2 blocks per game. He shot 0.458 from the field, 0.453 from 3-point range, and 0.915 from the free throw line, playing an average of 34.0 minutes per game. In the 2012–13† season, Ray Allen played for Miami in 79 games. He averaged 10.9 points, 2.7 rebounds, 1.7 assists, 0.8 steals, and 0.2 blocks per game. He shot 0.449 from the field, 0.419 from 3-point range, and 0.886 from the free throw line, playing an average of 25.8 minutes per game. In the 2013–14 season, Ray Allen played for Miami in 73 games. He averaged 9.6 points, 2.8 rebounds, 2.0 assists, 0.7 steals, and 0.1 blocks per game. He shot 0.442 from the field, 0.375 from 3-point range, and 0.905 from the free throw line, playing an average of 26.5 minutes per game. In the All-Star season, Ray Allen played for All-Star in 10 games. He averaged 14.5 points, 2.6 rebounds, 2.2 assists, 1.1 steals, and 0.2 blocks per game. He shot 0.423 from the field, 0.31 from 3-point range, and 0.765 from the free throw line, playing an average of 20.1 minutes per game. In the 1999 season, Ray Allen played for Milwaukee in 3 games. He averaged 22.3 points, 7.3 rebounds, 4.3 assists, 1.0 steals, and 0.3 blocks per game. He shot 0.532 from the field, 0.474 from 3-point range, and 0.615 from the free throw line, playing an average of 40.0 minutes per game. In the 2000 season, Ray Allen played for Milwaukee in 5 games. He averaged 22.0 points, 6.6 rebounds, 2.6 assists, 1.6 steals, and 0.0 blocks per game. He shot 0.444 from the field, 0.385 from 3-point range, and 0.909 from the free throw line, playing an average of 37.2 minutes per game. In the 2001 season, Ray Allen played for Milwaukee in 18 games. He averaged 25.1 points, 4.1 rebounds, 6.0 assists, 1.3 steals, and 0.6 blocks per game. He shot 0.477 from the field, 0.479 from 3-point range, and 0.919 from the free throw line, playing an average of 42.7 minutes per game. In the 2005 season, Ray Allen played for Seattle in 11 games. He averaged 26.5 points, 4.3 rebounds, 3.9 assists, 1.3 steals, and 0.4 blocks per game. He shot 0.474 from the field, 0.378 from 3-point range, and 0.889 from the free throw line, playing an average of 39.6 minutes per game. In the 2008† season, Ray Allen played for Boston in 26‡ games. He averaged 15.6 points, 3.8 rebounds, 2.7 assists, 0.9 steals, and 0.3 blocks per game. He shot 0.428 from the field, 0.396 from 3-point range, and 0.913 from the free throw line, playing an average of 38.0 minutes per game. In the 2009 season, Ray Allen played for Boston in 14 games. He averaged 18.3 points, 3.9 rebounds, 2.6 assists, 1.1 steals, and 0.4 blocks per game. He shot 0.403 from the field, 0.35 from 3-point range, and 0.948 from the free throw line, playing an average of 40.4 minutes per game. In the 2010 season, Ray Allen played for Boston in 24 games. He averaged 16.1 points, 3.3 rebounds, 2.6 assists, 0.9 steals, and 0.1 blocks per game. He shot 0.431 from the field, 0.386 from 3-point range, and 0.863 from the free throw line, playing an average of 38.5 minutes per game. In the 2011 season, Ray Allen played for Boston in 9 games. He averaged 18.9 points, 3.8 rebounds, 2.4 assists, 1.2 steals, and 0.1 blocks per game. He shot 0.523 from the field, 0.571 from 3-point range, and 0.96 from the free throw line, playing an average of 40.1 minutes per game. In the 2012 season, Ray Allen played for Boston in 18 games. He averaged 10.7 points, 4.1 rebounds, 1.0 assists, 0.9 steals, and 0.1 blocks per game. He shot 0.395 from the field, 0.304 from 3-point range, and 0.711 from the free throw line, playing an average of 34.2 minutes per game. In the 2013† season, Ray Allen played for Miami in 23 games. He averaged 10.2 points, 2.8 rebounds, 1.3 assists, 0.5 steals, and 0.1 blocks per game. He shot 0.43 from the field, 0.406 from 3-point range, and 0.87 from the free throw line, playing an average of 24.9 minutes per game. In the 2014 season, Ray Allen played for Miami in 20 games. He averaged 9.3 points, 3.4 rebounds, 1.6 assists, 0.7 steals, and 0.2 blocks per game. He shot 0.413 from the field, 0.388 from 3-point range, and 0.919 from the free throw line, playing an average of 26.4 minutes per game."", 'Allan Nathaniel Ray (born June 17, 1984) is an American sports agent and former professional basketball player. He played college basketball for four years at Villanova University.', ""Upon joining the Celtics, Allen changed his jersey to number 20 because Paul Pierce already had number 34 in Boston. On November 4, 2007, Allen passed 17,000 points for his career with his first of two 3-pointers in overtime in a 98–95 victory against the Toronto Raptors, in which he sank the game winning 3-pointer with three seconds remaining in overtime. On February 13, 2008, Allen was named as the replacement for injured East All-Star Caron Butler of the Washington Wizards, who was out with a left hip flexor strain, for the 2008 NBA All-Star Game in New Orleans. While LeBron James was given the All-Star MVP Award, many analysts, including the TNT commentators of the game, felt it should have gone to Allen, who scored 14 points in a stretch of 2 minutes and 30 seconds in the fourth quarter to seal the win for the East team. On March 28, 2008, Allen was honored as the 3rd best of the 20 greatest players in franchise history during Milwaukee's 40th Anniversary Team Celebration, but could not attend the festivities because of the Celtics' game against the New Orleans Hornets. The Boston Celtics finished 66–16, and were the #1 seed in the 2008 NBA Playoffs."", 'The Celtics went on to lose in seven games as they failed to defend their title. 2009–2012: finals upset and 3-point record On December 10, 2009, Allen scored 18 points to reach the 20,000 point total for his career. On June 6, 2010, in Game 2 of the 2010 NBA Finals in a 103–94 victory against the Los Angeles Lakers, Allen set a then record for most three-pointers made in an NBA Finals game on 8–11 shooting to tie the series 1–1. He broke Michael Jordan\'s record of six three-pointers in one half by hitting seven in the first half and had tied Scottie Pippen and Kenny Smith\'s record for most three-pointers in one game in the NBA Finals by half time. Allen also became the first player in NBA history to have two separate games of scoring at least seven three-pointers in the NBA Finals. The Celtics would win two of three games in Boston, before losing the last two games and the series in Los Angeles. After becoming a free agent on July 1, 2010, Allen re-signed a two-year deal with the Boston Celtics on July 7 worth $20 million. During a game against the Los Angeles Lakers on February 10, 2011, Allen became the all-time NBA leader in total three-pointers made (2,562), surpassing Reggie Miller\'s record of 2,560. The 35-year-old shooting guard finished the game with 20 points but the Celtics eventually lost 92–86. In the 2010–11 NBA season Allen was named to his tenth All-Star game alongside teammates Rajon Rondo, Paul Pierce and Kevin Garnett. Also during All-Star Weekend, Allen competed in the Three-Point Shootout, but lost to James Jones of the Miami Heat. During the 2011–12 NBA season, Allen was privately frustrated with trade rumors in February, issues with teammate Rajon Rondo, and an ankle injury that ultimately required surgery in June 2012 to remove bone spurs. The Celtics lost in seven games to the Miami Heat in the 2012 Eastern Conference finals. = 2012–2013: second championship Allen\'s initial plan in the summer of 2012 was to stay with the Boston Celtics. He was reportedly seeking a three-year, $24 million contract whereas the Celtics were offering a two-year, $12 million deal. Further internal discord with a bench role and a Rondo-focused approach led to Allen rejecting the Celtics and instead choosing to sign a two-year, $6 million deal with the Miami Heat. The Heat were limited to their mid-level exception amount of slightly more than $3 million per season. During Allen\'s first season with the Miami Heat, he averaged 10.9 points per game and made 88.6% of his free throws while playing an average of 25.8 minutes per game. On April 25, 2013, while playing Milwaukee in Game 3 of the first round of the playoffs, Allen made his 322nd career three-pointer in the playoffs, which broke Reggie Miller\'s record for most three-pointers made in NBA playoff history. Allen returned to his favorite #34 jersey upon joining the Heat. In Game 6 of the NBA Finals against the San Antonio Spurs, as the Heat trailed by three points, Allen made a game-tying 3-pointer with 5.2 seconds left in the fourth quarter to force overtime. Having rallied from a 10-point deficit at the end of the third quarter, the Heat won in overtime 103–100 over the San Antonio Spurs and forced a seventh game in the series. With the Heat leading 101–100, Allen stole the ball from Manu Ginóbili under the Spurs\' basket and drew a foul with 1.9 seconds remaining in the overtime period. Allen made both ensuing free throws to put Miami up 103–100. Allen played 41 minutes in Game 6 off the bench and scored 9 points on 3-for-8 field goal shooting; his game-tying three-pointer was the only three-pointer he made in three attempts. Allen also had one defensive rebound and two assists. In Game 7, which the Heat won 95–88 to win its second consecutive championship, Allen played 20 minutes off the bench. Although he made none of 4 field goal attempts and had 3 turnovers, Allen recorded 4 defensive rebounds and 4 assists. 2013–2014: final playing year On June 29, 2013, Allen picked up his $3.23 million player option to stay with the Heat through the 2013–14 NBA season. During the regular season, Allen played in 73 games, starting 9 of them, averaging 9.6 points and shooting 37 percent from three-point range. In the playoffs, Allen scored 19 points on 4–7 three-point shooting in game 4 of the conference semifinals against the Brooklyn Nets. Then in Game 3 against the Indiana Pacers in an Eastern Conference finals rematch, Allen hit four 3-point shots in the fourth quarter and put them up 2–1 in the series. The Heat won the series in six games to advance to the NBA Finals for the fourth straight year and Allen\'s second. The Heat faced the Spurs again in the 2014 NBA Finals, but they lost the series in five games. = Allen became a free agent in the 2014 off-season, and after much anticipation of a return at some point during the 2014–15 season, he announced his decision to sit out the season and focus on 2015–16. However, he did not end up joining a team. In July 2016, Allen began mulling a comeback, and admitted he was ""intrigued"" by the possibility of competing for another championship. The following month, Allen had talks with the Boston Celtics and the Milwaukee Bucks regarding a possible return, but ultimately decided to officially retire on November 1, 2016. In September 2018, Allen was inducted into the Naismith Memorial Basketball Hall of Fame. In February 2019, Allen played in the NBA All-Star Celebrity Game. In October 2021, Allen was honored as one of the league\'s greatest players of all time by being named to the NBA\'s 75th Anniversary Team. He was also named in the top 75 players by The Athletic. In 1998, Allen co-starred alongside Denzel Washington in the Spike Lee film He Got Game as high school basketball phenomenon Jesus Shuttlesworth. Roger Ebert praised his performance and said Allen ""is that rarity: an athlete who can act,"" while New York magazine described him as ""graceful and fast in the basketball scenes"" while giving ""a somberly effective minimalist performance."" His role as Jesus Shuttlesworth earned him that name as a nickname from teammates and fans. Allen also appeared as Marcus Blake in the 2001 film Harvard Man.', 'Overall, their record was 28–5. In 2006, Ray was named to the Big East first team, along with teammate Randy Foye, who was given the honor of Big East Player of the Year. Ray led Villanova to the Elite Eight of the 2006 NCAA tournament, playing in a four-guard offense with Foye, Kyle Lowry and Mike Nardi. = During the 2006 Big East tournament, Ray was poked in the eye by Carl Krauser during the semifinal game against Pittsburgh. His vision apparently left him for a period of time and his eyeball had seemed to come loose from the socket, leading most to believe it was an extremely serious injury. However, his vision returned and it turned out to be only soft tissue damage. He was able to play less than a week later in the NCAA tournament, without goggles. In his first game back, he led Villanova in scoring. While on the video it appeared as though his eye came loose from the socket, his eyelid actually went behind his eye, giving off the impression of his eye coming loose. Ray was not selected in the 2006 NBA draft, surprising many Big East fans and some NBA experts. On July 6, 2006, he was signed as a free agent by the Boston Celtics. Ray was sent to the D-League Austin Toros, but was recalled after just two games there. He led the Toros in scoring in both games he played for them. During the last two months of the season, Ray began receiving extended playing time with the Celtics, and had two 22-point games and three others where he scored 20, 18 and 17 points. Ray was also fourth among rookies in three-point percentage. Despite a seemingly bright future in Boston, Ray agreed to terms on a $2 million contract to play in Italy, instead of having the Celtics pick up his $687,456 option. Ray signed with the Euroleague club Lottomatica Virtus Roma on July 27, 2007. Midway through the following season, after the club signed Brandon Jennings (whom Ray served as a mentor to), Ray left to sign a contract with Carife Ferrara for the remaining part of the season. After sitting out the 2009–10 season to recover from knee surgery, Ray signed with Sutor Montegranaro for the 2010–11 season. In November 2011 he signed a temporary contract with BC Krka in Slovenia, but in December 2011 he signed a new contract with Élan Béarnais Pau-Orthez in France. In August 2012, he moved to Germany and signed with ratiopharm Ulm for the 2012–13 season. In November 2013, he signed with the Croatian team Cedevita Zagreb for the rest of the 2013–14 season. On July 30, 2014, he signed with Virtus Bologna for the 2014–15 season. On March 11, 2015, he signed a two-year contract extension with Virtus. On March 31, 2016, he parted ways with Virtus. In 2015–16 season, he played only six games due to an injury. On October 30, 2016, he signed with Amici Pallacanestro Udinese of the Italian Serie A2 Basket. On March 30, 2017, he parted ways with Udinese. On April 3, 2017, he signed with Turkish club TED Ankara Kolejliler for the rest of the 2016–17 BSL season. On December 4, 2017, Ray signed with Byblos Club of the Lebanese Basketball League. = Career statistics from NBA.com · Basketball Reference Profile at euroleague.com Profile Archived January 27, 2019, at the Wayback Machine at legabasket.it (in Italian)\n\nIn the 2006–07 season, Allan Ray played for Boston in 47 games. He averaged 6.2 points, 1.5 rebounds, 0.9 assists, 0.4 steals, and 0.1 blocks per game.', 'Jarrett Allen (born April 21, 1998) is an American professional basketball player for the Cleveland Cavaliers of the National Basketball Association (NBA). He played college basketball for the Texas Longhorns and was selected 22nd overall by the Brooklyn Nets in the 2017 NBA draft. In January 2021, he was traded to the Cleveland Cavaliers as part of the four-team blockbuster James Harden trade. In February 2022, Allen was named to his first NBA All-Star Game. Allen attended Walsh Middle School in Round Rock Texas, which feeds into Round Rock High School in Round Rock, Texas for his freshman year of high school.', 'Tony Allen may refer to: Tony Allen (musician) (1940–2020), Nigerian drummer with Fela Kuti and one of the founders of Afrobeat Tony Allen, member of American doo-wop group The Furys Tony Allen, Irish singer, member of Irish duo Foster and Allen with Mick Foster Tony Allen, recording alias of J.W. Hodkinson (1942–2013), English rock singer Tony Allen (footballer) (1939–2022), English footballer Tony Allen (basketball) (born 1982), American former basketball player Tony Allen (comedian) (1945–2023), English comedian and writer Tony Allen (academic administrator), president of the Delaware State University Tony Allan (disambiguation) Anthony Allen (disambiguation)\n\nIn the 2004–05 season, Tony Allen played for Boston in 77 games.']","In 2015, Ray Allen co-starred alongside Kyrie Irving, Baron Davis, and J.","Kyrie Irving, Baron Davis, and J.",0.0,0.9999999999999996,0.0,1.0,0.9775420214671867,0.9101680858687468
What college did Miye Oni play basketball for?,"['Olumiye Dimolu ""Miye"" Oni (born August 4, 1997) is an American-Nigerian professional basketball player for Criollos de Caguas of the BSN in Puerto Rico. He played college basketball for the Yale Bulldogs.', 'On a volunteer basis, Oni and Brandon Sherrod (his fellow Connecticut CASA ambassador) participated in an awareness-raising forum recorded on YouTube and documented in an October 2020 news story. Yale Bulldogs bio NBA Draft profile Criollos de Caguas statistics\n\nIn the 2019–20 season, Miye Oni played for Utah in 10 games. He averaged 3.5 points, 1.7 rebounds, 0.4 assists, 0.4 steals, and 0.2 blocks per game. He shot 0.375 from the field, 0.368 from 3-point range, and 0.8 from the free throw line, playing an average of 10.9 minutes per game. In the 2020–21 season, Miye Oni played for Utah in 54 games. He averaged 1.9 points, 1.6 rebounds, 0.5 assists, 0.2 steals, and 0.1 blocks per game. He shot 0.354 from the field, 0.341 from 3-point range, and 0.833 from the free throw line, playing an average of 9.6 minutes per game. In the 2021–22 season, Miye Oni played for Utah in 16 games. He averaged 0.3 points, 0.4 rebounds, 0.3 assists, 0.0 steals, and 0.0 blocks per game. He shot 0.222 from the field, 0.125 from 3-point range, and 0.0 from the free throw line, playing an average of 2.8 minutes per game. In the 2020 season, Miye Oni played for Utah in 2 games. He averaged 3.5 points, 2.0 rebounds, 0.0 assists, 0.5 steals, and 0.5 blocks per game. He shot 0.5 from the field, 0.25 from 3-point range, and — from the free throw line, playing an average of 7.0 minutes per game. In the 2021 season, Miye Oni played for Utah in 8 games. He averaged 0.0 points, 0.4 rebounds, 0.0 assists, 0.1 steals, and 0.0 blocks per game. He shot 0.0 from the field, 0.0 from 3-point range, and — from the free throw line, playing an average of 5.1 minutes per game. In the 2016–17 season, Miye Oni played for Yale in 29 games. He averaged 12.9 points, 6.3 rebounds, 2.7 assists, 0.7 steals, and 1.1 blocks per game. He shot 0.441 from the field, 0.396 from 3-point range, and 0.784 from the free throw line, playing an average of 31.2 minutes per game. In the 2017–18 season, Miye Oni played for Yale in 29 games. He averaged 15.1 points, 6.0 rebounds, 3.6 assists, 0.9 steals, and 0.8 blocks per game. He shot 0.405 from the field, 0.31 from 3-point range, and 0.75 from the free throw line, playing an average of 32.8 minutes per game. In the 2018–19 season, Miye Oni played for Yale in 29 games. He averaged 17.1 points, 6.3 rebounds, 3.6 assists, 0.9 steals, and 1.3 blocks per game.', 'On November 2, he joined the Osceola Magic. On September 6, 2024, Oni signed with the Memphis Grizzlies, but was waived on October 19. = On December 16, 2024, Oni signed with Joventut Badalona of the Liga ACB. On March 6, 2025, Oni reached an agreement with the club to conclude the contract for personal reasons. = On March 17, 2025, Oni made his debut with Criollos de Caguas in the BSN professional league in Puerto Rico. On April 21, 2025, Oni had 33 points with 6 3PT, 7 rebounds, 7 assists in a win. Oni was eligible to play for the Nigeria men\'s national basketball team at the 2020 Summer Olympics in Tokyo due to his mother being born there. He saw significant minutes and made the go-ahead three point field goal when Nigeria upset the United States men\'s national basketball team in an exhibition game prior to the start of the Games. Oni then appeared in all three games in Tokyo, starting two of the three and averaging 21.8 minutes which was second on the team. Against Germany, he was 5-of-6 from three-point range and finished with 15 points. = Regular season Playoffs = At Yale University, Oni was a major in political science. He has been praised for his academic performance, with Yale assistant basketball coach Justin Simon saying, ""To maintain his grades at the level he has—the guys respect his work ethic."" After being drafted, Yale allowed him to complete his degree. = Miye Oni is one of two inaugural ambassadors for Connecticut CASA, part of the national CASA network for children who have experienced abuse or neglect. He was also involved with Utah CASA.', ""He plays the shooting guard position. Oni was named Ivy League Player of the Year in 2019 and was a three-time All-Ivy League selection. Oni, who is of Nigerian descent, grew up in Northridge, Los Angeles and began playing high school basketball at Viewpoint School, where he was named the divisional player of the year. He was lightly recruited at Viewpoint and committed to Williams College of the NCAA Division III. After drawing more interest as a senior at Viewpoint, he committed to Yale, but admissions rules forced him to play an additional season of prep basketball at Suffield Academy before college. Oni was born to Nigerian parents Opeyemi and Oludotun Oni. His father is a professor at the University of Phoenix and an engineer. Oni began playing basketball at age two with a toy hoop and joined a YMCA league with his older sister at age five. From a young age, he had aspirations to play in the National Basketball Association (NBA) and admired Kobe Bryant of the Los Angeles Lakers. In addition to basketball, he played football, mainly as a safety and wide receiver, and baseball. Oni began his freshman year at Sierra Canyon School in Chatsworth, California, but transferred to enroll and play basketball at Viewpoint School in Calabasas, California before the season started. He played for the junior varsity team in his freshman season, when he stood 5 feet 9 inches (1.75 m) and weighed 140 pounds (64 kg). He did not play on the school's basketball team as a sophomore to focus on his education. As a junior, Oni suffered a knee injury that sidelined him for most of the season. The injury hindered his college recruiting because he did not have film to show college coaches before his senior year. Oni stood 6 feet 4 inches (1.93 m) and weighed 180 pounds (82 kg) by the time he was a senior. He had a breakout final season for Viewpoint, averaging 18 points, 9 rebounds, and 4 assists and being named California Interscholastic Federation (CIF) Division 5AA player of the year. At Viewpoint, Oni did not draw interest from NCAA Division I basketball programs and was only recruited by Division III school Williams College, where he committed in the fall of his senior year of high school. However, Williams did not offer enough financial aid for his family to meet the cost of attendance. During his senior season at Viewpoint, Oni attracted attention from Yale assistant coach Matt Kingsley. After watching his highlight video in the spring of 2015, Yale head coach James Jones offered him, and Oni committed to play for the team on July 1, 2015. However, since Yale admissions were closed, he spent his next season playing for Suffield Academy, a prep school in Suffield, Connecticut, located near Yale University. With Suffield, Oni averaged 17 points, 6 rebounds and 5 assists and earned New England Preparatory School Athletic Council (NEPSAC) Class A player of the year distinction. On February 5, 2016, he scored 52 points with 11 three-pointers versus Wilbraham & Monson Academy at the National Prep School Invitational, breaking his school record and Shabazz Napier's tournament record. Oni was named most outstanding player of the event."", 'He played college basketball for the Michigan State Spartans.', 'He was a nominee for the 2016 McDonald\'s All-American Boys Game. = Oni made his debut for Yale on November 13, 2016, recording a team-high 24 points, 6 rebounds, and 3 assists in a 98–90 upset win over Washington. In his next game, he posted 13 points, 10 rebounds, and a season-best 5 blocks in an 89–81 victory over Lehigh. Oni claimed Ivy League Rookie of the Week honors in each of his first three weeks with Yale. On February 25, 2017, he scored a season-high 27 points while chipping in 7 rebounds and 4 assists, in a 99–86 win over Dartmouth. By the end of the season, Oni was averaging 12.9 points, 6.3 rebounds, and 2.7 assists per game. He earned second-team All-Ivy League recognition and was named conference Rookie of the Week on five occasions during the season. = Entering the 2017–18 season, the Hartford Courant speculated that the Yale duo of Oni and Makai Mason could be ""one of the top backcourts in the country."" On November 14, 2017, his third appearance in his sophomore season, he led all scorers with 20 points in an 86–54 victory over South Carolina State. Oni erupted for 26 points, his best mark in the season, and recorded team-highs of 7 rebounds and 4 assists on November 25, in a 79–73 loss to Vermont. On February 24, 2018, he flirted with a triple-double in an 83–73 win over Columbia, matching his season-high of 26 points while leading his team with 9 rebounds and 8 assists. Through 29 games, Oni averaged 15.1 points, 6.0 rebounds, and 3.6 assists per game, leading Yale in all three categories. He tied the school record for three-pointers attempted in a single season, with 184. Oni was a three-time Ivy League Player of the Week, unanimous first-team All-Ivy League pick, and National Association of Basketball Coaches (NABC) District 13 second-team selection. = Oni made his junior season debut on November 9, 2018, scoring 16 points in a 76–59 win over California at the Pac-12 China Game held in Shanghai. On November 21, he posted his first double-double of the season, leading his team with 18 points and 10 rebounds in a 79–70 loss to Vermont. On December 1, Oni scored 29 points and was named game MVP in a 77–73 victory over Miami (Florida) at the Hoophall Miami Invitational. He erupted for 31 points, 9 rebounds, and 4 assists, leading his team in each category, on February 2, 2019, in an 89–68 win over Dartmouth. Oni was the first Yale player to record a 30-point game since Anthony Dallier in 2017. In his next game, a 74–60 victory over Princeton, he posted a career-high 35 points, 12 rebounds, and 3 blocks. Oni scored the most single-game points in school history since Greg Mangano in 2012. He delivered another strong performance on March 1, when he scored 30 points—shooting 9-of-11 from the field—to help Yale defeat Cornell, 88–65, and clinch a spot in the 2019 Ivy league tournament. By the end of the regular season, Oni was averaging a team-best 17.4 points, 6.3 rebounds, and 3.6 assists per game. He was named Ivy League Player of the Year, becoming the third Yale player to win the award. In his junior season, Oni frequently attracted attention from NBA scouts, who visited all of his games to see him play. He was considered a top-50 prospect for the 2019 NBA draft and became the first Ivy League player to be drafted since 1995. In December 2018, Duke head coach Mike Krzyzewski predicted that he would be a first-round pick. = On June 20, 2019, Oni was selected as the 58th pick of the 2019 NBA draft by the Golden State Warriors. His draft rights were traded to the Utah Jazz. With the selection, Oni became the first Ivy League men\'s basketball player picked in the NBA draft since Jerome Allen in 1995 and the first Yale Bulldogs men\'s basketball player picked since Chris Dudley in 1987. On July 15, 2019, the Utah Jazz signed Oni. He was assigned to the Salt Lake City Stars for the start of the NBA G League season.', 'He played college basketball at the University of Massachusetts.', 'He played college basketball for the California Golden Bears.', 'He played college basketball for Kentucky.', 'He played college basketball for the University of Kentucky.']",Miye Oni played college basketball for the Yale Bulldogs.,Yale Bulldogs,1.0,0.9821259286691743,0.9666666666473333,0.2,0.7141264769162224,0.8565059076648898
"In what year did AJ Green record his fourth consecutive 1,000 yard season despite missing three games and nearly all of two more due to a concussion?","['He followed that up with eight receptions for 153 receiving yards and a receiving touchdown in a 20–17 victory over Arizona State in the next game. On November 14, against Auburn, he suffered a left shoulder injury, which kept him out of the remaining regular season games. He returned for the 2009 Independence Bowl, December 28, in Shreveport, Louisiana, where he made six catches totaling 57 yards in the 44–20 victory over the Texas A&M Aggies. Green ended the 2009 regular season with 53 catches for 808 yards and six touchdowns, leading the team in all those categories despite missing time due to injury. Among other awards, Green was elected All-SEC First-team by Associated Press, SEC Coaches, ESPN, Phil Steele, and Sporting News. = Green\'s junior season started off tumultuous due to a compliance issue. He was suspended for the first four games of the 2010 regular season after he admitted to selling his 2009 Independence Bowl Jersey for $1,000 to former North Carolina defensive back Chris Hawkins, who the NCAA described as an agent or someone who markets amateur athletes. As part of his punishment, he was required to repay $1,000 to a charity. Green returned from the suspension on October 2 and had seven receptions for 119 receiving yards and two receiving touchdowns in a 29–27 road loss to Colorado. On November 6, against Idaho State, he had six receptions for 103 receiving yards and two receiving touchdowns in the 55–7 victory. In the following game against rival Auburn, he had nine receptions for 164 receiving yards and two receiving touchdowns in the 49–31 road loss. Green finished Georgia\'s 6–7 season with a team-high 57 catches for 848 yards and nine touchdowns. On January 9, 2011, Green officially declared for the 2011 NFL draft. He finished his three seasons at the University of Georgia with 166 receptions for 2,619 yards and 23 touchdowns. = = 2011 season Green was selected in the first round with the fourth overall pick in the 2011 NFL Draft by the Cincinnati Bengals. He became the highest drafted wide receiver in Georgia school history, breaking the mark set by Lindsay Scott, who went 13th overall in 1984. On July 28, 2011, Green agreed to a four-year contract with the Cincinnati Bengals worth $19.6 million. After signing with the Cincinnati Bengals, Green became a member of School of the Legends (SOTL) in 2011. Green was featured in the 2011 NFLPA Rookie Debut ""One Team"" Celebration which streamed live on YouTube from New York City\'s Cipriani Wall Street. The event was produced by SOTL, a licensed partner of the NFLPA, and employed YouTube\'s live streaming platform. Green\'s first NFL reception was a 41-yard touchdown reception from quarterback Bruce Gradkowski against the Cleveland Browns in the Bengals\' 2011 regular season opener, a 27–17 victory. In the following game, Green recorded his first 100-yard game with ten receptions for 124 receiving yards and one receiving touchdown in a 24–22 loss to the Denver Broncos. By the end of his rookie season, Green recorded four 100-yard games and led all NFL rookies in receptions and receiving yards, catching 65 passes for 1,057 yards in 15 games. His seven touchdown receptions were second among rookies – one behind Julio Jones of the Atlanta Falcons. On December 18, 2011, Green and fellow rookie quarterback Andy Dalton surpassed the all-time NFL record for yards and receptions by a rookie quarterback/receiver tandem. One week later on December 24, 2011, Green\'s 1,031 yards surpassed Cris Collinsworth\'s franchise record of 1,009 yards set in 1981 for most receiving yards by a rookie. Green made his playoff debut in the Wild Card Round against the Houston Texans. In the 31–10 loss, he had five receptions for 47 receiving yards. Green earned a Pro Bowl nomination for his rookie season in addition to being named to the NFL All-Rookie Team. He was ranked 77th by his fellow players on the NFL Top 100 Players of 2012. 2012 season In Week 3 of the 2012 regular season, Green caught nine passes for a career-high 183 yards in a 38–31 win over the Washington Redskins. He earned AFC Offensive Player of the Month for September.', ""In Week 5, against the New England Patriots, he re-aggravated his lingering toe injury and missed the following three games. In Week 14, he recorded 224 yards on 11 receptions (a 20.4 average) and one touchdown in a 42–21 loss to the Pittsburgh Steelers. Green's 224 receiving yards marked the third most the Steelers had ever given up in a game to one player. Despite missing three games and nearly all of two more, Green still recorded his fourth consecutive 1,000 yard season, finishing the year with 69 receptions for 1,041 yards and six touchdowns. However, a concussion ultimately forced him to miss the postseason for the first time in his career. He was ranked 37th by his peers on the NFL Top 100 Players of 2015. 2015 season Green was an instrumental part of the Bengals recording a franchise-record tying 12 victories in 2015. In Week 3 of the 2015 season, Green caught 10 passes for a career-high 227 yards and two fourth quarter touchdowns in a 28–24 win over the Ravens. His 227 yards were the second highest single game total in franchise history, trailing only Chad Johnson's 260 receiving yards in a 2006 game against the Chargers. In Week 8, against the Steelers, he had 11 receptions for 118 receiving yards and a touchdown in the 16–10 victory. In Week 12, against the St. Louis Rams, he recorded his second multi-touchdown game of the season. In Week 13 against the Browns and Week 14 against the Steelers, he recorded consecutive 100 yard games while catching another touchdown. He finished the 2015 season with 86 receptions, 1,297 yards, and 10 touchdowns while recording his fifth straight 1,000-yard season to start a career. He joined Randy Moss as the only players in NFL history to accomplish the feat at the time. During the Wild Card Round against the Steelers, he caught five passes for 71 yards and his first postseason touchdown, which put the Bengals up 16–15 with less than two minutes remaining. However, a late turnover and penalty by the Bengals loomed large as the Bengals lost 16–18. He earned his fifth straight Pro Bowl and was ranked 16th by his fellow players on the NFL Top 100 Players of 2016. 2016 season In the Bengals' season opener against the New York Jets, Green had 12 receptions for 180 receiving yards, including a 54-yard touchdown as the Bengals won by a score of 23–22. Green had three key receptions on the Bengals' drive to set up the late go-ahead field goal. In Week 4, he caught 10 passes for 173 receiving yards and a touchdown during a 22–7 victory over the Miami Dolphins on Thursday Night Football. In Week 7, the Bengals defeated the Browns while Green finished the win with eight receptions for 169 receiving yards and a 48-yard touchdown. The following game, Green recorded nine catches for 121 receiving yards in a 27–27 tie with the Redskins. Green returned in Week 10 and caught seven passes for 68 yards and a touchdown during the Bengals' 21–20 loss at the Giants. On November 20, Green sustained a tear to his hamstring in the first quarter of a 16–12 loss to the Buffalo Bills. He was inactive for the next five games before being placed on injured reserve prior to the regular-season finale. Green finished the 2016 season with 66 receptions, 964 receiving yards, and four touchdown receptions in 10 games. This marked the first time in Green's career that he failed to reach 1,000 receiving yards. Despite the injury, Green was named to his sixth straight Pro Bowl on December 20. He was ranked 17th by his peers on the NFL Top 100 Players of 2017. 2017 season In Week 3, against the Green Bay Packers, Green recorded ten receptions for 111 yards and one touchdown in the 27–24 overtime loss. In Week 5 against the Bills, Green had two passes deflected off his hands that were intercepted and he lost a fumble, but still had an impressive outing with seven receptions for 189 receiving yards as the Bengals won 20–16. In Week 9 against the Jacksonville Jaguars, Green got into a fight with Jalen Ramsey, resulting in both players being ejected and his first ever foul. He was later fined $42,541."", 'He had six seasons with 1,000 or more receiving yards. Green signed with the Cardinals in 2021, having finished his Bengals career ranked second in franchise history, behind only Chad Johnson, in receiving yards, receiving touchdowns, and receptions. On September 16, 2023, Green signed a one-day contract with the Bengals to retire with the team. When Green was age 4, his older brother and only sibling died in a car wreck on the way to a school carnival. Green was on his elementary school\'s juggling team, telling The Atlanta Journal-Constitution that he learned to juggle as early as second grade. Green said he could juggle as many as four items at once, and that the ability helped the development of his hand-eye coordination. Green attended Summerville High School in Summerville, South Carolina, where he was a three-sport athlete in football, basketball, and track. He played as a wide receiver for the Summerville Green Wave football team, under coach John McKissick. He was widely considered to be one of the top national football prospects of the Class of 2008 and was listed #1 by Sports Illustrated. Green earned All-State honors four times and was the only junior nominated to the 2006 USA Today All-American first-team following 75 receptions for 1,422 yards and 16 touchdowns during his junior season. Green was also selected as a member of the Rivals.com Junior All-America team based on those stats. As a freshman, he had 57 receptions for 1,217 yards and eight touchdowns. As a sophomore, he had 60 catches for 1,203 yards and 14 touchdowns. Green\'s 5,373 career receiving yards rank second in the all-time career receiving records of the National Federation of High Schools. His 279 career receptions rank fourth. In June 2006, Green was profiled by Sports Illustrated as part of its ""Where Will They Be?"" stories documenting athletes with the potential of becoming a future great, alongside Peter Uihlein, John Tavares, Tyreke Evans, Elena Delle Donne, and others. Sports Illustrated compared him to the then-Oakland Raiders wideout Randy Moss and predicted Green will be in the NFL by 2011. Green was also on the school\'s track & field team, where he competed as a long jumper (top-jump of 19 ft 6 in) and triple jumper (40 ft 0 in). Rivals.com ranked Green as their No. 9 prospect for the high school class of 2008, while Scout.com named Green their No. 10 prospect nationally. He participated in the Under Armour All-America Game. Green was also on the Summerville High high school basketball team that claimed the 2007–2008 South Carolina state championship in a championship game against Spartanburg (S.C.) High. The game was played in memory of their fallen assistant coach, Captain Louis Mulkey of the Charleston Fire Department in South Carolina, who died responding to a fire with eight other firefighters on June 18, 2007. Green verbally committed to attend the University of Georgia in October 2006, and made his commitment official by signing a letter of intent to play at Georgia on February 6, 2008. He played for coach Mark Richt\'s Georgia Bulldogs football team from 2008 to 2010. = Green had a solid freshman season for the 10–3 Georgia Bulldogs in 2008. He joined a wide receivers unit that contained Mohamed Massaquoi, Michael Moore, Kris Durham, and Demiko Goodman. In the fourth game of his college career, against Arizona State, Green had eight catches for 159 yards and a touchdown in the 27–10 victory. For this, he was named SEC Player of the Week. On October 18, against SEC East rival Vanderbilt, he had seven receptions for 132 receiving yards in the 24–14 victory. He finished the 2008 season with 56 catches for 963 yards and eight touchdowns, all Georgia freshman school records. He also led the SEC in receiving yards, with the third-highest total in UGA school history. He was named second-team All-SEC and Freshman of the Year by the SEC coaches, and was named to the Associated Press All-SEC first-team. = As a sophomore, Green became the top option for the Georgia wide receivers group that added newcomers Tavarres King and Rantavious Wooten. Green saw similar opportunities production-wise as a sophomore in Georgia\'s 8–5 season. On September 19, he had seven receptions for 137 receiving yards and two receiving touchdowns in a 52–41 victory on the road against Arkansas.', 'In 2019, Green donated money to elementary school teachers in his hometown of Summerville. List of Cincinnati Bengals first-round draft picks List of National Football League career receiving yards leaders Career statistics from NFL.com · ESPN · Yahoo Sports · Pro Football Reference Georgia Bulldogs bio\n\nIn the 2022–23 season, AJ Green played for Milwaukee in 35 games. He averaged 4.4 points, 1.3 rebounds, 0.6 assists, 0.2 steals, and 0.0 blocks per game. He shot 0.424 from the field, 0.419 from 3-point range, and 1.0 from the free throw line, playing an average of 9.9 minutes per game. In the 2023–24 season, AJ Green played for Milwaukee in 56 games. He averaged 4.5 points, 1.1 rebounds, 0.5 assists, 0.2 steals, and 0.1 blocks per game. He shot 0.423 from the field, 0.408 from 3-point range, and 0.895 from the free throw line, playing an average of 11.0 minutes per game. In the 2024–25 season, AJ Green played for Milwaukee in 73 games. He averaged 7.4 points, 2.4 rebounds, 1.5 assists, 0.5 steals, and 0.1 blocks per game. He shot 0.429 from the field, 0.427 from 3-point range, and 0.815 from the free throw line, playing an average of 22.7 minutes per game. In the 2024 season, AJ Green played for Milwaukee in 6 games. He averaged 2.8 points, 1.5 rebounds, 0.3 assists, 0.0 steals, and 0.0 blocks per game. He shot 0.375 from the field, 0.182 from 3-point range, and 1.0 from the free throw line, playing an average of 11.2 minutes per game. In the 2025 season, AJ Green played for Milwaukee in 5 games. He averaged 11.0 points, 2.8 rebounds, 2.0 assists, 0.0 steals, and 0.2 blocks per game. He shot 0.462 from the field, 0.514 from 3-point range, and 0.5 from the free throw line, playing an average of 27.0 minutes per game. In the 2018–19 season, AJ Green played for Northern Iowa in 34 games. He averaged 15.0 points, 3.0 rebounds, 2.3 assists, 0.6 steals, and 0.1 blocks per game. He shot 0.41 from the field, 0.348 from 3-point range, and 0.864 from the free throw line, playing an average of 29.9 minutes per game. In the 2019–20 season, AJ Green played for Northern Iowa in 31 games. He averaged 19.7 points, 3.0 rebounds, 3.0 assists, 0.7 steals, and 0.0 blocks per game. He shot 0.416 from the field, 0.391 from 3-point range, and 0.917 from the free throw line, playing an average of 34.8 minutes per game. In the 2020–21 season, AJ Green played for Northern Iowa in 3 games. He averaged 22.3 points, 5.7 rebounds, 2.7 assists, 1.3 steals, and 0.7 blocks per game. He shot 0.464 from the field, 0.407 from 3-point range, and 0.667 from the free throw line, playing an average of 36.3 minutes per game. In the 2021–22 season, AJ Green played for Northern Iowa in 31 games. He averaged 18.8 points, 3.7 rebounds, 2.5 assists, 0.8 steals, and 0.0 blocks per game.', ""In Week 10 against the Titans, he recorded five receptions for 115 receiving yards and a touchdown as the Bengals lost 24–20. In Week 13 against the Steelers, he caught two touchdowns in the 23–20 loss. On December 19, 2017, Green was named to his seventh straight Pro Bowl. Overall, he finished the 2017 season with 75 receptions for 1,078 receiving yards and eight touchdowns in the Bengals' 7–9 season. 2017 marked the seventh consecutive season that Green led the Bengals in receiving yards, breaking the mark of six set by Chad Ochocinco and Cris Collinsworth. He was ranked 22nd by his fellow players on the NFL Top 100 Players of 2018. 2018 season On September 13, 2018, Green had the first three-touchdown game of his career against the Ravens, completing the hat-trick in the first half, with each of his first three catches resulting in touchdowns in the 34–23 victory. In Week 4, against the Falcons, with the Bengals trailing by five with only 12 seconds remaining, Dalton connected with Green on a 13-yard pass to give the Bengals the game-winning points. On October 7, in a 27–17 win over the Dolphins in, Green caught six passes for 112 yards, setting a franchise record with his 32nd 100-yard receiving game, breaking the previous mark by Chad Johnson. He suffered a toe injury in Week 8 against the Tampa Bay Buccaneers and missed the next three games. Green returned in Week 13 against the Broncos but re-injured his toe and was placed on injured reserve on December 5. He finished the 2018 season with 46 receptions for 694 receiving yards and six touchdowns, ending his Pro Bowl streak at seven seasons, as the Bengals finished with a 6–10 record. He was ranked 58th by his fellow players on the NFL Top 100 Players of 2019. 2019 season During training camp, Green suffered torn ligaments in his ankle while practicing with the team at Welcome Stadium in Dayton, Ohio. Despite being expected to only miss a handful of games early in the season, he ended up missing the entire year, being inactive for every game before being placed on injured reserve on December 23, 2019. 2020 season On March 16, 2020, the Bengals placed the franchise tag on Green. He signed the one-year tender on July 17, 2020. He made his official return from injury in the Bengals' 2020 regular season opener against the Los Angeles Chargers. He scored his first touchdown since Week 8 of the 2018 season in Week 11 against the Washington Football Team. Overall, in the 2020 season, he finished with 47 receptions for 523 receiving yards and two receiving touchdowns as the Bengals finished with a 4–11–1 record. He finished his Bengals career second to Chad Johnson in receptions, receiving yards, and receiving touchdowns. = 2021 season Green signed a one-year deal worth $8.5 million, with $6 million guaranteed, with the Arizona Cardinals on March 17, 2021. He entered the 2021 season as a starter alongside DeAndre Hopkins and Christian Kirk. In Week 3, against the Jaguars, he had five receptions for 112 yards in the 31–19 victory. For Green, it was his first game reaching at least 100 yards since Week 7 of the 2018 season. In Week 8, against the Packers, Green was targeted on a potential game-winning play by Kyler Murray. A miscommunication on the play led to Green not looking at the thrown pass and it led to an interception by Rasul Douglas. In Week 14, against the Los Angeles Rams, Green eclipsed 10,000 career receiving yards. He finished the season with 54 catches for 848 yards and three touchdowns. 2022 season On April 14, 2022, Green re-signed with the Cardinals on a one-year contract. In his final career game against the San Francisco 49ers, Green recorded three catches for 91 yards, including a 77-yard touchdown reception off a flea-flicker from David Blough. In the 2022 season, Green played in 15 games, starting ten. He finished with 24 receptions for 236 receiving yards and two receiving touchdowns. = On February 6, 2023, Green posted on Instagram that he would be retiring after two seasons with the Cardinals. He finished his NFL career with 10,514 career yards. On September 16, 2023, Green signed a one-day contract with the Bengals to retire with the team. Career best in bold = = On March 21, 2015, he married actress and singer Miranda Brooke, his college sweetheart. They have two sons together."", 'Adriel Jeremiah ""AJ"" Green (born July 31, 1988) is an American former professional football wide receiver who played in the National Football League (NFL) for twelve seasons, primarily with the Cincinnati Bengals. He played college football for the Georgia Bulldogs, earning first-team All-American honors before being selected by the Bengals with the fourth overall pick in the 2011 NFL draft.', ""In Week 6, against the Browns, he had seven receptions for 135 receiving yards and two touchdowns in the 34–24 loss. In Week 9, he caught a 56-yard touchdown against the New York Giants extending his touchdown streak to eight consecutive games, the longest in the NFL by a receiver and second-longest overall. He extended the streak to nine following a four-yard touchdown in a 28–6 victory over the Kansas City Chiefs in Week 11. On December 23, Green recorded his first career lost fumble against the Pittsburgh Steelers, but he finished the game with 10 receptions for 116 yards, including a 21-yard reception that set up the game-winning field goal. Green gained over 100 receiving yards in five different games and was selected to his second Pro Bowl. He finished the season with 97 receptions for 1,350 yards and 11 touchdowns. In the Bengals' Wild Card Round loss to the Texans, he was the team's leading receiver with five receptions for 80 yards. He was ranked 16th by his fellow players on the NFL Top 100 Players of 2013. 2013 season Green started off the 2013 season with nine receptions for 162 receiving yards and two receiving touchdowns in a 24–21 loss to the Chicago Bears. In Week 7, against the Detroit Lions, he scored on a career-long 82-yard touchdown reception on the Bengals' first drive of the game in the 27–24 victory. In Week 10, against the Baltimore Ravens, he recorded a 51-yard touchdown reception on the game's last play in regulation to tie the game. However, the Bengals eventually lost in overtime. He had a franchise-record five consecutive games with at least 100 receiving yards from Week 6 to Week 10. In Week 16, against the Minnesota Vikings, he had seven receptions for 97 receiving yards and two receiving touchdowns in the 42–14 victory. Green set new career highs in 2013 for receptions (98) and receiving yards (1,426, which was the third-highest total in Bengals history), while scoring 11 touchdowns. He was targeted a franchise-record 178 times, breaking the 174 targets for Carl Pickens in 1996. Green was named to his third Pro Bowl and was ranked ninth by his fellow players on the NFL Top 100 Players of 2014. His 260 career receptions set an NFL record for most receptions in a player's first three seasons, which was later broken by Odell Beckham Jr. and Jarvis Landry in 2016 after both tallied 288."", ""The Bengals finished with an 11–5 record and won the AFC North. In the Wild Card Round against the San Diego Chargers, Green had three receptions for 34 yards in the 27–10 loss. 2014 season Green caught six passes for 131 yards, including a 77-yard fourth quarter touchdown reception, in the Bengals 23–16 win over the Ravens in Week 1. In Week 2, he suffered a game-ending ligament injury on the Bengals opening drive against the Falcons, resulting in Green's first career NFL game without a reception. He returned the following week against the Tennessee Titans and recorded six receptions for 102 yards in the 33–7 victory."", 'A.C. Green Jr.', 'He shot 0.462 from the field, .083 from 3-point range, and 0.873 from the free throw line, playing an average of 36.8 minutes per game. In the 1996 season, A.C. Green played for Phoenix in 4 games. He averaged 4.8 points, 4.5 rebounds, 0.5 assists, 0.3 steals, and 0.0 blocks per game.']","AJ Green recorded his fourth consecutive 1,000 yard season in 2015, despite missing three games and nearly all of two more due to a concussion.",2015,0.0,0.9111188671623175,0.5926190476071952,0.75,0.8398089533220818,0.7877491566025943
What was Ronald Dupree's shooting percentage from the field in the specified season?,"[""Ronald Edmund Dupree Jr. (born January 26, 1981) is an American former professional basketball player who played six seasons in the National Basketball Association (NBA). He also played numerous seasons in the NBA Development League, and spent time in Europe and Argentina. After his playing retirement, Dupree was a college basketball assistant coach and works as a scout for the Milwaukee Bucks. Dupree played at Louisiana State University (LSU) under Coach John Brady. He averaged 4.9 points and 3.3 rebounds in 12.7 minutes per game in the Tigers' 2000 Sweet Sixteen season."", ""On December 14, 2007, he was waived so the Pistons could make room for other players obtained in a trade with the Charlotte Bobcats. He was signed to a ten-day contract by the Seattle SuperSonics on April 3, 2008, becoming the last player to sign with the Sonics. Dupree started the 2008–2009 season with the Tulsa 66ers of the NBA Developmental League. Halfway through the season he was traded to the Utah Flash, and helped take that team to the D-League finals. Dupree was invited to training camp with the Utah Jazz for preparation to the 2009–2010 season. However, he did not make their final roster. He signed a non-guaranteed contract with the Toronto Raptors on September 16, 2010. Dupree was released from the Toronto Raptors roster on October 19, 2010. He was re-signed by Toronto on December 26, 2010, but waived again on January 5, 2011. He signed with the Argentine team Regatas Corrientes in January 2012. He then signed with the Italian team Andrea Costa Imola Basket in February 2012. In September 2012, he joined the Memphis Grizzlies, but he did not make the team's regular season roster. On January 4, 2013, Dupree was acquired by the Los Angeles D-Fenders. On February 25, 2013, Dupree was traded to the Reno Bighorns. On August 8, 2013, he signed a two-year deal with Hapoel Jerusalem. On September 10, 2014, he announced his retirement and became a student assistant on the LSU men's basketball staff. Dupree returned to LSU as a student assistant coach in 2014. He was elevated to the position of director of student development for the 2015–16 season. Dupree was hired by the Nevada Wolf Pack men's basketball team as an assistant coach for the 2016–17 season. He departed the position in 2017 to join the Milwaukee Bucks as a scout. = = Career statistics from NBA.com · Basketball Reference LSU Tigers bio\n\nIn the 2003–04 season, Ronald Dupree played for Chicago in 47 games. He averaged 6.2 points, 3.6 rebounds, 1.2 assists, 0.7 steals, and 0.4 blocks per game. He shot 0.394 from the field, 0.444 from 3-point range, and 0.629 from the free throw line, playing an average of 19.0 minutes per game. In the 2004–05 season, Ronald Dupree played for Detroit in 47 games. He averaged 3.2 points, 2.0 rebounds, 0.5 assists, 0.1 steals, and 0.2 blocks per game. He shot 0.48 from the field, 0.5 from 3-point range, and 0.617 from the free throw line, playing an average of 10.0 minutes per game. In the 2005–06 season, Ronald Dupree played for Minnesota in 36 games. He averaged 2.2 points, 1.4 rebounds, 0.4 assists, 0.3 steals, and 0.0 blocks per game. He shot 0.524 from the field, 0.0 from 3-point range, and 0.341 from the free throw line, playing an average of 7.4 minutes per game. In the 2006–07 season, Ronald Dupree played for Detroit in 19 games. He averaged 1.3 points, 0.9 rebounds, 0.3 assists, 0.3 steals, and 0.1 blocks per game. He shot 0.355 from the field, 0.0 from 3-point range, and 0.333 from the free throw line, playing an average of 4.9 minutes per game. In the 2007–08 season, Ronald Dupree played for Detroit in 1 games. He averaged 0.0 points, 0.0 rebounds, 0.0 assists, 0.0 steals, and 0.0 blocks per game. He shot 0.0 from the field, 0.0 from 3-point range, and 0.0 from the free throw line, playing an average of 3.0 minutes per game. In the 2007–08 season, Ronald Dupree played for Seattle in 4 games. He averaged 1.0 points, 2.0 rebounds, 0.3 assists, 0.3 steals, and 0.0 blocks per game. He shot 0.333 from the field, 0.0 from 3-point range, and 1.0 from the free throw line, playing an average of 4.5 minutes per game. In the 2010–11 season, Ronald Dupree played for Toronto in 3 games. He averaged 0.7 points, 1.0 rebounds, 0.3 assists, 0.0 steals, and 0.0 blocks per game. He shot 0.25 from the field, 0.0 from 3-point range, and 0.0 from the free throw line, playing an average of 4.3 minutes per game. In the 2005 season, Ronald Dupree played for Detroit in 14 games. He averaged 0.3 points, 0.4 rebounds, 0.0 assists, 0.0 steals, and 0.0 blocks per game."", 'He shot .607 from the field, — from 3-point range, and 0.738 from the free throw line, playing an average of 22.9 minutes per game.', 'He shot 0.623 from the field, .500 from 3-point range, and 0.711 from the free throw line, playing an average of 32.0 minutes per game.', 'He shot 0.561 from the field, .250 from 3-point range, and 0.752 from the free throw line, playing an average of 22.9 minutes per game.', 'He shot 0.483 from the field, 0.322 from 3-point range, and 0.752 from the free throw line, playing an average of 32.9 minutes per game.', 'He shot 0.608 from the field, 0.5 from 3-point range, and 0.692 from the free throw line, playing an average of 27.7 minutes per game.', 'He shot 0.616 from the field, 0.25 from 3-point range, and 0.72 from the free throw line, playing an average of 30.6 minutes per game.', 'He shot 0.612 from the field, 0.343 from 3-point range, and 0.733 from the free throw line, playing an average of 33.5 minutes per game.', 'He shot 0.636 from the field, .214 from 3-point range, and 0.701 from the free throw line, playing an average of 28.8 minutes per game.']",Ronald Dupree's shooting percentage from the field in the 2003–04 season was 0.394.,0.286,1.0,0.9706770961597834,0.9999999999666667,0.0,0.1931343148546495,0.772537259418598
In which year did Kirk Haston play basketball?,"['Kirk Haston (born March 10, 1979) is an American former professional basketball player and politician. He played for Indiana University under coach Bobby Knight between 1998–99 and 2000–01. He was subsequently drafted 16th overall in 2001 by the Charlotte Hornets, with whom he played a reserve role for two years during the team\'s transition to New Orleans. Since 2019, Haston has been a member of the Tennessee House of Representatives, representing Tennessee\'s 72nd state congressional district as a Republican. Born in Lobelville, Tennessee, he attended Perry County High School in Linden, Tennessee, where, as a senior, he was a part of the 37–0 Class A state championship team, being named Class A ""Mr.', 'The expulsion was widely characterized as unprecedented. = Source = Source Regular season Playoffs = Source Regular season = = = Career statistics from NBA.com · Basketball Reference\n\nIn the 1998–99 season, Kirk Haston played for Indiana in 34 games. He averaged 9.9 points, 6.5 rebounds, 0.9 assists, 0.6 steals, and 0.8 blocks per game. He shot 0.514 from the field, – from 3-point range, and 0.753 from the free throw line, playing an average of 22.4 minutes per game. In the 1999–00 season, Kirk Haston played for Indiana in 29 games. He averaged 15.3 points, 8.3 rebounds, 1.4 assists, 0.8 steals, and 1.2 blocks per game. He shot 0.496 from the field, .000 from 3-point range, and 0.73 from the free throw line, playing an average of 27.4 minutes per game. In the 2000–01 season, Kirk Haston played for Indiana in 33 games. He averaged 19.0 points, 8.7 rebounds, 1.2 assists, 1.1 steals, and 1.2 blocks per game. He shot 0.44 from the field, .377 from 3-point range, and 0.687 from the free throw line, playing an average of 30.8 minutes per game. In the 2001–02 season, Kirk Haston played for Charlotte in 15 games. He averaged 1.7 points, 1.3 rebounds, 0.3 assists, 0.0 steals, and 0.1 blocks per game. He shot 0.282 from the field, 0.0 from 3-point range, and 0.5 from the free throw line, playing an average of 5.1 minutes per game. In the 2002–03 season, Kirk Haston played for New Orleans in 12 games. He averaged 0.5 points, 0.6 rebounds, 0.3 assists, 0.0 steals, and 0.4 blocks per game. He shot 0.118 from the field, 0.0 from 3-point range, and 0.5 from the free throw line, playing an average of 4.8 minutes per game. In the 2002 season, Kirk Haston played for Charlotte in 2 games. He averaged 1.0 points, 0.5 rebounds, 0.0 assists, 0.5 steals, and 0.0 blocks per game. He shot 1.0 from the field, – from 3-point range, and – from the free throw line, playing an average of 2.0 minutes per game. In the 2004–05 season, Kirk Haston played for Florida in 46 games. He averaged 16.4 points, 7.9 rebounds, 1.6 assists, 1.1 steals, and 1.6 blocks per game. He shot 0.456 from the field, 0.444 from 3-point range, and 0.705 from the free throw line, playing an average of 36.4 minutes per game.', ""His college career took place under head coach Bob Knight and Mike Davis at Indiana University where, in the 2000–01 season he led the Big Ten Conference in scoring and was a third-team All-American selection. In the 2000–01 season, Haston's buzzer-beating three-pointer helped IU beat the defending champion and top-ranked Michigan State 59–58 at Assembly Hall. During his sophomore year, he lost his mother, Patti Kirk Haston, 48, in a tornado that hit the county seat, Linden, Tennessee on May 5, 1999. Haston was selected 16th overall by the Charlotte Hornets in the 2001 NBA draft; many analysts, who had pegged Haston in the late first round-early second round area, thought that the Hornets took Haston to be a 'zone breaker', working against the change in rules that allowed some forms of the zone defense in games. Haston was known for his sky hook shot and shooting range for a forward/center. Haston averaged 1.2 points and 1 rebound per game, playing in 27 games. Haston would only play in the NBA for 2 years as his final NBA game was played on March 7, 2003, in a 102–76 win over the Cleveland Cavaliers. In his final game, Haston recorded 2 points and 1 rebound in 8 minutes of play. He played the 2004–05 season with the Florida Flame for head coach Dennis Johnson in the NBA D-League. There he averaged 16 points, 7.9 rebounds, 1.2 blocks per game and was selected to the All NBDL First-Team. His season came to an end when he suffered a right knee injury that required season-ending knee surgery with three games remaining. In 2005, he signed with Upea Capo D'Orlando of the Serie A. He and his wife Kasey soon returned from Sicily to Middle Tennessee when he was waived due to a right knee injury prior to the start of the season. In 2010, he came back to Perry County High School to coach the boys basketball team. He then led his alma mater to two state appearances in his first seasons. In 2012, the Perry County Vikings finished their season as state runner-up. In 2016 he published Days of Knight: How the General Changed My Life in which he details his mostly positive experiences playing for then Indiana Coach Bob Knight. Knight provided assistance and an endorsement during Haston's 2018 campaign to the Tennessee House of Representatives. In 2018, Haston was elected to the Tennessee House of Representatives, representing District 72. He won with 81% of the vote. Haston was inaugurated on January 8, 2019. That same month, Haston was appointed as the Vice Chairman of Tennessee's House Education Committee. In 2023, Haston supported a resolution to expel three Democratic lawmakers from the legislature for violating decorum rules."", 'Kirk James Hinrich ( HYNE-rik born January 2, 1981) is an American former professional basketball player. He has also been a member of the USA National Team. Growing up in Sioux City, Iowa, Hinrich was exposed to basketball at an early age. His father, Jim, coached him from the third grade through high school. As a high school senior, Hinrich was named the 1999 Co-Iowa Mr. Basketball, along with future college teammate and roommate Nick Collison. Hinrich originally committed to play basketball at Iowa State but when the coach at the time, Tim Floyd, took the head coaching position for the NBA\'s Chicago Bulls, Hinrich changed his mind and decided to attend the University of Kansas. Hinrich helped Kansas to consecutive Final Fours in 2002 and 2003, his junior and senior seasons. He was drafted by the Chicago Bulls with the seventh pick in the 2003 NBA Draft, where he earned the nickname ""Captain Kirk"". Hinrich was the Bulls\' all-time leader in three-point field goals until November 29, 2024 when this was surpassed by Zach LaVine. After seven seasons with the Bulls, he had short stints with the Washington Wizards and Atlanta Hawks before returning to the Bulls in 2012. In 2016, he was traded back to the Atlanta Hawks. Hinrich was born to Jim and Nancy Hinrich of Sioux City, Iowa. His father played basketball at Briar Cliff College and later became a coach for Sioux City West High School. When Hinrich was about seven years old, Jim Hinrich visited Ray Nacke, his old college coach, and asked if Kirk could enroll in Nacke\'s summer camp for fourth, fifth, and sixth graders. Despite Nacke\'s hesitations, Hinrich was allowed to attend the camp, and played well against the older children. After just two years, Hinrich advanced to Nacke\'s camp for young teenagers, and excelled there, as well. Hinrich also played football at the quarterback position, and baseball as a pitcher. However, basketball was Hinrich\'s passion. His role model was Seattle SuperSonics star Gary Payton, a player known for his strong defense. With his father as coach, Hinrich\'s basketball team at Sioux City West High School achieved an 82–9 record over four years, and won the Iowa state championship when Hinrich was a senior. When he graduated, Hinrich was West High\'s all-time leader in points, steals, and assists. As a freshman with the University of Kansas Jayhawks, Hinrich tallied 123 assists and received the Clyde Lovellette Most Improved Player Award. The next year, he ranked eighth in the nation in assists per game (6.9), led his team in steals, and set a Kansas Jayhawks record with a .505 three-point shooting mark. Hinrich was also voted onto the Associated Press All-Big 12 Second Team and earned All Third Team status from the NCAA coaches. In his fourth and final season at Kansas, Hinrich, along with power forward Nick Collison, led the Jayhawks to the Final Four, and was voted onto the All-Big 12 Second Team by coaches and the media. He led his team in free throw shooting and three-point shooting, contributed 5.0 assists per game and received Kansas\' Ted Owens Defensive Player Award. Kansas lost to Syracuse in the championship Game but Hinrich was named the Midwest Region\'s Most Outstanding Player. He ranked second on his team in scoring and led it in three-pointers, while also contributing 3.5 assists per game, 3.9 rebounds per game and 1.9 steals a game. Following the season, he was named a third-team All-American by the Associated Press. On March 1, 2009, Kansas retired Hinrich\'s number 10 jersey and raised it to the rafters of Allen Fieldhouse. Hinrich\'s was the 25th jersey to be retired by Kansas and is an honor reserved for the highest caliber of player, which includes names like Wilt Chamberlain and Paul Pierce. Hinrich was quoted as saying: ""I don\'t know if there\'s a greater honor in basketball than to have your jersey hanging in the most historic basketball building in the world. It\'s an unbelievable honor."" = 2003 draft Hinrich was selected by the Chicago Bulls in the 2003 NBA draft with the seventh overall pick, resulting in mild surprise because he had been expected to be a mid to late first-round draft pick. Some doubted that his college game would translate successfully to the professional league, in part because he played shooting guard for his final two years in college and was considered too small to play that position professionally. Hinrich\'s high selection in the draft is credited to a good workout in front of NBA team scouts. The Bulls needed a point guard, as Jay Williams was severely injured in a motorcycle accident. After being picked by the Bulls, Hinrich said he knew they had a need at point guard: ""I know Jay... [W]e came out of high school the same year. He\'s a great guy. I feel for him, but the rumors were Chicago was going to take a point guard, so I had a good chance to be drafted. The situation is tough.', ""He was selected by the Milwaukee Bucks in the second round (44th pick overall) of the 1990 NBA draft. He was an assistant basketball coach at the University of Oklahoma under his former college coach Lon Kruger. Henson played collegiately at Kansas State University, where he was named to the All-Big Eight Conference first team in 1989. He is Kansas State's all-time leader in assists, and remains in the top ten on the all-time NCAA career free throw percentage list, with a .900 mark. He was also a track and field decathlete at Kansas State. In six seasons in the NBA, Henson played for the Bucks, Atlanta Hawks, Charlotte Hornets, Portland Trail Blazers, and Detroit Pistons. During his NBA career, Henson appeared in 238 games and averaged 3.1 points per game. = = Since retiring from playing basketball, Henson has turned to coaching."", 'You pay your debt to society and you humble yourself and you learn from your mistakes. So everybody deserves a second chance, maybe a third chance."" = = Media related to Kirk Snyder at Wikimedia Commons Career statistics from NBA.com · Basketball Reference\n\nIn the 2004–05 season, Kirk Snyder played for Utah in 68 games. He averaged 5.0 points, 1.8 rebounds, 0.5 assists, 0.4 steals, and 0.3 blocks per game. He shot 0.372 from the field, 0.353 from 3-point range, and 0.667 from the free throw line, playing an average of 13.3 minutes per game. In the 2005–06 season, Kirk Snyder played for NO/Oklahoma City in 68 games. He averaged 8.0 points, 2.4 rebounds, 1.5 assists, 0.4 steals, and 0.3 blocks per game. He shot 0.453 from the field, 0.357 from 3-point range, and 0.735 from the free throw line, playing an average of 19.3 minutes per game. In the 2006–07 season, Kirk Snyder played for Houston in 39 games. He averaged 4.9 points, 2.1 rebounds, 1.0 assists, 0.3 steals, and 0.3 blocks per game. He shot 0.452 from the field, 0.25 from 3-point range, and 0.653 from the free throw line, playing an average of 14.4 minutes per game. In the 2007–08 season, Kirk Snyder played for Houston in 9 games. He averaged 3.8 points, 1.3 rebounds, 0.9 assists, 0.1 steals, and 0.1 blocks per game. He shot 0.464 from the field, 0.222 from 3-point range, and 0.545 from the free throw line, playing an average of 9.0 minutes per game. In the 2007–08 season, Kirk Snyder played for Minnesota in 27 games. He averaged 8.4 points, 4.2 rebounds, 2.1 assists, 0.7 steals, and 0.5 blocks per game. He shot 0.516 from the field, 0.214 from 3-point range, and 0.753 from the free throw line, playing an average of 25.2 minutes per game. In the 2007 season, Kirk Snyder played for Houston in 3 games. He averaged 0.7 points, 0.3 rebounds, 0.0 assists, 0.0 steals, and 0.0 blocks per game. He shot 0.333 from the field, 0.0 from 3-point range, and 0.0 from the free throw line, playing an average of 3.0 minutes per game.', 'Scott Russell Haskin (born September 19, 1970) is an American former professional basketball player who was selected by the Indiana Pacers in the first round (14th pick overall) of the 1993 NBA draft. Haskin played one season in the National Basketball Association (NBA) for the Pacers, appearing in 27 games and averaging 2.0 ppg. He played collegiately at Oregon State University.', 'In a game against the Boston Celtics, he had 9 steals. He also scored a career-high 43 points in a game against the Orlando Magic. = In 1993, Hawkins was traded to the Charlotte Hornets for Dana Barros, Sidney Green and draft picks. In 1994, he grabbed a career-high 14 rebounds against the Houston Rockets. Hawkins wore #32 with the Hornets during the 1993–94 season since Alonzo Mourning wore #33. Next season, he would change his jersey number to #3. = After two productive seasons in Charlotte, Hawkins and David Wingate were traded to the Seattle SuperSonics for Kendall Gill. In 1996, he played a key role, complementing Gary Payton, Detlef Schrempf and Shawn Kemp on a Sonics team that made it to the NBA Finals but lost 2–4 to his hometown team, the Chicago Bulls. He won the NBA Sportsmanship Award in his final season in Seattle. = On August 12, 1999, Hawkins was traded along with James Cotton to the Bulls for Brent Barry, but his one-year tenure in Chicago was marred by injury, and he only averaged 7.9 points per game in 61 games. = He returned to Charlotte as a free agent in 2000 for his final season, and he retired in 2001 with 14,470 career points. = Regular season Playoffs = Hawkins was named as an assistant by head coach Ty Amundsen for the 2006–2007 season at Estrella Foothills High School varsity basketball in Goodyear, Arizona. He also came to the Hoopfest in 2009.', ""5 player in the nation in 2008. He played three seasons of college basketball for the University of Tennessee under head coach Bruce Pearl from 2008 to 2011. = Hopson went undrafted in the 2011 NBA draft. In August 2011, he signed with Kolossos Rodou of the Greek Basket League for the 2011–12 season. = In July 2012, Hopson signed with Hapoel Eilat of the Israeli Basketball Super League for the 2012–13 season. In 33 games, he averaged 17.7 points and 5.2 rebounds per game. = In July 2013, Hopson signed with Anadolu Efes of the Turkish Basketball League for the 2013–14 season. His final game for Anadolu Efes came on January 13, 2014. = On March 31, 2014, Hopson signed with the Cleveland Cavaliers. He had two assignments with the Canton Charge of the NBA Development League during April 2014. On July 12, 2014, Hopson was traded, along with cash considerations, to the Charlotte Hornets in exchange for Brendan Haywood and the draft rights to Dwight Powell. The next day, the Hornets traded him to the New Orleans Pelicans in exchange for cash considerations. Two days later, he was traded again, this time to the Houston Rockets. On September 17, 2014, he was traded, along with Alonzo Gee, to the Sacramento Kings in exchange for Jason Terry and two future second-round draft picks. On September 24, 2014, he was waived by the Kings. = On December 7, 2014, Hopson was acquired by the Sioux Falls Skyforce of the NBA Development League. On February 24, 2015, Hopson set two Skyforce single-game records, scoring 52 points and making 21 field goals in a win over the Reno Bighorns. = On April 21, 2015, Hopson signed with Laboral Kutxa of Spain for the rest of the 2014–15 ACB season. = In September 2015, Hopson signed with the Foshan Long Lions of China for the 2015–16 CBA season. He played seven games for Foshan in November 2015, before leaving the team. = On July 24, 2016, Hopson signed with Croatian club Cedevita Zagreb. = On February 11, 2017, Hopson signed with Israeli club Ironi Nahariya for the rest of the 2016–17 season. = On July 20, 2017, Hopson signed with Turkish club Galatasaray for the 2017–18 season. He left Galatasaray in January 2018. = On February 26, 2018, Hopson signed a 10-day contract with the Dallas Mavericks. After appearing in one game, he was not offered a second 10-day contract. = On October 10, 2018, Hopson signed with the Oklahoma City Thunder. He was waived two days later and subsequently joined the Thunder's NBA G League affiliate, the Oklahoma City Blue. On February 14, 2019, he signed a 10-day contract with the Thunder. He did not appear in a game for the Thunder during his stint and returned to the Blue after the contract expired. = On April 18, 2019, Hopson returned to Israel for a third stint, signing with Hapoel Holon. He suffered a foot injury in his first game with Holon and was later ruled out for the rest of the season. = On July 31, 2019, Hopson signed with the New Zealand Breakers for the 2019–20 NBL season. Early in the season, he split a ligament in his knee."", ""He played collegiately with the Kentucky Wildcats men's basketball team. Hanson was born in Charlotte, North Carolina and graduated from high school in Pulaski County, Kentucky. ""]",Kirk Haston played basketball during the years 1998-2001 in college and from 2001 to 2003 in the NBA.,Kirk Haston played basketball in the year mentioned in the document.,0.5,0.9671086986472129,0.9999999999666667,1.0,0.23621303810639366,0.9448521524255746
In what year was Adonal Foyle inducted into the World Sports Humanitarian Hall of Fame?,"['He also became a member of the National Basketball Players Association executive committee. He was elected to the Common Cause National Governing Board in 2008. On September 24, 2009, Foyle was inducted into the World Sports Humanitarian Hall of Fame. Only eight other NBA players have been inducted into the World Sports Humanitarian Hall of Fame (Nate ""Tiny"" Archibald, Vlade Divac, Julius Erving, A. C.', 'Green, Kevin Johnson, Dikembe Mutombo, David Robinson and Steve Smith). In 2013, Foyle released his first children\'s book, called Too Tall Foyle Finds His Game. In January 2014, Foyle traveled to Spain and Morocco as a Sports Diplomacy Sports Envoy for the U.S. Department of State. In this function, he worked with Ruth Riley to conduct basketball clinics for more than 600 youth from under-served areas. In so doing, Foyle helped contribute to Sports Diplomacy\'s mission to promote conflict resolution, leadership, greater understanding and inclusion through sport. The Golden State Warriors appointed Foyle as the team\'s community ambassador in 2014. = = List of NCAA Division I men\'s basketball career blocks leaders List of NCAA Division I men\'s basketball season blocks leaders Adonal Foyle\'s homepage Career statistics from NBA.com · Basketball Reference ""Adonal Foyle biography"". NBA.com.', ""Adonal David Foyle (born March 9, 1975) is a Vincentian-American former professional basketball center. He was selected by the Golden State Warriors with the eighth overall selection of the 1997 NBA draft. Foyle played ten seasons with the Warriors until the team bought out his contract on August 13, 2007. At the time, he had been Golden State's longest-tenured player. He then played two seasons with the Orlando Magic and part of the 2008–09 season with the Memphis Grizzlies, sat out the next season due to knee surgery, and retired. As of 2018, Foyle does Warriors post-game commentary for ABC 7 in San Francisco. Foyle was born in Canouan, St."", 'Walter Kennedy Citizenship Award in 2001 and 2009. For his feats, Sporting News named him as one of the ""Good Guys in Sports"" in 1999 and 2000.', 'He transferred after sophomore year and attended high school at Hamilton Central School (Hamilton, New York), where he helped the HCS Emerald Knights gain their first two state championships. As of 2016, his 47 points and 25 rebounds in the NYSPHSAA Class D semifinals in 1994 are tied for the most in either statistical category in a state tournament game. In his official biography, Foyle explained that he enrolled at Colgate University because ""he wanted the opportunity to learn the principles of the game in a slower-paced setting, where the coach would be able to give him the attention he desired."" With the Colgate Raiders, he was the school\'s all-time-leading rebounder and 2nd-all-time-leading scorer. He led the Raiders to their first two NCAA tournament appearances in school history. He left as the NCAA\'s all-time leader in blocked shots with 492, despite playing only three college seasons (his record was broken by Wojciech Myrda in 2002). He now ranks third all-time, behind Myrda and Jarvis Varnado. In 1999, Foyle graduated from Colgate magna cum laude with a history degree. Politically motivated, he founded the organization Democracy Matters, which tries to curb the effects of money on politics. In his NBA career, Foyle averaged 4.1 points and 1.6 blocks per game. He was among the top 10 in blocks per game three times during his career. In July 2004, during the offseason, the Golden State Warriors re-signed Foyle to a six-year, $42 million contract. Foyle played sparingly during the 2006–07 season under head coach Don Nelson, and was waived by the Warriors on August 13, 2007, with three years and $29.2 million remaining on his contract. On August 23, 2007, Foyle signed with the Orlando Magic for the veteran\'s minimum of $1.3 million. On August 2, 2008, he re-signed with the Magic for another year, also at the veteran\'s minimum. He was traded to the Memphis Grizzlies on February 19, 2009. On March 1, 2009, the Grizzlies waived Foyle. He signed with the Orlando Magic on March 23, 2009, for the rest of the season. Later that year, in August, Foyle re-signed with the Magic. However, he underwent arthroscopic knee surgery before the season began, and did not play that season. On August 17, 2010, Foyle announced his retirement. On September 7, 2010, the Magic named Foyle the team\'s director of player development, which he held until 2012. In his spare time, Foyle writes poems and is a political activist. He has reviewed books for Hoop magazine. In 2001, he founded Democracy Matters, a non-partisan student organization, as an effort to counteract political apathy on college campuses. The organization\'s signature issue is campaign finance reform, particularly Clean Elections. Active on over 50 college campuses, Democracy Matters involves hundreds of students and faculty nationwide through teach-ins, letter writing and petition campaigns, educational seminars, and voter registration drives. In 2005, Foyle founded the Kerosene Lamp Foundation, which serves children in St.', 'Archived from the original on January 20, 2010. Retrieved August 19, 2005.{{cite web}}: CS1 maint: bot: original URL status unknown (link) at NBA.com Kerosene Lamp Foundation Democracy Matters C-SPAN Q&A interview with Foyle, March 5, 2006\n\nIn the 1997–98 season, Adonal Foyle played for Golden State in 55 games. He averaged 3.0 points, 3.3 rebounds, 0.3 assists, 0.2 steals, and 0.9 blocks per game. He shot 0.406 from the field, 0.0 from 3-point range, and 0.435 from the free throw line, playing an average of 11.9 minutes per game. In the 1998–99 season, Adonal Foyle played for Golden State in 44 games. He averaged 2.9 points, 4.4 rebounds, 0.4 assists, 0.3 steals, and 1.0 blocks per game. He shot 0.43 from the field, 0.0 from 3-point range, and 0.49 from the free throw line, playing an average of 14.0 minutes per game. In the 1999–00 season, Adonal Foyle played for Golden State in 76 games. He averaged 5.5 points, 5.6 rebounds, 0.6 assists, 0.3 steals, and 1.8 blocks per game. He shot 0.508 from the field, 0.0 from 3-point range, and 0.378 from the free throw line, playing an average of 21.8 minutes per game. In the 2000–01 season, Adonal Foyle played for Golden State in 58 games. He averaged 5.9 points, 7.0 rebounds, 0.8 assists, 0.5 steals, and 2.7 blocks per game. He shot 0.416 from the field, 0.0 from 3-point range, and 0.441 from the free throw line, playing an average of 25.1 minutes per game. In the 2001–02 season, Adonal Foyle played for Golden State in 79 games. He averaged 4.8 points, 4.9 rebounds, 0.5 assists, 0.5 steals, and 2.1 blocks per game. He shot 0.444 from the field, 0.0 from 3-point range, and 0.398 from the free throw line, playing an average of 18.8 minutes per game. In the 2002–03 season, Adonal Foyle played for Golden State in 82 games. He averaged 5.4 points, 6.0 rebounds, 0.5 assists, 0.5 steals, and 2.5 blocks per game. He shot 0.536 from the field, 0.0 from 3-point range, and 0.673 from the free throw line, playing an average of 21.8 minutes per game. In the 2003–04 season, Adonal Foyle played for Golden State in 44 games. He averaged 3.1 points, 3.8 rebounds, 0.4 assists, 0.1 steals, and 1.0 blocks per game. He shot 0.454 from the field, 0.0 from 3-point range, and 0.543 from the free throw line, playing an average of 13.0 minutes per game. In the 2004–05 season, Adonal Foyle played for Golden State in 78 games. He averaged 4.5 points, 5.5 rebounds, 0.7 assists, 0.3 steals, and 2.0 blocks per game. He shot 0.502 from the field, 0.0 from 3-point range, and 0.556 from the free throw line, playing an average of 21.8 minutes per game. In the 2005–06 season, Adonal Foyle played for Golden State in 77 games. He averaged 4.5 points, 5.5 rebounds, 0.4 assists, 0.6 steals, and 1.6 blocks per game. He shot 0.507 from the field, 0.0 from 3-point range, and 0.612 from the free throw line, playing an average of 23.7 minutes per game. In the 2006–07 season, Adonal Foyle played for Golden State in 48 games. He averaged 2.2 points, 2.6 rebounds, 0.4 assists, 0.2 steals, and 1.0 blocks per game. He shot 0.565 from the field, 0.0 from 3-point range, and 0.44 from the free throw line, playing an average of 9.9 minutes per game. In the 2007–08 season, Adonal Foyle played for Orlando in 82* games. He averaged 1.9 points, 2.5 rebounds, 0.2 assists, 0.2 steals, and 0.5 blocks per game. He shot 0.458 from the field, 0.0 from 3-point range, and 0.471 from the free throw line, playing an average of 9.4 minutes per game. In the 2008–09 season, Adonal Foyle played for Orlando in 9 games. He averaged 1.9 points, 2.9 rebounds, 0.1 assists, 0.0 steals, and 0.9 blocks per game. He shot 0.636 from the field, 0.0 from 3-point range, and 0.5 from the free throw line, playing an average of 6.6 minutes per game. In the 2008–09 season, Adonal Foyle played for Memphis in 1 games. He averaged 0.0 points, 0.0 rebounds, 0.0 assists, 0.0 steals, and 0.0 blocks per game. He shot 0.0 from the field, 0.0 from 3-point range, and 0.0 from the free throw line, playing an average of 3.0 minutes per game. In the 2007 season, Adonal Foyle played for Golden State in 3 games. He averaged 0.7 points, 0.7 rebounds, 0.0 assists, 0.0 steals, and 0.0 blocks per game. He shot 1.0 from the field, 0.0 from 3-point range, and 0.0 from the free throw line, playing an average of 2.0 minutes per game. In the 2008 season, Adonal Foyle played for Orlando in 3 games. He averaged 0.7 points, 1.0 rebounds, 0.0 assists, 0.0 steals, and 0.0 blocks per game. He shot 0.333 from the field, 0.0 from 3-point range, and 0.0 from the free throw line, playing an average of 3.7 minutes per game. In the 2009 season, Adonal Foyle played for Orlando in 2 games. He averaged 0.0 points, 0.5 rebounds, 0.0 assists, 0.0 steals, and 0.0 blocks per game. He shot 0.0 from the field, 0.0 from 3-point range, and 0.0 from the free throw line, playing an average of 2.0 minutes per game.', 'He was inducted as a player into the Naismith Memorial Basketball Hall of Fame on September 10, 2004, in his first year of eligibility.', 'Vincent & the Grenadines. He played a cameo role of ""detective"" in the 2006 movie The Darwin Awards. Foyle became an American citizen on March 13, 2007, after being in the U.S. for almost 18 years.', ""Vincent and the Grenadines. At the age of 15, Foyle was adopted by Joan and Jay Mandle, professors at Colgate University. He first attended high school at Cardinal O'Hara Catholic High in Springfield, Pennsylvania."", 'In 2018, he was named to the Maryland State Athletic Hall of Fame.']","Adonal Foyle was inducted into the World Sports Humanitarian Hall of Fame on September 24, 2009.",2009,1.0,0.9927901807157858,0.9999999999,1.0,0.9456309470681745,0.7826341602731486
In which year did Cozell McQueen lead the Italian Serie A league in blocks per game?,"[""Though he briefly played in the NBA for the Detroit Pistons, the majority of his professional career took place in the minor leagues and in Europe. He played as a center. As a sophomore, McQueen took part in North Carolina State's 1983 NCAA title. He sunk an off-balance shot to tie the overtime game against Pepperdine in the first round of the Tournament. In the semifinal against Georgia, McQueen - who had more playing than usual as the Wolfpack dropped their three-guard lineup - posted a career-high 13 rebounds and added 8 points. In the final against favourites Houston, he had 12 rebounds and 4 points whilst also defending Hakeem Olajuwon as NC State earned an upset win to win the tournament. He finished his collegiate career in 1985 with 5.3 points and 6 rebounds per game on average. He was drafted by the Milwaukee Bucks in the 4th round of the 1985 NBA draft, he was waived by the Bucks a week later. McQueen signed with Spanish side Cacaolat Granollers the same year but was again released, having only played in the Catalan league. McQueen then moved to the Continental Basketball Association, playing with the Wisconsin Flyers. He was signed as a free-agent by the New York Knicks in August 1986 but was released without playing a competitive game less than two months later. He then returned to play in the CBA. He averaged 11.9 points and 10.2 rebounds for the La Crosse Catbirds in the CBA for the first half of the 1986–1987 season. McQueen was signed by the Detroit Pistons in January 1987 on a 10-day contract as an injury replacement for Rick Mahorn. Though he posted 6 points (on 3 for 3 shooting) and 8 rebounds in 7 minutes, he could not find space in a roster containing Adrian Dantley, John Salley and Dennis Rodman and left after 3 games, finishing the season with the Catbirds. McQueen then moved abroad, returning to his birth country, France, to play for Tours in the Pro A. He had 12 points, 10.6 rebounds and 1.5 blocks in 37.3 minutes per game for 1987–88. For the next season, he moved to the Italian Serie A, signing with Paini Napoli. He led the league in blocks with 2.1 per game in 1988–89, adding 16.3 points and 11.5 rebounds in 35.4 minutes. Joining Philips Milano in 1990, he had 10.2 points, 12.1 rebounds and 1.3 blocks in 32.7 minutes per game. The American then signed with Spanish side CAI Zaragoza in 1991. He averaged 9 points, 11 rebounds and 1.3 blocks in 35 minutes on average in the Liga ACB during 1991–1992. A return to Italy followed, signing a $800,000 contract with Scaini Venezia. He was replaced by Shelton Jones in February 1993 after posting 9.1 points, 10.2 rebounds and 1.2 blocks in nearly 33 minutes per game. He finished his career in the American minor leagues, retiring in 1996."", 'Primarily a center, he was widely regarded as an excellent shot-blocker and led the league three times in blocks per game.', 'He appeared in 11 games and had four starts in the Italian League, averaging 9.0 points and 5.0 rebounds in 22.4 minutes per game.', 'He continued to improve in 2005–06, before getting injured in January, averaging 14.5 points and 7 rebounds, and ranking in the top 10 in the NBA in field goal percentage (54.142), blocks (2.19), and steals per game (2.44). Since the NBA began counting blocks as a statistic in 1973, only two other players (David Robinson and Hakeem Olajuwon) in league history have averaged over 2.0 blocks and 2.0 steals per game in a single season. Wallace was known for his somewhat reckless style of play that led to frequent injuries and earned him the nickname ""Crash"".', 'La Salle on February 28 (17 pts, 10 reb, 10 blocks). Also in 2006–07 Lasme set new UMass records for career blocked shots (399), single season blocked shots (168), and blocks per game (11), passing Marcus Camby on all three lists. In June 2007, Lasme was selected in the second round, 46th overall, in the 2007 NBA draft by the Golden State Warriors, using the pick they got from the New Jersey Nets in exchange for Clifford Robinson. He made his NBA debut on November 8, playing only 3.8 seconds of game time in the Warriors 120–115 loss to the Dallas Mavericks. On November 17, Lasme was waived by the Warriors. Later that month, he was signed by the NBA Development League\'s Los Angeles D-Fenders. On March 21, 2008, Lasme was signed to a ten-day contract with the Miami Heat, whose roster had been depleted by injuries. He later signed for the rest of the season. In 15 games (four starts), he averaged 5.5 points, 3.5 rebounds, 1.5 blocks and 20.2 minutes. In September 2008, Lasme signed with the Adriatic League champions Partizan Belgrade, for the 2008–09 season. After the opening three games in EuroLeague, he was ranked second in both blocks and rebounds per game. Lasme finished the season well, averaging 10.6 points, 6.6 rebounds, and 1.5 blocks per game, 25.5 minutes a contest, after Partizan\'s strong showing that ended in the quarterfinals with a loss to CSKA Moscow. He was instrumental in helping the team to another regional ABA championship, with 11.3 points per game. He also won Serbian national championship and the Serbian Radivoj Korać Cup titles with Partizan. In July 2009, Lasme signed with the Israeli League club Maccabi Tel Aviv, along with Alan Anderson. On June 8, 2010, Maccabi announced that they had released Lasme, after a foot injury had limited his playing time towards the end of the season. In 20 games of EuroLeague play, he averaged 6.5 points, 4.4 rebounds, and 1.4 blocks per game in 18.5 minutes per game. Lasme then signed a two-year contract with the Russian League club Spartak Saint Petersburg in July 2010. However, he was released in September, due to some administrative problems that he had in the United States. Lasme was invited to join the Boston Celtics for their 2010 training camp. However, he was waived on October 20. Subsequently, Lasme joined the Maine Red Claws of the NBA D-League, an affiliate of the Celtics. However, Lasme fractured his foot just 2 minutes into the team\'s preseason opener against the Springfield Armor, and immediately underwent surgery. After recovering, he returned to action in March 2011. In August 2011, Lasme returned to Europe and signed with the Spanish League newcomers Obradoiro CAB. On July 5, 2012, the Boston Celtics announced that Lasme was added to their roster for the 2012 Orlando Pro Summer League and the 2012 NBA Summer League. On September 29, 2012, Lasme signed a one-year contract with the Greek League club Panathinaikos Athens. He was named the EuroLeague Best Defender for the 2012–13 Euroleague season. He averaged 1.86 blocks and 6.14 rebounds per game, while his team allowed 69.8 points per game, thus displaying the second best team defense in the league. Also, Lasme earned the Greek Basket League MVP award, as well as the Greek League Best Defender award for the 2012–13 season. On July 1, 2013, Lasme renewed his contract with Panathinaikos for two more years. In May 2014, he was named to the All-EuroLeague Second Team of the EuroLeague. He also earned the Greek League Best Defender award and was named to the Greek League Best Five for the 2013–14 season. Panathinaikos decided to exercise an ""opt out"" clause in his contract for the upcoming 2014–15 season, on 12 June 2014. On June 22, 2014, he signed a two-year contract with Anadolu Efes Istanbul.', ""He signed in 2007 with another Serie B1 team, Gira Ozzano, staying there for two years, before ending his playing career in 2009, at 40 years old. Esposito finished his 25-year playing career with 762 games played, across all teams and divisions, with 13,286 points scored, for an average of 17.43 points per game. Esposito played several years for the youth national teams of Italy, playing in the 1985 FIBA Europe Under-16 Championship, where he won a bronze medal, and the 1988 FIBA Europe Under-18 Championship, where he was the Team Best Scorer, as they lost in the final. He later joined the senior men's Italian national basketball team for EuroBasket 1995, where Italy made it to the quarterfinals and he was the Team Best Scorer. Later on he played in the qualifiers for EuroBasket 1997, but he did not participate to the tournament. Following the year 2002 Esposito never played again for the Italian national basketball team. After his retirement from playing professional basketball, Esposito started a basketball coaching career with Aquila Basket Trento of the Serie A Dilettanti (the renamed third division) for the 2009–10 season, with the team finishing ninth. The next year, he coached Fortitudo Agrigento in the same division, leaving after one year. In July 2013, he returned to Imola, to coach the team that was still in the second division (now DNA Gold), after his team only won 1 game in 13, he decided - at 44 - to return to the team as player, leaving coaching duties to his assistant. He rejoined another former club, Juvecaserta, in 2014, to serve as assistant coach to Emanuele Molin first and then Zare Markovski in the Serie A. When Markovski was dismissed in December, with Caserta at zero games won in 11 games, Esposito took over as head coach. He helped them to 8 wins in the next 19 games, which gave them hope of escaping relegation, however the team lost their final game and were unable to achieve safety. Esposito would stay in the Serie A, signing a two-year deal with Giorgio Tesi Group Pistoia in June 2015. In two years as the head coach of the Giorgio Tesi Group Pistoia he took twice the team to the playoffs, one time to the Italian Basketball Cup, and at the end of the season 2017 he was named Italian League Coach of the Year (Lega Basket Serie A awards) On May 22, 2018, Esposito signed a deal with Banco di Sardegna Sassari in LBA. On May 26, 2019, Esposito signed a deal with Germani Basket Brescia. Source. Lega Basket Serie A Coach Profile Retrieved 29 June 2015.(in Italian) Lega Basket Serie A player statistics Retrieved 2 June 2015.(in Italian) FIBA Player Profile FIBA Europe Player Profile Liga ACB Player Profile Retrieved 2 June 2015.(in Spanish) Real GM Player Profile Retrieved 6 June 2015. In the 1995–96 season, Vincenzo Esposito played for Toronto in 30 games. He averaged 3.9 points, 0.5 rebounds, 0.8 assists, 0.2 steals, and 0.0 blocks per game."", ""They therefore became considerably less competitive in the league. Ford's contract with Olympiacos was subsequently not renewed, and he signed a new contract with the Italian league's EuroLeague contender, Mens Sana Siena. Ford had a quick adaptation period to his new team, and although his scoring average in the EuroLeague dropped to 17.9 points per game, he was selected to the All-EuroLeague 2002–03 First Team, after Siena qualified to the 2003 EuroLeague Final Four. Unfortunately, Ford had one of his worst shooting nights ever, in the semifinal against Benetton Treviso: he scored 15 points, making only 5 of his 19 shots. His 7 rebounds and 2 steals did not allow his team to overcome Benetton's obstacle, as they lost 62–65 in a highly intense game. In the Italian League 2002–03 season, Ford averaged 19.1 points per game, and Siena finished in fourth place in the league. Despite his leukemia being in an advanced stage, Ford played the Italian League 2003–04 season with Scavolini Pesaro. Averaging 22.2 points per game in the Italian League, Ford, in his final season, helped Scavolini finish in fourth place in the Italian League, which meant the team qualified to the next season's EuroLeague, and to the Italian Cup's runner-up position, despite being near death. Less than two weeks after announcing his retirement from the EuroLeague, Ford died from leukemia, at age 32. He is survived by his wife Paula, their daughter Quekenshia, and their sons Karlderek, Alphonso Jr. In Ford's honor, the EuroLeague named its trophy for the leading scorer of the year, the Alphonso Ford EuroLeague Top Scorer Trophy. The player who replaced Ford on Scavolini Pesaro, following his death, Charles Smith, would win the award the very next season. In 2021, a documentary dedicated to the life of Alphonso Ford, titled Alphonso Ford: Score Until The Last Day, premiered at the Thessaloniki International Documentary Festival, receiving critical acclaim. = List of NCAA Division I men's basketball career scoring leaders Alphonso Ford at nba.com Alphonso Ford at basketballreference.com Alphonso Ford at euroleague.net Alphonso Ford at fibaeurope.com Alphonso Ford at acb.com (in Spanish) Alphonso Ford at legabasket.it (in Italian) Alphonso Ford at esake.gr (in Greek) Alphonso Ford at baskethotel.com\n\nIn the 1989–90 season, Alphonso Ford played for MVSU in 27 games. He averaged 29.9 points, 4.9 rebounds, 1.9 assists, 1.5 steals, and 0.2 blocks per game. He shot 0.441 from the field, 0.361 from 3-point range, and 0.737 from the free throw line, playing an average of 31.8 minutes per game. In the 1990–91 season, Alphonso Ford played for MVSU in 28 games. He averaged 32.7 points, 6.0 rebounds, 1.4 assists, 2.2 steals, and 0.1 blocks per game. He shot 0.487 from the field, 0.331 from 3-point range, and 0.765 from the free throw line, playing an average of 33.4 minutes per game. In the 1991–92 season, Alphonso Ford played for MVSU in 26 games. He averaged 27.5 points, 5.6 rebounds, 3.7 assists, 2.5 steals, and 0.4 blocks per game. He shot 0.45 from the field, 0.303 from 3-point range, and 0.757 from the free throw line, playing an average of 33.2 minutes per game. In the 1992–93 season, Alphonso Ford played for MVSU in 28 games. He averaged 26.0 points, 5.3 rebounds, 3.9 assists, 1.9 steals, and 0.4 blocks per game."", 'Cozell McQueen (born January 18, 1962) is an American former professional basketball player. He was part of the NC State side that surprisingly won the 1983 NCAA Tournament.', ""= After playing at St. Catherine's High School in Racine (averaging 22.9 points, 11.1 rebounds and 8.1 blocked shots as a senior) and blocking a school-record 399 shots at Marquette University, McIlvaine was named NABC Defensive Player of the Year and was drafted with the fifth pick in the second round of the 1994 draft by the Washington Bullets (now Washington Wizards). He spent two years with the team, primarily in a backup role to Gheorghe Mureșan."", 'Before the 1989–90 NBA season, he signed with the Milwaukee Bucks but his season was cut short due to injury in February and he was waived. The following season he began a three-year stint in Spain, signing with Baloncesto León in Spain. He moved to FC Barcelona and CB Peñas Huesca. For the 1993–94 NBA season, Coleman returned to the U.S. with the Rapid City Thrillers of the Continental Basketball Association. He signed a ten-day contract with the Detroit Pistons. After Detroit did not retain him, he played on a rest-of-season contract with Roma and the following season with Montecatiniterme Basketball in Italy. He ended his playing career with the Sioux Falls Skyforce and Omaha Racers of the CBA. After he retired, Coleman coached in the greater Minneapolis area with the private coaching service, CoachUp. Coleman died on January 6, 2019, at age 57. = = College & NBA statistics @ basketballreference.com Italian League profile\n\nIn the 1986–87 season, Ben Coleman played for New Jersey in 68 games. He averaged 6.6 points, 4.2 rebounds, 0.5 assists, 0.5 steals, and 0.5 blocks per game. He shot 0.581 from the field, 0.0 from 3-point range, and 0.727 from the free throw line, playing an average of 15.1 minutes per game. In the 1987–88 season, Ben Coleman played for New Jersey in 27 games. He averaged 11.0 points, 6.4 rebounds, 1.4 assists, 1.0 steals, and 0.6 blocks per game. He shot 0.483 from the field, 0.0 from 3-point range, and 0.774 from the free throw line, playing an average of 24.3 minutes per game. In the 1987–88 season, Ben Coleman played for Philadelphia in 43 games. He averaged 6.9 points, 4.1 rebounds, 0.5 assists, 0.3 steals, and 0.6 blocks per game. He shot 0.516 from the field, 0.0 from 3-point range, and 0.752 from the free throw line, playing an average of 19.6 minutes per game. In the 1988–89 season, Ben Coleman played for Philadelphia in 58 games. He averaged 5.1 points, 3.1 rebounds, 0.3 assists, 0.2 steals, and 0.3 blocks per game. He shot 0.485 from the field, 0.0 from 3-point range, and 0.792 from the free throw line, playing an average of 12.1 minutes per game. In the 1989–90 season, Ben Coleman played for Milwaukee in 22 games. He averaged 5.7 points, 4.0 rebounds, 0.5 assists, 0.3 steals, and 0.3 blocks per game. He shot 0.474 from the field, 0.0 from 3-point range, and 0.829 from the free throw line, playing an average of 13.9 minutes per game. In the 1993–94 season, Ben Coleman played for Detroit in 9 games. He averaged 3.1 points, 2.9 rebounds, 0.0 assists, 0.2 steals, and 0.2 blocks per game. He shot 0.48 from the field, 0.0 from 3-point range, and 0.5 from the free throw line, playing an average of 8.6 minutes per game. In the 1988–89 season, Ben Coleman played for Philadelphia in 3 games. He averaged 4.7 points, 1.7 rebounds, 0.0 assists, 0.3 steals, and 0.0 blocks per game.']",Cozell McQueen led the Italian Serie A league in blocks per game in the 1988–89 season.,1988–89,0.0,0.9255505757341326,0.766666666641111,1.0,0.9525942912929366,0.8103771651717464
In which year did Brandon Ingram represent the Olympic basketball team?,"[""Brandon Xavier Ingram (born September 2, 1997) is an American professional basketball player for the Toronto Raptors of the National Basketball Association (NBA). He was selected by the Los Angeles Lakers with the second overall pick in the 2016 NBA draft, and was named to the NBA All-Rookie Second Team. He was traded to the New Orleans Pelicans and became a first-time NBA All-Star and was named the NBA Most Improved Player in 2020 during his first season with the Pelicans. Ingram had a successful high school career in North Carolina, where he won state titles each of his four years of high school and was named North Carolina's Mr. Basketball. He played one season of college basketball for the Duke Blue Devils, where he was named Atlantic Coast Conference Rookie of the Year. After the season, Ingram decided to forgo his remaining college eligibility and declared for the NBA draft. He played three seasons with the Lakers before being traded to New Orleans in 2019 in a package for All-Star Anthony Davis. Ingram was born on September 2, 1997, in Kinston, North Carolina. He is the son of Donald and Joann Ingram. He has two half-siblings, an older brother, Donovan, and an older sister, Brittany. He shares a father with Donovan and a mother with Brittany. Ingram's father started his career as a police officer and a manager of a local gym, but he is now full-time at a welding plant, where he makes forklifts. Before that, Donald was a would-be hoops star, pushing his way through the semi-pro leagues. When he moved back home to Kinston, his father started playing pickup games with a young Jerry Stackhouse, who was looking to play locally against older and more experienced players to help him elevate his game. Stackhouse, an ex-NBA star and Kinston native, forged a friendship with Ingram's father on the court. While Ingram grew up in a one-story house on Highland Avenue in Kinston, his brother Donovan grew up in a different house but would spend weekends with Brandon, teaching him basketball. Kinston had an extremely high crime rate, but Ingram kept his focus on basketball. Before Ingram was a teenager, his brother allowed him to play with him and his older friends."", 'He was also a member of the United States national team that competed in the 2023 FIBA Basketball World Cup, finishing fourth overall. Standing 6 feet 8 inches (2.03 m) tall and weighing 196 pounds (89 kg), Ingram plays mostly at the small forward position. His long arms, stretching to a 7-foot-3-inch (2.21 m) wingspan and 9-foot-1-inch (2.77 m) standing reach, allows him get his shot off over defenders and block shots on the defensive end. Ingram has drawn frequent comparisons to Kevin Durant, after whom he patterned his playing style revealing, ""I try to take bits and pieces out of [Durant\'s] game and put it in my game [but] at the end of the day, he\'s Kevin Durant, and I\'m Brandon Ingram"". Like Durant, Ingram has been criticized for his slim frame; however, one Western Conference coach stated that Ingram is ""just weak right now. He\'s not soft, by any stretch of the imagination."" After a Team USA practice, Durant told reporters that Ingram is ""the first person that I could... look at him and feel like I\'m looking in the mirror"". In his rookie year, Ingram was utilized as a point forward by coach Luke Walton, who stated that ""it helps engage [Ingram] in the game."" Growing up, one of Ingram\'s favorite things to do as a kid was fishing with his grandmother at Atlantic Beach. Ingram signed with Excel Sports Management and is represented by Excel founder and president Jeff Schwartz. In 2016, he chose to sign an endorsement deal with Adidas Basketball and made an appearance in a commercial for Speed Stick along with then Minnesota Timberwolves point guard Kris Dunn. In early 2017, he teamed up with L.A. street artist Jonas Never for Delta\'s ""Beyond the Court"" campaign, which saw Ingram and then-Laker teammate Jordan Clarkson explore their passions outside of basketball. While Clarkson is an aspiring fashion designer, Ingram\'s passion for art began with him drawing basketball players and cartoon characters, which was bolstered by taking a portrait drawing class at Duke. = Regular season Playoffs = NBA NBA All-Star (2020) NBA Most Improved Player (2020) 2× Rising Stars Challenge (2017, 2018) NBA All-Rookie Second Team (2017) College Associated Press Honorable Mention (2016) ACC Rookie of the Year (2016) High school 4× NCHSAA champion (2012, 2013, 2014, 2015) North Carolina Mr. Basketball (2015) McDonald\'s All-American (2015) First-team Parade All-American (2015) Nike Hoop Summit (2015) Career statistics from NBA.com · Basketball Reference Duke Blue Devils bio Lakers rookie Brandon Ingram has skill and moxie, scouts say of his Las Vegas summer league stint\n\nIn the 2016–17 season, Brandon Ingram played for L.A. Lakers in 79 games.', 'Olympic basketball team.', ""Andre Ingram (born November 19, 1985) is an American former professional basketball player who played two seasons for the Los Angeles Lakers. He played college basketball for American University, where he finished his four-year career as the school's fifth all-time leading scorer with 1,655 points. He made his NBA debut with the Los Angeles Lakers in 2018. Ingram is the NBA G League's career leader in three-point field goals and games played. He has also scored the third-most points in league history and won the D-League 3-Point Contest in 2010 and 2016. As a pro, Ingram spent four seasons with the Utah Flash between 2007 and 2011, and four seasons with the Los Angeles D-Fenders between 2012 and 2016. After a short stint in Australia with the Perth Wildcats, Ingram returned to the D-Fenders in March 2017. He continued on with the renamed South Bay Lakers for the 2017–18 season, before joining the Los Angeles Lakers in April 2018, and finally making his NBA debut. Ingram was born and raised in Richmond, Virginia, and grew up in a tight-knit family of four. He loved basketball from an early age, and by the time he turned 12, he was beating his older brother by seven years, Lucius, in one-on-one. Ingram attended Highland Springs High School in Highland Springs, Virginia, where he led the basketball team to the Group AAA championship as a senior in 2002–03, the first title in school history. That year, he averaged 22.8 points and 9.5 rebounds per game, while shooting 49 percent from three-point range. He was subsequently named the Associated Press Group AAA Player of the Year for his division. He left Highland Springs as a two-time Capital District Player of the Year and First-Team All-Metro, and as a senior was a First-Team All-State and First-Team All-Central Region pick. = As a freshman at American University in 2003–04, Ingram started in all 31 games and led the team with 13.6 points per game, which ranked fifth best in the league. He was subsequently named Patriot League Freshman of the Year, becoming the first American player to win the award. He had 16 points, five rebounds, two assists and two steals against Maryland on November 22, 2003, in his first collegiate game. On January 14, 2004, he made eight shots from behind the arc in a 27-point effort against Navy, which ties the second best single-game three-point total in AU history. In addition, his 15 three-point attempts against Navy is tied for the highest single-game attempt total for an Eagle."", 'On January 16, 2020, he bested that career high, scoring 49 points in a 138–132 overtime win over the Utah Jazz. Ingram gave New Orleans a one-point lead with a fadeaway jumper with 0.2 seconds remaining in regulation, before Rudy Gobert was fouled and sent the game to overtime with a free throw. He became an NBA All-Star in his first year as a Pelican.', 'He was selected with the 31st overall pick in the 2014 NBA draft by the Bucks and represents France in international competition. Born in Cayenne, French Guiana, Inglis was a big soccer fan, but as his cousins played streetball, he first began playing basketball at age nine before moving to Paris as a teenager. Several years later, he recalled his move to Paris saying, ""I was by myself. I left French Guiana when I was 14 years old. My family was far and I had to play basketball. It was cold, it was tough.', 'He debuted for his country at the 2012 Centrobasket, when he was age 16.', 'He averaged 9.4 points, 4.0 rebounds, 2.1 assists, 0.6 steals, and 0.4 blocks per game. He shot 0.402 from the field, 0.294 from 3-point range, and .621 from the free throw line, playing an average of 28.9 minutes per game. In the 2017–18 season, Brandon Ingram played for L.A. Lakers in 59 games. He averaged 16.1 points, 5.3 rebounds, 3.9 assists, 0.8 steals, and 0.7 blocks per game. He shot 0.47 from the field, 0.39 from 3-point range, and .681 from the free throw line, playing an average of 33.5 minutes per game. In the 2018–19 season, Brandon Ingram played for L.A. Lakers in 52 games. He averaged 18.3 points, 5.1 rebounds, 3.0 assists, 0.5 steals, and 0.6 blocks per game. He shot 0.497 from the field, 0.33 from 3-point range, and .675 from the free throw line, playing an average of 33.9 minutes per game. In the 2019–20 season, Brandon Ingram played for New Orleans in 62 games. He averaged 23.8 points, 6.1 rebounds, 4.2 assists, 1.0 steals, and 0.6 blocks per game. He shot 0.463 from the field, 0.391 from 3-point range, and .851 from the free throw line, playing an average of 33.9 minutes per game. In the 2020–21 season, Brandon Ingram played for New Orleans in 61 games. He averaged 23.8 points, 4.9 rebounds, 4.9 assists, 0.7 steals, and 0.6 blocks per game. He shot 0.466 from the field, 0.381 from 3-point range, and .878 from the free throw line, playing an average of 34.3 minutes per game. In the 2021–22 season, Brandon Ingram played for New Orleans in 55 games. He averaged 22.7 points, 5.8 rebounds, 5.6 assists, 0.6 steals, and 0.5 blocks per game. He shot 0.461 from the field, 0.327 from 3-point range, and .826 from the free throw line, playing an average of 34.0 minutes per game. In the 2022–23 season, Brandon Ingram played for New Orleans in 45 games. He averaged 24.7 points, 5.5 rebounds, 5.8 assists, 0.7 steals, and 0.4 blocks per game. He shot 0.484 from the field, 0.39 from 3-point range, and .882 from the free throw line, playing an average of 34.2 minutes per game. In the 2023–24 season, Brandon Ingram played for New Orleans in 64 games. He averaged 20.8 points, 5.1 rebounds, 5.7 assists, 0.8 steals, and 0.6 blocks per game. He shot 0.492 from the field, 0.355 from 3-point range, and .801 from the free throw line, playing an average of 32.9 minutes per game. In the 2024–25 season, Brandon Ingram played for New Orleans in 18 games. He averaged 22.2 points, 5.6 rebounds, 5.2 assists, 0.9 steals, and 0.6 blocks per game. He shot 0.465 from the field, 0.374 from 3-point range, and .855 from the free throw line, playing an average of 33.1 minutes per game. In the All-Star season, Brandon Ingram played for All-Star in 1 games. He averaged 2.0 points, 1.0 rebounds, 1.0 assists, 1.0 steals, and 0.0 blocks per game. He shot 0.25 from the field, 0.0 from 3-point range, and — from the free throw line, playing an average of 8.6 minutes per game. In the 2022 season, Brandon Ingram played for New Orleans in 6 games. He averaged 27.0 points, 6.2 rebounds, 6.2 assists, 0.7 steals, and 0.3 blocks per game. He shot 0.475 from the field, 0.407 from 3-point range, and 0.83 from the free throw line, playing an average of 39.3 minutes per game. In the 2024 season, Brandon Ingram played for New Orleans in 4 games. He averaged 14.3 points, 4.5 rebounds, 3.3 assists, 1.0 steals, and 1.3 blocks per game. He shot 0.345 from the field, 0.25 from 3-point range, and 0.895 from the free throw line, playing an average of 36.4 minutes per game. In the 2015–16 season, Brandon Ingram played for Duke in 36 games. He averaged 17.3 points, 6.8 rebounds, 2.0 assists, 1.1 steals, and 1.4 blocks per game.', ""He was also selected to play in the 2020 Jordan Brand Classic. = A five-star recruit, Boston committed to play college basketball at the University of Kentucky. In his college debut on November 25, 2020, Boston posted 15 points and seven rebounds in an 81–45 win over Morehead State. He scored 21 points in the season finale win against South Carolina. As a freshman, he averaged 11.5 points and 4.5 rebounds per game. On March 20, 2021, Boston declared for the 2021 NBA draft, forgoing his remaining college eligibility. = Boston was selected in the second round of the 2021 NBA draft with the 51st pick by the Memphis Grizzlies, then traded to the Los Angeles Clippers via the New Orleans Pelicans. Boston was assigned to the Clippers' NBA G League affiliate, the Agua Caliente Clippers, for their G League season-opener. Boston helped the since-relocated Ontario Clippers win the G League Winter Showcase championship in 2022, earning Showcase Cup MVP honors after scoring 21 points in the final. On August 8, 2024, Boston signed with the San Antonio Spurs, but was waived on October 19. = On October 21, 2024, Boston was claimed off waivers by the New Orleans Pelicans, who later converted his deal into a two-way contract. On February 26, 2025, the Pelicans signed Boston to a standard, two-year contract. He made 42 appearances (10 starts) for New Orleans during the 2024–25 NBA season, averaging 10.7 points, 3.2 rebounds, and 2.2 assists. On April 28, it was announced that Boston had undergone arthroscopic surgery on his left ankle. = Regular season Playoffs = After a workout with Kentucky teammate Terrence Clarke on April 22, 2021, Clarke was involved in a car crash in Los Angeles, California. Clarke, driving by himself, was killed while Boston, in the car behind of Clarke, witnessed the crash. He also keeps a dollar bill in his shoe during games. Kentucky Wildcats bio Sierra Canyon Trailblazers bio USA Basketball bio\n\nIn the 2021–22 season, Brandon Boston played for L.A. Clippers in 51 games."", ""Kyle Brandon O'Quinn (born March 26, 1990) is an American former professional basketball player. He played for the Norfolk State Spartans, and led them to a victory over the #2 seed Missouri Tigers in the second round of the 2012 NCAA Men's Division I Basketball Tournament. He was drafted in the second round of the 2012 NBA draft with the 49th overall pick, by the Orlando Magic. O'Quinn was born in Queens, New York, and grew up in South Jamaica, Queens.""]",Brandon Ingram represented the Olympic basketball team in 2023 when he was a member of the United States national team that competed in the 2023 FIBA Basketball World Cup.,...,0.6666666666666666,0.911270324930617,0.0,0.5,0.18698431723602735,0.7479361708945086
"What were Greg Brown III's shooting percentages from the field, 3-point range, and free throw line in the mentioned season?","['He shot - from the field, - from 3-point range, and - from the free throw line, playing an average of 3.0 minutes per game.', 'He shot — from the field, — from 3-point range, and — from the free throw line, playing an average of 3.0 minutes per game.', 'He shot 0.493 from the field, — from 3-point range, and 0.739 from the free throw line, playing an average of 22.8 minutes per game. In the 2008† season, P.J. Brown played for Boston in 25 games. He averaged 2.9 points, 2.4 rebounds, 0.5 assists, 0.2 steals, and 0.4 blocks per game. He shot 0.464 from the field, .000 from 3-point range, and 0.84 from the free throw line, playing an average of 13.6 minutes per game.', 'He shot 0.513 from the field, 0.368 from 3-point range, and 0.686 from the free throw line, playing an average of 35.0 minutes per game.', 'He shot 0.513 from the field, 0.396 from 3-point range, and 0.809 from the free throw line, playing an average of 34.8 minutes per game.', 'He shot 0.603 from the field, 0.28 from 3-point range, and 0.678 from the free throw line, playing an average of 30.2 minutes per game.', 'He shot 0.513 from the field, 0.306 from 3-point range, and 0.673 from the free throw line, playing an average of 34.9 minutes per game.', 'He shot .585 from the field, .387 from 3-point range, and .837 from the free throw line, playing an average of 27.0 minutes per game.', 'He shot 0.381 from the field, 0.269 from 3-point range, and 0.779 from the free throw line, playing an average of 29.5 minutes per game.', 'He shot 0.387 from the field, 0.331 from 3-point range, and 0.86 from the free throw line, playing an average of 31.9 minutes per game.']",I don't know.,"Greg Brown III shot 0.42 from the field, 0.33 from 3-point range, and 0.708 from the free throw line.",0.0,0.0,0.4362433862361155,0.0,0.18594053436281643,0.7436089686052865
What did Michael Jackson install at his Neverland Ranch?,"['The Recording Industry Association of America (RIAA) certified it as eight times Platinum in the US. In March 1988, Jackson purchased 2,700 acres (11 km2) of land near Santa Ynez, California, to build a new home, Neverland Ranch, at a cost of $17 million (equivalent to $45 million in 2024). He installed a Ferris wheel, a carousel, a movie theater and a zoo.', 'The People v. Jackson trial began on January 31, 2005, in Santa Maria, California, and lasted until the end of May. Jackson found the experience stressful and it affected his health. If convicted, he would have faced up to twenty years in prison. On June 13, 2005, Jackson was acquitted on all counts. FBI files on Jackson, released in 2009, revealed the FBI\'s role in the 2005 trial and the 1993 allegations, and showed that the FBI found no evidence of criminal conduct on Jackson\'s behalf. = After the trial, Jackson became reclusive. In June 2005, he moved to Bahrain as a guest of Sheikh Abdullah. In early 2006, it was announced that Jackson had signed a contract with a Bahrain startup, Two Seas Records. Nothing came of the deal, and the Two Seas CEO, Guy Holmes, later said it was never finalized. Holmes also found that Jackson was on the verge of bankruptcy and was involved in 47 ongoing lawsuits. By September 2006, Jackson was no longer affiliated with Two Seas. In April 2006, Jackson agreed to use a piece of his ATV catalog stake, then worth about $1 billion, as collateral against his $270 million worth of loans from Bank of America. Bank of America had sold the loans to Fortress Investments, an investment company that buys distressed loans, the year before. As part of the agreement, Fortress Investments provided Jackson a new loan of $300 million with reduced interest payments (equivalent to $470 million in 2024). Sony Music would have the option to buy half of his stake, or about 25% of the catalog, at a set price. Jackson\'s financial managers had urged him to shed part of his stake to avoid bankruptcy. The main house at Neverland Ranch was closed as a cost-cutting measure, while Jackson lived in Bahrain at the hospitality of Abdullah. At least thirty of Jackson\'s employees had not been paid on time and were owed $306,000 in back wages. Jackson was ordered to pay $100,000 in penalties. Jackson never returned to Neverland after his acquittal. In mid-2006, Jackson moved to Grouse Lodge, a residential recording studio near Rosemount, County Westmeath, Ireland. There, he began work on a new album with the American producers will.i.am and Rodney Jenkins. That November, Jackson invited an Access Hollywood camera crew into the studio in Westmeath. On November 15, Jackson briefly joined in on a performance of ""We Are the World"" at the World Music Awards in London, his last public performance, and accepted the Diamond Award for sales of 100 million records. He returned to the US in December, settling in Las Vegas. That month, he attended James Brown\'s funeral in Augusta, Georgia, where he gave a eulogy calling Brown his greatest inspiration. In 2007, Jackson and Sony bought another music publishing company, Famous Music LLC, formerly owned by Viacom. The deal gave Jackson the rights to songs by Eminem and Beck, among others. In a brief interview, Jackson said he had no regrets about his career despite his problems and ""deliberate attempts to hurt [him]"". That March, Jackson visited a US Army post in Japan, Camp Zama, to greet more than 3,000 troops and their families. As of September, Jackson was still working on his next album, which he never completed. In 2008, for the 25th anniversary of Thriller, Jackson and Sony released Thriller 25, with two remixes released as singles: ""The Girl Is Mine 2008"" and ""Wanna Be Startin\' Somethin\' 2008"". Thriller 25 was the last recorded work released during his life which he was extensively involved with, with Jackson co-producing the album\'s remix tracks. For his 50th birthday, Sony BMG released a series of greatest hits albums, King of Pop, with different tracklists for different regions. That July, Fortress Investments threatened to foreclose on Neverland Ranch, which he had used as collateral for his loans. Fortress sold Jackson\'s debts to Colony Capital LLC. In November, Jackson transferred Neverland Ranch\'s title to Sycamore Valley Ranch Company LLC, a joint venture between Jackson and Colony Capital LLC. The deal earned him $35 million.', 'The documentary, broadcast in February 2003 as Living with Michael Jackson, showed Jackson holding hands and discussing sleeping arrangements with a twelve-year-old boy. He said that he saw nothing wrong with having sleepovers with minors and sharing his bed and bedroom with various people, which aroused controversy. He insisted that the sleepovers were not sexual and that his words had been misunderstood. In October 2003, Jackson received the Key to the City of Las Vegas from Mayor Oscar Goodman. On November 18, 2003, Sony released Number Ones, a greatest hits album. It was certified five times platinum by the RIAA, and ten times platinum in the UK, for shipments of at least 3 million units. On December 18, 2003, Santa Barbara authorities charged Jackson with seven counts of child molestation and two counts of intoxicating a minor with alcoholic drinks. Jackson denied the allegations and pleaded not guilty.', ""He spent time in the Skywalker Ranch for the movie's post-production."", 'In late 1995, Jackson was admitted to a hospital after collapsing during rehearsals for a televised performance, caused by a stress-related panic attack. In November, Jackson merged his ATV Music catalog with Sony\'s music publishing division, creating Sony/ATV Music Publishing. He retained ownership of half the company, earning $95 million up front (equivalent to $196 million in 2024) as well as the rights to more songs. ""Earth Song"" was the third single released from HIStory, and topped the UK Singles Chart for six weeks over Christmas 1995. It became the 87th-bestselling single in the UK. At the 1996 Brit Awards, Jackson\'s performance of ""Earth Song"" was disrupted by Pulp singer Jarvis Cocker, who was protesting what Cocker saw as Jackson\'s ""Christ-like"" persona. Jackson said the stage invasion was ""disgusting and cowardly"". In 1996, Jackson won a Grammy for Best Music Video, Short Form, for ""Scream"" and an American Music Award for Favorite Pop/Rock Male Artist. In July 1996, Jackson performed for Sultan Hassanal Bolkiah\'s fiftieth birthday at Jerudong Park Amphitheater, which was specifically built for that birthday concert. Jackson was reportedly paid $17 million (equivalent to $34 million in 2024). Jackson promoted HIStory with the HIStory World Tour, from September 7, 1996, to October 15, 1997. He performed 82 concerts in five continents, 35 countries and 58 cities to over 4.5 million fans, his most attended tour. It grossed $165 million (equivalent to $323 million in 2024). During the tour, in Sydney, Australia, Jackson married Debbie Rowe, a dermatology assistant, who was six months pregnant with his first child. Michael Joseph Jackson Jr. (commonly known as Prince) was born on February 13, 1997. His sister Paris-Michael Katherine Jackson was born on April 3, 1998. Jackson and Rowe divorced in 2000, Rowe conceded custody of the children, with an $8 million settlement (equivalent to $15.1 million in 2024). In 2004, after the second child abuse allegations against Jackson, she returned to court to reclaim custody.', 'Its score was arranged by Quincy Jones, who later produced three of Jackson\'s solo albums. During his time in New York, Jackson frequented the Studio 54 nightclub, where he heard early hip hop; this influenced his beatboxing on future tracks such as ""Working Day and Night"". In 1978, Jackson felt unsatisfied with his nose, and decided to have a rhinoplasty. He was referred to Steven Hoefflin, who performed his operations. Jackson\'s fifth solo album and first album as an adult, Off the Wall (1979), established him as a solo performer and helped him move from the bubblegum pop of his youth to more complex sounds. It produced four top 10 entries in the US: ""Off the Wall"", ""She\'s Out of My Life"", and the chart-topping singles ""Don\'t Stop \'Til You Get Enough"" and ""Rock with You"". The album reached number three on the US Billboard 200 and sold over 20 million copies worldwide. In 1980, Jackson won three American Music Awards for his solo work: Favorite Soul/R&B Album, Favorite Soul/R&B Male Artist, and Favorite Soul/R&B Single for ""Don\'t Stop \'Til You Get Enough"". He also won a Grammy Award for Best Male R&B Vocal Performance for 1979 with ""Don\'t Stop \'Til You Get Enough"". In 1981, Jackson was the American Music Awards winner for Favorite Soul/R&B Album and Favorite Soul/R&B Male Artist. Jackson felt Off the Wall should have made a bigger impact, and was determined to exceed expectations with his next release. In 1980, he secured the highest royalty rate in the music industry: 37 percent of wholesale album profit. = Jackson recorded with Queen\'s lead singer Freddie Mercury from 1981 to 1983, recording demos of ""State of Shock"", ""Victory"" and ""There Must Be More to Life Than This"". The recordings were intended for an album of duets but, according to Queen\'s manager Jim Beach, the relationship soured when Jackson brought a llama into the recording studio, and Jackson was upset by Mercury\'s drug use. ""There Must Be More to Life Than This"" was released in 2014. Jackson went on to record ""State of Shock"" with Mick Jagger for the Jacksons\' album Victory (1984). In 1982, Jackson contributed ""Someone in the Dark"" to the audiobook for the film E.T. the Extra-Terrestrial. Jackson\'s sixth album, Thriller, was released in late 1982. It was the bestselling album worldwide in 1983, and became the bestselling album of all time in the US and the best-selling album of all time worldwide, selling an estimated 70 million copies. It topped the Billboard 200 chart for 37 weeks and was in the top 10 of the 200 for 80 consecutive weeks. It was the first album to produce seven Billboard Hot 100 top-10 singles, including ""Billie Jean"", ""Beat It"", and ""Wanna Be Startin\' Somethin\'"".On March 25, 1983, Jackson reunited with his brothers for Motown 25: Yesterday, Today, Forever, an NBC television special. The show aired on May 16 to an estimated audience of 47 million, and featured the Jacksons and other Motown stars. Jackson\'s solo performance of ""Billie Jean"" earned him his first Emmy Award nomination. Wearing a glove decorated with rhinestones, he debuted his moonwalk dance, which Jeffrey Daniel had taught him three years earlier, and it became his signature dance in his repertoire. Jackson had originally turned down the invitation to the show, believing he had been doing too much television.', 'T.J. Jackson, the son of Tito Jackson, was given co-guardianship of Michael Jackson\'s children after false reports of Katherine Jackson going missing. Xscape, an album of unreleased material, was released on May 13, 2014. The lead single, a duet between Jackson and Justin Timberlake, ""Love Never Felt So Good"", reached number 9 on the US Billboard Hot 100, making Jackson the first artist to have a top-10 single on the chart in five different decades. Later in 2014, Queen released a duet recorded with Jackson in the 1980s. A compilation album, Scream, was released on September 29, 2017. A jukebox musical, MJ the Musical, premiered on Broadway in 2022. Myles Frost won the 2022 Tony Award for Best Actor in a Musical for his portrayal of Jackson. On November 18, 2022, Epic released a 40th-anniversary edition reissue of Thriller. A biographical film based on Jackson\'s life, Michael, directed by Antoine Fuqua, is scheduled for October 2025. Jackson is played by his nephew Jaafar Jackson. Deadline Hollywood reported that the film ""will not shy away from the controversies of Jackson\'s life"". Since Jackson\'s death, his estate has grossed $2 billion in ticket revenue from MJ the Musical, Michael Jackson\'s This Is It and two Cirque du Soleil productions. = In 2013, choreographer Wade Robson filed a lawsuit alleging that Jackson had sexually abused him for seven years, beginning when he was seven years old (1989–1996). In 2014, a case was filed by James Safechuck, alleging similar sexual abuse over a four-year period starting when Safechuck was ten (1988–1992). Both had previously testified in Jackson\'s defense during the 1993 allegations; Robson did so again in 2005. In 2015, Robson\'s case against Jackson\'s estate was dismissed as it had been filed too late. Safechuck\'s claim was also time-barred. In 2017, it was ruled that Jackson\'s corporations could not be held accountable for his alleged past actions. The rulings were appealed. On October 20, 2020, Safechuck\'s lawsuit against Jackson\'s corporations was again dismissed. The judge ruled that there was no evidence that Safechuck had had a relationship with Jackson\'s corporation, nor was it proven that there was a special relationship between the two. On April 26, 2021, Robson\'s case was dismissed because of a lack of supporting evidence that the defendants exercised control over Jackson. Robson and Safechuck\'s allegations were the subject of the documentary film Leaving Neverland, released in March 2019. Radio stations in New Zealand, Canada, the UK and the Netherlands removed Jackson\'s music from their playlists. Jackson\'s family condemned the film as a ""public lynching"", and the Jackson estate released a statement calling the film a ""tabloid character assassination [Jackson] endured in life, and now in death"". Close associates of Jackson, such as Corey Feldman, Aaron Carter, Brett Barnes, and Macaulay Culkin, defended Jackson in the wake of the documentary\'s release, saying that Jackson had never molested them. Documentaries such as Square One: Michael Jackson, Neverland Firsthand: Investigating the Michael Jackson Documentary and Michael Jackson: Chase the Truth, presented information countering the claims suggested by Leaving Neverland. Jackson\'s album sales increased following the documentary screenings. Billboard senior editor Gail Mitchell said she and a colleague interviewed about thirty music executives who believed Jackson\'s legacy could withstand the controversy. In late 2019, some New Zealand and Canadian radio stations re-added Jackson\'s music to their playlists, citing ""positive listener survey results"". On February 21, 2019, the Jackson estate sued HBO for breaching a non-disparagement clause from a 1992 contract. The suit sought to compel HBO to participate in a non-confidential arbitration that could result in $100 million or more in damages awarded to the estate. HBO said they did not breach a contract and filed an anti-SLAPP motion against the estate. In September 2019, Judge George H. Wu denied HBO\'s motion to dismiss the case, allowing the Jackson estate to arbitrate. HBO appealed, but in December 2020 the appeals court affirmed Wu\'s ruling. In 2020, a state law passed in California which granted plaintiffs in child sex abuse cases an additional period to file lawsuits. In October 2020 and again in April 2021, the Los Angeles County Superior Court ruled that MJJ Productions Inc. and MJJ Ventures Inc. employees were not legally obligated to protect the two men from Jackson. In August 2023, California\'s Second District Court of Appeal overturned the ruling, and the case was approved to move forward to trial court. Jackson has been referred to as the ""King of Pop"" for having transformed the art of music videos and paving the way for modern pop music. For much of Jackson\'s career, he had an unparalleled worldwide influence over the younger generation. His influence extended beyond the music industry; he impacted dance, led fashion trends, and raised awareness for global affairs. Jackson\'s music and videos fostered racial diversity in MTV\'s roster and steered its focus from rock to pop music and R&B, leading to the discontinuation of the album-oriented rock format previously dominant on the channel. In songs such as ""Black or White"", ""Heal the World"", ""Earth Song"" and ""They Don\'t Care About Us"", Jackson\'s music emphasized racial integration and environmentalism and protested injustice. He is considered one of the most significant figures of the 20th century, and his contributions to music, dance, and fashion, along with his publicized personal life, made him a global figure in popular culture for over four decades. Jackson\'s meteoric rise in the 1980s catapulted him to global stardom, and his influence transcended borders. In Africa, his influence was compared to Nelson Mandela for his ability to inspire and unite diverse audiences through his music. Similarly, in India, Jackson was likened to Mahatma Gandhi, with his art championing themes of social justice and humanitarianism, and his influence extending to Bollywood where it was said that anyone who danced well was compared to Jackson. In Europe, Jackson\'s impact was compared to that of the Pope, drawing huge crowds of people who gathered to see the singer in public and even more to his concerts, which spread messages of love and healing during rough economic and political times. His presence in the Middle East was considered as widespread as Coca-Cola, symbolizing a shared global culture through his music. Additionally, Jackson is considered the backbone of the K-pop industry in South Korea, influencing countless artists and shaping the genre\'s development.Trying to trace Michael Jackson\'s influence on the pop stars that followed him is like trying to trace the influence of oxygen and gravity. So vast, far-reaching and was his impact—particularly in the wake of Thriller\'s colossal and heretofore unmatched commercial success—that there weren\'t a whole lot of artists who weren\'t trying to mimic some of the Jackson formula.Danyel Smith, chief content officer of Vibe Media Group and the editor-in-chief of Vibe, described Jackson as ""the greatest star"". Steve Huey of AllMusic called him ""an unstoppable juggernaut, possessed of all the skills to dominate the charts seemingly at will: an instantly identifiable voice, eye-popping dance moves, stunning musical versatility and loads of sheer star power"". BET said Jackson was ""quite simply the greatest entertainer of all time"" whose ""sound, style, movement and legacy continues to inspire artists of all genres"". In 1984, Time pop critic Jay Cocks wrote that ""Jackson is the biggest thing since the Beatles. He is the hottest single phenomenon since Elvis Presley. He just may be the most popular black singer ever."" He described Jackson as a ""star of records, radio, rock video. A one-man rescue team for the music business. A songwriter who sets the beat for a decade.', 'A dancer with the fanciest feet on the street. A singer who cuts across all boundaries of taste and style and color too."" The New York Times wrote ""in the world of pop music, there is Michael Jackson and there is everybody else"".In November 1983, Jackson and his brothers partnered with PepsiCo in a $5 million promotional deal that broke records for a celebrity endorsement (equivalent to $15.8 million in 2024). The first Pepsi campaign, which ran in the US from 1983 to 1984 and launched its ""New Generation"" theme, included tour sponsorship, public relations events, and in-store displays. Jackson helped to create the advertisement, and suggested using his song ""Billie Jean"", with revised lyrics, as its jingle. On January 27, 1984, Michael and other members of the Jacksons filmed a Pepsi commercial overseen by Phil Dusenberry, a BBDO ad agency executive, and Alan Pottasch, Pepsi\'s Worldwide Creative Director, at the Shrine Auditorium in Los Angeles. During a simulated concert before a full house of fans, pyrotechnics accidentally set Jackson\'s hair on fire, causing second-degree burns to his scalp. Jackson underwent treatment to hide the scars and had his third rhinoplasty shortly thereafter. Pepsi settled out of court, and Jackson donated the $1.5 million (equivalent to $4.5 million in 2024) settlement to the Brotman Medical Center in Culver City, California; its now-closed Michael Jackson Burn Center was named in his honor. Jackson signed a second agreement with Pepsi in the late 1980s for $10 million (equivalent to $27.7 million in 2024). The second campaign covered 20 countries and provided financial support for Jackson\'s Bad album and 1987–1988 world tour. Jackson had endorsements and advertising deals with other companies, such as LA Gear, Suzuki, and Sony, but none were as significant as his deals with Pepsi. The Victory Tour of 1984 headlined the Jacksons and showcased Jackson\'s new solo material to more than two million Americans. It was the last tour he did with his brothers. Following controversy over the concert\'s ticket sales, Jackson donated his share of the proceeds, an estimated $3 to 5 million, to charity. During the last concert of the Victory Tour at the Dodger Stadium in Los Angeles, Jackson announced his split from the Jacksons during ""Shake Your Body"". = With Lionel Richie, Jackson co-wrote the charity single ""We Are the World"" (1985), which raised money for the poor in the US and Africa. It earned $63 million (equivalent to $184 million in 2024), and became one of the best-selling singles of all time, with 20 million copies sold. It won four Grammy Awards in 1985, including Song of the Year for Jackson and Richie. Jackson, Jones, and the promoter Ken Kragen received special awards for their roles in the song\'s creation. Jackson collaborated with Paul McCartney in the early 1980s, and learned that McCartney was making $40 million a year from owning the rights to other artists\' songs. By 1983, Jackson had begun buying publishing rights to others\' songs, but he was careful with his acquisitions, only bidding on a few of the dozens that were offered to him. Jackson\'s early acquisitions of music catalogs and song copyrights such as the Sly Stone collection included ""Everyday People"" (1968), Len Barry\'s ""1-2-3"" (1965), and Dion DiMucci\'s ""The Wanderer"" (1961) and ""Runaround Sue"" (1961). In 1984, Robert Holmes à Court announced he was selling the ATV Music Publishing catalog comprising the publishing rights to nearly 4,000 songs, including most of the Beatles\' material. In 1981, McCartney had been offered the catalog for £20 million ($40 million) (equivalent to $138 million in 2024). Jackson submitted a bid of $46 million (equivalent to $139 million in 2024) on November 20, 1984. When Jackson and McCartney were unable to make a joint purchase, McCartney did not want to be the sole owner of the Beatles\' songs, and did not pursue an offer on his own. Jackson\'s agents were unable to come to a deal, and in May 1985 left talks after having spent more than $1 million and four months of due diligence work on the negotiations. In June 1985, Jackson and Branca learned that Charles Koppelman\'s and Marty Bandier\'s The Entertainment Company had made a tentative offer to buy ATV Music for $50 million; in early August, Holmes à Court contacted Jackson and talks resumed. Jackson\'s increased bid of $47.5 million (equivalent to $139 million in 2024) was accepted because he could close the deal more quickly, having already completed due diligence. Jackson agreed to visit Holmes à Court in Australia, where he would appear on the Channel Seven Perth Telethon. His purchase of ATV Music was finalized on August 10, 1985. = Jackson\'s skin had been medium-brown during his youth, but from the mid-1980s gradually grew paler. The change drew widespread media coverage, including speculation that he had been bleaching his skin. His dermatologist, Arnold Klein, said he observed in 1983 that Jackson had vitiligo, a condition characterized by patches of the skin losing their pigment. He also identified discoid lupus erythematosus in Jackson. He diagnosed Jackson with lupus that year, and with vitiligo in 1986. Vitiligo\'s drastic effects on the body can cause psychological distress. Jackson used fair-colored makeup, and possibly skin-bleaching prescription creams, to cover up the uneven blotches of color caused by the illness. The creams would depigment the blotches, and, with the application of makeup, he could appear very pale. Jackson said he had not purposely bleached his skin and could not control his vitiligo, adding, ""When people make up stories that I don\'t want to be who I am, it hurts me."" He became friends with Klein and Klein\'s assistant, Debbie Rowe. Rowe later became Jackson\'s second wife and the mother of his first two children. In his 1988 autobiography and a 1993 interview, Jackson said he had had two rhinoplasty surgeries and a cleft chin surgery but no more than that. He said he lost weight in the early 1980s because of a change in diet to achieve a dancer\'s body. Witnesses reported that he was often dizzy, and speculated he was suffering from anorexia nervosa. Periods of weight loss became a recurring problem later in his life. After his death, Jackson\'s mother said that he first turned to cosmetic procedures to remedy his vitiligo, because he did not want to look like a ""spotted cow"". She said he had received more than the two cosmetic surgeries he claimed and speculated that he had become addicted to them. In 1986, it was reported that Jackson slept in a hyperbaric oxygen chamber to slow aging. He denied the story, although it was alleged that Jackson leaked an image of him sleeping in a glass chamber (according to Jackson, this was a promotional shot from an upcoming space opera featuring himself) to The National Enquirer. It was also reported that Jackson took female hormone shots to keep his voice high and facial hair wispy, proposed to Elizabeth Taylor and possibly had a shrine of her, and had cosmetic surgery on his eyes. Jackson\'s manager Frank DiLeo denied all of them, except for Jackson having a chamber. DiLeo added ""I don\'t know if he sleeps in it.', '2 on the charts in 1992. Jackson founded the Heal the World Foundation in 1992. The charity brought underprivileged children to Jackson\'s ranch to use the theme park rides, and sent millions of dollars around the globe to help children threatened by war, poverty, and disease. That July, Jackson published his second book, Dancing the Dream, a collection of poetry. The Dangerous World Tour ran between June 1992 and November 1993 and grossed $100 million (equivalent to $220 million in 2024); Jackson performed for over 3.5 million people in 70 concerts, all of which were outside the US. Part of the proceeds went to Heal the World Foundation. Jackson sold the broadcast rights of the tour to HBO for $20 million (equivalent to $45 million in 2024), a record-breaking deal that still stands. Following the death of HIV/AIDS spokesperson and friend Ryan White, Jackson pleaded with the Clinton administration at Bill Clinton\'s inaugural gala to give more money to HIV/AIDS charities and research and performed ""Gone Too Soon"", a song dedicated to White, and ""Heal the World"" at the gala. Jackson visited Africa in early 1992; on his first stop in Gabon he was greeted by more than 100,000 people, some of them carrying signs that read ""Welcome Home Michael"", and was awarded an Officer of the National Order of Merit from President Omar Bongo. During his trip to Ivory Coast, Jackson drew larger crowds than Pope John Paul II on his previous visits. He was crowned ""King Sani"" by a tribal chief in the Ivorian village of Krindjabo, where he thanked the dignitaries in French and English, signed documents formalizing his kingship, and sat on a golden throne while presiding over ceremonial dances. In January 1993, Jackson performed at the Super Bowl XXVII halftime show in Pasadena, California. The NFL sought a big-name artist to keep ratings high during halftime following dwindling audience figures. With 133.4 million viewers, it was the first Super Bowl whose halftime show drew greater audience figures than the game. Jackson played ""Jam"", ""Billie Jean"", ""Black or White"", and ""Heal the World"". Dangerous rose 90 places in the US albums chart after the performance. Jackson gave a 90-minute interview with Oprah Winfrey on February 10, 1993.', 'Bush. In 1992, he was honored as a ""Point of Light Ambassador"" by Bush for inviting disadvantaged children to his Neverland Ranch. Jackson won hundreds of awards, making him one of the most-awarded artists in popular music. His awards include 39 Guinness World Records, including the Most Successful Entertainer of All Time, 13 Grammy Awards, as well as the Grammy Legend Award and the Grammy Lifetime Achievement Award, and 26 American Music Awards, including the Artist of the Century and Artist of the 1980s. He also received the World Music Awards\' Best-Selling Male Artist of the Millennium and the Bambi Pop Artist of the Millennium Award. Jackson was inducted onto the Hollywood Walk of Fame in 1980 as a member of the Jacksons, and in 1984 as a solo artist. He was inducted to the Rock and Roll Hall of Fame and Vocal Group Hall of Fame as a member of the Jackson 5 in 1997 and 1999, respectively, and again as a solo artist in 2001. In 2002, he was added to the Songwriters Hall of Fame. In 2010, he was the first recording artist to be inducted into the Dance Hall of Fame, and in 2014, he was posthumously inducted into the Rhythm and Blues Music Hall of Fame. In 2021, he was among the inaugural inductees into the Black Music & Entertainment Walk of Fame. In 1988, Fisk University honored him with an Honorary Doctorate of Humane Letters. In 1992, he was invested as a titular king of Sanwi, a traditional kingdom located in the south-east of Ivory Coast. In July 2009, the Lunar Republic Society named a crater on the Moon after Jackson. In August, for what would have been Jackson\'s 51st birthday, Google dedicated their Google Doodle to him. In 2012, the extinct hermit crab Mesoparapylocheles michaeljacksoni was named in his honor. In 2014, the British Council of Cultural Relations deemed Jackson\'s life one of the 80 most important cultural moments of the 20th century. World Vitiligo Day has been celebrated on June 25, the anniversary of Jackson\'s death, to raise awareness of the auto-immune disorder that Jackson suffered from. In 1989, Jackson\'s annual earnings from album sales, endorsements, and concerts were estimated at $125 million.']","Michael Jackson installed a Ferris wheel, a carousel, a movie theater, and a zoo at his Neverland Ranch.","He installed a Ferris wheel, a carousel, a movie theater, and a zoo.",,0.999999153598127,0.66666666665,,0.9823213622817913,0.9292785979105294
"In the 2016-17 season, how many games did Ron Baker play for New York?","['He shot 0.378 from the field, 0.267 from 3-point range, and .651 from the free throw line, playing an average of 16.5 minutes per game. In the 2017–18 season, Ron Baker played for New York in 29 games. He averaged 2.4 points, 1.0 rebounds, 1.6 assists, 0.9 steals, and 0.2 blocks per game. He shot 0.339 from the field, 0.333 from 3-point range, and .769 from the free throw line, playing an average of 13.3 minutes per game. In the 2018–19 season, Ron Baker played for New York in 11 games. He averaged 1.3 points, 0.6 rebounds, 1.2 assists, 0.5 steals, and 0.0 blocks per game. He shot 0.25 from the field, 0.111 from 3-point range, and .833 from the free throw line, playing an average of 9.7 minutes per game. In the 2018–19 season, Ron Baker played for Washington in 4 games. He averaged 0.0 points, 1.0 rebounds, 0.5 assists, 0.3 steals, and 0.3 blocks per game. He shot 0.0 from the field, 0.0 from 3-point range, and – from the free throw line, playing an average of 11.3 minutes per game. In the 2012–13 season, Ron Baker played for Wichita State in 18 games. He averaged 12.7 points, 3.2 rebounds, 1.8 assists, 0.8 steals, and 0.3 blocks per game. He shot 0.398 from the field, 0.357 from 3-point range, and 0.822 from the free throw line, playing an average of 26.1 minutes per game. In the 2013–14 season, Ron Baker played for Wichita State in 36 games. He averaged 13.1 points, 3.8 rebounds, 3.1 assists, 1.4 steals, and 0.6 blocks per game. He shot 0.456 from the field, 0.38 from 3-point range, and 0.842 from the free throw line, playing an average of 29.9 minutes per game. In the 2014–15 season, Ron Baker played for Wichita State in 35 games. He averaged 13.7 points, 4.5 rebounds, 2.5 assists, 1.3 steals, and 0.8 blocks per game. He shot 0.433 from the field, 0.383 from 3-point range, and 0.758 from the free throw line, playing an average of 32.7 minutes per game. In the 2015–16 season, Ron Baker played for Wichita State in 35 games. He averaged 14.0 points, 4.8 rebounds, 3.2 assists, 1.5 steals, and 0.6 blocks per game.', 'Ron Baker may refer to: Ron Baker (American football) (born 1954), former NFL offensive lineman Ron Baker (basketball) (born 1993), NBA basketball guard Ronnie Baker (athlete) (born 1993), American track and field sprinter Ronnie Baker (musician) (1947–1990), record producer, bassist, arranger and songwriter Ron Bakir (born 1977), Lebanese-Australian entrepreneur\n\nIn the 2016–17 season, Ron Baker played for New York in 52 games. He averaged 4.1 points, 1.9 rebounds, 2.1 assists, 0.7 steals, and 0.2 blocks per game.', 'He currently serves as an assistant coach for the Milwaukee Bucks. Baker played for Old Saybrook High School in Old Saybrook, Connecticut. He first started on Old Saybrook\'s varsity in his junior year. Baker was passed over by the bigger Division I schools and signed a scholarship offer from the Hartford Hawks. During Baker\'s inaugural season in 1989, he averaged 4.7 points and 2.9 rebounds per game, which earned him a place on the North Atlantic Conference (now America East Conference) All-Rookie Team. Named a starter for his sophomore season, Baker averaged 19.7 PPG and 10.4 RPG and a first team All-NAC spot. As a Junior, Baker averaged 27.6 PPG (2nd in the country), 9.9 RPG, and 3.7 blocks per game (5th in the country), though the team finished with an abysmal 6–21 record. Entering his final season, Baker was called ""America\'s Best-Kept Secret"" by Sports Illustrated and the conference\'s most dominant player since Reggie Lewis by Street & Smith\'s College/Prep Basketball Preview in 1992. Baker averaged 28.3 PPG (4th in the country) and finished with 792 points in only 28 games, a conference record that still remains in the NAC. He finished with 2,238 points, a school record that still stands. However, Baker was not able to translate his immense scoring abilities into team success, as none of his teams ever made the NCAA tournament, and the best his Hartford teams ever finished in a season was .500 (14–14). Baker\'s jersey (#42) hangs on the east wall of Chase Arena in the Reich Family Pavilion. = After a college career at the University of Hartford, Baker was selected by the Milwaukee Bucks with the 8th pick of the 1993 NBA draft. He played four seasons in Milwaukee, during which he was the leading star (alongside Glenn Robinson) and received three all-star selections. On March 14, 1995, Baker recorded a triple double, with 12 points, 12 rebounds, and 12 assists, in a win against the Charlotte Hornets. On April 11, 1995, Baker scored 31 points, grabbed 12 rebounds, and recorded 9 assists in a 114–100 victory over the Detroit Pistons. During the 1995–96 and 1996–97 seasons, Baker averaged at least 21.0 points. On March 1, 1997, Baker recorded a career-high 6 blocks, alongside 20 points and 15 rebounds, in a 103–92 loss against the Sacramento Kings. Despite his personal success as a player while in Milwaukee, the Bucks were not able to make the postseason during his tenure with the team. = After four seasons with the Bucks, he was traded to the Seattle SuperSonics following the 1996–97 NBA season in a three-team deal that sent Tyrone Hill and Terrell Brandon to the Bucks, and Shawn Kemp and Sherman Douglas to the Cleveland Cavaliers. Baker helped the SuperSonics to a strong 1997-98 NBA season and a first round win over the Minnesota Timberwolves, while proving to be a valuable replacement for Kemp. On May 12, 1998, in a decisive Game 5 of a hard-fought Western Conference Semifinals against the Los Angeles Lakers (both teams finished the season with a 61–21 record, though Seattle had home-court advantage due to a tiebreaker), Baker led Seattle with 29 points and 9 rebounds in a losing effort. On February 1, 2000, Baker scored 33 points, recorded 5 assists, and 5 rebounds, in a 104–96 victory against Karl Malone and the Jazz. = After four years in Seattle, Baker was traded to the Boston Celtics with Shammond Williams for Kenny Anderson, Vitaly Potapenko and Joseph Forte. While his career averages include 15.1 points per game, his numbers had dropped considerably in the twenty-first century. After the 1998–99 NBA lockout season in Seattle, Baker\'s weight ballooned to near 300 pounds and his game suffered tremendously. While Baker was able to get his weight down to around 250, Baker revealed that he was a recovering alcoholic who used to binge in hotel rooms and at home after playing poorly. In an interview with the Boston Globe, Baker said Celtics coach Jim O\'Brien smelled alcohol on him in practice and confronted him about it. The team suspended him and he was eventually released. = Baker would sign with the New York Knicks. The team reached the playoffs in the 2003–04 NBA season. = Baker was traded to the Rockets with Moochie Norris for Maurice Taylor on February 24, 2005. = The Rockets would ultimately release Baker on October 7, 2005. He would spend the 2005–06 NBA season in a reserve role with the Los Angeles Clippers. Baker signed with the Minnesota Timberwolves on October 1, 2006, reuniting him with head coach Dwane Casey, who served as an assistant coach when Baker was in Seattle. His tenure in Minnesota would be short-lived, though. Baker was released from the Timberwolves on November 13, 2006. He never played in a regular season game after being on the inactive list for the first six games. = = Regular season Playoffs Baker has a non-profit foundation called the Stand Tall Foundation. The Stand Tall Foundation is an organization that helps give kids a better future by financially assisting with different charitable and volunteer organizations. The goal of the Stand Tall Foundation is to help young people with their education, personal development and general well-being. On June 3, 2011, Baker was hired as an assistant high school boys basketball coach at St.', 'He shot 0.467 from the field, — from 3-point range, and 0.722 from the free throw line, playing an average of 10.6 minutes per game. In the All-Star season, Vin Baker played for All-Star in 4 games. He averaged 8.7 points, 6.0 rebounds, 0.7 assists, 0.5 steals, and 0.2 blocks per game. He shot 0.419 from the field, .000 from 3-point range, and 0.75 from the free throw line, playing an average of 17.5 minutes per game. In the 1998 season, Vin Baker played for Seattle in 10 games. He averaged 15.8 points, 9.4 rebounds, 1.8 assists, 1.8 steals, and 1.5 blocks per game. He shot 0.53 from the field, — from 3-point range, and 0.421 from the free throw line, playing an average of 37.1 minutes per game. In the 2000 season, Vin Baker played for Seattle in 5 games. He averaged 14.0 points, 7.6 rebounds, 2.0 assists, 1.0 steals, and 0.4 blocks per game. He shot 0.4 from the field, .000 from 3-point range, and 0.588 from the free throw line, playing an average of 35.4 minutes per game. In the 2002 season, Vin Baker played for Seattle in 5 games. He averaged 13.2 points, 5.0 rebounds, 0.8 assists, 0.6 steals, and 1.2 blocks per game. He shot 0.5 from the field, 1.000 from 3-point range, and 0.778 from the free throw line, playing an average of 28.8 minutes per game. In the 2004 season, Vin Baker played for New York in 4 games. He averaged 5.5 points, 3.0 rebounds, 0.3 assists, 0.8 steals, and 0.5 blocks per game. He shot 0.571 from the field, — from 3-point range, and 0.667 from the free throw line, playing an average of 14.3 minutes per game.', 'In 2013, the New York Daily News reported that he had stopped drinking alcohol on April 17, 2011. List of National Basketball Association annual minutes leaders Career statistics from NBA.com · Basketball Reference The Curious Case of Vin Baker\n\nIn the 1989–90 season, Vin Baker played for Hartford in 28 games. He averaged 4.7 points, 2.9 rebounds, 0.3 assists, 0.3 steals, and 1.7 blocks per game. He shot 0.617 from the field, – from 3-point range, and 0.39 from the free throw line, playing an average of 13.4 minutes per game. In the 1990–91 season, Vin Baker played for Hartford in 29 games. He averaged 19.6 points, 10.4 rebounds, 0.6 assists, 1.1 steals, and 2.0 blocks per game. He shot 0.491 from the field, – from 3-point range, and 0.678 from the free throw line, playing an average of 31.0 minutes per game. In the 1991–92 season, Vin Baker played for Hartford in 27 games. He averaged 27.6 points, 9.9 rebounds, 1.3 assists, 1.3 steals, and 3.7 blocks per game. He shot 0.44 from the field, .331 from 3-point range, and 0.657 from the free throw line, playing an average of 36.9 minutes per game. In the 1992–93 season, Vin Baker played for Hartford in 28 games. He averaged 28.3 points, 10.7 rebounds, 1.9 assists, 1.4 steals, and 2.6 blocks per game. He shot 0.477 from the field, .269 from 3-point range, and 0.625 from the free throw line, playing an average of 36.4 minutes per game. In the 1993–94 season, Vin Baker played for Milwaukee in 82* games. He averaged 13.5 points, 7.6 rebounds, 2.0 assists, 0.7 steals, and 1.4 blocks per game. He shot 0.501 from the field, .200 from 3-point range, and 0.569 from the free throw line, playing an average of 31.2 minutes per game. In the 1994–95 season, Vin Baker played for Milwaukee in 82* games. He averaged 17.7 points, 10.3 rebounds, 3.6 assists, 1.0 steals, and 1.4 blocks per game. He shot 0.483 from the field, .292 from 3-point range, and 0.593 from the free throw line, playing an average of 41.0* minutes per game. In the 1995–96 season, Vin Baker played for Milwaukee in 82 games. He averaged 21.1 points, 9.9 rebounds, 2.6 assists, 0.8 steals, and 1.1 blocks per game. He shot 0.489 from the field, .208 from 3-point range, and 0.67 from the free throw line, playing an average of 40.5 minutes per game. In the 1996–97 season, Vin Baker played for Milwaukee in 78 games. He averaged 21.0 points, 10.3 rebounds, 2.7 assists, 1.0 steals, and 1.4 blocks per game. He shot 0.505 from the field, .278 from 3-point range, and 0.687 from the free throw line, playing an average of 40.5 minutes per game. In the 1997–98 season, Vin Baker played for Seattle in 82* games. He averaged 19.2 points, 8.0 rebounds, 1.9 assists, 1.1 steals, and 1.0 blocks per game. He shot 0.542 from the field, .143 from 3-point range, and 0.591 from the free throw line, playing an average of 35.9 minutes per game. In the 1998–99 season, Vin Baker played for Seattle in 34 games. He averaged 13.8 points, 6.2 rebounds, 1.6 assists, 0.9 steals, and 1.0 blocks per game. He shot 0.453 from the field, .000 from 3-point range, and 0.45 from the free throw line, playing an average of 34.2 minutes per game. In the 1999–2000 season, Vin Baker played for Seattle in 79 games. He averaged 16.6 points, 7.7 rebounds, 1.9 assists, 0.6 steals, and 0.8 blocks per game. He shot 0.455 from the field, .250 from 3-point range, and 0.682 from the free throw line, playing an average of 36.1 minutes per game. In the 2000–01 season, Vin Baker played for Seattle in 76 games. He averaged 12.2 points, 5.7 rebounds, 1.2 assists, 0.5 steals, and 1.0 blocks per game. He shot 0.422 from the field, .063 from 3-point range, and 0.723 from the free throw line, playing an average of 28.0 minutes per game. In the 2001–02 season, Vin Baker played for Seattle in 55 games. He averaged 14.1 points, 6.4 rebounds, 1.3 assists, 0.4 steals, and 0.7 blocks per game. He shot 0.485 from the field, .125 from 3-point range, and 0.633 from the free throw line, playing an average of 31.1 minutes per game. In the 2002–03 season, Vin Baker played for Boston in 52 games. He averaged 5.2 points, 3.8 rebounds, 0.6 assists, 0.4 steals, and 0.6 blocks per game. He shot 0.478 from the field, .000 from 3-point range, and 0.673 from the free throw line, playing an average of 18.1 minutes per game. In the 2003–04 season, Vin Baker played for Boston in 37 games. He averaged 11.3 points, 5.7 rebounds, 1.5 assists, 0.6 steals, and 0.6 blocks per game. He shot 0.505 from the field, .000 from 3-point range, and 0.732 from the free throw line, playing an average of 27.0 minutes per game. In the 2003–04 season, Vin Baker played for New York in 17 games. He averaged 6.6 points, 4.1 rebounds, 0.7 assists, 0.4 steals, and 0.5 blocks per game. He shot 0.404 from the field, .500 from 3-point range, and 0.711 from the free throw line, playing an average of 18.4 minutes per game. In the 2004–05 season, Vin Baker played for New York in 24 games. He averaged 1.4 points, 1.5 rebounds, 0.4 assists, 0.1 steals, and 0.2 blocks per game. He shot 0.342 from the field, .000 from 3-point range, and 0.467 from the free throw line, playing an average of 8.0 minutes per game. In the 2004–05 season, Vin Baker played for Houston in 3 games. He averaged 0.7 points, 0.7 rebounds, 0.3 assists, 0.0 steals, and 0.0 blocks per game. He shot 0.0 from the field, — from 3-point range, and 1.0 from the free throw line, playing an average of 4.3 minutes per game. In the 2005–06 season, Vin Baker played for L.A. Clippers in 8 games.', 'Bernard School in Uncasville, Connecticut. In 2014, Baker was named to a team assembled by Dennis Rodman as part of his ""basketball diplomacy"" effort in North Korea; the team was assembled to play an exhibition game against the North Korean Senior National Team to celebrate the birthday of Kim Jong-un. As of December 2015, Baker was managing a Starbucks location in Old Saybrook, Connecticut. Baker later became Fox Sports Milwaukee\'s home team broadcaster. In 2017, Baker became the head of the basketball department at Camp Greylock. On July 18, 2020, The Vin Baker Foundation hosted a 5k run called ""Addiction Ends Here"". Since 2018, Baker has been serving as an assistant coach for the Milwaukee Bucks, helping them win a championship in 2021.', 'He played college basketball for Dixie State College and Oklahoma State University, and has spent time in the NBA with the Los Angeles Clippers and the Portland Trail Blazers. He has also played professionally in Russia, Syria, Mexico, Lithuania, France, Puerto Rico, Philippines, Venezuela, and the Dominican Republic. Baker played his longest tenure with the Santa Cruz Warriors, starting with the 2004 season when the team was known as the Dakota Wizards in the Continental Basketball Association before the team moved to the NBA Development League in 2006. Baker has appeared in the second-most D-League games (356) in league history, and is the Warriors\' franchise all-time leader in points, minutes played, rebounds, assists, steals, and field goals made. Over his first two professional seasons, between 2002 and 2004, Baker played in Russia, Syria and Mexico. His first stint in the United States came during the 2004–05 season, when he joined the Dakota Wizards of the Continental Basketball Association. After averaging 16.9 points, 6.7 assists and 5.4 rebounds in 30 games for Dakota, he was called up to the NBA by the Los Angeles Clippers in February 2005. The following month, he garnered another NBA stint, this time with the Portland Trail Blazers. Over two 10-day contract periods with the Clippers and Trail Blazers, Baker appeared in five games with limited court time. Baker\'s 10-day contract with the Trail Blazers ended up being his final playing time in the NBA, as the rest of his professional basketball career was played in the D-League and overseas. His final game was played on March 19, 2005, in a 92 - 97 loss to the Orlando Magic where he only played for 5 seconds and recorded no stats. Baker returned to the Dakota Wizards for the 2005–06 season, playing with them until January 2006 when he moved to Lithuania to play for Lietuvos Rytas. In 12 league games for Rytas, he averaged 6.5 points, 3.2 rebounds, 2.1 assists and 1.7 steals per game. In the summer of 2006, Baker underwent ankle surgery, and was deemed ""about 80 percent of the player he was before"" the surgery. For the 2006–07 season, Baker returned to the Dakota Wizards, with the team now playing in the NBA Development League. In their first D-League season, Baker helped the Wizards win the championship, leading the team in rebounds with ten while scoring nineteen points in the Championship game against the Colorado 14ers. He again played for Dakota in 2007–08, departing the team in January 2008 to join Paris-Levallois of the LNB Pro A. In 2008–09, Baker again played in the NBA Development League for the Dakota Wizards, earning All-Star honors for the first time. Following the season with Dakota, Baker moved to Puerto Rico for the 2009 BSN season, joining Atléticos de San Germán. He returned to Dakota for the 2009–10 season, before again playing in Puerto Rico in the off-season, this time joining Indios de Mayagüez. For the 2010–11 season, Baker moved to Mexico where he played for Ola Verde de Poza Rica. In January 2011, he returned to the Dakota Wizards for the rest of the season. He later had stints in the Philippines for the Talk \'N Text Tropang Texters, and in Venezuela for Guaiqueríes de Margarita. Baker again played for the Dakota Wizards in 2011–12. He then played in the Dominican Republic during the 2012 off-season for Cañeros del Este. In 2012, the Wizards were moved from North Dakota to California by their NBA affiliate team, the Golden State Warriors. The team was subsequently renamed the Santa Cruz Warriors, and Baker continued on with Santa Cruz. Between 2012 and 2016, Baker was a consistent presence on the Santa Cruz roster, earning his second D-League championship in the 2014–15 season. Prior to the start of the 2022–23 NBA season, Baker was hired as an assistant coach for the Indiana Pacers under head coach Rick Carlisle. = Career statistics from NBA.com · Basketball Reference Maurice Baker at nbadleague.com Maurice Baker Oklahoma State profile Maurice Baker at lnb.fr Maurice Baker is the legend you never heard of\n\nIn the 2004–05 season, Maurice Baker played for L.A. Clippers in 1 games.', ""He returned to the line-up on 6 February 2013, but after managing another 14 games, he was ruled out for the rest of the season on 13 March because of the same injury. = 2013–14 season On 10 July 2013, Bargnani was traded to the New York Knicks in exchange for Steve Novak, Marcus Camby and Quentin Richardson, along with a future first-round draft pick (2016) and two future second-round draft picks (2014 and 2017). On 18 December 2013, in a game at the Milwaukee Bucks, with 20 seconds remaining in overtime in which the Knicks held a two-point lead, Bargnani received an offensive rebound and, instead of dribbling out the clock or getting fouled to go to the free throw line, for reasons only known to him, shot a three-pointer that missed. The game went into double-overtime as a result, where the Knicks outscored the Bucks 13–7 to hold on for a 107–101 win. On 22 January 2014, in a loss to the Philadelphia 76ers, Bargnani suffered a torn ligament in his left elbow after a failed dunk attempt, and was ruled out indefinitely, eventually missing the rest of the regular season. The Knicks finished the season at 37–45 and missed the playoffs. 2014–15 season After missing most of the preseason with a hamstring injury, Bargnani was set to make his season debut on 22 November when he was ruled out indefinitely again with a strained calf muscle. He went on to make his season debut on 31 December against the Los Angeles Clippers after having not played for nearly a year. In just under 20 minutes of action off the bench, he recorded 9 points, 4 rebounds and 2 assists in the 78–99 loss. However, the following game on 2 January, Bargnani re-injured his right calf during the first quarter of the Knicks' 81–97 loss to the Detroit Pistons. He missed a further 16 games before making his second return of the season against Miami on 9 February. = On 17 July 2015, Bargnani signed with the Brooklyn Nets. He made his debut for the Nets in the team's season opener against the Chicago Bulls on 28 October, recording 17 points and 7 rebounds off the bench in a 115–100 loss. On 10 December, he scored a season-high 23 points in a 110–91 win over the Philadelphia 76ers."", ""22 for the season's summer leagues, in Las Vegas, Nevada. On December 1, 2008, it was announced that Brewer had sustained an ACL tear and would miss the rest of the 2008–09 NBA season. = On February 22, 2011, Brewer was traded to the New York Knicks in a three-way blockbuster trade that also brought Carmelo Anthony from the Nuggets to New York. On March 1, 2011, he was waived by the Knicks without playing a game for them. On March 3, 2011, Brewer signed a three-year, $8 million contract with the Dallas Mavericks. He went on to win his first NBA Championship with the Mavericks when they defeated the Miami Heat in six games in the 2011 NBA Finals. = On December 13, 2011, Brewer and Rudy Fernández were traded to the Denver Nuggets for a future second-round pick and a traded player exception. = On July 12, 2013, Brewer signed a reported three-year, $15 million contract with the Minnesota Timberwolves, returning to the franchise for a second stint. On April 11, 2014, Brewer scored a career-high 51 points in a 112–110 win over the Houston Rockets. In doing so he joined Michael Jordan, Allen Iverson and Rick Barry as the only players to record 50-plus points and 6-plus steals in one game. He also tied Kevin Love's then-franchise record for most points in a game. = On December 19, 2014, Brewer was acquired by the Houston Rockets in a three-team trade that also involved the Timberwolves and the Philadelphia 76ers. Three days later, he made his debut for the Rockets against the Portland Trail Blazers. In just under 23 minutes of action off the bench, he recorded 12 points, 4 rebounds, 4 assists, 5 steals and 1 block in a 110–95 win. On February 21, 2015, he recorded season-highs of 26 points and 10 rebounds in a 98–76 win over the Toronto Raptors. During 2015 NBA Playoffs of the Semiconference finals, Brewer score 19 points, grab 10 rebounds and 2 assist off the bench leading the Rockets to decisive victory over Clippers in game 6 that ultimately came back with a 3–1 deflict and head to the Western Conference Finals. On July 14, 2015, Brewer re-signed with the Rockets to a three-year, $23.4 million contract. On January 22, 2016, he picked up the team's starting small forward role. On February 4, in his ninth start of the season, Brewer scored a season-high 24 points in a 111–105 win over the Phoenix Suns. = On February 23, 2017, Brewer was traded, along with a 2017 first round draft pick, to the Los Angeles Lakers in exchange for Lou Williams. On February 28, 2018, he was waived by the Lakers after reaching a buyout agreement. = On March 3, 2018, Brewer signed with the Oklahoma City Thunder. The signing reunited Brewer with his former college coach Billy Donovan. On March 16, 2018, he scored 22 points and matched a career high with six steals in a 121–113 win over the Los Angeles Clippers. = On January 15, 2019, Brewer signed a 10-day contract with the Philadelphia 76ers. On January 25, he signed a second 10-day contract with the 76ers. Following the expiration of his second 10-day contract, the 76ers parted ways with Brewer, deciding not to sign him for the rest of the season. = On February 8, 2019, Brewer signed a 10-day contract with the Sacramento Kings. He went on to sign a second 10-day contract on February 18, and a rest-of-season contract on February 28. After spending the whole of the 2019–20 NBA season (before it was suspended) as a free agent, Brewer re-signed with the Kings on June 23, 2020, prior to the planned resumption of the season. On November 16, 2020, the New Orleans Pelicans announced that they had hired Brewer as a player development coach, at the same time announcing his retirement from the NBA. On September 27, 2024, Brewer was promoted to assistant coach by the Pelicans. = = List of Florida Gators in the NBA Career statistics from NBA.com · Basketball Reference Brewer's official website Florida Gators bio\n\nIn the 2007–08 season, Corey Brewer played for Minnesota in 79 games. He averaged 5.8 points, 3.7 rebounds, 1.4 assists, 1.0 steals, and .3 blocks per game. He shot 0.374 from the field, 0.194 from 3-point range, and 0.8 from the free throw line, playing an average of 22.8 minutes per game. In the 2008–09 season, Corey Brewer played for Minnesota in 15 games. He averaged 6.2 points, 3.3 rebounds, 1.7 assists, 1.0 steals, and .2 blocks per game. He shot 0.411 from the field, 0.417 from 3-point range, and 0.737 from the free throw line, playing an average of 20.5 minutes per game. In the 2009–10 season, Corey Brewer played for Minnesota in 82* games. He averaged 13.0 points, 3.4 rebounds, 2.4 assists, 1.4 steals, and .4 blocks per game. He shot 0.431 from the field, 0.346 from 3-point range, and 0.648 from the free throw line, playing an average of 30.3 minutes per game. In the 2010–11 season, Corey Brewer played for Minnesota in 56 games. He averaged 8.6 points, 2.7 rebounds, 1.4 assists, 1.6 steals, and .2 blocks per game. He shot 0.384 from the field, 0.263 from 3-point range, and 0.708 from the free throw line, playing an average of 24.3 minutes per game. In the 2010–11† season, Corey Brewer played for Dallas in 13 games. He averaged 5.3 points, 1.8 rebounds, 0.9 assists, 0.8 steals, and .2 blocks per game. He shot 0.49 from the field, 0.308 from 3-point range, and 0.714 from the free throw line, playing an average of 11.4 minutes per game. In the 2011–12 season, Corey Brewer played for Denver in 59 games. He averaged 8.9 points, 2.5 rebounds, 1.5 assists, 1.2 steals, and .3 blocks per game. He shot 0.434 from the field, 0.26 from 3-point range, and 0.692 from the free throw line, playing an average of 21.8 minutes per game. In the 2012–13 season, Corey Brewer played for Denver in 82* games. He averaged 12.1 points, 2.9 rebounds, 1.5 assists, 1.4 steals, and .3 blocks per game. He shot 0.425 from the field, 0.296 from 3-point range, and 0.69 from the free throw line, playing an average of 24.4 minutes per game. In the 2013–14 season, Corey Brewer played for Minnesota in 81 games. He averaged 12.3 points, 2.6 rebounds, 1.7 assists, 1.9 steals, and .4 blocks per game. He shot 0.481 from the field, 0.28 from 3-point range, and 0.718 from the free throw line, playing an average of 32.2 minutes per game. In the 2014–15 season, Corey Brewer played for Minnesota in 24 games. He averaged 10.5 points, 3.9 rebounds, 3.3 assists, 2.3 steals, and .2 blocks per game. He shot 0.418 from the field, 0.195 from 3-point range, and 0.705 from the free throw line, playing an average of 28.3 minutes per game. In the 2014–15 season, Corey Brewer played for Houston in 56 games. He averaged 11.9 points, 3.6 rebounds, 1.7 assists, 1.1 steals, and .3 blocks per game. He shot 0.429 from the field, 0.284 from 3-point range, and 0.764 from the free throw line, playing an average of 25.1 minutes per game. In the 2015–16 season, Corey Brewer played for Houston in 82* games. He averaged 7.2 points, 2.4 rebounds, 1.3 assists, 1.0 steals, and .2 blocks per game. He shot 0.384 from the field, 0.272 from 3-point range, and 0.75 from the free throw line, playing an average of 20.4 minutes per game. In the 2016–17 season, Corey Brewer played for Houston in 58* games. He averaged 4.2 points, 2.0 rebounds, 1.1 assists, 0.6 steals, and .2 blocks per game. He shot 0.414 from the field, 0.234 from 3-point range, and 0.727 from the free throw line, playing an average of 15.9 minutes per game. In the 2016–17 season, Corey Brewer played for L.A. Lakers in 24* games."", 'New York Basketball.']","In the 2016–17 season, Ron Baker played for New York in 52 games.",Ron Baker played in 52 games for New York in the 2016-17 season.,,0.9853385638954872,0.9166666666361111,,0.6175600001091766,0.9702400004367064
"In the 2012-13 season, how many games did Steve Blake play for the L.A. Lakers?","['He averaged 5.2 points, 1.6 rebounds, 3.3 assists, 0.7 steals, and 0.0 blocks per game. He shot 0.377 from the field, 0.335 from 3-point range, and 0.778 from the free throw line, playing an average of 23.3 minutes per game. In the 2012–13 season, Steve Blake played for L.A. Lakers in 45 games.', 'He averaged 7.3 points, 2.9 rebounds, 3.8 assists, 0.8 steals, and 0.1 blocks per game. He shot 0.422 from the field, 0.421 from 3-point range, and 0.771 from the free throw line, playing an average of 26.1 minutes per game. In the 2013–14 season, Steve Blake played for L.A. Lakers in 27 games.', ""However, Blake was sidelined starting in November after suffering an abdominal strain that required surgery. He experienced groin problems during his recovery before returning in late January after missing 37 games. He was more comfortable playing under coach Mike D'Antoni, who had replaced Brown early in the season. In the playoffs that season, Blake left Game 2 in the first round against San Antonio after injuring his right hamstring and was declared out indefinitely. = On February 19, 2014, Blake was traded to the Golden State Warriors in exchange for MarShon Brooks and Kent Bazemore. = On July 10, 2014, Blake signed with the Portland Trail Blazers to a reported two-year, $4.2 million deal. On February 20, 2015, Blake changed his jersey number from #25 to #5 in a tribute to Jerome Kersey who died two days prior. On June 19, 2015, Blake exercised his player option with the Trail Blazers for the 2015–16 season. = On June 25, 2015, Blake was traded, along with the draft rights to Rondae Hollis-Jefferson, to the Brooklyn Nets in exchange for Mason Plumlee and the draft rights to Pat Connaughton. On July 13, 2015, he was traded to the Detroit Pistons in exchange for Quincy Miller. Blake's final NBA game was played in Game 4 of the 2016 Eastern Conference First Round on April 26, 2016. The Pistons would lose the game 98–100 to the Cleveland Cavaliers with Blake recording 3 points, 2 assists and 1 rebound. = On October 22, 2016, Blake signed with the Sydney Kings for the rest of the 2016–17 NBL season. He made his debut for the Kings on October 30, recording 12 points, four rebounds, four assists and two steals in an 87–78 win over the Brisbane Bullets. On November 28, he was granted leave by the Kings and returned to the United States indefinitely to address a private family matter. On December 6, Blake announced that he would not be returning to Sydney, effectively ending his stint with the Kings. In nine games for the Kings, he averaged 5.9 points, 2.3 rebounds and 2.2 assists per game. = On September 27, 2017, Blake was reported to have joined the Portland Trail Blazers as a coaching intern. For the 2018–19 season, Blake was promoted to an on-court assistant for the Trail Blazers. = On June 26, 2019, Blake was hired as an assistant coach for the Phoenix Suns. On July 18, 2020, Suns head coach Monty Williams announced that Blake was no longer with the team. = = List of NCAA Division I men's basketball career assists leaders Career statistics from NBA.com · Basketball Reference\n\nIn the 2003–04 season, Steve Blake played for Washington in 75 games. He averaged 5.9 points, 1.6 rebounds, 2.8 assists, 0.8 steals, and 0.1 blocks per game. He shot 0.386 from the field, 0.371 from 3-point range, and 0.821 from the free throw line, playing an average of 18.6 minutes per game. In the 2004–05 season, Steve Blake played for Washington in 44 games. He averaged 4.3 points, 1.6 rebounds, 1.6 assists, 0.3 steals, and 0.0 blocks per game. He shot 0.328 from the field, 0.387 from 3-point range, and 0.805 from the free throw line, playing an average of 14.7 minutes per game. In the 2005–06 season, Steve Blake played for Portland in 68 games. He averaged 8.2 points, 2.1 rebounds, 4.5 assists, 0.6 steals, and 0.1 blocks per game. He shot 0.438 from the field, 0.413 from 3-point range, and 0.791 from the free throw line, playing an average of 26.2 minutes per game. In the 2006–07 season, Steve Blake played for Milwaukee in 33 games. He averaged 3.6 points, 1.4 rebounds, 2.5 assists, 0.3 steals, and 0.1 blocks per game. He shot 0.349 from the field, 0.279 from 3-point range, and 0.55 from the free throw line, playing an average of 17.7 minutes per game. In the 2006–07 season, Steve Blake played for Denver in 49 games. He averaged 8.3 points, 2.5 rebounds, 6.6 assists, 1.0 steals, and 0.1 blocks per game. He shot 0.432 from the field, 0.343 from 3-point range, and 0.727 from the free throw line, playing an average of 33.5 minutes per game. In the 2007–08 season, Steve Blake played for Portland in 81 games. He averaged 8.5 points, 2.4 rebounds, 5.1 assists, 0.7 steals, and 0.0 blocks per game. He shot 0.408 from the field, 0.406 from 3-point range, and 0.766 from the free throw line, playing an average of 29.9 minutes per game. In the 2008–09 season, Steve Blake played for Portland in 69 games. He averaged 11.0 points, 2.5 rebounds, 5.0 assists, 1.0 steals, and 0.1 blocks per game. He shot 0.428 from the field, 0.427 from 3-point range, and 0.84 from the free throw line, playing an average of 31.7 minutes per game. In the 2009–10 season, Steve Blake played for Portland in 51 games. He averaged 7.6 points, 2.3 rebounds, 4.0 assists, 0.7 steals, and 0.0 blocks per game. He shot 0.403 from the field, 0.377 from 3-point range, and 0.75 from the free throw line, playing an average of 27.4 minutes per game. In the 2009–10 season, Steve Blake played for L.A. Clippers in 29 games. He averaged 6.8 points, 2.4 rebounds, 6.1 assists, 0.7 steals, and 0.1 blocks per game. He shot 0.443 from the field, 0.437 from 3-point range, and 0.75 from the free throw line, playing an average of 26.3 minutes per game. In the 2010–11 season, Steve Blake played for L.A. Lakers in 79 games. He averaged 4.0 points, 2.0 rebounds, 2.2 assists, 0.5 steals, and 0.0 blocks per game. He shot 0.359 from the field, 0.378 from 3-point range, and 0.867 from the free throw line, playing an average of 20.0 minutes per game. In the 2011–12 season, Steve Blake played for L.A. Lakers in 53 games."", 'He averaged 9.5 points, 3.8 rebounds, 7.6 assists, 1.3 steals, and 0.1 blocks per game. He shot 0.378 from the field, 0.397 from 3-point range, and 0.8 from the free throw line, playing an average of 33.0 minutes per game. In the 2013–14 season, Steve Blake played for Golden State in 28 games. He averaged 4.4 points, 2.0 rebounds, 3.6 assists, 0.7 steals, and 0.2 blocks per game. He shot 0.375 from the field, 0.342 from 3-point range, and 0.625 from the free throw line, playing an average of 21.7 minutes per game. In the 2014–15 season, Steve Blake played for Portland in 81 games. He averaged 4.3 points, 1.7 rebounds, 3.6 assists, 0.5 steals, and 0.1 blocks per game. He shot 0.373 from the field, 0.352 from 3-point range, and 0.707 from the free throw line, playing an average of 18.9 minutes per game. In the 2015–16 season, Steve Blake played for Detroit in 58 games. He averaged 4.4 points, 1.5 rebounds, 3.4 assists, 0.4 steals, and 0.1 blocks per game. He shot 0.388 from the field, 0.344 from 3-point range, and 0.8 from the free throw line, playing an average of 17.0 minutes per game. In the 2005 season, Steve Blake played for Washington in 4 games. He averaged 0.5 points, 0.8 rebounds, 0.5 assists, 0.0 steals, and 0.0 blocks per game. He shot 0.25 from the field, 0.0 from 3-point range, and 0.0 from the free throw line, playing an average of 4.3 minutes per game. In the 2007 season, Steve Blake played for Denver in 5 games. He averaged 7.2 points, 2.4 rebounds, 4.6 assists, 0.6 steals, and 0.0 blocks per game. He shot 0.452 from the field, 0.5 from 3-point range, and 0.0 from the free throw line, playing an average of 36.0 minutes per game. In the 2009 season, Steve Blake played for Portland in 6 games. He averaged 9.8 points, 4.0 rebounds, 6.2 assists, 0.8 steals, and 0.0 blocks per game. He shot 0.489 from the field, 0.417 from 3-point range, and 0.714 from the free throw line, playing an average of 38.5 minutes per game. In the 2011 season, Steve Blake played for L.A. Lakers in 9 games. He averaged 2.2 points, 1.6 rebounds, 2.2 assists, 0.6 steals, and 0.0 blocks per game. He shot 0.304 from the field, 0.333 from 3-point range, and 0.0 from the free throw line, playing an average of 16.1 minutes per game. In the 2012 season, Steve Blake played for L.A. Lakers in 12 games. He averaged 6.3 points, 2.8 rebounds, 2.3 assists, 0.7 steals, and 0.2 blocks per game. He shot 0.419 from the field, 0.419 from 3-point range, and 0.714 from the free throw line, playing an average of 25.5 minutes per game. In the 2013 season, Steve Blake played for L.A. Lakers in 2 games. He averaged 14.0 points, 4.0 rebounds, 2.5 assists, 2.0 steals, and 1.5 blocks per game. He shot 0.393 from the field, 0.417 from 3-point range, and 1.0 from the free throw line, playing an average of 37.5 minutes per game. In the 2014 season, Steve Blake played for Golden State in 6 games. He averaged 1.8 points, 0.7 rebounds, 0.3 assists, 0.0 steals, and 0.0 blocks per game. He shot 0.333 from the field, 0.3 from 3-point range, and 0.0 from the free throw line, playing an average of 7.5 minutes per game. In the 2015 season, Steve Blake played for Portland in 5 games. He averaged 1.4 points, 0.2 rebounds, 1.6 assists, 0.0 steals, and 0.2 blocks per game. He shot 0.182 from the field, 0.125 from 3-point range, and 1.0 from the free throw line, playing an average of 8.6 minutes per game. In the 2016 season, Steve Blake played for Detroit in 4 games. He averaged 1.0 points, 1.0 rebounds, 2.5 assists, 0.0 steals, and 0.0 blocks per game.', 'He shot 0.444 from the field, .416 from 3-point range, and .913 from the free throw line, playing an average of 16.4 minutes per game. In the 2009–10 season, Steve Novak played for L.A. Clippers in 54 games. He averaged 2.1 points, 0.6 rebounds, 0.1 assists, 0.1 steals, and 0.0 blocks per game.', 'Lakers in 9 games. He averaged 5.4 points, 5.3 rebounds, 1.6 assists, 1.0 steals, and 0.7 blocks per game.', 'Lakers in 45 games. He averaged 6.9 points, 1.5 rebounds, 4.2 assists, 1.0 steals, and 0.1 blocks per game.', 'Lakers in 70 games. He averaged 6.8 points, 5.2 rebounds, 1.3 assists, 1.7 steals, and 0.7 blocks per game.', 'Lakers in 55 games. He averaged 4.1 points, 4.2 rebounds, 1.3 assists, 0.4 steals, and 0.4 blocks per game.', 'In the 2003–04 season, Matt Barnes played for L.A. Clippers in 38 games. He averaged 4.5 points, 4.0 rebounds, 1.3 assists, 0.7 steals, and 0.1 blocks per game.']","In the 2012-13 season, Steve Blake played for the L.A. Lakers in 45 games.",Steve Blake played 45 games for the L.A. Lakers in the 2012-13 season.,,0.9459423109524794,0.7861904761747525,1.0,0.542717672583095,0.9708706903323798
"What were Victor Oladipo's shooting percentages from the field, 3-point range, and free throw line in the specified season?","['He has a daughter, Naomi, born in 2022. Career statistics from NBA.com · Basketball Reference Indiana Hoosiers bio\n\nIn the 2013–14 season, Victor Oladipo played for Orlando in 80 games. He averaged 13.8 points, 4.1 rebounds, 4.1 assists, 1.6 steals, and 0.5 blocks per game. He shot 0.419 from the field, 0.327 from 3-point range, and 0.78 from the free throw line, playing an average of 31.1 minutes per game. In the 2014–15 season, Victor Oladipo played for Orlando in 72 games. He averaged 17.9 points, 4.2 rebounds, 4.1 assists, 1.7 steals, and 0.3 blocks per game. He shot 0.436 from the field, 0.339 from 3-point range, and 0.819 from the free throw line, playing an average of 35.7 minutes per game. In the 2015–16 season, Victor Oladipo played for Orlando in 72 games. He averaged 16.0 points, 4.8 rebounds, 3.9 assists, 1.6 steals, and 0.8 blocks per game. He shot 0.438 from the field, 0.348 from 3-point range, and 0.83 from the free throw line, playing an average of 33.0 minutes per game. In the 2016–17 season, Victor Oladipo played for Oklahoma City in 67 games. He averaged 15.9 points, 4.3 rebounds, 2.6 assists, 1.2 steals, and 0.3 blocks per game. He shot 0.442 from the field, 0.361 from 3-point range, and 0.753 from the free throw line, playing an average of 33.2 minutes per game. In the 2017–18 season, Victor Oladipo played for Indiana in 75 games. He averaged 23.1 points, 5.2 rebounds, 4.3 assists, 2.4* steals, and 0.8 blocks per game. He shot 0.477 from the field, 0.371 from 3-point range, and 0.799 from the free throw line, playing an average of 34.0 minutes per game. In the 2018–19 season, Victor Oladipo played for Indiana in 36 games. He averaged 18.8 points, 5.6 rebounds, 5.2 assists, 1.7 steals, and 0.3 blocks per game. He shot 0.423 from the field, 0.343 from 3-point range, and 0.73 from the free throw line, playing an average of 31.9 minutes per game. In the 2019–20 season, Victor Oladipo played for Indiana in 19 games. He averaged 14.5 points, 3.9 rebounds, 2.9 assists, .9 steals, and 0.2 blocks per game. He shot 0.394 from the field, 0.317 from 3-point range, and 0.814 from the free throw line, playing an average of 27.8 minutes per game. In the 2020–21 season, Victor Oladipo played for Indiana in 9 games. He averaged 20.0 points, 5.7 rebounds, 4.2 assists, 1.7 steals, and 0.2 blocks per game. He shot 0.421 from the field, 0.362 from 3-point range, and 0.73 from the free throw line, playing an average of 33.3 minutes per game. In the 2020–21 season, Victor Oladipo played for Houston in 20 games. He averaged 21.2 points, 4.8 rebounds, 5.0 assists, 1.2 steals, and 0.5 blocks per game. He shot 0.407 from the field, 0.32 from 3-point range, and 0.783 from the free throw line, playing an average of 33.5 minutes per game. In the 2020–21 season, Victor Oladipo played for Miami in 4 games. He averaged 12.0 points, 3.5 rebounds, 3.5 assists, 1.8 steals, and 0.5 blocks per game. He shot 0.372 from the field, 0.235 from 3-point range, and 0.667 from the free throw line, playing an average of 27.8 minutes per game. In the 2021–22 season, Victor Oladipo played for Miami in 8 games. He averaged 12.4 points, 2.9 rebounds, 3.5 assists, .6 steals, and 0.1 blocks per game. He shot 0.479 from the field, 0.417 from 3-point range, and 0.737 from the free throw line, playing an average of 21.6 minutes per game. In the 2022–23 season, Victor Oladipo played for Miami in 42 games. He averaged 10.7 points, 3.0 rebounds, 3.5 assists, 1.4 steals, and 0.3 blocks per game. He shot 0.397 from the field, 0.33 from 3-point range, and 0.747 from the free throw line, playing an average of 26.3 minutes per game. In the All-Star season, Victor Oladipo played for All-Star in 1 games. He averaged 7.0 points, 2.0 rebounds, 3.0 assists, 3.0 steals, and 0.0 blocks per game. He shot 0.375 from the field, 0.167 from 3-point range, and 0.0 from the free throw line, playing an average of 15.0 minutes per game. In the 2017 season, Victor Oladipo played for Oklahoma City in 5 games. He averaged 10.8 points, 5.6 rebounds, 2.0 assists, 1.4 steals, and 0.6 blocks per game. He shot 0.344 from the field, 0.24 from 3-point range, and 1.0 from the free throw line, playing an average of 36.2 minutes per game. In the 2018 season, Victor Oladipo played for Indiana in 7 games. He averaged 22.7 points, 8.3 rebounds, 6.0 assists, 2.4 steals, and 0.4 blocks per game. He shot 0.417 from the field, 0.404 from 3-point range, and 0.732 from the free throw line, playing an average of 37.3 minutes per game. In the 2020 season, Victor Oladipo played for Indiana in 4 games. He averaged 17.8 points, 3.3 rebounds, 2.5 assists, 2.3 steals, and 0.0 blocks per game. He shot 0.393 from the field, 0.364 from 3-point range, and 0.938 from the free throw line, playing an average of 30.8 minutes per game. In the 2022 season, Victor Oladipo played for Miami in 15 games. He averaged 10.6 points, 3.4 rebounds, 2.1 assists, 1.3 steals, and 0.3 blocks per game. He shot 0.368 from the field, 0.274 from 3-point range, and 0.792 from the free throw line, playing an average of 24.5 minutes per game. In the 2023 season, Victor Oladipo played for Miami in 2 games. He averaged 11.5 points, 3.5 rebounds, 1.0 assists, 1.0 steals, and 0.5 blocks per game. He shot 0.526 from the field, 0.4 from 3-point range, and 0.333 from the free throw line, playing an average of 22.7 minutes per game. In the 2010–11 season, Victor Oladipo played for Indiana in 32 games. He averaged 7.4 points, 3.7 rebounds, 0.9 assists, 1.1 steals, and 0.2 blocks per game. He shot 0.547 from the field, 0.308 from 3-point range, and 0.612 from the free throw line, playing an average of 18.0 minutes per game. In the 2011–12 season, Victor Oladipo played for Indiana in 36 games. He averaged 10.8 points, 5.3 rebounds, 2.0 assists, 1.4 steals, and 0.6 blocks per game. He shot 0.471 from the field, 0.208 from 3-point range, and 0.75 from the free throw line, playing an average of 26.7 minutes per game. In the 2012–13 season, Victor Oladipo played for Indiana in 36 games. He averaged 13.6 points, 6.3 rebounds, 2.1 assists, 2.2 steals, and 0.8 blocks per game.', 'He shot 0.333 from the field, 0.462 from 3-point range, and 0.917 from the free throw line, playing an average of 15.3 minutes per game.', 'He shot .687* from the field, .267 from 3-point range, and .694 from the free throw line, playing an average of 28.1 minutes per game.', 'He shot 0.3 from the field, 0.235 from 3-point range, and .970 from the free throw line, playing an average of 35.8 minutes per game.', 'He shot — from the field, — from 3-point range, and — from the free throw line, playing an average of — minutes per game.', 'He shot - from the field, - from 3-point range, and - from the free throw line, playing an average of 3.0 minutes per game.', 'He shot 0.513 from the field, 0.368 from 3-point range, and 0.686 from the free throw line, playing an average of 35.0 minutes per game.', 'He shot 0.3 from the field, 0.357 from 3-point range, and 0.875 from the free throw line, playing an average of 8.3 minutes per game.', 'He shot .585 from the field, .387 from 3-point range, and .837 from the free throw line, playing an average of 27.0 minutes per game.', 'He shot 0.333 from the field, 0.368 from 3-point range, and 0.8 from the free throw line, playing an average of 23.8 minutes per game.']","In the specified season (2022–23), Victor Oladipo's shooting percentages were as follows: 39.7% from the field, 33.0% from 3-point range, and 74.7% from the free throw line.","He shot 0.599 from the field, 0.441 from 3-point range, and 0.746 from the free throw line.",1.0,0.9466929806147798,0.8802579364969333,0.0,0.21280416008338018,0.8512166403335207
In which season did Ruben Boumtje-Boumtje have the highest average minutes per game while playing for Portland?,"['After his playing career, he joined the Philadelphia 76ers’ staff as a technical scout. In 2019, he was hired as the assistant general manager of the Delaware Blue Coats of the NBA G League. In June 2020, he was let go from the 76ers organization after his contract was not renewed. = Source Regular season Career statistics from NBA.com · Basketball Reference Player Profile at HoopsHype.com Basketpedya.com Player Profile\n\nIn the 2001–02 season, Ruben Boumtje-Boumtje played for Portland in 33 games. He averaged 1.2 points, 1.7 rebounds, 0.1 assists, 0.1 steals, and 0.5 blocks per game. He shot 0.406 from the field, – from 3-point range, and .520 from the free throw line, playing an average of 7.4 minutes per game. In the 2002–03 season, Ruben Boumtje-Boumtje played for Portland in 2 games. He averaged 0.0 points, 0.5 rebounds, 0.5 assists, 0.5 steals, and 0.0 blocks per game. He shot 0.0 from the field, – from 3-point range, and – from the free throw line, playing an average of 2.5 minutes per game. In the 2003–04 season, Ruben Boumtje-Boumtje played for Portland in 9 games. He averaged 0.4 points, 0.1 rebounds, 0.1 assists, 0.0 steals, and 0.1 blocks per game. He shot 0.2 from the field, – from 3-point range, and 1.000 from the free throw line, playing an average of 2.9 minutes per game.', ""He played college basketball at Georgetown University and holds career averages of 9.6 points and 6.8 rebounds per game. He ranks fourth on the Hoyas' all-time blocked shots list with 255, behind Patrick Ewing, Alonzo Mourning and Dikembe Mutombo. = Boumtje-Boumtje was selected in the 2001 NBA draft by the Portland Trail Blazers with the 50th overall pick and participated in 44 games over three seasons from 2001 to 2004. What ended up being his final regular season NBA game took place on December 20, 2003, while the Blazers visited the San Antonio Spurs in a losing effort; Boumtje-Boumtje recorded one foul and one missed field goal in four minutes of playing time. On January 21, 2004, when he was traded along with guard Jeff McInnis to the Cleveland Cavaliers in exchange for small forward Darius Miles. He was waived soon afterwards, having never played a game for them. In July 2005, Boumtje-Boumtje was drafted in the 2005 AAPBL Draft but the league folded before a game was even played. On August 22, 2005, it was announced the Orlando Magic had signed him to a contract of undisclosed terms. He had played five games with them during the 2005 Reebok Vegas Summer League while averaging 4.8 points, shooting 56.3 percent of his field goals (9-of-16), and 3.6 rebounds in 16.8 minutes per game. = Boumtje-Boumtje played the 2006–07 season for Alba Berlin in the ULEB Cup and the German Basketball Bundesliga. After the season, his contract was not renewed, but he joined league rival EWE Baskets Oldenburg in November as a replacement for injured Dan McClintock and later signed for the remainder of the 2007–08 season. Oldenburg renewed his contract for the 2008–09 season. The team became the German league champions in June 2009. In 2010 Boumtje-Boumtje joined the Artland Dragons in Germany. In 2011, he signed with Bayern Munich, but he immediately retired after just 4 games, because of an irregularity with his heart. Boumtje-Boumtje speaks three languages - a native Cameroonian language, French and English. At Georgetown he was a pre-med, as well as a mathematics and biology double major. He was named Big East Scholar-Athlete of the Year in 2001, an honor often reserved for athletes in non-televised sports, and used the occasion to restate his intention to attend medical school if he were not drafted by the NBA. In 2014, Ruben earned a master's degree in Applied Mathematics and Statistics from Georgetown University. He recently interned at Elder Research."", 'Ruben Bertrand Boumtje-Boumtje (born 20 May 1978) is a Cameroonian professional basketball executive and former player who last served as the assistant general manager of the Delaware Blue Coats of the NBA G League. He played college basketball for the Georgetown Hoyas and professionally in the National Basketball Association (NBA) for the Portland Trail Blazers. Boumtje-Boumtje retired in November 2011 at age 33 due to a heart condition. Boumtje-Boumtje attended Archbishop Carroll High School in Washington, D.C. for one year.', 'He shot 0.425 from the field, 0.399 from 3-point range, and 0.839 from the free throw line, playing an average of 25.6 minutes per game. In the 2009–10 season, Rudy Fernandez played for Portland in 62 games. He averaged 8.1 points, 2.6 rebounds, 2.0 assists, 1.0 steals, and 0.2 blocks per game. He shot 0.378 from the field, 0.368 from 3-point range, and 0.867 from the free throw line, playing an average of 23.2 minutes per game. In the 2010–11 season, Rudy Fernandez played for Portland in 78 games. He averaged 8.6 points, 2.2 rebounds, 2.5 assists, 1.1 steals, and 0.2 blocks per game. He shot 0.37 from the field, 0.321 from 3-point range, and 0.863 from the free throw line, playing an average of 23.3 minutes per game. In the 2011–12 season, Rudy Fernandez played for Denver in 31 games. He averaged 8.6 points, 2.1 rebounds, 2.4 assists, 1.0 steals, and 0.1 blocks per game. He shot 0.44 from the field, 0.328 from 3-point range, and 0.698 from the free throw line, playing an average of 22.9 minutes per game. In the 2009 season, Rudy Fernandez played for Portland in 6 games. He averaged 7.5 points, 2.8 rebounds, 1.0 assists, 1.3 steals, and 0.5 blocks per game. He shot 0.429 from the field, 0.421 from 3-point range, and 1.0 from the free throw line, playing an average of 27.0 minutes per game. In the 2010 season, Rudy Fernandez played for Portland in 6 games. He averaged 6.8 points, 1.7 rebounds, 1.3 assists, 0.2 steals, and 0.0 blocks per game. He shot 0.444 from the field, 0.478 from 3-point range, and 0.75 from the free throw line, playing an average of 19.8 minutes per game. In the 2011 season, Rudy Fernandez played for Portland in 6 games. He averaged 2.8 points, 2.0 rebounds, 0.8 assists, 0.3 steals, and 0.2 blocks per game.', 'Due to injury, he played in only 57 games in that season, the second-fewest games for a Rookie of the Year. He was the third Trail Blazer to win the award, the first two being Geoff Petrie and Sidney Wicks. 2007–08 season: First All-Star selection Roy started in the first 48 games of the 2007–08 season, averaging 19.1 points, 5.8 assists and 4.6 rebounds. He also led the Blazers to a 13-game winning streak in the month of December. Roy was selected as a reserve for the 2008 NBA All-Star Game. He scored 18 points in that game, and also had 9 rebounds. He injured his right ankle in the final game before the All-Star Weekend. Although he earned accolades for his play over the weekend, the injury impacted his play in the following weeks. He played in the Rookie Challenge for the second time, this time as a ""sophomore""; teammate LaMarcus Aldridge was also on the sophomore squad. Roy played about 29 minutes in the All-Star game, the most of any Western Conference player. He also tied Chris Paul and Amar\'e Stoudemire for the most points with 18. 2008–09 season: First All-NBA selection In the 2008 preseason, Roy underwent a 20-minute medical procedure in Vancouver, Washington, during which team physician Don Roberts removed a piece of cartilage that was causing irritation in Roy\'s left knee. Roy missed several weeks of action because of the rehabilitation, but was ready on the opening day of the season against the Los Angeles Lakers. On November 6, against the Houston Rockets, Roy hit a game-winning 30-foot jumper in overtime with eight tenths of a second left. On December 18, Roy scored a career-high 52 points against the Phoenix Suns. He made 14 of 27 shots from the field, 19 of 21 from the free-throw line, and 5 of 7 from the three-point line. He also added six assists, five rebounds and a blocked shot, all without a turnover. On January 24, Roy tied a Blazers franchise record with 10 steals against the Washington Wizards. On February 8 with the Blazers trailing by 1 against the Knicks, Roy made a layup at the buzzer to win it 109–108. As of February 16, 2009, Roy has had 24 shots which tied or won the games with 35 seconds or less. Roy was again selected as a reserve in the 2009 NBA All-Star Game, where he scored 14 points in 7-for-8 shooting, grabbed 5 boards, and dished out 5 assists in a game-high 31 minutes of action. On April 13, Roy was named Western Conference Player of the Week for his fourth time. At the time, Clyde Drexler was the only other Portland Trail Blazers to have won the award four times. Roy finished 9th in MVP voting for the 2008–09 season, garnering one 4th-place vote and four 5th-place votes for a total of 7 points. Roy was named to the All-NBA Second Team on May 13, and was the first Blazer to make an All-NBA team since the 1991–92 season. 2009–10 season: Second All-NBA selection On August 5, 2009, it was confirmed that Roy had agreed to a four-year maximum-salary contract with a fifth-year player option, keeping him a Trail Blazer until at least the 2013–14 season. Roy was selected to compete in the 2010 NBA All-Star Game, marking his third selection as an NBA All-Star. However, Roy was sidelined because of a right hamstring injury he sustained on January 13 against the Milwaukee Bucks, and re-aggravated on January 20 against the Philadelphia 76ers. On April 11, 2010, Roy injured his right knee. Magnetic resonance imaging that night confirmed a right knee bone contusion (bone bruise) and on April 12, further examination of the MRI showed a slight meniscus tear. Roy underwent surgery on April 16 and was expected to miss at least the first round of the 2010 NBA playoffs, but returned for Game 4 after eight days of recovery time to lead the Blazers to a win. Roy was named to the All-NBA Third Team on May 6, and this was his second season in a row to be named to an All-NBA Team. Shortly before the next season began, conference rival Kobe Bryant called Roy the hardest player to guard in the Western Conference, claiming he had ""no weaknesses in his game."" Roy was the cover athlete for NBA 10: The Inside. 2010–11 season: Final season in Portland Roy started the first month of the season scoring at his normal rate, but by December it started showing that his knees, which have bothered him since college and were injured in April, were ailing due to lack of cartilage. He missed nine games before the Trail Blazers announced that he would be out indefinitely. On January 17, 2011, Roy underwent arthroscopic surgery on both of his knees. He returned to the lineup on February 25, scoring 18 points off the bench, including a clutch three-pointer to force overtime, and helping the Blazers defeat the Denver Nuggets 107–106. The Blazers then faced the Dallas Mavericks in the first round of the 2011 NBA playoffs. Roy shot 1-for-8 the first 2 games, including a Game 2 where he saw only 8 minutes of playing time and went scoreless. The Blazers lost both games and trailed 2-0 in the series. He expressed his frustration about being the last substitution during the first 2 quarters, and playing for 8 minutes after getting 26 minutes in Game 1. Both the Blazers and Mavericks started Game 4 with a quiet first half, with Dallas leading slightly. The Blazers then missed their first 15 shots after halftime as the Mavs\' lead grew as big as 67–44. Roy then made a three-pointer near the end of the third to cut the lead to 67–49. In the fourth quarter, Roy scored 18 points after going 1-for-3 the previous 3 quarters, including a clutch 4-point play to tie the game and a bank shot from the middle of the paint with 49 seconds left to give his team the lead for good, finishing with 24 points to lead the Blazers to an improbable 84–82 win to tie the series. Just before NBA training camp opened following the resolution of the 2011 NBA lockout, Roy announced that his knees had degenerated so much—he lacked cartilage between the bones of both knees—that he was retiring from basketball. Following his announcement of retirement, the Portland Trail Blazers used their amnesty clause on Roy for salary cap flexibility. = In June 2012, Roy announced that he was planning to make a comeback to the NBA. He said he had recovered enough to play after having the platelet-rich plasma procedure that Kobe Bryant also had to keep his knees healthy. He could not play for Portland under the current NBA Collective Bargaining Agreement because of Portland\'s amnesty of him in 2011. Roy entered the free agent market on July 1, 2012. Roy reportedly had expressed interest in signing with the Dallas Mavericks, Golden State Warriors, Minnesota Timberwolves, Indiana Pacers, or Chicago Bulls. On July 31, 2012, Roy signed with the Minnesota Timberwolves. The deal put Roy with All-Star forward Kevin Love and point guard Ricky Rubio. He decided to wear No.', 'Richard died during a game in 1991 after suffering an aneurysm. Nicolas, at only 2+1⁄2 years old, and his mother were in the crowd to witness Richard\'s death. Batum delivered an impressive performance at the 2007 Nike Hoop Summit scoring 23 points (9/13 FG, 3/5 for 3 pointers) in 28 minutes. He also grabbed four rebounds and recorded four steals. As a youngster, Nicolas Batum was considered one of the most talented young players in Europe, as he was ranked #17 among international players born in 1988, by the scouting website DraftExpress.com at the time he entered the 2008 NBA draft. = Batum was part of the junior French national team that won the 2004 FIBA Europe Under-16 Championship. He was named the MVP of the 2006 FIBA Europe Under-18 Championship, as France won the gold medal at that tournament. While playing for Le Mans, Batum averaged 3.4 points (65.9% FG), 2.5 rebounds, 0.5 assist per game in 13 minutes for the 2006–2007 French league season, and 12.3 points (52.3%), 5.0 rebounds and 3.6 assists per game in 28 minutes for the 2007–2008 season. = Upon being selected with the 25th pick in the 2008 NBA draft by the Houston Rockets, Batum was traded to the Portland Trail Blazers for the rights to Darrell Arthur and Joey Dorsey. After coming off the bench for the first three games of his NBA career, Batum moved into the starting lineup in place of Travis Outlaw in Portland\'s fourth game of the 2008–09 season, a 103–96 loss to the Utah Jazz. On March 13, 2009, Batum recorded a season-high 20 points to go along with a clutch three-pointer with 29.9 seconds left, en route to a 109–100 victory over the New Jersey Nets. Batum missed the first 45 games of the 2009–10 season due to torn cartilage in his right shoulder. He played in his first game of the season on January 25, 2010. Batum scored more than 30 points for the first time with a 31-point performance (including 7 rebounds, 7 assists, and 3 steals) on February 27, 2010, against the Minnesota Timberwolves. = In August 2011, during the 2011 NBA lockout, he signed a one-year contract with SLUC Nancy in French Basketball League which was valid until the NBA lockout ended. = Batum returned to Portland after the lockout ended. On June 25, 2012, the Portland Trail Blazers extended a qualifying offer to Batum, making him a restricted free agent. Less than three weeks later Batum signed a $46 million/4 year offer sheet with the Minnesota Timberwolves. On July 18, 2012, the Trail Blazers elected to match the Timberwolves\' offer, signing Batum to the team through the 2015–16 campaign. On November 16, 2012, Batum tied a career-high of 35 points in a 119–117 overtime win against the Houston Rockets. This was followed exactly one month later by a game in which Batum recorded the 15th ""five-by-five"" in the NBA since the 1985–86 season, and the first since Andrei Kirilenko in January 2006. In this effort Batum scored 11 points while racking up 10 assists, 5 rebounds, 5 blocks and 5 steals in a 95–94 win against the New Orleans Hornets. On January 21, 2013, Batum recorded his first triple-double in a 98–95 loss to the Washington Wizards, scoring 12 points and adding 10 rebounds, and 11 assists, in addition to 3 steals and 2 blocks. Batum had a career year in 2012–13, as he finished with career-highs in nearly every statistic. His biggest improvement was his passing; he averaged 4.9 assists, more than triple his previous career-high (1.5 assists per game during the 2010–11 season). = On June 24, 2015, Batum was traded to the Charlotte Hornets in exchange for Gerald Henderson, Jr. and Noah Vonleh. On August 1, 2015, Batum played for Team Africa at the 2015 NBA Africa exhibition game. He made his debut for the Hornets in the team\'s season opener against the Miami Heat on October 28, recording 9 points and 6 rebounds in a 104–94 loss. On November 15, he scored a season-high 33 points in a 106–94 win over the Portland Trail Blazers. The following day, he was named Eastern Conference Player of the Week for games played Monday, November 9 through Sunday, November 15. It was the first career Player of the Week award for Batum, who led the Hornets to a 3–1 record on the week. On December 9, he recorded his fifth career triple-double with 10 points, 11 rebounds and 11 assists in a 99–81 win over the Miami Heat.', 'Sabonis was selected to the All-Rookie First Team and was runner-up in both Rookie of the Year and Sixth Man of the Year voting. His postseason averages went up to 23.6 points and 10.2 rebounds per game. In the first playoff series of his NBA career, Portland lost to Utah in five games. Sabonis averaged 16.0 points, 10.0 rebounds, and 3.0 assists per game in 1997–98, all career-highs. During Sabonis\'s first stint in Portland, the Blazers always made the playoffs (part of a 21-year streak); between 1998 and 1999, the Oregon franchise changed large parts of its roster in order to compete for the NBA Championship (after six consecutive first round losses) with center Sabonis the only player remaining in the starting five. Kenny Anderson and Isaiah Rider were traded for Damon Stoudamire and Steve Smith. In both those years, the Blazers reached the Western Conference Finals. In 1999, they were swept by the eventual champions, the San Antonio Spurs, while, the next year, the team (starting Sabonis, Smith, Stoudamire, Rasheed Wallace, and recently added Scottie Pippen) lost to the Los Angeles Lakers (at the beginning of the team\'s three-peat), in seven games. The question that frequently surrounds Sabonis\'s NBA career revolves around how good he could have been had he played in the NBA during his prime. Sabonis was already 30 when he joined the Blazers, by which time he had already won multiple gold medals, suffered through numerous injuries, and had lost much of his mobility and athleticism. In Bill Simmons\'s ""Book of Basketball"", Sabonis the international player is idealized, while Sabonis the Blazer is described as ""lumbering up and down the court in what looked to be concrete Nikes"" and ranking ""just behind Artis Gilmore on the Moving Like a Mummy Scale."" In ESPN\'s David Thorpe\'s view, Sabonis would be the best passing big man in NBA history, and possibly a top-four center overall, had he played his entire career there. In Clyde Drexler\'s view, if Sabonis had been able to spend his prime in Portland, next to the plethora of other Trail Blazers\' All-Stars (Drexler, Terry Porter, Buck Williams, Steve Johnson, Kevin Duckworth, and Clifford Robinson), the Trail Blazers would ""have had four, five or six titles.', 'He made his first NBA start on April 10, 2013, against the Los Angeles Lakers. On February 26, 2014, Barton recorded a season-high 20 points and a career-high 11 rebounds in 124–80 win over the Brooklyn Nets. In a televised interview following the game, when asked by a reporter about a spontaneous ""Will Barton"" chant that had broken out late in the contest, the guard replied, ""I like to think I\'m the people\'s champ,"" thereby instantly giving birth to a new nickname and a Trail Blazers meme. He went on to record 17 points and six rebounds on May 12 to help Portland win Game 4 of their semi-final match-up against the San Antonio Spurs. = On February 19, 2015, Barton was traded, along with Víctor Claver, Thomas Robinson and a lottery-protected 2016 first-round pick, to the Denver Nuggets in exchange for Arron Afflalo and Alonzo Gee. On August 7, 2015, Barton re-signed with the Nuggets. On November 13, 2015, he scored a career-high 26 points in a 107–98 win over the Houston Rockets. He topped that mark on December 20 with 32 points against the New Orleans Pelicans. Barton\'s strong pre-Christmas play earned him recognition as a possible contender for the 2015–16 Sixth Man of the Year award. Over the Nuggets\' first 29 games of the season, Barton averaged 15.7 points, 6.1 rebounds, 2.3 assists and 1.1 steals in 29.0 minutes per game off the bench. Barton appeared in just six of the Nuggets\' first 18 games of the 2016–17 season. He played in the first three games before missing the next nine after spraining his left ankle.', 'In his rookie year during the 1989–90 NBA season, he averaged 7.4 points in 12 minutes per game. The following season, veteran guard Danny Ainge was added to the team, and Petrović\'s playing time dropped further to 7 minutes a game. In many statements made prior to arriving in Portland, Petrović had said he saw a lack of playing time as the only possible obstacle to his success in the NBA. He was determined to be a success in basketball\'s highest arena. His lack of playing time during his second season in the league brought Petrović\'s frustration to a climax: ""I have nothing to say to Adelman any more and vice versa. Eighteen months have passed by, too long.', ""On December 17, he had 36 points, 10 assists, and eight rebounds against the Cleveland Cavaliers. The following day, he had a second straight 36-point effort against the Minnesota Timberwolves. On January 7, in a 123–119 loss to the Sacramento Kings, Lillard scored a career-high 41 points, including 26 in the fourth quarter to break Portland's franchise record for most points in any quarter. On February 7, he had a 38-point effort against the Indiana Pacers. During All-Star weekend, Lillard became the first player in NBA history to take part in five events during the All-Star festivities: the Rising Stars Challenge, Skills Challenge, Three-Point Contest, Slam Dunk Contest, and the All-Star Game. Lillard started all 82 games for the second straight year and averaged 20.7 points, 5.6 assists and 3.5 rebounds per game. Portland finished fifth in the Western Conference with a 54–28 record and faced the Houston Rockets in the first round of the 2014 NBA playoffs. In Game 1 of the series, Lillard recorded 31 points and nine rebounds in his first playoff appearance to help propel Portland to a 122–120 overtime win over Houston. In Game 6 of the series, Lillard became the first player to make a buzzer-beating shot to win a playoff series since Utah's John Stockton against Houston in 1997. Lillard's 3-pointer as time expired gave Portland a 99–98 victory over Houston, as he finished with 25 points to lift the Trail Blazers to their first playoff series win since 2000. The Trail Blazers went on to lose in five games to the eventual NBA champion San Antonio Spurs in the second round. Lillard had a series-best game in Game 4 with a 25-point effort, helping the Trail Blazers win their sole game of the series. At the season's end, Lillard was named to the All-NBA Third Team. 2014–15 season: First division title For the third straight season, Lillard started all 82 games for the Trail Blazers. He averaged career highs in points, rebounds, steals, and field goal percentage, but averaged a career-low 34 percent from three-point range.""]",I don't know.,Ruben Boumtje-Boumtje had the highest average of 7.4 minutes per game in the 2001-02 season while playing for Portland.,,0.0,0.9999999999666667,1.0,0.43299374899085485,0.7319749959634195
What book by Todd Spehr provides insight into the remarkable life and legacy of Drazen Petrovic?,"['Hawkesworth, Celia (2007). Zagreb: a cultural and literary history. {{cite book}}: |work= ignored (help) Spehr, Todd (2016). The Mozart of Basketball: The Remarkable Life and Legacy of Drazen Petrovic. Sports.', 'Each and every day in practice he would be the first guy to come and the last guy to leave the gym. So anybody with that kind of dedication...you have to have a lot of respect for him."" ""Dražen Petrović was an extraordinary young man, and a true pioneer in the global sports of basketball. I know that a lasting part of his athletic legacy will be that he paved the way for other international players to compete successfully in the NBA. His contributions to the sport of basketball were enormous. We are all proud of the fact we knew him."" ""It was a thrill to play against Dražen. Every time we competed, he competed with an aggressive attitude. He wasn\'t nervous; he came at me as hard as I came at him. So we\'ve had some great battles in the past and unfortunately, they were short battles."" = = A museum named ""The Dražen Petrović Memorial Center"" was founded in his honor, and constitutes a co-operative effort led by the Dražen Petrović Foundation in conjunction with the Croatian government, the city of Zagreb and the Croatian Museum of Sports. The memorial center idea originated from Petrović\'s parents, Biserka and Jole Petrovic, and was supported with the contributions of Croatian architects Andrija Rusan and Niksa Bilic. All of the articles presented in the center have been collected and categorized by the Croatian Museum of Sports. The organization and operations of the center have been provided by the Dražen Petrović Foundation, which is led by Petrović\'s family. The Center contains his No. 3 New Jersey Nets jersey and the watch that stopped when he died in a car crash. The center features 1,000 memorabilia items and a video of his basketball highlights.', 'Huber, Jim (12 January 2006). ""Drazen Petrovic"". Inside the NBA.', 'However, he did not receive an invitation to the 1993 All-Star game. = Regular season = = = Petrović\'s national team debut came at the age of 15, at the Under-18 Balkan Championship in Turkey, where the Yugoslavia junior team won the bronze. The young man regularly played for the Yugoslavia national team in the Balkan Championships, also winning gold with the junior team and silver with the senior team. He also brought back the silver from the 1982 FIBA Europe Under-18 Championship in Bulgaria. The 1984 Summer Olympics were Petrović\'s first competition of a grand scale with the Yugoslavia senior national team, and the bronze medal won in Los Angeles that summer became his first Olympic medal. Third place was also earned at the 1986 FIBA World Championship, remembered for the last minute thriller in the semi-final game against the Soviet Union. Petrović was named the MVP of the tournament. At the 1987 EuroBasket, Petrović again returned with bronze, as Yugoslavia lost to the hosts and gold medalists Greece. The University Games, held in Zagreb in 1987, saw the Yugoslavian squad with Petrović win the gold. In the 1988 Summer Olympics, Yugoslavia with Petrović, earned 2nd place, as they lost once more to the Soviet powerhouse. An excellent club season with Real Madrid was topped by Petrović\'s 1989 accomplishment with the Yugoslavia national team: at the EuroBasket in Zagreb, the young Yugoslavian team went all the way, defeating Greece more than comfortably in the championship game. Petrović was the tournament\'s second leading scorer and Most Valuable Player. The very next year, the summer in between the two most frustrating seasons of his professional career, as he struggled for playing time with the Trail Blazers, Petrović was again making history with the national team, as Yugoslavia became world champions, after beating the Soviet Union for the gold in Buenos Aires, at the 1990 FIBA World Championship. Overall, Petrović represented Yugoslavia\'s senior national team in 155 games, in which he scored a total of 3,258 points, for a career scoring average of 21.0 points per game. = The 1992 Olympic Games in Barcelona, marked the first summer Olympics featuring the independent Croatia, and Petrović was the leader of the Croatian national basketball team at the Olympic basketball tournament. Losing only to the American Dream Team in the group stage, a strong and inspired Croatian team emerged victorious from the Semifinals against the revamped post-Soviet team, thanks to clutch free throws executed by Petrović, and faced off against the Americans for the gold. Urged on by Petrović\'s competitiveness and confidence, the Croatians fared well in the first ten minutes of the game, taking a 25–23 lead on a Franjo Arapović dunk and the subsequent made free throw. As the game progressed, however, the now-legendary team composed of NBA stars proved too tough for Croatia: the Americans won 117–85, sending Petrović, the game\'s leading scorer with 24 points, and his teammates, home with silver medals. In the period during which Petrović played for the senior Croatian national team (1992–1993), he appeared in 40 games and scored a total of 1,002 points, for a career scoring average of 25.1 points per game. His highest single-game point tally came against Estonia, on 31 May 1993 (48 points). Counting the senior national team games that he played in with both Yugoslavia\'s and Croatia\'s national teams, Petrović scored a total of 4,260 points in 195 games played, for a career scoring average of 21.8 points per game. In the summer of 1993, after his best NBA season and the Nets\' first-round elimination by the Cleveland Cavaliers, Petrović traveled to Wrocław, where the Croatian national team was playing a qualification tournament for the 1993 EuroBasket. He was contemplating departure from the Nets, disappointed with the fact that the Nets had not yet extended his contract. He told American reporters that the lack of recognition in the league made him also consider leaving the NBA completely and playing club basketball in Greece. There were at least two Greek clubs ready to offer Petrović three-year contracts worth US$7.5 million net. Petrović decided to skip the connection flight back to Zagreb from Frankfurt and instead drive to Zagreb with a woman he was romantically involved with at the time. He had met her only a few weeks prior after a game at the Meadowlands Arena. Petrović died in a traffic accident at about 5:20 p.m. on 7 June 1993. On the rain-drenched Autobahn 9, he was a passenger in a car that was cut off by a semi-truck at Denkendorf near Ingolstadt in the German state of Bavaria. According to the report of the Ingolstadt police, that afternoon a truck broke through the Autobahn median; the driver was trying to avoid a collision with a personal vehicle in his own lane and lost control of the truck, crashing through the median barrier and finally coming to a stop and blocking all three lanes of traffic going in the opposite direction. Seconds later, the Volkswagen Golf carrying a sleeping Petrović in the passenger seat crashed into the truck, and Petrović was ejected from the vehicle. According to the autopsy report, Petrović died of severe head injuries on impact. The driver, Klara Szalantzy, a Hungarian model and basketball player with whom Petrović was romantically involved, and Hilal Edebal, a female Turkish basketball player, sustained serious injuries. It was established that visibility on the road was very poor and neither Petrović nor Edebal wore their seatbelts. According to Edebal, who incurred severe memory loss as a result of the accident and would never play basketball again, Szalantzy was driving 180 kilometres per hour (110 mph), which was legal on the Autobahn. Szalantzy would return to modeling and basketball not long after. Petrović was buried on June 12, 1993, with a Catholic funeral Mass celebrated by Auxiliary Bishop Marko Culej of Zagreb. Petrović\'s tomb at Mirogoj Cemetery instantly became a sanctuary for his compatriots. The Cibona stadium was renamed the Dražen Petrović Basketball Hall on 4 October 1993, and the city of Zagreb dedicated a square in his name, which was later followed by Šibenik and Vukovar, while Petrinja dedicated a street to him. Before Game 1 of the 1993 NBA Finals, the NBA held a moment of silence for Petrović, whose death occurred two days before the event began. The Nets retired his number 3 jersey on 11 November 1993. On June 4, 1994, Diego Maradona, the Argentine football star who also had Croatian roots, paid tribute to Dražen Petrović by placing his Argentina jersey on the basketball star\'s grave in Zagreb. After 1994, the MVP award at the McDonald\'s Championship bore the name Dražen Petrović Trophy, and the Croatian Olympic Committee\'s award for young athletes was named for him in 2006. On 29 April 1995, a statue commemorating Petrović\'s significance to the world of sports was erected in front of the Olympic Museum in Lausanne, Switzerland, thus making him only the second athlete to receive this honor. On 9 July 2001, having defeated Patrick Rafter to win the men\'s singles title at Wimbledon, Croatian tennis player Goran Ivanišević dedicated the win to Petrović; Ivanišević wore Petrović\'s Nets jersey amidst the 100,000 strong crowd celebrating his victory in Split. Petrović was inducted posthumously into the Basketball Hall of Fame in 2002. In 2006, the 13th anniversary of Petrović\'s death was marked with the opening of the Dražen Petrović Memorial Center in Zagreb, dedicated to his life and achievements, with ten themed galleries of multimedia content outlining his entire career and a four-meter-high (13 ft) statue of Dražen in shooting position in front of it. Petrović was enshrined in the FIBA Hall of Fame in 2007. The 2010 documentary, Once Brothers (part of the ESPN 30 for 30 series), portrays the achievements of the Yugoslavia national basketball team in the late 1980s and early 1990s, and how the Yugoslav Wars tore the team apart. It explores Petrović\'s broken friendship with Serbian/Yugoslav player Vlade Divac. In 2011, a statue of him as a little boy sitting on a bench with a ball was unveiled in Šibenik, and his old room was renovated the way it looked when he was young, as a first part of opening a Memorial Center in his hometown. During the 2012 Three Point Shootout, New Jersey Nets guard Anthony Morrow wore Petrović\'s jersey in the latter\'s honor. In 2015, Australian writer Todd Spehr released a 470-page biography on Petrović, titled Dražen: The Remarkable Life & Legacy of the Mozart of Basketball. At the urging of the Petrovic family, Spehr\'s book was released in the Croatian language in 2016 at the Petrovic Museum, and is considered the definitive work on his life. On 3 June 2015, Croatian basketball journalists Marjan Crnogaj and Vlado Radicevic released a 487-page biography, the global paperback edition of which was released on 14 October 2017. = ""It\'s hard for you to imagine here in America, because you have so many great players, but we are a country of four million; without him, basketball takes three steps back."" ""You know, there is a saying that we have about JFK, John F. Kennedy – \'You know, Johnny, we never got to know you.\' And I kind of feel that way about Dražen. I felt that the whole year that I was with him went by too fast and I really never got to know him the way I would have liked to."" ""Dražen and I were very good friends. I was one of those people who welcomed him to Portland when he came from Europe.', 'Dražen Petrović (Croatian pronunciation: [drǎʒen pětroʋitɕ]; 22 October 1964 – 7 June 1993) was a Yugoslav and Croatian professional basketball player. A shooting guard, he initially achieved success playing professional basketball in Europe in the 1980s with Cibona and Real Madrid before joining the National Basketball Association (NBA) in 1989. A star on multiple international basketball stages, Petrović earned two silver medals (1988, 1992) and one bronze (1984) at the Summer Olympic Games, a gold (1990) and a bronze (1986) at the FIBA World Cup, and a gold (1989) and a bronze (1987) at the FIBA EuroBasket. He was the FIBA World Championship MVP in 1986 and the FIBA EuroBasket MVP in 1989. With Cibona Zagreb, Petrović also won two consecutive EuroLeague championships in 1985 and 1986. He first represented Yugoslavia\'s senior national team and later Croatia\'s senior national team. He earned four Euroscars and was named Mr. Europa twice. In 1985, he received the Golden Badge award for the best athlete of Yugoslavia. Seeking a bigger arena after his career started in Europe, Petrović joined the NBA in 1989, as a member of the Portland Trail Blazers. After playing mostly off the bench that year, Petrović experienced a breakthrough following a trade to the New Jersey Nets. While starting for the Nets, he became one of the league\'s best shooting guards. He was named one of FIBA\'s 50 Greatest Players in 1991. On 7 June 1993, Petrović\'s career and life were cut short after he died in a car accident in Germany at the age of 28. In 1993, Petrović\'s jersey number 3 was retired by the Nets, and the Dražen Petrović Basketball Hall was named in his honor. He also received the Olympic Order in 1993. In 2002, he was posthumously enshrined into the Naismith Memorial Basketball Hall of Fame. In 2006, the Dražen Petrović Award was created in his honor. In 2007, he was posthumously inducted into the FIBA Hall of Fame. He was named one of the 50 Greatest EuroLeague Contributors in 2008. In 2013, he was voted the best European Basketball player in history, by players at the 2013 FIBA EuroBasket. Petrović is considered a crucial part of the vanguard to the present-day mass influx of European players into the NBA, and to this day he is viewed as a national hero in Croatia. Born in Šibenik, Yugoslavia (present-day Croatia), Dražen Petrović was the second child of Jovan ""Jole"" Petrović, a police officer, and Biserka (née Mikulandra), a librarian. His father was born in a Serb family in Zagora, near Trebinje in Bosnia and Herzegovina. His mother was born in Bilice, near Šibenik, and was from a traditional conservative Croat family, devoutly Catholic. The couple\'s eldest child, Aleksandar, was the first to play basketball and rose to become one of the top point guards in the former Yugoslavia. The Petrović brothers are second cousins to the Serbian basketball player Dejan Bodiroga. = At the age of 13, Petrović started playing in the youth selections of the local club Šibenka; at the age of 15, he had already made the club\'s first team, just as Šibenka had earned a place in the Yugoslav national first division. With young Petrović as the star of the team, Šibenka reached the final of the third level Pan-European club competition, the FIBA Korać Cup twice (1981–82 and 1982–83), where they lost to the French League club Limoges CSP both times. In 1983, the 18-year-old Petrović hit two free throws in Šibenka\'s victory over Bosna Sarajevo in the final playoff game of the Yugoslavian League\'s 1982–83 season\'s club championship. However, on the day after the club won the championship, the Basketball Federation of Yugoslavia stripped the title from Šibenka, because of irregularities in refereeing. The league\'s championship was then awarded to Bosna, after Šibenka refused to play in a rematch. Petrović increased his scoring numbers in each successive season that he played with Šibenka. In the 1979–80 Yugoslav FFL season, he scored 13 points in 16 games, for an average of 0.8 points per game. In the 1980–81 Yugoslav FFL season, he scored 39 points in 20 games, for an average of 2.0 points per game. In the 1981–82 Yugoslav FFL season, he scored 392 points in 24 games, for an average of 16.3 points per game. In the 1982–83 Yugoslav FFL season, he scored 758 points in 31 games, for an average of 24.5 points per game. In total, he scored 1,202 points in 91 games played with Šibenka in the Yugoslav first division, for a scoring average of 13.2 points per game. = 1984–85 season After a year\'s mandatory service in the Yugoslav military, Petrović joined his older brother Aco and moved to Cibona Zagreb, to form what was at that time, the best back court duo in Europe. In his first season in Cibona, Petrović won both the national Yugoslav League championship and the Yugoslav National Cup title. In national domestic league play, in the 1984–85 Yugoslav FFL season, Petrović averaged 32.5 points per game. On 6 December 1984, in the 1984–85 season of Europe\'s top-level club competition, the FIBA European Champions Cup (EuroLeague), Petrović scored 44 points in a game against the Spanish League club Real Madrid. He scored 29 of the 44 points in the second half of the game. Petrović also scored 36 points in the league\'s 1985 Final against Real Madrid. Cibona won the game, by a score of 87–78, and the win brought the club their first top-tier level European Champions Cup title. That season, Petrović scored a total of 463 points in 15 games played, for a scoring average of 30.9 points per game. 1985–86 season On 5 October 1985, in a Yugoslav First Federal League game against Union Olimpija Ljubljana, Petrović scored 112 points, in Cibona\'s 158–77 blowout win. He scored 67 of the 112 points in the first half of the game. During the game, Petrović shot 40/60 from the field, 10/20 from 3-point range, and 22/22 from the free-throw line. The 112 points scored was the most points ever scored in a single game in the history of the Yugoslav First Federal League. It broke the league\'s previous single-game scoring record of 74 points, which was set in 1962, by Radivoj Korać. Korać achieved that record while playing with OKK Beograd, in a game against Mladost Zagreb. Olimpija Ljubljana had failed to fulfill their player registration administrative obligations in time for the game. Olimpija general manager Radovan Lorbek was reportedly late with submitting a registration letter to the Basketball Federation of Yugoslavia (KSJ) headquarters in Belgrade. That rendered their entire men\'s first team roster ineligible for the Yugoslav First Federal League\'s regular season opening game, and forced them to instead field players for the game from their youth systems. Olimpija didn\'t have an under-18 youth squad that season so the club went to Zagreb to play the game with younger players. in the under-16 and under-17 age groups, which included: Igor Đurović, Matjaž Strmole, Jože Maček, Dag Kralj, Tine Erjavec, Jure Zorčič, Gregor Stražiščar, Andrej Novina, and Tine Merzelj. Cibona, for their part, decided to use a mixed roster for the game, consisting of players from their youth system, plus their senior men\'s team\'s twenty-one-year-old Dražen Petrović, who broke Korać\'s single-game Yugoslav League scoring record of 74 points. Petrović scored 112 points in the game; before the game, he had reportedly announced his intention to leave the game once he had surpassed Korać\'s 74 points record. Petrović was one of only five Cibona players to score that day. From November 1985, Petrović began partnering in the backcourt with another high-scoring player, newly arrived shooting guard Danko Cvjetićanin, brought in as replacement for Aco Petrović who was away serving his mandatory Yugoslav People\'s Army (JNA) stint. Overall, over the 1985–86 Yugoslav League regular season and playoffs, Petrović scored a total of 1,241 points in 30 games played, for a scoring average of 41.4 points per game. That season, Petrović also won another Yugoslav National Cup title with Cibona. On 7 February 1986, Petrović scored 55 points in a Yugoslav Cup game against Union Olimpija Ljubljana. He also scored 46 points in the 1986 Yugoslav Cup\'s Final against Cibona\'s old rivals Bosna Sarajevo. On 4 December 1985, in a 1985–86 season FIBA European Champions Cup (EuroLeague) game against the Israeli Super League club Maccabi Tel Aviv, Petrović scored 44 points. In the same European Champions Cup season, on 11 December 1985, he had 47 points and 25 assists in a game against the then reigning Italian League champions Simac Milano. In another European Champions Cup game that season, on 16 January 1986, Petrović scored 49 points, and had 20 assists against the Spanish League club Real Madrid. On 22 January 1986, in a European Champions Cup game against the French League club Limoges, Petrović made ten 3-pointers, including seven in a row during a first-half stretch, for a final tally of 51 points and 10 assists in the game. The 51 points scored was also his personal career-high scored in a single EuroLeague game. Petrović won his second straight FIBA European Champions Cup (EuroLeague) title with Cibona, as he scored 22 points in the league\'s 1986 Final, in which Cibona defeated the USSR Premier League club Žalgiris Kaunas, which starred Arvydas Sabonis. In the 1985–86 European Champions Cup (EuroLeague) season, Petrović scored a total of 555 points in 15 games played, for a scoring average of 37.0 points per game. The season ended with Cibona losing the Yugoslav league playoff final series to KK Zadar. Following an opening game win, Petrović controversially sat out game 2 away in Zadar, ostensibly due to a pre-game warm-up injury, leading to accusations of tanking out of desire to win the title on home court in front of their own fans. Cibona lost game 2 thus setting up the deciding game 3 at home in Zagreb at the sold out Dom sportova. However, in one of the biggest upsets in Yugoslav League history, despite having a double-digit lead in the second half, Cibona ended up losing game 3 in double overtime with Petrović fouling out during first overtime with 39 points scored. 1986–87 season In the 1986–87 Yugoslav FFL season, Petrović scored a total of 932 points in 25 games played, for a scoring average of 37.3 points per game. In that same season, Cibona competed in the European-wide secondary level FIBA European Cup Winners\' Cup competition. Petrović led Cibona to the championship, as he scored 28 points against the Italian League club Scavolini Pesaro, in the league\'s 1986–87 season Final. It was the third straight European-wide club championship for Petrović and Cibona. In the 1986–87 FIBA European Cup Winners Cup season, Petrović scored a total of 270 points in 8 games played, for a scoring average of 33.8 points per game. 1987–88 season With Cibona, Petrović again won the Yugoslav National Cup title in 1988. In the 1987–88 Yugoslav FFL season, Petrović scored a total of 860 points in 24 games played, for a scoring average of 35.8 points per game. In that same season, Cibona competed in Europe\'s third-level club competition, the FIBA Korać Cup. On 14 October 1987, Petrović scored 62 points in a 1987–88 FIBA Korać Cup season game against the Finnish League club KTP Kotka. Petrović led Cibona to the Finals of the Korać Cup, where they lost to the Spanish League club Real Madrid. During the Korać Cup season, Petrović scored a total of 401 points in 12 games played, for a scoring average of 33.4 points per game. During his four seasons with Cibona, Petrović scored a total of 3,911 points, in 106 games played in the national Yugoslav First Federal League, for a scoring average of 36.9 points per game. With Cibona, he also scored a total of 559 points, in 20 games played, for a scoring average of 28.0 points per game, in the Yugoslav Cup competition. In the three Pan-European club competitions that he played in with Cibona, he scored a total of 1,689 points in 50 games played, for a scoring average of 33.8 points per game. With both Šibenka and Cibona, Petrović\'s career scoring numbers in the Yugoslav First Federal League were 5,113 points scored, in 197 games played, for a career scoring average of 26.0 points per game. In the FIBA European Champions Cup (EuroLeague), Petrović scored a career total of 1,018 points in 30 games played, for a career scoring average of 33.9 points per game. = After his string of very successful seasons with Cibona Zagreb, Petrović needed new challenges that Cibona and the Yugoslav First Federal League could no longer offer him. The NBA\'s Portland Trail Blazers had already used their third-round draft pick on the young Petrović, in the 1986 NBA draft, but he had decided to postpone his departure to the United States. In 1988, rather than go to the NBA, he instead signed with the Spanish League club Real Madrid, for around US$4 million in net income. At that time, Yugoslav sporting laws stipulated that players could not professionally move abroad until they had reached the age of 28. Petrović was still only 23 when he signed with Real Madrid. In 2014, José Antonio Arízaga, the sports agent who played a key role in Petrović\'s 1988 summer transfer from Cibona to Real, recalled a few details from the transaction: ""I spoke to Mirko Novosel, Dražen\'s head coach at Cibona, and he told me two things. One, every problem in Yugoslavia can be taken care of with the right amount of money, and two, if Dražen leaves, every other player under 28 will be leaving and it\'ll be chaos. So, you can imagine all the individuals I had to bribe and all the places where I had to pay up, in order to circumvent this law"". 1988–89 season Petrović helped Real to win the title of the 1989 edition of the Spanish King\'s Cup, over their Catalan rivals, Barcelona. In the Spanish ACB League\'s Finals, Real Madrid narrowly lost to Barcelona, in the fifth and decisive game of the series. In the Spanish League\'s 1988–89 ACB season, Petrović was the league\'s regular season top scorer. Including the playoffs, he scored a total of 1,327 points, in 47 games played, for a scoring average of 28.2 points per game. Petrović\'s first season in Spain\'s ACB was also his last, but he still holds the ACB\'s single-game Finals records for the most points scored, with 42, and for the most three-pointers made, with 8. In European-wide club competition, Real Madrid competed in the European secondary level FIBA European Cup Winners\' Cup. On 14 March 1989, in the 1988–89 Cup Winners\' Cup Final against the Italian League club Snaidero Caserta, Petrović tied his previous best scoring performance in a European-wide club competition with 62 points. Petrović was pressured to join the NBA, by the Trail Blazers, who had drafted him 60th overall in 1986. Being motivated by the potential new challenges that the NBA presented, Petrović finally decided to try to establish himself in the league. He left Spain rather abruptly, at the end of the season; the Blazers assisted him in the process, by buying out his contract with Real Madrid, for as much as US$1.5 million. Petrović finally joined the Blazers for the 1989–90 season. = The Blazers valued Petrović as a shooter, but were concerned that he might not possess the quickness to play guard or the foot speed to play defense. They brought him onto the team primarily as an outside threat to shoot three-pointers. In the Blazers\' offensive scheme he was to set up behind the line, receive a passed ball and go directly up to release his shot. Petrović was an aggressive, attacking player who was used to creating his shot and shots for his teammates. Taking the ball out of his hands and making him a static shooter was foreign to him. Making matters worse, the Blazers already had a full rotation of guards, with a starting backcourt of Clyde Drexler and Terry Porter, and with veteran Danny Young as a reserve. Consequently, the reigning La Gazzetta dello Sport Euroscar European Player of the Year saw limited playing time. He had difficulty being productive in the limited role the Blazers had for him.', 'The official opening of the museum was held on 7 June 2006, while the official opening of the center to the public began at the end of December 2006. The square on which the center is operated upon has been renamed to Dražen Petrović Square in his honor. In 2013, former NBA MVP Derrick Rose visited the museum. List of National Basketball Association career 3-point field goal percentage leaders List of basketball players who died during their careers List of basketball players who have scored 100 points in a single game Yugoslav First Federal Basketball League career stats leaders Freeman, Mike (9 June 1993). ""Details Emerge, but Petrovic\'s Death Still Baffles"".', 'Vranković was a close friend of the fellow Croatian basketball player Dražen Petrović. He was a coffin bearer at Petrović\'s funeral in 1993, and has been active in commemorating his memory. In an article at the FIBA website concerning the opening of a museum in Dražen\'s honour, Vranković was quoted as saying: ""I would like to thank all those involved in creating this place, so children would be able to learn more about basketball\'s Amadeus"". Vranković and his wife Lovorka have two daughters, Andrea and Matea, and one son, Antonio, who plays for Croatian club Split. Euroleague.net Profile Fibaeurope.com Profile NBA stats at basketball-reference\n\n', 'ISBN 978-1613219171. Career statistics from NBA.com · Basketball Reference Drazen Petrovic Museum Drazen Petrovic Yugoslavia FIBA Profile Drazen Petrovic Croatia FIBA Profile FIBA Europe Profile Drazen Petrovic at the Basketball Hall of Fame Euroleague.net 50 greatest contributors In Honor of Dražen Petrović FIBA Hall of Fame profile Drazen Petrovic at Olympics.comDrazen Petrovic at OlympicChannel.com (archived)Drazen Petrovic at Olympic.org (archived) Dražen Petrović at Olympedia Dražen Petrović at Olympics at Sports-Reference.com (archived)\n\nIn the 1989–90 season, Drazen Petrovic played for Portland in 77 games. He averaged 7.6 points, 1.4 rebounds, 1.5 assists, 0.3 steals, and 0.0 blocks per game. He shot 0.485 from the field, 0.459 from 3-point range, and 0.844 from the free throw line, playing an average of 12.6 minutes per game. In the 1990–91 season, Drazen Petrovic played for Portland in 18 games. He averaged 4.4 points, 1.0 rebounds, 1.1 assists, 0.3 steals, and 0.0 blocks per game. He shot 0.451 from the field, 0.167 from 3-point range, and 0.682 from the free throw line, playing an average of 7.4 minutes per game. In the 1990–91 season, Drazen Petrovic played for New Jersey in 43 games. He averaged 12.6 points, 2.1 rebounds, 1.5 assists, 0.9 steals, and 0.0 blocks per game. He shot 0.5 from the field, 0.373 from 3-point range, and 0.861 from the free throw line, playing an average of 20.5 minutes per game. In the 1991–92 season, Drazen Petrovic played for New Jersey in 82 games. He averaged 20.6 points, 3.1 rebounds, 3.1 assists, 1.3 steals, and 0.1 blocks per game. He shot 0.508 from the field, 0.444 from 3-point range, and 0.808 from the free throw line, playing an average of 36.9 minutes per game. In the 1992–93 season, Drazen Petrovic played for New Jersey in 70 games. He averaged 22.3 points, 2.7 rebounds, 3.5 assists, 1.3 steals, and 0.2 blocks per game. He shot 0.518 from the field, 0.449 from 3-point range, and 0.87 from the free throw line, playing an average of 38.0 minutes per game. In the 1990 season, Drazen Petrovic played for Portland in 20 games. He averaged 6.1 points, 1.6 rebounds, 1.0 assists, 0.3 steals, and 0.0 blocks per game. He shot 0.44 from the field, 0.313 from 3-point range, and 0.583 from the free throw line, playing an average of 12.7 minutes per game. In the 1992 season, Drazen Petrovic played for New Jersey in 4 games. He averaged 24.3 points, 2.5 rebounds, 3.3 assists, 1.0 steals, and 0.3 blocks per game. He shot 0.539 from the field, 0.333 from 3-point range, and 0.846 from the free throw line, playing an average of 40.8 minutes per game. In the 1993 season, Drazen Petrovic played for New Jersey in 5 games. He averaged 15.6 points, 1.8 rebounds, 1.8 assists, 0.4 steals, and 0.0 blocks per game. He shot 0.455 from the field, 0.333 from 3-point range, and 0.8 from the free throw line, playing an average of 38.6 minutes per game. In the 1984–85† season, Drazen Petrovic played for Cibona Zagreb in 15 games. He averaged 30.9 points, — rebounds, — assists, — steals, and — blocks per game. He shot — from the field, — from 3-point range, and — from the free throw line, playing an average of — minutes per game. In the 1985–86† season, Drazen Petrovic played for Cibona Zagreb in 15 games. He averaged 37.0 points, — rebounds, — assists, — steals, and — blocks per game.', 'He was inducted into the Greek Basket League Hall of Fame in 2022. Paspalj\'s forester father Jovan\'s lumber trade job took him from his home village on the slopes of Kozara in Bosanska Krajina to Pljevlja, finding employment at the Velimir Jakić Lumber Processing Plant (ŠIK Velimir Jakić). Once there he married a local woman, Mileva, and remained. Their first child, son Darko, was born in 1961, five years before Žarko was born in 1966. During the mid-1970s, when young Žarko was ten years old, his father\'s job requirements moved the family to Titograd. Žarko took up basketball and soon established himself in the youth system of KK Budućnost. He considers himself an ethnic Serb from Montenegro, which he believes is ""only natural"". = Paspalj began his career in 1982. At 16 he moved up to Budućnost\'s first team where he was part of a talented generation alongside Zdravko Radulović and Luka Pavićević. At the time, Budućnost was a small, unambitious side that had played its first ever top-tier season two years earlier in 1980–81, essentially serving as talent feeder for bigger Yugoslav League clubs like Partizan, Cibona, Jugoplastika, Crvena zvezda, and Bosna. Not too long after that, Paspalj entered the senior squad. Playing under young head coach Milutin Petrović and alongside seasoned Yugoslav League players such as Nikola Antić and the Ivanović brothers (Duško and Dragan), the talented youngster contributed greatly to Budućnost\'s third place league finish in the 1985–86 season and a playoff semi-final where they lost to eventual champions Zadar. = During the summer of 1986 Budućnost sold 20-year-old Paspalj to Partizan. Eighteen-year-old Vlade Divac, another rising star, also joined the club that summer from Sloga. Together with young Sasha Djordjevic, Željko Obradović and more established players like Milenko Savović and Goran Grbović, they won the national title in a final against Crvena zvezda. Paspalj played well enough to earn a spot on the national team of Yugoslavia that won bronze at the EuroBasket 1987 in Athens, Greece. The following year, in 1988, he played a leading role in the side that made it to the Olympic final against the Soviet Union, and marked himself out as a potential star with some fine performances for Yugoslavia at the 1988 McDonald\'s Open. Also in 1988, Paspalj top-scored for Yugoslavia at the prestigious Acropolis Tournament in Athens, which included 26 points in one half in a tough-fought 104–103 victory against US college side Duke. = In the summer of 1989, Paspalj became one of the first Europeans to move to the NBA, joining the San Antonio Spurs despite going undrafted one year earlier. He came into the league alongside two Soviets (Šarūnas Marčiulionis and Alexander Volkov) and two more fellow Yugoslavs (Dražen Petrović and Vlade Divac) as they were collectively dubbed the ""green card five"" by Sports Illustrated. At the time they were the only five players in the entire NBA who didn\'t come up through the American collegiate system.', 'Beginning in 2007, Danilović served as the president of Partizan, the club with which he spent six years as a player during the 1980s and early 1990s. In 2015, he resigned from the position. On December 15, 2016, Danilović became the president of the Basketball Federation of Serbia (KSS). Born in Sarajevo to a family of Herzegovinian Serbs (father Milan from the Orašje Zubci village near Trebinje and mother Vuka from the Kukričje village near Bileća), Danilović grew up in the Alipašino polje neighbourhood near the RTV Sarajevo main building. Many of his childhood summers and winters were spent in the villages of his father and mother, and in the town of Trebinje where he had aunts and uncles. A tall and lanky kid, Danilović excelled at a variety of sports, including football, speed skating, and street basketball. Already showing promise at streetball, in 1984, the fourteen-year-old began playing organized basketball in KK Bosna\'s youth setup under youth coach Mladen ""Makso"" Ostojić. The player\'s talent was immediately evident and it didn\'t take long before he started receiving attention from bigger Yugoslav clubs such as KK Partizan whose assistant coach Duško Vujošević was alerted to the youngster\'s talents by the team\'s point guard Željko Obradović who had spotted Danilović during summer 1985 at a Yugoslav intra-republic youth basketball tournament on Mount Zlatibor. Young Danilović played for a select team of players representing SR Bosnia-Herzegovina at the tournament. By late 1985, Vujošević started courting the fifteen-year-old. Getting Danilović and his parents to agree to a move to Belgrade proved to be the easy part; the real challenge was getting his club KK Bosna to sign off on the transfer. Danilović wasn\'t under a professional contract with the Sarajevo club, however, according to Yugoslav Basketball Federation (KSJ) rules, being a youth system prospect, he needed his club\'s permission to complete the move. In Danilović\'s own words: ""Bosna club management weren\'t too keen on me at all while I was there; they had even been planning to loan me out to other Sarajevo-area clubs, which I didn\'t want at all. But then Vujošević started sniffing around, and they suddenly wanted to keep me. Also, Bosna club president Mirza Delibašić and Partizan vice-president Dragan Kićanović were close friends going back to their playing days, so that created additional awkwardness and the whole thing dragged out for a while"". Since Bosna didn\'t want to let him go, by the summer of \'86 Danilović and Partizan decided to act unilaterally to move the player to Belgrade, knowing full well he\'d have to sit out a year before taking part in official competitions. The move marked the beginning of a long friendship and professional association between Danilović and Vujošević, with the twenty-eight-year-old coach initially acting as a mentor to the sixteen-year-old player. By December 1986 Vujošević had moved up in the Partizan club hierarchy, becoming head coach in place of the fired Vladislav Lučić while young Danilović trained by himself and with the first team. Due to the unfortunate administrative situation, Danilović could only practice with Partizan players, which he did vigorously and assiduously, up to 7 or 8 hours per day. He stated in later interviews that it wasn\'t until his arrival at Partizan that he started training seriously. His living arrangements were provided for by the club; they put him up in a room at the JNA Stadium that he shared with youngster teammates Oliver Popović and Popović\'s brother. Furthermore, in accordance with his parents\' wishes, the club ensured he also pursued his full-time secondary education by getting enrolled in the streamlined Petar Drapšin Technical High School. However, unable to make the classes due to frequent, lengthy practices, he soon switched to part-time education at the streamlined touristic high school. Discussing his first days in Belgrade and arrival at a new club, Danilović later said: Certain people at Partizan liked me very much, but there were also those within the club who thought I was a \'neanderthal from Sarajevo\' because I was a very brazen kid and I practiced like an animal. At that moment, for me, Vujošević was both a coach and a father.']","The book by Todd Spehr that provides insight into the remarkable life and legacy of Drazen Petrovic is titled ""The Mozart of Basketball: The Remarkable Life and Legacy of Drazen Petrovic.""",The Mozart of Basketball: The Remarkable Life and Legacy of Drazen Petrovic,,0.9853343675381474,0.8597505668811417,1.0,0.9888382897828173,0.9553531591312692
In which year did Marial Shayok make his NBA debut for the Philadelphia 76ers?,"[""The 76ers waived him during the offseason. = On January 5, 2021, he signed with Frutti Extra Bursaspor of the Turkish Super League (BSL). In 12 games with them, Shayok averaged 18.9 points (2nd in the league), 6.9 rebounds, and 4.2 assists, with an 88.1% free throw percentage. = Following his very strong finish to the season, Shayok signed a two (1+1) year deal with fellow Turkish club Fenerbahçe on June 21, 2021. In 25 games in 2021-22 he averaged 5.4 points, 2.2 rebounds, and 1.8 assists per game. = On October 24, 2022, Shayok joined the Maine Celtics training camp roster. He played 21 games for the team in the G League, and averaged 19.7 points, 4.7 rebounds, and 4.4 assists per game while shooting 57.5% from the floor, 50.0% (3rd in the league) from three-point range, and 92.2% (2nd in the league) from the free throw line for the season of 2022–2023. = On October 23, 2023, Shayok signed with Shandong, of the Chinese Basketball Association (CBA). He averaged 19.1 points, 4.6 rebounds, 3.6 assists, and 1.2 steals per game, while shooting 41.1% from three-point range, and 81.2% from the free throw line. = On September 20, 2024, Shayok joined the Liaoning Flying Leopards of the Chinese Basketball Association (CBA). In 47 games, he averaged 13.8 points, 3.2 rebounds, 2.4 assists, and 1.0 steals per game, while shooting 41.0% from three-point range, and 87.5% from the free throw line. = On November 14, 2024, he signed a two-year deal with Maccabi Tel Aviv of the Israeli Basketball Premier League. Shayok joined Maccabi Tel Aviv center Wenyen Gabriel, alongside whom he had represented South Sudan at the 2024 Olympic Games. Shayok represented South Sudan at the 2023 FIBA World Cup, averaging 13.2 points 3.5 rebounds, and 2.2 assists per game. The South Sudan men's basketball team finished the FIBA World Cup with a 3–2 record, and qualified for the 2024 Paris Olympics. At the Olympics, he averaged 14.7 points, 3.7 rebounds, and 1.3 assists per game, as South Sudan defeated Puerto Rico but lost to Serbia and the United States. In a pre-Olympics exhibition game, he scored 25 points against Team USA, as South Sudan lost to the eventual gold medal winner by just one point, 100–101, as Team USA was led by four former NBA MVP winners, LeBron James, Joel Embiid, Stephen Curry, and Kevin Durant. = Regular season = Iowa State Cyclones bio NBA Draft Profile Marial Shayok on Instagram\n\nIn the 2019–20 season, Marial Shayok played for Philadelphia in 4 games. He averaged 2.8 points, 1.8 rebounds, 0.3 assists, 0.3 steals, and 0.0 blocks per game. He shot 0.25 from the field, 0.333 from 3-point range, and 0.75 from the free throw line, playing an average of 7.0 minutes per game. In the 2014–15 season, Marial Shayok played for Virginia in 34 games. He averaged 3.8 points, 1.8 rebounds, 1.0 assists, 0.6 steals, and 0.3 blocks per game. He shot 0.405 from the field, 0.38 from 3-point range, and 0.63 from the free throw line, playing an average of 14.6 minutes per game. In the 2015–16 season, Marial Shayok played for Virginia in 35 games. He averaged 4.3 points, 1.9 rebounds, 1.1 assists, 0.3 steals, and 0.1 blocks per game. He shot 0.492 from the field, 0.436 from 3-point range, and 0.548 from the free throw line, playing an average of 15.0 minutes per game. In the 2016–17 season, Marial Shayok played for Virginia in 34 games. He averaged 8.9 points, 2.4 rebounds, 1.0 assists, 0.9 steals, and 0.3 blocks per game. He shot 0.445 from the field, 0.328 from 3-point range, and 0.796 from the free throw line, playing an average of 20.6 minutes per game. In the 2018–19 season, Marial Shayok played for Iowa State in 34 games. He averaged 18.7 points, 4.9 rebounds, 2.0 assists, 0.9 steals, and 0.2 blocks per game."", 'Marial Makur Shayok ( SHAY-ok; born July 26, 1995) is a South Sudanese-Canadian professional basketball player for Maccabi Tel Aviv of the Israeli Basketball Premier League and the EuroLeague. He played college basketball for the Virginia Cavaliers and Iowa State Cyclones. He was selected 54th overall by the Philadelphia 76ers in the 2019 NBA Draft, and played briefly for the Sixers. Shayok represented the South Sudan national team in the 2023 FIBA World Cup and the 2024 Olympics. Shayok was born in Ottawa, Ontario, to Sudanese father Makur and mother Helena. Makur played basketball at the University of Dayton (1990-92)). Marial has four siblings, including two who played college basketball in the NCAA. His sister, Yar, played for the University of Detroit Mercy, then signed with a professional team in France, while his older brother Shayok played at the IMG Academy and later at Bradley University. Shayok started playing basketball at the age of seven, sometimes on the playgrounds, sometimes at the YMCA. Growing up, his favorite players were Michael Jordan, Kobe Bryant, Kevin Durant, Penny Hardaway, and Dwyane Wade. Shayok first attended and played basketball for three seasons for St.', 'He was later named as part of the PIT All-Tournament Team. For the season, he averaged 18.7 points (2nd in the conference), 4.9 rebounds, 2.0 assists, and 2.1 three-pointers (6th) per game, shooting 49.6% (2nd) from the field, 38.6% from three-point range (8th), and 87.8% (2nd; 18th in the NCAA) from the free throw line. Shayok was the only player in the US who averaged 18.5 points while shooting at least 49% from the field, 38% on three-pointers, and 87% at the free throw line. He was named an Associated Press All-America Honorable Mention, a Julius Erving Award finalist (Small Forward of the Year), and an All-Big 12 First-Team selection. = Shayok was selected with the 54th overall pick in the 2019 NBA draft by the Philadelphia 76ers. On July 7, 2019, the 76ers announced that they had signed Shayok to a two-way contract, meaning he would split time between the 76ers and their G League affiliate, the Delaware Blue Coats. Shayok was named G League player of the week on November 18 after averaging 35.0 points, 9.3 rebounds, and 3.7 assists in three games for the Blue Coats, including 42 points against the Greensboro Swarm. On December 6, Shayok scored 31 points in a 110–109 win over the Capital City Go-Go on 13-of-23 shooting. He had 29 points and six assists on January 20, 2020, in a 119–109 win over the South Bay Lakers. On February 6, Shayok made his NBA debut for the 76ers, hitting a three-pointer in a 112–101 loss to the Milwaukee Bucks. During the shortened 2019-20 G League season, in 35 games Shayok averaged 22.4 points (6th in the league), 6 rebounds, and 3.8 assists per game, shooting 46% from the field, 36% from three-point range, and 88.9% (9th) from the free throw line. He was named 2019-20 All-G League, and G-League All-Rookie Team.', ""After the SuperSonics moved to Oklahoma City, the team waived him before the start of the new season. On September 1, 2008, Marshall agreed to terms with the Philadelphia 76ers on a one-year contract. The move signaled Marshall's impending retirement, as he said his goal was to play for his hometown 76ers before he retired. Playing just 25 games, he provided Philadelphia with veteran leadership and three point shooting. He played a key role in Philadelphia's game 1 victory over the Orlando Magic in the first round of the playoffs; he scored 11 points and made a three-pointer to tie the game in the final minute. On October 26, 2009, after retiring from the NBA, Marshall joined Comcast SportsNet as a 76ers' post-game live analyst. Marshall left broadcasting on July 1, 2010, to become an assistant men's basketball coach of the George Washington Colonials under fellow Univ. of Connecticut alumnus Karl Hobbs. On November 3, 2011, Marshall was announced as an assistant coach of the D-League's Maine Red Claws. In September 2013, Marshall became an assistant coach of the Rider University men's basketball team. Marshall was largely responsible for the effective play of senior transfer center Matt Lopez and a second place regular season finish in the MAAC in 2014–15. Following a 21–12 season at Rider which earned a College Basketball Invitational appearance, Marshall was named as an assistant on Nate Oats's staff at the University at Buffalo on April 16, 2015. = On April 6, 2016, he was named head men's basketball coach at Central Connecticut State. Marshall won his first game as head coach of Central Connecticut on November 11, 2016, a 75–60 win over Hartford. After the 2021 season, Marshall and Central Connecticut mutually agreed to part ways ending Marshall's time at the school after five seasons. = On October 24, 2021, Marshall became an assistant coach for the Greensboro Swarm of the NBA G League. On February 5, 2007, Marshall's number was honored at Gampel Pavilion on the University of Connecticut campus in Storrs, during halftime of the men's basketball game against the Syracuse Orangemen, as part of the Huskies of Honor ceremony which recognized personal accomplishments of 13 former players and three coaches. Until November 7, 2016, he held and shared the NBA record (with Kobe Bryant and Stephen Curry) for most three-point field goals made in a game after he made 12 three-point field goals of 19 attempts against the Philadelphia 76ers on March 13, 2005. Marshall's great uncle is Hall of Fame American football player Lenny Moore. = = List of NBA single-game 3-point field goal leaders Official biography, Central Connecticut Blue Devils NBA Profile Stats at Basketball-Reference\n\nIn the 1994–95 season, Donyell Marshall played for Minnesota in 40 games. He averaged 10.8 points, 4.9 rebounds, 1.4 assists, 0.6 steals, and 1.3 blocks per game."", 'On 3 July 2016, he signed his rookie scale contract with the 76ers and joined the team for the 2016 NBA Summer League. On 29 October 2016, he made his NBA debut in a 104–72 loss to the Atlanta Hawks, recording one rebound, one assist and one steal in six minutes off the bench. On 1 February 2017, he made the first start of his career in place of the injured Robert Covington and scored seven points in a 113–95 loss to the Dallas Mavericks. On 12 March 2017, he scored a season-high 18 points in a 118–116 win over the Los Angeles Lakers. On 31 March 2017, he set a new season high with 19 points in a 122–105 loss to the Cleveland Cavaliers. Two days later, he had a 23-point effort in a 113–105 loss to the Toronto Raptors. On 10 April 2017, he scored a season-best 24 points in a 120–111 loss to the Indiana Pacers.', ""Following the season he declared for the 2018 NBA draft. = Shamet was taken with the 26th pick in the 2018 NBA draft by the Philadelphia 76ers. In the 2018 preseason, Shamet averaged 8.8 points per game, with an 18-point performance in a 120–114 victory over the Dallas Mavericks in China. Shamet scored a career-high 29 points off the bench on January 8, 2019, in a home victory over the Washington Wizards, including a Sixers rookie record 8 three-pointers. = On February 6, 2019, Shamet was traded to the Los Angeles Clippers. In his first game with them, he scored 17 points, 13 of which were in the 4th quarter, in a comeback from 28 down against the Boston Celtics. On April 15, in Game 2 of the first round against the Golden State Warriors, he scored 12 points and the game winning 3-pointer in a 31-point comeback leading to a 135–131 Clippers victory. In Game 7 of the second round in the 2020 NBA playoffs, Shamet turned his ankle in the first quarter and had to leave the game, playing only six minutes. The Clippers lost 104–89 to the Denver Nuggets and were eliminated. = On November 19, 2020, Shamet was traded to the Brooklyn Nets in a three-team trade that sent Luke Kennard to the Clippers. On January 14, 2021, Shamet switched his number from 13 to 20 since James Harden was traded to the Nets and wanted to wear the number 13. = On August 6, 2021, Shamet was traded to the Phoenix Suns in exchange for Jevon Carter and the draft rights to Day'Ron Sharpe. On October 18, he signed a four-year, $43 million rookie scale extension with the Suns. On December 20, 2022, Shamet scored a career-high 31 points, including tying a franchise-record 9 three-pointers made in a single game alongside teammate Cameron Johnson, Aron Baynes, Channing Frye, and Quentin Richardson in a 113–110 loss to the Washington Wizards. He later tied his career-high in points scored five days later on Christmas Day in an overtime loss to the Denver Nuggets. On May 7, 2023, Shamet scored 19 points during a 129–124 win over the Denver Nuggets during the Western Conference Semifinals. = On June 24, 2023, the Suns traded Shamet, along with Chris Paul, four first-round pick swaps, and six second-round picks, to the Washington Wizards in exchange for Bradley Beal, Jordan Goodwin, and Isaiah Todd. On July 6, 2024, Shamet was waived by the Wizards. = On September 14, Shamet signed with the New York Knicks. However, he was waived on October 19 amid suffering a dislocated shoulder in an NBA Preseason game against the Charlotte Hornets on October 15. On October 26, 2024, Shamet joined the Westchester Knicks after being selected in the 2024 NBA G League draft and on December 23, he re-signed with the New York Knicks. = Regular season Playoffs = Career statistics from NBA.com · Basketball Reference Wichita State Shockers bio\n\nIn the 2018–19 season, Landry Shamet played for Philadelphia in 54 games. He averaged 8.3 points, 1.4 rebounds, 1.1 assists, 0.4 steals, and 0.1 blocks per game. He shot 0.441 from the field, 0.404 from 3-point range, and 0.815 from the free throw line, playing an average of 20.5 minutes per game. In the 2018–19 season, Landry Shamet played for L.A. Clippers in 25 games."", 'However, he was later waived by the 76ers on October 25, 2014. On November 3, 2014, he was acquired by the Delaware 87ers as an affiliate player. He later re-signed with the 76ers on November 10 and made his NBA debut on November 13 against the Dallas Mavericks. He recorded two points and five rebounds in the 70–123 loss. On December 5, 2014, he was waived by the 76ers after appearing in nine games.', 'He was recalled on December 23 and made his debut for the 76ers that night, recording 10 points and 5 rebounds in a loss to the Milwaukee Bucks. On March 20, 2016, he scored a season-high 26 points in a loss to the Boston Celtics.', ""He shot a solid 47.8% from the field and an above average 41.9% from the three-point line. = On June 28, 2007, Young was drafted by the Philadelphia 76ers with the 12th overall pick in the 2007 NBA draft. In his NBA debut on November 7, 2007, Young made his first NBA field goal at the Wachovia Center in Philadelphia in a 94–63 76ers' win over the Charlotte Bobcats. Young finished the night with 6 points and 3 rebounds."", 'The highlight of his NBA career was his performance in the 1987–88 season with the Nuggets when he averaged 13.9 points and 8.2 rebounds per game. In the playoffs that season he averaged 16.4 points and 7.2 rebounds per game. He was 4th in the NBA with a .640 true shooting percentage. He retired after the NBA lockout-shortened 1999 season, after averaging 1.5 points in an injury-plagued 19-game stint with the Orlando Magic. Schayes was briefly a member of the Minnesota Timberwolves after signing as a free agent before the start of the 1999–00 season. However, he made no appearances for them due to his injuries, and was waived.']","Marial Shayok made his NBA debut for the Philadelphia 76ers on February 6, 2020.",Marial Shayok made his NBA debut for the Philadelphia 76ers on February 6.,0.0,0.9544897072370672,0.5317460317283068,1.0,0.6226447262469095,0.9905741202979992
In which league did Mickael Gelabale last play for before joining the Los Angeles D-Fenders in the NBA D-League?,"[""Mickaël Gelabale (born May 22, 1983) is a French professional basketball player who last played for Élan Chalon of the Pro B. He also represents the France national basketball team internationally. Standing at 2.01 m (6 ft 7 in), he plays either at the small forward position or the power forward position in a small ball configuration. Gelabale started playing professionally with Cholet Basket, averaging 10 points and five rebounds per game in his final season (2003–04). Subsequently, he joined Real Madrid, being used in the side's rotation during two seasons (about 23 minutes per game combined). At the end of his first season, Gelabale was selected by the Seattle SuperSonics in the second round (48th overall) of the 2005 NBA draft, but opted to stay in the Spanish capital instead of immediately joining the NBA. On July 12, 2006, he signed a two-year contract with the Sonics, joining Johan Petro as the second French player on the team. Stuck on the depth chart behind both Ray Allen and Rashard Lewis (in 2006–07) and rookie Kevin Durant (2007–08), Gelabale appeared sparingly for the team, tearing his anterior cruciate ligament midway through his second year. On March 29, 2009, he resumed playing, one year after his injury, with the Los Angeles D-Fenders in the NBA D-League."", ""On January 29, 2013, he was signed to a second 10-day contract. On February 8, 2013, he signed with the Timberwolves for the rest of the season. Gelabale was waived by the Timberwolves on July 7, 2013. On July 31, 2013, Gelabale signed a one-year contract with his former team Khimki. On November 21, 2014, Gelabale signed a one-month contract with Strasbourg IG. After his contract expired, he left Strasbourg. On January 5, 2015, he signed with Limoges CSP. On July 2, 2015, he signed a two-year contract with Le Mans Sarthe. On October 10, 2017, he signed with Élan Chalon. He averaged 11.1 points and 5 rebounds per game in 2019–20. In June 2020, Gelabale extended his contract until 2022. In September 2005, Gelabale helped the senior men's French national team to the bronze medal at the EuroBasket 2005. In EuroBasket 2011, his team won the silver medal, and in EuroBasket 2013, they won the gold medal. = = = List of French NBA players Career statistics from NBA.com · Basketball Reference Mickaël Gelabale at Euroleague.net Mickaël Gelabale at Eurobasket.com Mickaël Gelabale at ACB.com (archived) (in Spanish) 'HoopsWorld Global' story on Gelabale; January 28, 2007 (archived)\n\nIn the 2006–07 season, Mickael Gelabale played for Seattle in 70 games. He averaged 4.6 points, 2.5 rebounds, 0.8 assists, 0.3 steals, and 0.3 blocks per game. He shot 0.462 from the field, 0.234 from 3-point range, and 0.805 from the free throw line, playing an average of 17.7 minutes per game. In the 2007–08 season, Mickael Gelabale played for Seattle in 39 games. He averaged 4.3 points, 1.5 rebounds, 0.8 assists, 0.3 steals, and 0.2 blocks per game. He shot 0.439 from the field, 0.432 from 3-point range, and 0.778 from the free throw line, playing an average of 11.9 minutes per game. In the 2012–13 season, Mickael Gelabale played for Minnesota in 36 games. He averaged 5.0 points, 2.8 rebounds, 0.7 assists, 0.4 steals, and 0.1 blocks per game. He shot 0.518 from the field, 0.308 from 3-point range, and 0.875 from the free throw line, playing an average of 17.9 minutes per game. In the 2004–05 season, Mickael Gelabale played for Real Madrid in 19 games. He averaged 8.2 points, 4.3 rebounds, 1.1 assists, 0.9 steals, and 0.4 blocks per game. He shot 0.607 from the field, 0.333 from 3-point range, and 0.788 from the free throw line, playing an average of 24.3 minutes per game. In the 2005–06 season, Mickael Gelabale played for Real Madrid in 22 games. He averaged 7.9 points, 3.5 rebounds, 0.7 assists, 0.6 steals, and 0.5 blocks per game. He shot 0.467 from the field, 0.395 from 3-point range, and 0.769 from the free throw line, playing an average of 23.2 minutes per game. In the 2012–13 season, Mickael Gelabale played for Cedevita in 10 games. He averaged 12.8 points, 4.9 rebounds, 1.3 assists, 0.5 steals, and 0.3 blocks per game."", 'On September 28, 2009, the Los Angeles Lakers of the NBA signed him to their practice squad to give him a chance at a long-term contract, but he was waived on October 10, 2009, two weeks before the beginning of the 2009–10 regular season. He then signed with Cholet Basket in the French Pro A on November 26, 2009. He won the 2009–2010 Pro A championship and was named MVP of the Play-Offs Final with Cholet. In July 2010, Gelabale signed a contract with ASVEL. In August 2011 he signed with Spirou Basket in Belgium for one year, but his contract was later indefinitely suspended because of an injury. In January 2012 he signed with Khimki Moscow until the end of the season. In August 2012 he signed with KK Cedevita. After the Croatian team was eliminated in the EuroLeague, Gelabale signed with Valencia Basket in December 2012. On January 19, 2013, he signed a ten-day contract with the Minnesota Timberwolves.', ""However, he was later waived by the Wizards on October 3. On October 30, he was reacquired by the Idaho Stampede. The next day, he was traded to the Los Angeles D-Fenders in exchange for a second round pick (36th overall) in the 2014 NBA Development League Draft. On February 12, 2015, he was named to the Futures All-Star team for the 2015 NBA D-League All-Star Game as a replacement for Jordan Hamilton. = On April 13, 2015, Blue signed with the Los Angeles Lakers to help the team deal with numerous injuries. The Lakers had to use an NBA hardship exemption in order to sign him as he made their roster stand at 16, one over the allowed limited of 15. Due to the severe lack of guard depth, in the two games he played for the Lakers, he logged 26 and 48 minutes respectively. = In July 2015, Blue joined the Chicago Bulls for the 2015 NBA Summer League. On October 31, he was reacquired by the Los Angeles D-Fenders. On January 29, he was named in the West All-Star team for the 2016 NBA D-League All-Star Game, earning his second straight All-Star nod. At the season's end, he was named to the All-NBA D-League First Team. = In July 2016, Blue joined the Dallas Mavericks for the 2016 NBA Summer League. The following month, he had a one-game stint in China with the Guangxi Rhinos. = Blue returned to the US and re-joined the Los Angeles D-Fenders on October 30, 2016. On February 6, 2017, he was named in the Western Conference All-Star team for the 2017 NBA D-League All-Star Game, earning his third straight All-Star nod. On April 24, 2017, he was named the recipient of the NBA Development League Most Valuable Player Award for the 2016–17 season. He ranked third in the league in scoring with 24.8 points per game and added 5.1 rebounds, 3.0 assists and a team-high 1.6 steals in 47 games (46 starts). He was twice named Player of the Week during the season and helped the D-Fenders finish tied for the best record in the Western Conference at 34–16. Blue scored at least 30 points 10 times and reached the 40-point mark twice. On March 29, he made an NBA D-League-record 23 free throws en route to a season-high 41 points to go with seven rebounds and five steals in a 139–132 road victory over the Reno Bighorns. = On August 4, 2017, Blue signed with the Los Angeles Lakers, returning to the franchise for a second stint. He was waived on October 14 as one of the team's final preseason roster cuts. On October 18, 2017, he signed a two-way contract with the Los Angeles Lakers. Under the terms of the deal, he split time between the Lakers and their NBA G League affiliate, the South Bay Lakers. On January 12, 2018, he was waived by the Lakers. = On February 2, 2018, Blue signed with Italian club Auxilium Torino for the rest of the 2017–18 season. Blue went to win the 2018 edition of the Italian Basketball Cup with Fiat Torino by beating Germani Basket Brescia 69–67 in the Finals. Blue was named Finals MVP of the competition recording 11 points, two rebounds, and three assists. = Blue joined the Wisconsin Herd of the G League when the team acquired his league rights from South Bay on November 16. = On January 24, 2019, Blue was traded to the Texas Legends for the returning player rights to Damon Lynn and a 2019 NBA G League second round pick. = Blue joined the Santa Cruz Warriors in 2019. He was waived by the Warriors on December 12, after averaging 8.6 points, 2.4 rebounds and 1.5 assists per game. = On March 8, 2020, Blue signed with Golden Eagle Ylli of the Kosovo Basketball Superleague. On August 18, 2021, Blue signed with Libertadores de Querétaro of the Liga Nacional de Baloncesto Profesional (LNBP). = On February 19, 2021, Blue signed with Club Atlético Peñarol of the Liga Uruguaya de Basketball. = In August 2022, Blue returned to the Libertadores de Querétaro for the 2022 season. He earned LNBP All-Star honors. = In January 2024, Blue signed with the Ángeles de la Ciudad de México, an expansion team in the Circuito de Baloncesto de la Costa del Pacífico (CIBACOPA). = List of NBA G League career scoring leaders Career statistics from NBA.com · Basketball Reference Marquette Golden Eagles bio\n\nIn the 2013–14 season, Vander Blue played for Boston in 3 games. He averaged 1.7 points, 1.0 rebounds, 0.3 assists, 0.0 steals, and 0.0 blocks per game. He shot 0.5 from the field, 0.0 from 3-point range, and 0.2 from the free throw line, playing an average of 5.0 minutes per game. In the 2014–15 season, Vander Blue played for L.A. Lakers in 2 games."", ""Petersburg. N'Dong moved to the Spanish ACB league later that season and signed with Unicaja Málaga for the 2006–07 ACB League play-offs to replace the injured Daniel Santiago. On 14 July 2007 he re-signed with Malaga on a one-season contract. He has also played with the Cleveland Cavaliers NBA Summer League squad in 2007. In 2009, he signed a two-year contract worth €3.2 million net income with the Spanish league club FC Barcelona. In 2011, he signed a one-year extension contract with Regal Barcelona. In the summer of 2012, he signed a one-year contract with Galatasaray Medical Park. On 16 June 2013, the day after Galatasaray won the 2012–13 league championship, he announced that he was going to retire. N'dong helped the Senegal national team get the silver medal at the FIBA Africa Championship 2005 in Algeria, a competition he won the MVP award. From 2015 until 2019, N'Dong was an assistant coach for Unicaja Málaga. In autumn 2020, N'Dong took over as the head coach of the Senegal national basketball team during the qualifiers for AfroBasket 2021. = Regular season = Career statistics from NBA.com · Basketball Reference Euroleague.net Profile Spanish League Profile (in Spanish) A report in German about N'Dong\n\nIn the 2005–06 season, Boniface Ndong played for L.A. Clippers in 23 games."", 'In November 2013, he was again re-acquired by the Los Angeles D-Fenders. In early January 2014, he left the D-Fenders. On January 8, 2014, Moon signed with the reigning back-to-back Euroleague champions, Olympiacos of the Greek League, for the rest of the 2013–14 season. In March 2014, he was released by Olympiacos. Later that month, he signed with Guaros de Lara for the 2014 LPB season. On November 1, 2014, Moon was reacquired by the Los Angeles D-Fenders. On December 18, 2014, he was waived by the D-Fenders. On January 5, 2015, Moon signed with Guaros de Lara for the 2015 LPB season, returning to the club for a second stint. On February 26, 2015, he was waived by the club. In the summer of 2017, Moon played in The Basketball Tournament on ESPN for team Trained To Go. He competed for the $2 million prize, and for team Trained To Go, he scored 13 points in 23 minutes on the court. Moon and Trained To Go lost in the first round of the tournament to the Broad Street Brawlers 108–95. On November 30, 2017, it was announced that Moon would be re-joining the Albany Patroons for his third stint with the team. In December 2017, Moon briefly played in Uruguay with Club Atlético Aguada. = = = Points: 17 5 times Rebounds: 15 vs.', ""He went on to be named to the D-League All-Rookie second team for the 2010–11 season. = On November 28, 2011, Millsap was acquired by the Los Angeles D-Fenders. On December 9, he signed with the Los Angeles Lakers, but was waived on December 22 prior to the start of the regular season. He then re-joined the D-Fenders. In July 2012, Millsap joined the Atlanta Hawks for the 2012 NBA Summer League. On September 17, he signed with the Shanghai Sharks of the Chinese Basketball Association. However, he was later released by the Sharks in November 2012 in favor of Gilbert Arenas. On December 12, 2012, he was reacquired by the D-Fenders, where he played out the 2012–13 season. = In June 2013, Millsap joined the Petron Blaze Boosters of the Philippine Basketball Association for the 2013 Governor's Cup. = On January 13, 2014, Millsap signed with Maccabi Ashdod for the rest of the 2013–14 season. On March 19, he left Maccabi and returned to the United States. = On March 29, 2014, Millsap was re-acquired by the Los Angeles D-Fenders. = In July 2014, Millsap joined the Philadelphia 76ers for the 2014 NBA Summer League. On September 27, he signed with the Milwaukee Bucks. However, he was later waived by the Bucks on October 16. On October 30, Millsap was reacquired by the Los Angeles D-Fenders. The next day, he was traded to the Bakersfield Jam. = On January 5, 2015, Millsap signed a 10-day contract with the Utah Jazz and made his NBA debut that night against the Indiana Pacers. In just over 18 minutes of action, he recorded 2 points, 5 rebounds, 4 assists and 1 steal in a 105–101 loss. On January 15, he signed a second 10-day contract with the Jazz, and on January 25, he signed a multi-year contract with the Jazz. On January 5, 2016, Millsap was waived by the Jazz. = On January 23, 2016, Millsap signed with Maccabi Tel Aviv of the Israeli League for the rest of the season. On March 10, 2016, he was released by the club after appearing in six games. = On September 15, 2016, Millsap signed with the San Miguel Beermen for the team's 2016 PBA Governors' Cup playoff run. He helped San Miguel reach the semi-finals, where they were defeated 3–2. = On October 31, 2016, Millsap was acquired by the Northern Arizona Suns of the NBA Development League. With the Suns in 2016–17, Millsap led the team in scoring (19.7 points per game), steals (2.1 per game), minutes (37.0 per game) and double-doubles (13). He was second on the team in rebounding with 7.9 rebounds per game, and third on the team with 4.0 assists per game. He was the only Suns player to start all 50 games, and was one of three players to play in all 50 Northern Arizona games on the year. In their season finale on April 1, Millsap dropped a career-high 38 points on 12-of-24 shooting, including 7-of-12 from distance, against the Reno Bighorns. Millsap scored 30+ points four times and 20+ points 23 times during the season. = On April 9, 2017, Millsap was called up from Northern Arizona and signed a multi-year contract with the Phoenix Suns. He made his debut for Phoenix later that day, recording two rebounds and one assist in 12 minutes off the bench in a 124–111 win over the Dallas Mavericks. He would later be cut from the roster on October 14, 2017, as the Suns trimmed their roster down to the newly implemented 17 players. = On October 20, 2017, Millsap was traded from the Northern Arizona Suns to the Minnesota Timberwolves's G League affiliate, the Iowa Wolves. = On December 18, 2018, Millsap signed for CB Breogán of the Spanish Liga ACB. On March 19, 2019, Millsap parted ways with Breogan after playing 11 games with the Galician side. = On January 3, 2022, Millsap signed with the College Park Skyhawks of the NBA G League. However, he was waived on January 12 after making three appearances. = Millsap was born in Grambling, Louisiana. He is the brother of four-time NBA All-Star Paul Millsap. He also has two other brothers who play basketball: John and Abraham. = On February 24, 2021, Millsap accused Utah Jazz vice president Dennis Lindsey of making racist comments towards him during a 2015 end-of-season meeting. Lindsey and Jazz head coach Quin Snyder both denied the allegations. On February 26, the NBA launched a probe into the allegations, but on March 15, the league announced that it had been unable to find evidence of the remark being made."", ""He played with the Atlanta Hawks during the 2006 NBA preseason, but he was cut before the regular season began. He also played with the Albuquerque Thunderbirds of the NBA D-League, and with them, he won the D-League championship, in the year 2006. Glyniadakis was signed by the NBA's Seattle SuperSonics, on 5 November 2006. With the Sonics, he appeared in 13 regular season games, in which he averaged 1.3 points per game. He was waived by the Sonics on 4 January 2007. Glyniadakis' final NBA game was played on 2 January 2007 in an 88–112 loss to the Dallas Mavericks. In his last NBA game, he recorded no stats, and only played for a total of 52 seconds, as he was substituted in at the very end of the 4th quarter, for Damien Wilkins. Glyniadakis also played with the Boston Celtics's Summer League squad in the 2007 NBA Summer League, in Las Vegas, Nevada. Glyniadakis was a member of the Greek junior national teams. With Greece's junior national teams, he played at the 1997 FIBA Europe Under-16 Championship. He won the bronze medal at the 1998 FIBA Europe Under-18 Championship. He also played at the 1999 FIBA Under-19 World Cup, and at the 2000 FIBA Europe Under-20 Championship. Glyniadakis was also selected to the senior men's Greek national team for the 2008 Summer Olympic Games. With Greece, he won the bronze medal at the 2009 EuroBasket."", 'He played college basketball for two years at Wichita State University. He then played in the Israeli Super League for Maccabi Tel Aviv, Hapoel Gilboa Galil, and Maccabi Haifa, and in the Italian Serie A League for Benetton Treviso. He was a two-time Israeli Super League MVP, in 2011 and 2013. He was the Israeli Premier League Assists Leader in 2011 and 2016. In 2013, he signed a three-year minimum fully guaranteed contract with the Dallas Mavericks, becoming the second Israeli to join the NBA; he also holds a Polish passport. Mekel is Jewish, and was born in Ramat HaSharon, Israel, to Alon and Ariela Mekel.', ""At the end of that month, he was signed for the remainder of the season, appearing in a total of 12 games and averaging 1.5 ppg. In October 2006, Felix was waived by the Sonics. Later that month he signed a two-year contract with Israel's Maccabi Tel Aviv. Felix started the 2007–08 season playing in the NBA Development League playing for the Anaheim Arsenal but in December 2007 signed with Hapoel Jerusalem. In 2010, Felix spent time with the Springfield Armor and Maine Red Claws of the NBA Development League. In 2011, Felix joined the Dacin Tigers of the Super Basketball League. Career statistics from NBA.com · Basketball Reference Eurobasket.com profile\n\n""]",Mickael Gelabale last played for Élan Chalon of the Pro B before joining the Los Angeles D-Fenders in the NBA D-League.,Élan Chalon of the Pro B,,0.9756297254916703,0.9087301587171768,1.0,0.5864693144323548,0.8458699981221854
In which NBA Finals did David Rivers and the Los Angeles Lakers face the Detroit Pistons?,"['The Pistons lost in six games to the Miami Heat, who went on to capture their first NBA title. On March 26, 2007, in a game against the Denver Nuggets, Wallace threw up a 60-foot shot off a stolen inbound pass with 1.5 seconds remaining and banked it in from just behind halfcourt to force overtime letting out a huge roar from what was left of the Palace crowd. The Pistons went on to win the game, 113–109. On June 2, 2007, Wallace fouled out of Game 6 of the Eastern Conference Finals after committing a foul on LeBron James and then received two technical fouls, resulting in an automatic ejection, for arguing with a referee. Prior to the 2007–08 NBA season, the Pistons would not re-sign Chris Webber, and putting Antonio McDyess as a starting power forward, put Wallace at center. On February 10, 2008, it was announced that Wallace would be replacing Boston Celtics\' injured forward Kevin Garnett in the 2008 NBA All-Star Game in New Orleans. The decision was made by NBA commissioner David Stern. This was Wallace\'s fourth All-Star appearance. In the 2008 Eastern Conference Finals, the Pistons played Garnett and the Celtics. This marked the sixth consecutive time that the Pistons had made it to this point, and five times they had gotten there with Wallace in the lineup. Still, Detroit lost a third consecutive year in the Conference Finals, losing to Boston 4–2 as Wallace played poorly. After the game, Wallace reportedly told reporters, without taking any questions, ""It\'s over, man"", perhaps indicating that Pistons\' General Manager Joe Dumars would break up the core of the team following the defeat. He changed his number from 36 back to his original 30, perhaps to change his and the team\'s fortunes, but sure enough, Dumars did indeed break up the core: at the beginning of the 2008–09 season, Dumars traded longtime starting point guard and 2004 Finals MVP Chauncey Billups to Denver. It was to be Wallace\'s last year with the team; after the season came to a close, Wallace and the Pistons decided to part ways.', 'While they swept the Blazers and defeated the Spurs 4–1 in the first two rounds of the playoffs, the Lakers did not have home-court advantage against the Sacramento Kings. The series would stretch to seven games, the first time this had happened to the Lakers since the 2000 Western Conference Finals.', 'He earned four monograms while a member of the Fighting Irish. = Rivers was selected by the Los Angeles Lakers in the first round (25th overall) of the 1988 NBA draft, after the player they were targeting (Brian Shaw), was selected one choice before. As a rookie he played in 47 regular season games, averaging 2.9 points and 2.3 assists per game, and 6 playoff games, averaging 2.5 points and 1 assist per game. The team eventually lost in the NBA Finals against the Detroit Pistons. Rivers was selected by the Minnesota Timberwolves in the 1989 NBA expansion draft. He was released before the start of the regular season on November 2.', ""Green, but frequently played more minutes off the bench than the starters, especially during the playoffs. In the 2000 Finals against the Indiana Pacers, the Lakers took a 2–1 lead into Game 4 in Indiana. The game went into overtime. Shaquille O'Neal fouled out, but Kobe Bryant led a run to seal the Laker victory. Horry finished with 17 points in 37 minutes, his high for the Finals. The Lakers won the 2000 NBA Finals in six games. Horry averaged 7.6 points and 5.4 rebounds per game throughout the 2000 playoffs. In the 2000–01 season, Horry played behind Horace Grant, but once again played big minutes in the playoffs. He played in 16 Lakers 2001 playoffs games, averaging 5.9 points."", ""David Lee Rivers (born January 20, 1965) is an American former professional basketball player and coach. A 5’11”(1.80 m ) tall point guard, he reached star status in the EuroLeague, mainly while playing with Olympiacos, under head coach Dušan Ivković. Rivers played 3 seasons in the NBA, one with the Los Angeles Lakers (1988–89) and two more with the Los Angeles Clippers (1989–90, 1991–92). He played college basketball for the Notre Dame Fighting Irish. Rivers grew up in Jersey City, and played high school basketball under Bob Hurley, at powerhouse St. Anthony High School. He contributed to the team winning three State Championships and became the school's first player to be invited to the McDonald's All-American Game (1984). Rivers was teammates at St. Anthony with John Valentin. Rivers accepted a basketball scholarship from the University of Notre Dame, to play under head coach Digger Phelps. As a freshman, he was named a starter at point guard."", 'However, Detroit would be swept by the New Jersey Nets, 4–0. Rick Carlisle was fired as the head coach in the offseason and Larry Brown was hired. Championship season and Finals MVP (2003–2004) In the 2004 season, Billups averaged 16.9 points, 5.7 assists, 3.5 rebounds, and 1.1 steals per game. The Pistons improved their record to 54–28, but it was only good for the third seed overall in the Eastern Conference playoff standings. In the pivotal Game 3 during the first round series against the Milwaukee Bucks, which was tied 1–1, Billups led all scorers with 21 points and finished the scoring for his team by sinking 4 of 4 free throws in the final 31.2 seconds. These free throws were a key part of the Pistons effort to stave off the Bucks\' relentless defense which kept Detroit from scoring a normal field goal during the last 5:34. In the Eastern Conference Semifinals versus the defending Eastern Conference Champions the New Jersey Nets, Billups banked in a half-court three as time expired in game 5 to send the game into overtime. The Pistons would lose in triple overtime. Finally, he helped Detroit overcome a 3–2 series deficit to win the series, 4–3. In the Eastern Conference Finals against the Indiana Pacers, the Pistons won the gritty, defensive series, 4–2, by an average score of 75.2 PPG to the Pacers\' 72.7 PPG. Billups helped Detroit win the 2004 NBA Finals over the heavily favored Los Angeles Lakers, 4–1. He averaged per game 21 points, 5.2 assists, 3.2 rebounds, 1.2 steals, as well as shooting 50.1 percent field goals, 47.1 percent three-pointers, and 92.9 percent free throws to earn the NBA Finals MVP Award. Billups said of his MVP award, ""Everybody deserves this. Not just me. I wish I could turn it into thirteen pieces and give a little bit to everybody."" Back-to-back All-Defensive honors (2004–2006) The following season, Billups was named to the 2005 NBA Second All-Defensive Team, along with teammate Tayshaun Prince, while teammate and co-captain of the Pistons Ben Wallace took home the Defensive Player of the Year Award. The Pistons reached the 2005 NBA Finals but lost in their bid to repeat as champions to the San Antonio Spurs in seven games. In 2006, Billups was co-captain of the team. Billups was selected to play in the 2006 NBA All-Star Game as a reserve for the Eastern Conference, along with teammates Rip Hamilton, Rasheed Wallace and Ben Wallace. Pistons head coach Flip Saunders coached the Eastern Conference squad and put all four Pistons in the game when the east was falling behind; they were able to get the Eastern All-Star team back in the game. During the 2006 NBA All-Star Weekend, Billups participated in the Three-point Shootout contest. He was eliminated in the first round of the contest after scoring 12 points. Billups called this moment when all four Pistons entered the game at the same time, one of the highlight moments of his career. Although he captained the Pistons to a franchise best 64–18 record, they failed to make it to the NBA Finals for the first time in three years. Final seasons in Detroit (2006–2008) In the 2007 NBA All-Star Game, Billups was chosen as a reserve, along with teammate Rip Hamilton, for the Eastern Conference, despite an injury that kept Billups out of five games early on in the season. Billups also took part in the Shooting Stars Competition alongside former Piston and Detroit Shock head coach Bill Laimbeer and Shock star Swin Cash. Team Detroit won the competition with Billups hitting the final half-court shot. On July 11, 2007, Billups signed a $46 million, four-year contract with the Pistons (which includes a team option for a fifth year at $14 million). He had been an unrestricted free agent for several days after he opted out of the previous contract, which he had signed in 2002. Billups was selected to play as a reserve in the 2008 NBA All-Star Game, along with teammates Richard Hamilton and Rasheed Wallace, an injury replacement. In the first round of the 2008 NBA playoffs, during Game 3 against the Orlando Magic, Billups injured his right hamstring when Orlando Magic guard Jameer Nelson tangled with Billup\'s left leg on a drive to the bucket. Billups would sit for the 3 remaining games of the series. Billups and the Pistons again made it to the Eastern Conference Finals against the Celtics, but lost the series, 4–2, to the eventual champions. = On November 3, 2008, Billups was traded back to his hometown team the Denver Nuggets along with Antonio McDyess and Cheikh Samb for Allen Iverson. Pistons GM Joe Dumars said that it was ""the hardest and toughest"" move he had made as a general manager, describing Billups as ""... a guy that I have looked at as a little brother."" Billups chose the #7 jersey to honor Denver Broncos quarterback John Elway, since two of his other favorite numbers, 1 and 4, were already worn by J. R.', 'Billups spent the majority of his 17-year basketball career playing for the Detroit Pistons of the National Basketball Association (NBA), where he won the NBA Finals MVP in 2004 after helping the Pistons beat the Los Angeles Lakers in the Finals. He was given the nickname ""Mr. Big Shot"" for making late-game shots with Detroit. A five-time NBA All-Star, a three-time All-NBA selection and two-time NBA All-Defensive selection, Billups also played for the Celtics, Toronto Raptors, Denver Nuggets, Minnesota Timberwolves, New York Knicks, and Los Angeles Clippers during his NBA career. He was elected into the Basketball Hall of Fame in 2024. Billups worked as a studio analyst after his retiring from playing in 2014. The Pistons retired his No.', ""In the first round of the playoffs, they defeated Chicago in five games. Cleveland faced the 2008 champions Boston in the next round, and despite expectations to prevail over the aging Celtics, Cleveland lost the series 4–2. Parker started all 11 of Cleveland's playoff games. During the 2010 NBA offseason, LeBron James and Zydrunas Ilgauskas left Cleveland for the Miami Heat, which led several other veterans to also leave the team. The departures would thrust Parker, Antawn Jamison and Anderson Varejão into the spotlight as the veteran leaders for the young team. While Cleveland only managed a conference-worst 19–63 season, they were able to upset LeBron James' heavily favored Miami Heat on March 29, 2011, in a game where Parker grabbed eight rebounds and scored 20 points. On June 27, 2012, Parker announced his retirement."", ""2 Phoenix Suns. This marked the first time in James's career that he did not have home court advantage in the opening series. They were up 2–1 before Davis suffered a strained groin in Game 4, in which James finished with a game-high 25 points on 10-for-21 shooting, 12 rebounds, and 6 assists. The Lakers lost to the Suns in six games, marking the first time James lost in the first round in his career. James finished the series averaging 23.3 points, his fourth-lowest scoring output for a series over his career and his lowest mark since averaging 22.8 in the 2014 Eastern Conference finals. He made his 17th consecutive All-NBA Team selection, extending the record for most selections in NBA history, being named for the third time to the All-NBA Second Team. 2021–2022: First in the 10K-10K-10K club For the 2021–22 season, James was joined by Carmelo Anthony and Russell Westbrook. James switched his jersey back to No."", ""The Bucks' triumph represented a turnaround in their season, as they had secured victories in 13 of their last 16 games during this period after a slow start. Following his retirement as a player, Rivers called games for the NBA on TNT before joining the Orlando Magic as head coach in 1999. With TNT Rivers was normally paired with Verne Lundquist and later with Kevin Harlan. After being fired by the Orlando Magic in 2003, Rivers joined ESPN/ABC's NBA coverage, calling regular season games and the 2004 NBA Finals. Rivers worked on the top broadcast team with Brad Nessler on ESPN and Al Michaels on ABC. After the Finals, he left the broadcast booth to become the head coach of the Boston Celtics. In the summer of 2023, he was added to the lead broadcasting team for ESPN/ABC, joining Mike Breen and Doris Burke. During the semifinals of the 2023 NBA In-Season Tournament, Rivers worked with TNT commentators Kevin Harlan and Candace Parker during one game, as part of a collaboration between ESPN/ABC and TNT. In January 2024, Rivers left ESPN mid-season to become Milwaukee's head coach.""]",David Rivers and the Los Angeles Lakers faced the Detroit Pistons in the 1989 NBA Finals.,NBA Finals in 1988,0.0,0.939504478777241,0.38730158728867725,0.5,0.595150584311663,0.880602337246652
In which year was Dontae' Jones inducted into the Mississippi Sports Hall of Fame?,"[""Dontae' Antijuaine Jones (born June 2, 1975) is an American former professional basketball player, formerly of the Boston Celtics of the National Basketball Association (NBA). Jones played college basketball at Northeast Mississippi Community College where he is the Tigers' all-time leading scorer, rebounder, and shot blocker."", ""His #32 jersey has been retired by the school. After playing two seasons for the Tigers he transferred to the Mississippi State Bulldogs program to finish his college career. He was named most valuable player of the 1996 SEC men's basketball tournament after leading Mississippi State to their first SEC Tournament championship by virtue of a win over top-ranked University of Kentucky in the SEC tournament championship game. That same season he led Mississippi State to the NCAA Men's Basketball Final Four, picking up a Regional MVP honor along the way. Jones, along with his 1995–96 Bulldog teammates, was inducted into the Mississippi Sports Hall of Fame in 2016. He was selected out of Mississippi State University by the New York Knicks as the 21st overall pick in the 1996 NBA draft but was traded, along with Walter McCarty, John Thomas and Scott Brooks, to the Celtics in exchange for Chris Mills shortly before the 1997–98 NBA season began (he had previously taken part in no games in 1996–97 with the Knicks due to a foot injury). After his NBA season, Jones played for the Memphis Houn'Dawgs in the American Basketball Association (ABA), and in Greece, Turkey, Italy, Korea and China. An apostrophe was intentionally placed on the end of his first name by his mother for distinctiveness. As of November 2012 he has been working as the program director at the Nashville Youth Basketball Association (NYBA), which is designed to help all middle Tennessee-area and Nashville city youth in metro Nashville improve their basketball skills. He is a highly regarded youth coach. Career statistics from NBA.com · Basketball Reference Basketpedya.com Player Profile\n\n"", 'He was inducted as a player into the Naismith Memorial Basketball Hall of Fame on September 10, 2004, in his first year of eligibility.', ""He finished his college career as a three-time All-Ohio Valley Conference selection, a two-time honorable mention All-America and was named OVC Player of the Year in 1990 and 1991. Jones was honored as the OVC's Athlete of the Year in 1991 and 1992. He is one of only ten MSU men's basketball players to have his jersey retired; his #54 hangs in the rafters of the CFSB Center in Murray, Kentucky. Jones ranks fourth on Murray State's all-time scoring list with 2,057 points. He is also Murray State's all-time leader in rebounds with 1,374, and led the nation in that category in the 1990–91 season. He is the only men's player in Murray State history to record more than 2,000 points and 1,000 rebounds. After college, he was selected by the Houston Rockets in the second round (41st overall) of the 1992 NBA draft, but his rights were traded to the Dallas Mavericks for those of former University of Michigan center Eric Riley."", 'In 2015, he was inducted into the Ohio Basketball Hall of Fame.', 'He earned the 2012 Minnesota Boys Basketball Gatorade Player of the Year. He was the 2012 Star Tribune Metro Player of the Year in boys\' basketball as well as the Pioneer Press\' boys basketball player of the year. By the end of his sophomore season, he had an offer from Duke to go along with his earlier offers from Minnesota, Iowa State, Michigan State, Ohio State, Providence, Arizona, Baylor and Marquette. Following the season, Jones again played for Team USA at the 2012 FIBA Under-17 World Championship in Kaunas, Lithuania from June 29 – July 8, 2012. The team went undefeated in 8 games. = Jones entered his 2012–13 junior season as the national class of 2014\'s top ranked basketball player according to ESPN. Sports Illustrated columnist Frank Burlison listed him second to Jahlil Okafor on August 16, 2012. On September 11, when Okafor was named a monthly blogger for USA Today High School Sports, he noted that he and Jones wanted to attend a Michigan State Spartans football game together. Jones was one of 10 USA Today preseason All-USA selections (along with Aaron Gordon, Andrew Harrison, Aaron Harrison, Kasey Hill, Okafor, Jabari Parker, Julius Randle, Noah Vonleh, Andrew Wiggins). At the January 5, 2013, Timberwolves Shootout at the Target Center, Jones led Apple Valley on a 31–9 run to overcome an 11-point deficit with 9 minutes and 19 seconds remaining against Rashad Vaughn and Robbinsdale Cooper High School. The head-to-head matchup of class of 2014 guards Jones and Vaughn was described as ""arguably the best individual-to-individual matchup in Minnesota high school basketball history"" by the Star Tribune. Two weeks before the matchup of ESPN 100 top 10 high school players, NBA.com had anticipated the matchup with a feature story. Following his junior season, he was co-winner of the Minnesota Associated Press Player of the Year award for high school boys basketball, with DeLaSalle fellow junior Reid Travis. Jones led Apple Valley to the MSHSL Class 4A championship, while Travis led DeLaSalle to the 3A championship. They were joined on the Associated Press All-State team by Anders Broman, Rashad Vaughn and Graham Woodward. Jones earned the 2013 Minnesota Boys Basketball Gatorade Player of the Year and the Pioneer Press player of the year. However, Travis was the 2013 Star Tribune Metro Player of the Year in boys\' basketball. Following the season, Jones was selected by HighSchoolHardwood.com as one of two juniors (along with Okafor) on its first or second five selections of its 2012-13 High School Hardwood All-American teams. Stanley Johnson was the only other junior on the 20-man All-American First Team. On March 9 Jones listed his final seven schools: Baylor, Duke, Kentucky, Kansas, Michigan State, Minnesota and Ohio State.', '= Source Regular season Playoffs University of Missouri Athletics Hall of Fame inductee, 1990.', ""at the 1998 Goodwill Games. On the 1998 Goodwill Games Team, Jones started all 5 games alongside future 1999 NBA overall 1st pick Elton Brand as wells as overall 6th pick Wally Szczerbiak and 8th Andre Miller. = Declaring himself eligible for the 1999 NBA draft, he was selected by the Atlanta Hawks with the 27th overall pick, but he was immediately traded to the Philadelphia 76ers, where he spent two years. On December 30, 1999, against the Portland Trail Blazers, Jones became a part of NBA history when he scored the final basket of the 1990s and as a result he is a member of the NBA Hall of Fame. As the 76ers became the 2001 Eastern Conference champions, Jones started throughout the postseason after current starter George Lynch went down with an injury, including the 2001 NBA Finals, in which the Los Angeles Lakers defeated the 76ers in five games. Jones' best game of the 2001 NBA playoffs came in game 7 of the Eastern Conference Semis against the Vince Carter-led Toronto Raptors. Jones played 31 minutes going 6–9 from the field and tallying 16 points, 4 rebounds, and an assist. He then played two years with the Cleveland Cavaliers, before being traded to the Boston Celtics."", 'In 2018, he was named to the Maryland State Athletic Hall of Fame.', 'Dahntay Lavall Jones (born December 27, 1980) is an American professional basketball coach and former player who is an assistant coach for the Los Angeles Clippers of the National Basketball Association (NBA). He played college basketball for the Rutgers Scarlet Knights and Duke Blue Devils.']",Dontae' Jones was inducted into the Mississippi Sports Hall of Fame in 2016.,2016,0.5,0.9900044785294927,0.49999999995,1.0,0.9465150218581809,0.7860237201429647
In which game did Nik Stauskas contribute a career-high 6 assists along with 20 points?,"[""All his three-point shots came from the left corner. The 6 three-point shots pushed Stauskas to a Michigan freshman-season record total of 80, surpassing Tim Hardaway Jr.'s two-year-old record of 76. Six 3 point shots made without a miss was one shy of a conference record shared by Wolverine Glen Rice and 3 others (including David Lighty's 2011 NCAA Tournament performance). Stauskas joined McGary and Most Outstanding Player Trey Burke on the South All-Regional team. For the season, his .9 fouls per 40 minutes was second in the country. = In the offseason, Stauskas added 16 pounds (7.3 kg) to his frame and 6 inches (15.2 cm) to his vertical jump. On November 12, Stauskas posted career highs of 23 points and 5 assists in the second game of the regular season against South Carolina State. In the next game, Stauskas contributed a career-high 6 assists as well as 20 points against Iowa State on November 17. Stauskas scored a game-high 24 points on November 21 against Long Beach State in the first round of the Puerto Rico Tip-Off, surpassing his career high set two games before and giving him three consecutive 20-point performances for the first time in his career. Stauskas established another career high the next day against Florida State as he scored 26 points including 7 of the team's 13 points in overtime, despite scoring only 3 points in the first half. In the game, he set a career high with 9 made free throws and logged his fourth consecutive 20 point game. Following a Michigan timeout with 11 seconds in regulation, Stauskas made a layup to force overtime. In the championship game against Charlotte, Stauskas tallied 20 points and a career-high 3 steals. Although Michigan lost in the championship game, Stauskas earned tournament MVP honors. In the second half Stauskas twisted his ankle, but continued to play the final 9½ minutes. Stauskas sat out the November 29 game against Coppin State to rest his ankle. In the January 2 Big Ten Conference opener against Minnesota, Stauskas set a career high with 7 assists while scoring 14 points. On January 14, he had a game-high 21 points, team-high 5 assists as well as 6 rebounds against Penn State. On January 18, Stauskas scored 23 points including the final 11 for Michigan as the team defeated (#3) Wisconsin at the Kohl Center for the first time since the 1998–99 team did so, ending an 11-game losing streak at Wisconsin. On January 21, Stauskas earned his first Big Ten Conference Player of the Week recognition. At the time he was leading the conference in scoring and 20-point games. On January 22, against (#10) Iowa Stauskas tied his career high with 26 points and contributed 5 rebounds and 5 assists, helping Michigan defeat consecutive top 10 opponents for the first time since the 1996–97 team. On January 25 in the Michigan–Michigan rivalry game against the 2013–14 Spartans, Stauskas contributed 19 points and 4 assists, including a 5-for-6 effort on three-point shots. The 80–75 victory over (#3) Michigan State marked the first time in school history that the team defeated three consecutive AP Poll top ten opponents and marked the first time since the 1986–87 Iowa Hawkeyes that any team has won three consecutive games all of which were against top 10 opponents. It also gave Michigan a 7–0 Big Ten start, which is the best since the 1976–77 team won its first eight games."", ""His brother's name is Peter. Three of Stauskas's four grandparents lived in Lithuania before World War II. Stauskas previously attended Lithuanian Saturday School in Toronto and is able to understand and speak some Lithuanian. List of Canadians in the National Basketball Association Michigan Wolverines men's basketball statistical leaders Career statistics from NBA.com · Basketball Reference Michigan Wolverines bio Nik Stauskas at acb.com Nik Stauskas at draftexpress.com Nik Stauskas at eurobasket.com Nik Stauskas at euroleague.net\n\nIn the 2012–13 season, Nik Stauskas played for Michigan in 39 games. He averaged 11.0 points, 3.0 rebounds, 1.3 assists, 0.6 steals, and 0.2 blocks per game. He shot 0.463 from the field, 0.44 from 3-point range, and 0.851 from the free throw line, playing an average of 30.5 minutes per game. In the 2013–14 season, Nik Stauskas played for Michigan in 36 games. He averaged 17.5 points, 2.9 rebounds, 3.3 assists, 0.6 steals, and 0.3 blocks per game. He shot 0.47 from the field, 0.442 from 3-point range, and 0.824 from the free throw line, playing an average of 35.6 minutes per game. In the 2014–15 season, Nik Stauskas played for Sacramento in 73 games. He averaged 4.4 points, 1.2 rebounds, 0.9 assists, 0.3 steals, and 0.2 blocks per game. He shot 0.365 from the field, 0.322 from 3-point range, and 0.859 from the free throw line, playing an average of 15.4 minutes per game. In the 2015–16 season, Nik Stauskas played for Philadelphia in 73 games. He averaged 8.5 points, 2.5 rebounds, 1.9 assists, 0.6 steals, and 0.3 blocks per game. He shot 0.385 from the field, 0.326 from 3-point range, and 0.771 from the free throw line, playing an average of 24.8 minutes per game. In the 2016–17 season, Nik Stauskas played for Philadelphia in 80 games. He averaged 9.5 points, 2.8 rebounds, 2.4 assists, 0.6 steals, and 0.4 blocks per game. He shot 0.396 from the field, 0.368 from 3-point range, and 0.813 from the free throw line, playing an average of 27.4 minutes per game. In the 2017–18 season, Nik Stauskas played for Philadelphia in 6 games. He averaged 0.7 points, 0.2 rebounds, 0.2 assists, 0.7 steals, and 0.0 blocks per game. He shot 0.25 from the field, 0.0 from 3-point range, and 1.0 from the free throw line, playing an average of 7.5 minutes per game. In the 2017–18 season, Nik Stauskas played for Brooklyn in 35 games. He averaged 5.1 points, 1.8 rebounds, 1.1 assists, 0.1 steals, and 0.1 blocks per game. He shot 0.393 from the field, 0.404 from 3-point range, and 0.704 from the free throw line, playing an average of 13.7 minutes per game. In the 2018–19 season, Nik Stauskas played for Portland in 44 games. He averaged 6.1 points, 1.8 rebounds, 1.4 assists, 0.3 steals, and 0.1 blocks per game. He shot 0.419 from the field, 0.344 from 3-point range, and 0.889 from the free throw line, playing an average of 15.3 minutes per game. In the 2018–19 season, Nik Stauskas played for Cleveland in 24 games. He averaged 5.5 points, 2.0 rebounds, 0.8 assists, 0.3 steals, and 0.1 blocks per game. He shot 0.367 from the field, 0.429 from 3-point range, and 0.893 from the free throw line, playing an average of 14.3 minutes per game. In the 2021–22 season, Nik Stauskas played for Miami in 2 games. He averaged 5.5 points, 1.5 rebounds, 0.5 assists, 0.0 steals, and 0.0 blocks per game. He shot 0.375 from the field, 0.5 from 3-point range, and 0.75 from the free throw line, playing an average of 12.0 minutes per game. In the 2021–22 season, Nik Stauskas played for Boston in 6 games. He averaged 1.2 points, 0.0 rebounds, 0.2 assists, 0.0 steals, and 0.0 blocks per game. He shot 0.333 from the field, 0.333 from 3-point range, and 0.5 from the free throw line, playing an average of 2.5 minutes per game. In the 2022 season, Nik Stauskas played for Boston in 13 games. He averaged 1.0 points, 0.3 rebounds, 0.3 assists, 0.0 steals, and 0.0 blocks per game. He shot 0.25 from the field, 0.3 from 3-point range, and 1.0 from the free throw line, playing an average of 1.8 minutes per game. In the 2019–20 season, Nik Stauskas played for Baskonia in 22 games. He averaged 9.0 points, 2.1 rebounds, 1.6 assists, 0.5 steals, and 0.2 blocks per game. He shot 0.415 from the field, 0.422 from 3-point range, and 0.781 from the free throw line, playing an average of 20.5 minutes per game. In the 2012-13 season, Nik Stauskas played for Michigan in 39 games. He averaged 11.0 points, 3.0 rebounds, 1.3 assists, 0.6 steals, and 0.2 blocks per game. He shot 0.463 from the field, 0.44 from 3-point range, and 0.851 from the free throw line, playing an average of 30.5 minutes per game. In the 2013-14 season, Nik Stauskas played for Michigan in 36 games. He averaged 17.5 points, 2.9 rebounds, 3.3 assists, 0.6 steals, and 0.3 blocks per game."", 'In his first week in the league, he had a 3-block game against the Los Angeles Clippers. On December 8 in his first game against Utah and former teammate and fellow Big Ten Player of the Year Burke, Stauskas posted career highs of 15 points and 8 rebounds. Stauskas again posted 15 points against the New York Knicks and former Michigan teammate Tim Hardaway Jr.', ""It was his first and only start of the season. = On July 10, 2015, Stauskas was traded to the Philadelphia 76ers along with Carl Landry, Jason Thompson, a future first round pick, and the rights to swap first round picks in 2016 and 2017, in exchange for the rights to Artūras Gudaitis and Luka Mitrović. During the preseason, Stauskas was impaired by a right tibia stress reaction. Although he felt recovered from the stress reaction by the beginning of the season, he missed the October 28 season opener with back spasms. Stauskas debuted for the 76ers on October 30 against the Utah Jazz, scoring 12 points. Stauskas moved into the starting lineup on November 2 against the Cleveland Cavaliers. He posted a career-high-tying 15 points. On November 7, Stauskas posted a career-high 18 points and career-high tying five assists against the Orlando Magic. On December 1, Stauskas and the 76ers defeated the Los Angeles Lakers 103–91. The win ended the longest losing streak in the history of major professional sports in the United States (28 games going back to the prior season) and the worst start in NBA history (tied with the 2009–10 New Jersey Nets at 0–18). Stauskas was injured in overtime of the January 15, 2016 contest against the Chicago Bulls and missed three games before returning to the lineup on January 25 against the Boston Celtics. Stauskas established a new career high on March 18 against the Oklahoma City Thunder, scoring 23 points. After the first week of the 2016–17 NBA season, the 76ers exercised the fourth-year team option. On November 19, 2016, Stauskas scored 21 points, while shooting 8-for-9 in a 120–105 win over the Phoenix Suns. He posted a career-high 24 points on 4-for-7 three-point shooting on March 4 in a 136–106 loss to Detroit. On March 20 against Orlando and March 22 against Oklahoma City, Stauskas reached 20 points in consecutive contests for the first time in his NBA career. = On December 7, 2017, Stauskas was traded, along with Jahlil Okafor and a 2019 second round draft pick, to the Brooklyn Nets in exchange for Trevor Booker. In his debut for the Nets on December 15, 2017, Stauskas scored a team-high 22 points in a 120–87 loss to the Toronto Raptors. In his first few weeks with Brooklyn, he made 19 of his first 33 shots (57.6%) from beyond the three-point line and set a career high with 7 made three-point shots (on 7-for-10 shooting) on December 27 against the New Orleans Pelicans, which tied a Nets franchise record by a performance off the bench. = On July 5, 2018, Stauskas signed with the Portland Trail Blazers. In his debut for the Trail Blazers in their season opener on October 18, 2018, Stauskas came off the bench to score a career-high-tying 24 points in a 128–119 win over the Los Angeles Lakers. = On February 4, 2019, Stauskas was traded to the Cleveland Cavaliers along with Wade Baldwin IV and two second-round picks for Rodney Hood. Three days later, he was acquired by the Houston Rockets in a three-team trade that involved the Cavaliers and Sacramento Kings. Hours later, he was traded again, this time to the Indiana Pacers alongside Baldwin, a 2021 second-round draft pick and the rights to Maarty Leunen, in exchange for cash considerations. He was waived by the Pacers on February 8. On February 11, Stauskas signed with the Cavaliers. = On August 1, 2019, Stauskas signed a one-year deal with Spanish EuroLeague club Kirolbet Baskonia. On February 12, 2020, Baskonia and Stauskas agreed to terminate the contract. On December 3, 2020, Stauskas was signed to a training camp contract by the Milwaukee Bucks. He was waived at the end of training camp. = On January 27, 2021, Stauskas was included on the Raptors 905 roster for the 2020–21 season. = On October 16, Stauskas was signed by the Denver Nuggets, but was waived later that day. He subsequently joined the Grand Rapids Gold as an affiliate player. = On December 31, 2021, Stauskas signed a 10-day contract with the Miami Heat. = Following the expiration of his 10-day contract, Stauskas returned to the Grand Rapids Gold. On March 1, 2022, he scored a franchise-record 57 points in a 131–127 win over the Wisconsin Herd. Alongside the feat, which was the sixth-highest scoring total in NBA G League history, he logged a G League-record 38 first half points. Stauskas made his first 12 shots in the game (including a 9–9/24 point 1st quarter), marking the second-highest scoring 100% FG% quarter in league history. The 38-point first half was one point shy of the G League record for either half. The next day, Stauskas posted 43 points against the Lakeland Magic, becoming the second G League player (Russ Smith, 105 March 2016) to achieve at least 100 points in consecutive games and the first to do it on consecutive nights. Stauskas' 100-point effort coincided with the 60th anniversary of Wilt Chamberlain's 100-point game. On March 8, 2022, he was named G League Player of the Week. = On March 4, 2022, Stauskas signed a two-year contract with the Boston Celtics. Stauskas and the Celtics reached the 2022 NBA Finals, where they lost in 6 games to the Golden State Warriors. On July 9, 2022, Stauskas was traded, alongside Daniel Theis, Aaron Nesmith, Malik Fitts, Juwan Morgan and a 2023 first-round pick, to the Indiana Pacers in exchange for Malcolm Brogdon. On July 14, Stauskas was waived by the Pacers. Stauskas' G-League rights were still held by the Gold, who traded them to the College Park Skyhawks, who turned around and dealt him to the Minnesota Timberwolves. Stauskas entered training camp under contract with the Timberwolves, who assigned his rights to the Iowa Wolves. Stauskas played for Canada in the 2009 FIBA Americas Under-16 Championship held in Argentina. He helped lead the Canadian junior national team to a bronze medal, which qualified them for the 2010 FIBA Under-17 World Championship. He averaged 9.4 points per game in the tournament, including a game-high 21 points in a 126–78 loss against the United States team led by Bradley Beal and James Michael McAdoo on June 20, 2009. First overall 2013 NBA draft pick Anthony Bennett was one of Stauskas' teammates in the tournament. Stauskas was later invited to train with the Canadian senior national team."", 'His effort for the week earned a second Big Ten Player of the Week recognition on January 27. Stauskas also earned Oscar Robertson National Player of the Week recognition from United States Basketball Writers Association on January 28. He led the conference in scoring and three-point shooting percentage through January, but he only scored six points when Michigan got upset by Indiana on February 2, ending a 10-game winning streak and 8–0 Big Ten conference start. Stuaskas established another career high in assists with 8 against Nebraska on February 5 as the team posted its largest conference game margin of victory since defeating Indiana 112–64 on February 22, 1998. On February 23 against (#13/14) Michigan State, Michigan rebounded from an early 22–11 deficit to win 79–70. Stauskas led the way with 25 points on 9-for-13 shooting and with 21 coming in the second half, including 10 that took the score from a 48–43 deficit to a 53–51 lead. It marked his first game with 9 made field goals. He added 5 assists, 3 rebounds and no fouls on his way to earning his third Big Ten Player of the Week recognition on February 24. On March 4, Stauskas had 24 points, including a career-high seven three-point shots, as part of a 7-for-9 three-point effort against Illinois to help Michigan clinch its 14th and 8th outright Big Ten Conference championship. On March 8, Stauskas had a team-high 21 points to help Michigan close out its season with a season-ending 84–80 victory over Indiana. On March 10 Stauskas earned his fourth Big Ten Player of the week award (this time Co-POTW with Shavon Shields). Stauskas\'s four Player of the Week awards led the Big Ten for the season. Four B1G Player of the Week awards is a Michigan single-season record. At the end of the regular season, he was the only player in the Big Ten to rank among the top 10 for field goal percentage (48.9), three-point percentage (45.8) and free throw percentage (81.1). On March 22 against Texas in Michigan\'s second game of the 2014 NCAA Men\'s Division I Basketball Tournament, Stauskas had a career-high-tying 8 assists as well as a team-high 17 points. The 2013–14 team was eliminated in the elite eight round of the 2014 NCAA Men\'s Division I Basketball Tournament by Kentucky as Stauskas led all scorers with 24 points. Stauskas and teammate Caris LeVert joined Julius Randle, Aaron Harrison and Marcus Lee on the All-Midwest Regional team. On April 15, in a joint press conference with Robinson on the Big Ten Network, Stauskas declared for the 2014 NBA draft. During his two years with Michigan, the school enjoyed its winningest two-year stretch in school history marked by a total of 59 wins. Of Michigan\'s prior 14 early NBA draft entrants, 10 were selected in the first round and 3 in the second. Stauskas did sign with Bartelstein (along with teammate McGary). Watchlists and awards On February 13, Stauskas was one of four Big Ten players (along with Keith Appling, Gary Harris and Roy Devyn Marble) who were named to the 30-man Naismith College Player of the Year midseason watchlist. On March 8, Stauskas was one of two Big Ten players (along with Harris) listed among the 15 finalists for the John R. Wooden Award. Stauskas was a 2014 NCAA Men\'s Basketball All-American second-team selection by the Sporting News. Stauskas earned third team All-American recognition from USA Today. He was a first team All-American selection by the National Association of Basketball Coaches (NABC). He was also a second team selection by Sports Illustrated and Bleacher Report, as well as a third team selection by NBC Sports. When Stauskas was named second team All-American by the Associated Press, he became a consensus All-American. Stauskas also earned John R. Wooden Award All-American Team recognition. Stauskas was the Big Ten Conference Men\'s Basketball Player of the Year and a unanimous first-team All-Big Ten selection by both the coaches and the media, becoming Michigan\'s fifth B1G player of the year and 2nd consecutive. On March 11 Stauskas was named District V (OH, IN, IL, MI, MN, WI) Player of the Year by the United States Basketball Writers Association. Stauskas was listed on the National Association of Basketball Coaches Division I All‐District 7 first team on March 12. Stauskas was named to the 2014 Big Ten Men\'s Basketball Tournament All-Tournament Team. = Stauskas\'s career free throw percentage of 83.16% is second in Michigan history, and his 44.10% three-point shot percentage ranks fifth. = Discussion about him entering the 2014 NBA draft began when he got hot in January 2014 and his father told Sports Illustrated, ""He knows all he has to do is keep his nose to the grindstone for another couple of months, and there\'s a really good possibility he might be able to go pro."" However, a few days later, Stauskas attempted to distance himself from his father\'s statements and apologized to his fans. Following the season, Stauskas, who was regarded as a likely late first round selection, said he would need some time to process his decision and that he would make his decision after talking to his coaches and family. On April 6, Stauskas said he would make his decision within the next week or so. On April 10, reports emerged that Stauskas had decided to go pro, but he denied he had made a decision. The reports were based on rumors that Stauskas had decided to hire Mark Bartelstein as his agent. Bartelstein is the father of former Michigan teammate Josh Bartelstein, and agent for former teammate Tim Hardaway Jr. = Stauskas was drafted 8th overall by the Sacramento Kings.', ""Mark's, he was expected to be an All-State performer. In the 2011 NEPSAC Class AA Championship game, Stauskas led St. Mark's in scoring with 17 points against Nerlens Noel and the Tilton School, but St. Marks lost 72–56. On March 26, 2011, Stauskas made a verbal commitment to Michigan. This commitment made him the second member of Michigan's recruiting class of 2012. That summer, he scored 27 points in an exhibition of Canadian high school all-stars against the Baylor Bears men's basketball team. Prior to his senior year, ESPN named him as one of the top 25 three-point shooters in the national class of 2012. At the time of their November 2011 National Letter of Intent signings, Stauskas, Glenn Robinson III and Mitch McGary gave Michigan a consensus top 10 entering class for its 2012 class. Stauskas led St. Mark's to 67–57 victory in a 2012 Hoophall Classic contest with 16 points against Friends Central. As the season progressed, Stauskas (and Robinson) improved in the national player ratings to offset McGary's slide and maintain a top-rated class. He scored 19 to lead his school to a 59–53 2012 NEPSAC Class AA Championship game victory over Noel's Tilton. Stauskas earned the NEPSAC championship game MVP. He was selected to the 2012 All-NEPSAC Class AA first team (along with teammate Kaleb Tarczewski). Following these honors, Stauskas's stock and rankings continued to rise. The 2011–12 Michigan Wolverines men's basketball team had been co-champions of 2011–12 Big Ten Conference, but lost both of its co-captains, Zack Novak and Stu Douglass, to graduation and three players as transfers. The team was returning a nucleus of All-Big Ten players Trey Burke and Tim Hardaway Jr. = Stauskas began his college career with the expectation that he would be a sharpshooter based on his performance in three-point field goal drills in which he had raised the bar for the team. In the championship rounds of the 2012 NIT Season Tip-Off tournament at Madison Square Garden on November 21 and 23, Michigan defeated Pittsburgh and Kansas State, respectively, to win the tournament. On November 26, Stauskas earned Big Ten Freshman of the Week honors for his NIT tournament performance in which he averaged 12.5 points and 4.5 rebounds. On November 27, Michigan defeated its first ranked opponent of the season, NC State (#18 AP Poll/#18 Coaches' Poll), in the ACC–Big Ten Challenge with a then-career-high 20 points from Stauskas in a 79–72 victory. On December 1 against Bradley, Stauskas made his first career regular season start and posted a new career-high 22 points. For his first two 20 point performances, he repeated as Big Ten Freshman of the Week on December 3. On December 29, against Central Michigan, Stauskas posted 19 points on 5-for-8 three-point shooting. His 5 three-pointers and 7 rebounds were career-highs, earning him his third Big Ten Freshman of the Week on December 31. Entering the day of December 31, Stauskas led the nation in three-point field goal percentage. On January 16, 2013, Sporting News named Stauskas the surprise player of the first half of the year. As late as January 28, Stauskas was leading the Big Ten in free throw shooting percentage (.833) as well as three-pointers made and was second in 3-point shooting percentage (.490). On that day, Michigan was ranked number one in the AP Poll with 51 of the 65 first place votes. It marked the first time Michigan ranked atop the AP Poll since the Fab Five 1992–93 team did so on December 5, 1992. On January 31, Stauskas and Robinson were named to the Wayman Tisdale Award (USBWA National Freshman of the Year) top 12 midseason list, recognizing their performances as being among the 12 best freshman performances in the NCAA competition. Stauskas finished the 18-game 2012–13 Big Ten Conference men's basketball season schedule with a 37% three-point percentage on 30-for-81 shooting during conference play. Having made his last 20 consecutive free throws entering the 2013 NCAA Men's Division I Basketball Tournament Sweet Sixteen, Stauskas ended the season with an 85.1% (74–87) free throw shooting percentage, which was better than the Big Ten Conference free throw shooting percentage leader, Adreian Payne (84.8%). In the regional finals on March 31 against Florida, Stauskas made all 6 of his three-point shot attempts, including all 5 in the first half as the team built a 41–17 lead before going into the half up 47–30. This marked the best NCAA Tournament single-game three-point shooting percentage in school history (min 5 attempts) since no other Wolverine has shot 100% with at least 5 attempts. Michigan advanced to the April 8 national championship game where the team lost to Louisville by an 82–76 margin. His 6 three-point shots was a new career best and his 22-point performance tied his career high."", ""And he had never thrown a baseball. Until 2009, Stauskas played for Loyola Catholic Secondary School. He averaged 15 points, 5 rebounds and 5 assists in 2007–08 and 32 points, 14 rebounds and 7.5 assists in 2008–09. Stauskas also joined the premier Amateur Athletic Union (AAU) team in Toronto, run by Ro Russell. Some of Russell's prior players, such as Tristan Thompson and Cory Joseph had gone to the United States to complete their scholastic years. Stauskas spent the 2009–10 academic year at South Kent School, but he transferred to St."", ""Nikolas Tomas Stauskas (born October 7, 1993) is a Canadian former professional basketball player who played six seasons in the National Basketball Association (NBA). A shooting guard, Stauskas played two seasons of college basketball for the Michigan Wolverines from 2012 to 2014. He was drafted eighth overall in the 2014 NBA draft by the Sacramento Kings. Stauskas, whose family is of Lithuanian heritage, is a member of the Canadian national team. As a freshman for the 2012–13 Michigan Wolverines, Stauskas was named Sports Illustrated National Freshman of the Week once, Big Ten Conference Freshman of the Week three times and to the Wayman Tisdale Award, United States Basketball Writers Association's National Freshman of the Year, top 12 midseason list. During the 2013 NCAA Men's Division I Basketball Tournament, he earned South All-Regional Team recognition. As a sophomore for the 2013–14 team, Stauskas went on to be named a 2014 NCAA Men's Basketball consensus All-American and was named Big Ten Conference Men's Basketball Player of the Year for the 2013–14 Big Ten Conference men's basketball season. Stauskas has played for several NBA and NBA G League teams. In 2022, he reached the NBA Finals with the Celtics. Stauskas grew up in Mississauga, Ontario. His first experience with basketball came as a member of the Aušra Sports Club, which is a Toronto-based traveling team for children of Lithuanian descent. He became so devoted to basketball that his head coach at Michigan, John Beilein, said in 2013,He doesn't know anything about hockey, he doesn't know anything about football. The other day we had him try to throw a baseball pass as a press breaker."", ""= On July 31, 2013, Jennings was signed-and-traded to the Detroit Pistons in exchange for Brandon Knight, Khris Middleton and Viacheslav Kravtsov. He agreed to a three-year contract, reportedly worth $25 million. On December 5, 2013, Jennings returned to Milwaukee in a 105–98 win over the Bucks, finishing with 17 points and 11 assists. On January 11, 2014, in a game against the Phoenix Suns, Jennings recorded 16 assists in the first half, tying Isiah Thomas' franchise record for the most assists in a half. On January 16, 2015, Jennings scored a season-high 37 points on 10-of-23 shooting in the 98–96 win over the Indiana Pacers. Five days later, he recorded 24 points and a career-high 21 assists in the 128–118 win over the Orlando Magic, becoming the first player to record a 20-point, 20-assist game in the NBA since Steve Nash in 2009. On January 25, 2015, Jennings was ruled out for the rest of the season due to a ruptured left Achilles tendon that required surgery. On the season, he averaged 15.4 points, 6.6 assists and 1.1 steals in 41 games. On December 17, 2015, Jennings voluntarily reported to the Grand Rapids Drive, the Pistons' D-League affiliate, on a rehab assignment. In his debut with the Drive on December 19, Jennings recorded a double-double with 11 points and 12 assists in 27 minutes against the Iowa Energy. He was recalled by the Pistons the next day. On December 29, Jennings made his first appearance of the season for the Pistons, scoring seven points and adding four assists in 16 minutes off the bench against the New York Knicks. He had a season-best game in his fourth game back from injury, recording 17 points and 6 assists off the bench on January 4 in a 115–89 win over the Orlando Magic. = On February 16, 2016, Jennings was traded to the Orlando Magic, along with Ersan İlyasova, in exchange for Tobias Harris. The next day, he made his debut with the Magic in a 110–104 win over the Dallas Mavericks, recording 18 points, three rebounds and four assists in 25 minutes. = On July 8, 2016, Jennings signed with the New York Knicks. He debuted in the Knicks's season opener on October 25, 2016, against the Cleveland Cavaliers. In 21 minutes off the bench, he recorded seven points, three rebounds and five assists in a 117–88 loss. On December 11, he scored 15 of his season high-tying 19 points in the fourth quarter of the Knicks' 118–112 win over the Los Angeles Lakers. On December 31, he set a new season high with 32 points in a 129–122 loss to the Houston Rockets. On February 27, 2017, he was waived by the Knicks."", 'On November 22, he had a season-high 13 assists in a 124–118 loss to the Minnesota Timberwolves.']",Nik Stauskas contributed a career-high 6 assists along with 20 points in a game against Iowa State on November 17.,Nik Stauskas contributed a career-high 6 assists along with 20 points against Iowa State on November 17.,1.0,0.8884324175569108,0.8555555555412963,,0.7495602679805575,0.9982410719222299
Which NBA team did Gabe Vincent reach the NBA Finals with in both 2020 and 2023?,"['He represented the Nigerian team at the 2019 FIBA Basketball World Cup in China. = Regular season Playoffs = Career statistics from NBA.com · Basketball Reference NBA G League profile UC Santa Barbara Gauchos bio Archived August 27, 2019, at the Wayback Machine\n\nIn the 2019–20 season, Gabe Vincent played for Miami in 9 games. He averaged 2.4 points, 0.6 rebounds, 0.7 assists, 0.6 steals, and 0.0 blocks per game. He shot 0.216 from the field, 0.222 from 3-point range, and – from the free throw line, playing an average of 9.2 minutes per game. In the 2020–21 season, Gabe Vincent played for Miami in 50 games. He averaged 4.8 points, 1.1 rebounds, 1.3 assists, 0.4 steals, and 0.0 blocks per game. He shot 0.378 from the field, 0.309 from 3-point range, and .870 from the free throw line, playing an average of 13.1 minutes per game. In the 2021–22 season, Gabe Vincent played for Miami in 68 games. He averaged 8.7 points, 1.9 rebounds, 3.1 assists, 0.9 steals, and 0.2 blocks per game. He shot 0.417 from the field, 0.368 from 3-point range, and .815 from the free throw line, playing an average of 23.4 minutes per game. In the 2022–23 season, Gabe Vincent played for Miami in 68 games. He averaged 9.4 points, 2.1 rebounds, 2.5 assists, 0.9 steals, and 0.1 blocks per game. He shot 0.402 from the field, 0.334 from 3-point range, and .872 from the free throw line, playing an average of 25.9 minutes per game. In the 2023–24 season, Gabe Vincent played for L.A. Lakers in 11 games. He averaged 3.1 points, 0.8 rebounds, 1.9 assists, 0.8 steals, and 0.0 blocks per game. He shot 0.306 from the field, 0.107 from 3-point range, and .500 from the free throw line, playing an average of 19.8 minutes per game. In the 2024–25 season, Gabe Vincent played for L.A. Lakers in 72 games. He averaged 6.4 points, 1.3 rebounds, 1.4 assists, 0.7 steals, and 0.2 blocks per game.', 'Gabriel Nnamdi Vincent (born June 14, 1996) is an American professional basketball player for the Los Angeles Lakers of the National Basketball Association (NBA) and the Nigerian national basketball team. He played college basketball for the UC Santa Barbara Gauchos. Undrafted out of college, Vincent signed with the Stockton Kings of the NBA G League before joining the Miami Heat on a two-way contract. With Miami, he reached the NBA Finals in 2020 and 2023 before signing with the Lakers. Vincent was born in Modesto, California, to Franklyn and Cynthia Vincent.', 'He shot 0.4 from the field, 0.353 from 3-point range, and .714 from the free throw line, playing an average of 21.2 minutes per game. In the 2020 season, Gabe Vincent played for Miami in 1 games. He averaged 0.0 points, 0.0 rebounds, 0.0 assists, 0.0 steals, and 0.0 blocks per game. He shot — from the field, — from 3-point range, and — from the free throw line, playing an average of 0.3 minutes per game. In the 2021 season, Gabe Vincent played for Miami in 3 games. He averaged 1.7 points, 0.3 rebounds, 0.7 assists, 0.0 steals, and 0.0 blocks per game. He shot .667 from the field, .500 from 3-point range, and — from the free throw line, playing an average of 4.7 minutes per game. In the 2022 season, Gabe Vincent played for Miami in 18 games. He averaged 8.0 points, 1.9 rebounds, 3.2 assists, 0.8 steals, and 0.3 blocks per game. He shot .382 from the field, .309 from 3-point range, and .950 from the free throw line, playing an average of 23.5 minutes per game. In the 2023 season, Gabe Vincent played for Miami in 22 games. He averaged 12.7 points, 1.4 rebounds, 3.5 assists, 0.9 steals, and 0.2 blocks per game. He shot .402 from the field, .378 from 3-point range, and .882 from the free throw line, playing an average of 30.5 minutes per game. In the 2024 season, Gabe Vincent played for L.A. Lakers in 5 games. He averaged 1.4 points, 1.6 rebounds, 0.6 assists, 0.4 steals, and 0.0 blocks per game. He shot .250 from the field, .143 from 3-point range, and — from the free throw line, playing an average of 13.8 minutes per game. In the 2025 season, Gabe Vincent played for L.A. Lakers in 5 games. He averaged 2.8 points, 1.0 rebounds, 1.0 assists, 0.2 steals, and 0.4 blocks per game.', ""His father is Nigerian and his American mother is from Connecticut. They both earned doctorates in psychology. The youngest of three brothers, Vincent attended St. Mary's High School in Stockton. Vincent played college basketball for University of California, Santa Barbara from 2014 to 2018, averaging 12.8 points in 113 games. After his senior season, he was named to the 2018 All-Big West Second Team. = After graduating, Vincent had a pre-draft workout with the Sacramento Kings. Although he went undrafted in the 2018 NBA draft, he signed an Exhibit 10 contract with Sacramento on October 2. He was waived a few days later. He played 24 games, with three starts, for the Stockton Kings of the NBA G League during the 2018–19 season, averaging 8.8 points in 18.6 minutes per game. He scored 35 points in a game twice for the Kings in December 2019. Vincent played in 20 games (three starts) in his second season with Stockton while averaging 23.4 points, 3.8 rebounds, 2.5 assists and 1.30 steals per game and shooting 46.9 percent from the field, 41.2 percent from three-point range and 89.7 percent from the free throw line. = On January 8, 2020, the Miami Heat announced that they had signed Vincent to a two-way contract. He made his NBA debut against the Orlando Magic on January 29. In the G League, Vincent tallied 27 points, three assists and one rebound in a win over the Salt Lake City Stars on February 3. He averaged 20.9 points, 3.1 rebounds and 2.3 assists per game in 31 G League games. On June 22, 2020, the NBA G League announced that Vincent won the Most Improved Player award. The Heat reached the 2020 NBA Finals, but lost in 6 games to the Los Angeles Lakers. On August 1, 2021, Vincent joined the Heat for the NBA Summer League and five days later, he signed a standard contract with the Heat. In Game 3 of the 2023 Eastern Conference Finals, Vincent scored a playoff career-high of 29 points in a 128–102 win to give the Heat a 3–0 lead over the Boston Celtics. The Heat eventually advanced to the NBA Finals after winning the series in seven games. In Game 2 of the 2023 NBA Finals, Vincent had a team-high 23 points in a 111–108 win over the Denver Nuggets to tie the series 1–1. Vincent struggled to shoot from the 3 point line in the NBA Finals, shooting just 33% from beyond the arc. The Heat went on to lose the series in five games. = On July 6, 2023, Vincent signed with the Los Angeles Lakers. = Vincent represents the Nigerian national team, D'Tigers. On August 24, 2019, he scored 23 points against Poland, including the game-winning three-pointer with 0.3 seconds left."", 'He played in the NBA from 2021 to 2023.', ""He played two seasons for the Celtics, winning an NBA Championship ring as a reserve in 1986, before joining the Seattle SuperSonics, who promptly traded him to the Chicago Bulls for Sedale Threatt. After one-and-a-half solid seasons with the Bulls, he was selected by the Orlando Magic in the 1989 NBA expansion draft, and he finished his NBA career with the Magic in 1992. His 1990–1991 NBA Hoops basketball card has gained fame due to having Michael Jordan in view wearing a #12 jersey, instead of his normal #23. Vincent scored 3,106 points and tallied 1,543 assists during his seven-year tenure in the league. Shortly after retiring, Vincent worked at Disney's Wide World of Sports in Walt Disney World. During the late 1990s, he coached basketball in South Africa, and he has also coached in Greece, Netherlands, Nigeria, and the NBA Developmental League; he went to the league finals in the NBADL twice, winning once. At the 2004 Summer Olympics, he led the Nigerian women's basketball team to a 68–64 victory over South Korea, which was the first ever victory by an African nation in an Olympic women's basketball contest. He was coach of the Fort Worth Flyers in the 2005–06 season."", 'He is a three-time NBA All-Star, a five-time NBA All-Defensive Team honoree, and he helped the Heat reach the NBA Finals in 2020 and 2023. He also won a gold medal with the 2020 and 2024 U.S.', 'Jay Fletcher Vincent (born June 10, 1959) is an American former professional basketball player. He played college basketball for the Michigan State Spartans. Vincent was selected 24th overall by the Dallas Mavericks in the 1981 NBA draft. He played for several NBA teams, including the Dallas Mavericks, Washington Bullets, Denver Nuggets, San Antonio Spurs, Philadelphia 76ers, and Los Angeles Lakers. Vincent also played professionally in Italy. A 6\'7"" forward, Vincent played at Michigan State University under coach, Jud Heathcote, where he teamed with Magic Johnson and Greg Kelser to win the 1979 NCAA Men\'s Division I Basketball Tournament. Vincent won the Big Ten scoring championship in his junior and senior years. He was then selected by the Dallas Mavericks in the second round of the 1981 NBA draft (24th overall pick), and he went on to have a productive 9-year NBA career, playing for the Mavericks (1981–86), Washington Bullets (1986–87), Denver Nuggets (1987–89), San Antonio Spurs (1989), Philadelphia 76ers (1989–1990) and Los Angeles Lakers (1990). He concluded his NBA career in 1990 with 8,729 career points, 3,167 career rebounds, and 1,124 career assists. Vincent is the older brother of seven-year NBA player and former NBA coach Sam Vincent. In August 2010 it was revealed that an East Lansing, Michigan, company owned by Vincent was involved in a scam that defrauded about 20,000 people across the United States out of more than $2 million. On August 18, 2010, Vincent and another man were indicted by a federal grand jury on mail fraud charges stemming from conduct between 2006 and 2009. Vincent later pleaded guilty. In July 2011 he voluntarily revoked his bond and was jailed ahead of his September 2011 sentencing.', 'He was drafted 23rd overall by the Detroit Pistons in the 2002 NBA draft and went on to win a championship with the team in 2004.', 'He shot .357 from the field, .30.8 from 3-point range, and — from the free throw line, playing an average of 19.8 minutes per game. In the 2014–15 season, Gabe Vincent played for UC Santa Barbara in 28 games. He averaged 10.1 points, 2.1 rebounds, 2.1 assists, 0.9 steals, and 0.1 blocks per game. He shot 0.424 from the field, 0.416 from 3-point range, and 0.66 from the free throw line, playing an average of 26.2 minutes per game. In the 2015–16 season, Gabe Vincent played for UC Santa Barbara in 33 games. He averaged 14.1 points, 3.2 rebounds, 2.2 assists, 1.2 steals, and 0.2 blocks per game. He shot 0.406 from the field, 0.385 from 3-point range, and 0.808 from the free throw line, playing an average of 32.0 minutes per game. In the 2016–17 season, Gabe Vincent played for UC Santa Barbara in 20 games. He averaged 14.8 points, 3.7 rebounds, 2.4 assists, 0.8 steals, and 0.1 blocks per game. He shot 0.355 from the field, 0.329 from 3-point range, and 0.762 from the free throw line, playing an average of 32.0 minutes per game. In the 2017–18 season, Gabe Vincent played for UC Santa Barbara in 32 games. He averaged 12.4 points, 1.9 rebounds, 3.3 assists, 1.1 steals, and 0.2 blocks per game.']",Gabe Vincent reached the NBA Finals with the Miami Heat in both 2020 and 2023.,Miami Heat,1.0,0.9182445474698818,0.9428571428382857,1.0,0.9578283627253468,0.8313134509013871
"In what year did Doug Christie sell 1,800 copies of The Christie’s Un-Cut, a self-made comedy featuring satirical sketches of him and his wife?","[""In 2002, The New York Times published a feature story in which the Christies spoke about their marriage and committed lifestyle. As of 2002, the Christies renewed their wedding vows every year on their wedding anniversary. Christie is a devout Christian. In 2006, BET's BET J launched the reality show The Christies Committed, featuring the Christies' struggle to balance family and celebrity life. Christie has also appeared alongside his wife on the long running VH1 show Basketball Wives. In 2007, Christie sold 1,800 copies of The Christie’s Un-Cut, a self-made comedy which features the Christies in numerous satirical sketches. = Regular season Playoffs List of National Basketball Association career steals leaders List of National Basketball Association single-game steals leaders Career statistics from NBA.com · Basketball Reference\n\n"", 'He produced the short film Why Not?', 'In attendance were 200 guests including family and close friends. In 2015, Chris Webber was the executive producer for the independent romantic-drama film Somewhere in the Middle by Lanre Olabisi. Webber has also tried his hand at music production, producing Nas\'s tracks ""Surviving the Times"" from his Greatest Hits album and ""Blunt Ashes"" from Hip Hop Is Dead. In late 2016, Webber began hosting Fearless or Insane on Podcast One. In 2018, with old age makeup, he played the role of Preacher in the film Uncle Drew, which starred Kyrie Irving. In 2016, Webber began work as a professor of practice at Wake Forest University, teaching a class in sports storytelling.', 'Schrempf appeared as himself in the documentary ""Mania"" (2008).', 'As of 2024 he was continuing the two careers in parallel, performing as well as writing and releasing music. In that year, he was an ambassador for the Adelaide Fringe, as well as performing a show called Unearthed. It was so named because it focused on sharing personal moments and songs that helped him ""unearth"" who he became. The show included original songs as well as cover versions, which he sings in his tenor voice.', ""In 2015, the couple moved to a property near the coastal Western Australian town of Denmark. In December 2009 Longley, who had previously participated in marine conservation efforts, named a newly discovered shrimp species Lebbeus clarehannah after his 15-year-old daughter. His wife's sister Sophie is married to British comedian Ben Elton."", ""Martin's Griffin. ISBN 978-0-312-33618-9."", 'In 1990, he was featured in a commercial with Laker teammates A.C. Green and Mychal Thompson for the Schick brand razor company. He also appeared in American sitcoms Married...', 'ISBN 978-1-989555-83-5.', 'with Michael Arkush. Dey Street Books.']","Doug Christie sold 1,800 copies of The Christie’s Un-Cut in 2007.",2007,0.5,0.9186064372936041,0.9999999999,1.0,0.9485153519886643,0.7940614079546573
What are Rick Brunson's career statistics according to NBA.com and Basketball Reference?,"['Stats at basketball-reference.com\n\n', 'Career stats at basketball-reference.com\n\n', 'Career stats at basketball-reference.com\n\n', 'Career statistics at basketball-reference.com\n\n', 'NBA.com profile Career statistics from NBA.com · Basketball Reference\n\n', 'Basketball-Reference stats\n\n', 'Career statistics from NBA.com · Basketball Reference\n\n', 'Career statistics from NBA.com · Basketball Reference\n\n', 'Career statistics from NBA.com · Basketball Reference\n\n', 'Career statistics from NBA.com · Basketball Reference\n\n']",I don't know.,Career statistics from NBA.com · Basketball Reference 'Profile at NBA.com'.,0.0,0.0,0.0,1.0,0.745818059274583,0.7333753129455084
Which NBA teams did Shelton Jones play for during the 1988-89 season?,"['Shelton Jones (born April 4, 1966) is an American former professional basketball player who played collegiately at St. John\'s University. He was selected by the San Antonio Spurs in the second round (27th pick overall) of the 1988 NBA draft. Shelton played only one year in the NBA, during the 1988–89 season. He split the year between the Spurs, the Golden State Warriors, and the Philadelphia 76ers, for whom he also appeared in the NBA Slam Dunk Contest, finishing in 4th place after advancing to the semi-finals. After the season, he was selected by the Minnesota Timberwolves as the 16th pick in the 1989 NBA expansion draft. After his selection, he said: ""I\'m a little stunned right now. I thought I\'d be taken by Orlando because I\'d heard some things. Things like this happen. That\'s the kind of year I had. I\'ll make the best of the situation. I look forward to getting out there and meeting with the coach.', 'I don\'t even know who it is."". As it turned out, the Timberwolves waived him before the season began, and he never played in the NBA again, although he did have a long career playing in various other leagues. Jones played in the Continental Basketball Association (CBA) for the Tulsa Fast Breakers, Rapid City Thrillers, Florida Beachdogs, Oklahoma City Cavalry, Connecticut Pride and Great Lakes Storm from 1988 to 2004. He won a CBA championship with the Cavalry in 1997. He was selected as the CBA Most Valuable Player and All-Star Game Most Valuable Player and named to the All-CBA First Team in 1996. After his playing career, Jones founded the Shelton Jones Foundation, which ""trains and mentors student-athletes to become successful in life through sports, community outreach and personal development"". Career statistics from NBA.com · Basketball Reference\n\n', 'In Boston, he suffered an injury early into the season and limited his appearances. In 2004, he was sent to the Los Angeles Lakers, but only when the deal was renegotiated after Gary Payton initially refused to report to the Celtics. On October 26, 2005, Jones was traded to the Charlotte Bobcats in exchange for a future second-round draft pick. On August 31, 2006, he signed a one-year contract with the Phoenix Suns. Jones was signed as an unrestricted free agent by the New Jersey Nets on October 1, 2007, but he was waived later that month. = He signed a one-year contract with Basket Napoli on October 24, 2007. With Napoli, Jones averaged 17.9 points and 8.4 rebounds per game. On July 21, 2008, Jones signed a contract with PBC Ural Great Perm of the Russian Basketball Super League. With Ural, Jones averaged 7.4 points, 5.2 rebounds, and 1.4 assists. In July 2009, he signed a contract with Juvecaserta Basket. In July 2011, he signed with Victoria Libertas Pesaro. In 2012, he joined Bnei Herzliya of Israel. In 2013, he signed with the Mets de Guaynabo in Puerto Rico. He also had a small stint with Lebanese Basketball League powerhouse Sagesse Club Beirut. In September 2013, he signed a one-year deal with Levski Sofia. On December 3, 2014, he signed with Mexican team Titánicos de León. = Career statistics from NBA.com · Basketball Reference NBA.com profile Archived August 11, 2014, at the Wayback Machine Georgia Bulldogs biography\n\n', 'Born in St. Paul, Minnesota, his family soon moved to Compton, California, and later to Long Beach, California, so that he could play high school basketball at Long Beach Polytechnic. Jones first played college basketball with the Wichita State University (1979–1981) and helped the ""Shockers"" reach the Elite 8 in his second year. He later transferred to Cal State Fullerton to play for the ""Titans"" in 1982–1984. He entered the 1984 NBA draft and was chosen in the fourth round (90th pick overall) by the San Antonio Spurs. On 24 October 1985, he was waived by the Spurs. He later signed as a free agent with the Los Angeles Clippers on March 31, 1986, but played in only three games. After his time in the NBA, he played overseas in Italy (1986–1987) then spent the rest of his professional career playing in the Continental Basketball Association (CBA) for the Cincinnati Slammers (1986–1987), Quad City Thunder (1987–1988), Tulsa Fast Breakers (1989–1990), Tri-City Chinook (1993–1994) and Oklahoma City Cavalry (1994–1995). Jones was selected to the All-CBA Second Team and All-Defensive Team in 1990. He also participated in the USBL with two spells for the Miami Tropics in 1987 and 1988. After retiring, he operated a big and tall men\'s clothing store in Lancaster, California. On 7 September 2006, Jones was found by relatives shot dead in his apartment. He was 45 years old. According to police reports, he bled to death from a single gunshot wound to the upper torso. The investigation of this case remains open. He is buried in Forest Lawn Memorial Park in Long Beach, California. USBL Championship (1987) CBA All-Star (1990)\n\n', 'Craig Anthony Shelton (born May 1, 1957) is an American former basketball player. He played in parts of two seasons in the National Basketball Association (NBA). Shelton, a 6-foot-7-inch (201 cm) small forward from Dunbar High School in Washington, D.C., played college basketball with his high school teammate John Duren at Georgetown University from 1976 to 1980. Shelton scored 1,409 points (15.2 per game) and collected 691 rebounds (7.4 per game) during his college career. During his senior year, he was chosen for the 1979–80 All-Big East First Team and was the Most Valuable Player of the 1980 Big East tournament. After the close of his college career, Shelton was drafted in the second round of the 1980 NBA draft by the Atlanta Hawks (28th overall). He played for the Hawks during the 1980–81 NBA season and in four games of the 1981–82 season before being waived.', ""Jones played in the NBA as a small forward and shooting guard from 2003 to 2017. He won an NBA championship with the Cleveland Cavaliers in 2016. Jones grew up in Hamilton Square, New Jersey, and starred at Steinert High School in Hamilton Township, Mercer County, from 1995 to 1998. He earned a McDonald's All-America honorable mention honor as a senior after averaging 24 points and 9 rebounds per game at Steinert. After playing college basketball at Rutgers in his freshman and sophomore years, Jones transferred to Duke, where he earned All-ACC Honorable Mention honors in 2002 after averaging 11.2 points, 4.2 rebounds and 1.1 assists as a junior. In his senior season, he played 33 games, averaging 17.7 points, 5.5 rebounds and 1.2 steals per game. = Jones was selected by the Boston Celtics with the 20th overall pick in the 2003 NBA draft, and his rights were later traded, along with the rights to Troy Bell, to the Memphis Grizzlies for the rights to Kendrick Perkins and Marcus Banks. On November 21, 2003, he made his professional debut in a 98–97 win over the Seattle SuperSonics, recording one rebound, one assist and two blocks in eight minutes off the bench. In four professional seasons for the Grizzlies, Jones averaged 5.0 points per game. = On September 27, 2007, Jones signed with the Boston Celtics. However, he was later waived by the Celtics on October 25. On December 10, he signed with the Sacramento Kings. Four days later, he made his debut with the Kings in a 109–99 win over the Philadelphia 76ers, recording one assist and two steals in seven minutes off the bench. On February 16, 2008, he was waived by the Kings. = On March 21, 2008, Jones was acquired by the Fort Wayne Mad Ants of the NBA Development League. That night, he made his debut for the Mad Ants in a 125–102 loss to the Dakota Wizards, recording 18 points in 31 minutes. = On July 30, 2008, Jones signed with the Denver Nuggets. On October 29, he made his debut for the Nuggets in a 98–94 loss to the Utah Jazz, recording three points, three rebounds and one steal in 14 minutes off the bench. The Nuggets went on to reach the Western Conference Finals but were defeated 4 games to 2 by the Los Angeles Lakers. = On July 14, 2009, Jones signed a four-year deal with the Indiana Pacers. On October 28, he made his debut for the Pacers in a 120–109 loss to the Atlanta Hawks, recording 17 points and five rebounds in 26 minutes. = On July 12, 2012, Jones was traded, along with Darren Collison, to the Dallas Mavericks in exchange for Ian Mahinmi. On October 30, he made his debut for the Mavericks in a 99–91 win over the Los Angeles Lakers. = On February 21, 2013, Jones was traded to the Atlanta Hawks in exchange for Anthony Morrow. The next day, he made his debut for the Hawks in a 122–108 win over the Sacramento Kings. On September 27, 2013, Jones signed with the Chicago Bulls. However, he was later waived by the Bulls on October 8, 2013. Jones did not play for the 2013–14 season. = On September 25, 2014, Jones signed with the Utah Jazz. However, he was later waived by the Jazz on October 22, 2014. On November 26, 2014, Jones was reacquired by the Fort Wayne Mad Ants. Two days later, he made his season debut in a 124–115 loss to the Delaware 87ers, recording 14 points, one rebound, three assists, one steal and one block in 19 minutes off the bench. = On January 14, 2015, Jones signed a 10-day contract with the Los Angeles Clippers. Two days later, he made his debut for the Clippers in a 126–121 loss to the Cleveland Cavaliers. On January 24, he signed a second 10-day contract with the Clippers. On February 3, he signed with the Clippers for the rest of the season. On March 9, the league fined Jones $10,000 for bumping Draymond Green of the Golden State Warriors during a postgame interview following the previous night's Warriors win over the Clippers. Jones denied that the bump was intentional. = On September 10, 2015, Jones signed with the Brooklyn Nets. However, he was later waived by the Nets on October 26 after appearing in four preseason games. On December 4, he was acquired by the Grand Rapids Drive of the NBA Development League. The next day, he made his debut for the Drive in a 128–99 win over Raptors 905, recording 13 points, two rebounds, one assist, one steal and one block in 20 minutes off the bench. = On April 13, 2016, Jones signed with the Cleveland Cavaliers. That night, he made his debut for the Cavaliers in a 112–110 loss to the Detroit Pistons, recording 13 points, five rebounds, two assists, one steal and two blocks in 42 minutes off the bench. On May 22, he was suspended for Game 4 of the Eastern Conference Finals for striking Toronto Raptors' center Bismack Biyombo in the groin during the final possession of Game 3. The Cavaliers went on to win the series in six games and advanced to the 2016 NBA Finals. Jones saw some early minutes in Game 6 of the NBA Finals after several teammates were in foul trouble. He finished Game 6 with five points, one rebound and one block. The Cavaliers came back from a 3–1 deficit to win the series in seven games, as Jones won his first NBA championship. Jones was waived by the Cavaliers on July 30, 2016, then re-signed on September 26, waived again on October 24, and re-signed yet again on April 12, 2017. Jones played three minutes at the end of the Cavaliers' 116–105 Game 1 Eastern Conference semifinals win over the Raptors on May 1 and picked up back-to-back technical fouls for talking trash to Toronto's Norman Powell, which earned him an ejection with 18.7 seconds remaining. The technicals came with a $3,000 fine attached to each of them, but due to earning only $9,127 in salary with the team for the postseason run—the veteran's minimum—teammate LeBron James covered the fine. The Cavaliers went 12–1 over the first three rounds of the playoffs to reach the NBA Finals for a third straight season."", 'He played in the National Basketball Association (NBA) from 1981 to 1987.', 'He played his college basketball at Daytona State College for two seasons (2002–2004) and then at the University of South Florida for another two seasons (2004–2006). He was then selected by the Atlanta Hawks with the 33rd overall pick in the 2006 NBA draft. As a rookie, he played in 58 games for the Atlanta Hawks. He averaged 3.3 points a game and 2.3 rebounds a game in 11.5 minutes. After three seasons with the Atlanta Hawks, he signed a two-year deal with the Indiana Pacers. On January 3, 2012, he signed with the Los Angeles Clippers, but he was later waived on February 7. On February 15, 2012, he signed a 10-day contract with the New Orleans Hornets. On February 27, 2012, he signed a second 10-day contract with the Hornets. In September 2012, Jones signed with the Phoenix Suns. On October 24, 2012, Jones was waived by the Suns. In January 2013, he joined the Liaoning Flying Leopards of the Chinese Basketball Association. On April 12, 2013, Jones signed with the New York Knicks. He was later waived by the Knicks on April 15, 2013. In September 2013, he signed with the Orlando Magic. On January 4, 2014, he was waived by the Magic. On February 10, 2014, Jones was acquired by the Erie BayHawks of the NBA D-League. On May 8, 2014, he signed with Changsha Bank Guangdong (a.k.a. Dongguan Snowwolf) of the Chinese National Basketball League. On September 26, 2015, Jones signed with the Chicago Bulls.', ""After playing professionally in Europe for a season, he played for the Mavericks for three seasons until being traded to the Toronto Raptors for Riley's former Michigan Wolverines teammate, shooting guard Jimmy King. In 1998, Jones, Kenny Anderson, and Žan Tabak were traded to the Boston Celtics for Roy Rogers, Dee Brown, Chauncey Billups, and John Thomas. The following year, Jones was traded with Ron Mercer and Dwayne Schintzius to the Denver Nuggets for Eric Washington, Danny Fortson and Eric Williams. During the 2000 offseason, Jones was traded with a 2002 second-round draft pick to the Washington Wizards for Tracy Murray. He had a second stint with the Mavericks during the 2002–03 season, but played in only 26 of 82 games. The following year, Jones was acquired alongside Nick Van Exel, Antoine Rigaudeau, Avery Johnson, and Evan Eschmeyer by the Golden State Warriors in a blockbuster trade for Danny Fortson, Antawn Jamison, Jiří Welsch and Chris Mills. This trade marked the second time Fortson and Jones were traded for each other. In 2004, the Warriors waived Jones, effectively ending his career. In a game on March 10, 1994, Jones collected 12 offensive rebounds without a single defensive rebound. The 12 offensive boards without recording a defensive rebound stands as an NBA record since the league started tracking the category in 1973–74. His best season was in 1995–96 with the Mavericks when he averaged 11.3 points and 10.8 rebounds per game while making 14 of 39 three-point attempts, after averaging 10.3 points and 10.6 rebounds the previous year. He holds NBA career per game averages of 7.0 points and 7.4 rebounds. He once secured 28 rebounds in a single game for the Mavericks in the 1995–96 season, still a team record. Following his 11-year career year in the NBA, Jones decided to pursue coaching professional basketball. He first worked as a player development coach with the Dallas Mavericks. After spending the 2007–08 through the 2009–10 season with the Mavericks, he earned a coaching job with the New Jersey / Brooklyn Nets as an assistant coach. On August 14, 2013, he was hired as an assistant coach for the Indiana Pacers. Jones worked with All-Stars like Roy Hibbert and Paul George, and reached the Eastern Conference Finals his first two years with the team. On November 9, 2020, the Philadelphia 76ers hired Jones as an assistant coach under Doc Rivers. On August 23, 2021, the Denver Nuggets announced that they had hired Jones as assistant coach. Jones won his first NBA championship when the Nuggets defeated the Miami Heat in the 2023 NBA Finals. On May 30, 2025, it was announced that Jones and the Nuggets would be parting ways. Jones and his wife Amy have three sons. The two youngest, Seth and Caleb, are professional ice hockey players. During Jones's tenure with the Denver Nuggets, he approached Joe Sakic of the Colorado Avalanche about his son playing ice hockey."", ""at the 1998 Goodwill Games. On the 1998 Goodwill Games Team, Jones started all 5 games alongside future 1999 NBA overall 1st pick Elton Brand as wells as overall 6th pick Wally Szczerbiak and 8th Andre Miller. = Declaring himself eligible for the 1999 NBA draft, he was selected by the Atlanta Hawks with the 27th overall pick, but he was immediately traded to the Philadelphia 76ers, where he spent two years. On December 30, 1999, against the Portland Trail Blazers, Jones became a part of NBA history when he scored the final basket of the 1990s and as a result he is a member of the NBA Hall of Fame. As the 76ers became the 2001 Eastern Conference champions, Jones started throughout the postseason after current starter George Lynch went down with an injury, including the 2001 NBA Finals, in which the Los Angeles Lakers defeated the 76ers in five games. Jones' best game of the 2001 NBA playoffs came in game 7 of the Eastern Conference Semis against the Vince Carter-led Toronto Raptors. Jones played 31 minutes going 6–9 from the field and tallying 16 points, 4 rebounds, and an assist. He then played two years with the Cleveland Cavaliers, before being traded to the Boston Celtics.""]","During the 1988-89 season, Shelton Jones played for the San Antonio Spurs, the Golden State Warriors, and the Philadelphia 76ers.","Shelton Jones played for the San Antonio Spurs, the Golden State Warriors, and the Philadelphia 76ers during the 1988-89 NBA season.",1.0,0.9849115818316169,0.99999999998,1.0,0.9967799116910311,0.9871264096889424
In which year did Garrett Temple score a career-high 30 points in a game for the Memphis Grizzlies?,"['On January 5, 2015, he recorded career highs of 19 points and 14 rebounds in a 105–83 loss to the Memphis Grizzlies.', 'He shot .273 from the field, .143 from 3-point range, and .700 from the free throw line, playing an average of 10.5 minutes per game. In the 2020 season, Garrett Temple played for Brooklyn in 4 games. He averaged 12.0 points, 2.8 rebounds, 2.0 assists, 0.8 steals, and 0.3 blocks per game. He shot .347 from the field, .250 from 3-point range, and .833 from the free throw line, playing an average of 34.3 minutes per game. In the 2022 season, Garrett Temple played for New Orleans in 1 games. He averaged 0.0 points, 1.0 rebounds, 0.0 assists, 0.0 steals, and 0.0 blocks per game.', 'On 6 December he had season bests of 23 points and 17 rebounds in a 96–91 loss to the Memphis Grizzlies. He had a second 23-point game on 8 December against the New Orleans Pelicans, and a third 23-point game on 30 December against the Denver Nuggets—both resulting in wins.', '= Temple is a member of the ""Starting Five,"" along with Malcolm Brogdon, Joe Harris, Justin Anderson and Anthony Tolliver. Their goal was to raise $225,000 through Hoops2O, founded by Brogdon, to fund five wells in East Africa by the end of the 2018–19 season. By February 2020, the charity had funded the construction of ten wells in Tanzania and Kenya, bringing water to over 52,000 citizens. Career statistics from NBA.com · Basketball Reference\n\nIn the 2009–10 season, Garrett Temple played for Houston in 9 games. He averaged 5.0 points, 1.6 rebounds, 0.8 assists, 0.4 steals, and 0.4 blocks per game. He shot 0.448 from the field, 0.25 from 3-point range, and 0.667 from the free throw line, playing an average of 13.1 minutes per game. In the 2009–10 season, Garrett Temple played for Sacramento in 5 games. He averaged 2.2 points, 0.6 rebounds, 0.4 assists, 0.2 steals, and 0.0 blocks per game. He shot 0.375 from the field, 0.0 from 3-point range, and 1.0 from the free throw line, playing an average of 4.6 minutes per game. In the 2009–10 season, Garrett Temple played for San Antonio in 13 games. He averaged 6.2 points, 1.1 rebounds, 0.9 assists, 0.6 steals, and 0.2 blocks per game. He shot 0.438 from the field, 0.435 from 3-point range, and 0.667 from the free throw line, playing an average of 14.9 minutes per game. In the 2010–11 season, Garrett Temple played for San Antonio in 3 games. He averaged 0.7 points, 0.7 rebounds, 0.7 assists, 0.3 steals, and 0.3 blocks per game. He shot 0.2 from the field, 0.0 from 3-point range, and 0.0 from the free throw line, playing an average of 6.8 minutes per game. In the 2010–11 season, Garrett Temple played for Milwaukee in 9 games. He averaged 1.9 points, 0.7 rebounds, 0.7 assists, 0.1 steals, and 0.1 blocks per game. He shot 0.333 from the field, 0.3 from 3-point range, and 0.0 from the free throw line, playing an average of 9.3 minutes per game. In the 2010–11 season, Garrett Temple played for Charlotte in 12 games. He averaged 3.2 points, 1.3 rebounds, 2.0 assists, 0.8 steals, and 0.3 blocks per game. He shot 0.286 from the field, 0.269 from 3-point range, and 0.636 from the free throw line, playing an average of 10.5 minutes per game. In the 2012–13 season, Garrett Temple played for Washington in 51 games. He averaged 5.1 points, 2.4 rebounds, 2.3 assists, 1.0 steals, and 0.3 blocks per game. He shot 0.407 from the field, 0.325 from 3-point range, and 0.703 from the free throw line, playing an average of 22.7 minutes per game. In the 2013–14 season, Garrett Temple played for Washington in 75 games. He averaged 1.8 points, 0.9 rebounds, 1.0 assists, 0.5 steals, and 0.1 blocks per game. He shot 0.362 from the field, 0.207 from 3-point range, and 0.698 from the free throw line, playing an average of 8.5 minutes per game. In the 2014–15 season, Garrett Temple played for Washington in 52 games. He averaged 3.9 points, 1.7 rebounds, 1.1 assists, 0.8 steals, and 0.2 blocks per game. He shot 0.4 from the field, 0.375 from 3-point range, and 0.729 from the free throw line, playing an average of 14.1 minutes per game. In the 2015–16 season, Garrett Temple played for Washington in 80 games. He averaged 7.3 points, 2.7 rebounds, 1.8 assists, 0.9 steals, and 0.2 blocks per game. He shot 0.398 from the field, 0.345 from 3-point range, and 0.728 from the free throw line, playing an average of 24.4 minutes per game. In the 2016–17 season, Garrett Temple played for Sacramento in 65 games. He averaged 7.8 points, 2.8 rebounds, 2.6 assists, 1.3 steals, and 0.4 blocks per game. He shot 0.424 from the field, 0.373 from 3-point range, and 0.784 from the free throw line, playing an average of 26.6 minutes per game. In the 2017–18 season, Garrett Temple played for Sacramento in 65 games. He averaged 8.4 points, 2.3 rebounds, 1.9 assists, 0.9 steals, and 0.4 blocks per game. He shot 0.418 from the field, 0.392 from 3-point range, and 0.769 from the free throw line, playing an average of 24.8 minutes per game. In the 2018–19 season, Garrett Temple played for Memphis in 49 games. He averaged 9.4 points, 3.1 rebounds, 1.4 assists, 1.0 steals, and 0.5 blocks per game. He shot 0.429 from the field, 0.352 from 3-point range, and 0.75 from the free throw line, playing an average of 31.2 minutes per game. In the 2018–19 season, Garrett Temple played for L.A. Clippers in 26 games.', 'That season, he recorded his second triple double with 28 points, 13 rebounds, and 10 blocks vs. Memphis (in 1997, he recorded 24/23/10 vs.', 'He shot 0.396 from the field, 0.296 from 3-point range, and 0.742 from the free throw line, playing an average of 19.6 minutes per game. In the 2019–20 season, Garrett Temple played for Brooklyn in 62 games. He averaged 10.3 points, 3.5 rebounds, 2.5 assists, 0.8 steals, and 0.5 blocks per game. He shot 0.378 from the field, 0.329 from 3-point range, and 0.805 from the free throw line, playing an average of 27.9 minutes per game. In the 2020–21 season, Garrett Temple played for Chicago in 56 games. He averaged 7.6 points, 2.9 rebounds, 2.2 assists, 0.8 steals, and 0.5 blocks per game. He shot 0.415 from the field, 0.335 from 3-point range, and 0.8 from the free throw line, playing an average of 27.3 minutes per game. In the 2021–22 season, Garrett Temple played for New Orleans in 59 games. He averaged 5.2 points, 2.4 rebounds, 1.3 assists, 0.7 steals, and 0.4 blocks per game. He shot 0.376 from the field, 0.319 from 3-point range, and 0.683 from the free throw line, playing an average of 18.6 minutes per game. In the 2022–23 season, Garrett Temple played for New Orleans in 25 games. He averaged 2.0 points, 0.7 rebounds, 0.5 assists, 0.4 steals, and 0.1 blocks per game. He shot 0.4 from the field, 0.423 from 3-point range, and 0.75 from the free throw line, playing an average of 6.5 minutes per game. In the 2023–24 season, Garrett Temple played for Toronto in 27 games. He averaged 3.3 points, 1.7 rebounds, 1.0 assists, 0.4 steals, and 0.1 blocks per game. He shot 0.372 from the field, 0.3 from 3-point range, and 0.818 from the free throw line, playing an average of 10.7 minutes per game. In the 2024–25 season, Garrett Temple played for Toronto in 28 games. He averaged 1.9 points, 1.0 rebounds, 1.1 assists, 0.6 steals, and 0.1 blocks per game. He shot 0.3 from the field, 0.214 from 3-point range, and 0.917 from the free throw line, playing an average of 8.1 minutes per game. In the 2010 season, Garrett Temple played for San Antonio in 6 games. He averaged 0.7 points, 0.3 rebounds, 0.3 assists, 0.2 steals, and 0.0 blocks per game. He shot .333 from the field, .333 from 3-point range, and 1.000 from the free throw line, playing an average of 2.5 minutes per game. In the 2014 season, Garrett Temple played for Washington in 10 games. He averaged 0.5 points, 0.0 rebounds, 0.0 assists, 0.0 steals, and 0.0 blocks per game. He shot 1.000 from the field, 1.000 from 3-point range, and – from the free throw line, playing an average of 0.9 minutes per game. In the 2015 season, Garrett Temple played for Washington in 4 games. He averaged 1.8 points, 0.8 rebounds, 0.3 assists, 0.5 steals, and 0.0 blocks per game. He shot .167 from the field, .000 from 3-point range, and .625 from the free throw line, playing an average of 6.5 minutes per game. In the 2019 season, Garrett Temple played for L.A. Clippers in 6 games.', ""On January 30, 2019, he recorded 19 points and a career-high 12 assists in a 99–97 overtime win over the Memphis Grizzlies. It was his first double-double since November 7, 2015, and just the fifth of his career. = Regular season Playoffs = = 2007 First-team Parade All-American Named to the 2007 USA Basketball Junior National Select Team Named to the 2006 USA Men's U18 National Team which went on to win a gold medal in the FIBA World Championship Four-time Arizona Republic All-Arizona team selection (2004, 2005, 2006 and 2007) 2006 Fourth-team Parade All-American Ranked as the No. 9 overall recruit and the No."", ""In his NBA debut game with the Memphis Grizzlies, he scored 29 points. As of the 2023–2024 season, Giriček's 29-point debut marks the highest-scoring debut by any NBA player since 1996. He played a total of 49 regular season games for the Memphis Grizzlies, averaging 11.2 points per game. = On February 19, 2003, day before trade deadline, he was traded by Memphis, with Drew Gooden, to the Orlando Magic for Mike Miller, Ryan Humphrey, a future first-round draft pick and a future second-round draft pick. He ended that season on the NBA's All-Rookie second team. = On February 19, 2004, Giricek was traded by the Orlando Magic to the Utah Jazz for DeShawn Stevenson and a future second-round draft pick. He scored a career-high 33 points against the Phoenix Suns on March 12, 2004."", ""He was the only player in the league with at least 1,300 points, 600 rebounds, and 300 assists. 2015–16 season: Contract extension On July 13, 2015, Gasol re-signed with the Grizzlies on a five-year maximum contract worth an estimated $110 million. On November 20, he recorded his first career triple-double with 16 points, 11 rebounds, and 11 assists in a 96–84 win over the Houston Rockets, marking the first triple-double for Memphis since 2007 when his brother Pau recorded 17 points, 13 rebounds, and 12 assists. Gasol set a new career low for games played with 52 after missing the second half of the season with a broken right foot. 2016–17 season: Career high in scoring On December 5, 2016, Gasol recorded his second career triple-double with 28 points, 11 rebounds, and 11 assists in a 110–108 double-overtime win over the New Orleans Pelicans. On December 12, he was named Western Conference Player of the Week for games played December 5–11. It marked his second career Player of the Week award and the ninth time a Grizzlies player has won the weekly accolade. On January 25, 2017, he scored a career-high 42 points in a 101–99 win over the Toronto Raptors. A day later, he was named an NBA All-Star for the third time in his career. On March 16, 2017, he recorded his third career triple-double with 18 points, 10 rebounds, and 10 assists in a 103–91 win over the Atlanta Hawks. 2017–18 season: 10,000 points On December 2, 2017, Gasol passed 10,000 career points with 27 points in a 116–111 loss to the Cleveland Cavaliers. On January 26, 2018, Gasol recorded his fourth career triple-double with 13 points, 12 rebounds, and 10 assists in a 109–100 loss to the Los Angeles Clippers. In February 2018, Gasol played his 700th career NBA game and made his 689th start, surpassing Mike Conley Jr. for the most games started in franchise history. 2018–19 season: Final season in Memphis In November 2018, Gasol passed Zach Randolph (5,612) to become the Grizzlies' all-time career rebound leader. In December, Gasol made at least one 3-pointer in 13 consecutive games, which tied a career-high. He set a new record in the first game of January, making a 3-pointer in his 14th straight game on January 2 against the Detroit Pistons."", 'He scored a career-high 28 points on November 21, 2005, against Arkansas. Gay led the Huskies to a 30–3 record and finished his college career with 20 points and six rebounds in a career-high 42 minutes in an NCAA Elite Eight loss to George Mason on March 26. On April 24, 2006, Gay declared for the 2006 NBA draft. In February 2012, Gay was inducted into the ""Huskies of Honor"". = Gay was selected with the eighth overall pick in the 2006 NBA draft by the Houston Rockets, who then traded him and Stromile Swift to the Memphis Grizzlies in exchange for Shane Battier on July 12. Gay immediately signed his rookie scale contract with the Grizzlies upon being acquired by the team. Gay averaged 10.8 points, 4.5 rebounds, and 27.0 minutes in 78 games (43 starts) as a rookie. He earned NBA Rookie of the Month honors for November 2006, and went on to be selected to the 2006–07 All-Rookie First Team after placing fourth among first-year players in scoring, sixth in rebounding, fifth in steals (0.91), third in blocks (0.95), and fourth in minutes. He also finished third in the balloting for the 2006–07 Rookie of the Year Award behind winner Brandon Roy and runner-up Andrea Bargnani. In 2007–08, Gay\'s second season, he set a Grizzlies\' franchise record for points in a single season (1,632) and established a career-high for scoring average (20.1 points), becoming just the third player in franchise history to average 20 points per game (behind only Shareef Abdur-Rahim and Pau Gasol). He participated in the 2008 Rising Stars Slam Dunk Contest, and finished runner-up to Hedo Türkoğlu for the 2007–08 NBA Most Improved Player Award. After his invitation to the 2008 Slam Dunk Contest, Gay and YouTube teamed up for the Rudy Gay Slam Dunk Contest promotion, in which he asked fans to upload footage of their best dunks for him to attempt during the contest. During the contest, he performed a one-handed reverse clutch dunk in the first round, and during the second round, teammate Kyle Lowry alley-ooped the ball off the bar and from behind the backboard; Gay regathered and pulled off a windmill dunk. He ended with a score of 85 but did not advance to the second round. In 2008–09, Gay recorded 18.9 points, 5.5 rebounds, 1.24 steals and 37.3 minutes in 79 games (78 starts). He made a baseline jumper as time expired in Memphis\' home opener on October 31 against the Orlando Magic, giving the organization its first home-opening win since the 2000–01 season. On December 13, 2009, Gay scored a career-high 41 points against the Miami Heat, tying Mike Miller\'s franchise record for points in a win. In 2009–10, he ranked second on the team in scoring (19.6 points) in 39.7 minutes in 80 games (all starts).']",I don't know.,"Garrett Temple scored a career-high 30 points in a game for the Memphis Grizzlies on October 19, 2018.",0.0,0.0,0.249999999975,0.0,0.5580294793979821,0.7321179175919285
What was Scott Machado's field goal percentage during the season mentioned in the passage?,"['In April 2022, he re-injured his heel and missed the rest of the season. He parted ways with the Taipans in June 2022. = On June 11, 2022, Machado signed with Hapoel Eilat of the Israeli Basketball Premier League. On December 7, 2022, he signed with Avtodor Saratov of the VTB United League. In 2018, Machado debuted for the Brazilian national team during the FIBA World Cup Americas qualifiers. He averaged 8.3 points, 3.3 rebounds and 3.5 assists in four games. = Regular season Playoffs Machado is the son of Brazilian parents Luiz and Solenir Machado. As a child, Machado started referring to himself by his middle name ""Scott"" instead of his birth name ""Michael"" after his childhood favorite team, the New York Knicks, were constantly beaten in the playoffs by Michael Jordan and the Chicago Bulls. List of NCAA Division I men\'s basketball career assists leaders List of NCAA Division I men\'s basketball season assists leaders Career statistics from NBA.com · Basketball Reference Iona Gaels bio FIBA profile\n\nIn the 2012–13 season, Scott Machado played for Houston in 6 games. He averaged 1.3 points, 0.2 rebounds, 1.0 assists, 0.3 steals, and 0.0 blocks per game. He shot 0.5 from the field, 0.0 from 3-point range, and 1.0 from the free throw line, playing an average of 3.5 minutes per game. In the 2018–19 season, Scott Machado played for LA Lakers in 4 games. He averaged 2.5 points, 0.0 rebounds, 0.8 assists, 0.3 steals, and 0.0 blocks per game. He shot 0.667 from the field, 1.0 from 3-point range, and 1.0 from the free throw line, playing an average of 4.8 minutes per game. In the 2013 season, Scott Machado played for Golden State in 5 games. He averaged 0.6 points, 0.2 rebounds, 0.2 assists, 0.0 steals, and 0.0 blocks per game.', 'He shot .543 for field goal percentage, and almost .800 from the free throw line.', ""Michael Scott Machado (born June 8, 1990) is an American-Brazilian professional basketball player for Minas Clube of Novo Basquete Brasil (NBB). He played college basketball for the Iona Gaels and represents the Brazilian national team. Machado played for three years at St. Mary's High School in Manhasset, New York, where he was teammates with future NBA player Danny Green. He transferred to Saint Benedict's Preparatory School for his senior year, where he played for Hall of Fame coach Bob Hurley's son, Danny. As a freshman at Iona, Machado led the Gaels in points scored (288, a 9.2 per game average), set a school record for assists by a freshman (150) and was named the Metro Atlantic Athletic Conference rookie of the year. As a sophomore, he averaged 12.5 points and 3.9 assists, leading the Gaels to a 21-win season. He was selected second team All-Conference. As a junior, Machado broke out, averaging 13.2 points and 7.6 assists per game (second in the nation). He set a school record for assists in a season (281) and was named first team all-conference. As a senior, Machado broke the school record for assists in the first game of the season and broke Siena's Ronald Moore's MAAC record in a February 18 game against Nevada. After emerging as one of the top point guards in the country, he was named a finalist for the Bob Cousy Award and the Wooden Award. = After going undrafted in the 2012 NBA draft, Machado joined the Houston Rockets for the 2012 NBA Summer League. In five games, he averaged 8.0 points, 5.6 assists and 2.2 rebounds per game. On September 7, 2012, he signed with the Rockets. On November 14, 2012, Machado was assigned to the Rio Grande Valley Vipers of the NBA Development League. On November 26, 2012, he was recalled by the Rockets. Two days later, he made his NBA debut with the Rockets, recording two points and one assist in a 98–120 loss to the Oklahoma City Thunder. On November 30, 2012, he was reassigned to the Vipers. On December 22, 2012, he was recalled by the Rockets. On January 7, 2013, he was waived by the Rockets. On January 29, 2013, Machado was acquired by the Vipers. On March 8, 2013, he was traded to the Santa Cruz Warriors in exchange for Chris Daniels and a second-round draft pick. On April 7, 2013, Machado signed a 10-day contract with the Golden State Warriors. The next day, he was assigned back to Santa Cruz. On April 17, 2013, he signed with Golden State for the rest of the season. Machado stayed with the Santa Cruz Warriors for the team's D-League playoff run until Santa Cruz lost the best-of-three 2013 NBA D-League Finals series to the Rio Grande Valley Vipers on April 26. Two days later, he returned to Golden State and made his debut in Game 4 of the Warriors' first-round series against the Denver Nuggets, recording two points and one rebound in the Warriors' 115–101 victory. = In July 2013, Machado joined the Golden State Warriors for the 2013 NBA Summer League. On July 24, 2013, he was waived by the Warriors. On September 26, 2013, he signed with the Utah Jazz. However, he was later waived by the Jazz on October 26, 2013. On January 14, 2014, he was re-acquired by the Santa Cruz Warriors. On February 26, 2014, he was traded to the Idaho Stampede. On April 7, 2014, he signed with ASVEL Basket of France for the rest of the 2013–14 LNB Pro A season. = In July 2014, Machado joined the Toronto Raptors for the 2014 NBA Summer League. On September 3, 2014, he signed with BC Kalev/Cramo of Estonia for the 2014–15 season. = On July 24, 2015, Machado signed with EWE Baskets Oldenburg of Germany for the 2015–16 season. = On August 7, 2016, Machado signed with Rasta Vechta of Germany for the 2016–17 season. On December 5, 2016, he parted ways with Vechta. Eight days later, he signed with Spanish club ICL Manresa for the rest of the 2016–17 ACB season. In its second game in Spain, its first at home, Machado scored a winning layup against Movistar Estudiantes. = In October 2017, Machado joined the South Bay Lakers of the NBA G League. In 46 games (22 starts), he averaged 15.9 points (.450 FG%, .405 3P%), 8.7 assists, 3.8 rebounds and 1.0 steals in 31.4 minutes per game. = On October 12, 2018, Machado signed with the Los Angeles Lakers, but was waived a day later. He subsequently signed with the Lakers' G League affiliate, the South Bay Lakers. On March 21, 2019, Machado signed a 10-day contract with the Los Angeles Lakers. He had a career high 7 points and 3 assists on March 27 against the Utah Jazz. = On August 9, 2019, Machado signed with the Cairns Taipans in Australia for the 2019–20 NBL season. He finished the season with averages of 16.6 points, 7.7 assists and 3.9 rebounds across his 31 games."", 'In his freshman season, Jerry boasted a 54.5 field goal and 81.6 free throw percentage.', 'He also recorded a career high field goal attempts and made field goals.', 'He shot 0.512 from the field, 0.395 from 3-point range, and 0.818 from the free throw line, playing an average of — minutes per game.', 'He shot 0.512 from the field, 0.522 from 3-point range, and 0.825 from the free throw line, playing an average of 35.7 minutes per game.', 'He shot 0.591 from the field, .273 from 3-point range, and 0.826 from the free throw line, playing an average of 22.3 minutes per game.', 'He shot 0.553 from the field, – from 3-point range, and 0.808 from the free throw line, playing an average of 28.2 minutes per game.', 'He shot 0.592 from the field, .575 from 3-point range, and 0.719 from the free throw line, playing an average of — minutes per game.']",Scott Machado's field goal percentage during the season mentioned in the passage was .543.,0.5,1.0,0.9999968044900333,0.7253968253823174,0.16666666666666666,0.19159259513594995,0.7663869854229796
In which year did Tim Frazier sign a multi-year deal with the Portland Trail Blazers after being named the 2015 NBA Development League's Most Valuable Player and Rookie of the Year?,"['Tim Frazier (born November 1, 1990) is an American professional basketball player for Ironi Nahariyah of the Israeli Leumit League. Frazier played high school basketball for Strake Jesuit College Preparatory and competed at the collegiate level with Penn State as a point guard. He earned various accolades with Penn State, including first-team All-Big Ten and All-Big Ten Defensive team honors, both as a junior in 2012. Frazier has played nine seasons in the NBA, with eight different franchises. Frazier was born on November 1, 1990, in Houston, Texas, to Billy and Janice. He started playing basketball when he was five years old.', 'He was considered to be a borderline first round prospect. In May, Frazier signed with Thad Foucher of Wasserman Media Group, thus ending his collegiate eligibility. On June 21, 2018, Frazier was drafted by the Orlando Magic with the 35th overall selection in the 2018 NBA draft. On July 6, 2018, the Magic announced that they had signed Frazier. On December 3, 2020, Frazier signed with the Oklahoma City Thunder, but was waived three days later. He joined the Oklahoma City Blue in 2021. On February 21, 2022, Frazier was traded to the Iowa Wolves in exchange for Robert Woodard II. On April 6, 2022, Frazier signed a two-way contract with the Oklahoma City Thunder. For the 2022–23 season, Frazier joined Raptors 905. On December 28, 2022, Frazier was later traded to the Westchester Knicks in exchange for Jeremiah Tilmon. On October 29, 2023, Frazier joined the Delaware Blue Coats. On June 18, 2024, Frazier signed with Al-Ahly Ly of the Libyan Division I Basketball League. = Regular season Playoffs = Career statistics from NBA.com · Basketball Reference Tulane Green Wave bio NBADraft.net profile\n\nIn the 2018–19 season, Melvin Frazier Jr. played for Orlando in 10 games.', ""On November 22, he had a 21-point, 14-assist effort in a 112–94 win over the Atlanta Hawks. On December 11, he had his first triple-double in the NBA with 14 points, a career-high 11 rebounds and 11 assists off the bench in a 120–119 overtime win over the Phoenix Suns. = On June 21, 2017, Frazier was traded to the Washington Wizards in exchange for the 52nd overall pick in the 2017 NBA draft. On January 27, 2018, he had a season-high 14 assists in a 129–104 win over the Atlanta Hawks. = On September 22, 2018, Frazier signed with the Milwaukee Bucks for training camp. He was waived by the Bucks on October 15. Two days later, he was claimed off waivers by the New Orleans Pelicans. On February 28, 2019, he was waived by the Pelicans. = On March 19, 2019, Frazier signed with the Milwaukee Bucks. On April 10, 2019, he scored a career-high 29 points to go with 13 assists in a 127–116 loss to the Oklahoma City Thunder. = On July 6, 2019, Frazier signed with the Detroit Pistons. On February 6, 2020, he was waived. = On January 4, 2021, Frazier signed a 10-day contract with the Memphis Grizzlies, making three appearances. On April 14, he signed a second 10-day contract, and on April 24, he signed for the rest of the season. = On December 21, 2021, Frazier signed a 10-day contract with the Orlando Magic. He signed a second 10-day contract with the team on December 31. = On February 25, 2022, Frazier signed a 10-day contract with the Cleveland Cavaliers. = On August 24, 2022, Frazier signed his first-ever contract overseas with the Greek club AEK Athens. = On February 21, 2023, Frazier signed a contract with the French club SIG Strasbourg. = On December 11, 2023, Frazier returned to Greece for Promitheas Patras. Only twelve days later, he mutually parted ways with the club due to a family matter overseas. = = Tim Frazier graduated in May 2013 with a 3.1 grade point average in supply chain and information systems at Smeal College of Business. Frazier added a second bachelor's degree in communication arts and sciences the following year. He later served as the basketball team's representative to the Penn State Student Athlete Advisory Board and was a member of the secret society Parmi Nous while at Penn State. In March 2023, Frazier had his first child. Career statistics from NBA.com · Basketball Reference NBA D-League profile Penn State Nittany Lions bio Archived December 21, 2015, at the Wayback Machine\n\nIn the 2014–15 season, Tim Frazier played for Philadelphia in 6 games. He averaged 5.7 points, 3.2 rebounds, 7.2 assists, 1.0 steals, and 0.0 blocks per game. He shot 0.302 from the field, .273 from 3-point range, and .333 from the free throw line, playing an average of 28.5 minutes per game. In the 2014–15 season, Tim Frazier played for Portland in 5 games. He averaged 4.6 points, 1.8 rebounds, 3.4 assists, 0.4 steals, and 0.0 blocks per game. He shot 0.444 from the field, .333 from 3-point range, and .833 from the free throw line, playing an average of 13.6 minutes per game. In the 2015–16 season, Tim Frazier played for Portland in 35 games. He averaged 1.5 points, 1.1 rebounds, 1.2 assists, 0.3 steals, and 0.0 blocks per game. He shot 0.333 from the field, .176 from 3-point range, and .533 from the free throw line, playing an average of 7.8 minutes per game. In the 2015–16 season, Tim Frazier played for New Orleans in 16 games. He averaged 13.1 points, 4.4 rebounds, 7.5 assists, 1.4 steals, and 0.1 blocks per game. He shot 0.45 from the field, .419 from 3-point range, and .763 from the free throw line, playing an average of 29.3 minutes per game. In the 2016–17 season, Tim Frazier played for New Orleans in 65 games. He averaged 7.1 points, 2.7 rebounds, 5.2 assists, 0.9 steals, and 0.1 blocks per game. He shot 0.403 from the field, .313 from 3-point range, and .760 from the free throw line, playing an average of 23.5 minutes per game. In the 2017–18 season, Tim Frazier played for Washington in 59 games. He averaged 3.0 points, 1.9 rebounds, 3.3 assists, 0.8 steals, and 0.1 blocks per game. He shot 0.395 from the field, .304 from 3-point range, and .767 from the free throw line, playing an average of 14.2 minutes per game. In the 2018–19 season, Tim Frazier played for New Orleans in 47 games. He averaged 5.0 points, 2.9 rebounds, 4.4 assists, 0.5 steals, and 0.1 blocks per game. He shot 0.451 from the field, .351 from 3-point range, and .780 from the free throw line, playing an average of 19.3 minutes per game. In the 2018–19 season, Tim Frazier played for Milwaukee in 12 games. He averaged 6.3 points, 2.6 rebounds, 3.5 assists, 0.4 steals, and 0.1 blocks per game. He shot 0.424 from the field, .417 from 3-point range, and .692 from the free throw line, playing an average of 17.6 minutes per game. In the 2019–20 season, Tim Frazier played for Detroit in 27 games. He averaged 3.6 points, 1.2 rebounds, 3.4 assists, 0.5 steals, and 0.1 blocks per game. He shot 0.362 from the field, .333 from 3-point range, and .792 from the free throw line, playing an average of 13.1 minutes per game. In the 2020–21 season, Tim Frazier played for Memphis in 5 games. He averaged 1.6 points, 1.6 rebounds, 3.2 assists, 0.4 steals, and 0.2 blocks per game. He shot 0.15 from the field, .000 from 3-point range, and .333 from the free throw line, playing an average of 12.4 minutes per game. In the 2021–22 season, Tim Frazier played for Orlando in 10 games. He averaged 3.7 points, 1.9 rebounds, 3.3 assists, 0.3 steals, and 0.1 blocks per game. He shot 0.302 from the field, .353 from 3-point range, and .556 from the free throw line, playing an average of 20.0 minutes per game. In the 2021–22 season, Tim Frazier played for Cleveland in 2 games. He averaged 1.0 points, 0.0 rebounds, 0.5 assists, 0.0 steals, and 0.0 blocks per game. He shot 0.5 from the field, — from 3-point range, and — from the free throw line, playing an average of 4.0 minutes per game. In the 2015 season, Tim Frazier played for Portland in 2 games. He averaged 0.0 points, 0.0 rebounds, 0.0 assists, 0.0 steals, and 0.0 blocks per game. He shot 0.0 from the field, — from 3-point range, and — from the free throw line, playing an average of 1.5 minutes per game. In the 2018 season, Tim Frazier played for Washington in 2 games. He averaged 0.0 points, 0.5 rebounds, 1.5 assists, 0.5 steals, and 0.0 blocks per game. He shot 0.0 from the field, — from 3-point range, and — from the free throw line, playing an average of 3.0 minutes per game. In the 2019 season, Tim Frazier played for Milwaukee in 11 games. He averaged 1.9 points, 0.8 rebounds, 0.9 assists, 0.1 steals, and 0.0 blocks per game. He shot 0.615 from the field, .500 from 3-point range, and 1.000 from the free throw line, playing an average of 3.6 minutes per game."", ""On January 5, 2015, he had a 39-point effort against the Los Angeles Lakers. On February 8, 2015, Lillard was selected as a replacement for the injured Blake Griffin in the 2015 NBA All-Star Game. On March 4, 2015, Lillard recorded a career-high 18 rebounds in a 98–93 win over the Los Angeles Clippers. The Trail Blazers finished the regular season as the fourth seed in the Western Conference with a 51–31 record. They faced the Memphis Grizzlies in the first round of the playoffs, where they lost in five games. Lillard shot 16 percent from three-point range during the series, hitting just 5-of-31 including going 0-of-6 in Game 1. 2015–16 season: Franchise player On July 9, 2015, Lillard signed a five-year, $120 million contract extension with the Trail Blazers. On October 28, 2015, Lillard recorded 21 points and 11 assists in a season-opening win over the New Orleans Pelicans. His one three-pointer made during the game was his 600th career three-point field goal, making him the fastest NBA player in history to reach the mark at 247 games. In addition, Lillard's 11 assists gave him 1,500 for his career, making him the fastest Trail Blazer to reach the milestone since Terry Porter (1987–88 season, 215 games). In the following game on October 30 against the Phoenix Suns, Lillard became the fastest player to reach 5,000 points and 1,500 assists (248 games) since Derrick Rose (240 games). On December 12, in a loss to the New York Knicks, Lillard became the first Blazer since Clyde Drexler in 1991–92 to record 600 points and 150 assists during the team's first 25 games. On December 21, Lillard missed the first game of his career with plantar fasciitis in his left foot, ending his streak of playing in 275 consecutive games. Backcourt partner C."", ""He played college basketball for the North Carolina Tar Heels and was selected in the first round of the 2019 NBA draft by the Portland Trail Blazers. Little played his freshman and sophomore seasons (2014–16) at Oakleaf High School then transferred to Orlando Christian Prep, where he played for the rest of his high school career. In his junior and senior season (2016–18), he led Orlando Christian Prep to back-to-back Florida state titles. Little stood out during the McDonald's All-American Game in 2018 as he posted 28 points and 5 rebounds, 1 assist and 1 steal, to lead the West past the East and claim the most valuable player (MVP) award. He also won MVP honors at the Jordan Brand Classic after putting up 24 points in 25 minutes. Thus he joined LeBron James as only the second player to win MVP honors at both high school All-American games. Little was ranked the second-best high school prospect of 2018 by the recruiting service Rivals. Little committed to play for North Carolina on October 4, 2017. He made his debut for the Tar Heels on November 6, 2018, recording 7 points, 3 assists, and 2 blocks during North Carolina's 78–67 victory over Wofford. Little scored a career-high 23 points to go along with 6 rebounds and 3 assists as North Carolina defeated Virginia Tech 103–82. At the conclusion of his freshman season, Little announced his decision to forgo his collegiate eligibility and declare for the 2019 NBA draft, where he was projected to be a first-round selection. = On June 20, 2019, the Portland Trail Blazers drafted Little with the 25th overall pick in the 2019 NBA draft. On July 1, 2019, Little officially signed with the Blazers. On February 1, 2021, Little scored a career-high 30 points to go along with 6 rebounds, 2 blocks, 1 assist and 1 steal. On January 27, 2022, Little suffered a left shoulder labral tear. Four days later, the Trail Blazers announced he would undergo surgery and would miss the rest of the season. On May 10, Little underwent abdominal surgery on his left side. On October 17, 2022, it was announced Little agreed on a four-year, $28 million contract extension with the Trail Blazers. In mid-April 2023, Little underwent abdominal surgery on his right side. = On September 27, 2023, Little, alongside Grayson Allen, Jusuf Nurkić, and Keon Johnson was traded to the Phoenix Suns as part of a three-team trade that sent Damian Lillard to the Milwaukee Bucks and Jrue Holiday, Toumani Camara, Deandre Ayton, and a 2029 first-round draft pick to the Portland Trail Blazers. On August 27, 2024, Little was waived by the Suns."", 'John\'s on November 29, 2013, posting 29 points. Over a week later, against Duquesne, Frazier recorded a career-high 13 assists, powering a 9-point victory for Penn State. His performance tied Dan Earl for the third-most assists in one game representing the Nittany Lions. Frazier completed his final season with Penn State by averaging 14.9 points, 4.5 rebounds, 5.4 assists, 1.6 steals, and 0.2 blocks per game. He started in all 34 games, averaging 35.2 minutes. Frazier was named to the Bob Cousy Award watch list, Third Team All-Big Ten, and the Barclays Center Classic all-tourney team. He was also a Senior CLASS Award finalist, and won the Big Ten Sportsmanship Award. = = Prior to the 2014 NBA draft, Frazier worked out for several NBA teams, including the Phoenix Suns, New York Knicks, Boston Celtics, Minnesota Timberwolves, Philadelphia 76ers and Washington Wizards. Philadelphia worked him out two times, and head coach Brett Brown invited him to play for them at the 2014 Las Vegas Summer League within an hour after he was not selected in the draft. The situation was compared to that of Khalif Wyatt, who played for the 76ers through the 2013 edition of the summer league, and attended Temple University in the Philadelphia area. Frazier said, ""When [the coaches] reached out to me and said they wanted me for the summer league, I was ready to go for it. I just want to go out, have fun, play my hardest and show Philly and other teams what they can get from me."". According to the 76ers assistant coach, Chad Iske, he impressed the team\'s staff by his ""poise"" and experience at the higher level. At Las Vegas, Frazier averaged 3.4 points, 4.0 rebounds, 2.0 assists and 1.2 steals in five games. On September 29, 2014, the Boston Celtics signed Frazier to a non-guaranteed training camp deal with the likely notion of auditioning with the Maine Red Claws in the future. On October 27, 2014, he was waived by the Celtics after appearing in four preseason games. As expected, four days later, he was acquired by the Maine Red Claws as an affiliate player. Frazier opened his season in the D-League by contributing 18 points, 9 assists, and 4 rebounds against the Oklahoma City Blue. He also shot 12-of-12 on free throws, helping the team win their first game. On January 30, 2015, Frazier recorded his second triple-double of the season with 13 points, 10 rebounds and 11 assists as he helped the Red Claws snap a three-game losing streak with a 104–92 win over the Canton Charge. On February 4, 2015, he was named to the Futures All-Star team for the 2015 NBA D-League All-Star Game. = On February 5, 2015, Frazier signed a 10-day contract with the Philadelphia 76ers. The following day, he made his NBA debut in the 76ers\' 96–107 loss to the Boston Celtics. In just under 35 minutes of action off the bench, he recorded a game-high 11 assists to go with 5 points, 5 rebounds and 2 steals. = Following the expiration of his 10-day contract, Frazier was not retained by the 76ers, and on February 16, 2015, he was reacquired by the Red Claws. = On February 20, 2015, Frazier signed a second 10-day contract with the 76ers. However, he was waived by the 76ers on February 24 after the team acquired Thomas Robinson. = Frazier returned once again to Maine on February 28, 2015. On March 5, he recorded his fourth triple-double of the season with 22 points, 13 rebounds, and 14 assists in the Red Claws\' 121–110 win over the Austin Spurs. = On March 30, 2015, Frazier signed a multi-year deal with the Portland Trail Blazers. On April 21, he was selected as both the 2015 NBA Development League\'s Most Valuable Player and Rookie of the Year after averaging 16.1 points, 7.1 rebounds and 9.5 assists in 41 games. In July 2015, Frazier joined the Portland Trail Blazers for the 2015 NBA Summer League and attended training camp with the team. He made the final roster for the 2015–16 season, and played in 15 of the team\'s first 29 games of the season. On December 21, he started in his first game for the Trail Blazers in place of the injured Damian Lillard. He subsequently played in all but 25 seconds of the team\'s 106–97 loss to the Atlanta Hawks, recording 12 points, 7 rebounds, 7 assists, 2 steals and 1 block. On February 18, 2016, he was waived by the Trail Blazers. = On February 27, Frazier was reacquired by the Maine Red Claws. The following day, in just his second game back for the Red Claws, Frazier recorded just the 10th triple-double in Red Claws history in a 132–111 win over the Sioux Falls Skyforce. In 32 minutes of action, he recorded 24 points, 12 rebounds, and 12 assists. = On March 16, 2016, Frazier signed a 10-day contract with the New Orleans Pelicans to help the team deal with numerous injuries. New Orleans had to use an NBA hardship exemption in order to sign him as he made their roster stand at 17, two over the allowed limited of 15. He made his debut for the Pelicans later that night, recording 14 points and 9 assists in 27 minutes off the bench in a 123–108 win over the Sacramento Kings. On March 20, he scored a season-high 17 points in a 109–105 win over the Los Angeles Clippers. He topped that mark four days later, scoring 18 points in a loss to the Indiana Pacers. On March 26, he signed with the Pelicans for the remainder of the season. On April 3, he had career highs with 19 points and 13 assists off the bench in a 106–87 win over the Brooklyn Nets. On April 11, he set a new career high with 20 points, along with 11 assists, in a 121–116 loss to the Chicago Bulls. In the Pelicans\' season finale on April 13, Frazier had a 15-assist game off the bench in a 144–109 loss to the Minnesota Timberwolves. On July 22, 2016, Frazier re-signed with the Pelicans. In the Pelicans\' season opener on October 26, 2016, Frazier recorded 15 points and 11 assists in a 107–102 loss to the Denver Nuggets. Two days later, he scored a career-high 21 points in a 122–114 loss to the Golden State Warriors.', 'Due to injury, he played in only 57 games in that season, the second-fewest games for a Rookie of the Year. He was the third Trail Blazer to win the award, the first two being Geoff Petrie and Sidney Wicks. 2007–08 season: First All-Star selection Roy started in the first 48 games of the 2007–08 season, averaging 19.1 points, 5.8 assists and 4.6 rebounds. He also led the Blazers to a 13-game winning streak in the month of December. Roy was selected as a reserve for the 2008 NBA All-Star Game. He scored 18 points in that game, and also had 9 rebounds. He injured his right ankle in the final game before the All-Star Weekend. Although he earned accolades for his play over the weekend, the injury impacted his play in the following weeks. He played in the Rookie Challenge for the second time, this time as a ""sophomore""; teammate LaMarcus Aldridge was also on the sophomore squad. Roy played about 29 minutes in the All-Star game, the most of any Western Conference player. He also tied Chris Paul and Amar\'e Stoudemire for the most points with 18. 2008–09 season: First All-NBA selection In the 2008 preseason, Roy underwent a 20-minute medical procedure in Vancouver, Washington, during which team physician Don Roberts removed a piece of cartilage that was causing irritation in Roy\'s left knee. Roy missed several weeks of action because of the rehabilitation, but was ready on the opening day of the season against the Los Angeles Lakers. On November 6, against the Houston Rockets, Roy hit a game-winning 30-foot jumper in overtime with eight tenths of a second left. On December 18, Roy scored a career-high 52 points against the Phoenix Suns. He made 14 of 27 shots from the field, 19 of 21 from the free-throw line, and 5 of 7 from the three-point line. He also added six assists, five rebounds and a blocked shot, all without a turnover. On January 24, Roy tied a Blazers franchise record with 10 steals against the Washington Wizards. On February 8 with the Blazers trailing by 1 against the Knicks, Roy made a layup at the buzzer to win it 109–108. As of February 16, 2009, Roy has had 24 shots which tied or won the games with 35 seconds or less. Roy was again selected as a reserve in the 2009 NBA All-Star Game, where he scored 14 points in 7-for-8 shooting, grabbed 5 boards, and dished out 5 assists in a game-high 31 minutes of action. On April 13, Roy was named Western Conference Player of the Week for his fourth time. At the time, Clyde Drexler was the only other Portland Trail Blazers to have won the award four times. Roy finished 9th in MVP voting for the 2008–09 season, garnering one 4th-place vote and four 5th-place votes for a total of 7 points. Roy was named to the All-NBA Second Team on May 13, and was the first Blazer to make an All-NBA team since the 1991–92 season. 2009–10 season: Second All-NBA selection On August 5, 2009, it was confirmed that Roy had agreed to a four-year maximum-salary contract with a fifth-year player option, keeping him a Trail Blazer until at least the 2013–14 season. Roy was selected to compete in the 2010 NBA All-Star Game, marking his third selection as an NBA All-Star. However, Roy was sidelined because of a right hamstring injury he sustained on January 13 against the Milwaukee Bucks, and re-aggravated on January 20 against the Philadelphia 76ers. On April 11, 2010, Roy injured his right knee. Magnetic resonance imaging that night confirmed a right knee bone contusion (bone bruise) and on April 12, further examination of the MRI showed a slight meniscus tear. Roy underwent surgery on April 16 and was expected to miss at least the first round of the 2010 NBA playoffs, but returned for Game 4 after eight days of recovery time to lead the Blazers to a win. Roy was named to the All-NBA Third Team on May 6, and this was his second season in a row to be named to an All-NBA Team. Shortly before the next season began, conference rival Kobe Bryant called Roy the hardest player to guard in the Western Conference, claiming he had ""no weaknesses in his game."" Roy was the cover athlete for NBA 10: The Inside. 2010–11 season: Final season in Portland Roy started the first month of the season scoring at his normal rate, but by December it started showing that his knees, which have bothered him since college and were injured in April, were ailing due to lack of cartilage. He missed nine games before the Trail Blazers announced that he would be out indefinitely. On January 17, 2011, Roy underwent arthroscopic surgery on both of his knees. He returned to the lineup on February 25, scoring 18 points off the bench, including a clutch three-pointer to force overtime, and helping the Blazers defeat the Denver Nuggets 107–106. The Blazers then faced the Dallas Mavericks in the first round of the 2011 NBA playoffs. Roy shot 1-for-8 the first 2 games, including a Game 2 where he saw only 8 minutes of playing time and went scoreless. The Blazers lost both games and trailed 2-0 in the series. He expressed his frustration about being the last substitution during the first 2 quarters, and playing for 8 minutes after getting 26 minutes in Game 1. Both the Blazers and Mavericks started Game 4 with a quiet first half, with Dallas leading slightly. The Blazers then missed their first 15 shots after halftime as the Mavs\' lead grew as big as 67–44. Roy then made a three-pointer near the end of the third to cut the lead to 67–49. In the fourth quarter, Roy scored 18 points after going 1-for-3 the previous 3 quarters, including a clutch 4-point play to tie the game and a bank shot from the middle of the paint with 49 seconds left to give his team the lead for good, finishing with 24 points to lead the Blazers to an improbable 84–82 win to tie the series. Just before NBA training camp opened following the resolution of the 2011 NBA lockout, Roy announced that his knees had degenerated so much—he lacked cartilage between the bones of both knees—that he was retiring from basketball. Following his announcement of retirement, the Portland Trail Blazers used their amnesty clause on Roy for salary cap flexibility. = In June 2012, Roy announced that he was planning to make a comeback to the NBA. He said he had recovered enough to play after having the platelet-rich plasma procedure that Kobe Bryant also had to keep his knees healthy. He could not play for Portland under the current NBA Collective Bargaining Agreement because of Portland\'s amnesty of him in 2011. Roy entered the free agent market on July 1, 2012. Roy reportedly had expressed interest in signing with the Dallas Mavericks, Golden State Warriors, Minnesota Timberwolves, Indiana Pacers, or Chicago Bulls. On July 31, 2012, Roy signed with the Minnesota Timberwolves. The deal put Roy with All-Star forward Kevin Love and point guard Ricky Rubio. He decided to wear No.', ""He completed his degree in professional sales from Weber State University in May 2015. = 2012–13 season: Rookie of the Year Lillard was selected with the sixth overall pick in the 2012 NBA draft by the Portland Trail Blazers. In the season opener against the Los Angeles Lakers on October 31, Lillard recorded 23 points and 11 assists to join Oscar Robertson and Allen Iverson as the only players in NBA history with at least 20 points and 10 assists in their NBA debut. In addition, his 11 assists were the most by an NBA rookie in his first game since Jason Kidd (11) in 1994, and the most ever by a Trail Blazer in his NBA debut. Lillard made a career-high 15 field goals and a Trail Blazer rookie-record seven 3-pointers on January 11 against the Golden State Warriors, where he finished with 37 points, six rebounds, and four assists. He became the first Trail Blazer to win an event at the NBA All-Star Weekend, winning the Skills Challenge. He also participated in the Rising Stars Challenge during All-Star weekend and finished with 18 points, three rebounds and five assists in a game-high 28 minutes. Lillard became the first NBA rookie to record 35 points, nine assists and zero turnovers in a game since turnovers became a stat in 1978–79 against the San Antonio Spurs on March 8. On April 10 against the Lakers, Lillard scored a season-high 38 points. He earned Western Conference Rookie of the Month honors for every month, becoming one of just eight players to sweep NBA Rookie of the Month honors since the inaugural award in 1981–82. He finished fifth in the NBA in 3-pointers made, 12th in points per game, tied for 16th in assists per game and tied for 23rd in free throw percentage. He was one of 10 NBA players to score 1,500 points, and he led all rookies in scoring (19.0 ppg), assists (6.5 apg), field goals (553) and free throws (271). With averages of 19.0 points, 3.1 rebounds, 6.5 assists, 0.90 steals, and 38.6 minutes in 82 games (all starting), Lillard not only claimed the NBA Rookie of the Year Award but joined Blake Griffin (2011), David Robinson (1990), and Ralph Sampson (1984) as the only unanimous winners. He also joined Oscar Robertson and Allen Iverson as the only rookies in NBA history to tally in excess of 1,500 points and 500 assists for a season. Lillard became the fourth Trail Blazer in franchise history to win NBA Rookie of the Year honors and one of two to ever finish a season with at least 1,500 points and 500 assists (the other being Clyde Drexler in 1986–87 and 1991–92). Among other distinctions, he broke the all-time NBA rookie record for 3-pointers in a season (185), surpassing Stephen Curry's 166 three-pointers in 2009–10; became the Portland franchise leader for most 3-point field goals in a season, breaking Damon Stoudamire's record of 181 in 2004–05; and became the first rookie to lead the NBA in total minutes played (3,167) since Elvin Hayes in 1968–69. 2013–14 season: First All-Star and All-NBA selection In the season opener on October 30, Lillard scored 32 points against the Phoenix Suns. He had a second 32-point effort on December 7 against the Dallas Mavericks."", ""Michael Frazier II (born March 8, 1994) is an American professional basketball player for Amman United of the Jordanian Premier Basketball League. He played college basketball for the Florida Gators. In the 2013–14 season, Frazier scored eleven three-pointers in a win against South Carolina, setting a school record. He also set a school record for made three-pointers in a season (118). His junior season was derailed significantly by a high-ankle sprain suffered in the game against Kentucky. On March 27, 2015, Frazier declared his eligibility for the 2015 NBA draft. = After going undrafted in the 2015 NBA draft, Frazier joined the Golden State Warriors for the 2015 NBA Summer League. On August 25, 2015, he signed with the Los Angeles Lakers. However, he was later waived by the Lakers on October 20 after appearing in four preseason games. On October 31, he was acquired by the Los Angeles D-Fenders of the NBA Development League as an affiliate player of the Lakers. On November 24, he made his professional debut in a 94–90 win over the Oklahoma City Blue, recording three points, two rebounds and one assist in four minutes. On January 16, 2016, Frazier was traded to the Iowa Energy in exchange for a 2016 second-round pick and the returning player rights to Kendrick Perry. Two days later, he made his debut for Iowa in a 98–94 loss to Raptors 905, recording one assist and one steal in nine minutes. On March 6, he was waived by Iowa. On March 10, 2016, Frazier was acquired by the Fort Wayne Mad Ants. The next day, he made his debut for Fort Wayne in a 106–99 loss to the Westchester Knicks, recording three points in 12 minutes off the bench. In July 2016, Frazier played for the Orlando Magic at the 2016 NBA Summer League. = On August 9, 2016, Frazier signed with Scaligera Basket Verona of the Italian Serie A2 Citroën. = On June 27, 2017, Frazier signed with German club MHP Riesen Ludwigsburg. However, on August 12, 2017, Ludwigsburg voided Frazier's contract after he suffered a potential career-ending quad injury. = In October 2018, Frazier joined the Rio Grande Valley Vipers of the NBA G League. In 45 games during the 2018–19 season, he averaged 16.9 points, 5.6 rebounds, 3.3 assists, and 1.5 steals. He was named the G League's Most Improved Player and helped the Vipers win the G League championship. In game three of the Finals series against the Long Island Nets, he scored 24 points with nine rebounds, six assists, two steals and a block in 45 minutes. = On April 6, 2019, Frazier signed with the Houston Rockets. He did not play for the Rockets to complete to the 2018–19 NBA season. Frazier was released by the Rockets on October 18, 2019, but was re-signed to a two-way contract two days later. He split the 2019–20 NBA season with the Rockets and Vipers. = In January 2021, Frazier joined the Delaware Blue Coats for the G League hub season. In August 2021, Frazier played for the Phoenix Suns at the 2021 NBA Summer League. = On October 15, 2021, Frazier signed with the Perth Wildcats in Australia for the 2021–22 NBL season. = On November 21, 2022, Frazier signed with the Illawarra Hawks in Australia for the rest of the 2022–23 NBL season. On January 6, 2023, he sustained a severe arm injury in a game against the Adelaide 36ers."", 'In 2015, he was named the NBA Most Improved Player. After six seasons in Chicago, he was traded to the Minnesota Timberwolves in June 2017, and was then again traded in November 2018, this time to the Philadelphia 76ers. In July 2019, he signed with the Miami Heat.']","Tim Frazier signed a multi-year deal with the Portland Trail Blazers on March 30, 2015, after being named the 2015 NBA Development League's Most Valuable Player and Rookie of the Year.",In 2015,,0.947542243353737,0.555555555537037,,0.6916016037641839,0.7664064150567358
